Text,Date,Favorites,Retweets,Tweet ID
"At today's press conference for H.R. 351, the Protecting Seniors' Access to Medicare Act, which would repeal #IPABpic.twitter.com/RFn1MrVU",2013-01-23 16:33:28,0,2,294120676867059712
VIDEO: My pro-life floor speech on the 40th anniversary of Roe v Wade. #Roe40 #prolifehttp://ow.ly/h2tbE ,2013-01-22 21:46:51,2,1,293837154738655233
Tomorrow I will reintroduce my #IPAB repeal bill. I sat down with @jenhab this morning to chat about the bill. http://ow.ly/h2lTn ,2013-01-22 20:41:49,0,0,293820786299510784
Please read my statement on the 40th anniversary of Roe vs. Wade http://ow.ly/h1UCc ,2013-01-22 17:10:25,0,1,293767587920240641
"As I mentioned in my weekly column, if Congress can't do our job, we shouldn't get paid. What do you think?http://ow.ly/gWeCD ",2013-01-18 19:02:49,0,2,292346321321472001
My weekly column in @thehill: Congress Must Pass a Budget http://ow.ly/gTJWk ,2013-01-17 15:58:04,0,2,291937442003574784
WCYB: Roe reacts to gun control speech http://ow.ly/gTA0S ,2013-01-17 14:51:12,0,1,291920613851951104
My statement on the administration’s gun control proposal:http://ow.ly/gRZqP ,2013-01-16 18:12:20,0,3,291608841538375680
@repkenmarchant Happy to have you on HELP! I look forward to working with you.,2013-01-16 15:05:14,0,0,291561759129608193
Seymour Herald: Roe Addresses Spending Cuts http://ow.ly/gRx7L ,2013-01-16 15:04:42,0,1,291561622282043393
Heading back to Washington this afternoon with lots of work to do. What issues do you hope to see Congress address over the next few weeks?,2013-01-14 18:50:32,0,2,290893678459908096
Who do you think the president should nominate as Labor Secretary? http://ow.ly/gHMid ,2013-01-10 17:59:44,0,2,289431342838587393
@tyjdunn You can call my Kingsport office at 423-247-8161 and talk with Sheila.,2013-01-10 01:38:47,1,1,289184479531106304
Great to chat with @FBillMcMorris with the @FreeBeacon about Labor Sec. Solis's resignationhttp://ow.ly/gGsVQ ,2013-01-10 01:28:46,0,1,289181957215109120
My Statement on Secretary Solis’s Resignationhttp://ow.ly/gGfpt ,2013-01-09 22:20:04,0,0,289134472274780163
"Washington Needs a Balanced Budget, Not More Blank Checks and Higher Taxeshttp://ow.ly/gGep4 ",2013-01-09 22:09:00,0,0,289131687894474752
PRESS RELEASE: Roe Joins @RepDianeBlack Other House Members to Introduce Title X Abortion Provider Prohibition Acthttp://ow.ly/gDBM1 ,2013-01-08 16:41:37,0,4,288686908991758337
Representing TN-01 has been a great honor and I look forward to serving in the 113th Congress. What issues are most important to you?,2013-01-04 15:18:42,0,0,287216491714191361
"@Dennis_Kucinich @cspan I know we don't always agree politically, but it has been an honor working with you. You will be missed.",2013-01-02 14:53:01,0,0,286485252082393088
"I voted no on H.R. 8. I could not, in good faith, support legislation that fails to address our spending problem. LINK:http://ow.ly/gteZ1 ",2013-01-02 04:17:38,5,20,286325351561437184
Sunday morning I will return to Washington to work on an agreement to avert the fiscal cliff. What do you think Congress should do?,2012-12-28 16:24:57,0,1,284696449298624513
"Last week, I went on Sirius XM radio to play bluegrass & Christmas carols. In case you missed it live, here's the cliphttp://ow.ly/glOyJ ",2012-12-25 23:47:38,0,0,283720689599512576
"Today, I'm thinking of those serving our country that can't be with their families. I thank you for your service. Merry Christmas to all!",2012-12-25 16:50:38,1,5,283615747811467265
What fiscal cliff proposals do you support? Which do you oppose?,2012-12-20 21:36:46,0,0,281875819322830849
Tune in to POTUS Sirius XM radio now. I'm playing music and chatting w Neda from Roll Call.pic.twitter.com/YBO2JrWn,2012-12-20 01:36:35,0,0,281573779090579458
My weekly column in @thehill: Looking Ahead to 2013 http://ow.ly/geQdw ,2012-12-19 21:15:35,0,2,281508098965921792
Can't wait. MT @Neda_Semnani so im hosting @POTUSShowdown tonight & special guest Phil Roe will be on for a little blue grass caroling (!!),2012-12-19 19:08:54,0,4,281476219088801792
Took a little break to practice guitar w Alex Large of my DC staff.pic.twitter.com/Cvb23OYD,2012-12-19 17:29:59,0,2,281451323512193024
Tomorrow I will be chairing a hearing on the challenges facing multiemployer pension plans.http://ow.ly/gcX60 ,2012-12-18 21:57:57,0,0,281156374468100096
"Today, I sent a letter to Speaker Boehner urging him to repeal the #IPAB as part of the Fiscal Cliff negotiationshttp://ow.ly/gaHfO ",2012-12-17 20:00:10,0,1,280764341647732736
"Staring Monday, my Washington D.C. office will be located at 407 Cannon, just down the hall from 419.",2012-12-15 14:36:39,0,2,279958151984455680
Speaker Boehner has ordered the flags over the Capitol to be lowered to honor the victims of today's tragedy.pic.twitter.com/c2PqH9al,2012-12-14 21:11:25,2,3,279695110487293952
"Sending thoughts and prayers to Newtown, CT during this tragic, horrific time. #PrayforNewtown",2012-12-14 18:07:28,0,2,279648817417170945
Always nice to have a friendly debate with @Lawrence on @TheLastWordhttp://ow.ly/g6z9x ,2012-12-14 16:03:33,0,0,279617634071347200
Just 30 minutes until our telephone town hall begins. I look forward to answering your questions.,2012-12-13 21:54:43,0,0,279343621273178112
Moving to a new DC office. Thanks to my friend @RepGusBilirakis and his team for the warm welcome! http://ow.ly/i/1f6Av ,2012-12-13 16:13:06,0,1,279257650091421698
REMINDER: I will be holding a telephone town hall from 5:30 p.m. to 6:30 p.m. this afternoon. http://ow.ly/g4tpF ,2012-12-13 15:02:34,0,0,279239897951387649
Read my opinion piece in @thehill: Affordable Care Act proving unaffordable for states http://ow.ly/g3eWw  #hcr #tn,2012-12-12 20:59:41,0,2,278967379944419329
Tomorrow I am hosting a telephone town hall. I hope you will join me! http://mobi.tricities.com/tricities/pm_5621/contentdetail.htm?contentguid=YdJ81nQY …,2012-12-12 16:12:21,0,0,278895073037529088
@nguyen_lin you can email your request to my communications director at Tiffany.McGuffee@mail.house.gov,2012-12-11 17:45:12,0,0,278556050590941186
Please take a moment to read my interview with WATE. I stand with @BillHaslam and I am proud of his decision. http://ow.ly/g0qiO ,2012-12-11 15:24:32,0,0,278520649562066945
Tonight I'll be on WATE and WJHL to discuss the state-ran health insurance exchange decision. Tune in!,2012-12-10 22:01:02,0,1,278258046021554176
@repandrewfarmer Thanks for tweeting that!,2012-12-10 21:56:52,0,0,278256998049533952
Read my statement on Tennessee’s Decision Not to Set Up Health Insurance Exchangehttp://ow.ly/fYZKK ,2012-12-10 20:36:42,1,9,278236822751047681
This Thursday at 5:30 p.m. I will hold a telephone town hall. What questions would you like to hear me to answer?,2012-12-10 15:56:28,0,0,278166300356902913
"Do you receive my enewsletter updates? If not, please visit my website to sign up. http://ow.ly/fUSFM ",2012-12-07 18:31:26,0,0,277118134605971457
Great to chat with Andy Dean last week on @americanowradiohttp://ow.ly/fUpDx ,2012-12-07 15:16:39,2,1,277069115842260992
"If the President Expects Compromise, He Must Set the Table for Negotiationhttp://ow.ly/fQvct ",2012-12-05 15:25:03,0,0,276346455420190720
"Tonight the Capitol Christmas tree was lit. This tradition dates back to 1964, and this year's tree is from CO. http://ow.ly/i/1cJeS ",2012-12-04 22:55:11,0,0,276097347136671744
@nomalariahc Thanks for coming in!,2012-12-04 18:44:21,1,0,276034219405369345
VIDEO: My statement on the House floor this afternoon in support of H.R. 6582.http://ow.ly/fOU11 ,2012-12-04 18:37:04,1,0,276032390047072256
"Kaiser Health News: Roe, Gingrey To Lead GOP Doctors Caucushttp://ow.ly/fOllj ",2012-12-04 14:55:03,0,1,275976515659894784
SURVEY: Do you think the President's proposed tax increase will be enough to avert the fiscal cliff? http://ow.ly/fMBCO ,2012-12-03 18:09:25,0,0,275663042891632641
Always a pleasure to join the @DrCarolShow. Check out our segment on health care from Saturday afternoon: http://ow.ly/fM5B4  #hcr,2012-12-03 15:05:43,0,1,275616810680852480
"'Fiscal Cliff,' STEM Act Discussed By Rep. Roe http://ow.ly/fJMtV ",2012-12-01 14:58:39,0,0,274890257554616320
"Today, I was chosen to be a co-chair of the GOP Doctors Caucus for the 113th Congress http://ow.ly/fJ4o0 ",2012-11-30 21:33:34,0,1,274627252745015296
RT @GOPWhip 15 miles away from POTUS speech today we’re not hearing the same story about tax hikes VIDEO: http://kom.io/YcKmDr  #FiscalCliff,2012-11-30 16:38:15,0,0,274552935885713409
Fired-up congressional panel vows strict VA oversighthttp://ow.ly/fGgKH ,2012-11-29 15:48:12,0,1,274177950776164352
My weekly column: Tax Increases Alone Won’t Avert Fiscal Cliffhttp://ow.ly/fEQck ,2012-11-28 20:46:54,0,0,273890734904594432
Politico: Back to the drawing board for Obamacare foes http://ow.ly/fAGDu ,2012-11-26 20:54:17,0,0,273167815740125185
Happy Thanksgiving! What are you thankful for today?,2012-11-22 15:43:32,0,1,271640064696672256
Please take a moment read my Thanksgiving column http://ow.ly/ftgi1  #Thanksgiving,2012-11-21 15:09:16,0,1,271269053614657536
Spent this morning visiting with my granddaughter Katherine and her fellow 4th graders in their Government class http://ow.ly/i/19gxv ,2012-11-20 15:32:47,0,0,270912580300730371
Knoxville News Sentinel Editorial: Feds should review pseudoephedrine database usage http://ow.ly/fp5eP ,2012-11-19 14:46:49,0,0,270538625702322176
@sprnov Thank you for your response! I agree our country's debt is a serious problem that must be addressed.,2012-11-14 18:15:03,0,1,268779092386668544
@jbcole1 Thank you for your response!,2012-11-14 17:48:43,0,1,268772462991392768
Back in DC this week & there's a lot of work to do to get our country back on track. What issues are important to you? http://ow.ly/fhASI ,2012-11-14 15:04:34,0,0,268731155791106048
My Veteran's Day piece in @thehill: Ensuring all our veterans have access to best available healthcarehttp://ow.ly/fdKdL ,2012-11-12 16:23:27,0,0,268026228966055936
It's almost Veterans Day. I am so grateful for our veterans! Do you have a veteran in your life you'd like to thank? http://ow.ly/f9Z5x ,2012-11-09 16:19:02,0,0,266937954847559681
Roe Statement on Repeal of the IPAB http://ow.ly/f8EdV ,2012-11-08 21:34:14,0,1,266654888052789249
I agree with @SpeakerBoehner. It's time for Republicans and Democrats to put politics aside and find a path forward.http://ow.ly/f81Af ,2012-11-08 16:16:10,0,2,266574846077571072
@leecountyida Thanks for having me!,2012-11-03 15:14:26,0,0,264747368698753024
Great to chat with Dave Hogan and the crew at WJCW this morning about the issues facing our country. http://ow.ly/i/15miJ ,2012-11-02 12:06:44,0,1,264337744409542656
@rwbuchanan Thank you for having me! It was great to be there.,2012-11-01 19:08:06,0,0,264081399886274561
@hays_13 It was great to be there!,2012-11-01 19:07:50,1,0,264081330986418176
Today @repjohnkline @KristiNoem & I asked the GAO to evaluate the impact of new school lunch requirements. @EdWorkforcehttp://ow.ly/eV1ST ,2012-10-31 17:16:28,0,0,263690915347058688
Had a great time visiting with Boone's Creek Elementary School during their mock debate! http://ow.ly/i/14J05 ,2012-10-30 19:25:54,0,1,263361102442819585
"Pam & I are praying for those affected by Sandy. Times like these are a reminder that despite our differences, the American spirit is strong",2012-10-30 18:33:50,0,1,263347999336443904
Seymour Herald: Area Congressman Urges Healthcare Reform http://ow.ly/eT7Rp ,2012-10-30 17:38:58,0,0,263334191989653506
Blizzard & winter storm warnings posted for parts of TN01. Be sure to follow this storm & take the proper precautions. http://ow.ly/ePDGv ,2012-10-28 22:09:24,0,3,262677470954790913
Good to chat with @FBillMcMorris about the Delphi pensions issue. We must get to the bottom of this.http://ow.ly/eNfuI ,2012-10-26 14:46:42,0,2,261841286229786624
"Do you receive my email updates from Washington? If not, please visit my website to sign up. http://ow.ly/eNdlP ",2012-10-26 14:33:12,0,1,261837889049096193
The Hill: New healthcare challenges coming in 2013http://ow.ly/eM0if ,2012-10-25 20:08:57,0,0,261559997647966208
This Week's Column: New Health Care Challenges Coming With New Yearhttp://ow.ly/eLiZD ,2012-10-25 14:22:43,0,2,261472865138917376
. @GOPLeader's new report underscores the importance of reining in the #NLRB and repealing the #IPAB http://ow.ly/eJQX7 ,2012-10-24 17:44:50,0,1,261161342852022272
"The Hill: GOP sees food fight as kids trash USDA fruit, vegetable guidelineshttp://ow.ly/eEaaI ",2012-10-21 19:43:35,0,4,260104061536313344
"Today, I joined @repjohnkline and @KristiNoem to urge Ag Secretary Vilsack to revisit the new school lunch requirementshttp://ow.ly/eAooZ ",2012-10-18 18:14:13,0,0,258994408119214083
Seymour Herald: Roe Honored as Friend of Farmers http://ow.ly/eA6ey  @TNFarmBureau,2012-10-18 15:49:01,0,0,258957866151596032
Farm Bureau Honors Roe with National Award |http://ow.ly/ey7hj ,2012-10-17 15:13:03,0,1,258586427661635586
@tnfarmbureau I am honored to be named a Friend of Farm Bureau!,2012-10-16 19:51:14,0,0,258294048211742721
Great piece on #IPAB from the American Medical News: Medicare IPAB: Rational or rationing? What do you think? http://ow.ly/etWd6 ,2012-10-15 14:09:43,0,0,257845712962875393
SURVEY: Do you believe Congress should adopt a plan to avert the fiscal cliff? http://ow.ly/eqwcE ,2012-10-12 14:22:43,0,1,256761824270229504
President Praises September Jobs Report While Impending Fiscal Cliff Threatens Economic Growthhttp://ow.ly/emOrb ,2012-10-10 14:48:42,0,4,256043583893827584
It was great to drive in the Tractor Parade on Saturday. I most enjoyed hearing what was on the minds of constituents. http://ow.ly/i/10wQA ,2012-10-09 19:33:12,0,0,255752795188240384
WATE: TVA natural gas plant dedicated in Hawkins Countyhttp://ow.ly/egQCt ,2012-10-06 14:09:58,0,4,254584286181744640
Kingsport Times News: Roe urges technology to make coal competitive http://ow.ly/egsQG ,2012-10-06 00:14:34,0,2,254374051588497409
"I remain concerned that the #IPAB could function as a denial-of-care board, and I will continue to fight for a repeal.http://ow.ly/edYnw ",2012-10-04 17:09:07,3,8,253904596207022080
Calorie Count Imposed on School Lunches: New Federal Law Causes Local Concerns in Seymour http://ow.ly/ecQ0N ,2012-10-04 02:45:16,1,1,253687199890022400
Looking forward to @TVA_Newsroom's John Sevier natural gas-fired plant dedication. We must keep electricity affordable for the TN Valley.,2012-10-03 17:32:30,0,4,253548093251911680
Do you believe the new school lunch standards are overly restrictive? Please take a moment to answer this week's survey http://ow.ly/e45B9 ,2012-09-28 14:01:12,1,0,251682975610175489
Good chatting with @mboyle1 over at the @dailycaller about the Delphi pensions issue.http://ow.ly/e34p3 ,2012-09-27 20:47:21,0,6,251422799665713153
"My column in @thehill: School lunches should be filled with nutrition, not red tapehttp://ow.ly/e0QoS ",2012-09-26 17:18:58,1,0,251007972224954370
"Check out my weekly column: School Lunches Should Be Filled with Nutrition, Not Red Tape. What do you think?http://ow.ly/e0qWb ",2012-09-26 14:21:22,0,2,250963278765899776
Thanks to everyone that came out for our 3rd annual Military Service Academy Day! http://ow.ly/i/XGp7 ,2012-09-24 14:42:56,0,0,250243928660520960
"Proud to be a cosponsor of @repjimcooper's bipartisan No Budget, No Pay Act. http://ow.ly/dVrLT ",2012-09-23 18:31:38,0,6,249939092975001600
"Today, I formally expressed disapproval of the Administration’s attempt to waive the work requirement for welfare.http://ow.ly/dSa9Z ",2012-09-20 21:17:49,2,6,248893752406585345
Our panel from yesterday's Invisible Wounds Caucus briefing to discuss military and veterans suicide prevention. http://ow.ly/i/X24A ,2012-09-20 14:01:31,1,3,248783952112939009
"Today, H.R. 5948 passed by voice vote. The Veterans’ Affairs Employee Accountability Act was included as a provision.  http://ow.ly/dQisJ ",2012-09-19 21:02:29,0,0,248527507647782912
Took a quick break in August to celebrate my mother's 90th. Our family is so blessed to celebrate four generations! http://ow.ly/i/WQK5 ,2012-09-19 15:33:35,0,1,248444733565853697
I was honored to attend the ribbon cutting for the VA Community Based Outpatient Clinic in Sevier County today. http://ow.ly/dObSH ,2012-09-18 19:02:15,0,1,248134860269551616
"This Saturday, September 22, my office will hold our 3rd annual Military Service Academy Day. More information: http://ow.ly/dNKcF ",2012-09-18 15:24:05,0,0,248079955311861762
Always great to go on the @DrCarolShow. Check out Saturday's segment. http://ow.ly/dMq0D ,2012-09-17 20:21:10,0,1,247792331611324418
Good catching up with @RepPaulRyan and @repaaronschock yesterday during votes. http://ow.ly/i/W0u4 ,2012-09-14 14:42:20,0,1,246619900347572224
Roe honored by national business group http://ow.ly/dIgCA ,2012-09-14 13:44:17,0,1,246605290370387969
"Today, I proudly accepted the “Guardian of Small Business Award” from the National Federation of Independent Business. http://ow.ly/i/VQV0 ",2012-09-13 18:40:40,0,3,246317487531106304
"Last evening, I spoke to members of the National Coalition for Literacy at their 2012 Literacy Leadership Awards. http://ow.ly/i/VNVk ",2012-09-13 15:07:33,0,0,246263858833010689
House Bill Protects GI Bill for the Futurehttp://ow.ly/dGtUG ,2012-09-13 13:58:47,1,1,246246551666688000
"Deficit Day sounds alarm on 'tax, borrow and spend'. Check out this week's column in @thehillhttp://ow.ly/dFdlS ",2012-09-12 18:25:50,0,1,245951367426998272
Observance of 9/11 includes a Miracle for Tennessee's Washington delegation. Moving @knoxnews piece by @jgregjohnson http://ow.ly/dECyM ,2012-09-12 13:53:35,0,0,245882852774903808
"Today, I attended a ceremony on the Capitol steps to pay tribute to the Americans whose lives were taken on 9-11. http://ow.ly/i/VrcK ",2012-09-11 17:33:57,0,4,245575924450480128
We will never forget. http://ow.ly/dCLjK ,2012-09-11 13:37:18,0,1,245516371100844033
"This Wed, @virginiafoxx and I will hold a joint hearing examining the NLRB’s efforts to encroach postsecondary schools.http://ow.ly/dAYz5 ",2012-09-10 14:33:10,0,1,245168039098736640
Knoxville News Sentinel (Blog): Lousy Reports Make Job Easy for White House http://ow.ly/dzfmS ,2012-09-08 21:30:12,0,0,244548214462754816
August marked the 43rd month in a row that unemployment has been above 8 percent. This is unacceptable.http://ow.ly/dycqZ ,2012-09-07 19:02:55,0,1,244148759909511168
I hope you can join me for the 3rd Annual Military Service Academy Day!http://ow.ly/dwnci ,2012-09-06 18:58:09,0,0,243785173227950080
House panel probing stimulus cash for MSNBC ads http://ow.ly/dnAlG ,2012-08-31 16:39:27,0,2,241575943720808448
Are you interested in attending one of the Military Service Academies? Join us for this year's 3rd annual Academy Day! http://ow.ly/i/Tr5d ,2012-08-30 19:32:15,0,0,241257039416946688
Have you read weekly column in @thehill? Labor Day forecast bleak for unemployedhttp://ow.ly/dk8uk ,2012-08-29 18:06:52,0,1,240873166593998849
Labor Day Forecast Bleak for Unemployedhttp://ow.ly/djWAF ,2012-08-29 16:28:02,0,0,240848294648115202
Need assistance but can't make it to one of my offices? My staff travels to bring our services to a location near you. http://ow.ly/djQnq ,2012-08-29 15:47:28,0,1,240838084567121920
"Today, I wrote the CBO and asked the agency to further examine possible Medicare cuts resulting from the IPAB.  http://ow.ly/difwN ",2012-08-28 17:24:16,1,0,240500058116739075
Great article in the Seymour Herald: Roe Promotes Local Business http://ow.ly/di0hU ,2012-08-28 15:28:58,0,0,240471042487902208
It's always a pleasure to chat with Brett Rappaport on The Final Say radio show. Check out our latest segment.http://goo.gl/t9m5S ,2012-08-24 22:09:55,0,1,239122392289525760
Tonight I will be holding a town hall meeting from 5:30-6:30 p.m. in Erwin at City Hall. Hope to see you there!http://goo.gl/WBFyH ,2012-08-23 14:05:12,0,2,238638019698098176
The Mountain Press: Roe meets with constituents at town hall meeting http://goo.gl/V4HlC ,2012-08-23 14:03:49,0,0,238637672376184833
Seymour Herald: Roe Pushes Energy Policy: States Domestic Production Will Benefit Economy... http://fb.me/1VK8Z7zUw ,2012-08-21 13:32:52,0,0,237905109886050305
"I posted 4 photos on Facebook in the album ""August District Work Period"" http://fb.me/NTm4rppM ",2012-08-20 17:55:26,0,0,237608798209052672
"Tonight, I am holding a town hall meeting from 6-7 p.m. at City Hall in Gatlinburg. For more information, please...http://fb.me/2a4bLpgjP ",2012-08-20 13:39:30,0,2,237544388375502848
This week's column in The Hill: Domestic Energy Production Can Pave Road to Lower Unemployment...http://fb.me/G6gfuLQY ,2012-08-15 14:30:17,0,0,235745229217611776
"This Thursday, I will hold a town hall meeting from 5-6 p.m. at the Courthouse in Elizabethton. For more...http://fb.me/1ME0p9oL0 ",2012-08-13 20:26:39,0,1,235110135117258753
"I posted 4 photos on Facebook in the album ""August District Work Period"" http://fb.me/1HG5bpCap ",2012-08-08 18:57:19,0,0,233275715561340928
"TONIGHT: Can't make it to one of my in-person town halls this August? As your Congressman, I'd still like to hear...http://fb.me/1XQE6GTgh ",2012-08-07 17:36:26,0,0,232892972952342529
Bristol Herald Courier: Roe tours Bristol packaging facility... http://fb.me/QrTVE5xY ,2012-08-07 16:23:43,0,0,232874674407747585
"During the month of August, I will be holding town hall meetings, as well as visiting with several constituent... http://fb.me/2lFmSMSqF ",2012-08-06 17:01:54,0,0,232521896036544512
"Greeneville Sun: Roe Has Full Calendar Through Nov., Beyond... http://fb.me/1TwAnyzBz ",2012-08-06 14:27:29,0,0,232483035541565441
"Today, I voted for the Pathway to Job Creation through a Simpler, Fairer Tax Code Act, which will provide a clear...http://fb.me/Lw5ySstG ",2012-08-02 20:22:27,0,0,231122812570587136
The Hill: Congress still has work to do...http://fb.me/2i51NL2XO ,2012-08-01 18:54:48,0,1,230738369930477569
My weekly column: Congress Still Has Work to Do http://roe.house.gov/News/DocumentSingle.aspx?DocumentID=305366 …http://fb.me/1QJJvFuHE ,2012-08-01 15:43:00,0,0,230690099875164160
Seymour Herald: Sevier Rep. Pushes for Audit http://seymourherald.com/blog/2012/07/30/sevier-rep-pushes-for-audit/ … http://fb.me/1Kxy05W26 ,2012-07-31 20:07:18,1,0,230394226586841088
"NEXT Tuesday, August 7, I will hold a telephone town hall meeting from 6-7 p.m. I will be dialing in from...http://fb.me/X9IVdU62 ",2012-07-31 18:57:15,0,0,230376596069044224
"Bristol Herald Courier: Congressmen Roe, Griffith win awards from U.S. Chamber for support of business... http://fb.me/1arlnLkH3 ",2012-07-31 13:55:06,0,0,230300557431144448
Knoxville News Sentinel: George Korda: Roe v. Obamacare http://www.knoxnews.com/news/2012/jul/30/073012webkorda/ … http://fb.me/1ApgBrIUU ,2012-07-30 15:17:12,0,0,229958829536858112
Do you believe the Federal Reserve should be audited?... http://fb.me/1niNguSMN ,2012-07-27 14:15:27,0,0,228856129298513920
USA TODAY: Plenty of alternatives to government health care... http://fb.me/1WMDkOGgX ,2012-07-26 13:34:51,0,0,228483522111877120
THE HILL: Taxpayers deserve audit of Federal Reserve...http://fb.me/1agohJALC ,2012-07-25 19:37:33,1,0,228212413391044609
My weekly column: Taxpayers Deserve Audit of Federal Reserve...http://fb.me/1ITGUbP3Y ,2012-07-25 19:17:47,0,0,228207435855310848
"Today, I voted in support of legislation to allow the Government Accountability Office - Congress’ investigative...http://fb.me/286UM5IVt ",2012-07-25 18:56:37,0,0,228202109584146432
"On Tuesday, August 7th, I will hold a telephone town hall from 5-6 p.m. ET. To participate in the tele-town hall,... http://fb.me/19CgNehsp ",2012-07-24 16:34:56,0,0,227804064925224961
"Do you receive my weekly enewsletters? If not, I encourage you to read my latest newsletter and take the survey to... http://fb.me/C4zJ4Ub9 ",2012-07-20 14:20:28,0,0,226320675172929537
The Tennessean: TN congressmen say missing word in health law may give states an out... http://fb.me/1dnzu5Vk1 ,2012-07-20 14:08:38,0,0,226317699184197632
"Today, I was proud to vote in support of H.R. 5872, the Sequestration Transparency Act. This legislation would... http://fb.me/2cjW9a6zG ",2012-07-18 18:46:48,0,1,225662923333312512
THE HILL: Defense cuts must be addressed... http://fb.me/1xbMkT9Y7 ,2012-07-18 16:01:19,0,0,225621281075245056
Please take a moment to visit my website and read my weekly column. Defense Cuts Must Be Addressed |... http://fb.me/1UyGjlmYj ,2012-07-18 15:28:57,0,0,225613132322705408
"I am on the cover of the July edition of TriCities Business Journal. In the interview, I talk about the... http://fb.me/27FibY48A ",2012-07-17 20:08:54,0,0,225321199687827457
"Bristol Herald Courier: Tough year to get things done in Washington, Congressman Roe says... http://fb.me/1zt2ndXUA ",2012-07-17 13:40:56,0,0,225223563664293888
"Last week, I spoke to students from ETSU's Upward Bound summer 2012 program on the steps of the Capitol. http://fb.me/2h6soSTix ",2012-07-16 21:00:04,0,0,224971686854934529
TONIGHT: Please join me in Bluff City for a town hall meeting. Hope to see you there!... http://fb.me/1ED6VCycU ,2012-07-16 17:34:55,0,1,224920060236546049
Modern Healthcare: The Washington Heat is on Medicare's IPAB... http://fb.me/1vZDWxH35 ,2012-07-16 14:03:37,0,0,224866881696309248
Kingsport Times News: Roe Defends Health Care Repeal Vote... http://fb.me/OdNNYWsm ,2012-07-16 13:57:20,0,0,224865302905753600
