Text,Date,Favorites,Retweets,Tweet ID
It was great to spend time with my family over Thanksgiving. Here are the Roe granddaughters oldest to youngest. I’m thankful to be their Pop! #tbtpic.twitter.com/5N8dmBK9B5,2017-11-30 16:03:56,20,3,936264543285796864
"This week, Congress returned to Washington with a full to-do list after Thanksgiving. While there is a lot on our plate, I’m confident we can work together to get the results the American people deserve. Read more on what is on Congress’ agenda this month:https://roe.house.gov/news/documentsingle.aspx?DocumentID=398256 …",2017-11-29 23:16:53,2,3,936011108535685121
"Yesterday marked the 1 year anniversary of the Sevier County wildfires. I'm grateful for the fire fighters & first responders who worked through the night to evacuate residents to safety, & my thoughts & prayers continue to be with Sevier Countians as they rebuild. #SmokiesStrong",2017-11-29 21:14:52,8,3,935980403793580032
"Wishing you and your family a very happy Thanksgiving! As Americans, we have so much to be grateful for. This Thanksgiving, I am thankful for the many blessings from our Creator, my loving family and the opportunity to represent you in Congress.pic.twitter.com/p2hJKbBvMy",2017-11-23 14:00:03,50,12,933696649150349312
"Thank you for having me, @RepFrenchHill!https://twitter.com/repfrenchhill/status/932722006541422594 …",2017-11-21 16:51:08,8,2,933014929204006912
"Thank you for having me, @HerreraBeutler! It was great to be there.https://twitter.com/HerreraBeutler/status/932679249672187913 …",2017-11-20 20:10:50,5,2,932702797748895750
"Today is National Adoption Day, a day to raise awareness of the almost 110,000 foster children in need of a family & to celebrate the families across the nation who welcome children into their homes. Read more about National Adoption Day at http://nationaladoptionday.org .pic.twitter.com/JGUc2zRfUH",2017-11-18 14:00:01,48,37,931884701396164611
"ICYMI: Yesterday the House passed the Tax Cuts and Jobs Act, a huge win for the First District. Read more from @JCPress:http://www.johnsoncitypress.com/Government/2017/11/16/Q-A-with-Roe-on-tax-overhaul.html?ci=stream&lp=9&p=1 …",2017-11-17 19:23:46,6,4,931603791182467077
It was a privilege to be there with you to hear other veterans’ stories. Thank you for having me @cathymcmorris!https://twitter.com/cathymcmorris/status/931593692288184320 …,2017-11-17 19:02:44,11,3,931598495135432709
"The Tax Cuts & Jobs Act passed the House today which is another huge step in delivering real and meaningful tax relief to East Tennessee families.
https://roe.house.gov/news/documentsingle.aspx?DocumentID=398254 …pic.twitter.com/VD1puKMc61",2017-11-16 19:33:50,12,4,931243933321097218
"Under the Tax Cuts and Jobs Act, the vast majority of individuals & families would be able to file their taxes on a form as simple as a postcard. Read more here: https://roe.house.gov/news/documentsingle.aspx?DocumentID=398253 …pic.twitter.com/vsbv8G4ZPj",2017-11-15 22:54:18,107,34,930931998327222272
"Our servicemembers deserve the best & safest medical treatments available, especially when they are in harm’s way. Thank you @repgregwalden for your leadership on this important issue.https://youtu.be/QdezYrDETlE ",2017-11-15 21:38:54,4,4,930913023363026945
This week is #ApprenticeshipWeek2017. A one-size-fits-all approach does not work for everyone when it comes to education and workforce training. That’s why I’m proud to support work-based learning and apprenticeships to encourage an efficient & effective labor market.,2017-11-14 19:16:24,4,6,930514772004655104
"Did you know the Tax Cuts and Jobs Act retains the child and dependent care tax credit, as well as the adoption tax credit? Reforming the tax code means helping middle-class families and rewarding success.pic.twitter.com/r9GTBH37rY",2017-11-13 22:26:44,3,1,930200282360893440
November is #NationalHealthySkinMonth. It’s important to take care of the largest organ in the human body: your skin. Keep your skin healthy by regularly seeing a board-certified dermatologist near you. Learn more: https://www.aad.org/ ,2017-11-13 17:01:51,6,1,930118522650415104
"This Veterans Day, take a moment to remember the sacrifice it takes to keep this great country safe and free. We salute our nation’s heroes today and every day, and are forever thankful for your service.pic.twitter.com/yaZMUx9ooR",2017-11-11 14:30:01,45,18,929355538483302402
The real winners of #taxreform are the middle class. See how in the Tax Cuts & Jobs Act → https://fairandsimple.gop/  #1182morepic.twitter.com/xAIO2Gs9af,2017-11-09 16:57:07,37,21,928667782329270272
It’s an incredible honor to be here tonight. Tune in.https://twitter.com/gotyoursix/status/928412591348645888 …,2017-11-09 00:12:13,5,3,928414890687127552
Veterans Day is a powerful reminder of how our nation’s liberty has been secured and preserved by the members of our Armed Forces since the founding of our great nation. Read more on this week’s column here: https://roe.house.gov/news/documentsingle.aspx?DocumentID=398251 …pic.twitter.com/eaEIlb6NVl,2017-11-08 21:42:29,13,4,928377209127043073
"Today, I spoke on the House floor in support of #HR3441, legislation to provide clarity and stability to job creators. VIDEO:https://youtu.be/dQNx0wevaqU ",2017-11-07 23:11:06,5,3,928037123030208512
Thank you for joining us this morning! Great to have you there.https://twitter.com/Surgeon_General/status/927911691144384512 …,2017-11-07 14:57:10,3,0,927912818514554880
Tax reform will help Tennessee families by allowing you to keep more of your hard-earned pay and bringing good-paying jobs to our state.pic.twitter.com/cW9Qv1QqhP,2017-11-06 20:26:56,8,2,927633420120940544
"During National #HospiceMonth, take a moment to learn about your caregiving options & plan ahead. #hpmpic.twitter.com/vpwYSihFvH",2017-11-03 19:12:13,9,5,926527452154822661
My statement on passage of the Championing Health Kids Act:https://roe.house.gov/news/documentsingle.aspx?DocumentID=398247 …,2017-11-03 17:05:01,2,1,926495440782200832
Very proud my bipartisan bill to repeal the #IPAB passed the House on a 307 to 111 vote today:https://roe.house.gov/news/documentsingle.aspx?DocumentID=398246 …,2017-11-02 21:56:42,7,2,926206460132028416
"Today, I spoke on the House floor in support of my bipartisan bill to repeal the #IPAB. 
WATCH:https://www.youtube.com/watch?v=KHB8SNhQc1U&feature=youtu.be …",2017-11-02 20:31:16,4,1,926184956858195968
"#IPABRepeal has the support of 271 bipartisan House members, nearly 800 coalition groups from all 50 states. The time to act is now.",2017-11-02 17:57:16,4,3,926146204064534528
"We cannot afford to let 15 unelected, unaccountable bureaucrats make decisions for our nation’s Medicare beneficiaries. #IPABRepeal",2017-11-02 16:52:18,10,2,926129855040770049
"This week, the House is considering my bill to repeal one of the worst parts of ObamaCare. Read more here:https://roe.house.gov/news/documentsingle.aspx?DocumentID=398245 …",2017-11-01 22:03:10,3,3,925845697852780545
Proud of the work @TN_Housing_Dev is doing to assist homebuyers with the Down Payment Assistance Program. More here:http://www.johnsoncitypress.com/Government/2017/10/30/Homebuyers-assistance-program.html?ci=stream&lp=4&p=1 …,2017-10-31 20:51:07,3,2,925465177100902401
This morning I hosted a roundtable discussion on tax reform for business leaders in the First District. Very productive conversation.pic.twitter.com/m9ws5ruVJS,2017-10-30 14:02:25,9,3,924999936210595842
"Today is National Prescription #TakeBackDay, which is an opportunity to safely dispose unused & expired medication. Do your part today.https://twitter.com/deahq/status/924276081867272192 …",2017-10-28 14:38:04,5,2,924284133744013313
Congrats @ErwinUtilities on receiving a grant for the Downtown Erwin Entrepreneurs Business Grant Project!https://roe.house.gov/news/documentsingle.aspx?DocumentID=398243 …,2017-10-27 17:08:05,2,1,923959498225614848
"Veterans have earned the right to access quality care that meets their needs. 

Read more here:https://roe.house.gov/news/documentsingle.aspx?DocumentID=398242 …",2017-10-26 20:26:37,4,2,923647071445544960
I commend @POTUS for declaring a Nationwide Public Health Emergency to address the opioid crisis. Read more here:https://roe.house.gov/news/documentsingle.aspx?DocumentID=398241 …,2017-10-26 19:52:10,5,3,923638402217586688
The House passed the budget which means we are one step closer to the tax relief East Tennesseans deserve.https://roe.house.gov/news/documentsingle.aspx?DocumentID=398240 …,2017-10-26 16:41:33,7,1,923590435242692608
"I’ll be hosting a Facebook Live town hall today at 11:45am. Tune in & submit any questions here:
https://www.facebook.com/DrPhilRoe/posts/1595807040477760 …",2017-10-25 13:21:33,1,2,923177714332422150
Did you know that 1 in 8 women will be diagnosed with breast cancer in their lifetime? October is #BreastCancerAwarenessMonth.pic.twitter.com/1yhC0M6ZM6,2017-10-23 18:01:48,7,4,922523465843953664
Veteran ID cards will be available next month:https://roe.house.gov/news/documentsingle.aspx?DocumentID=398239 …,2017-10-20 14:14:20,4,1,921379057689866240
Take a look at the important information about keeping teens safe on the roads. The text message can wait. #TeenDriverSafetyWeekhttps://twitter.com/TNHSO/status/920741394397921280 …,2017-10-19 19:20:47,3,1,921093792161288194
I’ve opposed the Iran nuclear agreement since day one. Read more in this week's column:https://roe.house.gov/news/documentsingle.aspx?DocumentID=398238 …,2017-10-18 19:38:03,5,2,920735746713112580
"Enjoyed being a barista for a day at the Johnson City Starbucks as I went behind the bar. Thanks for having me, @Starbucks!pic.twitter.com/CmUMGfHzNq",2017-10-18 13:38:54,24,5,920645365740777472
Encouraged by my visit with Unicoi County High School students today. It's always a pleasure to meet with the next generation of leaders.pic.twitter.com/cXdF0T09J2,2017-10-16 15:30:30,19,6,919948675299848194
It was a privilege to visit @FreseniusKC to learn more about the innovative dialysis treatment facilities in #TN01.http://newsroom.fmcna.com/congressman-phil-roe-visits-tennessee-facility-discusses-veterans-care/ …,2017-10-13 19:55:05,4,1,918928094890741761
ICYMI: I joined @LizClaman on @FoxBusiness to discuss the executive order signed by @POTUS today. Watch here:https://youtu.be/FajgCcdLmjM ,2017-10-12 20:48:54,1,1,918579251200348162
My full statement on the Department of Labor’s decision to delay the Obama administration’s disability claims rule: https://roe.house.gov/news/documentsingle.aspx?DocumentID=398234 …https://twitter.com/DrPhilRoe/status/918525940954750976 …,2017-10-12 17:17:30,1,2,918526051847991297
The last thing someone facing an unexpected hardship needs is to be further burdened by inefficient & unnecessary government bureaucracy.,2017-10-12 17:17:04,11,5,918525940954750976
"7 years later, the fact remains that the only thing bipartisan about Obamacare is its opposition. 

Read more here:https://roe.house.gov/news/documentsingle.aspx?DocumentID=398233 …",2017-10-12 16:21:58,5,3,918512074023686144
"My heart breaks for the Californians affected by the devastating wildfires. Prayers for all affected, for firefighters & first responders.",2017-10-11 14:52:40,11,2,918127213505138689
House Republicans’ tax reform framework will make the tax code fairer and simpler for all Americans. Learn more:  https://fairandsimple.gop/?utm_source=RepPhilRoe …pic.twitter.com/U0xovPb3Gl,2017-10-10 21:23:44,8,4,917863240209653761
I'm proud to support TN manufacturers on National Manufacturing Day & celebrate the great contribution they are to our nation. #MFGDay17https://twitter.com/DrPhilRoe/status/916352413711388672 …,2017-10-06 17:20:48,5,0,916352555592056833
I visited the Walmart Midway Distribution Center & learned about the vital role they hold in ensuring customers get the products they need.pic.twitter.com/VwB090N9AY,2017-10-06 17:20:15,7,2,916352413711388672
Thank you @RepAnnieKuster & @RepTomMacArthur for partnering with me on this bipartisan legislation.https://twitter.com/DrPhilRoe/status/916331621321715712 …,2017-10-06 16:10:57,1,2,916334975594754048
The Opioid Addiction & Prevention Act of 2017 will help curb the opioid epidemic and save lives. More here:https://roe.house.gov/news/documentsingle.aspx?DocumentID=398231 …,2017-10-06 15:57:37,3,2,916331621321715712
ICYMI: This week the House voted to restrict late-term abortions. #ProLifehttps://www.lifesitenews.com/news/breaking-u.s.-house-votes-on-banning-late-term-abortion-on-babies-who-feel …,2017-10-05 14:12:57,10,1,915942890379075586
"Proud to support the Pain-Capable Unborn Child Protection Act & fight for the right to life. 
Learn more here: https://roe.house.gov/news/documentsingle.aspx?DocumentID=398229 …pic.twitter.com/VMVe9ZKzKe",2017-10-04 19:59:38,10,3,915667750814650371
I am a proud supporter of HR 3441. Thank you @RepByrne for leading the charge.https://twitter.com/EdWorkforce/status/915604930030899200 …,2017-10-04 16:31:48,1,1,915615446803546112
It is unconscionable to me that our government allows innocent babies capable of feeling pain to be terminated.https://roe.house.gov/news/documentsingle.aspx?DocumentID=398228 …,2017-10-03 22:11:08,31,12,915338454036353026
I applaud @RepKevinBrady & @RepGregWalden on their continued leadership & efforts to protect seniors’ access to care https://roe.house.gov/news/documentsingle.aspx?DocumentID=398226 …pic.twitter.com/AophZDulxI,2017-10-03 14:02:01,8,4,915215366829125637
"Heartbroken by the senseless & horrific shooting in Las Vegas. Praying for the innocent victims, their families & the city of Las Vegas.",2017-10-02 14:33:48,20,5,914860975811174400
I’m committed to ensuring veterans have the tools and resources they need to know they are not alone.https://twitter.com/HouseVetAffairs/status/913825596047855616 …,2017-09-29 18:04:40,8,2,913826878632464384
"I look forward keeping our promise to deliver long-awaited tax relief that will greatly benefit East Tennesseans. 
https://roe.house.gov/news/documentsingle.aspx?DocumentID=398223 …pic.twitter.com/n1Ga1EfIVH",2017-09-28 18:56:17,3,1,913477478081089538
Thank you for your leadership and support of this legislation @SpeakerRyan @RepBrianMast.https://twitter.com/HouseVetAffairs/status/913464298558681088 …,2017-09-28 18:19:34,67,12,913468242030743552
Welcome back my friend!https://twitter.com/stevescalise/status/913405166178783232 …,2017-09-28 14:13:32,7,0,913406321868853251
Thank you @CCFheartkids for raising awareness and access to the lifesaving value of automatic external defibrillators (AEDs). #KnowYourHeartpic.twitter.com/W8gqL02wll,2017-09-27 21:17:27,5,3,913150616402370560
The framework released today is a down payment on our promise to create jobs and grow our economy. https://roe.house.gov/news/documentsingle.aspx?DocumentID=398221 …pic.twitter.com/Uy5bmhsTGb,2017-09-27 17:58:27,1,1,913100538165829632
ICYMI: Yesterday was #TaxReformTuesday & today House Republicans are rolling out a plan to promote pro-growth reformhttps://waysandmeans.house.gov/taxreformtuesday-rep-phil-roe/ …,2017-09-27 14:21:41,3,3,913045984955047937
It has been an honor to serve with @SenBobCorker. I’ll never forget the kindness he’s shown my family and me.https://roe.house.gov/news/documentsingle.aspx?DocumentID=398219 …,2017-09-26 21:05:07,13,6,912785127280869376
Honored to stand with my colleagues to outline House Republicans' agenda to keep our promises to the American people.pic.twitter.com/VO1an5IybQ,2017-09-26 18:44:53,17,9,912749836587405312
"Restrictions on freedom of speech, thought and expression are inherently at odds with the rights guaranteed by our Constitution.https://twitter.com/DrPhilRoe/status/912712256659578886 …",2017-09-26 16:16:23,6,0,912712465854713857
"Thank you, Attorney General Sessions for continuing the conversation in order to protect and foster the free and open exchange of ideas.",2017-09-26 16:15:34,3,1,912712256659578886
Tax reform is needed now more than ever to cut tax rates & make owning a small business more affordable. More: https://fairandsimple.gop/?utm_source=RepPhilRoe …pic.twitter.com/SiJ3h8rmsU,2017-09-25 19:19:24,5,2,912396135163219969
House Republicans have a plan to allow hardworking Americans to keep more of their pay. MORE:http://bit.ly/2hfJU42 ,2017-09-22 19:55:20,8,1,911318013986709504
Join me in continuing to pray for the citizens of Puerto Rico as #HurricaneMaria passes through the Caribbean.,2017-09-21 15:05:58,10,2,910882803948105728
Some of the most important work I do is to listen to East Tennesseans’ views on the many issues facing our country.https://roe.house.gov/news/documentsingle.aspx?DocumentID=398218 …,2017-09-20 20:55:21,10,1,910608342707589126
So much has changed in our culture over the past 31 years. It’s time to reform our tax code & get with the times. http://bit.ly/2hfJU42 pic.twitter.com/kyeM6RrzV2,2017-09-19 14:37:35,9,3,910150884440576002
.@HouseVetAffairs is working to improve the Veterans’ Choice program. Read more here: http://bit.ly/2ykgHfS  via @CitizenTribune,2017-09-18 18:40:16,1,1,909849569315508224
#POWMIARecognitionDayhttps://twitter.com/HouseVetAffairs/status/908688954110758912 …,2017-09-15 14:09:24,9,2,908694240473047041
May we never forget how America was forever changed 16 years ago. Our best & brightest years are yet to come.http://bit.ly/2jvhkzV ,2017-09-15 13:16:04,3,1,908680818498916355
Join me for the 8th Annual Military Service Academy Day on Saturday at Greeneville High School. Learn more here:http://bit.ly/2y1g7Tf ,2017-09-14 15:14:50,1,2,908348321785372672
It was an honor to join the 2nd Infantry Division for their annual reunion tonight. Proud to be a lifetime member!pic.twitter.com/YYT9iikZS0,2017-09-14 00:22:35,21,4,908123779930492928
Learn more here: https://fairandsimple.gop/?utm_source=RepPhilRoe …https://twitter.com/HouseGOP/status/907636422798188544 …,2017-09-12 18:34:16,3,3,907673734970068993
"Today, we honor all who lost their lives on September 11, 2001. Let us always remember and pray for those who were affected. #NeverForgetpic.twitter.com/Rf55eEtT6o",2017-09-11 13:32:33,17,10,907235416549490688
Don’t just take our word for why we need #taxreform. Here are 31 reasons → https://fairandsimple.gop/?utm_source=RepPhilRoe …,2017-09-08 19:01:00,9,4,906230911125131265
"What does the House GOP tax reform plan do? Learn more about our competitive, pro-growth tax reform plan here: https://fairandsimple.gop/?utm_source=RepPhilRoe …",2017-09-07 20:10:47,9,7,905886081853399040
"Today, the House passed a bipartisan bill to provide federal resources in the aftermath of Harvey. Read more here:https://roe.house.gov/news/documentsingle.aspx?DocumentID=398210 …",2017-09-06 21:43:27,9,2,905547013969895425
"Very proud of your hard work, Evan!https://twitter.com/theaward/status/905528528631889920 …",2017-09-06 20:45:01,5,0,905532308702277632
It’s Time to Protect the Rights of American Workers. Read my op-ed here: http://bit.ly/2eBFKTb  via @DailySignal,2017-09-05 14:55:52,2,1,905082058271330304
Happy Labor Day! Proud of the hardworking East Tennesseans who make our country so great. Hope everyone is enjoying their #LaborDay!,2017-09-04 21:53:32,15,4,904824776098807808
Read my statement on Chimney Tops 2 fire report:http://bit.ly/2vMYRzy ,2017-08-31 19:36:49,3,3,903340819364675585
It’s always a pleasure to speak with the Morristown Rotary Club & learn about their dedication to serving the local community.pic.twitter.com/ScxYwcjgeD,2017-08-31 16:03:15,4,1,903287074996047873
Reason 30 of #31ReasonsforTaxReform: Complex & confusing rules are costing our businesses $23 billion & 448 million hours each year.pic.twitter.com/NnoKC96uae,2017-08-30 16:29:43,6,3,902931349098696704
"Encouraged to see volunteers from the First District who have stepped up to help our friends in Texas. Thank you. 
http://bit.ly/2vkAGNz ",2017-08-29 16:06:54,3,3,902563219079741440
My prayers are with Houstonians & all Texans affected by Hurricane Harvey. Grateful to first responders & citizens for their rescue efforts.,2017-08-28 15:48:53,24,12,902196293442920448
"The House is working to instill #VAAccountability across @DeptVetAffairs. Read more at
http://veterans.house.gov/accountability .pic.twitter.com/uArrG7ogB7",2017-08-22 15:28:47,6,6,900016908967321600
In case you missed it: #ForeverGIBill is now the law of the land. Great news for our nation's veterans.https://twitter.com/housevetaffairs/status/897946689205542913 …,2017-08-17 13:04:51,43,14,898168746703024130
"Groups like the KKK, Neo-Nazis and other movements fueled by hate must be condemned in the strongest terms. More:http://wate.com/2017/08/16/tennessee-lawmakers-respond-to-protests-in-charlottesville-president-trump/ …",2017-08-16 22:30:54,22,6,897948812437626881
Statement from the office of Congressman Roe:pic.twitter.com/UEnYXnr4xQ,2017-08-11 14:44:34,154,49,896019514030264320
The time for an update & commonsense change to our tax code is now. Read this week's column on why: http://bit.ly/2uJCcnw pic.twitter.com/G6QkPENPw4,2017-08-10 14:36:40,11,0,895655141713616896
"ICYMI: The House passed HR1690 to increase #VAaccountability by improving VA's monitoring of
high-dollar bonuses https://go.usa.gov/xR96a ",2017-08-08 17:42:58,8,5,894977249782501376
"Today, on #PurpleHeartDay we honor the bravery & sacrifice of those who were wounded or gave their life while serving in the US military.pic.twitter.com/2lmrJGjyEk",2017-08-07 17:47:18,64,28,894615951131455489
August 3: Reasons for #taxreform – protecting American’s pay checks and growing our economy.pic.twitter.com/GL2vteECf2,2017-08-03 18:33:23,10,3,893177995300622336
Did you know taxpayers spend a combined $99 BILLION each year complying with the individual income tax? #taxreformpic.twitter.com/b06lFWEg0k,2017-08-02 19:32:41,9,5,892830531712364545
"Congress is making progress in bringing wholesale reform to VA. Read more at http://veterans.house.gov/ 
legislation.pic.twitter.com/so9GdcQM0p",2017-08-01 15:57:26,4,1,892413975224356865
House Republicans just passed the Make America Secure Act which will fund our national security efforts. More here: http://bit.ly/2tHbYT2 pic.twitter.com/ZwwEvjWRTs,2017-07-27 21:30:57,4,2,890685965861363712
I’m very proud of the summer interns who serve in my personal office & the @HouseVetAffairs. Such a huge help to me. Thanks for all you do!pic.twitter.com/XImqABn0jY,2017-07-27 18:29:55,17,2,890640408547545088
"This week, House approved H.R. 1848, my bill to improve care for veterans:http://bit.ly/2v8ANf1 ",2017-07-26 18:54:52,29,9,890284299085389824
Statement from my office:pic.twitter.com/ergiUoGxRF,2017-07-25 18:05:50,74,49,889909573049561089
#ForeverGIBillhttps://twitter.com/HouseVetAffairs/status/889856662496055300 …,2017-07-25 14:41:05,14,7,889858043630018560
Congratulations to Kim Cherry of First Horizon Corporation on receiving @FSR’s 2016 Corporate Social Responsibility Leadership Awardpic.twitter.com/3MGjFk3QQl,2017-07-24 20:36:13,10,3,889585031177437185
"Thanks for having me this morning, @Varneyco!https://twitter.com/FoxBusiness/status/888410545367375872 …",2017-07-21 15:03:59,9,6,888414256655458307
@EdWorkforce held a markup on the Affordable Retirement Advice for Savers Act. Read my column on this flawed rule: http://bit.ly/2uNeXNW pic.twitter.com/ewdJKMdO7G,2017-07-20 18:29:00,1,1,888103461685952512
Congressman Roe's birthday is tomorrow & staff surprised him with cake a day early. Join us in wishing him a very happy birthday! -Team Roepic.twitter.com/BWtwwtSivy,2017-07-20 14:37:31,31,5,888045210692980736
"This legislation will overturn the flawed fiduciary rule and replace it with workable, enhanced protections for retirement savers.https://twitter.com/EdWorkforce/status/887717707512205312 …",2017-07-19 17:29:44,6,2,887726158556667908
"If triggered, #IPAB would authorize arbitrary cuts to docs that could adversely affect health care access to Medicare patients. #ASMChat",2017-07-19 00:07:15,6,5,887463810260455424
#IPAB is an unelected board with sweeping powers to cut Medicare spending if actual spending exceeds projected spending. #ASMChat,2017-07-19 00:03:22,5,6,887462832983486464
We need to get this country back on the right fiscal path. #balancethebudget http://balancedbudget.gop pic.twitter.com/qXtaOLn1Kx,2017-07-18 15:38:33,7,2,887335792884027393
A huge congrats to David LaPorte & Erin Luther from the First District of Tennessee -- recipients of the 2017 @FulbrightPrgrm Scholarship.,2017-07-17 19:16:58,11,2,887028373083627525
ICYMI: Yesterday @CongressmanRuiz & I led a bipartisan House effort on the need to act quickly to repeal the #IPAB.http://bit.ly/2tUkgb1 ,2017-07-14 19:27:50,4,0,885943943371911168
Bipartisan #NDAA passed the House today which provides the largest troop pay raise in 8 years. Read more here:http://bit.ly/2tnjgub ,2017-07-14 16:42:48,6,1,885902412149641216
Proud to lead the House’s bipartisan effort to repeal the #IPABpic.twitter.com/mAaow0zmzE,2017-07-13 21:48:49,14,6,885617033584541701
I'm proud the House passed 3 bills to #EndTrafficking. Read my column on the bills here:http://bit.ly/2uSQzH8 ,2017-07-12 22:22:19,7,1,885263074617425920
"Was very encouraged by these bright, young Beta Club students from #TN01 who came to DC today. “Let Us Lead By Serving Others.”pic.twitter.com/gMp9YQAKpW",2017-07-12 19:47:33,4,0,885224126289518594
It was great to have you!https://twitter.com/sgottliebfda/status/885124348423671808 …,2017-07-12 13:22:05,5,1,885127120867000323
