Text,Date,Favorites,Retweets,Tweet ID
"Greeneville Sun: Roe Talks Keystone, Budgets, ACA http://www.greenevillesun.com/news/local_news/article_5cbd0f64-ed91-5a05-ba1e-a256156182c4.html …",2014-11-15 17:22:50,1,1,533671481130352640
My statement on the House Keystone Pipeline vote:http://roe.house.gov/news/documentsingle.aspx?DocumentID=397788 …,2014-11-14 17:54:38,0,1,533317092259659777
My Statement on Judge Mike Faulk’s Passing:http://roe.house.gov/news/documentsingle.aspx?DocumentID=397787 …,2014-11-12 21:07:37,1,3,532640885352435714
Please take a moment to read this week's column on the VA:http://roe.house.gov/news/documentsingle.aspx?DocumentID=397786 …,2014-11-12 16:29:45,1,1,532570957035343872
"Today and every day, we thank and salute our veterans. #VeteransDaypic.twitter.com/aUrNPEEl4e",2014-11-11 16:52:44,5,10,532214353425338368
Be sure to tune in to @wkpt19 tonight at six. I'll be talking about the 114th Congress and my priorities.,2014-11-06 20:01:54,1,3,530450017493221377
@annakuskin Nice chatting with you!,2014-11-06 20:00:56,1,0,530449774873698304
@votemattmorris Thanks for tuning in!,2014-11-06 20:00:46,1,0,530449735262674944
Doctors Caucus Urges Leadership to Address ‘Doc Fix’ By Year’s End:http://roe.house.gov/news/documentsingle.aspx?DocumentID=397785 …,2014-11-03 20:43:51,2,9,529373412524048384
Interesting article in the New York Times about music in our area:http://www.nytimes.com/2014/11/02/travel/where-the-hills-and-hollows-are-alive-with-music.html?_r=1 …,2014-11-03 14:39:13,2,3,529281651600527362
Great write-up about my visit to Ridgeview. Visiting schools is one of my favorite things to do as a Congressman! http://www.wcde.org/education/components/scrapbook/default.php?sectiondetailid=22679 …,2014-10-31 18:52:11,0,0,528258146696175617
This week's column is all about making government work for East Tennesseans. Read more: http://roe.house.gov/news/documentsingle.aspx?DocumentID=397783 …,2014-10-29 13:52:14,0,1,527457885220270080
Great news for Bluff City! http://www.timesnews.net/article/9082007/bluff-city-water-system-to-get-much-needed-upgrades …,2014-10-28 22:17:47,0,1,527222725639958529
In case you missed it: I did a phone interview with CNN Saturday morning to discuss why I support a travel ban.https://www.youtube.com/watch?v=_sigLSmZKOQ&list=UU8muYurPSNO8x2Qqk40mVOA …,2014-10-27 19:19:02,1,3,526815354438565889
It was wonderful to visit the Niswonger Foundation. I'm so proud of the work they are doing in our community. http://www.greenevillesun.com/news/local_news/article_d961d1f9-4af5-5e5b-bbd8-93fbfb010352.html …,2014-10-26 15:24:46,0,2,526394010777444352
@TNFarmBureau thank you for the honor!,2014-10-24 00:06:20,1,0,525438100689125376
Read my latest thoughts on #Ebola in this week's column: A Temporary Travel Ban Can Help Combat Ebola |http://roe.house.gov/news/documentsingle.aspx?DocumentID=397782 …,2014-10-23 15:43:20,1,3,525311519241023489
"Roe, Members of the Doctors Caucus Urge President Obama to Reconsider Temporary Travel Ban. LETTER: http://roe.house.gov/uploadedfiles/docs_letter_ebola.pdf …",2014-10-21 17:41:28,0,0,524616470631026688
"Bristol Herald Courier: Griffith, Roe back travel ban push http://www.tricities.com/news/article_e1ad57a0-55b0-11e4-b936-0017a43b2370.html …",2014-10-17 14:09:09,0,3,523113490777931777
My weekly column: Obamacare in Year Twohttp://roe.house.gov/news/documentsingle.aspx?DocumentID=397779 …,2014-10-16 17:05:24,0,0,522795455261184000
I'm looking forward to being at the Tennessee for a Lifetime event this weekend. DETAILS:pic.twitter.com/F1Fn22RUqF,2014-10-16 14:12:15,0,3,522751880343339008
Via @JCPress: Tennessee for a Lifetime http://www.johnsoncitypress.com/article/121263/tennessee-for-a-lifetime …,2014-10-16 14:10:39,0,0,522751479695048704
It was great to stop by Ridgeview School last week as part of Education Week.pic.twitter.com/4mXsAgcoVq,2014-10-14 17:36:02,3,2,522078389826781184
@HMGforYou Thank you for having me!,2014-10-08 17:38:23,2,1,519904655028273152
Please take a moment to read my weekly column. This week's topic is #Ebola. LINK:http://roe.house.gov/news/documentsingle.aspx?DocumentID=397778 …,2014-10-08 17:06:42,4,7,519896681832529920
@FinalSayRadio Thanks for having me!,2014-10-06 22:53:49,0,0,519259259125919744
Education Week kicks off today with our first teacher forum and town hall in Kodak at Northview Academy. INFO: http://roe.house.gov/educationweek/ ,2014-10-06 15:16:07,0,0,519144074730041344
WCYB: Johnson City Housing Authority receives money for vouchers for veteranshttp://www.wcyb.com/news/johnson-city-housing-authority-receives-money-for-vouchers-for-veterans/28360048 …,2014-10-02 14:43:31,2,0,517686320962215936
I'm excited to announce next week's education week. DETAILS: http://roe.house.gov/educationweek/ ,2014-10-01 18:08:05,0,1,517375411769323520
My statement on Eric Holder's resignation:http://roe.house.gov/news/documentsingle.aspx?DocumentID=394555 …,2014-09-25 20:43:13,0,1,515240126671503360
"Please take a moment to read my weekly column: American Energy Production Can Lower Costs, Create Jobshttp://roe.house.gov/news/documentsingle.aspx?DocumentID=394459 …",2014-09-24 19:33:39,0,1,514860232938627072
My staff traveling office hours were announced this week. See when we'll be nearest you: http://roe.house.gov/constituentservices/officehours/ …,2014-09-23 20:58:17,1,0,514519140443619330
Thank you to everyone that made it out for Academy Day. It's inspiring to see young people who want to serve.pic.twitter.com/sSBweRC7Yk,2014-09-22 14:12:18,1,1,514054587356291072
I hope to see you at tomorrow's Academy Day eventpic.twitter.com/eE0pRpwJDU,2014-09-19 13:53:14,0,0,512962623923834882
In case you missed it: I went on Fox Business with Neil Cavuto to discuss the Ebola epidemic. VIDEO:https://www.youtube.com/watch?v=gNHASLan5NM&list=UU8muYurPSNO8x2Qqk40mVOA …,2014-09-18 15:23:26,4,2,512622936751370240
I'm am still outraged & demanding answers from the #VA. Great @CNN article on yesterday's @HouseVetAffairs hearing: http://www.cnn.com/2014/09/17/politics/va-whistleblowers-congressional-hearing/index.html?hpt=hp_t4 …,2014-09-18 15:03:31,3,4,512617923123621889
I addressed today's vote on President Obama's ISIL proposal in my weekly column:http://roe.house.gov/news/documentsingle.aspx?DocumentID=393920 …,2014-09-17 22:23:52,0,2,512366351768649728
I believe the Constitution is one of our nation's most sacred documents & will always fight to uphold and protect it.pic.twitter.com/dz8b2oC546,2014-09-17 14:05:06,6,5,512240836181229568
"The Mountain Press: Veteran job fair, outreach event set for Sevierville http://www.themountainpress.com/news/x1412772124/Veteran-job-fair-outreach-event-set-for-Sevierville …",2014-09-16 18:03:15,2,0,511938377252618241
Reminder: Our 5th annual Academy Day is coming up on September 20th. INFO:http://roe.house.gov/news/documentsingle.aspx?DocumentID=392285 …,2014-09-15 14:15:58,0,0,511518794792325120
Kingsport Times News: Roe looks for well-defined plan to authorize force http://www.timesnews.net/article/9080735/roe-looks-for-well-defined-plan-to-authorize-force …,2014-09-12 14:33:31,0,0,510436047520813056
Great to join @news5wcyb live today to discuss President Obama's speech lastnight. Thanks @WCYB_Preston for having me!,2014-09-11 16:16:10,0,0,510099492830715905
We will never forget.pic.twitter.com/Qb0COTG8pd,2014-09-11 13:25:03,3,10,510056429693456384
My statement on President Obama's proposal:http://roe.house.gov/news/documentsingle.aspx?DocumentID=393066 …,2014-09-11 01:16:11,4,5,509873004403515393
My weekly column is up on my website. This week's topic is defeating the Islamic State. Read here:http://roe.house.gov/news/documentsingle.aspx?DocumentID=392996 …,2014-09-10 16:43:28,0,1,509743973842579456
Today my #VA dialysis bill passed the @HouseVetAffairs Committee. Read my statement here:http://roe.house.gov/news/documentsingle.aspx?DocumentID=392981 …,2014-09-10 15:02:33,1,2,509718577805803520
STARTING SOON: I will be chairing the @EdWorkforce subcommittee hearing on expanding joint employer status. Watch: http://edworkforce.house.gov/webcast/ ,2014-09-09 13:53:54,0,0,509338912071098368
Today is a very special day! It is my mother's 92nd birthday!pic.twitter.com/VQyLFEZFBU,2014-09-03 17:46:08,3,1,507223028745641984
"Please take a moment to read this week's column: Labor Day a Reminder to Continue Focus on Jobs, Economic Growthhttp://roe.house.gov/news/documentsingle.aspx?DocumentID=392301 …",2014-09-03 14:01:20,0,0,507166458020126720
Reminder: I'll be holding a town hall meeting TONIGHT at 6:30 pm at Unaka Elem. School in Stoney Creek,2014-09-02 14:23:41,1,2,506809693923475456
Great to be in Morristown yesterday! http://www.citizentribune.com/?p=76633 ,2014-08-28 14:11:08,0,1,504994593226895360
Great to host a lunch this afternoon and hear about the issues facing women leading businesses in East Tennessee.pic.twitter.com/hLKp32cVAF,2014-08-27 16:17:05,1,1,504663904753287169
It was nice to take a little break to have a jam session with my daughter Whitney. Video here: https://www.facebook.com/DrPhilRoe/posts/762285923829880?ref=notif&notif_t=like …,2014-08-25 20:43:11,2,1,504006092217909249
Great news for Kingsport! Release:http://roe.house.gov/news/documentsingle.aspx?DocumentID=391446 …,2014-08-25 17:10:51,0,0,503952659888734209
My staff constituent service office hours for September are up. Need assistance? See when we'll be nearest you: http://roe.house.gov/constituentservices/officehours/ …,2014-08-23 20:34:54,0,2,503279234203521025
I'll be holding a town hall meeting on September 2nd at 6:30 pm at Unaka Elem. School in Stoney Creek. @ElizStarNewspic.twitter.com/zZRJaddxYt,2014-08-22 14:22:55,1,0,502823233172045824
Please take a moment to read this week's column: It’s Time for Leadership on the World Stagehttp://roe.house.gov/news/documentsingle.aspx?DocumentID=391024 …,2014-08-18 18:01:38,0,1,501428721908453378
In case you missed it in the @JCPress: Farmers market store receives 'boon' from USDA http://www.johnsoncitypress.com/article/119345/farmers-market-store-receives-boon-from-usda …,2014-08-12 13:46:09,0,2,499190101998862336
Knoxville News Sentinel: Congress members demand answers about arrival of immigrant children in Tenn. http://www.knoxnews.com/news/state/congress-members-demand-answers-about-arrival-of-immigrant-children-in-tenn_84561681 …,2014-08-04 15:04:02,0,1,496310599924858880
In case you missed it: my statement on Friday evening's vote to address the crisis at the border https://www.facebook.com/DrPhilRoe/posts/751593208232485?ref=notif&notif_t=like …,2014-08-03 23:32:05,0,1,496076065123893249
Today I spoke on the House floor in support of the conference report for the #VA health care bill. VIDEO:https://www.youtube.com/watch?v=8-_ZCmw25Ig&feature=youtu.be …,2014-07-30 19:57:15,1,1,494572451041673216
My weekly column: Education is Necessary for Success in the 21st Centuryhttp://roe.house.gov/news/documentsingle.aspx?DocumentID=389084 …,2014-07-24 15:28:14,0,1,492330423784316928
"Today, I spoke on the House floor in support of the Strengthening Transparency in Higher Education Act. VIDEO:https://www.youtube.com/watch?v=pXDU4AZTzNM&feature=youtu.be …",2014-07-23 18:15:48,0,2,492010205476306944
My statement on the #Obamacare subsidy ruling:http://roe.house.gov/news/documentsingle.aspx?DocumentID=388744 …,2014-07-22 20:12:51,0,1,491677274681249793
Join us today in wishing the Congressman a very happy birthday! -Team Roe,2014-07-21 15:49:46,3,3,491248679970697216
Great to visit with the Mullins Family in my Washington office yesterday!pic.twitter.com/EQMPt2iJF1,2014-07-17 14:15:40,0,0,489775445735657473
My weekly column: A Government of Laws and Not of Menhttp://roe.house.gov/news/documentsingle.aspx?DocumentID=388217 …,2014-07-16 20:36:41,1,2,489508943983808512
Great story from @WJHL_Nate about a patriot in the District: Lost Vietnam veteran's dog tag returned 46 years later http://www.wjhl.com/story/26013186/lost-vietnam-veterans-dog-tag-returned-to-marine-46-years-later …,2014-07-15 14:21:47,1,3,489052210446483456
"The bottom photo was taken in 65, & the top was taken at Scout camp reunion last weekend, nearly 50 years later. #tbtpic.twitter.com/AJ2nTGEcy1",2014-07-10 13:53:02,1,1,487233034299908097
If you missed me on @FoxNews with @EricShawnonFox you can watch the video here:https://www.youtube.com/watch?v=cyb71p7Hp0k&feature=youtu.be …,2014-07-09 17:47:52,0,2,486929744546783232
My weekly column: Workforce Innovation and Opportunityhttp://roe.house.gov/news/documentsingle.aspx?DocumentID=387096 …,2014-07-09 14:42:09,0,1,486883006561656832
It was great to have my friend and colleague @michaelcburgess in Tennessee yesterday!http://www.wcyb.com/news/congressman-burgess-addresses-state-of-healthcare-at-johnson-city-meeting/26837366 …,2014-07-08 15:20:49,0,0,486530348327927808
Happy Independence Day! Read my message here:http://roe.house.gov/news/documentsingle.aspx?DocumentID=386585 …,2014-07-04 13:34:31,2,4,485054048660647936
I will be in Jonesborough this evening for a town hall meeting. This town hall will focus primarily on the VA.http://roe.house.gov/news/documentsingle.aspx?DocumentID=385461 …,2014-07-01 14:47:06,0,0,483985149991088129
Reminder: I will be in Erwin this evening for a town hall meeting.http://roe.house.gov/news/documentsingle.aspx?DocumentID=385693 …,2014-06-30 14:32:26,1,1,483619072182325248
Reminder: I am holding a town hall meeting in Erwin on Monday. Information here: http://roe.house.gov/news/documentsingle.aspx?DocumentID=385693 …,2014-06-27 14:12:12,1,2,482526817635803136
"Senator Baker was a great American, devoted to public service and to the great state of Tennessee. Statement:http://roe.house.gov/news/documentsingle.aspx?DocumentID=386095 …",2014-06-26 19:16:48,6,4,482241084324843520
"Kline, Roe Respond to Supreme Court’s Noel Canning Decisionhttp://edworkforce.house.gov/news/documentsingle.aspx?DocumentID=386017 …",2014-06-26 18:20:47,0,1,482226985574600704
I'll be on the radio with @seanhannity at 4:30 ET to discuss the VA. Tune in!,2014-06-25 19:09:54,1,0,481876958456725505
My weekly column: Easing the Pain at the Pumphttp://roe.house.gov/news/documentsingle.aspx?DocumentID=385871 …,2014-06-25 17:10:30,1,0,481846910396162048
Next Monday I am holding a town hall meeting in Erwin. INFO HERE: http://roe.house.gov/news/documentsingle.aspx?DocumentID=385693 …,2014-06-24 15:53:43,0,1,481465201649520640
HAPPENING NOW: I am chairing the @EdWorkforce HELP Subcommittee hearing on the #NLRB. Watch live: http://edworkforce.house.gov/webcast/ ,2014-06-24 14:10:00,0,3,481439099711418368
Next week I am holding a veterans town hall in Jonesborough. INFO: http://roe.house.gov/news/documentsingle.aspx?DocumentID=385461 …,2014-06-23 18:37:08,1,2,481143936883621888
And congratulations to @kevinomccarthy on being elected as our next @GOPLeader!,2014-06-19 20:07:16,2,3,479717069744005120
"Congratulations to my good friend and colleague, @SteveScalise. You will make an excellent @GOPWhip!",2014-06-19 20:04:12,1,6,479716295253168128
Roe Tapped to Serve as Conferee for Veterans Health Care Bill. STATEMENT:http://roe.house.gov/news/documentsingle.aspx?DocumentID=384916 …,2014-06-18 18:02:10,3,3,479323197033418753
My weekly column: Audit Confirms Serious Need for Changes in VA Health Care Systemhttp://roe.house.gov/news/documentsingle.aspx?DocumentID=384169 …,2014-06-11 17:44:56,1,2,476782145760137216
"Today, I proudly supported the Veteran Access to Care Act. VIDEO:https://www.youtube.com/watch?v=7vDC3nAPxTc&feature=youtu.be …",2014-06-10 18:00:02,1,1,476423556419813376
Great to meet with the Cocke County ROTC this morning in Washington.pic.twitter.com/o0fPctQ8jx,2014-06-10 14:42:23,3,1,476373817112399874
My weekly column: President Obama's War on Coalhttp://roe.house.gov/news/documentsingle.aspx?DocumentID=383463 …,2014-06-04 15:59:57,1,2,474219009714688000
It’s painfully clear this president plans to play by a different set of rules than any other president. STATEMENT:http://roe.house.gov/news/documentsingle.aspx?DocumentID=383308 …,2014-06-02 18:37:05,1,6,473533781123825664
I went on Fox earlier to discuss Secretary Shinseki's resignation. VIDEO:https://www.youtube.com/watch?v=vcM-ekfNEos&feature=youtu.be …,2014-05-30 19:02:31,0,0,472453016696913920
My statement on Secretary Shinseki's resignation:http://roe.house.gov/news/documentsingle.aspx?DocumentID=382649 …,2014-05-30 16:01:58,0,4,472407578472120320
I'm still seeking answers after lastnight's Veterans Affairs Committee hearing. My weekly column:http://roe.house.gov/news/documentsingle.aspx?DocumentID=381496 …,2014-05-29 16:54:06,2,6,472058310175494146
I'm up next at the @HouseVetAffairs hearing. WATCH:http://www.ustream.tv/channel/hclive14 …,2014-05-29 00:29:37,1,2,471810558107598849
In the @HouseVetAffairs Committee hearing. We must get to the bottom of this and make sure it never happens again.,2014-05-28 23:50:37,2,5,471800744660979712
Roe Bill to Establish War Memorial Passes House of Representatives http://roe.house.gov/news/documentsingle.aspx?DocumentID=381365 …,2014-05-28 23:47:37,1,2,471799989459771392
My Statement on the interim IG Report: http://roe.house.gov/news/documentsingle.aspx?DocumentID=381362 …,2014-05-28 19:41:43,0,1,471738104945315840
Looking forward to chatting with @MikeEmanuelFox about the VA Scandal today.,2014-05-28 15:50:46,0,0,471679987192725504
House to vote on Desert Shield/Desert Storm veteran memorial Wednesday http://www.wjhl.com/story/25601305/house-to-vote-on-desert-shielddesert-storm-veteran-memorial-wednesday …,2014-05-27 13:35:56,3,4,471283664425586688
Today I opposed the USA Freedom Act. Statement:http://roe.house.gov/news/documentsingle.aspx?DocumentID=380900 …,2014-05-22 16:32:55,4,1,469516267024809984
"If you missed me on @cspanwj this morning, you can watch the segment here: http://www.c-span.org/video/?319344-4/washington-journal-fy2015-defense-authorization …",2014-05-22 14:06:05,0,4,469479312824205312
LIVE on @cspanwj talking about the VA. Tune in!,2014-05-22 11:50:32,1,2,469445199324647424
I'll be on @cspanwj tomorrow morning around 7:45 talking about the VA scandal. Tune in!,2014-05-21 23:41:50,0,0,469261815856525312
Please take a moment to read my Memorial Day message in this week's column: http://roe.house.gov/news/documentsingle.aspx?DocumentID=380766 …,2014-05-21 18:48:21,0,1,469187961100435456
I went on the Blaze's Wilkow! to discuss the VA. You can watch the interview here:https://www.youtube.com/watch?v=J30nmQWaPeI&feature=youtu.be …,2014-05-21 14:14:12,0,0,469118967949565952
Today I will vote in support of the conference report on The Water Resources Reform & Development Act of 2014 #WRRDApic.twitter.com/rZmJtRL5ep,2014-05-20 14:52:57,1,2,468766331786240000
My district staff office hours for the month of June have been announced: http://roe.house.gov/constituentservices/officehours/ …,2014-05-19 15:33:04,0,2,468414040017235969
My weekly column: Demanding Answers for Our Veteranshttp://roe.house.gov/news/documentsingle.aspx?DocumentID=379863 …,2014-05-14 14:36:39,0,2,466587903427346432
WBIR: Congressman Roe speaks out on VA controversy http://www.wbir.com/story/news/local/2014/05/12/congressman-roe-speaks-out-on-va-controversy/9020551/ …,2014-05-13 14:28:48,0,0,466223539855822848
"Happy Mothers Day to all the mothers out there, especially to two mothers in my life: my mother Rose & my wife Pam!  https://www.facebook.com/DrPhilRoe/photos/a.146337795424699.30057.130725126985966/706051082786698/?type=1&theater …",2014-05-11 13:28:42,0,2,465483637463724032
VIDEO: Roe speaks in support of H.R. 10 #qualitychartershttps://www.youtube.com/watch?v=z1k6jcxX6qg&feature=youtu.be …,2014-05-09 14:00:17,0,1,464766809624035328
@meagan_shc Thank you for coming in!,2014-05-08 23:02:11,0,0,464540798701535232
My statement on the Benghazi Select Committee:http://roe.house.gov/news/documentsingle.aspx?DocumentID=379426 …,2014-05-08 22:32:12,0,1,464533251928121346
.@BHCJames Thank you for sharing! It's from 6:40-7:40 now because of votes. 1-877-229-8493 access code: 19641,2014-05-08 18:56:49,0,0,464479048371277824
"Because of votes, we've had to move tonight's telephone town hall from 6:15 to 6:40 p.m. The dial-in number and ID code will be the same.",2014-05-08 18:07:45,1,2,464466702483595264
My weekly column: Accountability and Transparencyhttp://roe.house.gov/news/documentsingle.aspx?DocumentID=379211 …,2014-05-07 17:42:28,0,0,464097949300293632
@RepGoodlatte Thank you for having me!,2014-05-06 20:37:19,0,0,463779566402953216
This week is Teacher Appreciation Week. Do you have a favorite memory of one of your teachers?pic.twitter.com/pHImn2VSS2,2014-05-06 15:08:49,1,3,463696893659185152
My weekly column: Tennessee Leading the Way on Education Reformhttp://roe.house.gov/news/documentsingle.aspx?DocumentID=378240 …,2014-04-30 17:54:29,0,0,461564261219991552
Sending thoughts and prayers to everyone affected by the storms moving across the south.pic.twitter.com/rBJWULgzas,2014-04-29 13:52:10,4,10,461140888425467904
Today I announced the winners of the 2014 Congressional Art Competition. Read my press release here:http://roe.house.gov/news/documentsingle.aspx?DocumentID=377626 …,2014-04-28 14:53:59,0,1,460794059607789568
Great news! Tennessee on pace to meet 90 percent high school graduation rate: http://www.johnsoncitypress.com/article/116788/tennessee-on-pace-to-meet-90-percent-high-school-graduation-rate …,2014-04-28 14:42:00,1,4,460791042347110401
Really enjoyed taking a break from our tour for a short jam session. Thank you all for having me!https://www.youtube.com/watch?v=5KGzJjn-mjc&feature=youtube_gdata …,2014-04-24 14:04:25,0,1,459332032808894464
My weekly column: Another Disappointing Keystone Delayhttp://roe.house.gov/news/documentsingle.aspx?DocumentID=377137 …,2014-04-23 14:24:37,1,0,458974730528493568
My district staff office hours for the month of May have been announced: http://roe.house.gov/constituentservices/officehours/ …,2014-04-22 13:09:18,0,2,458593387340648448
Roe to Announce Congressional Art Competition Winnershttp://roe.house.gov/news/documentsingle.aspx?DocumentID=376776 …,2014-04-17 14:09:16,0,2,456796539067723776
Please take a moment to read my weekly column on Tax Day:http://roe.house.gov/news/documentsingle.aspx?DocumentID=376727 …,2014-04-16 16:41:24,0,0,456472438860414976
"Today is #TaxDay. This graphic is just one of the many reasons we need a fairer, simpler tax code.pic.twitter.com/nKaOXd6oLx",2014-04-15 14:07:56,4,9,456071428597485568
It was an honor to send off veterans from the district this morning as they head to DC on their Honor Flight.pic.twitter.com/Nb9kOE6WeG,2014-04-11 14:34:50,1,2,454628645667995648
VIDEO: Roe Speaks in Support of Ryan Budget:https://www.youtube.com/watch?v=PTgMHD5OCow&feature=youtu.be …,2014-04-10 13:45:40,1,0,454253886724132864
.@RepPaulRyan's budget is a better bargain for American taxpayers. Read more in my weekly column:http://roe.house.gov/news/documentsingle.aspx?DocumentID=376087 …,2014-04-09 18:03:54,1,1,453956485530525696
@bitedoc Hi Dr. Wood. You can email Rep.roe@mail.house.gov. Thanks!,2014-04-07 13:55:52,0,0,453169288959234048
VIDEO: Roe Supports 40-Hour Workweekhttps://www.youtube.com/watch?v=-uj_Sue0Yt4&feature=youtu.be …,2014-04-03 19:02:01,0,1,451796783493316608
Great to have @skylarmcbee1 and @jjmcgrawmd in my Washington office today.pic.twitter.com/UiJh10lvyZ,2014-04-03 17:15:45,2,1,451770037364215808
Today's #tbt from just a few Thanksgivings ago. Can you guess which one is me? http://ow.ly/i/57myl ,2014-04-03 13:26:36,0,1,451712371657281537
@FAHEonline Thanks for coming in!,2014-04-02 22:01:43,0,0,451479615467712512
My weekly column: Stopping the Administration’s War on Workhttp://roe.house.gov/news/documentsingle.aspx?DocumentID=375002 …,2014-04-02 18:09:49,0,3,451421256458698752
My weekly column: Preventing Government Waste and Protecting Jobshttp://roe.house.gov/news/documentsingle.aspx?DocumentID=374175#Comments …,2014-03-26 16:09:04,0,1,448854156820758528
Roe Statement on the Fourth Anniversary of Obamacare:http://roe.house.gov/news/documentsingle.aspx?DocumentID=373604 …,2014-03-21 14:12:30,1,4,447012882002485248
Integrated Electronic Health Records Important to Veterans’ Carehttp://roe.house.gov/news/documentsingle.aspx?DocumentID=373454 …,2014-03-19 19:52:48,0,3,446373743133487104
Great piece in the @TimesFreePress about GOP alternatives to #Obamacare @GroverNorquist @taxreformerhttp://www.timesfreepress.com/news/2014/mar/15/health-care-gop-has-alternatives/ …,2014-03-18 15:45:49,0,2,445949201776930816
@KaylaNeikirk Nice to chat with you as well!,2014-03-18 15:38:27,1,0,445947346120372224
Great to be at Chuckey Doak High School this afternoon | http://ow.ly/i/4VFac ,2014-03-17 18:28:34,0,1,445627769142398977
RELEASE: Roe Supports SGR Repeal Compromisehttp://roe.house.gov/news/documentsingle.aspx?DocumentID=372941 …,2014-03-14 14:55:41,0,0,444487032723996672
The Yant family stopped by my office while visiting DC! Contact my office if you're planning a trip & need assistance http://ow.ly/i/4SmTX ,2014-03-12 17:18:01,0,1,443798078131539968
There’s no clause in the Constitution about ignoring laws you don’t like or changing laws you championed. Read more:http://roe.house.gov/news/documentsingle.aspx?DocumentID=372562 …,2014-03-12 15:14:48,1,5,443767069969244161
