Text,Date,Favorites,Retweets,Tweet ID
"Last day to register to vote in CA. Regardless of political affiliation, register here: http://RegisterToVote.ca.gov .pic.twitter.com/65rgMMvEcn",2014-10-20 18:09:07,1,3,524261040776032256
Pleased to join @RepEdRoyce & @RepJudyChu in announcing $10 million TIGER grant funding for 57/60 Improvement Project http://1.usa.gov/1wfoqEE ,2014-09-09 22:29:08,4,5,509468574226714624
Great to visit @CitrusCollege Veterans Center today & see how transitional services are aiding SGV student veterans http://1.usa.gov/1qhTrHi ,2014-09-04 22:10:35,2,4,507651966382530560
"For latest newsletter w/ updates on our local economy, water/drought, veterans, mental health & more; please visit: http://1.usa.gov/1pENIJO ",2014-08-07 21:09:56,1,4,497489842964422656
Proud to join @RepRoybalAllard @DelegateDonna @RepBarbaraLee @HispanicCaucus @OfficialCBC @CAPAC to support #HEAA2014 #HealthEquity for all!,2014-07-30 19:42:35,0,3,494568758493868032
REMINDER: FREE Veterans Forum TOMORROW in Azusa. Please share with any veterans you know! http://1.usa.gov/1zO2IdY pic.twitter.com/UyhD00suQ3,2014-07-25 22:02:24,0,4,492792007535132672
"Hosting a FREE Veterans Forum on Sat, July 26 in Azusa. Please tell any veterans you know! http://1.usa.gov/1zO2IdY pic.twitter.com/49nSD9FbcH",2014-07-17 21:58:02,0,2,489891806050803712
"Proud to cosponsor HR 5051, #NotMyBossBusiness bill, to ensure healthcare decisions are between a woman & her doctor--not her boss.",2014-07-14 18:48:00,2,2,488756815950536704
Joined my @HispanicCaucus colleagues today at a press conf on unaccompanied minors situation http://1.usa.gov/1r47GRe pic.twitter.com/4QRld737Eb,2014-07-11 20:00:38,6,9,487687932879577088
Joined Cong colleagues & business leaders last night to discuss how exports can grow American businesses/create jobs http://1.usa.gov/1nT3dgg ,2014-06-20 19:50:45,0,0,480075300941099008
Innovators & professionals from 16 countries at CYPSY19 Conf today. Mental illness knows no nationality or boundariespic.twitter.com/KGADxNbuBY,2014-06-19 22:31:44,0,1,479753424880549888
Joined innovators & #mentalhealth professnls at CyberPsychology Conf today. New tech is helping increase access to MH care for all citizens.,2014-06-19 22:28:42,1,1,479752662385455104
Thank you to all who participated in last Friday's 32nd District #mentalhealth consortium meeting. #EndStigmahttp://1.usa.gov/1qq4ZZB ,2014-06-17 23:01:10,1,2,479036057745649664
Today Pres Obama took big step toward strengthening our nation's #water #infrastructure by signing #WRRDA into lawpic.twitter.com/0Rt5oRcN5Y,2014-06-10 19:01:07,1,1,476438932327268352
Honor to attend Borinqueneers Bill signing cmny @WhiteHouse today. Congrats to these heroes who served in Korean Warpic.twitter.com/CAqMHgVXuW,2014-06-10 18:47:31,1,4,476435505983524864
Today we honor the bravery of El Monte’s Joe Jimenez & 150k others who stormed beaches at Normandy 70 yrs ago #DDay70http://bit.ly/1utD36s ,2014-06-06 19:58:37,1,1,475003847744573440
"It was a pleasure visiting the ""Almost Home"" house, a new transitional housing facility for women veterans today. http://1.usa.gov/1l9CN9P ",2014-06-05 21:41:08,0,3,474667259651440640
It was great to visit East San Gabriel Valley ROP/TC today to learn about educational services available to our vets http://1.usa.gov/1hbK21z ,2014-06-04 22:02:20,1,0,474310209834610692
It was a pleasure to speak w/ @HumanityAction fellows this morning. We wish these young scholars the very best.pic.twitter.com/lO8nG26LS8,2014-05-30 20:23:26,2,3,472473377924743168
Today we remember our heroes who made the ultimate sacrifice for our country and did not return home. #MemorialDaypic.twitter.com/pYLDbbc3ja,2014-05-26 16:17:18,5,7,470961886436265984
We commend @SenFeinstein & @SenatorBoxer for passing S. 2198 & will cont. to work on long-term CA #water solutions http://1.usa.gov/1r13WAv ,2014-05-23 17:06:42,0,0,469887155775758336
Joining @RepMcKinley in applauding increased funds for Natl Guard Youth ChalleNGe Program  @NGYFoundation http://1.usa.gov/1tpEmmy ,2014-05-22 19:13:39,1,3,469556713176461312
Proud to sign grant agreement for @metrolosangeles Purple Line ext. to improve transportation infrastructure in LA http://1.usa.gov/1sVVzBT ,2014-05-21 22:18:45,1,1,469240909356630016
Proud to support bipartisan passage of #WRRDA today to create jobs & strengthen our nation’s #water infrastructure. http://1.usa.gov/1o3as7D ,2014-05-20 21:31:58,0,1,468866749941952512
Thank you @SanDimasChamber for hosting this morning's legislative forum. http://1.usa.gov/1hKkpiS pic.twitter.com/fDig7cXgU1,2014-05-13 21:28:11,1,0,466329079697145857
"Pleased to join my fellow GOP & Democratic colleagues in signing #WRRDA conf report, which addresses CA’s #drought.pic.twitter.com/p5uuZ5xQY2",2014-05-09 16:29:41,0,0,464804409403531264
Thx @RepPerlmutter @RepCardenas @RepMarciaFudge @RepBarbaraLee @RepSires wearing lime green to #EndStigma! #mhm2014pic.twitter.com/HvkFQkWhRJ,2014-05-08 21:12:20,4,4,464513154475905024
Thank you @JacksonLeeTX18 @CongressmanGT @repbenraylujan @RepRobinKelly @NydiaVelazquez @RepScottPeters! #mhm2014pic.twitter.com/RzFgepHr2u,2014-05-08 21:01:51,4,2,464510514035707904
Thx @dorismatsui @RepThompson @RepTimRyan @RepPaulTonko @BMarshall @MettaWorldPeace @MrsMichMarshall @JilldiamondWBC!pic.twitter.com/GJhm400thu,2014-05-08 20:52:11,2,2,464508080949301248
Thx to all who helped paint the Capitol lime green today for children's mental health awareness! #mhm2014 #EndStigma http://1.usa.gov/1kYXXqb ,2014-05-07 23:10:02,21,16,464180385514283008
"To see what mettaworldpeace bmarshall @MrsMichMarshall @jilldiamondWBC and I are doing today, follow… http://instagram.com/p/ntTraHvOKs/ ",2014-05-07 19:49:11,0,3,464129838899425280
"Children do not vote, so we are here today on behalf of them and their mental well being. #mhm2014 #EndStigma http://instagram.com/p/ntHocXvOJU/ ",2014-05-07 18:06:05,0,3,464103891786010624
Honored to receive World Boxing Council green belt & join these mental health champions in the fight against stigma! http://instagram.com/p/ns6uDwPOHm/ ,2014-05-07 16:19:49,0,1,464077151856128001
Painting the Capitol lime green for children's mental health #mhm2014 #EndStgma http://instagram.com/p/nsnIBRvOPZ/ ,2014-05-07 15:28:51,1,5,464064323724521472
Huge day for children's #mentalhealth awareness! Please follow my new Instagram account at http://instagram.com/repgracenapolitano … #mhm2014 #EndStigma,2014-05-07 12:41:53,1,5,464022306910900224
TMRW Press Conf w/ @MettaWorldPeace @BMarshall @MrsMichMarshall @JillDiamondWBC @NationalFFCMH #mhm2014 #EndStigmahttp://1.usa.gov/1hvkveb ,2014-05-06 20:21:07,7,10,463775487202844673
"W/ 50 months of job growth, #jobsreport shows strong progress. Now we must #raisethewage & #renewui to build an economy that works for all.",2014-05-02 15:02:45,3,5,462245815747362816
Very pleased to join my colleagues in celebrating Asian Pacific American Heritage Month this May! @CAPAC http://1.usa.gov/1lEr8j9  #APAHM2014,2014-05-01 21:03:15,1,2,461974152388550657
Thank you Pres. Obama @WhiteHouse for proclaiming May as National Mental Health Awareness Month #mhm2014 #EndStigma http://1.usa.gov/1fTBtCB ,2014-05-01 20:17:56,8,14,461962745681035265
Honored to present Gold & Silver @theaward Medalions to Kyle Kearney of West Covina today. http://1.usa.gov/1j27N8f pic.twitter.com/g3r0ut7PVd,2014-04-16 21:19:56,3,3,456542531602227201
Today we honor  some of the countless unsung heroines whose selfless acts help so many. http://1.usa.gov/1gSq5WR pic.twitter.com/4z3gmayzlP,2014-04-11 21:33:04,2,2,454733896840527873
Honored to receive Humane Award w/ so many of my colleagues. Thx @HumaneSociety for all your efforts #HumaneAwards http://1.usa.gov/1kvOt4g ,2014-04-03 21:02:39,2,2,451827140712226816
I signed the House petition to #demandavote on immigration reform. You can make your voice heard too: http://dems.gov/timeisnow/  #TimeIsNow,2014-03-26 15:53:37,3,4,448850267011051520
Thanks to all who came to Saturday's update on the EPA Superfund cleanup in Baldwin Park http://bitly.com/1iVKTBi  #clean #water,2014-03-25 00:00:13,0,1,448247949097988096
"Thx to @RepRoybalAllard, @Rep_JaniceHahn, @CityOfCommerce & others for a successful #WomenSucceed event on Saturday http://1.usa.gov/1jxTtoo ",2014-03-24 23:40:33,1,4,448242996883251200
"Join @Rep_JaniceHahn @RepRoybalAllard & me TOMORROW at our event When Women Succeed, America Succeeds #WomenSucceed http://1.usa.gov/1jhJrrg ",2014-03-21 19:10:06,0,3,447087775108825088
"Proud to introduce HR 4258, SECURE #Water Amendments Act w/ @RepHanabusa for increased conservation & sustainability http://1.usa.gov/1kRniEv ",2014-03-14 17:35:12,1,5,444527178248884225
I signed a petition today to #renewUI for #2million Americans who deserve a votepic.twitter.com/CYOJnjO4o4,2014-03-13 21:02:58,6,11,444217074320027648
Thank you @RepLowenthal @RepCardenas @LAAreaChamber @MWDSC for today's briefing on CA #water & #drought http://1.usa.gov/1fvsj2i ,2014-03-12 21:14:08,0,4,443857498471399424
RIGHT NOW LA Cong #water briefing broadcasting live athttp://bit.ly/1cTkTkJ ,2014-03-12 16:16:16,0,1,443782537060433920
Honored to join @SenGillibrand & @LATINAStyleMag Pres. Robert Bard at @STEMConnector @MillionWMentors kickoff todaypic.twitter.com/v3S7OgpbjM,2014-03-05 23:29:17,1,4,441354792254730241
Honored to join @repbobbyscott @RepRonBarber @RepPaulTonko @RepTimRyan @NACBHDD #EndStigma http://1.usa.gov/1q7a0Ey pic.twitter.com/FhPxrfXLbH,2014-03-05 19:17:32,2,3,441291438865666048
"Many thanks to @afspnational for being here yesterday. If you or someone you know needs help, call @800273TALKpic.twitter.com/XXjl1eCztn",2014-02-28 17:37:20,0,3,439454282459250688
"Yesterday, I signed the discharge petition on the House floor to raise the minimum wage. #raisethewage #timefor1010pic.twitter.com/Qx5zrM6a0Q",2014-02-27 22:02:29,3,6,439158620937154560
Congrats @usbr Commissioner Mike Connor on your unanimous confirmation as Deputy Secretary for Dept of @Interior!  http://1.usa.gov/1jE0UeG ,2014-02-27 20:43:57,0,1,439138857259630594
Thanks to @Johnny_Bench5 @SenLandrieu for support of Youth ChalleNGe program @NGYFoundation http://1.usa.gov/1jy9DPJ pic.twitter.com/yL7iwRLEKV,2014-02-25 23:58:45,0,1,438463107451453440
"We welcome rain, but ensuring safety is critical. Glendora & Azusa residents, for info on Colby Fire readiness visit http://www.ci.glendora.ca.us/residents/colby-fire-information …",2014-02-25 23:45:16,0,2,438459715191058432
Joined my colleagues in wearing red to raise awareness for heart disease. Will you go red for #WearRedDay on Feb. 7?pic.twitter.com/YB8Ofk6mTE,2014-02-06 19:54:17,2,5,431516216033701888
"Happy Lunar New Year! May we all be happy, prosperous, and healthy during this Year of the Horse.",2014-01-31 16:41:00,0,2,429293248335462400
Residential No-Burn Alert issued for all residents of LA Air Basin today. Visit http://www.aqmd.gov  for more info & sign up for updates,2014-01-30 18:42:09,0,2,428961348395888640
The Lilly Ledbetter Act was a strong step on our path to make equal pay a reality for all women. Thanks Lilly! #Lilly5,2014-01-29 21:39:19,5,7,428643545226813440
"Today, the # of Americans who have lost critical unemployment insurance = #1million600k. How many more before the GOP lets us #renewUI?",2014-01-24 18:06:54,3,9,426778147900518400
UPDATE: FEMA has approved California’s request for assistance and will reimburse up to 75% of firefighting costs #ColbyFire,2014-01-16 23:10:04,1,7,423955342049808384
"Mandatory evacuations all homes north of Sierra Madre, east of Azusa. Be safe. For more info, please follow @AzusaPOA & #ColbyFire",2014-01-16 18:57:27,0,4,423891769055387648
"Congrats to a strong Latina & Californian w/ San Gabriel Valley roots, Maria Contreras-Sweet, on nomination to lead @SBAgov",2014-01-15 22:13:18,1,1,423578666946158592
I stand with @HouseDemocrats & #FastForFamilies in asking GOP to bring #CIR to the Floor for a vote! #TimeIsNowpic.twitter.com/X7hPccYt1D,2013-12-12 22:27:54,0,2,411261152501301248
Thx to my colleagues & staff for attending #mentalhealth training today. Together we can #EndStigma & save lives http://1.usa.gov/1bz70pH ,2013-12-12 22:00:37,0,2,411254285402255360
Proud to welcome Brandon & Michi Marshall to our #MentalHealth Tsk Frce! @BMarshall http://1.usa.gov/1fkBu3w  #EndStigmapic.twitter.com/T9s3Vo1LcL,2013-12-11 20:39:29,2,4,410871480952422400
“There can be no keener revelation of a society's soul than the way in which it treats its children.” - Nelson Mandela,2013-12-05 22:36:39,1,0,408726641389494274
"So glad to visit w/ #MentalHealth Tsk Force mbr @jilldiamondWBC yesterday, a wonderful advocate for youth everywherepic.twitter.com/ADNqbBTEp2",2013-11-19 21:44:25,0,1,402915288821141504
So pleased the Obama administration issued final rule for #mentalhealth parity today! #EndStigma #MHPAEA #mhparity http://1.usa.gov/1aJDMK1 ,2013-11-08 20:14:08,2,7,398906303113740288
Thx @RepTimRyan @Action_Alliance @afspnational for military/vets suicide prevention briefing http://youtu.be/qS8DRR0Dsec  http://1.usa.gov/1hrqWBj ,2013-10-29 23:21:07,0,2,395329479653855232
My opening statement from today's #Water & Power Subcommittee hearing: http://youtu.be/THogJcTDNYk  http://1.usa.gov/1dnds7g ,2013-10-29 23:02:58,0,0,395324913952645120
I am broadcasting live at http://ustre.am/z6Zz  come and check it out!,2013-10-29 18:38:39,0,0,395258392945504256
RIGHT NOW @Action_Alliance for Suicide Prevention & @afspnational Mil/Vets MH briefing broadcasting live at http://ustre.am/z6Zz ,2013-10-29 18:36:26,0,1,395257837951000576
So proud to welcome @Arjay_Smith to our #MentalHealth Task Force! http://1.usa.gov/1gY6tGK  #EndStigmapic.twitter.com/O1vIQ9DTbp,2013-10-29 16:15:54,1,2,395222458573148161
Last night I voted to reopen govt & avert default #TimeisNow to pass #CIR create #jobs #infrastructure & grow economy http://on.fb.me/1bZCsUB ,2013-10-17 16:58:46,0,0,390884603751174144
We must open the government immediately http://1.usa.gov/19Isz8r  #EnoughAlready,2013-10-16 14:59:00,0,0,390492076866957313
My opening statement from last wk's #Water & Power Subcommittee hrng: http://youtu.be/DHHdGCXNUJU  Let's reopen the govt & get people back to work,2013-10-14 22:38:27,0,1,389882925790928896
Today is World Mental Health Day. Together we can #EndStigma & save lives! #WMHD2013 http://1.usa.gov/1cAXSqv ,2013-10-10 22:27:23,0,5,388430587955908608
Today is 10/10 and I am proud to support HR 1010 that will #RaisetheWage to $10.10 an hour. #Timefor1010,2013-10-10 14:11:18,0,0,388305744950349824
"If there is a shutdown, our District & DC offices will remain open, but we are hopeful that we can reach a resolution http://1.usa.gov/18mcTZd ",2013-09-30 23:43:51,0,0,384825954633150464
The #TimeIsNow to pass #comprehensive #immigration #reform!http://www.sgvtribune.com/opinion/20130920/celebrate-hispanic-heritage-month-by-passing-immigration-reform-opinion …,2013-09-23 21:46:02,1,10,382259587950198784
Voted no on GOP bill to cut $40 billion from #SNAP. We must ensure food aid for those who need it most #SaveSNAP http://1.usa.gov/18ew99J ,2013-09-19 22:59:38,4,9,380828557590556672
As we honor MLK's dream today may we renew our commitment to fight for equality for all #mlkdream50 #MOW50,2013-08-28 19:31:06,0,3,372803547525427201
Thx all who participated in the Southern California #water workshop. Together we can build a sustainable water future http://1.usa.gov/14CqsWf ,2013-08-09 17:16:03,0,0,365884190094401536
Offered amdt for @USGS study effects of oil shale development on CO River. GOP opposed. We must protect #water supplyhttp://bit.ly/1aJpHtd ,2013-07-24 22:36:25,0,1,360166609572208640
RIGHT NOW National @Action_Alliance for Suicide Prevention briefing broadcasting live at http://ustre.am/z6Zz  #mentalhealth #EndStigma,2013-07-24 19:05:55,1,2,360113632509558784
"With HHS Sec. Sebelius, Rep. Murphy, NAB Pres & CEO Gordon Smith & Sen. Stabenow at #OK2Talk PSA launch! #EndStigmapic.twitter.com/OyoDe1Z2Ux",2013-07-23 15:49:59,2,6,359701935802171397
Nelson #Mandela is such an inspiration to us all. Celebrating his 95th birthday and wishing him well #MandelaDaypic.twitter.com/QUIxgLYRHt,2013-07-18 15:16:25,0,3,357881548479021057
So pleased to receive the #NationalParkFriend award from @NPCA. We must continue to preserve our nation's treasures.pic.twitter.com/GJQG8j87x6,2013-07-17 19:39:49,4,4,357585449881071616
Billions of dollars' worth of CA transportation projects continue without delay thanks to DOT @SecretaryFoxx http://1.usa.gov/12koiDS ,2013-07-11 21:04:14,1,2,355432367990652928
Joining my @HispanicCaucus colleagues today to meet w/ President Obama on comprehensive immigration reform #CIR #TimeisNow,2013-07-10 14:49:33,0,0,354975687582552064
Glad the Senate passed #CIR bill today. Now it is the House's turn to get it done! http://1.usa.gov/1100V7h pic.twitter.com/ymV3S4r8aQ,2013-06-27 22:40:29,0,0,350383158090428416
7PM TONIGHT! @CWSoftballGame http://www.congwomensoftball.org/  #CWSG I play because we need ALL to be survivors!pic.twitter.com/SyDKEUtsiV,2013-06-26 18:01:34,0,2,349950577184231424
We must replace hatred w/ love & acceptance. Proud to support #MarriageEquality & equal rights for all #NOH8ontheHillpic.twitter.com/gtRM8miSeR,2013-06-26 14:33:30,17,26,349898217942556672
So pleased that #SCOTUS has struck down #DOMA. This is a big step toward #MarriageEquality,2013-06-26 14:27:14,2,5,349896639957311489
Proud to stand w/ my colleagues for marriage equality & equal rights for all! #NOH8ontheHillpic.twitter.com/xRd2Ujvjch,2013-06-13 16:52:52,65,55,345222247759364098
Spoke on the floor this morning for May #MentalHealth Awareness Month http://youtu.be/v1Dg9pNbjlg  #EndStigma #mhm2013,2013-05-23 13:44:10,1,6,337564616890667008
Speaking in a few minutes on the floor of US House of Reps. on May Mental Health Awareness Month http://houselive.gov/  #EndStigma #mhm2013,2013-05-23 13:14:10,3,2,337557066157789186
MT @activeminds_gwu: 1 of our co-presidents is speaking on a mental health panel hosted by Rep. @gracenapolitano 5/22 @ 1:30. Cannon 121,2013-05-22 16:41:50,0,3,337246939202592768
"Thanks to @MiaStJohnBoxer,  #MentalHealth Task Force Member, for continuing to raise awareness & #EndStigma #mhm2013pic.twitter.com/uk43cOUjYs",2013-05-21 21:16:03,1,8,336953556370345984
"Thanks @jilldiamondWBC, member of #Mentalhealth Task Force, for your work to raise awareness & #EndStigma #mhm2013pic.twitter.com/anxrb1F57J",2013-05-16 20:30:19,1,6,335130111315673089
Proud to work w/ my friend & former colleague @PJK4brainhealth on #mentalhealth to #EndStigma & save lives! #mhm2013pic.twitter.com/sphkBpaxuT,2013-05-16 19:47:11,0,0,335119255475458048
"Proud of @MettaWorldPeace, a wonderful friend/advocate for #mentalhealth http://1.usa.gov/144h5KF  #EndStigma #mhm2013pic.twitter.com/cNWkAE8C3G",2013-05-15 21:44:04,28,60,334786281089425409
Mental health affects us all. MT @PJK4brainhealth #MH in the AAPI community: http://1.usa.gov/17ebV2v  @whitehouse #APAHM2013 #mhm2013,2013-05-15 16:40:07,1,5,334709791379320832
Today is Natl Children's MH Awareness Day. Honored to recognize it w/ so many colleagues & MH advocates on Tuesday http://on.fb.me/15Q7JGn#mhm2013 ,2013-05-09 21:40:51,3,9,332611146840436736
Pleased to co-host Mental Health First Aid training today w/ @RepRonBarber and @RepLynnJenkins http://1.usa.gov/10j8lvt  #EndStigma #mhm2013,2013-05-08 22:31:13,2,3,332261432185995264
Proud to join my CAPAC colleagues at Congressional Ceremony for APA Heritage Month today! Follow @CAPAC #APAHM2013pic.twitter.com/UlvGJqXK6b,2013-05-08 22:24:06,0,2,332259640668729344
Thanks to @MentalHealthAm @NAMICommunicate @BazelonCenter @NationalFFCMH @AACAP for yesterday's briefing #mhm2013pic.twitter.com/bLzy7TZuii,2013-05-08 16:17:05,1,4,332167278164586496
Great partnering w/ @NationalFFCMH for Children's Mental Health Awareness Day photos! #EndStigma #mhm2013pic.twitter.com/3G35vmUMlB,2013-05-08 16:09:58,1,9,332165486651506691
Many thanks to all who participated in Nat'l Children's MH Awareness Day http://1.usa.gov/10nT2Cs  #EndStigma #mhm2013pic.twitter.com/yfQUhqXsk8,2013-05-07 23:42:38,2,5,331917016913043456
We painted the Hill green today for children's mental health @RepLujanGrisham @RepSpeier @RepThompson @RepSheaPorterpic.twitter.com/MTUVRh9r7Z,2013-05-07 20:25:39,1,5,331867442978643968
Thanks to my colleagues for supporting children’s mental health @RepLujanGrisham @RepSpeier @RepThompson #mhm2013,2013-05-07 19:33:26,3,3,331854306703712256
Thanks to my colleagues for supporting children’s mental health @RepMcLeod @RepJudyChu @WhipHoyer @RepSheaPorter @CongressmanGT #mhm2013,2013-05-07 19:17:07,0,3,331850199720923137
Many thanks to my colleagues for supporting children’s mental health @RepLoisCapps @JacksonLeeTX18 @SanfordBishop @RepKirkpatrick #mhm2013,2013-05-07 19:13:09,2,3,331849202051215360
Many thanks to my colleagues for supporting children’s mental health @Rep_Albio_Sires @RepBera @RepCardenas @RepTimRyan @paultonko #mhm2013,2013-05-07 19:11:36,0,1,331848812278714369
"Green to support children’s mental health. Together we can #EndStigma, raise awareness, and save lives! #mhm2013pic.twitter.com/rewEuziEQ0",2013-05-07 19:03:51,3,8,331846857607237632
Tomorrow: briefing for Children's Mental Health Awareness Day. Wear green to support #mentalhealth http://1.usa.gov/15t37FL  #mhm2013,2013-05-06 21:36:14,2,7,331522818980335618
May is Asian Pacific American Heritage Month! Proud to represent APA communities in our San Gabriel Valley http://1.usa.gov/16oKGle  #APAHM2013,2013-05-01 19:40:14,0,9,329681688076619778
I applaud @BarackObama for being 1st president to proclaim May as National Mental Health Awareness Month! http://1.usa.gov/11XsQAm  #mhm2013,2013-05-01 16:17:49,9,37,329630747453452288
May is National #MentalHealth Awareness Month! Use hashtag #mhm2013 to learn about events and activities going on across the country,2013-05-01 15:25:34,3,5,329617599384129536
"Senate bill is critical step forward. Now is the #RightTime to pass true, comprehensive immigration reform! http://1.usa.gov/10hYyN6 ",2013-04-17 21:50:47,0,1,324641111299747840
"Famous “whistleblower” in DC. Met w/ Whistling Diva, Carol Kaufman of Monrovia, on way to NC to compete. Good luck!pic.twitter.com/JCtuxp7Lo7",2013-04-16 22:45:00,1,0,324292368910151680
"Thoughts & prayers go out to all the victims, their loved ones, and the entire #Boston community.",2013-04-15 22:48:31,0,3,323930865933639680
"Sad to say goodbye to a great community leader and activist. Rest in Peace, Helen http://1.usa.gov/ZrhjGD ",2013-04-12 20:53:33,0,0,322814771000930304
Proud to cosponsor HR 377 Paycheck Fairness Act and support equal pay for equal work #EqualPayDaypic.twitter.com/6EfAR1YAul,2013-04-09 14:09:01,3,4,321625801319669760
Today is #WorldWaterDay. We must work together to improve access to clean #water and conserve this precious resourcehttp://bit.ly/WZebXK ,2013-03-22 15:31:36,0,6,315123605396672513
"Today, I voted against unbalanced #GOPbudget that ends Medicare while protecting wealthiest individuals #JobsNotCuts http://1.usa.gov/Yuf0mt ",2013-03-21 18:28:38,1,3,314805767104512001
Deeply concerned w/ our children's physical & mental well-being and proud to support the Safe Schools Improvement Act #stopbullyingnow,2013-03-15 15:44:40,1,9,312590178776666113
Happy International Women's Day to all the unsung heroines everywhere! #IWD,2013-03-08 16:48:49,0,4,310069607262212096
"We must pass a strong #VAWA to ensure the safety and protection of our mothers, wives, sisters, and daughters.",2013-02-28 15:12:14,7,16,307146196236005378
@gracenapolitano @mettaworldpeace @repthompson @repronbarber @repbobbyscott Video of press conf: https://demsgov.box.com/s/0gs61z54n8q1a2gr1ec4 …,2013-02-15 22:47:51,1,5,302549815684894720
Thx to @MettaWorldPeace @RepThompson @RepRonBarber @repbobbyscott for promoting #mentalhealth & reducing #stigmahttp://1.usa.gov/YkJc3W ,2013-02-15 20:40:55,5,20,302517870024327168
HAPPENING NOW Press Conf w @MettaWorldPeace on #mentalhealthpic.twitter.com/WwgEpJTA,2013-02-15 16:48:08,2,3,302459285756063746
UPDATED LOCATION - TMRW Press Conf w/ @MettaWorldPeace on Mental Health in Schools Act #mentalhealth Reduce #stigmahttp://1.usa.gov/Vi3RJI ,2013-02-14 23:45:52,0,2,302202028099248128
"Proud to reintroduce Mental Health in Schools Act. Join @alfranken and me, let's pass it today! #mentalhealth #stigmahttp://1.usa.gov/12h0epp ",2013-02-13 23:35:20,1,2,301836987730624513
My response to last night's #SOTU Need dialogue on #mentalhealth reduce #stigma Must pass #CIR now http://1.usa.gov/XyiWFh ,2013-02-13 17:48:50,1,9,301749789551374337
"Today, Gun Violence Prvntn Tsk Frce & @HouseDemocrats released policy proposals. #Mentalhealth #stigma #NowistheTime http://1.usa.gov/VH2nDA ",2013-02-07 21:57:28,0,7,299638033387491328
"Celebrating 2 decades of workers having leave to care for themselves, sick family members, or new children Happy 20th #FMLA! #FMLA20",2013-02-05 23:56:15,0,1,298943147969503232
Thx to the President and @HispanicCaucus for leadership on comprehensive #immigrationreform #TimeisNow,2013-01-29 20:54:54,1,5,296360797049847808
@MikeTyson Thx so much for support for Mental Health in Schools Act. Pls send contact info so we can work together to advance this goal!,2013-01-25 19:08:29,0,0,294884465749143552
Proud to serve on Resources @NRDems & Transportation @HouseTransInf Committees in Congress #water #transportation http://1.usa.gov/XDi6Uh ,2013-01-24 23:03:19,0,5,294581175043903488
Thx to all who came to #mentalhealth briefing yesterday. Together we can increase awareness and reduce #stigma http://1.usa.gov/10KnTxU ,2013-01-23 23:08:23,14,30,294220059600121856
