Text,Date,Favorites,Retweets,Tweet ID
It is time for AG Sessions to address the very serious evidence that Mr. Bharara’s firing was a politically motivated attempt to stop...,2017-04-04 19:04:01,15,11,849336773104865280
..into the secretary’s questionable stock trades only adds to this controversy.,2017-04-04 19:02:01,4,3,849336271617097728
The abrupt firing of former U.S. Attorney Preet Bharara while he was reportedly conducting an investigation...,2017-04-04 19:01:01,7,4,849336019921010688
The questions surrounding Secretary Price have only grown since he joined the Trump cabinet.,2017-04-04 19:00:02,11,6,849335771408375808
Here’s how the @HouseGOP wasted your time & taxpayer money this week:pic.twitter.com/291xNmKSBk,2017-03-31 20:00:01,38,35,847901315543977986
Enjoyed reading today’s @DandC! I'll always be a proud advocate for arts programs across the country & in #ROC!http://on.rocne.ws/ ,2017-03-30 16:51:29,22,7,847491480243494913
"I’m proud to #StandWithPP, which services 2.5 million people—men & women—each year. Thanks, @PPFA for all that you do!",2017-03-29 15:58:38,24,6,847115792625942529
"..the very real issues facing our country, @HouseGOP is working to eliminate privacy protections for the American people.",2017-03-28 18:48:00,10,7,846796028258873344
"Now more than ever, our personal data is vulnerable and it is deeply troubling that instead of addressing…",2017-03-28 18:46:01,8,4,846795529610768384
I would never support this kind of giveaway to internet service providers at the expense of your privacy.,2017-03-28 18:45:02,26,7,846795280615903232
.@HouseGOP are moving quickly and quietly under the CRA in the hopes the American people won’t notice.,2017-03-28 18:44:00,6,6,846795021831450624
Every single American who uses the internet would be impacted.,2017-03-28 18:43:00,4,1,846794770340966401
.. collected through your internet use & sell it without your consent.,2017-03-28 18:42:00,4,1,846794519538388992
"This would allow internet service providers to access your private browsing history including SSN, personal finances & health data...",2017-03-28 18:41:00,7,2,846794267133526016
"Today, @HouseGOP will use the #CRA to roll back an @FCC safeguard designed to keep your internet browsing history private.",2017-03-28 18:40:01,4,3,846794018323386372
Today's @nytimes article highlights what I've been saying for years: we must protect federally-funded arts programs.http://nyti.ms/2ouoSRj ,2017-03-28 15:24:06,11,4,846744716498653185
This bill deserves not only to be pulled from the floor today - it should be scrapped once and for all.,2017-03-24 20:45:13,64,12,845375974103494656
"A bad process begets a bad product – and both this process, and this product could not have been worse.",2017-03-24 20:44:48,18,5,845375871452151808
by bringing this bill to the floor just hours after releasing the final text late last night.,2017-03-24 20:44:25,4,1,845375773611626497
".@HouseGOP tried to jam this bill through the House without holding a single hearing, w/out waiting for a nonpartisan @USCBO analysis, and..",2017-03-24 20:44:09,15,3,845375705840074754
"All the while, it would steal from Medicare, shorten the life of the Medicare Trust Fund & ransack the funds that seniors depend on for care",2017-03-24 20:43:23,11,4,845375512449093632
"emergency services, maternity care, and prescription drugs.",2017-03-24 20:42:50,5,3,845375377493164032
"This legislation would've also killed the requirement for insurance companies to offer Essential Health Benefits, including...",2017-03-24 20:42:33,7,3,845375302620659714
"and those aged 50 to 64 would have faced a crushing age tax, paying five times more for premiums.",2017-03-24 20:42:09,7,5,845375203907702784
"24 million people would have been pushed off their health insurance, families would have had to pay higher premiums and deductibles..",2017-03-24 20:41:50,13,3,845375122085203969
"This decision is a win for the American people, who would have been devastated by this bill.",2017-03-24 20:41:15,53,14,845374978455416834
It turns out that the president who wrote the book on deal making couldn’t close this deal.,2017-03-24 20:40:58,79,21,845374905034199040
"The vote on #AHCA shouldn’t just be delayed, it should be scrapped indefinitely. The bill is a disaster.",2017-03-23 21:00:41,43,13,845017479583817728
"I'm outraged by @HouseGOP's decision to decimate & replace the #ACA w/ a far-worse, half-baked option & will continue to voice my opposition",2017-03-23 16:23:19,29,8,844947678677127168
"Instead of working to strengthen this landmark law, @HouseGOP could bring their repeal bill to the floor for a vote as early as today.",2017-03-23 16:23:04,4,2,844947615833821184
"in providing high-quality, affordable coverage to more than 20 million people nationwide.",2017-03-23 16:22:45,6,1,844947536087519232
I was proud to bring the #ACA to the floor in 2009 as Chairwoman of the Rules Committee & have been impressed by the strides we have made..,2017-03-23 16:22:31,14,2,844947476536868865
Today marks the 7th anniversary of the signing of the #ACA.,2017-03-23 16:22:10,8,2,844947386673909761
"The Republican bill cuts care for families to give out a tax cut to the wealthy, which is why I’m fighting against it.",2017-03-22 20:03:01,18,3,844640577777893376
This bill is scheduled to be voted on tomorrow. I hope the speaker reads what you have to say before this vote.,2017-03-22 20:02:00,7,1,844640324777488385
Today I delivered those stories to @SpeakerRyan so he could hear directly from you what’s at stake with #TrumpCare.,2017-03-22 20:01:01,7,1,844640077699534848
"The past several months, I’ve asked #ROC families to submit stories about how the #ACA has helped them.",2017-03-22 20:00:01,0,0,844639823377911810
"I will continue to advance this bill, so that the American public can rest assured knowing #SCOTUS is held to the highest ethical standards.",2017-03-21 20:59:01,9,5,844292285684690945
"My bill, the Supreme Court Ethics Act, would require justices adopt the same code of conduct required by every other fed. Judge in the USA.",2017-03-21 20:58:00,21,9,844292028867362816
For years SCOTUS justices have undermined public confidence—attending political events & failing to disclose potential conflicts of interest,2017-03-21 20:57:00,9,12,844291777951547392
I wrote to the @senjudiciary & asked that they question #Gorsuch on requiring #SCOTUS to adopt a binding code of ethics for justices.,2017-03-21 20:56:01,11,8,844291530194124806
"As a Member of the House I don’t vote on #SCOTUS nominees, but I strongly believe #Gorsuch is the wrong choice.",2017-03-21 20:55:01,30,18,844291276312788992
"If Rep. Collins thinks that’s a good deal, he’s not a very good businessman or representative for our state.",2017-03-21 17:58:01,40,11,844246734620561408
"With this amendment, they would be sending our state a $4.7 billion bill.",2017-03-21 17:57:00,8,4,844246478742683648
"Either way, the @HouseGOP is proposing New Yorkers pay for their terrible plan.",2017-03-21 17:56:00,5,1,844246227881349120
if Republicans steal billions from NY to pay for tax cuts for the wealthy it doesn’t matter if taxpayers have to cover the cost.,2017-03-21 17:55:00,7,5,844245976210583552
Shifting the local cost share to the state is a political sleight of hand..,2017-03-21 17:54:01,11,1,844245726385209344
The overall Medicaid plan would cost New Yorkers billions of dollars of lost federal funds and jeopardize hospital stability.,2017-03-21 17:53:00,8,4,844245472801771520
".. devastate our state, especially upstate rural areas.",2017-03-21 17:52:00,3,3,844245221978193920
"It's a gimmick, & nothing more than pure political cover for wavering NY Republicans that know the @HouseGOP healthcare plan would...",2017-03-21 17:51:00,12,3,844244970110296064
I strongly oppose the backroom deal announced late last night by Chris Collins that was added to the @HouseGOP health care repeal bill.,2017-03-21 17:50:01,32,15,844244721765666817
POTUS’ elimination of #GLRI is outrageous & I'll continue to fight to ensure that his budget proposal does not become a reality.,2017-03-17 19:46:08,21,8,842824391062962176
"26 million in our region depend on the #GreatLakes for commerce, transportation & recreation each year.",2017-03-17 19:45:13,6,4,842824161668096001
"As Co-Chair of the bipartisan Great Lakes Task Force, defending our lakes has been one of my top priorities.",2017-03-17 19:44:48,17,5,842824053954101257
"POTUS’ dangerous budget proposal would eliminate #GLRI, which fights invasive species, reduces pollution & protects our lakes.",2017-03-17 19:44:17,8,3,842823925251891200
We must break the stranglehold the pharmaceutical industry & corporate agriculture have on our public health policy & finally pass this bill,2017-03-15 21:00:26,18,5,842118312096063496
It's beyond time for meaningful action to protect the public health & stop this in its tracks.,2017-03-15 20:59:45,12,2,842118141803155457
"All the while, the consequences have continued to grow, with the discovery last year of an antibiotic-resistant superbug in the US",2017-03-15 20:59:15,6,3,842118014728298503
"Although I have been sounding the alarm for years, many leaders have failed to take this threat seriously.",2017-03-15 20:58:26,8,4,842117809693970433
This is 40th year since @US_FDA acknowledged the threat of antibiotic-resistance & called for reduction in the use of antibiotics in animals,2017-03-15 20:58:01,14,7,842117706618933248
PAMTA would prevent a nightmarish post-antibiotic future & preserve the use of antibiotics for sick humans & animalshttp://bit.ly/2mui05N ,2017-03-15 20:57:30,7,9,842117574624194560
"As the only microbiologist in Congress, I'm so proud today to introduce the Preservation of Antibiotics for Medical Treatment Act (PAMTA).",2017-03-15 20:56:15,43,17,842117262526025728
"Proud to receive a perfect rating from @Defenders & @LCVoters—I have, & will always be, a proud advocate for our environment.pic.twitter.com/F7KNU1QDOx",2017-03-15 18:02:00,19,5,842073410515558404
"For a full report of the disastrous impacts an #ACA repeal would have on #ROC, please visit my site: http://bit.ly/2mTJZPb ",2017-03-14 19:01:00,5,5,841725870184177664
"Under @HouseGOP's health care plan, employer-based coverage would be eroded & 177 million would lose their protections. Shameful.",2017-03-14 16:38:00,12,6,841689883370389504
We should be improving the #ACA instead of rushing this bill through just to try and fulfill a political talking point.,2017-03-13 22:05:08,32,13,841409822398517250
.. that the @HouseGOP repeal bill would give a tax break to the wealthy and leave families struggling to afford coverage.,2017-03-13 22:04:32,10,4,841409668224290816
.@USCBO confirmed what many experts and those in the industry have said from the beginning...,2017-03-13 22:04:13,5,6,841409588771602433
"Although the Republicans are claiming otherwise, the Congressional Budget Office is non-partisan, objective, and unbiased.",2017-03-13 22:03:25,37,13,841409388887851010
That number doesn’t even reflect the millions more would be left with worse coverage and fewer benefits at a higher cost.,2017-03-13 22:02:59,16,4,841409278728638465
This analysis has found that the @HouseGOP plan would cause 24 million people to lose their health insurance over the next ten years alone.,2017-03-13 22:02:30,8,3,841409155969753088
.@USCBO analysis makes clear why Republicans were skipping the hearing process and rushing this bill through.,2017-03-13 22:02:07,10,6,841409063263035396
I hope @HouseGOP follows through w/ @WhiteHouse's promise of an open rule for #TrumpCare!,2017-03-10 22:06:00,9,5,840322877027209216
"There hasn’t been an open rule under @SpeakerRyan's leadership, w/ @HouseGOP already on pace to break the all-time record for closed rules.",2017-03-10 22:06:00,12,8,840322876179849218
That’s why it's even more important that all Members are able to offer amendments on the floor though an open rule,2017-03-10 22:05:01,11,4,840322627055034370
We haven’t even received a budget score from @USCBO making clear how much the plan would cost & how it would impact our insurance markets,2017-03-10 22:04:01,16,9,840322376071962624
"The @HouseGOP is pushing this bill through, skipping the hearing process & failing to hear from experts, doctors, & those battling illnesses",2017-03-10 22:02:01,17,9,840321871123963904
I welcome Congressman Jim Jordan’s request for an open rule on the @HouseGOP’s health care repeal bill.,2017-03-10 22:01:01,12,7,840321620514373633
.@USCBO How will #TrumpCare affect the growth rate of health care prices? #NoScoreNoVote,2017-03-10 18:45:00,17,8,840272292680736768
.@USCBO #TrumpCare defunds @PPFA. How will this affect women’s access to family planning? #NoScoreNoVote,2017-03-10 18:36:01,4,2,840270029429989376
.@USCBO How many fewer people will receive treatment for mental health under #TrumpCare? #noscorenovote,2017-03-10 18:20:01,20,11,840266004152365056
.@USCBO How much do you expect deductibles to increase under #TrumpCare? #noscorenovote,2017-03-10 18:15:01,11,6,840264745877925891
".@HouseGOP is rushing #TrumpCare through without a @USCBO cost estimate, a dangerous move that leaves many questions unanswered.",2017-03-10 18:00:03,13,12,840260979527098368
So pleased to have had the chance to meet with representatives from the @UofR this week!pic.twitter.com/mOJkZySpSd,2017-03-10 17:24:56,12,1,840252140878778369
"For those in #ROC who are still without power, here is an updated list of open shelters & services in the region:http://on.rocne.ws/2mLzLRt ",2017-03-09 20:15:24,9,13,839932653222707200
Proud to gather my bipartisan colleagues from the NY cong. delegation & @KathyHochul this week to discuss top priorities for our state!pic.twitter.com/J9CdmXxlDw,2017-03-09 17:15:00,8,1,839887256433340416
Stay safe & stay alert in #ROC tonight.https://twitter.com/DandC/status/839638122480619521 …,2017-03-09 01:49:03,6,0,839654232131272705
".@HouseGOP's efforts will turn back the clock, undermine GINA & make it easy for employers to access employee’s personal information.",2017-03-08 23:09:41,9,5,839614123671498754
GINA allows people to take advantage of the potential of genetic research w/out worrying  this info will cost them their job & health care.,2017-03-08 23:08:55,6,4,839613931593347072
"None of us were born with perfect genes, it affects us all.",2017-03-08 23:08:23,9,2,839613797253931010
I fought for 14 years to pass GINA so Americans no longer had to fear their genetic info would be used against them.http://bit.ly/2n0jWXu ,2017-03-08 23:07:53,12,7,839613672267841537
"Today, @HouseGOP considered HR 1313, which would give employers access to the genetic & medical info of employees & their families.pic.twitter.com/nrhxvNJPLb",2017-03-08 23:07:09,10,20,839613488523771904
"I’m a proud #AdvocateForArthritis and especially @teamSophieJIA, who stopped by my office yesterday to talk about their important cause!pic.twitter.com/4sZa2hU1Ek",2017-03-08 21:08:07,26,5,839583531248545794
"I recently had the chance to meet with some young entrepreneurs from @girlscoutswny —needless to say, the thin mints won me over!pic.twitter.com/wTAyOxO04H",2017-03-08 20:30:01,9,2,839573942847275008
"Today the Rules Committee will consider HR 720 & HR 985, dangerous @HouseGOP bills that would take a sledgehammer to civil justice.",2017-03-08 19:55:01,7,7,839565135723147264
Today we celebrate #InternationalWomensDay & the enormous impact women have on our economy and our country.pic.twitter.com/0lS49b40NO,2017-03-08 19:28:51,20,5,839558550976344064
"After wasting millions on dozens of votes to undermine the #ACA, @HouseGOP finally released a bill. Not the headlines they were hoping for.pic.twitter.com/HbnETpAszr",2017-03-08 14:40:01,22,14,839485864099008514
POTUS’ baseless claims about former President Obama’s “wiretapping” are just absurd:pic.twitter.com/qancgUOeFA,2017-03-07 21:44:36,22,8,839230325972688897
Proud to stand @MCCPresident in pushing POTUS to invest more resources in optics and photonics to train the next generation workforce.pic.twitter.com/cwNJ1HfPej,2017-03-07 19:31:23,7,4,839196799046942720
"I'm proud to be the original co-author of #VAWA, and will continue to advance legislation that protects survivors & prevents domestic abuse.",2017-03-07 14:36:00,19,7,839122465683091458
"3 years ago today, #VAWA was expanded to include protections for Native American women, the LGBTQ community, college students, & immigrantspic.twitter.com/EFzvlMjOTP",2017-03-07 14:35:01,24,8,839122217837309952
Despicablehttp://on.rocne.ws/2n9V9w6 ,2017-03-07 12:37:31,6,4,839092645955764225
"POTUS’ budget cuts would be devastating for our #GreatLakes, the largest source of drinking water on the planet.http://on.rocne.ws/2mN6JBj ",2017-03-06 21:45:01,16,17,838868042738253824
"This is an immoral attempt to fulfill a campaign talking point, not about keeping our country safe.",2017-03-06 17:25:34,89,25,838802749777137664
No immigrant from any of the countries included in this ban has ever killed an American in a U.S. terrorist attack.,2017-03-06 17:24:45,245,155,838802545330044928
"This order still bans travel from several Muslim nations, suspends our refugee program, & makes our country less safe.",2017-03-06 17:24:03,17,9,838802369353768961
"POTUS just signed his latest executive order, a dangerous attempt to get his de facto Muslim ban through the courts.",2017-03-06 17:23:30,12,4,838802231856152577
Jonathan’s story is one example of the devastating affects a repeal of the #ACA would have on families nationwide:pic.twitter.com/k0VUTqNl6q,2017-03-06 15:13:10,7,5,838769431937449985
It’s been a busy week in D.C. advocating for the issues that matter most to my constituents!pic.twitter.com/nfx1TtMvjz,2017-03-03 19:11:52,17,4,837742338449506304
"AG #Sessions lied, violated the public’s trust. We can’t say we weren’t warned: http://bit.ly/2iZwpWu pic.twitter.com/qvAUYQ7qZl",2017-03-02 20:06:50,32,16,837393781318123524
"It's beyond time to form an independent commission to uncover the extent of Russia's financial, personal & political grip on this admin.",2017-03-02 16:49:01,36,18,837344001527250944
…the unanswered questions are growing more urgent by the day.,2017-03-02 16:48:02,16,6,837343754948325376
Whether it's the scandals surrounding the #AG or former Security Advisor Flynn or the fact POTUS still refuses to release his taxes..,2017-03-02 16:47:25,16,7,837343596437254144
Simply recusing himself from a possible investigation into this administration’s troubling ties to Russia is not enough.,2017-03-02 16:46:00,24,9,837343242697859073
AG #Sessions lied under oath during his confirmation hearing. He lacks credibility & the public's trust. He must resign immediately.,2017-03-02 16:45:38,40,15,837343149869707270
I recently spoke about POTUS’ outrageous plan to eliminate @NEAarts & @NEHgov. I've always advocated for the arts & I won't stop now!pic.twitter.com/Qn489EXqas,2017-03-01 22:21:41,62,12,837065331776569345
So pleased to have the chance to speak with Brighton's Jonathan Siegel before we attend the president's address to Congress. #ROCpic.twitter.com/CZ6UfGm7EX,2017-02-28 23:04:16,8,1,836713659669827584
"Before each #SOTU, I ask the bipartisan NY delegation to come together for a group photo. The tradition continues!pic.twitter.com/vT4P4iMPoC",2017-02-28 20:05:27,23,5,836668658034302976
"I am dismayed by the @HouseGOP’s refusal to look into this, but I will keep pushing to get the American people the answers they deserve.",2017-02-28 16:50:01,24,11,836619477995368449
"I believe a bipartisan, 9/11-style commission must be formed to investigate Russia’s influence on the Trump Admin. and the 2016 election.",2017-02-28 16:47:00,47,15,836618718884945920
Recent reports that the president’s top adviser directed FBI agents to rebut news reports about Trump allies’ ties to Russia is outrageous.,2017-02-28 16:46:01,20,10,836618469776883713
"The constant drip, drip, drip of information regarding POTUS' ties to Russia remains deeply concerning.",2017-02-28 16:45:01,30,11,836618217346904064
Republicans failed to rise to the occasion & enabled President Trump's unprecedented secrecy by voting down this resolution. It is shameful.,2017-02-28 14:13:51,28,17,836580174305062912
No president in modern times has refused to show his tax returns to the American people.,2017-02-28 14:13:22,25,23,836580053018423300
Last night’s vote on H Res 111 that I cosponsored was the House's first chance to go on record in support of POTUS releasing his tax returns,2017-02-28 14:12:31,29,5,836579838349705216
#rocstation will reduce regional delays & help move goods & people more efficiently. I look forward to cutting the ribbon later this year!,2017-02-24 17:02:01,15,3,835172944670240769
"In 2014, I secured the funding through the highly competitive @USDOT TIGER program to make the new #rocstation possible.",2017-02-24 17:01:01,7,2,835172693401980929
I was so pleased to tour the new #rocstation yesterday with local construction crews and our partners at @NYSDOTRochester!pic.twitter.com/e1NbEZreoe,2017-02-24 17:00:03,7,1,835172451696984067
I’ve sounded this alarm for years & am pleased @TysonFoods will rid their branded poultry of antibiotics by June. http://bit.ly/2l0bYYR ,2017-02-22 21:51:01,22,9,834520897860034570
"This week, I took to the House Floor to set the record straight on federal funding for @PPFA:pic.twitter.com/7WJ5TeYI1Q",2017-02-17 15:33:59,24,12,832614074097737728
Just another day with President Trump:http://politi.co/2kuWlgZ ,2017-02-16 22:28:34,18,8,832356023071420416
This troubling report is another indication of the very real effects of @POTUS' harmful immigration policy:http://wapo.st/2kWIgHA ,2017-02-16 16:58:44,11,8,832273016079994881
The @POTUS should nominate someone to lead the Labor Department who actually believes in supporting our workforce.,2017-02-15 22:23:01,35,9,831992234853675014
"Like the majority of @POTUS's other nominees, Puzder’s record raised doubts about his ability to address the issues facing average Americans",2017-02-15 22:21:00,13,6,831991730295623680
"From the moment he was first nominated, it was glaringly obvious that #Puzder was not the right person to lead the Department of Labor.",2017-02-15 22:20:00,21,2,831991477911719936
"Last night at the Rules Committee, I voiced my opposition to the @HouseGOP's plans to attack #TitleX, the national family planning program:pic.twitter.com/A9PYzK9YVO",2017-02-15 15:09:05,28,10,831883032625831937
Enough. It's now past time the @HouseGOP end their ruthless assault on women's health care & focus on the real issues facing our country.,2017-02-14 21:11:00,52,23,831611726604800000
Women across the country are fed up with @HouseGOP's attack on access to contraception and basic repro health services. #ProtectOurCare,2017-02-14 21:10:00,60,22,831611473910575105
"This attack includes limiting millions of women's access to vital care, contraception, & family planning services. #ProtectOurCare",2017-02-14 21:08:00,30,15,831610972078956544
"Now, the @HouseGOP has proven they'll stop at nothing by using the #CRA to attack #TitleX, the national family planning program.",2017-02-14 21:07:01,28,18,831610720810721281
"At the same time, the @POTUS demanded a #SCOTUS nominee litmus test, requiring that his nominee promise to overturn Roe v. Wade.",2017-02-14 21:05:00,15,13,831610217079128068
"Next the @HouseGOP advanced HR 7, effectively banning private insurance companies from providing comprehensive reproductive health services.",2017-02-14 21:03:00,22,18,831609712881709056
"First, @HouseGOP threatened women's care by attempts to dismantle #ACA with nothing to take its place.",2017-02-14 21:01:01,19,14,831609212321067008
"Despite promises to focus on jobs & economy, @HouseGOP started 115th Congress w/ a total assault on women's access to care #TitleX",2017-02-14 21:00:02,17,16,831608963305185280
My statement on General #Flynn's resignation:pic.twitter.com/snUABru1AI,2017-02-14 16:51:55,25,13,831546525004230656
General Flynn’s conduct – a clear violation of the law – is as outrageous as it is inexcusable & he should be fired immediately. #FlynnLied,2017-02-13 22:41:54,69,40,831272214649528321
I have serious concerns that sanctions weren’t the only inappropriate thing General #Flynn has discussed with the Russian ambassador.,2017-02-13 22:40:44,93,48,831271919689285632
His relationship with Putin has compromised his ability to represent American interests.,2017-02-13 22:39:38,43,22,831271643209146368
"At best, #Flynn lacks the judgement necessary to serve as National Security Advisor.",2017-02-13 22:38:46,24,13,831271422286761985
General #Flynn should never have been appointed National Security Advisor in the first place.,2017-02-13 22:37:39,41,20,831271141759209478
"I've co-sponsored HR 804, a bill that would prevent people like Bannon, who have primarily political roles, from being assigned to the #NSC.",2017-02-09 15:32:00,104,32,829714474072317953
"The #NSC should be comprised of national security professionals, and we cannot let partisan politics interfere with its important work.",2017-02-09 15:31:01,38,15,829714225354338305
"Steve Bannon has a history of spreading racism, xenophobia, and white nationalism. He doesn't belong anywhere near the #NSC.",2017-02-09 15:30:03,63,23,829713982457999360
"Despite his promise to protect American workers, @POTUS continues to fill his cabinet with billionaires, big business leaders, & CEOs.pic.twitter.com/eXwREukbda",2017-02-08 19:22:58,23,20,829410210246754313
It's a sad day when members of Congress are forbidden from reading the views of Civil Rights icons while speaking to colleagues #LetLizSpeak,2017-02-08 15:30:51,82,29,829351794685988864
