Text,Date,Favorites,Retweets,Tweet ID
"Happy #SmallBusinessSaturday! Be sure to #shopsmallbiz in your community today. Local diners, coffee shops, and mom & pop shops are some of my favorites.  #SmallBiz truly is the backbone of the  economy!pic.twitter.com/yjAgxFOVp4",2017-11-25 16:58:38,3,3,934466368258412544
"My family and I wish you and your loved ones a happy and blessed Thanksgiving!

This year, I am grateful for a loving family, and the opportunity to represent Florida's 5th District in Congress.pic.twitter.com/W9q41nKjaV",2017-11-23 18:40:22,21,1,933767195548581890
Why I voted agains the GOP tax plan #Sayfie #FLpolitics @Fla_Pol @politicofl @wjxt4 @FCN2gohttps://medium.com/@RepAlLawsonJr/gop-tax-bill-bad-for-america-f41fa14120d9 …,2017-11-16 20:31:30,4,2,931258448460775425
Why I voted against the GOP tax plan https://medium.com/@RepAlLawsonJr/gop-tax-bill-bad-for-america-f41fa14120d9 …,2017-11-16 18:35:53,23,13,931229351210897410
"The GOP tax plan would make dangerous cuts to medicare and many programs important to seniors, veterans, students, and the middle class .pic.twitter.com/Pdy01qdVSB",2017-11-16 14:22:42,5,5,931165636339945474
Thank you @PIJAC4PETS I am honored to accept this “#Pets’ Best Friend” award from the Pet Leadership Council.pic.twitter.com/dwhwd70r35,2017-11-15 20:55:40,3,2,930902142361235457
Today I filed two amendments to the tax reform bill to aid veterans who want to start their own small businesses and to help ease the burden of student loan debt on borrowers.,2017-11-14 21:57:46,7,5,930555383344713729
Should be back up and operational now.  Thanks for letting me know.,2017-11-13 22:30:25,0,1,930201210111647744
Thank you to those who have served this country honorably. It is only because of your service and dedication that we can say #WeThePeople. God Bless!  #VeteransDay2017 #VeteransDayWeekendpic.twitter.com/Iv4ynEwsAE,2017-11-11 13:26:23,5,3,929339522663448576
"This week I introduced the Veterans’ Agricultural Apprenticeship Act that will help our #veterans, who protected us at home and abroad, get the good jobs they need to thrive!https://lawson.house.gov/media/press-releases/lawson-bost-focus-veterans-hiring-agriculture …",2017-11-10 16:16:41,3,3,929019995115479043
Thank you to those who have served this country honorably. It is only because of your service and dedication that we can say #WeThePeople. God Bless!  #VeteransDay2017 #VeteransDayWeekendpic.twitter.com/g7C4teE4St,2017-11-10 14:49:51,5,3,928998140723826688
Very nice.,2017-11-07 20:50:26,2,1,928001721300930560
"Today, I had an opportunity to express the need for SBICs to increase technical assistance & opportunities for small minority owned firmspic.twitter.com/otl3Hqj3Xx",2017-11-07 20:48:57,3,3,928001348670550016
"With all Americans, my heart goes out to the families who lost loved ones in Sutherland, Texas today.",2017-11-06 01:05:15,5,3,927341072044392450
Did you know this year’s open enrollment is half the length of previous years? Visit http://healthcare.gov   & #GetCovered.pic.twitter.com/LjAnofE3IN,2017-11-03 18:47:34,0,4,926521247596515328
"Today, I requested funding for 11 flood and storm surge projects costing $79m to protect Jax from future storms",2017-11-02 14:43:33,5,6,926097455015432195
I'm about to testify before the House Transportation & Infrastructure Committee on Jax needs after Hurricane Irma https://transportation.house.gov/ ,2017-11-02 14:32:40,3,4,926094716093034496
My thoughts are with the people of New York City this morning and the victims  of this cowardly act.,2017-11-01 14:26:45,7,3,925730835571118080
"@RepDarrenSoto , and I, wrote Gov. Scott to ask him to help those still incurring Irma expenses & need food #sayfiehttp://floridapolitics.com/archives/248368-al-lawson-darren-soto-urge-rick-scott-seek-suspension-food-stamps-time-limit …",2017-10-31 18:28:55,2,1,925429392532230149
"Floridians who don't have health insurance, or want a new plan, may select coverage that begins on Jan 1, 2018 via http://Healthcare.gov pic.twitter.com/EGUdw6I2Am",2017-10-30 20:32:34,5,7,925098124074471425
#Sayfie #FLpolitics @Fla_Pol @politicofl @wjxt4 @FCN2gohttps://twitter.com/RepAlLawsonJr/status/923654217553924096 …,2017-10-26 21:20:21,0,0,923660597916585986
U.S. Rep. Lawson statement on the passing of Sen. Arnett Girardeau https://medium.com/@RepAlLawsonJr/lawson-statement-on-the-passing-of-senator-arnett-girardeau-feb80afaf76e …pic.twitter.com/wTNHSl6dKD,2017-10-26 20:55:00,3,4,923654217553924096
My letter to @BetsyDeVosED will ensure that we have the data we need to support our next gen of college students http://bit.ly/2glUUge pic.twitter.com/iCArOILjLP,2017-10-19 20:28:15,2,2,921110770317971458
I sent a letter to @BetsyDeVosED asking the @usedgov to begin assessing food insecurity on college campuses  http://bit.ly/2glUUge pic.twitter.com/zJR6n09m6Z,2017-10-19 20:19:15,2,2,921108505360240640
"Today, I introduced the Veterans Armed for Success Act that will help our returning military personnel transition into the workforce",2017-10-17 20:41:18,4,4,920389276097007617
#FannieLouHamer #FannieLou100https://twitter.com/BennieGThompson/status/916314799516061696 …,2017-10-06 18:26:01,11,13,916368964560867329
"Republican Budget Would Provide Tax Cuts for Wealthy at the Expense of Working Families

Why I voted against it:https://medium.com/@RepAlLawsonJr/lawson-republican-budget-would-provide-tax-cuts-for-wealthy-at-the-expense-of-working-families-1ab3ca719207 …",2017-10-05 19:51:18,1,2,916028041003978753
October is National Breast Cancer Awareness Month. Standing by those in our communities who have been affected.  #BreastCancerAwarenesspic.twitter.com/ImSDC6bbo4,2017-10-05 14:58:24,4,5,915954328980029440
Great meeting w/@SenAudrey2eet & Rep @kamiabrownfl45 on the importance of having women in government and elected office. @WomenLegisLobbypic.twitter.com/xaBg1e1zU5,2017-10-04 14:12:36,7,3,915580414869344256
I just published “A Message to DREAMers from Rep. Al Lawson Ahead of October 5 DACA Renewal Deadline”https://medium.com/p/a-message-to-dreamers-from-rep-al-lawson-ahead-of-october-5-daca-renewal-deadline-fd537badda0c …,2017-10-03 21:08:46,1,2,915322758015471616
"Happy 130th Birthday to my alma mater @FAMU_1887 from my fellow alum, Rep. @kamiabrownfl45 & I. #FAMU #WeBraggDifferent @FAMUNAA pic.twitter.com/iYlVs3SgWw",2017-10-03 18:24:56,42,11,915281530871799808
"I am saddened by the mass shooting in Las Vegas this morning. My thoughts and prayers are with the victims, families, and first responders",2017-10-02 14:01:14,6,5,914852780774428673
"I just published “Rep. Lawson, Senator Gillibrand Bill would Reduce Hunger & Poverty among Nation’s Seniors and…”https://medium.com/p/rep-lawson-senator-gillibrand-bill-would-reduce-hunger-poverty-among-nations-seniors-and-517f8e8a80e1 …",2017-09-27 19:56:59,6,2,913130367590322178
I agree.https://twitter.com/RepValDemings/status/912362858654179328 …,2017-09-25 18:00:22,2,1,912376243827482629
"Proud to stand with the @AmerMedicalAssn, America’s doctors, in opposing the disastrous #GrahamCassidy bill.",2017-09-20 20:45:00,2,0,910605735159058432
Instead of repealing the ACA and kicking millions off their #healthcare Democrats and Republicans should work together to improve the law.,2017-09-20 20:44:45,4,0,910605672609456133
"I visited with relief workers in Jacksonville, this morning, and assemble food packages for those in need after #HurricaneIrmapic.twitter.com/EOzTWzayzb",2017-09-14 20:19:33,10,5,908425006404788224
Preparing to talk live with @wolfblitzer at @CNN 5 p.m. about damage following #hurricaneimra,2017-09-11 21:02:39,1,2,907348688514764801
Remember.https://twitter.com/RepAlLawsonJr/status/907317734471557124 …,2017-09-11 20:22:48,0,0,907338659057324032
"If you must get out in the weather and you approach inoperable traffic lights, remember;pic.twitter.com/sWVTjoCq56",2017-09-11 18:59:39,1,5,907317734471557124
Today we honor and remember the victims of 9/11.  We stand untied today and always. #NeverForgetpic.twitter.com/8GMj5oQwB8,2017-09-11 16:59:46,1,1,907287565400788992
"Lost Power?
After clearing hazards, electrical crews will restore power to essential services--hospitals, nursing homes, fire stations, etc.",2017-09-11 12:55:57,2,2,907226206373806085
Reminder: Charge cell phones and any battery powered devices ahead of time. #HurricaneIrmapic.twitter.com/oyUMv4AmVy,2017-09-10 16:58:24,28,20,906924833920966656
Thank you so much Senator.,2017-09-10 16:28:53,6,2,906917402121818112
As #HurricaneIrma approaches our area a tornado watch has been issued for our area. Please stay in a safe place.pic.twitter.com/uobykaZgF5,2017-09-10 16:20:34,3,5,906915312452476928
"As we monitor #HurricaneIrma, I wanted to share a few helpful contact numbers and websites to help you prepare: https://lawson.house.gov/issues/hurricane-preparedness … …pic.twitter.com/LuEst1eTxl",2017-09-09 14:12:38,1,3,906520728077586432
"As we monitor #HurricaneIrma, I wanted to share a few helpful contact numbers and websites to help you prepare: https://lawson.house.gov/issues/hurricane-preparedness …pic.twitter.com/5hBVvPsTJP",2017-09-08 20:04:24,2,2,906246863732568065
Floridians & visitors can text FLPREPARES to 888777 in order to receive text alerts on hurricane preparedness from @FLSERT. #HurricaneIrma,2017-09-08 17:10:41,3,3,906203149400199169
Prep Tip: Charge cell phones and any battery powered devices ahead of time. #HurricaneIrmapic.twitter.com/FBPzHPizYD,2017-09-08 15:50:46,1,1,906183036647165954
"If you rely on anything that is battery-operated or power dependent, like medical devices, have a back-up plan. #HurricaneIrma",2017-09-08 15:49:33,4,1,906182728562946048
@JTAFLA  is scheduling Connexion rides for those registered through 630-CITY to  special needs shelters & for life sustaining medical trips.,2017-09-08 15:48:13,0,0,906182392418840576
I'm on the phone w/elected officials across #FL05 to ensure we're prepared for #HurricaneIrma . Visit http://floridadisaster.org  for the latestpic.twitter.com/45XJd6LyxB,2017-09-06 19:48:05,12,8,905517981085650944
With Hurricane Irma approaching I urge families to make sure you have a disaster plan in place  http://bit.ly/2vZ5Eq0 ,2017-09-06 17:16:23,56,26,905479805323370496
Trump's decision to end the #DACA program is terribly wrong. He needlessly targets children who know no other country as home than the USA.pic.twitter.com/MFB0PgrcVF,2017-09-05 17:44:18,8,6,905124445660045313
This #LaborDay I pay tribute to the working men and women to whom America owes so much.pic.twitter.com/wLHLip3Tnj,2017-09-04 19:41:19,4,2,904791503347863552
We had a great turn out today in #Tallahassee for our Military Academy Day - thanks to everyone who joined us! http://lawson.house.gov/military pic.twitter.com/CJINjk35vT,2017-08-26 20:26:50,4,2,901541470162780160
Are you ready for football season? @floridastate is! Great kickoff today. #GoNoles #UnitedWeFan pic.twitter.com/3uh4e4dQc5,2017-08-25 16:10:42,6,2,901114622765355008
DOJ has reversed course on key #VotingRights cases. I’m working to #RootOutRacism in the Trump Administration’s policies.,2017-08-23 18:34:01,26,11,900425912239497223
10 US military bases are named after Confederates who fought against us during the Civil War. We need to #RootOutRacism on federal property.pic.twitter.com/XrGJNO5Xs3,2017-08-23 18:12:16,9,8,900420439238987776
Join us in #Tallahassee for Military Academy Day THIS Sat from 10 a.m. - noon at Bethel Family Life Center at 406 North Bronough Street.pic.twitter.com/gq3LafKTwd,2017-08-22 15:03:58,4,4,900010663115988992
"Praying for a fast recovery for our brave @JSOPIO officers, Michael Fox & Kevin Jarrell. We are grateful for your service.",2017-08-20 14:43:25,1,1,899280717036871680
Thank you to everyone who came out for our leadership breakfast at Edward Waters College in #Jacksonville to discuss ways to work together.pic.twitter.com/9jgo43iIUL,2017-08-19 14:42:20,7,2,898918056356925442
Interested in joining a military academy? Come join us in #Jacksonville for Military Academy Day from 10-noon at 2179 Benedict Road!,2017-08-19 14:35:35,0,2,898916359391903745
In honor of #NationalHealthCenterWeek I visited Bond Community Health Center in #Tallahassee to talk about how to #ProtectOurCare #ValueCHCspic.twitter.com/kkg4NpO1dC,2017-08-16 19:22:06,2,2,897901298338508800
"Today we honor Heather Heyer, who lost her life fighting against racism. We must keep standing up to hate & bigotry. #PurpleforHeatherpic.twitter.com/6r8LxUVNMX",2017-08-16 14:57:49,12,2,897834789839020032
Today marks 82 years since #socialsecurity was signed into law. We must protect it! Thanks to everyone in the Tallahassee field office! #FL5pic.twitter.com/aE9TZw2Vb6,2017-08-14 17:47:47,9,2,897152789167648768
Good luck to everyone in #FL5 who is starting school today!https://goo.gl/Fohnrv ,2017-08-14 14:44:50,3,2,897106746791120896
Jacksonville’s @MayoClinic ranked best hospital in #Florida by @usnews https://goo.gl/jag24r  #Healthcare,2017-08-08 14:59:30,5,2,894936109439954944
Need help with a federal agency? Come see us TODAY between noon - 3pm at 732 S Pat Thomas Parkway in Quincy for our mobile office hours #FL5,2017-08-08 14:26:09,2,1,894927715937247233
Kicked off the Manufacturing & Construction #HiringFair in #Quincy today - we had a great turnout! #Jobspic.twitter.com/xunV7Pp3eq,2017-08-03 15:23:04,5,3,893130100706770944
Helped serve dinner to a wonderful group at #KearneyCenter in #Tallahassee this evening.pic.twitter.com/ZIlDEfUpcs,2017-08-02 23:32:04,3,1,892890775037640704
The FL Alliance for Retired Americans visited our #Jacksonville office today to celebrate #Medicare & #Medicaid providing much-needed care.pic.twitter.com/CqZE1jJuUS,2017-07-31 20:45:44,2,1,892124139661783041
Keeping the celebration going in #Tallahassee for all #Medicare has done for #FL5pic.twitter.com/lzrVLiFydZ,2017-07-31 17:09:23,4,4,892069693837725696
Now let's join together to figure out how to truly improve our nation's health care so that it's affordable & accessible for everyone.,2017-07-28 13:42:02,3,2,890930347071991808
We saw the power of democracy at work this week - Your outreach to tell our elected leaders to #ProtectOurCare were heard loud and clear.,2017-07-28 13:40:57,5,2,890930074144436225
Happy 52nd Birthday to #Medicare & #Medicaid! So many Americans rely on these programs to get the health care they need. #ProtectOurCarepic.twitter.com/VTcAfG0j1i,2017-07-27 17:08:16,4,3,890619861491105792
Our thoughts and prayers are with #JSO K9 Officer Jeremy Mason.https://twitter.com/jsopio/status/890050740852580352 …,2017-07-27 14:21:20,27,12,890577849350017024
Happy 52nd Birthday to #Medicare & #Medicaid! These programs provide affordable health care to so many Americans & we must #ProtectOurCare,2017-07-27 14:16:00,1,1,890576510880329729
In #Madison FL & need help w a federal issue? Come see us Wed between noon-3pm at 125 SW Range Ave for mobile office hours. #FL5,2017-07-25 17:13:00,0,0,889896278158704645
Need help w a federal issue? Come see us Wed bet. 10 am – 1pm for mobile office hours at Macclenny Fire Rescue @ 139 E Macclenny Ave #FL5,2017-07-25 15:48:24,1,0,889874988341317632
Be sure to tune into @cspan around noon to hear my tribute to Sgt Joe Murray of #Jacksonville who we lost too soon.https://goo.gl/AuzRyf ,2017-07-25 15:42:42,1,2,889873551217569798
I refuse to stand by and watch as Republicans attack Americans’ health care by gutting key protections. #ProtectOurCare,2017-07-24 17:45:01,3,2,889541944023678976
#Trumpcare is fundamentally broken. It’s time for Republicans to move on and work with Dems.,2017-07-24 17:40:00,1,1,889540684763607040
Middle class & working Americans deserve a government that works for them. #ABetterDeal,2017-07-24 17:29:00,1,1,889537915671388160
"#ABetterDeal means: Raising wages, lowering the price of prescription drugs & making college affordable. Read more -http://www.dems.gov/abetterdeal ",2017-07-24 17:19:01,6,3,889535401425330176
"If you're in #Gadsden today, be sure to stop by James A. Shanks Middle School for a free health screening & tips for a healthy lifestyle!pic.twitter.com/54jliqC07C",2017-07-22 17:05:21,2,0,888807188650749956
Proud to join local leaders & @Seminoles to discuss how to encourage young professionals to stay in #tallahassee & boost N FL's economy.pic.twitter.com/fymX0qBejD,2017-07-21 15:48:05,6,2,888425355517755392
Today I introduced the Veterans Jobs Opportunity Act to help encourage veterans to start small businesses -https://goo.gl/Wa31Zo ,2017-07-20 19:11:48,5,3,888114233488973824
"We know that girls can change the world. #ChibokGirls #BBOG @RepWilson
@RepTerriSewell @RepBeatty @RepRobinKelly @JacksonLeeTX18",2017-07-19 20:43:08,3,2,887774833223905281
Today at 11 am: Trump's #ShamVotingCommission meets for the first time. Here's why it's all about voter suppression:https://goo.gl/ppqAip ,2017-07-19 15:28:29,11,17,887695648291684356
Ribbon cutting ceremony for East Coast Migrant Head Start program in Jennings FL today.  #HeadStartAdvantage #MSHSWorks #FarmworkersFeedYoupic.twitter.com/o6g7yoALl0,2017-07-14 22:05:35,6,3,885983640785694720
Today I met with the incredible #NorahSproles from #Jacksonville who told me about why it's so important we protect #medicaidpic.twitter.com/VvsC1xZTuc,2017-07-13 21:35:18,4,1,885613632603783169
Civil discourse strengthens our democracy! That's why we must practice the #GoldenRule both in Congress and at home. #NationalDayofCivility,2017-07-12 16:55:01,14,7,885180710386114560
"We may disagree on the issues, but we all agree that our country is strongest when we treat each other with respect! #NationalDayofCivility",2017-07-12 16:34:48,7,4,885175621445439488
Had a wonderful time last night speaking at the Greenville Training School's Triennial reunion. Thank you to everyone who joined us!pic.twitter.com/nWJo4bJrXE,2017-07-09 12:54:37,3,1,884033048542662657
Thanks to everyone who came out to the Beaver Street Veterans Villas in #Jacksonville today - we must do all we can to help our #vetspic.twitter.com/ZGjPprsgLg,2017-07-06 17:43:48,8,2,883018658464903168
"We could start by fixing #ACA instead of taking away health care from even more Americans. Happy to chat more about it, @FLGovScotthttps://twitter.com/FLGovScott/status/879743631963369473 …",2017-06-27 17:05:57,9,3,879747641978105856
.@realDonaldTrump promised to create millions of new jobs in the U.S. #Trumpcare would cost nearly 2 million jobs. No thanks!,2017-06-27 16:06:01,3,1,879732557872599041
1.75 million #veterans count on Medicaid. #Trumpcare could see hundreds of thousands lose access. Is this how GOP honors our vets?,2017-06-27 15:25:00,4,2,879722237141467136
FACT: Only 16% of Americans believe that #Trumpcare “is a good idea.”https://goo.gl/fKe5uR ,2017-06-27 14:05:10,1,0,879702144756187141
Today @HouseAgNews I asked about alternative crop research @UF is doing in N FL w peaches & olives & 1890 universities centers of excellence,2017-06-22 17:07:31,3,0,877936095274700801
Excited to cheer on my colleagues as they #BeatThePress tonight in the @CWSoftballGame to help young cancer survivors.pic.twitter.com/POvEamlcTc,2017-06-21 23:15:00,0,1,877666189438308352
.@CenterOnBudget @FRACTweets – How would the #TrumpBudget affect Floridians with disabilities on SNAP?,2017-06-21 18:34:25,1,3,877595576665120768
"Today I presented @LHSTrojanNation student Jean-Paul Recht with the #congressionagoldmedal for his incredible community service-
Congrats!pic.twitter.com/UFYTuX7HJ2",2017-06-21 15:34:08,0,0,877550209156427779
Today it is important to remember that the U.S. should always open its doors to Refugees #WorldRefugeeDay #iStandWithRefugees.,2017-06-20 20:00:45,6,4,877254916670148609
#TeamLawson at the #CongressionalBaseballGame tonight! #GoDems great game!pic.twitter.com/SMXxH0SuvY,2017-06-16 01:34:50,12,3,875527053608714240
Talked about #Jacksonville priorities with the @JAXChamber today - from boosting innovation in small businesses to #FloridaAgriculturepic.twitter.com/9wBoNS4rnU,2017-06-15 19:38:45,17,15,875437441661845504
Tonight’s Congressional Baseball Game carries extra weight. It will be good to see everyone come together. #CBG2017,2017-06-15 18:36:08,2,1,875421682172915712
Had a great time hearing from the FL Tri-county co-op full of great students & future leaders of the Big Bend.pic.twitter.com/OxqO4bH6tL,2017-06-14 21:04:11,4,1,875096552766930944
Joining @RepRutherfordFL to stand strong together for #NorthFlorida as we wish a swift recovery to @SteveScalise & @CapitolPolice & others.pic.twitter.com/YjI0Ti2CGK,2017-06-14 16:45:53,18,14,875031548738904064
Our thoughts & prayers are with @SteveScalise @CapitolPolice & others shot this morning. Such terrible & disheartening news.,2017-06-14 12:51:12,8,8,874972491055333376
"After #ComeyHearings, clearer than ever that an independent commission into Trump-Russia connection is needed. We need to #FollowTheFacts.",2017-06-08 16:51:57,7,3,872858748565508096
"Hoping everyone is staying safe during the storm in #Tallahassee. If you see someone who needs help, stop to lend a hand.https://twitter.com/NWSTallahassee/status/872546879795589120 …",2017-06-07 21:11:40,3,1,872561721428324352
Talked to Beaver Yoder about the importance of #4H to #FL5 & I'm glad he represented FL at the Young Cattlemen's Conference for @BeefUSApic.twitter.com/YpQ0aoWN3Z,2017-06-07 21:08:33,6,3,872560937080946688
Congratulations to Tallahassee's own #ChefShac - Shacafrica Simmons - for great success on #Chopped - https://goo.gl/OPCdMl https://twitter.com/TLHFoodNetwork/status/872459836574879744 …,2017-06-07 14:42:12,1,0,872463709498748929
Great meeting with @FHCA today to discuss how we can work together to improve care in nursing facilities throughout #FL5pic.twitter.com/pwvfQzqcWM,2017-06-06 20:10:58,0,0,872184057358168064
".@HouseGOP should be putting #ConsumersFirst, not Wall Street. We must defeat the #WrongChoiceAct once and for all.",2017-06-05 18:12:15,8,6,871791793842647040
Enjoyed hearing from @UPS workers in #Tallahassee this morning.pic.twitter.com/4thaUk3zwb,2017-06-05 15:55:28,9,2,871757372619882496
Honored to join the Leon County Chapter of #Charmettes for their 3rd Annual Dr. Eva C. Wanton Recognition Luncheon in #Tallahassee todaypic.twitter.com/cWfUoEtW2L,2017-06-03 20:15:58,2,1,871098153096929280
Thanks to everyone who joined us in Jefferson today for our farming forum. Together we can help feed America.http://www.tallahassee.com/story/news/2017/06/01/trumps-budget-shocks-lawson/361419001/ …,2017-06-02 00:58:56,8,5,870444587025911808
"#HurricaneSeason starts today, is your family prepared in case a storm is headed our way?https://goo.gl/QgNPco ",2017-06-01 14:52:39,1,1,870292009969483777
So proud VA Jacksonville Outpatient Clinic honored our blind veterans with a Bronze Braille Flag dedication ceremony https://goo.gl/r5fxCl pic.twitter.com/0h6cHogMJI,2017-05-31 20:30:37,6,2,870014675362172928
It was wonderful to visit with @FAMU_1887 alumni from all over the country last night at the @FAMUNationalAA #FAMUAlumniConvention2017pic.twitter.com/91hOIBRg3O,2017-05-26 14:49:12,8,5,868116817709064192
"Need help w a federal agency or department? Come see us during mobile office hours on Fri, 5/26 in Macclenny @ City Hall, 10am-1pm #FL5",2017-05-25 15:13:23,8,12,867760516122497028
"This new CBO score would still mean 23 million hard-working Americans would lose their health care, which is patently unacceptable.",2017-05-24 21:36:10,92,45,867494458769756161
This is not helpful for improving housing conditions across our country.https://twitter.com/postpolitics/status/867468939588243456 …,2017-05-24 20:02:04,4,2,867470775481241600
Thanks to Moniece Jackson @CurvyLeoQueen for being a strong advocate for #FosterYouthVoices. Good luck as you graduate from @floridastate!pic.twitter.com/Iou2m3vxh6,2017-05-24 19:42:47,6,5,867465921631334400
Talked with Florida's own Southeast Milk about how to educate & inspire the next generation about the #dairy  industry. #FL5pic.twitter.com/x2XCeP5urT,2017-05-24 16:31:24,1,1,867417760866893826
Thanks to @FloridaTrucking for meeting with me to discuss importance of improving our infrastructure & keeping our roads & bridges safe.pic.twitter.com/VtnRG6IKZn,2017-05-24 15:38:03,5,3,867404332928573441
Tune into @cspan now to hear what I think about @realDonaldTrump's budget. #TrumpCuts,2017-05-24 14:42:45,1,0,867390419222630401
Great to meet with Melissa Bohrer from @AIPAC about our continual support of the US-Israel relationship.pic.twitter.com/I0G1KQxQxE,2017-05-23 21:16:10,15,7,867127035617062915
Enjoyed meeting with @NATCA & talking about their priorities & how we can keep travelers safe in #FL5. #NATCApic.twitter.com/1So8p4yfnE,2017-05-23 19:56:34,5,3,867107005743472640
"In the #TrumpCuts budget, millionaires and corporations win. Everybody else loses. We won't stand for it.pic.twitter.com/zrAatD7frJ",2017-05-23 17:33:20,1,2,867070956489068545
"I'm sorry to hear that, @_EricCarr we normally reach out 2 weeks before tours to schedule them. Please call my DC office at 202-225-0123.",2017-05-23 17:06:14,1,0,867064140115980288
The #TrumpCuts budget is an affront to our values as Americans.https://goo.gl/wn78NK ,2017-05-23 16:36:32,1,1,867056665300008964
The #TrumpCuts budget is an assault on working families and Americans struggling to make ends meet.pic.twitter.com/CtjRt4jhH0,2017-05-23 15:25:29,0,0,867038785518919681
Our thoughts and prayers are with #Manchester and the United Kingdom for all the victims of tonight's attack. Such sad news.,2017-05-23 01:08:49,13,8,866823196582043649
