Text,Date,Favorites,Retweets,Tweet ID
Voted in my Facebook photo contest yet? Like your favorite pics & help pick my new cover photo! Vote now → http://on.fb.me/1zO3ibz ,2014-07-18 01:10:16,1,1,489940182872125440
"Watch: Spoke out against outrageous #HobbyLobby ruling today. SCOTUS didn’t go to medical school, but I did:https://m.youtube.com/watch?v=gc_SaFBvByU …",2014-07-17 22:36:25,10,16,489901464056115200
My thoughts and prayers are with the families of those who lost loved ones in the #MalaysiaAirlines flight #MH17 tragedy.,2014-07-17 20:39:23,6,2,489872012467519488
VIDEO: Shelly needed help getting her mom the Social Security benefits she was owed. See how my office helped her  →http://bit.ly/UaNiPH ,2014-07-17 00:15:14,1,1,489563943166574592
"As a doctor, disappointed politics in Senate blocked women’s access to birth control: http://bit.ly/1rrApwV  #NotMyBossBusiness #HobbyLobby",2014-07-16 22:30:47,3,6,489537659618873344
Participating in a job fair with @KenCooley to help #CA7 find work. Learn more & RSVP → http://bera.house.gov/media-center/amis-updates/job-fair …,2014-07-16 02:35:05,2,3,489236748405596160
Please RT so someone you know can get help. Details → http://bera.house.gov/library-office-hours …pic.twitter.com/DRR0VIslKJ,2014-07-16 01:20:30,4,4,489217982665859073
See my latest jobs email update – and join today so you don’t miss any in the future →http://bera.house.gov/media-center/amis-updates/email-update-jobs-0 …,2014-07-14 23:45:22,1,2,488831650504384512
Vote now for your favorite photo in my Facebook photo contest → https://www.facebook.com/media/set/?set=a.805590796120686.1073741859.528662157146886&type=1 …,2014-07-14 20:12:43,0,0,488778136528908288
Voted for bipartisan job training bill to help get our country back to work. Read more in @thehill →http://thehill.com/blogs/floor-action/house/211778-house-clears-workforce-training-bill …,2014-07-13 20:15:12,0,3,488416372792492032
"Attention local small business owners: If you haven’t heard, I’m hosting a #smallbiz workshop on Tuesday. RSVP →http://bera.house.gov/media-center/amis-updates/new-small-business-workshop-using-us-census-data-for-businesses …",2014-07-12 21:30:10,4,4,488072850063241216
Should Congress address climate change? Take my survey if you haven’t already  → http://bera.house.gov/climate-change-survey … http://ow.ly/i/6cRD4 ,2014-07-12 17:45:16,1,4,488016253177843712
Last call! Enter my Facebook photo contest now before it’s too late → http://www.bera.house.gov/FBphotocontest ,2014-07-11 22:16:29,0,1,487722118919245824
Thx Chrissy for sending in your contest picts! Send in yours now – its the last day to enter → http://bera.house.gov/FBphotocontest pic.twitter.com/06RO6vIISm,2014-07-11 15:42:20,1,1,487622930399236096
Thx to Stan for sending in this beautiful pict! Just 1 day left to enter FB photo contest → http://bera.house.gov/FBphotocontest pic.twitter.com/wqA5Oo7520,2014-07-10 22:00:53,2,1,487355807215149057
Cosponsoring Protect Women’s Health from Corporate Interference Act to help reverse #HobbyLobby. #NotMyBossBusinesspic.twitter.com/tjqFTp22Lt,2014-07-10 18:46:39,6,10,487306924825010177
Should Congress act to address climate change? Take my survey now → http://www.bera.house.gov/climate-change-survey …pic.twitter.com/RweTCKltxT,2014-07-09 22:10:05,1,4,486995735297417216
Attention #CA7 homeowners – get help at free housing event on 7/24 at Sac Convention Center. Details → http://www.makinghomeaffordable.gov/SacramentoCa ,2014-07-09 02:40:07,0,2,486701300239724544
Thanks to Nathan from Folsom for this great #CA7 pict! Enter my Facebook photo contest now → http://bera.house.gov/FBphotocontest pic.twitter.com/bz9aKEGtk3,2014-07-09 00:55:47,1,0,486675044547174400
"Need help? Drop by Franklin library tmrw, 10AM – 12PM for help w/ vets benefits, social security & more. Details → http://bera.house.gov/library-office-hours …",2014-07-07 21:11:12,1,0,486256141421527040
#CA7 #smallbiz owner? Get help at my new workshop! RSVP today → http://bera.house.gov/media-center/amis-updates/new-small-business-workshop-using-us-census-data-for-businesses … http://ow.ly/i/67lgn ,2014-07-06 23:35:06,3,1,485929966123896832
Thx to Kurt in Rancho Cordova for this beautiful #CA7 photo! Enter my FB pict contest today → http://bera.house.gov/FBphotocontest  http://ow.ly/i/67l98 ,2014-07-06 18:30:45,1,2,485853372218880001
"#NotMyBossBusiness? If you haven’t already, take my #HobbyLobby survey now → http://bera.house.gov/contraception-survey … http://ow.ly/i/67kZZ ",2014-07-05 22:25:09,0,1,485549973069524992
Glad VA is providing guidance to #LGBT married vets so they can access their earned benefits! http://www.va.gov/opa/pressrel/pressrelease.cfm?id=2562 …,2014-07-05 17:20:29,1,3,485473301960327168
"Hope you’re having a #HappyFourth! As we celebrate our independence, let us honor our vets for their sacrifices →http://bera.house.gov/media-center/amis-updates/email-update-doctors-helping-heroes …",2014-07-05 00:20:12,2,1,485216538958778368
"As we celebrate #FourthofJuly, I want to send a note to #CA7 vets: My office is here help you. http://ow.ly/i/67kwu ...",2014-07-04 20:20:28,0,1,485156209541259264
#HappyFourth! Hope you have great day celebrating our independence and a big THANK YOU to our vets for their service. http://ow.ly/i/67koC ,2014-07-04 17:05:16,3,1,485107083239755776
"As a doctor, I believe health decisions should be between a patient & her doctor – not her boss. #HobbyLobby e-news →http://bera.house.gov/media-center/amis-updates/email-update-hobby-lobby …",2014-07-03 22:20:13,7,19,484823954998435841
Good news for #CA7 #smallbiz! Federal funds to help local businesses pursue govt. contracts →http://1.usa.gov/1j0SZfe ,2014-07-03 18:51:25,1,1,484771409374486528
Enter my Facebook photo contest today! Your #CA07 pic could be my new cover photo! Enter now: http://bera.house.gov/FBphotocontest ,2014-07-03 00:15:11,0,0,484490501329281024
Today is the 50th anniversary of the Civil Rights Act. We shall overcome. http://ow.ly/i/66aYO ,2014-07-02 17:45:30,3,3,484392432671289344
Medicare began 48 yrs ago today. See how I’m fighting to protect it → http://bera.house.gov/issues/social-security-and-medicare … http://ow.ly/i/65Jr3 ,2014-07-02 01:05:08,3,8,484140685302702081
See my new joint @SacBee_news #HobbyLobby oped w/ @acognews’ @ConryJeanne →  http://bit.ly/1nZKw88  #NotMyBossBusiness #ICYMI,2014-07-01 23:10:21,1,4,484111798044745728
Good luck to #TeamUSA in #USAvsBEL #WorldCup game!,2014-07-01 20:22:03,0,2,484069441295355904
Deny women birth control in health plans? Take the #HobbyLobby survey → http://bera.house.gov/contraception-survey … #NotMyBossBusinesspic.twitter.com/xTSSUVryIl,2014-06-30 17:31:51,2,3,483664223399329793
RT if you agree! #HobbyLobby #NotMyBossBusiness → http://1.usa.gov/1mdMGFC pic.twitter.com/s7gdtxeJFz,2014-06-30 15:47:21,4,7,483637922957365248
"As a doctor, I believe no one should come between a patient & her doctor – not bosses, not politicians. #NotMyBossBusiness #HobbyLobby",2014-06-30 14:58:35,45,104,483625650591662080
Congrats to Elizabeth Pinkerton Middle School in Elk Grove for being recognized as a School to Watch by @MGForumSTW!pic.twitter.com/1ni7sBe34d,2014-06-29 22:52:34,1,0,483382544608804864
Congrats to Folsom HS student Lukas Novak for being recognized as a presidential scholar! Great job! http://ow.ly/i/63NrR ,2014-06-28 22:15:09,2,1,483010743177330689
Are you a shutterbug? Enter my Facebook photo contest today → http://www.bera.house.gov/FBphotocontest  http://ow.ly/i/63kpq ,2014-06-27 21:15:24,0,1,482633315670056960
Congratulations to Sim Bhullar - first basketball player of Indian descent coming to @SacramentoKings!http://bit.ly/1pHWzt6 ,2014-06-27 20:41:12,8,8,482624709021138944
Great seeing @citizensclimate in D.C. – we must face our climate change crisis by building a clean energy economy nowpic.twitter.com/KZNDG8cJ3d,2014-06-27 18:31:50,3,7,482592153684959232
"SCOTUS swept aside #DOMA & CA Prop 8 one year ago today – historic step for #MarriageEquality, and our nation. http://ow.ly/i/62BTe ",2014-06-27 00:10:03,1,2,482314880381644800
#ThrowBackThursday – Joined w/ @PPact supporters in front of #SCOTUS during #HobbyLobby arguments. #NotMyBossBusinesspic.twitter.com/b3Ub0Yxgfa,2014-06-26 21:55:22,5,4,482280989738409984
#ICYMI – Introduced bipartisan bill to make sure VA has enough doctors to care for vets. See more in @sacbee_news → http://bit.ly/1pjhOp9 ,2014-06-25 20:10:03,1,1,481892096828518400
Congrats to #CA7 art competition winner Josh Corrigan – in D.C. today to see art work displayed in the U.S. Capitol!pic.twitter.com/Tgy1flocj5,2014-06-25 16:24:48,0,0,481835411921465344
Joined w/ Leehy Shaer & @HouseForeign @HFACDemocrats to call for Israeli teens’ release.pic.twitter.com/0egxKL4VIT,2014-06-25 02:31:01,2,2,481625583458062338
Introduced Doctors Helping Heroes Act w/ @RepMarkMeadows to deal w/ doctor shortage at VA → http://1.usa.gov/1mcdqQM pic.twitter.com/g8w7znDA6U,2014-06-24 21:15:31,1,0,481546183798972416
Need help w/ fed govt? Drop by the Sylvan Oaks library tmrw from 10AM to noon. My staff will be there to serve you → http://bera.house.gov/library-office-hours …,2014-06-23 22:03:48,1,0,481195945921892352
Looking forward to the #USAvsPortugal #WorldCup game today. Go team USA!,2014-06-22 21:14:27,2,1,480821137887469570
See how I’m working to #FixNotFight & more in new e-mail update → http://1.usa.gov/1nrU5gV  http://ow.ly/i/5Z9sS  cc: @NoLabelsOrg @mmckinnon,2014-06-22 19:56:33,0,1,480801533966434304
Pres. Roosevelt signed GI bill of rights into law 70 yrs ago– one of greatest investments our nation has ever made. http://ow.ly/i/5YBKl ,2014-06-22 17:35:08,1,3,480765947272527872
"On this day in 1851, Sojourner Truth made historic speech: “Ain’t I a Woman?” See it here → http://www.sojournertruth.org/Library/Speeches/Default.htm#RIGHTS … http://ow.ly/i/5YBva ",2014-06-21 19:25:06,2,5,480431232887836672
"Should we militarily intervene in Iraq? If you haven’t yet, pls take my brief survey →  http://www.bera.house.gov/iraq-survey  http://ow.ly/i/5YBNx ",2014-06-21 17:20:10,0,1,480399792238252033
"Honored to meet w/ Filipino Ambassador Cusia in my Washington, D.C. office today! http://ow.ly/i/5YIEI  cc: @HFACRepublicans @HFACDemocrats",2014-06-21 00:10:23,1,2,480140638328197120
Outrageous that the Phoenix VA paid $10 million in bonuses while vets may have died waiting for health care. http://bit.ly/1igFfg4 ,2014-06-20 21:45:04,0,4,480104070318161920
Congrats to Sac County’s economic powerhouse @AerojetRdyne on your 1st anniversary →  https://www.facebook.com/photo.php?fbid=793151427364623&set=p.793151427364623&type=1 … http://ow.ly/i/5YCqJ ,2014-06-20 19:55:16,0,0,480076434464337920
Great seeing Cavitt Jr. High students at the U.S. Capitol! Get help w/ your D.C. tours → https://bera.house.gov/get-help/tours-and-tickets …pic.twitter.com/dmNtiHqd8y,2014-06-20 17:19:14,0,0,480037167402852353
Should the U.S. militarily intervene in Iraq? Take my brief survey now →  http://www.bera.house.gov/Iraq-survey pic.twitter.com/jLoUEUhZRU,2014-06-19 20:55:20,0,2,479729163574972416
"Sally Ride became 1st U.S. woman to fly in space 31 yrs ago. As @SciCmteDems member, proud to commemorate her triumph http://ow.ly/i/5XkIq ",2014-06-19 02:15:04,3,5,479447240306851841
Discrimination has no place in U.S. Glad @WhiteHouse banning discrimination against #LGBT by fed contractors →http://bit.ly/1nk6qnk ,2014-06-19 01:03:13,0,3,479429156908699649
Honored @NoLabelsOrg’s @mmckinnon joined me & #CA07 leaders yesterday to discuss #FixNotFight: http://1.usa.gov/1iEH6pu  http://ow.ly/i/5Wohp ,2014-06-18 00:05:04,3,6,479052138958839809
RT so someone you know can get help. My staff will be at the Southgate library tomorrow → http://bera.house.gov/library-office-hours …pic.twitter.com/V29xyIT90g,2014-06-17 20:02:55,0,4,478991197936320513
Important note: My local office’s address has changed! We’re now at 11060 White Rock Rd. Suite 180 in Rancho Cordova.,2014-06-17 00:40:13,0,2,478698596057899008
"Drop by Folsom library tomorrow between 10AM to noon for help w/ vets benefits, Social Security, Medicare, and more → http://bera.house.gov/library-office-hours …",2014-06-16 23:10:10,0,2,478675934925819904
Great to have @NoLabelsOrg co-founder @mmckinnon meet w/ local leaders today. Here's our interview on @News10_CA →https://www.youtube.com/watch?v=yCs8HyJMUn8 …,2014-06-16 21:02:34,0,0,478643822621388800
Met w/ Deborah from Elk Grove & @IJM team in DC office to discuss how we can end human trafficking. #EndSlaverypic.twitter.com/mx2ygdsNX6,2014-06-16 15:53:36,20,11,478566069599490049
See my latest update on my work to grow our economy & join my updates so you don’t miss any in the future →http://1.usa.gov/1ivfinp ,2014-06-15 20:40:13,0,1,478275809506230272
#HappyFathersDay - Thanks to my dad for being my role model! http://ow.ly/i/5UmE5 ,2014-06-15 15:50:15,1,1,478202836996472832
Should Congress act to close the wage gap between men and women? Take my survey now →http://bera.house.gov/equal-pay-survey …,2014-06-14 22:55:10,1,1,477947380638445570
Took part in Foreign Affairs hearing on how we can #BringBackOurGirls → https://www.youtube.com/watch?v=3GFF9WTTZpw&feature=youtu.be … @HFACRepublicans @HFACDemocrats,2014-06-14 20:15:14,3,2,477907133380689920
Led bipartisan effort to ensure VA hospitals have enough doctors to care for veterans --> http://1.usa.gov/1iv8nuB pic.twitter.com/yRAqWbMmWk,2014-06-13 23:02:30,4,4,477586840246317056
It's #menshealthmonth. Don't forget to schedule a check-up w/ doctor. Preventive care saves lives.,2014-06-13 16:13:22,3,3,477483879519895554
Thrilled that legislation authorizing improvements to the Natomas levees was signed into law yesterday. http://www.sacbee.com/2014/06/11/6473394/viewpoints-water-projects-bill.html?storylink=lingospot_related_articles …,2014-06-11 21:17:33,4,0,476835651653226496
Voted to allow veterans who experience inexcusable wait times for VA health care to get help from private doctors → https://www.facebook.com/RepAmiBera/posts/788311211181978 …,2014-06-11 18:05:26,2,1,476787305605513217
"President Kennedy signed the #EqualPay Act into law 51 years ago. We’ve made progress, but we have a ways to go.pic.twitter.com/4KMyE2tVVi",2014-06-11 00:57:18,1,2,476528568760283136
RT if you support #EqualPay for equal work. President Kennedy signed the Equal Pay Act into law 51 years ago today.pic.twitter.com/N4MHtrUGAY,2014-06-10 16:13:35,3,5,476396770801770496
Deeply disappointed by report confirming that thousands of vets are w/o health care. #CA7 vets: Call my office at (916) 635 0505 for help.,2014-06-09 22:23:04,2,0,476127363148042240
"Need help? Go to Carmichael library tmrw, 10AM to 12PM, for help w/ VA benefits, Social Security, Medicare, & more. http://www.bera.house.gov/library-office-hours …",2014-06-09 19:15:24,1,0,476080136375508992
"What should Congress do to fix the VA? If you haven’t already, please take my survey now →http://www.bera.house.gov/VA-Survey ",2014-06-08 17:35:08,1,2,475692517053464576
Congrats to my wounded warrior fellow Matt for winning 2 gold medals and a silver at Valor Games Far West 2014!  http://ow.ly/i/5Pbnf ,2014-06-07 19:35:09,2,1,475360333285314560
.@Intel is celebrating 30 years in Folsom! Their Local campus and 6k employees are critical to out community.pic.twitter.com/vK1ydhwOed,2014-06-06 20:42:28,1,0,475014883705380865
American GIs heroically stormed Normandy beaches 70 years ago today. Let us all honor their sacrifice. #DDaypic.twitter.com/v3xBsQJpEw,2014-06-06 15:32:44,4,2,474936935660937216
RT so someone you know can get help. My staff & I are here for our vets. (916) 635 0505 http://bera.house.gov/gethelp pic.twitter.com/srxbwmvUoC,2014-06-05 21:17:32,2,8,474661323100676097
Fix50 construction entering new phase tomorrow – learn more in @sacbee_news & see if other routes can work for you:http://bit.ly/1oYTtnJ ,2014-06-05 19:02:52,1,1,474627432423886849
"As a doctor, I can’t stress enough how important it is to properly dispose of unused medications. http://bit.ly/Ua1kSL#NSM14  @nscsafety",2014-06-04 01:03:14,3,0,473993345476210689
What should Congress do to fix the VA? Take my survey now → http://www.bera.house.gov/VA-Survey pic.twitter.com/Quko7kpmIF,2014-06-03 18:25:37,3,2,473893282498760704
"Special note to vets - call my office if you need help w/ health, benefits. See details in my latest email update:http://1.usa.gov/1ok8gW8 ",2014-06-02 00:07:53,7,16,473254638196912128
Took part in Science Cmte hearing this week on serious threat of climate change: http://bit.ly/TXAoWh  cc: @SciCmteDems,2014-05-31 21:34:35,4,4,472853673627123712
I applaud Mr. Shinseki for doing the right thing today by accepting respoinsibility and stepping aside at the VA. http://on.fb.me/1oD2K4o ,2014-05-30 16:49:20,1,0,472419498432413696
My staff & I are here to help local vets cut through govt. red tape  (916) 635 0505 or → http://bera.house.gov/gethelp . http://ow.ly/i/5JvJd ,2014-05-30 00:01:01,1,2,472165749847769088
"I’m deeply troubled by today’s report that at least 1,700 veterans weren’t on medical care wait lists. http://on.fb.me/1lS2tnZ ",2014-05-29 00:35:26,3,3,471812022246854656
"As a doctor who’s helped care for veterans, I’m humbled by the sacrifices our heroes have made. #MemorialDay http://ow.ly/i/5FKwH ",2014-05-26 17:40:17,2,3,470982768844087297
Was at the Fair Oaks Cemetery yesterday to recognize the sacrifice of our fallen troops. #MemorialDay http://ow.ly/i/5GzBS ,2014-05-26 00:41:09,1,2,470726297753505793
"On this #MemorialDay weekend, we should honor vets we've lost & thank our military & vets for their sacrifices. →http://1.usa.gov/RjtmIU ",2014-05-23 20:22:43,1,0,469936483819069442
Joined w/ 127 congress members to push for equal #LGBT Social Security spousal benefits today: http://1.usa.gov/1i9AvTx ,2014-05-23 01:29:02,2,1,469651182102003712
"Voted for a VA accountability bill today. As a doctor, I’m outraged veterans may have died while waiting for care.http://wapo.st/1oT0q9e ",2014-05-22 01:08:03,3,1,469283514031284225
Took part in Foreign Affairs hearing today on brutal terrorist group Boko Haram. U.S. must do all it can to help #BringBackOurGirls,2014-05-21 22:02:01,1,1,469236699164585984
We must honor the promises we've made to our seniors. See how I’m fighting to protect Social Security & Medicare:http://1.usa.gov/1ldwRMI ,2014-05-19 19:26:23,2,5,468472755743379456
Historic Indian elections are a reminder on importance of democracy & our shared values. More in my @thehill op-ed →http://bit.ly/1llglIr ,2014-05-16 00:04:41,1,5,467093240249077761
"As a father, I want my daughter to grow up in a country where gender is not a barrier to success. http://1.usa.gov/1mIDV3M  #WomenSucceed",2014-05-14 21:21:10,5,7,466689702704463873
What are your priorities? Listening to you is my most important job. Take my survey now: http://www.bera.house.gov/survey  http://ow.ly/i/5yFRU ,2014-05-14 00:40:03,1,1,466377364222783489
Attn #CA7 Small businesses: RSVP now for my Friday workshop & learn how to use U.S. Census data to grow!http://bera.house.gov/media-center/amis-updates/small-business-workshop-using-us-census-data-for-businesses …,2014-05-13 21:46:30,1,0,466333690155782146
Remember – you can drop by the Fair Oaks library today btwn 1-3PM to get help w/ the fed govt! http://bera.house.gov/library-office-hours …,2014-05-13 18:55:01,2,1,466290535184216065
Need help w/ fed govt? Get help at the Fair Oaks Library tomorrow – my staff will be there to serve you! Details: http://bera.house.gov/library-office-hours …,2014-05-12 22:45:25,0,1,465986128521469952
Folsom Lake boat accident is a terrible tragedy. Thoughts & prayers are w/ the victims & their families. http://bit.ly/1mixd56 ,2014-05-12 21:19:35,0,1,465964528740864000
"Happy Mother’s Day! Thanks to my mom and to my wife, Janine, for being a great mom to our daughter Sydra.pic.twitter.com/EHaiPg8WSJ",2014-05-11 19:50:37,8,4,465579751273668608
"Honored to attend documentary screening of Dalip Singh Saund: His Life, His Legacy. http://ow.ly/i/5wml6 ",2014-05-10 17:30:24,3,2,465182079018618880
"RT if you agree: We need to pass a permanent version of the No Budget, No Pay Act!http://1.usa.gov/1ggkNFt ",2014-05-09 23:20:09,0,2,464907706047164416
"On this Military Spouse Appreciation Day, thank you to America’s military spouses for the sacrifices you’ve made for our country....",2014-05-09 21:33:36,0,2,464880892780228608
Observed a moment of silence today on the House floor for kidnapped Nigerian Girls. We must #BringOurGirlsBack,2014-05-09 19:59:17,1,4,464857155968184320
Glad Sec. Shinseki ordered an audit of all VA clinics. We must ensure our heroes get the health care they've earned. http://ow.ly/wDiFN ,2014-05-08 22:25:04,0,2,464531454694031360
U.S. must stand against propaganda & anti-Semitic hatred in Ukraine: http://bit.ly/QiPEdi  @HFACRepublicans @HFACDemocrats,2014-05-08 20:25:03,0,3,464501254853775360
Honored to take part in @CAPAC panel today on inspiring future #AAPI leaders. #CAPAC20pic.twitter.com/AMNbNW4fj6,2014-05-08 19:07:26,4,5,464481718511349760
Great #Cap2Cap14 discussion on green technology - the Sacramento region must seize this opportunity grow our economy. http://ow.ly/i/5uwnu ,2014-05-07 22:40:17,1,5,464172896689336320
"Thank you, nurses, for all the great work you do to care for us. As a doctor, I know how hard you work. #NursesWeek",2014-05-07 21:00:34,3,1,464147803867193344
Had a productive #Cap2Cap14 meeting on how we can improve our local transportation infrastructure. http://ow.ly/i/5uwdq  #CA7,2014-05-07 20:15:02,2,1,464136346014339073
"On Mother’s Day, we honor our moms w/ flowers & hugs. Congress should honor moms w/ paid sick days. #WhatMothersNeedpic.twitter.com/UMjh0QmvM6",2014-05-07 19:01:19,2,0,464117792980348928
Glad to see the U.S. is sending a security team to help rescue the kidnapped Nigerian girls. #BringBackOurGirls http://ow.ly/wyBeX ,2014-05-06 22:37:57,6,14,463809922476408832
Did you know today is the Big Day of Giving? See how you can support our area in the @Sacbee_news:http://bit.ly/1g5Stpe ,2014-05-06 22:30:05,0,0,463807943813513216
"Thanks to my mom, a retired CA school teacher, & all teachers on National Teacher Appreciation Day. #ThankATeacher http://ow.ly/i/5tLay ",2014-05-06 21:00:12,2,0,463785323500019715
Glad to meet with local health care leaders this morning in one of my first #Cap2Cap14 meetings this week.pic.twitter.com/cRH0gyXpRD,2014-05-06 20:21:26,3,3,463775565636313088
Pleased to see Cap-to-Cap leaders in D.C. today to help kick off #Cap2Cap14!pic.twitter.com/CCflFSrZWo,2014-05-06 19:19:44,3,3,463760039938129921
Participating in #Cap2Cap14 this week – when local leaders & stakeholders fly to D.C. to share their views. Time to make govt work for #CA7!,2014-05-06 00:25:03,1,1,463474487879815168
California and our nation is blessed to have a vibrant Mexican-American community - #HappyCincoDeMayo to all who are celebrating!,2014-05-05 22:09:52,2,3,463440468756688896
Congrats to Josh Corrigan for winning first place in the 2014 congressional art competition! http://bera.house.gov/artcompetition pic.twitter.com/rQUXq9gXsV,2014-05-05 20:15:02,48,22,463411568995094528
See how I’m fighting to build an economy that works for middle class families on my website:http://1.usa.gov/1fg2iWk ,2014-05-05 14:20:27,0,0,463322336872366080
Got to meet with students & teachers from California visiting Capitol Hill through @CloseUp_DC this week. Pic: http://ow.ly/i/5rqmp ,2014-05-04 23:15:17,1,2,463094544318230528
Thanks to the spring interns in my D.C. office for all their hard work this semester! http://ow.ly/i/5rqci ,2014-05-04 19:35:06,2,1,463039129937518593
"Had a great time walking the Western Festival parade today. If we missed you, visit http://bera.house.gov/gethelp  to learn how our office can help",2014-05-03 23:48:07,0,1,462740416895672321
Story of kidnapped Nigerian girls is heartbreaking. We must hold those responsible accountable! #bringourgirlsback http://ow.ly/wqF6F ,2014-05-03 17:45:24,8,26,462649136052207616
"Spoke at a screening of #Misconception. Here I am w/ Gladys Kalibbala, Uganda journalist in the film. Trailer:http://ow.ly/wqEgn ",2014-05-03 14:35:15,0,2,462601285821546496
Extremely concerned by issue of sexual assaults at colleges & commend students who've brought this issue to light:http://nyti.ms/1mVvswF ,2014-05-02 21:58:51,0,1,462350530191581184
LAST DAY TO VOTE! Don't forget to make your pick in the Congressional Art Competition. http://ow.ly/wlE3Y ,2014-05-02 16:10:37,1,1,462262894101798913
"May is Asian Pacific American Heritage Month, a time to celebrate the many contributions our diverse community has made to the US #APAHM2014",2014-05-02 14:15:46,1,4,462233993849864193
Voted to keep my promise today: no pay raise for Congress until unemployment is under 5% in #ca07:http://ow.ly/wnORj ,2014-05-01 19:29:55,3,1,461950662264520705
Proud to launch bipartisan California Public Higher Education Caucus w @RepJeffDenham & students fr UC & CSU: http://ow.ly/wnjtp  #cphec,2014-05-01 15:51:16,4,6,461895638964518912
Help choose which Sacramento student has their work of art displayed in the US Capitol! Vote here: http://ow.ly/wlE3Y ,2014-05-01 14:50:28,0,0,461880337342398464
"Thx for your work! MT Headed to inauguration of CA Public Higher Ed Caucus with the 2awesome co-chairs, @RepBera and @RepJeffDenham #CPHEC",2014-05-01 14:08:53,2,2,461869873929670656
