Text,Date,Favorites,Retweets,Tweet ID
I want to thank many of you for your prayers and well wishes regarding the health of my wife Carolyn at this very difficult time. #FightOn,2017-02-23 14:56:21,13,4,834778931194630146
"The ""Laquan McDonald Camera Act o 2017"" will further efforts of increased police accountability and the restoration of trust among citizens.",2017-02-22 21:03:16,12,1,834508882940682241
I've introduced legislation to strip police departments of federal funding if they fail to enforce body cam policies. #LaquanMcdonald,2017-02-22 21:01:52,29,11,834508530757599233
America is a nation of laws. That includes due process. I'm for human rights. Are you? Join me Thurs. at IIT at 5:30 pm to discuss the ban.,2017-02-21 16:38:04,13,8,834079755070738432
"This week I met with Robert Kennedy, Jr. to discuss the rising number of black boys with autism and misdiagnosed behavioral issues.pic.twitter.com/NKdWAoV10s",2017-02-17 21:33:35,15,8,832704570572763136
So disrespectful @realDonaldTrump to tell a reporter to arrange a meeting with the CBC. Read the letter we sent you on 1/19. No games! #CBC,2017-02-16 22:38:31,55,23,832358525011640329
Solidarity with #ADayWithoutImmigrants. I've co-sponsored H.R. 724 to rescind and defund Trump's ban. I'll host a Chicago forum on  2/23.,2017-02-16 22:35:07,34,13,832357669633662980
"The U.S. is made of indigenous people, immigrants and descendants of slaves who've made our nation great. I am in solidarity! #DayWithout",2017-02-16 13:43:20,28,9,832223840226988034
I stand with Native Americans in protecting the human rights of the people and the rights of private landowners.  #DakotaAccessPipeline,2017-02-15 15:36:01,32,10,831889809794809860
Congress must provide responsible guidance for a fair process for moving energy projects that respect all rights. #DakotaAccessPipeline.pic.twitter.com/LjIiR0gVqa,2017-02-15 15:30:02,12,5,831888305344102400
I am standing with First Nations in defense of their human and property rights during this hearing.#DakotaAccessPipelinepic.twitter.com/bfnw4D0TNd,2017-02-15 15:26:31,32,8,831887420476026880
"Chicago is under siege from gun and economic violence. Today, a family mourns  their 11-yo child, and now a 2-yo has been shot and killed.",2017-02-14 20:59:58,8,13,831608948163743744
We have a National Security Advisor who can't trusted not to put America before Russia. Gen. Flynn must be fired immediately. #FireFlynn,2017-02-13 20:20:49,223,156,831236709006315521
The  gun violence that has gripped my city like a vice must end. My prayers are with Kanari Gentry and Takiya Holmes. We need justice.,2017-02-13 20:16:49,12,7,831235703463763969
@SenWarren will remain as persistent as she is consistent. Coretta S. King spoke truth to power on Sessions! Truth will prevail!  #PersistOn,2017-02-08 22:32:39,13,4,829457947214245889
@GovRauner Speaker Madigan are like Godzilla vs. King Kong fighting while IL families suffer from this budget brutality. #illinoisbudget,2017-02-08 22:22:02,4,1,829455272405917696
This @NPR story is exactly why I’m reintroducing my legislation to bring more transparency to the funeral industry.https://goo.gl/OAnNbf ,2017-02-08 20:29:05,15,5,829426847985369089
"What the @SenateMajLdr said about @SenWarren is right: She was warned. She was given an explanation. Nevertheless, she persisted. #PersistOnpic.twitter.com/90GsWJg1Rm",2017-02-08 15:50:08,164,92,829356647231397888
See my statement expressing concern with Sec. Devos at http://go.usa.gov/x9FMM  #QualityEducationforAllpic.twitter.com/B2CLLXOlPq,2017-02-07 21:14:30,10,5,829075891317780481
I sent a letter with colleagues to ask the @FCC General Counsel why he won’t defend prison phone rate rules. More at http://go.usa.gov/x9FpE pic.twitter.com/jcXEiHrmzX,2017-02-07 16:36:16,6,3,829005872357597184
Thank you UAO for the opportunity to speak and stand up for immigrant rights. #weareonepic.twitter.com/Qo4GIF6Iyi,2017-02-04 21:09:30,6,3,827987468540661763
 “Celebrating the start of Black History Month”https://twitter.com/i/moments/826797165452390400 …,2017-02-01 16:50:01,6,3,826835003652849664
Click here for the full text of my statement responding to President Trump's recent Executive Order. http://go.usa.gov/x9sQp pic.twitter.com/BurDMfFh91,2017-01-30 23:40:25,25,10,826213509897867265
"In my experience, the only way to beat a bully is to stand up and fight back; which, morally, I must do. (2/2)",2017-01-30 18:34:05,84,21,826136416124010496
President Trump’s executive order demonstrates the infantile evil acts of a street bully. (1/2),2017-01-30 18:33:58,52,13,826136387426607104
"I'm not protesting, but am at my wife's hospital bedside. I look forward to building a far better life for my constituents and nation.",2017-01-20 18:39:43,33,4,822513958250627072
Thank you @BarackObama for commuting Eric Wilson's sentencing:https://goo.gl/jn1fV4 ,2017-01-18 23:43:26,5,3,821865614935465984
In celebration of the life of Dr. King at Rainbow Push's Excel breakfast.pic.twitter.com/t7EbhhR5Up,2017-01-16 16:08:50,11,3,821026435519410176
RT if you oppose GOP vote to repeal the #ACA w/o a replacement which will #MakeAmericaSickAgain.,2017-01-13 18:41:13,25,39,819977620339224580
The DOJ released its report of the CPD finding systemic deficiencies in training view the full report: https://goo.gl/2frJLx ,2017-01-13 18:33:37,5,2,819975707191345157
pic.twitter.com/dhDPxLA3NR,2017-01-11 15:52:51,18,4,819210471173685251
"Thanks to the #ACA 850,000 people in Illinois have gained health coverage #ProtectOurCare",2017-01-04 22:18:29,75,24,816770805732347908
We welcome all the help we can get. Come visit my district @realDonaldTrumphttps://twitter.com/realdonaldtrump/status/815973752785793024 …,2017-01-03 18:12:31,21,23,816346517766340612
"In my district office, I hosted an Illinois Tollway Authority briefing regarding I-294\I-57 Phase 2 project coming in 2023.pic.twitter.com/7h0CqwuDy6",2016-12-12 23:14:27,4,1,808449968889561088
Signing of 21st Century Cures bill. We did it for minority clinical trials.pic.twitter.com/MZydPVYOI7,2016-12-08 16:46:38,7,4,806902819022405632
#pearlharbor75pic.twitter.com/Rcsur7n4D3,2016-12-07 16:35:47,7,4,806537702552272896
US infrastructure should be built with US products that support US jobs. Why won’t @SpeakerRyan support this?http://www.wsj.com/articles/water-bills-buy-american-provision-sparks-some-gop-concerns-1480709387 …,2016-12-05 16:02:40,6,3,805804592172769281
Happy birthday Illinois!pic.twitter.com/94WIG9qwWe,2016-12-02 21:16:01,3,1,804796285182246912
"This #WorldAIDSDay, we must recommit to the fight to #EndAIDS2030 through education, prevention & research. #WAD2016pic.twitter.com/yJs4iEMfIx",2016-12-01 16:01:34,8,1,804354762279911424
Blessings on this day of thanks. Happy Thanksgiving.,2016-11-24 20:52:11,10,4,801891183203090433
Englewood is bursting with new businesses and jobs opportunities and I am proud to open the new doors of Chipotle. #englewoodpic.twitter.com/HD7AA9sRo5,2016-11-14 20:29:44,9,6,798261656329617409
As we honor the men and women who served in our country's Armed Forces let's remember to say thank you. Happy Veterans Day!,2016-11-11 15:48:28,5,2,797103711558451200
#FlyTheW #worldserieschampspic.twitter.com/1fdHZgdrD7,2016-11-03 14:12:49,10,2,794180537548210177
Thank you to @RepCheri for joining today's Water Infrastructure Listening Session to discuss the issue of lead in schools.pic.twitter.com/5pr4OGVyB7,2016-10-27 22:07:32,12,7,791763285712506884
"Today's #PreserveHBCUs Day! Tell Congress: #PreserveHBCUs, fund HBCU
Historic Preservation Program @ $5+ million https://goo.gl/qcHIZW pic.twitter.com/Nx1p59kqK1",2016-10-26 16:37:30,13,13,791317845196021760
Come see me at that the National Archives panel on Revolutionary Movements : Black Power and Black Lives Matter. http://bit.ly/2e0ZMr8 ,2016-10-18 16:55:43,7,5,788423324829376516
I attended as guest speaker at the SRMBC's quarterly meeting with Congresswoman Robin Kelley and Chairman Mayor David Webb.pic.twitter.com/kl1znjAFOr,2016-10-06 15:08:11,4,3,784047606783770624
#NewBeginnings on the south side of Chicago with today's ribbon cutting ceremony for the Rosenwald Court Apartments.pic.twitter.com/bJQI4XxSpW,2016-09-30 22:02:52,6,5,781977639644983296
#warrior for peacepic.twitter.com/tObjQC72pD,2016-09-28 21:30:23,2,3,781244689513086976
Flint is not included in the Senate continuing resolution (CR) to fund the government past Sept. 30th #FundFlint,2016-09-22 21:00:56,9,9,779062951990923265
"Locally, a reported 26 Chicago Public Schools were found to have dangerous levels of lead in them. #timeforsafedrinkingwaterpic.twitter.com/f07dhYhMJC",2016-09-22 16:33:19,3,5,778995604382945280
#Studentdebt has become a $1.3 trillion problem. What would u spend your $ on w/o it? Tell us! #DebtFreeWishListpic.twitter.com/QPXOsDumIh,2016-09-21 18:16:50,9,8,778659265397522433
We need to address the longstanding problem of #policebrutality. Congress should act before we adjourn. #DoYourJob #TerenceCruthcher,2016-09-20 19:01:38,41,39,778308153985433601
American people want Congress to #DoYourJob. End gun violence in our community. Give us a vote. #NoFlyNoBuy #CloseTheLoophole #GunVote,2016-09-14 16:34:31,5,3,776096801954889728
"Rush’s Seeks Jobs in Meeting of Senate and House Conferees on S. 2012, the Energy Policy Modernization Act of...http://bit.ly/2c9qyeq ",2016-09-08 22:25:59,2,1,774010924319387648
Wear orange during Hunger Action Day to support the hunger-relief efforts of the Greater Chicago Food Depository.pic.twitter.com/IIfSUocxj4,2016-09-08 16:12:45,5,2,773916995653869568
"Rush, Durbin & Kirk to Introduce Bronzeville–Black Metropolis National Heritage Area Act: WASHINGTON — U.S. R...http://bit.ly/2bZ2JKn ",2016-09-07 21:04:26,3,2,773628013355204608
I stand squarely behind Kamau and his vision for our children at the new XS Tennis groundbreaking today.pic.twitter.com/E0MGTcw7eJ,2016-08-25 22:34:01,5,5,768939515692060672
pic.twitter.com/wgh5RbBWJ0,2016-08-17 22:46:58,3,2,766043674056720384
#SocialSecurity isn't just for seniors - it's also life & disability insurance that protects millions of children #SocSec81,2016-08-12 19:55:40,2,3,764188624741105664
The Mokena Lincolnway Democratic Organization keeps our community thriving. Thanks to Larry Gilman for the invite.pic.twitter.com/MndkYSoa04,2016-08-05 16:53:11,2,2,761605984389361665
@aimeelevitt Great article:http://goo.gl/6yBFZo ,2016-07-26 20:51:51,2,1,758042168321777668
U.S. Representatives Rush & Pallone Propose New Legislation for $5 Million Grant Program to Address Lead Pois...http://bit.ly/2aeNmYy ,2016-07-15 07:37:17,6,4,753855941242597377
"Congress made incremental changes to the 1996 Communications Act, yet it is in dire need of modernization.pic.twitter.com/o3rdrIwT5T",2016-07-14 14:17:47,6,3,753594344192507904
"Rush Statement on Dallas Shooting: WASHINGTON — Today, U.S. Representative Bobby L. Rush (D-Ill.) released th...http://bit.ly/29xRRzs ",2016-07-09 07:16:19,4,8,751676339686547456
#AmericasCollegePromise will make @POTUS' goal to make community college free for students a reality http://bit.ly/29lTmOn ,2016-07-08 17:00:58,3,0,751461085216112641
Congress has a moral responsibility to do more to keep guns out of the wrong hands.https://youtu.be/gc371kgqaSE ,2016-07-07 17:34:24,24,21,751107111074103296
@USNavy @aircraftcarrier @GW_CVN73pic.twitter.com/PPCowfEVOO,2016-07-05 03:01:26,4,3,750162643546243072
To our country's great day!pic.twitter.com/ok7sDLVKFn,2016-07-04 15:25:50,4,5,749987592599441408
Greater Chatham Initiative is the manifestation of countless hours of hard work and planning. Chatham is on the movepic.twitter.com/R1JMmDfEJL,2016-06-30 20:33:51,3,2,748615554647334912
"Rush Launches Greater Chatham Initiative, A Historic Neighborhood Development and Economic Growth Program: CH...http://1.usa.gov/29u1n4f ",2016-06-30 17:45:25,0,0,748573167338164224
Today marks a new beginning for the south side of Chicago as the Greater Chatham Inititiave.pic.twitter.com/WRzcA8KDOW,2016-06-29 19:23:46,12,7,748235530551304192
#NoBillNoBreakpic.twitter.com/XDJLwZdyLA,2016-06-24 16:35:12,9,7,746381171005751296
.@SpeakerRyan failed Americans–he & @HouseGOP left town w/o protecting them from suspected terrorists #NoBillNoBreakpic.twitter.com/gqNyjoyv58,2016-06-24 14:34:03,513,444,746350681959895040
The bells are ringing to call us for a vote & I have one message for @HouseGOP leadership: http://goo.gl/ZY54V0 ,2016-06-23 05:05:52,15,7,745845304193343489
Proud to join my colleagues to protest @HouseGOP's refusal to bring common-sense bipartisan legislation to the floorpic.twitter.com/gvUye583wo,2016-06-23 04:47:59,35,16,745840805034733568
I joined fellow @HouseDemocrats on the Capitol steps to discuss the impact of gun violence. http://goo.gl/QbCRac ,2016-06-23 04:43:47,13,7,745839749043208192
Happy Father's Day to all the men who make sacrifices for the young people in their lives.,2016-06-19 11:39:52,4,3,744494906673004544
"Congrats to Christian Cooper, Gold Medal Award Recipient from the 1st District for your excellent achievements.pic.twitter.com/2e428cy75q",2016-06-16 16:12:12,4,3,743476277026357248
"Today, I paid tribute to the life and legacy of the Greatest, Muhammad Ali:https://www.youtube.com/watch?v=BdqGMKqN1Xk …",2016-06-08 23:06:16,2,3,740681376584871936
"St. Bernard is here for the Englewood community, and I am so delighted . . . to be a part of its new opening.pic.twitter.com/ElmLzSIF4L",2016-06-06 17:21:59,4,5,739869961032732672
The greatest. #MuhammadAli,2016-06-04 05:58:15,5,4,738973117050028032
It is important for a bipartisan bill that supports a more comprehension energy agenda. No to H.Res. 744https://goo.gl/KcERie ,2016-05-25 19:51:20,4,3,735558890079850497
"May is National Foster Care Month. Ralph, a former foster care shared his story. Visit: https://goo.gl/gOrRgw pic.twitter.com/oiGqZjcoAH",2016-05-25 17:03:33,5,1,735516666902282241
Thanks to the AABE for the James E. Stewart Award. I appreciate the honor http://goo.gl/sOsS6t ,2016-05-24 21:21:04,0,1,735219087836598272
Proud to be a Member of the Congressional Voting Rights Caucus.pic.twitter.com/IZRE4W5l9z,2016-05-24 15:05:40,34,27,735124612183392256
@ChiUrbanLeague @sharirunner thank you for today's discussion on charting a way forward for Afr-American community.pic.twitter.com/p1JBHC9TXf,2016-05-19 14:29:17,5,5,733303516081586176
"CSU President, Dr.Thomas Calhoun is in the business of changing the narrative for the school's future.pic.twitter.com/LqlL8OZpba",2016-05-18 19:33:56,3,2,733017797949849600
Rush Congratulates Village of Crestwood for Successfully Securing an Independent ZIP Code: WASHINGTON — Today...http://1.usa.gov/23Jo742 ,2016-05-12 06:25:15,4,5,730644993006690305
Congratulations to @MayorPresta and Crestwood residents in securing a separate ZIP code for the villagehttp://goo.gl/QE3zsd ,2016-05-11 15:25:04,3,2,730418453631401985
Happy Mother's Day to the many women who make daily sacrifices for their love ones.,2016-05-08 16:25:59,4,3,729346621608099840
"Rush Welcomes http://Amazon.com ’s Decision to Expand Service: CHICAGO — Today, Congressman Bobby L. Rush... http://1.usa.gov/1W3GLUK ",2016-05-03 05:57:13,3,3,727376448487460864
I am pleased to learn that @amazon will serve everyone in the City of Chicago. http://go.usa.gov/cunvG  #EndRedlining #PrimeforEveryone,2016-05-02 19:44:55,2,2,727222354816946178
I spoke on the House floor this evening to address http://Amazon.com  Prime Free Same-Day Delivery redlininghttps://goo.gl/KLXVK8 ,2016-04-28 21:15:24,1,2,725795575183085568
#GovernmentBythePeopleActpic.twitter.com/28xWSOous0,2016-04-28 16:47:35,2,4,725728176618508288
"Met with members from the NEA, an organization committed to advancing the cause of public education.pic.twitter.com/PEJpBgWoXR",2016-04-28 16:37:03,1,2,725725526485291008
E&C markup brings to light addiction in our country and how treatment is addressed for communities of color https://goo.gl/vqr4Hs ,2016-04-27 22:08:41,0,1,725446597769891840
"In 2015, 4 states and 17 cities passed laws to raise the minimum wage. It’s time for Congress to do the same and #RaiseTheWage",2016-04-27 18:22:54,3,3,725389777034436608
@Amazon treat all neighborhoods fairly.http://goo.gl/W6Xw3E ,2016-04-25 20:54:58,0,1,724703271831654401
The Illinois General Assembly took a step in the right direction by funding our state's public institutionshttp://goo.gl/uGyS63 ,2016-04-22 22:40:09,0,1,723642575714979840
UP Initiative is a collaborative effort to reduce gun violence and increase economic development across the country.pic.twitter.com/Lj2obM3ElY,2016-04-22 18:08:13,4,4,723574140079345664
This Earth Day let's do something good for our planet. #EarthDaypic.twitter.com/6dT8zNhysF,2016-04-22 14:30:26,5,4,723519333733830656
#HarrietTubman,2016-04-21 01:45:54,4,4,722964544595865600
"@SecretaryFoxx or discussion, inspires me to believe the economic infrastructure of the nation is in capable hands.pic.twitter.com/SmNpCEWfi2",2016-04-14 18:08:01,0,1,720674987342970880
#Flint isn't alone—Congress must invest nationwide in lead poisoning prevention programs.pic.twitter.com/HDzK1hpkaB,2016-04-13 18:03:58,15,20,720311583881043968
Preparing to speak with MSNBC host @tamronhall about the 1994 Crime's Bill.pic.twitter.com/dpWg0z65wH,2016-04-13 15:26:36,17,8,720271977701879808
#NotOneMore parent should have to lose a child to gun violence. Congress must act. #HonorWithAction,2016-04-12 18:30:53,17,26,719955969145483266
"Enjoyed President Obama's U of C discussion about Supreme Court nominee, Merrick Garland and also spoke with @vj44.pic.twitter.com/zmsXYAdbz0",2016-04-07 23:06:19,11,8,718213343140556800
"Good luck to the students from @ChicagoState competing at @HCASC!
Tune in for updates at http://hcasc.com  #HCASC",2016-03-31 15:44:43,1,4,715565496146468864
"REMEMBER #MLK. A NEW @BillKurtis1 DOC EXAMINES HIS LEGACY WITH @REVJJACKSON @REPBOBBYRUSH. WATCH ON @DECADESNETWORK APR. 4, 48 YRS LATER.",2016-03-31 15:27:19,5,8,715561116521381890
Rush to Host Federal Grants Information Session: CHICAGO — U.S. Representative Bobby L. Rush (D-Ill.) will hos...http://1.usa.gov/21TK30H ,2016-03-07 22:15:31,1,1,706966537190551552
@PeaceCorps We commemorate the 55th Anniversary of the Peace Corps! #PeaceCorpsWeek2016,2016-03-01 21:31:02,2,1,704781011918450688
"@KeithEllison: ""getting money out of politics is really important for the Civil Rights Movement."" #BHM Watch:https://youtu.be/Ao2yKdB_WKg ",2016-03-01 20:40:06,0,3,704768196428087297
"Since its inception, Job Corps has trained almost 3 million out-of-work and underserved young people:http://goo.gl/Nd9Jxl ",2016-02-24 15:36:21,2,4,702517428627120128
I applaud President Obama for his leadership efforts to authorize the closure of Guantanamohttp://goo.gl/mQoraQ ,2016-02-23 18:59:45,2,3,702206226969526272
Rush and Chicago Delegation Send Letter to Secretary Foxx Requesting Local Hiring Contract Initiative: WASHING...http://1.usa.gov/1o8ogQz ,2016-02-13 04:21:48,2,5,698361403929862144
Rush Pushes to Move the 21st Century Workforce Legislation through the Committee Process: WASHINGTON — U.S. Re... http://1.usa.gov/1o961LE ,2016-02-12 08:02:00,1,3,698054430847991808
"Because of the man-made #FlintWaterCrisis, thousands of children are at risk of lifelong damage from lead exposure.",2016-02-11 17:06:54,7,4,697829172404711424
"My constituents from Chicago, Albert Embry, Sandra Davis and Janet Loving all from AFGE share their ideas.pic.twitter.com/HERmUTmVHM",2016-02-10 23:16:59,0,2,697559921441796096
@MikvaChallenge inspires me to connect with the city's youth to promote solutions driven dialogue.,2016-02-06 19:52:48,2,5,696058982654468096
Mikva Challenge weekend in Chicago is the start to empowering our nation's future leaders.pic.twitter.com/1H2Yfb90Iy,2016-02-06 19:42:02,2,4,696056272609767424
The #FlintWaterCrisis is an ongoing public health crisis. Flint families are the victims & they deserve the truth about how this happened.,2016-02-03 19:07:25,3,5,694960396852142080
Black History is American History #BHM2016! Visit http://www.blackfacts.com/  for more facts about our history.,2016-02-02 18:22:13,1,4,694586636710100992
"Black History Month started in 1926. The observance was proposed by Carter Godwin Woodson, an author and historian, as Negro History Week.",2016-02-01 21:29:30,6,7,694271379680706560
pic.twitter.com/x6iAVPrPmM,2016-02-01 17:16:56,1,2,694207819525033985
The president's executive order requires all businesses with 100+ employees to submit detailed info for #equalpayhttp://goo.gl/nJ3T8G ,2016-01-29 21:52:54,3,8,693190105092194304
Big ups to the @USSupremeCourt which backed a woman’s constitutional right to make her own reproductive health decisions in 1973. #RoevWade,2016-01-22 18:47:55,10,9,690606835636817921
Let us remember to follow Dr. King's example of being understanding and compassionate toward one another. #MLKDaypic.twitter.com/obxc2fIMeP,2016-01-18 19:29:13,29,27,689167679190618112
"Pres Obama: ""Why would we want to pass up the chance for American businesses to produce and sell the energy of the future?"" #climatechange",2016-01-13 02:36:38,10,13,687100914918920192
"Every modern day U.S. President has acknowledged the urgency of healthcare reform, but @POTUS answered the call w/ passage of the ACA. #SOTU",2016-01-13 02:26:31,8,12,687098367424524288
"We've witnessed significant accomplishments over the last 7 years: access to jobs, affordable health care, reforming criminal justice. #SOTU",2016-01-13 02:18:16,3,12,687096294586855424
"My letter to @JohnKerry asking him to ensure that the rights of my constituent, Dr. Alie Kabba, are being protected.https://goo.gl/XAeg2Q ",2016-01-07 17:09:33,2,7,685146264825147392
Rush Pushes for Reversal of USPS’ Decision Against Crestwood: WASHINGTON — U.S. Representative Bobby L. Rush (... http://1.usa.gov/1OPu33t ,2016-01-07 01:38:35,4,6,684911977890627584
I sent a letter to the Postmaster General calling for a reversal in USPS denying Crestwood’s request for a zip code.http://go.usa.gov/cRjex ,2016-01-06 22:01:01,1,2,684857226650075137
"I joined @ChicagosMayor, @cta and @ChiCityColleges leadership to announce the expansion of the Second Chance Programpic.twitter.com/DqtiasWIWg",2016-01-05 21:57:40,7,7,684493993938305025
"Rush Statement on H.R. 2029 -- Consolidated Appropriations Act, 2016: WASHINGTON — Today, U.S. Representative ...http://1.usa.gov/1ULZf8O ",2015-12-19 04:07:42,0,4,678064136358465537
"Our prayers are with the family of fallen Chicago firefighter, Daniel Capuano http://goo.gl/DRa33U ",2015-12-14 18:51:13,2,5,676474542253056002
"Today, I submitted a letter of support for the application of IDOT for federal grant funding under STEP: https://goo.gl/K9YTOJ ",2015-12-11 18:51:08,0,1,675387356996849666
Trust needs be restored between police and the communities they serve:https://goo.gl/FtflnL ,2015-12-03 20:24:31,3,8,672511752823812097
We must all be cautious and aware of our surroundings:http://goo.gl/asmTPY ,2015-11-30 12:35:39,1,5,671306595733774336
We will longer accept police brutality. #sameol'jimcrowpic.twitter.com/NNYwbs6LKH,2015-11-27 17:12:24,12,16,670289079800565760
Share this day with your loved ones and be thankful for all the things in your life. Happy Thanksgiving.,2015-11-26 15:37:00,2,2,669902684900753408
Rush Sends Letter to Illinois Governor Slamming Him for Denying Syrian Refugees: WASHINGTON — U.S. Representat...http://1.usa.gov/1SJJLAt ,2015-11-20 02:09:31,6,6,667525146521960452
Today I sent a letter to Governor Rauner condemning him for denying #SyrianRefugees. http://go.usa.gov/cTZDx ,2015-11-19 20:08:30,10,9,667434292486807552
@FactsOnClimate I will assist the WH Admin on its Clean Power Plan and EPA’s emission standards for new power plants. #FactsOnClimate,2015-11-17 22:16:57,1,1,666741841484718080
"At today's @HouseCommerce hearing, I asked the FCC to use its platform to address Chicago's gun violence:https://goo.gl/l895X1 ",2015-11-17 20:33:31,1,4,666715812342996992
No voice is too small to learn about how to end the gun violence in Chicago and across this country: http://goo.gl/ZGtTzX ,2015-11-12 21:09:34,4,11,664912947043549186
Proud to be a veteran. #VeteransDaypic.twitter.com/UfYNyRrmw9,2015-11-11 16:29:44,4,4,664480134662103040
"Rush Statement on President Obama’s Keystone XL Pipeline Announcement: CHICAGO — Today, U.S. Representative Bo...http://1.usa.gov/20C8jkP ",2015-11-07 10:35:06,1,5,662941336639705088
"Rush Reintroduces Gun Legislation after Learning of 9-year-old's Shooting Death: WASHINGTON — Today, U.S. Repr... http://1.usa.gov/1H5gQpS ",2015-11-04 01:11:22,2,8,661712305248301056
Barriers to voting are unacceptable! All voices must be heard. #RestorationTuesday #RestoreTheVOTEpic.twitter.com/u4ENe7FQ6m,2015-11-03 18:01:12,5,10,661604050979393536
"FACT: The bipartisan budget agreement will add 340,000 jobs in 2016 alone → http://go.wh.gov/BudgetDeal pic.twitter.com/OmFJI8Jd9k",2015-11-02 19:22:37,1,2,661262152007852033
"Congratulations, to the new Speaker of the U.S. House of Representatives, @SpeakerRyanpic.twitter.com/1EmVNgxtzY",2015-10-29 17:15:43,3,6,659780663760052229
"Today, I voted in favor of passing a House budget deal that increases spending caps for two years and raises the debt limit until 2017.",2015-10-28 22:26:18,1,1,659496437873549312
Today Dems are participating in #MIIAWhatsNext hearing to discuss ways to update #MakeItInAmerica plan to reflect today’s economic landscape,2015-10-28 17:20:21,1,2,659419443240509440
Today's FCC order to lower prison phone rates protects families and allows them to communicate with incarcerated loved ones. #PhoneJustice,2015-10-22 20:45:41,0,3,657296789968654336
