Text,Date,Favorites,Retweets,Tweet ID
Congratulations to Allison Zhang from Elk Grove for earning the Congressional Award for her outstanding public service in our community! #EarnedItpic.twitter.com/1jahXMWrn7,2017-11-29 22:55:27,9,3,936005716158107648
Thanks to American River College for giving me the chance to hear from students and educators. Listening to you is my most important job!pic.twitter.com/fTgoR3CoC8,2017-11-29 01:50:44,8,3,935687439875760129
Our local food banks do a tremendous job serving our community. Glad to hear the latest from the Twin Lakes Food Bank in Elk Grove on how they’re helping make sure that no local family goes hungry.pic.twitter.com/krhMNTQuAk,2017-11-26 20:25:05,7,3,934880710447521793
It’s Small Business Saturday- Remember to support our local small businesses today and shop small! #SmallBizSaturday #ShopSmallpic.twitter.com/8nnfhRyk2D,2017-11-25 17:01:04,7,5,934466980559671299
Great to get back to my roots as a doctor and drop by Kaiser Permanente Medical Center to see how they’re working to improve health care in our region.pic.twitter.com/MyeyfyVzs0,2017-11-24 18:45:06,28,5,934130775934558208
Happy Thanksgiving to you and your family!pic.twitter.com/GzLGNdJOxD,2017-11-23 17:01:51,18,4,933742404410249216
"Great to drop by the Elk Grove Senior Center and catch-up with local seniors being served by Meals on Wheels. Thanks to Meals on Wheels, more than 2,000 seniors in our community receive a nutritious meal and fellowship every weekday.pic.twitter.com/x6qeSIM2Oa",2017-11-23 00:10:05,14,4,933487785079648256
"It was good to get an update from the folks at the Cordova Food Locker and see the wonderful job they're doing serving our community. As we approach Thanksgiving, it’s important to make sure that everyone in our community is cared for.pic.twitter.com/DwntvNaRDI",2017-11-22 21:00:25,8,3,933440051102527488
"[Picture is circa 1970-1971, while Sal was serving in Cam Ranh Bay, Vietnam] 8/ END",2017-11-22 02:04:32,3,1,933154199096803328
"If you think you may need help, please call my office at (916) 635-0505 or visit http://bera.house.gov/gethelp  to learn more. We’ve helped return more than $4.5 million in owed benefits to local taxpayers and we’d be honored to help you, too. 7/",2017-11-22 02:03:39,4,2,933153976349966337
"As a doctor who has helped care for veterans, I know how much our vets sacrifice for our country – it’s critical we are there to support these heroes. 6/",2017-11-22 02:03:00,6,3,933153810247282689
"It turned out that while Sal was approved for his back-pay, the VA had never actually sent his benefits. My office contacted the VA about expediting Sal’s benefits and the situation was resolved within a month. 5/",2017-11-22 02:02:25,3,2,933153663832526848
"During this second treatment period, the VA had not yet provided Sal with his back-pay benefits, adding to his stress. As the bills mounted, Sal contacted my office to help with his VA disability claim – we got right to work. 4/",2017-11-22 02:01:29,5,3,933153430893465601
"Unfortunately, Sal later received tests that his cancer had returned. It was a very stressful time for Sal and his finances.",2017-11-22 02:00:37,3,1,933153212076404736
He decided to use his Department of Veterans Affairs benefits to pay for his medicine and started responding positively to treatment. 2/,2017-11-22 01:59:55,3,1,933153036951785473
"Thread: Meet Sal, an Army veteran and Carmichael native who served during the Vietnam War. He was diagnosed with prostate cancer related to his exposure to Agent Orange. 1/pic.twitter.com/a25ot5iAiX",2017-11-22 01:59:18,14,6,933152881414250497
"My most important job is listening to you. Thanks to everyone who came to my Town Hall yesterday in Elk Grove. If you couldn't make it, please always feel free to contact me to ask your questions: https://bera.house.gov/contact pic.twitter.com/jAuKGpkgdS",2017-11-19 21:37:08,5,9,932362126429171713
"Need help? My staff will be at the Elk Grove library on Tuesday from 10AM to noon to help you with backlogged veterans’ benefits, Social Security and Medicare issues, stalled tax refunds, and more. Learn more and RSVP: http://bit.ly/2hEJPHQ pic.twitter.com/kPlMrPichF",2017-11-19 19:35:42,4,4,932331567594303490
"Middle class families deserve tax reform that helps them get ahead. Instead, the Republican tax bill takes us backwards. I voted NO for the #GOPTaxPlanpic.twitter.com/TAEA8Nj6rE",2017-11-17 21:37:15,35,12,931637380200660993
"Honored to help welcome Jason McAlister, from @SMUDUpdate, to Washington to lead a discussion on jobs, education, and vocational training. Great panel – learn more about it here:http://bit.ly/2jxkHqE ",2017-11-17 03:42:03,1,2,931366798531973120
Remember: Hosting a Town Hall this Saturday so I can hear directly from our community about what matters most. RSVP:http://bit.ly/2hBbsF5 ,2017-11-16 01:10:06,12,6,930966170060156929
It’s always a pleasure when @PPMarMonte drops by the office – we’re ready to fight for women’s health care! #StandWithPPpic.twitter.com/FcWmcJRpOc,2017-11-15 22:53:28,19,10,930931785344651265
I’m hosting a Town Hall this Saturday to hear from Sacramento County! Learn more and RSVP here: http://bit.ly/2hBbsF5 pic.twitter.com/JnKuF5rAT8,2017-11-15 02:49:07,22,9,930628701766680576
Need college financial aid? Cash for College Workshop tomorrow at Monterey Trail High School in Elk Grove from 6:00PM to 8:00PM. Learn more and RSVP:http://bit.ly/2yB3wXV ,2017-11-14 02:30:49,2,1,930261710799327232
"It’s Open Enrollment for Covered CA, our state’s health insurance marketplace. See how you can #GetCovered:http://bit.ly/2i6IUk6 ",2017-11-12 19:55:04,8,8,929799729235546113
"We were able to help Richard, a Vietnam War veteran from Elk Grove. Can we help you? http://bera.house.gov/helpforvets  #VeteransDaypic.twitter.com/brGhnONuwr",2017-11-11 19:42:26,15,9,929434160061669376
"Thank you, veterans. #VeteransDaypic.twitter.com/fHRhWOPNhr",2017-11-11 19:09:47,11,4,929425945223626753
"As we come together to commemorate #VeteransDay tomorrow, please know my office is here to serve our heroes however we can:http://bera.house.gov/helpforvets ",2017-11-11 02:33:24,8,7,929175194601705473
Please call us at (916) 635-0505 or visit http://bera.house.gov/helpforvets  to learn more. 10/ [END] #VeteansDay,2017-11-10 19:48:18,2,3,929073248591077378
"As we come together to commemorate #VeteransDay tomorrow, please know that my office is here to serve our heroes however we can. 9/",2017-11-10 19:47:35,3,2,929073068407951360
It was the least my staff and I could do after Virgilio’s service to our country. 8/ #VeteansDay,2017-11-10 19:46:42,1,1,929072847389065216
Including the tens of thousands of dollars in benefits he was owed. 7/ #VeteansDay,2017-11-10 19:46:11,1,1,929072714807152647
"That’s when he contacted my office for help. With our help, he began receiving his benefits within a few weeks -- 6/ #VeteansDay",2017-11-10 19:45:30,1,2,929072544212283393
"For two years, he contacted the VA repeatedly and was told to wait while his bills continued to pile up. 5/ #VeteransDay",2017-11-10 19:44:55,1,1,929072396363010048
"But for 2 years, Virgilio did not receive the disability benefits he’d been promised by the Department of Veterans Affairs. 4/ #VeteransDay",2017-11-10 19:44:04,2,3,929072182541602816
Virgilio was ready for a well-deserved retirement in Elk Grove. 3/ #VeteransDay,2017-11-10 19:43:26,2,2,929072022797332480
After serving his country in the Air Force for more than 22 years on Active Duty & for 10 years in the Air Force Reserve 2/ #VeteransDay,2017-11-10 19:42:45,2,1,929071851682304000
"Thread: Today, I want to share a story about a Sacramento County veteran named Virgilio. 1/ #VeteransDaypic.twitter.com/QHboP941Ig",2017-11-10 19:41:54,10,4,929071636921442304
"This #VeteransDayWeekend, I was honored to present WWII veteran Glen Stout with his lost medals. Thank you, Glen, for your years of service.pic.twitter.com/h5zAGQgb2k",2017-11-10 18:32:32,8,4,929054179800289280
Great to meet with Astronaut Jack Fisher – he just returned to Earth last month after a 136 day space mission!pic.twitter.com/oVOj2SmS2l,2017-11-07 22:13:44,10,3,928022684344209408
"Need help? My staff will be at the Sylvan Oaks library tomorrow from 10AM to noon to help w/ vets benefits, Social Security, and more.pic.twitter.com/gNIP8bXWE5",2017-11-06 22:38:33,8,6,927666540354396161
Tune in now to MSNBC for my take on President Trump's visit to Asia -- security and increasing economic partnerships.pic.twitter.com/yxQr5IyNzf,2017-11-06 15:30:20,6,1,927558776777068544
Honored to discuss how we can empower women & girls around the globe w/ former First Lady Laura Bush & Afghan First Lady Rula Ghani.pic.twitter.com/TpH9OsqMpK,2017-11-04 19:07:36,9,2,926888677661380608
A woman’s health decisions should be between her and her doctor – not her boss or D.C. politicians. #HandsOffMyBC #WomensHealth #TrustWomenpic.twitter.com/yXfFUYgfVi,2017-11-02 22:05:45,103,44,926208735160229889
Open Enrollment begins today! See how you can get health insurance for 2018 or a plan that works better for you: http://www.coveredca.com ,2017-11-01 21:18:59,19,11,925834579532972032
"Hope everyone has a great time trick-or-treating tonight. From my family to yours, #HappyHalloween!pic.twitter.com/yUKFUMJHt8",2017-10-31 17:54:26,39,3,925420716207624193
Introduced new bill to boost our cybersecurity infrastructure and protect our energy grid. Learn more:http://bit.ly/2zUY9CZ ,2017-10-30 22:03:31,12,7,925121011862900738
"As a doctor, I can’t emphasize enough how important it is to get your flu shot. Find a FREE Sac County flu clinic: http://bit.ly/2xTvtZJ pic.twitter.com/KPtdkkt7ex",2017-10-29 17:30:13,25,16,924689845942931457
Remember- Today is #TakeBack day! Drop off your expired & unused meds: https://bera.house.gov/drugdropoff https://twitter.com/RepBera/status/923308032729210880 …,2017-10-28 16:20:43,5,4,924309965820579840
Don’t forget - #TakeBack day is tomorrow! Drop off old meds tomorrow to help address our opioid epidemic:http://www.bera.house.gov/drugdropoff ,2017-10-28 00:35:04,8,9,924071985059192833
#FlashBackFriday: Dropped off old meds on #TakeBack Day. The next Take Back Day is tomorrow! Find locations: http://www.bera.house.gov/drugdropoff pic.twitter.com/OxQZtYE0uv,2017-10-27 21:38:11,3,6,924027470944317442
Proud to support Protect Access to Birth Control Act to reverse Pres. Trump rule that lets bosses deny women birth control. #HandsOffMyBCpic.twitter.com/YdX2Skt8rn,2017-10-26 21:04:51,42,12,923656696760881152
Dropped off unused prescriptions to help get the word out for Saturday's upcoming #TakeBack Day! Drop off yours: http://bera.house.gov/drugdropoff pic.twitter.com/5mtYKTozVl,2017-10-25 21:59:23,13,7,923308032729210880
I recently got my flu shot – have you gotten yours yet? Get your flu shot for free through Sacramento County: http://bit.ly/2xTvtZJ pic.twitter.com/DUc9yLhFql,2017-10-24 20:55:51,19,5,922929656533266433
"Need help? My staff will be at the Fair Oaks library tomorrow from 10AM - 12 noon to help w/ vet benefits, tax refunds, Medicare, and more.pic.twitter.com/rYrRU2mmPv",2017-10-23 19:13:47,2,5,922541580845813761
Thinking about our firefighters & all impacted. If you or anyone you know needs help visit:http://www.disasterassistance.gov ,2017-10-21 19:22:19,5,5,921818950895366146
National #MammographyDay is an important reminder for women & their DRs to talk about early detection. Learn more: http://bit.ly/2yVoaFU ,2017-10-20 21:24:25,14,4,921487290832183297
"October is Domestic Violence Awareness month. If you or someone you know needs help, please call this number below.pic.twitter.com/rEKMUjNHWl",2017-10-20 01:05:50,12,15,921180626161668096
Birth control is health care. I oppose President Trump’s new birth control policy & want to know your views: http://bit.ly/2gibBfZ pic.twitter.com/wU3eOjXwxM,2017-10-19 01:58:51,20,4,920831578829402112
I strongly oppose President Trump’s decision to let employers deny birth control coverage. What do you think? Survey:http://bit.ly/2gibBfZ pic.twitter.com/yMgeLVF1fJ,2017-10-17 22:09:57,15,7,920411586887667712
My message to the Trump administration is clear: stop playing politics with people’s health care. #ProtectOurCare #PatientsOverPoliticspic.twitter.com/y3lwvPfco1,2017-10-16 19:01:16,50,36,920001714178097153
"Need help? Staff at Southgate library on Tue from 10AM to noon to help you w/ vets benefits, tax refunds, and more: http://bit.ly/2fVhXhK pic.twitter.com/40i6dia4Ex",2017-10-15 22:15:07,3,3,919688112971894784
President Trump's actions are destabilizing the Korean peninsula. Read my op-ed on confronting this threat: http://bit.ly/2g8kSnb pic.twitter.com/5Y42IBZrlo,2017-10-15 20:10:07,33,16,919656656258129923
Let’s fix what isn’t working and make it better – not play politics with people’s lives. #ProtectOurCare #PatientsOverPoliticspic.twitter.com/qTP0p3U0hX,2017-10-15 18:20:10,27,9,919628985323147264
President continues to undermine our efforts w/ North Korea. It's time we get serious about diplomacy. See my op-ed:http://bit.ly/2g8kSnb ,2017-10-14 20:05:07,29,12,919293009488990213
My message to the Trump administration is clear: STOP playing politics with people's health care #ACASabotage #ProtectOurCare,2017-10-13 20:45:01,35,14,918940662883606529
Creating confusion & undermining insurance markets less than 3 weeks before enrollment hurts those who need insurance the most! #ACASabotage,2017-10-13 20:43:07,15,12,918940182396723200
Trump's decision will raise premiums and actually *increase* the deficit according to the @USCBO #ACASabotage,2017-10-13 20:41:26,14,9,918939757975080960
"Instead, President Trump has undermined the #ACA at every turn, just to fulfill a political promise. That's unacceptable #ACASabotage",2017-10-13 20:39:14,20,11,918939206667431938
"Despite multiple failed attempts to repeal the #ACA, I was hopeful we could finally improve health care in a bipartisan manner #ACASabotage",2017-10-13 20:38:04,22,7,918938913481338880
Every doctor swears an oath to do no harm -- it's time the Trump administration do the same #ACASabotage,2017-10-13 20:36:50,26,9,918938602515648512
"As a doctor, this is sabotage, plain and simple. Why is this administration so set on hurting millions of Americans? #ACASabotage",2017-10-13 20:35:12,32,18,918938191532625920
The Trump administration's decision to end #ACA subsidies puts a political promise over the health of millions #ACASabotagepic.twitter.com/RJAwsbukEN,2017-10-13 20:33:17,53,35,918937709514764289
Extremely disappointed by @POTUS decision to sabotage health insurance. We need to fix ACA in a bipartisan way.http://nbcnews.to/2yf5Mqw ,2017-10-13 00:28:50,45,19,918634601152700416
Make sure to close your doors and windows! 4/ [End],2017-10-11 20:06:59,5,4,918206314228174849
"The fires have led to a sharp drop in air quality in our region, so please stay safe. 3/",2017-10-11 20:06:18,7,4,918206142794338305
My heart goes out to everyone who has been impacted and to our firefighters who are doing a tremendous job. 2/,2017-10-11 20:05:40,5,2,918205984966930432
"Like all of you, I’ve been watching wildfires raging through Northern California with great concern. 1/http://bit.ly/2yhm7eg ",2017-10-11 20:05:16,16,5,918205881602461697
"On #DayOfTheGirl, I remember @Malala's tweet from Monday. Let's celebrate by supporting & empowering girls across the world #GirlsBelongHerehttps://twitter.com/malala/status/917414203186667520 …",2017-10-11 19:24:14,16,4,918195556618592262
"Happy Birthday to Eleanor Roosevelt! She remains a terrific role model, leader, and inspiration to us all.pic.twitter.com/glz9AHzyeF",2017-10-11 16:10:05,28,10,918146698173669376
Republicans & Democrats must work together to #StopTheHIT & lower health costs. Read my op-ed w/ @RepErikPaulsen:http://bit.ly/2yaqmGg ,2017-10-10 22:09:19,10,6,917874714713952256
"Need help? Staff at Arden Dimick library on Tue 10 AM-noon to help w/ vets benefits, Social Security, & more. RSVP: http://bit.ly/2fVhXhK pic.twitter.com/vohAYktcos",2017-10-08 17:45:06,9,5,917083443745492993
I’ve been disappointed by how @POTUS has done in his first 8+ months. Want to check-in to get your thoughts:  http://bit.ly/2fViJeZ pic.twitter.com/SRhlsmNTph,2017-10-07 19:56:10,16,6,916754040347938818
"And every American deserves quality, affordable health care to lead healthy lives -- that means contraception #HandsOffMyBC [10/ ]",2017-10-06 18:22:03,61,27,916367969554444288
"Every doctor swears an oath to do no harm, but this #birthcontrol decision does a great deal of harm to women & families #HandsOffMyBC [9/ ]",2017-10-06 18:17:46,454,198,916366888900399104
62 million women use birth control. My message to the Trump admin is simple: stop playing politics with women's health #HandsOffMyBC [8/ ],2017-10-06 18:15:32,66,37,916366328784711681
This #birthcontrol rule will make health costs more difficult for millions of families & place a large financial burden on women [7/ ],2017-10-06 18:13:57,57,30,916365930950782977
"As doctors, we listen to patients, answer their questions, & empower them to make the best decisions that best fit their lives [6/ ]",2017-10-06 18:11:11,37,19,916365231340781569
A woman's health decisions should be between her & her doctor -- NOT her boss or Washington politicians #HandsOffMyBC [5/ ],2017-10-06 18:09:44,68,40,916364868873261056
#BirthControl is health care. It enables women to live healthier lives & enhances their economic security #HandsOffMyBC [4/ ],2017-10-06 18:08:24,63,43,916364533563822081
"As a medical professional and public health expert, today's decision on #birthcontrol is unacceptable #HandsOffMyBC [3/ ]",2017-10-06 18:04:23,58,30,916363523160190977
This rule will allow bosses to deny #birthcontrol coverage and decide what's best for women #HandsOffMyBC [2/ ],2017-10-06 18:03:02,42,29,916363183434141696
"As a doctor, I'm deeply concerned & angered by the administration's decision to repeal the contraception coverage requirements in #ACA [1/ ]",2017-10-06 18:01:02,184,95,916362679085944832
"Birth control is health care. As a doctor, I believe we should #TrustWomen to make their own health decisions. #HandsOffMyBC #WomensHealthpic.twitter.com/4mVwZaeSNq",2017-10-06 17:24:35,129,96,916353506998718464
"As a doctor, I’m outraged by Pres. Trump’s decision to make it harder for women to access birth control. RT if you agree. #HandsOffMyBCpic.twitter.com/3znteDY5VY",2017-10-06 15:57:37,141,171,916331621380509696
The #Rohingya are being relentlessly persecuted by the Burmese government. The U.S. must help address this crisis #RohingyaCrisispic.twitter.com/nLEEE2MbXM,2017-10-05 21:04:13,25,12,916046388848398338
It was great to speak at @TheHill's Improving Patient Health forum. We must continue to find bipartisan solutions to improve health care.pic.twitter.com/p4P74o0eYf,2017-10-05 15:36:06,20,11,915963816445403136
Need help with college financial aid? Cash for college workshop tomorrow to help #CA07:http://bit.ly/2fJDRUT ,2017-10-04 15:56:03,2,5,915606449862184962
"Voted against HR 36- radical assault on women’s health. Women should be in charge of their health decisions, not politicians. #TrustWomenpic.twitter.com/CR9JBt6jS4",2017-10-04 01:38:15,53,18,915390578266910720
Thank you all for tuning in to our telephone town hall tonight! It's an honor to serve Sacramento County every daypic.twitter.com/3UKICiVVBR,2017-10-03 01:52:53,33,9,915031873348304897
"As Vice Ranking Member of Foreign Affairs Cmte, pushed Trump Admin to abandon reckless State Dept cuts & to fill key diplomatic posts.pic.twitter.com/8J9tXwaOf9",2017-10-01 19:05:12,34,11,914566889489223680
"Now that Senate won’t consider disastrous #GrahamCassidy, time for real a Prescription to #ProtectOurCare: http://bit.ly/RxtoProtectOurCare …pic.twitter.com/8dmKgbJY3b",2017-09-30 18:10:07,21,14,914190637221781504
"Happy Birthday to the Veterans of Foreign Wars, which was founded 118 years ago today. To all of our veterans, thank you.pic.twitter.com/kg6TqhWEBG",2017-09-29 20:51:09,27,9,913868773433708544
.@POTUS has served for 8+ months. I’ve been disappointed by his actions & want to check-in to get your views: http://bit.ly/2fViJeZ pic.twitter.com/vQy4jYVQRN,2017-09-28 21:07:42,11,9,913510551183134721
"As a doctor, America's investment in global health is a symbol of our indispensable leadership. We must fund these critical services.https://twitter.com/care/status/913413312121118723 …",2017-09-28 15:26:07,25,11,913424587991523328
So glad to see @SteveScalise back in action. Welcome back!https://twitter.com/stevescalise/status/913405166178783232 …,2017-09-28 15:02:24,8,0,913418623087206401
Know a young person who’s wants to make a difference? My local office is looking to hire more interns! Apply today: http://bit.ly/2mmOPnX pic.twitter.com/MnDKevIQ0C,2017-09-27 21:25:39,16,11,913152680700387328
"As a doctor, I am gravely concerned about the humanitarian crisis in #PuertoRico. Congress must pass an aid package. My statement below:pic.twitter.com/rqGbbXVl9j",2017-09-27 14:24:16,126,74,913046638700179456
This is great news. Time we come together to solve our health care challenges and put people over politics #ProtectOurCarehttps://twitter.com/politico/status/912741067539255296 …,2017-09-26 18:54:27,27,6,912752241752383489
"As a doctor, I’m committed to expanding access to contraception & women’s health care. #WCD2017 #WorldContraceptionDaypic.twitter.com/XaTj3g9pI1",2017-09-26 18:20:07,30,13,912743602543104007
"Glad to be a part of @POLITICOLive's discussion of #healthcare & patient care. All Americans deserve affordable, quality health care.pic.twitter.com/51n7BQS1Xj",2017-09-26 13:14:59,20,7,912666811396653057
"Thanks to all who came to my office’s Brain Health Forum. As a doctor, I’m committed to helping #CA07 seniors address Alzheimer’s.pic.twitter.com/hUbeliYJ8J",2017-09-25 20:05:08,9,4,912407642836004864
ICYMI: Joined w/ Fire Chief McLaughlin to announce major new grant for Cosumnes Fire Department!pic.twitter.com/5JCTSs8CGW,2017-09-25 15:45:52,6,3,912342396301664256
Join w/ all Americans to commemorate Gold Star Mother’s Day to honor mothers who lost children in service to nation http://bit.ly/2ylz975 ,2017-09-24 17:30:15,18,10,912006275583631360
Real pleasure to catch-up w/ Cadet Adamson at my office’s Service Academy Info Day. See how to apply: https://bera.house.gov/academynominations …pic.twitter.com/Hlsa7Znprd,2017-09-23 19:10:05,8,5,911669015277445120
ACA Patient’s Bill of Rights took effect 7 years ago. #ACARepeal would only make things worse – let’s fix & make it better! #ProtectOurCarepic.twitter.com/Zw7CX719Kn,2017-09-23 15:50:05,32,18,911618683386114048
Thanks to the Elk Grove Senior Center for hosting our Senior Scam Stopper workshop. Need to ensure #CA07 can protect themselves & loved onespic.twitter.com/uU6g1yfxZE,2017-09-23 01:02:04,22,5,911395203273170944
Latest #ACARepeal ends essential benefit protections millions rely on. No more DC games – time to #ProtectOurCare: http://bit.ly/RxtoProtectOurCare …pic.twitter.com/CqDvsKShQX,2017-09-23 00:05:05,11,11,911380866064162816
It's time Congress take that same oath #ProtectOurCarehttps://twitter.com/repbera/status/910189236514639872 …,2017-09-19 17:11:25,60,30,910189598273351681
"As a doctor, I swore an oath: to do good, to do no harm, & to help patients make the best health care decisions for their own circumstances.",2017-09-19 17:09:59,15,7,910189236514639872
Millions of Americans rely on Medicaid for care -- #GrahamCassidy hurts this vital program. It's time Congress put people over politics,2017-09-19 17:07:26,41,20,910188597940285445
The #GrahamCassidy bill would gut protections for preexisting conditions & severely limit care. Stop putting politics over people's health,2017-09-19 17:05:41,67,39,910188156854599680
We’re hosting a Brain Health Forum on Wednesday to give info & resources on Alzheimer’s disease. Learn more & RSVP: http://bit.ly/2vVu7xd pic.twitter.com/C02WtSSGCa,2017-09-19 00:32:26,11,3,909938196150136832
"Instead of kicking millions off health care, we must work together to #ProtectOurCare. Read my @sacbee_news op-ed: http://bit.ly/2xcIi4P pic.twitter.com/5kwTJnjNnn",2017-09-17 21:20:07,41,19,909527411213074432
Need help w/ vets benefits or a Social Security issue? Drop by Franklin library on Tue from 10AM-noon: http://bit.ly/2gSVHbS pic.twitter.com/JIsSjINwp8,2017-09-17 17:20:11,8,3,909467029475872768
We can’t abandon U.S. leadership in support maternal & child health. Read my op-ed here:http://bit.ly/2y3Sz0e ,2017-09-16 17:55:05,7,2,909113423107170304
Today we commemorate National #POWMIA Day. Never forget all who have served our country.pic.twitter.com/KnVTtTEP33,2017-09-16 02:21:32,26,14,908878489805312000
"54 years ago today, four girls lost their lives in a KKK bombing in Birmingham. Never forget those lost in the struggle for equalitypic.twitter.com/j7oHzByU39",2017-09-16 01:44:54,115,81,908869269990948865
Don’t forget – my office is hosting a Service Academy Information Day on Saturday! Details and RSVP: http://bit.ly/2eMCxnA pic.twitter.com/pN9NdNjaEL,2017-09-15 01:31:07,5,4,908503411271831552
.@USCBO concluded the Trump administration's threats have increased premiums by up to 15%. Unacceptable! Congress must fix this uncertainty.https://twitter.com/voxdotcom/status/908410038129217537 …,2017-09-14 20:20:25,35,27,908425223036395520
Hosting a Brain Health Forum on 9/20 to connect #CA07 residents w/ latest on Alzheimer’s info and resources. RSVP: http://bit.ly/2vVu7xd pic.twitter.com/pyNSWsA9xF,2017-09-14 02:00:50,5,2,908148503829913601
