Text,Date,Favorites,Retweets,Tweet ID
"It is with a heavy heart that we say goodbye to Dr. Amy Reed – a recognized physician, exemplary mother and wife,...http://fb.me/8E1fjEgf5 ",2017-05-25 22:00:04,1,2,867862859077881860
"#TBT to talking about real government reform measures like:
 Enacting Term limits
 Ending partisan... http://fb.me/1oJMmfxyG ",2017-05-25 17:00:07,5,1,867787373173755904
"Dr. Amy Reed was a fighter, not only for herself, but others. She will be missed dearly.

My statement: http://fitzpatrick.house.gov/media-center/press-releases/fitzpatrick-statement-passing-dr-amy-reed …pic.twitter.com/q5Jx3HzfgV",2017-05-25 13:52:15,11,9,867740097986400256
"ICYMI: Read my op-ed for Levittown Now & Newtown, PA Now about making every week #PoliceWeek http://fb.me/XKJnKk0c ",2017-05-25 12:00:03,2,1,867711862443565058
"Last week - during #PoliceWeek - we lost Bucks County Sheriff's Office Deputy Keith Clymer.

My thoughts and... http://fb.me/8ViWVR6UD ",2017-05-24 21:30:07,0,0,867492932533854209
Awesome event last weekend at Brian's Harley-Davidson's Military Appreciation Day! Thanks to everyone who came... http://fb.me/11x0Xz3Fu ,2017-05-24 17:00:05,1,0,867424979989737472
Proud to join the House in passing @RepMcCaul's DHS Blue Campaign Authorization Act aimed at combating human trafficking. #endtraffickingpic.twitter.com/9PnNiCTFFg,2017-05-24 12:59:18,9,4,867364383080542210
"While businesses regularly deal with change orders in the private sector, contractors and subcontractors on...http://fb.me/91O0zCTqn ",2017-05-23 22:00:05,2,1,867138089738784768
The Problem Solvers Caucus is eager and ready to engage with all stakeholders in the important work on...http://fb.me/1mqh9fJ7G ,2017-05-23 22:00:03,4,6,867138078904905729
Stopped by the St. Patrick's Day Parade Committee Beef & Beer at the AOH Bristol Div. 1 last week on the way back... http://fb.me/1oXWiLUrJ ,2017-05-23 17:00:03,1,1,867062583496515585
"You never know what will happen when you get 500 CPAs in a room... but you can always count on a good time!

Had... http://fb.me/8sOxadGC3 ",2017-05-23 12:00:03,1,0,866987086733340672
"Ahead of President Donald J. Trump's trip to Israel this week, I had a productive meeting with Consul General of... http://fb.me/MHCDpQE2 ",2017-05-22 22:00:03,2,0,866775693383925760
Proud of these guys & their desire to serve our country - @Bensalem High School Marine Corps JRTOC http://fb.me/6akOkBwhb ,2017-05-22 17:00:03,3,1,866700195932905474
"A government of, by and for the people — not just political eliteshttp://fb.me/72KHHZoFo ",2017-05-22 12:00:03,58,17,866624697575895040
We marked #PoliceWeek2017 by passing several bills designed to honor the law enforcement community’s sacrifices... http://fb.me/8WsIZmnJC ,2017-05-21 21:00:05,4,0,866398213565296643
"If you went to Egan like me, then you knew Father Fidelis & Brother Larry. 

For 60 years, the Franciscan Friars...http://fb.me/zzc1GPcf ",2017-05-21 14:00:07,5,3,866292525669244928
Congratulations to Valley Day School in #Morrisville for their Sanctuary Model accreditation - an important step... http://fb.me/3NHTGdSir ,2017-05-20 14:00:08,3,1,865930140026589185
This week marks one-year since the EPA established a Health Advisory Level of 70 parts-per-trillion to limit the... http://fb.me/7Wk7oM0Fk ,2017-05-19 22:00:05,5,2,865688534732206080
Thanks to Chairman Michael McCaul and the Homeland Security Committee for hosting a meet & greet with some... http://fb.me/64RainKjb ,2017-05-19 17:00:03,4,3,865613030754848771
"Last year, ambush-style killings of law enforcement officers increased by 167%. Yet, each day, tens of thousands... http://fb.me/8cD2isMux ",2017-05-19 12:00:04,2,1,865537536457793536
"When our local small businesses succeed, they create opportunity & invigorate our communities.

As a member of... http://fb.me/6HFl67018 ",2017-05-18 17:01:04,6,2,865250898599170050
"As a member of the law enforcement community for nearly a decade and a half, I know firsthand the service and...http://fb.me/1k5vCYirc ",2017-05-18 12:00:03,2,0,865175146339979264
Had an absolute blast local postal employees at the National Association of Letter Carriers Stamp Out Hunger food... http://fb.me/27e6kNmkm ,2017-05-17 12:00:08,1,0,864812780477710339
"With all the politicking in Washington right now it would be easy to push this issue to the back burner, but I...http://fb.me/Nt0nuYkq ",2017-05-16 22:01:05,6,0,864601625251520512
"Thanks to everyone who braved the wet weather Saturday for the NAMI of PA, Bucks County Chapter Stride for Mental... http://fb.me/A2ygdQ0c ",2017-05-16 17:00:05,2,0,864525874602921984
Honored to address the Bucks County Police Chiefs Assoc. about my push for increasing support for families of our... http://fb.me/76NLXT3EC ,2017-05-16 12:00:03,2,1,864450371758043137
Thanks to Ofc. Marks & the Middletown Township Police Department for the ride-along this morning:... http://fb.me/7MCHxSaEy ,2017-05-15 22:00:05,6,1,864238985073352704
Thanks to @MiddletownTwp Police for the ride-along this morning. Be sure to thank an officer this #PoliceWeek2017https://www.youtube.com/watch?v=uD70yo3LIvQ&feature=youtu.be …,2017-05-15 16:53:55,8,1,864161933712388100
"As a member of the law enforcement community, I saw firsthand the service and profound commitment to duty of... http://fb.me/8zkULxepf ",2017-05-15 12:00:03,3,2,864087983162609664
"Congratulations to Hatfield's Ryan O'Rourke for winning the 
Ancient Order of Hibernians - Division 4 (Hatfield)... http://fb.me/69ShANaNC ",2017-05-14 22:00:03,0,0,863876587019784192
Happy Mother's Day! http://fb.me/8Sd5GmwOf ,2017-05-14 14:00:04,5,0,863755797557374976
Spoke with local #EMS chiefs about the fight against the opioid epidemic & its continuing impact on our... http://fb.me/265NSRBa7 ,2017-05-13 22:00:09,6,1,863514227893555201
Always a great time getting together with colleagues from around the region & highlighting areas of agreement... http://fb.me/zonhnFg7 ,2017-05-13 17:35:03,0,0,863447512807604224
"Thanks so much to Kristen King & the amazing students at 
William Tennent High School for inviting me to their... http://fb.me/1PZEjp5Dt ",2017-05-13 13:00:04,2,0,863378311468265472
"Three of my sisters are nurses. I know firsthand the hard work, long hours & selfless commitment this job... http://fb.me/1olB8u6HA ",2017-05-12 22:06:03,21,2,863153324266278913
"Each of us can probably remember a teacher who made an impression on our life — as an educator, a coach or a... http://fb.me/7TacO2iJr ",2017-05-12 12:00:05,7,0,863000824989052928
Spoke with members of the American Bar Association about the importance defending funding for the Legal Services... http://fb.me/3cUGf9TLk ,2017-05-11 22:00:04,2,0,862789430737764353
Spoke with members of the American Bar Association about the importance defending funding for the Legal Services... http://fb.me/6KXw017QI ,2017-05-11 22:00:03,1,0,862789424467386368
"#TBT to my first speech to the House of Representatives - urging for real government reform measures like:
... http://fb.me/2TaQWhZAA ",2017-05-11 12:00:04,2,1,862638432480309249
"#TBT to my first speech to the House of Representatives - urging for real government reform measures like:
... http://fb.me/4Q8ZFWYAW ",2017-05-11 12:00:03,0,0,862638431788302336
Proud to join our friends in the Indian community at the inauguration of the Shreenathji Haveli temple in #Bensalem! http://fb.me/FnwpRizu ,2017-05-10 17:00:04,1,0,862351542111920128
I'm working to send the Synthetics Trafficking and Overdose Prevention (STOP) Act to President Trump's desk.... http://fb.me/10tAycbss ,2017-05-10 12:00:04,7,0,862276046045028357
"As our nation continues to combat the threat of terrorism, it’s crucial that we not only prepare for the future,... http://fb.me/8ZCkKeTF4 ",2017-05-09 22:15:03,2,1,862068423773257729
Thanks Rob Frankil & the team at the Sellersville Pharmacy to talk about prescription drug policies and the role... http://fb.me/88MLEfI5r ,2017-05-09 17:00:41,0,0,861989311725662209
Did you see my op-ed in the Perkasie News-Herald? http://fb.me/89JgdzQCn ,2017-05-09 12:00:02,0,1,861913652135329794
Thanks to Elbow Lane for inviting me to be a guest reader in the pre-school class today! http://fb.me/74IKvXenP ,2017-05-08 22:25:04,2,1,861708555384221697
"Evan is an energetic, tech-savvy kindergartner. He also happens to have Down Syndrome.

I believe Evan deserves... http://fb.me/1bznGMYLO ",2017-05-08 12:00:06,8,3,861551279012806656
Had the opportunity to sit down with tech industry leaders to discuss innovation & job creation in the 21st... http://fb.me/8XeAGGW0r ,2017-05-07 21:20:04,3,0,861329813147181056
Stopped by Lykon Automotive & Towing to check out their operation & talk about the challenges facing small... http://fb.me/1WoM29DAq ,2017-05-07 14:00:04,1,0,861219082045181952
Small businesses create 2 out of every 3 net new jobs. Show your support this Nat'l #SmallBusinessWeek! http://www.sba.gov/nsbw ,2017-05-06 22:49:00,2,1,860989806033215488
Proud to lead the Eagle Scout Charge at the Eagle Scout Court of Honor for Jack Kane & Joey McDowell of Troop 36... http://fb.me/3TWXm3VVX ,2017-05-06 22:00:02,2,0,860977482572410880
"Small Business by the numbers: 99.9% of all firms, 48% of private sector employees, 41.2% of private sector payroll. #smalbusinessweek",2017-05-06 17:48:01,4,0,860914059486605313
"Congratulations to Feasterville Business Association Person of the Year, Stu Coren!  Stu has been a small... http://fb.me/7PemywU3h ",2017-05-06 14:00:04,0,0,860856695618244608
"Happy National #SmallBusinessWeek! If you’ve thought about starting a #smallbiz, this week is for you: http://www.sba.gov/nsbw ",2017-05-05 22:49:00,6,0,860627418452819969
Small businesses represent 99.9% of all businesses with employees in the United States. #smallbusinessweek,2017-05-05 17:47:00,3,1,860551417609814016
"Interested in an internship in our district or Washington, D.C. office? Learn more! http://fb.me/6xahVqv0O ",2017-05-05 12:00:03,7,3,860464103831334916
My statement on the American Health Care Act → http://bit.ly/2pDDtNF pic.twitter.com/pd2pQcbgaA,2017-05-04 18:36:42,112,28,860201535783006208
Thanks to Dr. Pao & members of the American Academy of Ophthalmology to discuss driving down the high cost of... http://fb.me/ub4lK1Mq ,2017-05-04 17:01:31,1,0,860177582578421760
Joined the House Foreign Affairs Committee in advancing #bipartisan legislation to stop the wholesale slaughter...http://fb.me/35sUgdmjK ,2017-05-04 12:00:05,9,3,860101722383024131
Roughly 50% of small biz are women-owned and small biz accounted for 2/3 of net new jobs over the past 20 yrs. #smallbusinesswee,2017-05-03 22:48:00,15,3,859902389444239360
"Across the United States, small businesses create about two out of every three new jobs. 

That’s why I’ve... http://fb.me/5APuyapA7 ",2017-05-03 22:00:03,2,0,859890323547443201
There are more than 29 million small businesses in the United States. #smallbusinessweek,2017-05-03 17:47:00,3,0,859826640876052480
"Congrats, Mr. Qualli!http://fb.me/19Ifz8jUo ",2017-05-03 17:00:04,18,0,859814829246337025
#HoldOnYouMatter http://fb.me/8BaIbaUzz ,2017-05-03 12:00:03,11,0,859739328972550144
It’s National #SmallBusinessWeek? Read about @SBAGov’s programs that help veterans start &  grow businesses → http://owl.li/MAOK30aS2Xq ,2017-05-03 00:49:01,2,0,859570454817853440
Another successful prescription drug take-back day in communities across #PA08 - over five TONS of unused or... http://fb.me/1OB5H0jFt ,2017-05-02 22:00:04,8,0,859527940031348737
Small businesses are responsible for creating 63% of new jobs! #smallbusinessweek,2017-05-02 17:47:00,2,2,859464252742025216
Thanks to U.S. Coast Guard Sector Delaware Bay for inviting me to discuss national security issues as well as... http://fb.me/2wK1NnxRP ,2017-05-02 12:00:03,5,0,859376939278237697
Roughly 50% of small businesses are women-owned and small biz accounted for 2/3 of net new jobs over the past two decades #smallbusinessweek,2017-05-01 22:48:02,17,6,859177621053112320
"""My constituents have a right to safe, clean drinking water & they deserve to know if PFOS/PFOA have compromised...http://fb.me/32h3wDcnF ",2017-05-01 22:00:02,24,1,859165544221724674
Small businesses employ over 47 percent of the employees in the private sector in the U.S. #smallbusinessweek,2017-05-01 17:47:01,5,1,859101867980271617
"Met with advocates from the Muscular Dystrophy Association about issues important to those living with MD,... http://fb.me/8wMQv1w9U ",2017-05-01 12:00:09,5,1,859014576632987651
"Thanks to Sheet Metal and Air Conditioning Contractors' National Association (SMACNA) Executive VP, John Wanner... http://fb.me/8qBkhaVpB ",2017-04-30 22:00:03,1,0,858803157836734464
Ran into Bristol Fire Company - Station 51 Chief Herb Slack & Rosie Torres of the Puerto Rican Cultural... http://fb.me/1mPhjFOO8 ,2017-04-30 14:00:05,2,0,858682370865672192
Stopped by the Dublin Dairy Queen & got the tour from Frank & Katie. What's your go to frozen treat? http://fb.me/1hSD6j1up ,2017-04-29 22:10:03,7,0,858443286473736192
Proud to stand with the Bucks County Association for the Education of Young People to advance early childhood... http://fb.me/6OpQt3zLu ,2017-04-29 18:00:03,8,1,858380374333947904
Today! http://fb.me/yg1gnk4Q ,2017-04-29 12:00:04,1,0,858289781951877120
Nearly 70% of people who abuse prescription pain relievers get them from their friends or family. As out...http://fb.me/4OyHuWMdx ,2017-04-28 22:00:04,2,0,858078388271054856
April is National Autism Awareness Month so I wore my Autism awareness pin this week while presiding over the US... http://fb.me/4UeLeJZJx ,2017-04-28 17:00:03,6,0,858002883895230465
"On April 10, 2009, the Smolensk Disaster claimed the lives of 96 Polish officials including President Lech... http://fb.me/8pgYo2hQy ",2017-04-28 12:00:03,0,0,857927388554035205
"""Just as sure as heroin and fentanyl kill; the INTERDICT Act will save lives."" - Bucks County District Attorney's... http://fb.me/3LuInZ9Fz ",2017-04-27 22:00:05,5,1,857716005442859009
"""Just as sure as heroin and fentanyl kill; the INTERDICT Act will save lives."" - Bucks County District Attorney's... http://fb.me/Ico4riz5 ",2017-04-27 22:00:03,4,0,857715994458042373
Amazing news & well-deserved recognition for our great educators! http://fb.me/158vhMINR ,2017-04-27 17:00:04,2,0,857640503042596864
Particpated in the 26th Annual International Spring Festival & Parade of Nations at North Penn High School. Our... http://fb.me/1rLmyfVYD ,2017-04-27 12:00:02,4,0,857564997169360897
Partisan gerrymandering has exacerbated the electoral complacency that causes lawmakers to focus on accumulating...http://fb.me/5zmcGFR1L ,2017-04-26 21:30:04,48,24,857346062335561728
Happy to join fellow scouts at Pack 380's Blue and Gold dinner this past weekend http://fb.me/7o8PIvJca ,2017-04-26 16:09:28,2,1,857265380938706944
Thanks to the Bucks County Audubon Society at Honey Hollow & Audubon Pennsylvania for inviting me birding &... http://fb.me/11HzFWoig ,2017-04-26 12:00:07,4,1,857202627880378368
"As an EMT & former federal drug prosecutor, I’ve seen firsthand the devastating impact of addiction in our...http://fb.me/1oeBiiwjF ",2017-04-25 22:00:04,8,0,856991223822901248
Intro'd INTERDICT Act w/ @nikiinthehouse to enhance @CustomsBorder resources to stem fentanyl #opioidepidemic http://bit.ly/2qaXMj0 pic.twitter.com/1rLQfmAInD,2017-04-25 16:20:32,8,5,856905778103451648
Joined municipalities & wholesale customers at Bucks County Water & Sewer Authority to discuss ways to strengthen... http://fb.me/1kWUEAq0U ,2017-04-25 12:00:04,2,0,856840227784142848
"On #HolocaustRemembranceDay, we mourn the millions of innocent victims, including 6 million Jews, brutally... http://fb.me/5OZnpFCET ",2017-04-24 22:00:03,6,0,856628830206906368
"Congrats to Bristol Fire Company - Station 51 Rookie Firefighter of the Year - Tarique Harvey. Great job, Tarique! http://fb.me/U88v1U6E ",2017-04-24 12:00:04,7,0,856477839524319235
"Plan ahead & avoid the ""Passport Surge"" ↴http://fb.me/6Jn2vdpgu ",2017-04-23 21:00:04,1,0,856251347011764226
"During her six years battling #ALS, Karen Shideleff did everything she could to make a difference & serve as an... http://fb.me/1abJdDsx7 ",2017-04-23 14:19:05,2,0,856150437594103808
I'm leading members of the House in saying #NoTaxOnTroophttp://fb.me/1iFEa3il5 ,2017-04-22 21:00:02,9,5,855888953404252167
Had the chance to take in a Souderton Area High School baseball game honoring our nation's veterans. Awesome work... http://fb.me/16XewtvRL ,2017-04-22 14:00:04,8,1,855783263272611840
Supporting our troops after they come home is a cost we commit to when we send them to war. Charging...http://fb.me/3GILHOGeN ,2017-04-21 22:00:03,16,6,855541668107431938
Thanks to Mr. Nord and the kids at New Hope Solebury High School for inviting me to talk about my first couple... http://fb.me/8qg6kaE9d ,2017-04-21 12:00:05,2,1,855390679710748672
"Help is on the way - but there's still work to do.

This funding from the 21st Century Cures Act is crucial to...http://fb.me/21aYzcxHu ",2017-04-20 22:00:03,11,2,855179279847567360
"Fitzpatrick Urges Local Fire Departments to Apply for DHS, FEMA Grantshttp://fb.me/6AkTnN8vj ",2017-04-20 12:00:03,3,1,855028283645276161
http://fb.me/5ImgVoopd ,2017-04-19 22:20:03,3,0,854821924437975040
Had the chance to witness this week’s active shooter drill at Pennsbury School District. Thank you to law... http://fb.me/6rWJPZNNR ,2017-04-19 16:52:36,6,1,854739518162960384
"""Members of Congress have taken up the cause. In March, Rep. Brian Fitzpatrick, a first-term Republican from...http://fb.me/8TPkVhZ8A ",2017-04-19 12:00:05,3,0,854665903811776512
Proud to honor Milford Township Fire Department's Ken Butz for 45 years of service to our community! http://fb.me/3u7KzMmXJ ,2017-04-18 22:00:02,4,1,854454502161776641
Great conversation with healthcare leaders at Grand View Health about removing barriers to care & attacking... http://fb.me/1wAgtBISk ,2017-04-18 12:00:05,3,1,854303519851073536
Had a wonderful time touring National Refrigerator & A/C Products Inc.'s facilities in #Bensalem. We all agree... http://fb.me/515llYtQ0 ,2017-04-17 22:50:04,2,0,854104702690131968
"Congrats to Evan Darroch of Troop 117 for attaining the rank of Eagle Scout. We're proud of you, Evan! http://fb.me/WQgZvDO3 ",2017-04-17 17:00:04,3,0,854016622809554944
Enjoyed visiting Sterling Helicopter in #Croydon for my 100 Small Business Listening Tour. I'm working with... http://fb.me/18dL99R3u ,2017-04-17 12:01:04,15,17,853941377633267712
"Great running into my friend, the ""Invincible"" Vince Papale, at an event honoring our nation's veterans.  Great... http://fb.me/5AZADRo5Y ",2017-04-16 21:00:03,3,0,853714631185006593
Wishing a blessed #Easter for all those celebrating! http://fb.me/2Rl1vrSCj ,2017-04-16 14:00:03,4,0,853608933461827584
"Honored to join World War II Veteran, 94-year-young Cpl. Roland Scarinci, USMC, at the Marine Corps Law... http://fb.me/1SqQvO8El ",2017-04-15 21:00:03,7,0,853352241746640896
Visited GE Water in #Trevose to learn about ways we can address water scarcity though recycling & reuse,2017-04-15 14:00:03,11,0,853246546665762816
Grateful for the opportunity to personally thank Dave Pennepacker (60 years) & Ray Gillespie (50 years) for their... http://fb.me/8bMiOAx4j ,2017-04-14 22:40:06,2,0,853015033747562502
Thank you Fred Beans Family of Dealerships for inviting me to speak to staff in #Doylestown & talk about how we... http://fb.me/187jfeMzw ,2017-04-14 18:32:33,1,0,852952733120425985
ICYMI: http://fb.me/ZiNZlAIf ,2017-04-14 12:00:05,0,0,852853964458602496
Had an awesome time at the 7th Annual Multi-Generational Art Exhibition at the Bensalem Senior Center last week! http://fb.me/1hmS9oRos ,2017-04-13 17:00:03,0,0,852567068775985152
" 100+ new jobs.
 Ground-breaking research.
 Lifesaving cures.

Had a wonderful time at the Pennsylvania...http://fb.me/88dti4bH9 ",2017-04-13 12:00:03,2,0,852491568879730688
Honored to welcome the kids from Newtown Friends School to the United States Capitol last week! http://fb.me/8vDDGxwkX ,2017-04-12 22:00:02,3,1,852280173038899201
Happy to host Jim Walter of the Hilltown Township Volunteer Fire Company - as well as other firefighters from... http://fb.me/808h4nM3w ,2017-04-12 17:00:03,0,0,852204679668826113
Thanks to the #Quakertown AARP for inviting me to speak & take questions on issues important to seniors in Bucks & Montgomery counties.,2017-04-12 12:00:05,2,0,852129189180395520
#HoldOnYouMatter http://fb.me/16AhMKww6 ,2017-04-11 22:00:04,2,0,851917794899894274
To all our friends and neighbors observing Passover: Chag Sameach! #pesach http://fb.me/7CShTTLZb ,2017-04-11 17:13:33,5,0,851845691194454021
Learn what I'm working on to put an end to #Gerrymandering --> http://bit.ly/2oF7kmi pic.twitter.com/JSbfJ2kHf9,2017-04-11 14:47:12,32,6,851808858809012224
"Enjoyed meeting with the Rothholz family from #Harleysville & hanging out with Evan.

According to the CDC, about... http://fb.me/22DlOlWsf ",2017-04-11 12:00:08,6,2,851766815281860609
Great time throwing out the first pitch to start the 2017 season at my old stompin' grounds - the MAA -... http://fb.me/4N99f7uAV ,2017-04-10 22:00:04,1,1,851555404232445953
Proud to join the Bucks County Heroes Scholarship Fund in #Croydon to support the children of our fallen law... http://fb.me/1NSIf8XuK ,2017-04-10 17:00:14,2,3,851479948212797441
"As a former anti-corruption FBI special agent, I’ve seen the brokenness in our system and I know the real-life... http://fb.me/20ivvqqDG ",2017-04-10 12:00:03,15,3,851404404804784128
"Zach Maiorana is battling Cystic Fibrosis.

In 1955, children born with CF likely would not make it through... http://fb.me/32k9KMJdP ",2017-04-09 21:00:03,1,0,851177915958136832
Proud to join the Souderton Area School District at the Montgomery County Intermediate Unit to discuss funding &... http://fb.me/4MgvFR3Nr ,2017-04-09 14:00:03,6,1,851072219451150337
Congratulations to Christian Simms from Troop 29 on your achievement of reaching the rank of Eagle Scout. Thanks... http://fb.me/6N5199n7w ,2017-04-08 22:00:09,6,2,850830651213447168
Proud to join with my bipartisan freshman colleagues in discussing history's lessons at the U.S. Holocaust... http://fb.me/1ntrdJW0m ,2017-04-08 14:00:04,4,2,850709835322720256
My statement on #Syria - http://bit.ly/2oRshuk pic.twitter.com/EvwuoEjop3,2017-04-07 17:07:35,7,0,850394636027928576
I was honored to attend an event supporting the Bucks County Emergency Homeless Shelter weekend to help awareness... http://fb.me/5VMupAnI5 ,2017-04-07 12:00:06,8,3,850317254604591104
Grateful for the thoughtful discussion on foreign policy and collaboration opportunities with colleagues... http://fb.me/4C7prLHxW ,2017-04-06 22:00:04,2,2,850105852656840706
"We've got to focus on the underlying issues driving people to seek opioids, while increasing the accessibility &... http://fb.me/87izP1sf1 ",2017-04-06 12:00:17,5,0,849954914004598785
North Korea is a sponsor of terror run by a madman willing to do anything to keep his power. Kim Jung Un’s... http://fb.me/7COqlk9ue ,2017-04-05 22:00:03,5,1,849743462677323776
"Yesterday, I met with Representative Alan Lowenthal to discuss the importance of redistricting reform and ending... http://fb.me/4BP3qOFP1 ",2017-04-05 12:00:08,24,6,849592486628642817
Proud to stand with Rep. Jacky Rosen and protect our military and law enforcement communities from partisan... http://fb.me/8NFdqviHQ ,2017-04-05 12:00:07,4,1,849592485177430019
"Equal pay for equal work. It’s that simple.

I’m committed to working with Republicans & Democrats this... http://fb.me/3bu9Wgtvv ",2017-04-04 22:00:04,37,8,849381079526121472
"Best of luck, Kieran! http://fb.me/3bP3VHRWE ",2017-04-04 12:00:04,1,1,849230083407699968
"Excellent guest opinion in yesterday's Bucks County Courier Times - I couldn't agree more!

Reforming the... http://fb.me/1OxTgU2q8 ",2017-04-03 22:00:03,5,2,849018687382331392
Fantastic work by all the students who participated in this year's 22nd Annual Bucks Co. High School Art... http://fb.me/167DEjJLV ,2017-04-03 12:00:09,2,1,848867716828196864
Congratulations to A Woman's Place on their 40th Anniversary & thank you for the wonderful work they do in... http://fb.me/1CkswzG01 ,2017-04-02 21:00:03,22,1,848641198864596993
Awesome time discussing U.S.-Israel policy with constituents from #PA08 who were in D.C. this week for AIPAC –... http://fb.me/8hxdCJohX ,2017-04-02 14:00:44,6,1,848535672994529280
Congratulations to J.J. MacClay for achieving the rank of Eagle Scout. Thank you for your hard work helping our... http://fb.me/820frUjzo ,2017-04-01 20:52:06,4,4,848276809460441088
100 years later: A salute in Bucks County to the soldiers of World War I http://fb.me/1haonQWNS ,2017-04-01 14:00:05,7,1,848173122981330944
Extremely proud of Ayshia from my legislative team for her commitment to #PA08 & work to strengthen the Black...http://fb.me/8KTcjlEZD ,2017-03-31 12:00:27,4,2,847780628594540545
"Let's get to work.

Read: http://bit.ly/2nEjrSg  http://fb.me/8weVRDzgN ",2017-03-30 22:00:13,5,1,847569178345320448
It is critically important for the Senate to act on the vacancy on the Supreme Court. Ensuring faith in our...http://fb.me/1LPp25V9s ,2017-03-30 12:00:15,4,2,847418190242000901
Today we honor the bravery & sacrifices of our Vietnam veterans on #VietnamVeteransDay. We are grateful for your...http://fb.me/19RJFVZ77 ,2017-03-29 22:00:11,5,0,847206780014874625
Today we honor the bravery & sacrifices of our Vietnam veterans on #VietnamVeteransDay. We are grateful for your service today & every day.,2017-03-29 20:53:00,12,2,847189875199823874
