Text,Date,Favorites,Retweets,Tweet ID
Enjoyed sitting down with the Washington Free Beacon and discussing how my 14 years in the FBI – Federal Bureau...http://fb.me/8romFVV9u ,2017-01-14 22:09:07,1,1,820392327420190720
Glad I got the chance to catch up with Congressman Glenn Thompson who represents Central PA. Really great guy & a... http://fb.me/5LiBHdHcv ,2017-01-14 15:00:05,1,0,820284358858866689
I joined 23 Democrat and Republican members of the Problem Solvers Caucus in sending a letter to President-Elect... http://fb.me/8kryLnejH ,2017-01-13 22:00:03,5,0,820027657941381120
Great meeting with No Labels Problem Solver Caucus yesterday http://fb.me/8l4ITrNy8 ,2017-01-13 13:00:03,2,0,819891761371893760
"I delivered my first speech on the floor of the House of Representatives and my message was simple:

Washington... http://fb.me/2GmYRgPkV ",2017-01-12 23:01:05,2,0,819680628883001351
"Did you see this? Be sure to share!
#MyBristolBorough http://fb.me/8M0f959yx ",2017-01-12 13:00:04,1,0,819529378677882881
BIG NEWS --> http://fb.me/5u7VuEvyQ ,2017-01-11 23:00:03,1,0,819317980588818432
Did you know today is National Human Trafficking Awareness Day? Take some time to learn about this form of modern... http://fb.me/2OS6QoL3Z ,2017-01-11 19:36:11,1,0,819266674822172680
