Text,Date,Favorites,Retweets,Tweet ID
"It’s unbelievable - & unacceptable - that elected officials have been using taxpayer $ to cover up sexual harassment suits for years. 

I’m calling on the Ethics Cmt. to fully investigate this misuse of taxpayer funds.http://bit.ly/2jdTZPV ",2017-11-21 23:54:00,82,27,933121348557193216
"I will be spending #Thanksgiving in #PuertoRico inspecting hurricane recovery efforts & meeting directly with affected residents, local government leaders & humanitarian professionals on the island. 

Read more: http://bit.ly/2zVafiO pic.twitter.com/0F5zCGerms",2017-11-21 17:25:02,87,28,933023459331805184
My statement on today's #taxreform measure: https://fitzpatrick.house.gov/taxreform pic.twitter.com/WLkekcdMQc,2017-11-16 18:52:47,16,5,931233604751028224
"Our gratitude is enduring, our support for you, steadfast. #VeteransDay https://fitzpatrick.house.gov/media-center/press-releases/fitzpatrick-recognizes-veterans-day-2017 …pic.twitter.com/GbMInui2n8",2017-11-11 15:34:01,20,8,929371643524284416
"The allegations against Roy Moore are beyond disturbing. If there is an ounce of truth to this, he must end his candidacy immediately.",2017-11-10 23:44:01,94,18,929132569265934336
"""Let’s put these heroes to work rebuilding our roads and bridges...""

Learn about Fairness to Veterans: https://fitzpatrick.house.gov/media-center/press-releases/ahead-veterans-day-fitzpatrick-sinema-fight-veterans-jobs …pic.twitter.com/InaKAVT5iY",2017-11-10 22:14:59,7,5,929110163944099840
Veteran-owned businesses make up nearly 10% of all businesses in the US & account for $1T+ in receipts annuallyhttps://www.youtube.com/watch?v=evaFF-VJJsw …,2017-11-03 15:45:06,2,2,926475330419863554
"Will read & review entire measure before concluding, but 1st impressions are very positive. 

Full statement on #TaxReform:pic.twitter.com/nXuOWWQhP4",2017-11-03 14:35:18,9,5,926457763689062402
"ICYMI: The House passed my third bill - the #INTERDICTact
http://bit.ly/2gyDZHf pic.twitter.com/1BworslawW",2017-10-25 14:17:55,17,5,923191897258160129
House passes #INDERDICTact. Next up: Senate. http://bit.ly/2gyDZHf https://twitter.com/RepCloakroom/status/922884599453290499 …,2017-10-24 18:12:38,5,2,922888580296511490
 INBOX: Fitzpatrick/Tsongas Anti-Fentanyl Bill Passes House http://bit.ly/2gyDZHf ,2017-10-24 18:10:43,4,2,922888095753736194
" INBOX: Fitzpatrick, Sinema to Introduce Legislation Restoring DEA’s Authority to Combat Opioid Epidemichttp://bit.ly/2ggP7Iz ",2017-10-17 18:44:14,20,5,920359817528700929
Grateful for the opportunity to discuss my #bipartisan 'Road to Recovery Act' to end the IMD exclusion: http://bit.ly/2xzBWsv https://twitter.com/HouseCommerce/status/918166009638457345 …,2017-10-11 18:27:29,8,1,918181272618438658
"Thanks to the @HouseCommerce Health Subcom. for inviting me to testify about #RightToTry
http://fitzpatrick.house.gov/media-center/press-releases/fitzpatrick-testifies-house-committee-regarding-right-try …pic.twitter.com/LJUdBviCYf",2017-10-03 18:29:09,6,2,915282591594446848
My heart goes out to all those impacted by last night’s heinous act of violence in Las Vegas.pic.twitter.com/afFwrZX3YB,2017-10-02 14:26:23,24,3,914859110738403332
"Best wishes for new year of peace, joy & love to all those celebrating #RoshHashanah! #ShanahTovahpic.twitter.com/RI79v9DcKZ",2017-09-20 22:30:00,21,4,910632162264801280
Excellent time bagging groceries at @ShopRiteStores in #Warminster as part of their Bag to End Hunger donation prgmhttp://www.theintell.com/news/local/rep-brian-fitzpatrick-bags-groceries-for-hunger-awareness/article_3c75788a-9e28-11e7-bef2-ab6a3bc7f050.html …,2017-09-20 21:12:03,22,4,910612545618276353
"ICYMI The House passed my bill to ensure federal, state & local first responders have the tools & training they needhttp://fitzpatrick.house.gov/media-center/press-releases/fitzpatrick-first-responder-bill-passes-house …",2017-09-15 00:50:00,26,5,908493066872307712
"#BREAKING My bill to support federal, state & local first responders just passed the House: http://fitzpatrick.house.gov/media-center/press-releases/fitzpatrick-first-responder-bill-passes-house …pic.twitter.com/unNOvycROf",2017-09-14 16:29:19,23,2,908367064842346496
Sixteen years later. But we'll #NeverForgetpic.twitter.com/0SloG45Dx1,2017-09-11 14:38:27,34,10,907252002136215552
We're all in this together. Addressing #gerrymandering is about good government.https://twitter.com/Schwarzenegger/status/906224376487395328 …,2017-09-09 01:04:00,47,9,906322262352990210
"Framers saw House of Rep. as the ‘People’s House’. In Federalist 56, Madison covers the importance of local representation.https://twitter.com/RiponAdvance/status/906230659135537153 …",2017-09-09 00:00:02,14,3,906306161892261889
"RT if you agree: extreme partisan #Gerrymandering is hurting our gov't & our citizens. 

My op-ed in @thehill:http://thehill.com/blogs/congress-blog/politics/349704-bipartisan-forward-looking-solutions-on-redistricting …",2017-09-07 21:19:04,124,159,905903265925267457
Important part of our national security strategy. #Bipartisan effort w/ @RepSwalwellhttps://twitter.com/WeAreALPA/status/905851262364737537 …,2017-09-07 18:09:46,11,3,905855630182948864
".@HouseHomeland just passed #INTERDICTact to tackle synthetic opioids like #fentanyl. 

Read:http://fitzpatrick.house.gov/media-center/press-releases/fitzpatrick-tsongas-anti-fentanyl-bill-passes-committee …",2017-09-07 15:07:51,16,10,905809848784363526
"Joined dozens of current/former MOCs in urging #SCOTUS to limit extreme partisan #Gerrymandering
 
Learn more:http://fitzpatrick.house.gov/media-center/press-releases/fitzpatrick-led-brief-pushes-supreme-court-redistricting-reform …",2017-09-06 19:29:07,22,6,905513211356643328
"@POTUS, our nation was so comforted to see you & @FLOTUS pitch in to help w/ clean-up & serve food to #Harvey victims. Sent a great message",2017-09-03 13:09:01,5,2,904330388927078400
Spoke at the How to Save a Life Foundation's International Overdose Awareness Day event in #Yardley. Together we can beat this epidemicpic.twitter.com/uV747xqrRh,2017-09-01 13:20:08,11,5,903608412893794305
Read my op-ed in today's @PhillyInquirerhttps://twitter.com/audubonsociety/status/902235634252820481 …,2017-08-28 20:26:00,11,4,902266035893551105
Had a blast spending some time behind the counter with the team @Wawa in #HollandPApic.twitter.com/yWsAPNkROW,2017-08-24 18:14:14,10,3,900783323546517504
Read my statement >>http://fitzpatrick.house.gov/media-center/press-releases/fitzpatrick-recognizes-ukrainian-independence-anniversary …,2017-08-24 14:01:55,4,3,900719823914754050
"Twenty-six years ago, the people of #Ukraine broke free from the chains of Soviet rule & took up the mantle of a free and independent nationpic.twitter.com/xmSDGexpPy",2017-08-24 14:01:05,12,5,900719617026478080
Joined Holly & the team at @thehomedepot in #Bensalem as an 'Employee for a Day' - orange apron and all!pic.twitter.com/ChV0ybiT1b,2017-08-22 16:33:02,3,3,900033078848094208
"@POTUS, those who stand with or associate with white-supremacist hate groups are not ""fine people."" They are aiders and abettors of hate.",2017-08-17 11:39:49,42,19,898147348534231040
"@POTUS, there is no moral equivalence of those who advance hate and those who oppose it. They are morally different universes. Period.",2017-08-16 11:46:02,51,24,897786527010480130
My letter urging DOJ to undertake comprehensive domestic terrorism investigation into all facets of #Charlottesville http://fitzpatrick.house.gov/media-center/press-releases/fitzpatrick-calls-administration-expand-investigation-charlottesville …pic.twitter.com/qoucEFb6oX,2017-08-14 15:03:02,72,24,897111324915888128
"Are you a #PA08 student interested in attending one of our nation's service academies?

Learn more: http://fitzpatrick.house.gov/service-academy-nominations …pic.twitter.com/Ist4FcLpWr",2017-07-28 14:16:50,2,3,890939106179657728
Great #bipartisan effort w/ @RepMeehan & @RepBrendanBoyle to attach needed #PFOS amdts to DoD approps bill. Big for #PA08 fams #UnwellWater,2017-07-27 21:00:08,7,0,890678211608272898
.@RepEliotEngel & I grabbed a pic with these awesome ladies who attended our @HouseForeign markup of HR 2408. @GirlUp #Support2408pic.twitter.com/UfKU8Cz3K6,2017-07-27 19:10:00,19,4,890650497111265281
pic.twitter.com/wCyloAqZ6D,2017-07-27 14:36:28,5,2,890581658335936513
"Securing operational control of our border is a national security emergency.

The time is now to act:https://www.youtube.com/watch?v=Hed3CARnZBU&feature=youtu.be …",2017-07-27 13:01:42,4,0,890557809871519744
".@HouseHomeland just passed legislation @RepStephMurphy, @RepDanDonovan & I introduced to help first responders:http://bit.ly/2uZGbQu ",2017-07-26 18:15:59,6,3,890274516638851074
"Speak w/ one voice against those who seek to delegitimize shared values of sovereignty, human rights & rule of law ➞ http://bit.ly/2h0FktG pic.twitter.com/iWH9mU9njO",2017-07-25 22:32:00,7,1,889976557124673536
"#RealReform includes 
 #termlimits
 No Budget, No Pay
 Gerrymandering reform
...and more

Read my plan:http://fitzpatrick.house.gov/realreform ",2017-07-25 21:58:54,10,4,889968227836727296
W/ @HouseHomeland Chairman @RepMcCaul & members of the Task Force on Denying Terrorists Entry into the US discussing terror surge in Europepic.twitter.com/jRglI9Kjzm,2017-07-25 14:15:47,4,3,889851680015122435
"The House just passed a massive rewrite of the #GIBill to strengthen it for the 21st century. 
https://medium.com/@RepBrianFitz/a-next-generation-gi-bill-1bd0feecfaa0 …pic.twitter.com/1VAN4ThH8m",2017-07-25 12:48:32,5,1,889829720707260416
"The House just passed the #NDAA - including big action on PFOA/PFOS contamination: http://fitzpatrick.house.gov/media-center/press-releases/ndaa-passes-includes-fitzpatrick-pfc-health-study …
#unwellwater",2017-07-14 16:02:59,6,3,885892390057365504
"ICYMI: @NoLabelsOrg
Thank you @RepBrianFitz for your support of #NoBudgetNoPay. Congress should only get paid if they do their job.",2017-07-13 13:56:01,17,7,885498048373071874
"Today & every day, we live by the words of Matt7:12 – ‘in everything do to others what you would have them do to you’ #NationalDayofCivility",2017-07-12 17:00:03,7,4,885181974150877184
"On #NationalDayofCivility, let's celebrate values that unite us as Americans rather than partisan bickering that divides us. #GoldenRule",2017-07-12 16:45:02,13,4,885178194789380100
Most learn #GoldenRule as kids -- today we need it more than ever! Encourage respect & tolerance on #NationalDayofCivility & every day!,2017-07-12 16:30:02,11,4,885174421366820864
.@WeberShandwick reports incivility at record high in U.S. Let's make a change by practicing #GoldenRule every day! #NationalDayofCivility,2017-07-12 16:15:00,2,1,885170637991419905
"July 12th is #NationalDayofCivility! Let's celebrate by treating everyone we meet with respect & dignity, even when we disagree! #GoldenRule",2017-07-12 16:00:01,42,15,885166865529552896
"Learn more --> http://fitzpatrick.house.gov/pfoa-pfos 
The latest --> http://bit.ly/2tGu5Ji https://twitter.com/FloorCharts/status/884447302777286656 …",2017-07-10 16:22:35,1,0,884447770534391810
"ICYMI: ""@TheIntellNews .@RepBrianFitz seeks to tie PFC health study to military spending bill #unwellwater http://bit.ly/2tQIkOw  """,2017-07-09 13:54:01,5,0,884047995091787778
Joined my friends with the Knights of Columbus to serve up some slices at the St. Mike's Fair in #Levittownpic.twitter.com/cGNUfpc24U,2017-07-05 14:48:47,10,0,882612227483852801
"""As a former FBI agent, I've seen firsthand the threats our nation faces from a broken immigration system"" #KatesLaw http://bit.ly/2sWD3DA pic.twitter.com/0ZeX1RiHXV",2017-06-29 22:14:08,9,4,880549974429360128
Joined members of the Bipartisan Heroin Task Force to roll out our legislative agenda for the 115th Congress ➔ http://bit.ly/2sj6WKG ,2017-06-28 12:00:02,9,3,880033044874317825
Read my op-ed on the three pillars of #taxreform: http://bit.ly/2tSFhT9 pic.twitter.com/F0QLd9drtq,2017-06-27 23:53:00,5,3,879850081385668608
"Met w/ @UN Sec.Gen. Guterres to urge support for Israel, increased sanctions on Russia & unification against the nuclear threat of N.Koreapic.twitter.com/HW1wpODlXx",2017-06-27 16:02:46,10,3,879731743225507840
"My new op-ed in the @CourierTimes: A CPA’s Advice on Growing Our Economy

Read & share ↓https://medium.com/@RepBrianFitz/a-cpas-advice-on-growing-our-economy-86be99523a7 …",2017-06-26 13:29:35,9,6,879330804463276032
The 115th Congress Freshman Class is leading by example. #summerofcivilitypic.twitter.com/S1jWyGPKQr,2017-06-21 23:08:01,10,4,877664432561770497
Congrats to @PburyHSBaseball for bringing home the state title! #GoFalconshttps://www.youtube.com/watch?v=-gW4ortIXtI&feature=youtu.be …,2017-06-21 16:14:20,43,21,877560326035824641
"Is it easy to change? No.

But can we? Of course we can... We just have to have the will to do it.https://youtu.be/pVit_-9UXNQ ",2017-06-16 19:21:03,9,3,875795376044945408
Thanks to Ms. Spiegel's science class at Holland Middle School for inviting me to talk about energy & the... http://fb.me/8HBtocr3G ,2017-06-16 15:30:05,4,1,875737250633568257
ICYMI: http://fb.me/1qH85hlgW ,2017-06-16 12:00:09,0,0,875684418496724994
Great game for a great cause. Enjoyed tonight's #CongressionalBaseballGame with Rep. Dwight Evans. #UnitedWeStand http://fb.me/8Re6iA1m2 ,2017-06-16 01:09:31,16,3,875520680464404480
"Thanks for the great discussion on rebuilding our roads, bridges & IT systems! http://fb.me/21puGFIPy ",2017-06-15 18:30:03,1,0,875420154083102752
.@RepDwightEvans & I caught up w/ @Laurenjmayk @NBCPhiladelphia to talk about tonight's Congressional  Game http://bit.ly/2sBbWih pic.twitter.com/XIRyaTgtNW,2017-06-15 16:30:37,11,0,875390095553171456
A timely #tbt http://fb.me/6ITZ9tkQB ,2017-06-15 12:00:04,2,1,875322011568021504
Looking forward to it. Hope to see a lot of other Rs & Ds do the same.https://twitter.com/RepDwightEvans/status/875092652953305091 …,2017-06-14 23:11:00,51,15,875128469255897090
"Rep. Dwight Evans and I will be sitting together at tomorrow night's #CongressionalBaseballGame and, in the wake...http://fb.me/1rZje4ea7 ",2017-06-14 22:00:04,19,3,875110618466054144
These officers (& all law enforcement) are heroes.https://twitter.com/CraigCaplan/status/875091439180546049 …,2017-06-14 20:46:55,4,1,875092209380544512
"After today, let's send a message that, despite our differences, we stand together: http://bit.ly/2sBbWih https://twitter.com/lauraolson/status/875080961846898691 …",2017-06-14 20:08:19,50,10,875082492432310274
Honored to address both the Delaware Valley Vietnam Veterans at Falls Community Park & the Fairless Hills Elks... http://fb.me/29OG8SG1V ,2017-06-14 18:30:03,4,1,875057766213222402
"As always, grateful for the service of @CapitolPolice",2017-06-14 12:59:29,18,2,874974575897038849
Absolutely terrible news from this morning’s @thehillbaseball practice. Join me in sending thoughts & prayers to all those involved,2017-06-14 12:59:05,33,11,874974473954394112
"For too long, veterans nationwide have been disrespected by those who are supposed to be advocates for them -...http://fb.me/6vbZpnNSB ",2017-06-14 12:00:05,8,1,874959627221426176
"Edward Plath, like so many Americans of his day, answered the call to service at the onset of World War II.... http://fb.me/8in6tJwQW ",2017-06-13 22:00:06,1,2,874748235616849921
Joined advocates from Mental Health America & the American Foundation for Suicide Prevention for a rally at the... http://fb.me/29KhqLBS6 ,2017-06-13 18:30:05,5,3,874695384219648001
"Proud to join the Borough of Penndel in dedication the new police station this weekend. As always, we are... http://fb.me/8ult2EEdy ",2017-06-13 15:30:04,2,0,874650083165433857
ICYMI:http://fb.me/2jeby5NSu ,2017-06-13 12:00:04,1,1,874597236033732609
"Earlier this year, I had the opportunity to sit down with Patience Carter, a Philadelphia native & survivor of... http://fb.me/1e6UjZwAh ",2017-06-12 22:30:04,0,0,874393389084684288
"Four years ago on June 10th, Lauren Shevchek took a life changing dive that paralyzed her body as a quadriplegic.... http://fb.me/96FMGn1CE ",2017-06-12 18:30:04,0,0,874332991950123009
Bucks County welcomes the Ukrainian Self Reliance Federal Credit Union which just opened up their newest branch... http://fb.me/240200m8W ,2017-06-12 15:30:05,1,0,874287697480888321
Aislinn doesn't remember a day when she didn’t need to lance her finger multiple times a day to check her blood... http://fb.me/12fy7hVzM ,2017-06-12 12:00:09,1,1,874234865343967232
"Thanks to Mr. Fries & his 'Conflict, Diplomacy & Resolution' students at William Tennent High School for inviting... http://fb.me/2SzO3MoBK ",2017-06-11 22:00:06,2,1,874023462288982016
"ICYMI: I'm pressing the Pentagon to tell me who knew what, when http://bit.ly/2rerN1m  http://fb.me/16Z8c9lSI ",2017-06-11 18:13:13,8,1,873966366218387457
Glad I could join the #Bensalem BAPs community the other weekend for Walk Green 2017! http://fb.me/HwFzw8hz ,2017-06-11 14:00:04,2,0,873902656527495168
"Best small business visit ever! 

Kenneth McDowell is raising money for kids with cancer through his Alex's... http://fb.me/7Mwq0TmdO ",2017-06-10 22:33:06,2,2,873669378180620289
Happy 30th Birthday to the Bristol Riverside Theatre!  Founding Director Susan Atkinson and the BRT community... http://fb.me/23iKnKe3r ,2017-06-10 18:21:49,9,1,873606142475337728
Joined Bucks Co. letter carriers for breakfast in D.C. this week. Thanks for coming down & discussing issues... http://fb.me/140gXdXdU ,2017-06-10 14:09:04,1,0,873542532977786880
These reports are extremely concerning and my constituents deserve answers. I joined Congressman Patrick Meehan &... http://fb.me/9aCkEw9uN ,2017-06-09 22:30:05,4,1,873306229531189248
Great to see our friends from Animal Alliance in New Hope the other weekend and talk about my work on the Animal... http://fb.me/8L7PcRAbH ,2017-06-09 18:30:05,2,0,873245832975405057
"Martha Miller is always working to make her community a better place - whether it's serving as a leader of ""No... http://fb.me/3wAaidEx3 ",2017-06-09 15:31:05,0,0,873200787517837312
#TBT Really enjoyed sitting down with #RSVP & learning about efforts to grow volunteering efforts in our region....http://fb.me/26spIBhe7 ,2017-06-09 12:00:03,0,0,873147680461123584
"Main Street, Not Wall Street http://fb.me/xh1kj2F5 ",2017-06-08 20:55:43,8,2,872920095542181889
"Congratulations to Commissioner Loughery for being tapped to attend a bipartisan summit governors, mayors &... http://fb.me/26wjsiPsU ",2017-06-08 12:00:04,3,1,872785296072560640
"June is National Alzheimer’s and Brain Awareness Month and, as a member of the Bipartisan Congressional Task... http://fb.me/6i4xrgEAR ",2017-06-07 23:00:04,0,0,872588999659016196
Thanks to the Central Bucks Family YMCA - Doylestown Branch for inviting me for a tour & seeing the great work being done for our community!,2017-06-07 18:30:04,9,2,872521051711963136
"Joined Senator Chuck McIlhinney, Doylestown Mayor Ron Strouse & Marlene Pray from CB Cares Educational Foundation... http://fb.me/6xXVex5uk ",2017-06-07 15:30:03,0,0,872475752842895360
"As Congress & the administration begin the process of shaping what tax reform should look like, I'm fighting for...http://fb.me/4Z2VZdG1y ",2017-06-07 12:00:05,2,0,872422909100339201
"The time is now for Congress to act on meaningful #TaxReform. 

Let's put politics aside & do what we were sent... http://fb.me/IURZQhpP ",2017-06-06 23:00:10,7,0,872226639534579713
Thanks for having me! http://fb.me/1iEFHgrJD ,2017-06-06 18:33:04,1,0,872159419819339779
"There’s plenty of work still to be done at the VA to ensure our veterans get the care they’ve earned, but...http://fb.me/1rgCSw7BW ",2017-06-06 15:30:08,5,0,872113383033712640
"There’s plenty of work still to be done at the VA to ensure our veterans get the care they’ve earned, but... http://fb.me/228XNwHLS ",2017-06-06 15:30:07,0,0,872113378571038720
"Today we mark #DDay73

""Soldiers, Sailors, and Airmen of the Allied Expeditionary Force:

You are about to embark... http://fb.me/8xwjGaaj9 ",2017-06-06 12:00:11,5,2,872060548720074752
Joined local Vietnam veterans early this morning to launch the first Bucks County Tour of Honor for Vietnam... http://fb.me/6P9Jwl4lG ,2017-06-05 23:00:06,7,0,871864232018685953
Had a blast talking about civics with the kids in Ms. Koczynski's 5th grade social studies class at Carl Sandburg... http://fb.me/1lYwPxfTZ ,2017-06-05 18:30:04,2,0,871796276026904576
"Today we remember the life & legacy of President Reagan & the enduring belief that, as Americans, we can achieve... http://fb.me/6QqQ62gb0 ",2017-06-05 15:30:03,1,0,871750976260247552
"""The Problem Solvers Caucus would like to begin discussions with you immediately on the possibility of tax reform... http://fb.me/1ZcD6SVq2 ",2017-06-05 12:00:03,4,3,871698128612839424
Joined the Bucks County Jewish Coalition & Jewish Federation of Greater Philadelphia at the annual Bucks County... http://fb.me/12Gd91icV ,2017-06-04 19:17:32,0,0,871445834109509632
Keep up the important work! http://fb.me/8CcAI8m34 ,2017-06-04 12:00:03,1,0,871335741003096064
Visited with the Southern Bucks Recovery Community Center & PRO-ACT this week to discuss their peer-to-peer... http://fb.me/4hJMWurM1 ,2017-06-03 22:21:11,1,0,871129664206626817
Visited with the Southern Bucks Recovery Community Center & PRO-ACT this week to discuss their peer-to-peer... http://fb.me/10y72C5lf ,2017-06-03 22:21:09,0,0,871129655583158272
"Congratulations to Thomas Hanlon of Troop 24 in #Doylestown on the attainment of his Eagle Scout!  

For his... http://fb.me/6napNzaH7 ",2017-06-03 18:35:09,3,0,871072782645329922
"Stopped by Bristol Borough's ""First Friday on The Delaware"" to grab a bite to eat between events & caught up with... http://fb.me/5OczhcFWS ",2017-06-03 14:00:06,4,1,871003561047601152
"ICYMI: Last week, the House took action to improve veterans’ access to quality health care, instill...http://fb.me/7Ns0VRDkX ",2017-06-02 22:00:04,4,0,870761961084121088
REMEMBERING THE COUNCIL ROCK 15: Memorial service in Newtown honors graduates who gave their lives on the... http://fb.me/2RhGxdKeK ,2017-06-02 17:00:03,2,1,870686461170900993
REMEMBERING THE COUNCIL ROCK 15: Memorial service in Newtown honors graduates who gave their lives on the... http://fb.me/1hZavjuUR ,2017-06-02 17:00:03,0,0,870686460260655105
Great catching up with my friend (& two-time heavyweight champion of the world!) Tim Witherspoon this weekend to... http://fb.me/19LTq9vRc ,2017-06-02 12:00:04,1,0,870610966664359937
"I'm 'taking on a leadership role in the fight against the national heroin and opioid addiction crisis...'

Learn... http://fb.me/13PLs2rDA ",2017-06-01 22:00:03,13,4,870399570466938881
Thanks to the BAPS community in #MontCo for inviting me to their walk last weekend! http://fb.me/1hMXNxnmq ,2017-06-01 17:00:04,2,0,870324075289300993
Opioid addiction and abuse is nothing short of an epidemic. From the toll it takes on our communities and...http://fb.me/8B7f89l18 ,2017-06-01 12:00:06,10,4,870248587820756992
"During #PoliceWeek, I told the story of my great uncle Philip Fitzpatrick - an NYPD patrolman shot & killed...http://fb.me/8EurLlT1f ",2017-05-31 22:00:12,5,4,870037218341126144
I was honored to join the Youth Orchestra of Bucks County's 25th Anniversary Production.  These children are an... http://fb.me/wyg35iaB ,2017-05-31 17:00:08,6,0,869961707367563264
"Human Trafficking may seem a world away, but it is not. It exists right here in our own back yards.

Last week,...http://fb.me/13pOttnNw ",2017-05-31 12:00:08,9,3,869886207056109569
Honored to commemorate #MemorialDay with VFW Post 1597 along with Senator Tommy Tomlinson & Representative Tina... http://fb.me/3vykPEIyo ,2017-05-30 22:09:03,1,0,869677061291614208
Joined the Friends of Washington Crossing Historic Park for a #MemorialDay ceremony thanking our veterans &... http://fb.me/3MCHcEKgE ,2017-05-29 22:00:03,8,2,869312407184846848
Honored join the Jewish War Veterans Post 697 in #Levittown for a dinner honoring our nation's' heroes this... http://fb.me/1q6y6OSVa ,2017-05-29 17:00:03,6,0,869236909213712384
"In his timeless and compassionate letter to a mother who lost five sons during the Civil War, President Abraham... http://fb.me/26wUplTTU ",2017-05-29 12:00:04,2,1,869161414211936257
"Planning your summer vacation? Considering a trip to our nation's capital? 

Our office can help you with tours,...http://fb.me/O9uX5vC2 ",2017-05-28 22:00:03,6,4,868950020627812352
Joined Bristol Borough Council President Ralph DiGuiseppe at St. Anne's in Bristol honoring Monsignor Joe Ferraro... http://fb.me/8H1Gg0xHI ,2017-05-28 17:00:03,3,0,868874523541688321
"As a member of the Animal Protection Caucus, I was happy to sit down with local members of the The Humane Society... http://fb.me/716lO3epW ",2017-05-28 14:00:04,15,4,868829227658993664
Cancer doesn't care who you are or how old you are. This ugly disease devastates so many - sometimes even the... http://fb.me/7ExWmjpaj ,2017-05-27 22:00:04,8,1,868587634783907840
Know anyone interested in a fall 2017 internship with The White House? Learn more here:http://fb.me/6NuNlLd2s ,2017-05-27 14:00:09,2,3,868466860488085506
Joined the Guardians Of The National Cemetery for a #MemorialDay flag planting at the Washington Crossing... http://fb.me/1IcK5CO56 ,2017-05-26 17:23:06,9,1,868155546230247424
"This week, Congress acted to strengthen our efforts to #EndTrafficking in the U.S. and abroad by passing a... http://fb.me/1qTYhMVCQ ",2017-05-26 12:00:04,4,0,868074253735931904
