Text,Date,Favorites,Retweets,Tweet ID
The 2017 ACA #OpenEnrollment season ends soon. Be sure to see what’s available for you!pic.twitter.com/KPQgG32Wes,2017-11-29 15:33:38,3,2,935894528279613441
"Small businesses are the backbone of our economy.  Today, I encourage everyone to join me in supporting the small businesses in their community. #SmallBusinessSaturdaypic.twitter.com/xjfy4qIQjk",2017-11-25 14:00:17,7,6,934421484084264962
Have a safe and happy Thanksgiving!pic.twitter.com/Yiq7mfvDMm,2017-11-23 14:01:59,8,3,933697138239950850
There's still time! ACA open enrollment ends December 15th. Visit http://Healthcare.gov  to see what’s available.pic.twitter.com/PGIxgtLiZc,2017-11-20 14:02:06,3,4,932610001591521287
"The GOP tax bill we voted on today benefits corporations and the 1% at the expense of the middle class.  In Illinois, more than 850,000 households earning less than $171,000 will see a tax increase. That is why I voted NO.",2017-11-16 23:36:24,31,10,931304977183756288
Our next step in the effort to get gun violence recognized as a public health crisis.https://twitter.com/EnergyCommerce/status/930492050058989575 …,2017-11-14 22:03:44,9,5,930556882837803008
Thank you to all of our veterans for your selfless sacrifice!pic.twitter.com/TuhKvTS0lv,2017-11-11 14:01:20,11,6,929348318404202497
"Yet again, the @HouseGOP uses and abuses lower- and middle- class families to further enrich the 1% https://nyti.ms/2hUiHFg  h/t @nytimes. 
cc: @HouseDemocrats",2017-11-09 18:19:28,4,6,928688506792300544
"Though it was defeated, I was proud to see BIPARTISAN support for my amendment today! #WorkingAcrossTheAislepic.twitter.com/I2i8xsQqBr",2017-11-08 22:28:14,9,4,928388721736642571
Rep. Rush Statement on #CHIP Vote: https://go.usa.gov/xnTwv pic.twitter.com/xmJyXvjNIp,2017-11-03 15:09:06,3,4,926466271222353921
2018 Healthcare Open Enrollment is Nov. 1 – Dec. 15. Visit http://Healthcare.gov  to review and update your options. #HurryUpForYourHealthpic.twitter.com/C8h8hHIZTM,2017-11-01 13:32:36,6,11,925717208428371969
If you missed the forum on public health solutions to gun violence hosted by Reps Rush & Pallone video is available. https://goo.gl/QQHi8r ,2017-10-26 20:54:09,9,9,923654003082309632
Proud to cohost tomorrow’s forum on Public Health Solutions to Gun Violence with @FrankPallone & @EnergyCommerce.https://go.usa.gov/xng9B ,2017-10-25 20:56:40,5,5,923292247797276672
"Then and now, freedom of speech is an important tool in the march towards equality.  We must cherish it and fight for it. #FreeSpeechWeekpic.twitter.com/LgO7XzVqjr",2017-10-16 15:50:42,57,34,919953759651926017
The exact opposite of what he claims to stand for. #HealthcareForAll (3/3),2017-10-13 18:23:33,5,1,918905060293214208
This will lead to more uninsured across the country & raise the price of insurance for the most vulnerable segments of our population. (2/3),2017-10-13 18:23:27,8,5,918905036448649216
I strongly condemn @POTUS’ decision to cut healthcare subsidies. (1/3),2017-10-13 18:23:21,19,5,918905011979083776
"Rep. Rush, today, questioned Energy Secretary Rick Perry’s commitment to evidence-based decision making. https://goo.gl/X49v5T  #Science",2017-10-12 21:44:59,5,3,918593364374769665
Congratulations to @R_Thaler and @UChicago for his winning the 2017 @NobelPrize in Economics! We are all proud of your great accomplishment!pic.twitter.com/UFTNu84jiq,2017-10-11 14:42:28,0,2,918124647723487233
Interested in a fully paid for first-class college education? Join us at our Military Academy Day to learn more! https://go.usa.gov/xnxq6 pic.twitter.com/VXNBCLmDap,2017-10-06 14:09:03,2,3,916304297134120960
So pleased that my amendment to allow community health centers to participate in the @NIH’s “All of Us” Program was unanimously accepted.,2017-10-05 03:15:49,19,3,915777518854123520
Another mass shooting. How many families will suffer before this stops? My thoughts & prayers with the victims & their loved ones. #LasVegas,2017-10-02 13:44:36,16,4,914848594557046786
Proud to stand with @NatlHeadStart which ensures that the most vulnerable families and children have access to a quality education.pic.twitter.com/3dCgthgfbC,2017-09-29 13:48:36,8,2,913762438507585538
The situation is dire. We must help #PuertoRico and the #USVirginIslands. That’s why I support the Humanitarian Disaster Relief Act.,2017-09-29 13:39:52,21,9,913760240683962368
It was my pleasure to meet with Bronzeville native #DemetriusNash as he works to end the violence plaguing Chicago. #StopTheViolencepic.twitter.com/3eePaWSvn1,2017-09-28 17:47:49,7,2,913460248593264640
So proud to welcome my friend and colleague @SteveScalise back to the Capitol today. #PowerOfPrayer #TeamScalise,2017-09-28 15:22:23,1,1,913423648329015297
Glad I had the chance to visit @NIH & meet some of the doctors and researchers there who are at the cutting edge of a cure for sickle cell.pic.twitter.com/3J1UrSl1Cm,2017-09-27 15:42:30,1,1,913066325160886272
News that #Equifax suffered an earlier breach further proves why we need a NATIONAL breach notification law & why I’ll be introducing one.,2017-09-20 16:06:16,19,8,910535591342870528
If the Senate debates a repeal of the #ACA I will continue to strongly oppose any efforts to deny #healthcare to Americans.,2017-09-18 16:00:06,9,3,909809263731765248
Concerned about the #Equifax breach? Here’s information from a reliable source on what you can do:https://go.usa.gov/xRMuN ,2017-09-12 19:26:17,4,2,907686823727595520
Rush Joins E&C Democrats in Questioning #Equifax CEO https://go.usa.gov/xRMu8 pic.twitter.com/Azg0g852ua,2017-09-12 19:23:40,5,3,907686167423975425
While we remember those we lost on 9/11 we remain grateful to those who put themselves in harm’s way to defend our way of life. #NeverForgetpic.twitter.com/dwPkEkTGwJ,2017-09-11 14:23:23,5,2,907248210602799104
Flooding can happen anywhere. Learn how to keep your family safe by visiting https://www.ready.gov/floods . #NationalPreparednessMonthpic.twitter.com/2wW1Iv59kr,2017-09-08 20:49:46,3,2,906258281513005056
"Today, I participated in an Energy Subcommittee hearing on the Public Utilities Regulatory Policies Act and its effect on today’s consumers.pic.twitter.com/OCAywIjDs7",2017-09-06 16:33:03,6,2,905468902305435648
Join us for Military Academy Day 2017 to hear from the U.S. service academies. More information at https://go.usa.gov/xR6WB .pic.twitter.com/Rh43hjZvSu,2017-09-06 15:28:47,2,0,905452727655903232
Rush Statement on Trump Administration's Decision to End #DACAhttps://go.usa.gov/xRHAX ,2017-09-05 16:03:49,14,5,905099156292849664
Rush Statement on State of Illinois’ Lawsuit to Enforce #ChicagoPoliceDepartment Reforms. Full statement at https://go.usa.gov/xRAbj .pic.twitter.com/phruluTMqX,2017-08-29 18:54:31,4,7,902605398171144192
The world has lost a pioneer in the fight for equality; a legendary writer and social activist. #RIPDickGregory,2017-08-20 14:49:06,25,5,899282148250853378
I encourage all Americans to join me in condemning the racist violence in #Charlottesville. We can do better. We must do better.,2017-08-13 14:29:11,43,18,896740421073850369
I hope tonight's Property Tax Appeal Forum helped everyone who attended receive the information needed to improve their tax bills.pic.twitter.com/tTeBPG1yWU,2017-08-04 02:51:47,10,3,893303422174318593
I hear that there might be rain in the forecast today. Don't let it stop you from coming out to the Property Tax Event starting at 6 p.m.pic.twitter.com/xYaCLV9vA3,2017-08-03 15:17:16,0,0,893128643467247617
Will you I see you at tomorrow's property tax assessment appeals event? It starts at 6 p.m. at CSU.pic.twitter.com/J59Co3AHyH,2017-08-02 19:24:33,1,1,892828486553010177
"Seeking a reduction is a free shot at saving big money on your tax bill. See you Thurs., 6 pm @ CSU to APPEAL your property tax bill.pic.twitter.com/Y8wkkzQxno",2017-08-01 18:40:40,2,1,892455055353421825
"#Startups create 2 million jobs/yr, which is why I’m joining my colleagues to learn about challenges facing the biz leaders of the future.pic.twitter.com/NHN9sNpYih",2017-08-01 18:34:25,6,4,892453478932652033
So everyone's facts are not in order?pic.twitter.com/X6V5AjDcIt,2017-07-31 18:51:13,2,2,892095320569647104
Call my office at 773-779-2400.,2017-07-31 17:28:31,0,0,892074509867659264
We read the stories about improper property tax assessments in Chicago. I will assist you on Thursday to appeal your property tax bill.pic.twitter.com/MMzc5eoGLS,2017-07-31 17:03:07,2,1,892068116997517313
"Today we celebrate the 52nd Anniversary of #Medicare and #Medicaid - Programs vital for the health of women, children & the disabled.",2017-07-27 15:04:47,22,10,890588786496811009
We haven’t stopped #Trumpcare yet. Republicans are reverting to an even more dangerous plan. We must #ProtectOurCare,2017-07-26 14:05:51,10,3,890211567542960128
.@OfficialCBC How can the 23 million Americans recover under Trumpcare who are slated to lose coverage? #CBCOnHealthcare,2017-07-26 14:03:03,14,4,890210863411580928
The Senate voted today to begin the process of repealing our country's working healthcare system. #SaveACA,2017-07-25 19:11:11,10,4,889926016688427011
#DidYouKnow: @CFPB's #arbitration rule makes it easier for #consumers to fight back if they are harmed by a bank or #creditcard company,2017-07-25 18:19:45,3,1,889913076992147456
There are more than 700 water main breaks every day.,2017-07-25 16:01:38,2,2,889878318098546689
"In 2017, the American Society of Civil Engineers gave America’s water infrastructure a D grade.",2017-07-25 16:01:15,1,0,889878221814202371
Thank you to the Midwest Energy Efficiency Alliance for the pleasure of keynoting this year's Policy Perspective breakfast. #energyjobspic.twitter.com/jcTHjQXt6Q,2017-07-21 19:27:39,3,0,888480612256034817
This has been my message for the past few years that Chicago needs jobs and opportunity to fix violence in our city:https://goo.gl/JAcY8Y ,2017-07-20 15:51:38,2,4,888063862003699713
Make your voice heard at tomorrow's Board of Commissioners of Cook County meeting if you experienced unfair #propertytaxassessment.pic.twitter.com/ACnbZYA6dU,2017-07-17 22:52:27,4,5,887082599696531456
pic.twitter.com/ADFy5ni6uJ,2017-07-17 13:48:23,2,3,886945681960841217
pic.twitter.com/4MdEN1Frmc,2017-07-17 13:48:11,1,1,886945628932239365
The CBC Health Task Force asked Senator Mitch McConnell to reconsider his health bill as it will devastate the communities we represent.,2017-07-14 16:19:12,6,10,885896469005447168
The #ACA ensured mental health coverage was included in all plans. #Trumpcare repeals coverage requirement & hurts millions,2017-07-13 18:14:04,10,5,885562991667806208
I am a strong supporter of net neutrality and will continue to fight to protect it. #NetNeutrality,2017-07-12 19:08:22,32,12,885214267003346944
"Illinois wants to cut landline service, but the FCC must approve this decision:https://goo.gl/DsWxsv ",2017-07-06 15:26:48,2,2,882984179444658177
I stand with 9 out of 10 Americans who want #GMO foods labeled! #justlabelit,2017-06-29 16:26:08,19,11,880462398414630912
Births. Medicaid covers 49 percent of all births (a state breakdown here).,2017-06-27 22:10:43,10,9,879824341373943808
CHIP stands on the shoulders of Medicaid. Medicaid covers 37 million low income children while CHIP covers 8.9 million #ProtectMedicaid,2017-06-23 15:16:57,3,6,878270660027367424
"After weeks of secrecy and backroom dealing, Senate Republicans have released a bill that is just as ‘mean’ and heartless as the House Bill.",2017-06-22 19:03:40,7,7,877965325941129218
Tell the world you stand with refugees and believe in #OurSharedFuture by adding your voice on social media this Refugee Week.pic.twitter.com/yAaurShNxZ,2017-06-21 21:55:45,6,2,877646246046949381
I met Dr. Selwyn Rogers who will lead the University of Chicago Medicine’s development of the South Side’s only Level 1 adult trauma center.pic.twitter.com/pcBovCBamJ,2017-06-19 22:34:24,9,2,876931195233107969
"Leading on climate action, we can create good-paying American jobs in clean energy and green manufacturing #ActonClimatepic.twitter.com/OY5lAXuD6s",2017-06-16 21:37:44,11,12,875829770923249664
The United States cannot and should not isolate itself from our neighbors: https://goo.gl/uLTSnv  #USCubaRelationspic.twitter.com/TxhA8KK4af,2017-06-16 21:19:16,6,5,875825124779470850
"Today, we laid to the rest a young man who was worthy of life, Xavier Joy: https://goo.gl/2azJPH . #StopTheViolence",2017-06-16 20:30:42,7,9,875812902724349952
Looking forward to a great game tonight! #CBG2017,2017-06-15 18:00:55,2,1,875412821609197569
"My prayers and thoughts are with @SteveScalise, congressional staff and Capitol police all affected by this morning's horrible shooting.",2017-06-14 13:38:54,15,10,874984493760880640
"@SteveScalise My prayers and thoughts are with and your family, and all affected by this morning's horrible shooting.",2017-06-14 13:37:16,1,2,874984083616649216
H.R.338 creates jobs in two of the most critical and fastest growing sectors energy & manufacturing:http://youtu.be/hm2KmukC-i0 ,2017-06-13 15:52:57,2,1,874655839721795584
Rush Statement on the Shooting Death of Xavier Joyhttps://go.usa.gov/xNyNk ,2017-06-09 20:03:47,5,5,873269412421390336
My prayers are with you friend:https://goo.gl/KuQetv ,2017-06-09 18:32:51,2,4,873246530752454656
Tuned into Comey hearing. We need answers to the following: https://goo.gl/x9nSU3 ,2017-06-08 14:12:10,2,0,872818538234425345
The President's decision to pull the U.S. out of #ParisAgreement removes safeguards that protect our health and our environment.,2017-05-31 15:09:00,27,12,869933736569208832
"Welcome to the Hill, Alvin Guyton for #FosterYouthVoices. Thank you to the parents & relatives who do so much for those in foster care.pic.twitter.com/s5IARAFnEd",2017-05-24 15:40:13,15,3,867404877437206528
"During Nat’l #DrugCourtMonth, I’d like to recognize the dedicated professionals who work in drug courts in Illinois. TY for all you do!",2017-05-22 21:17:22,5,0,866764952052355072
#FosterYouthVoices must be included in the child welfare reform discussion. Looking forward to hosting Alvin Guyton at #DCShadowDay 2017.,2017-05-22 19:07:07,2,1,866732173252059136
Great conversation with @nardotrealtor about legislation that will protect new and existing homeowners from flood insurance tax hikes.pic.twitter.com/eG6yi9jK7C,2017-05-18 16:47:37,6,4,865247515540631554
"Nice to see changes coming to the CPD, but more still needs to be done:https://goo.gl/hHvpHK ",2017-05-17 17:45:02,5,1,864899575798169600
#NetNeutrality protects innovators and small businesses—they can't afford @FCC about-face on rules protecting the fair and open internet.,2017-05-17 16:15:09,12,11,864876955233124353
78% of Americans want an independent commission to #FollowTheFacts on Trump-Russia connection. Republicans must act.,2017-05-17 16:13:47,8,5,864876612067762176
Every $1 invested in transit generates approximately $4 in economic returns.,2017-05-17 15:20:03,8,2,864863088352382976
"Public transportation provides access to jobs,and spurs economic growth in communities.",2017-05-17 15:19:58,11,4,864863069234761728
"It's Infrastructure Week: According to the 2017 Infrastructure Report Card, America’s public transit receives a grade of D-.",2017-05-17 15:19:11,7,3,864862871502503938
Happy Mother's Day to all the women make the world a better place.,2017-05-14 21:40:27,13,1,863871655826919425
"Today, I received an Honorary Doctorate of Humanities from Illinois Institute. It is with the utmost appreciation that accept such an honor.pic.twitter.com/Z6cu5kmMwE",2017-05-13 15:26:53,15,2,863415256512704514
The roll backs in sentencing issued yesterday by Attorney General Sessions are appalling and harmful to our communities. #resist,2017-05-13 04:28:05,27,12,863249465515409408
I'm live on Facebook addressing the fallout from the firing of former FBI Director Comey.,2017-05-12 15:08:16,9,3,863048183047389186
Upward Bound is critical to my constituents.View the letter my colleagues  sent to Secretary DeVos today: https://goo.gl/JHbgqM ,2017-05-10 18:49:16,4,2,862379026110980096
Questions are raised after the President fires FBI director overseeing investigation. We need a special prosecutor for accurate reporting.,2017-05-10 15:44:20,60,26,862332487195914241
This is not what America stands for. All Americans need proper healthcare coverage. No to #Trumpcare,2017-05-04 18:23:39,60,17,860198252041437185
To My Constituents: https://goo.gl/XUfRuy pic.twitter.com/bX6fcNR6YZ,2017-05-04 16:38:39,21,11,860171825858433024
#YoungEntrepreneurs face unique issues. Resources exist to help improve financial literacy & make informed decisionshttp://bit.ly/1WvRqXw ,2017-05-03 21:08:05,2,0,859877245959237632
@OfficialCBC Has justice been served?https://goo.gl/vkDPnH ,2017-05-02 19:33:44,1,0,859491110749691910
"It has been 100 days of attacks on health care, public education, social justice, women and immigrants. #Trump100Days",2017-04-28 12:58:55,16,7,857942202663792641
"Today, I announced plans to renovate the historic 63rd and Cottage Grove station at the Green Line. Constituents will have their say.pic.twitter.com/Ye6bkLYml4",2017-04-24 13:37:18,13,1,856502311681654784
Trump reaches his 100th day next week. Since taking the oath he has spent all of that time harming rather than helping the American people.,2017-04-21 18:39:12,25,16,855491121442693120
Chicago is a beautiful city but it it is impacted by the ugliness of violence. We have to get these illicit guns off the streets now.,2017-04-19 12:10:39,22,8,854668566389547009
Bannon removed from the National Security Council is a step in the (non-alt) right direction.,2017-04-05 16:07:52,33,11,849654832906592258
Forty-nine years ago MLK was assassinated fighting for our rights. Our nation remains just as divided. There's no going backward. #justice,2017-04-04 14:46:21,19,7,849271930083520513
"With a heavy heart I extend condolences to Rep. Danny K. Davis on the loss of his son today. He, Vera and family are in our prayers.",2017-03-31 18:18:33,24,4,847875780474482689
"Rep. Rush tells @POTUS, “Let America Breathe Again!”https://go.usa.gov/xXXzm ",2017-03-28 22:33:06,11,5,846852677862674433
"On behalf of the entire Rush family, thank you for your outpouring of love today. We had a beautiful service for Carolyn. My to you all.",2017-03-25 22:01:31,64,11,845757562997886978
My family is humbled by the love and support shown us. Carolyn lays in state at 6pm and I thank you all in advance for your expressions.,2017-03-24 22:15:30,29,5,845398695730401280
Today God and sane judgment prevailed. The attack on healthcare has been tabled. We will continue to protect our interests. #ProtectOurCare,2017-03-24 22:13:36,34,12,845398215994298368
I was on my way to DC today to fight for healthcare. Carolyn would have wanted me to do so. The vote is postponed. I'll be with my family.,2017-03-23 21:06:44,78,9,845019002883756036
My colleagues are magnificent in their understanding. On Friday services for my beloved Carolyn start. I stand in unity to protect ACA.,2017-03-23 00:24:20,38,3,844706340329193472
I am in constant contact with the leadership and I'm monitoring the ACA vote hour by hour.,2017-03-23 00:22:06,33,3,844705780767096832
"The celebration of Carolyn's life will be Saturday, Mar. 25th at 11 am at Freedom Temple COGIC, 1459 W. 74th Street in Chicago.  #ThankYou",2017-03-15 16:57:52,24,5,842057271802789889
"Thanks to everyone for your outpouring of love during this difficult time, including Fmr President Obama, who called me today.  #ThankYou",2017-03-14 20:33:08,52,7,841749053838921728
"U.S. Rep. Bobby L. Rush announces the passing of his wife Carolyn Rush, 68. Full statement available at https://go.usa.gov/xXrEm .",2017-03-13 17:53:40,28,11,841346537204678657
"Today I have lost by best friend, the love of my life, my confidant and my best half. Carolyn I will always love you.",2017-03-13 14:36:43,360,88,841296973789577216
RE DO: Scores of families received energy assistance at our Winter Resource Fair. Thanks to all participants. #CEDApic.twitter.com/l14U7JM9Ab,2017-03-11 20:03:59,9,3,840654557826994176
"It is clear, the GOP Repeal Bill means less coverage, fewer protections, higher costs – and massive new tax break to billionaires.  #Stand!",2017-03-09 20:04:45,27,8,839929975541202949
"Do the 1% want it all? I stand with working families, those without work, and my colleagues who oppose the GOP's @PayMoreForLess bill.https://twitter.com/USRepMikeDoyle/status/839822332009066496 …",2017-03-09 15:40:34,25,9,839863490634469377
"Thinking of my wife, sisters, daughters and granddaughters. I remember my mom and aunts. I am because they are. #InternationalWomensDay",2017-03-08 13:32:08,31,5,839468779893567488
The Republicans' draconian attack on the ACA will render millions without health care... not just health insurance. This is immoral.,2017-03-07 14:08:23,45,24,839115513917763585
The DOJ mustn't close an eye to its own scathing report on the CPD. Their use of deadly force is what got them there in the first place.https://twitter.com/chicagotribune/status/838862828085837825 …,2017-03-06 21:32:59,11,6,838865016690454528
Republians will unravel the guaranteed benefit for seniors and people with disabilities by privatizing Medicare and moving to vouchers. #No!,2017-03-06 21:29:45,21,15,838864200239890432
I have just introduced H.R. 1272 to help bring justice and closure to civil rights era cold cases. These crimes must be brought to bare.,2017-03-01 23:09:52,36,16,837077456121020417
"It is Women's History Month and we can celebrate all month by advocating for reproductive rights, gender equality and  against sexism.",2017-03-01 18:46:23,23,11,837011148180492297
ACA is making Americans’ lives better.  We must #ProtectOurCare – or watch as @realDonaldTrump and House Rs #MakeAmericaSickAgain.,2017-03-01 15:48:47,23,10,836966453425418240
Trumps speech was more campaign promises on steroids. Little substance. Lots of threats. I asked him to come to Chicago. He said yes.,2017-03-01 03:57:47,37,17,836787527520518144
"Will I vote against Trump's budget cuts? I will take on anything that removes protections, reduces our power and voice, and sets us back.",2017-02-28 21:52:41,24,11,836695645331279873
"Whatever happens tonight we will not be divided. Democracy calls for the diversity of voices, where all participate. Justice trumps hate.pic.twitter.com/OGFvmympQt",2017-02-28 21:03:06,22,9,836683168858128385
Trump's Executive Order apparently puts HBCUs under his control. Where's the money? The devil's in the details with this. No applause here.,2017-02-28 19:56:46,17,6,836666474278207488
"This is why the people yell, ""NO JUSTICE, NO PEACE."" We demand police accountability and massive reforms. Sixteen shots is not anecdotal.https://twitter.com/NBCNews/status/836659739740233729 …",2017-02-28 19:35:49,59,59,836661200880480256
Betsy DeVos' comments on HBCUs may prove her the most misinformed U.S. Ed Secy. in recent history. Our HBCUs are not 'school choice.',2017-02-28 19:33:38,24,9,836660653704130560
The horror in Kansas is an illustration of the ugliness and division that is being sowed by the WH. We cannot afford to go backwards. No!,2017-02-28 18:53:29,13,4,836650548132720640
The Return of American Race Laws (from @Truthdig)http://www.truthdig.com/report/item/the_return_of_american_race_laws_20170226#.WLST0nD26yE.twitter …,2017-02-27 21:02:14,7,14,836320562645454848
The attacks on voting rights must be met with vigorous opposition. Too many people have sacrificed so others have the right. I'm appalled.https://twitter.com/AP/status/836276697091670016 …,2017-02-27 20:17:49,19,8,836309381268582400
"@realDonaldTrump No cuts to the EPA!! Cuts lead to more crisis like Flint, MI, and Crestwood, IL. I will oppose any cuts to the EPA.",2017-02-27 12:56:22,13,9,836198290391764993
Congratulations Tom Perez. @TheDemocrats Time to retore the public's trust in Our party as we unite to stop America from moving backwards.,2017-02-25 21:33:17,6,2,835603599019376640
"And, as I shared with you all at the meeting my voice has never been silent--- until I leave this earth.",2017-02-24 21:30:43,3,0,835240566006894592
Agreed. #NewJimCrowhttps://twitter.com/RepYvetteClarke/status/835190468786933761 …,2017-02-24 18:38:40,55,28,835197268227653637
"Harold Washington was an exceptional mayor and friend. I stood with him against the 'Vrdolyak 29"" during the Council Wars. #FlashbackFridaypic.twitter.com/IoPDJy3fP2",2017-02-24 18:37:46,9,3,835197039428370432
If Trump is the future of the GOP then everybody ought to invest in a time machine right now so tomorrow becomes yesterday. #StoptheClockhttps://twitter.com/thehill/status/835184787912548352 …,2017-02-24 17:52:16,12,9,835185590891134976
After candid talks with constituents I remain hopeful our talks are not misrepresented to the public. @IndivChi_South took their signs down.pic.twitter.com/Zn1fDFUEoV,2017-02-24 17:39:59,8,3,835182500599238658
"Free speech, advocacy and voting rights are rooted in our democracy. @IndivChi_South we are not as divided as we are disconnected. #Unitedpic.twitter.com/yoS9EA4jOL",2017-02-24 17:31:02,14,8,835180247075160064
Navigating Today’s U.S Immigration Policy...live nowhttps://www.youtube.com/watch?v=3e_0iaHPUgY&feature=share …,2017-02-24 00:16:39,3,1,834919936116019202
I agree! @Clyburnhttps://twitter.com/XULASGA/status/834155893998678017 …,2017-02-23 16:59:43,2,1,834809977604866048
Tonight's immigration will live stream on my YouTube channel. Tune in at 5:30 PM.https://www.youtube.com/watch?v=3e_0iaHPUgY …,2017-02-23 16:32:22,4,4,834803093451763713
