Text,Date,Favorites,Retweets,Tweet ID
Update - See how I’m working for you as President Trump moves ahead with his agenda:http://bit.ly/2k4BiNS ,2017-02-04 21:40:13,10,5,827995198978416640
Today we celebrate a remarkable woman’s birthday – Rosa Parks. May we continue to learn from her example. #GoodTrouble #BlackHistoryMonthpic.twitter.com/GEWxkad4Tj,2017-02-04 17:30:30,38,15,827932355679633408
Celebrating 147 yrs of crucial voting rights milestone – 15th amendment. Let’s keep pushing to ensure all can exercise their voting rights.pic.twitter.com/9OEJsOaCxW,2017-02-03 22:25:10,24,7,827644121670152192
Thank you to all who fought for athletes to wear articles of faith on the basketball court h/t @repjoecrowley @fibahttps://sports.ndtv.com/othersports/sikh-basketball-players-can-wear-turbans-in-international-games-us-lawmakers-hail-move-1655695 …,2017-02-03 17:13:34,5,1,827565705306525697
Thank you to all who fought for athletes to wear articles of faith on the basketball court h/t @joecrowley @fiba https://sports.ndtv.com/othersports/sikh-basketball-players-can-wear-turbans-in-international-games-us-lawmakers-hail-move-1655695 …,2017-02-03 17:12:19,5,2,827565393082458112
The President’s Executive Order against refugees & immigrants is contrary to core our values. Do you agree? Survey: http://bit.ly/2k0ZUXB pic.twitter.com/mHJEOG08Yn,2017-02-03 04:12:36,19,7,827369171000389632
‘Let Them Play’ is more than a hashtag – it’s the right thing to dohttps://twitter.com/repjoecrowley/status/827304379191611393 …,2017-02-03 00:48:53,8,3,827317902172946432
4 African Americans sat down at a Greensboro lunch counter 57 yrs ago to demand equality. Let’s honor their bravery this #BlackHistoryMonthpic.twitter.com/q7pwRzNpmn,2017-02-01 20:25:19,65,22,826889184157790210
"If you started your #CoveredCalifornia paperwork before midnight yesterday, you have until Saturday to complete it http://www.coveredca.com/ ",2017-02-01 14:41:28,7,2,826802651421691908
1st Social Security check mailed 77 yrs ago. You can count on me to be a champion of Social Security as new Admin & Congress move ahead.pic.twitter.com/MK4OXmKXGX,2017-02-01 02:05:06,30,11,826612308067614721
THANK You to students at Skycrest & Kingswood elementary for making Valentine’s Day Cards for veterans! We are honored to deliver them.pic.twitter.com/sByrqjNxjx,2017-02-01 00:25:12,15,4,826587168122499072
Proud to stand w/ colleagues to denounce President Trump’s harmful executive order against immigrants & refugees. Not who we are.pic.twitter.com/sxlNQRff29,2017-01-31 23:10:41,58,23,826568412105146368
"Today, I sponsored legislation to block the executive order banning refugees and travelers from 7 Muslim majority countriespic.twitter.com/Ma7gXDh8Dk",2017-01-31 00:15:27,159,44,826222323443363841
Today I’m glad to recognize the anniversary of the Lilly Ledbetter Fair Pay Act – a crucial milestone in the fight for #EqualPay.pic.twitter.com/M57TfxJUGP,2017-01-29 21:49:12,22,7,825823134397894659
This executive order is a dramatic overreach that lacks understanding of and respect for our constitution:http://bit.ly/2kgUjQe ,2017-01-29 20:29:10,61,27,825802993320747008
Open enrollment at Covered California ends on January 31st– look at your options today: http://www.coveredca.com pic.twitter.com/62sOCAWYGp,2017-01-29 01:55:55,3,8,825522834051104768
Incredible turnout at our community engagement forum today in #ElkGrove. Thank you to all who participatedpic.twitter.com/XRTfX7OSMp,2017-01-28 20:20:49,28,5,825438503773335552
Wishing a safe and prosperous Year of the Rooster to those celebrating #LunarNewYear around the world! http://cnyca.net/php/ ,2017-01-28 17:07:00,5,2,825389727230488577
"Holocaust Remembrance Day: The atrocities of the past remind us to double down on the fight against racism, discrimination and hate",2017-01-27 20:19:49,39,25,825075861581881344
"Bringing nature back to our neighborhoods, one tree at a time! Thank you @SacTree for having me this morning #CityofTreespic.twitter.com/dYSVcpVI8P",2017-01-26 18:37:15,12,5,824687663500386304
"Excited to speak at @sactree summit - Trees improve our quality of life, our health and our neighborhoods! #CityofTreespic.twitter.com/neczk3P1VD",2017-01-26 17:57:01,7,1,824677538270220288
#ICYMI: Scheduled new office hours for 2017 to help you at your own neighborhood library. Learn more & RSVP: http://1.usa.gov/1FMlZ50 pic.twitter.com/A1TjDiTVrI,2017-01-25 22:12:56,0,1,824379554030567426
#ICYMI: Pleased to share that I’ve been named the Vice Ranking Member of the House Foreign Affairs Committee:http://bit.ly/2jWie7b ,2017-01-25 17:22:07,14,6,824306365468475394
Proud to stand w/ @RepDianaDeGette today to oppose HR 7 – a radical attack on women’s health care. #WomenAreWatchingpic.twitter.com/hBdorLjGB0,2017-01-25 01:53:24,42,30,824072649894666240
Hosting a Community Engagement Forum this Saturday w/ Elk Grove Mayor Steve Ly. Learn more & RSVP: http://bit.ly/2jX9SMF pic.twitter.com/bskpswHJ5u,2017-01-25 01:32:49,7,3,824067467710496768
Honored and energized to be named Vice Ranking Member of the House Committee on Foreign Affairs #115thCongress https://bera.house.gov/media-center/press-releases/icymi-rep-ami-bera-named-vice-ranking-member-of-house-foreign-affairs …,2017-01-24 21:19:32,13,5,824003725316521986
I'm concerned policies supported by this Administration & Congress interfere with doctor-patient relationship & women's healthcare decisions,2017-01-24 15:36:05,54,19,823917294837436421
A woman's decisions about her healthcare should be made between her and her doctor #ProtectOurCarepic.twitter.com/y8kCV1Dox5,2017-01-24 15:25:00,187,91,823914504459259904
"Now that President Trump has taken his oath of office, what are your thoughts? Survey: http://bit.ly/2h39ESa pic.twitter.com/klqiZ020nv",2017-01-24 01:44:47,8,6,823708092919582720
"On this anniversary of Roe v Wade, proud to be one of the 7 in 10 Americans who support this decision for women’s health.pic.twitter.com/FKybkcntyJ",2017-01-22 18:30:28,74,34,823236405233090560
"Any discussion of women’s rights must include access to safe and affordable health care, including reproductive care.pic.twitter.com/BnQVItbTuS",2017-01-21 19:05:15,42,10,822882768610848768
We must continue the struggle for women’s equality at home and abroad. Gender should never be a barrier to success.pic.twitter.com/XNF6DWGCbf,2017-01-21 18:00:52,52,16,822866567327268869
"In America, respect for the rights of all women and girls must always be one of our core national values.pic.twitter.com/GKF3BImkpj",2017-01-21 16:35:07,35,14,822844989172551680
Wearing Planned Parenthood Pink today to #standwithplannedparenthood #protectourcare. See you at the march tomorrowpic.twitter.com/W9gTntFSaW,2017-01-20 20:44:01,82,13,822545237163855872
I'm really going to miss these guys. Grateful for their service to this countrypic.twitter.com/uKhebp9T94,2017-01-20 20:21:12,45,6,822539495207825408
"If you are experiencing a power outage, follow these safety tips from http://Ready.Gov  https://www.ready.gov/power-outages ",2017-01-19 20:17:26,2,4,822176161107214342
Thank you to the men and women who are working hard to get everyone back on. Stay safe out there.https://twitter.com/SMUDUpdates/status/822151522809090048 …,2017-01-19 19:09:42,7,2,822159113471856640
"As a doctor, I urge the President-Elect to prove his campaign pledges to respect women by rejecting policy to #ACARepeal and defund @ppfahttps://twitter.com/mikedebonis/status/822096294470713344 …",2017-01-19 16:43:55,22,8,822122425789849600
The President-Elect has the power to prevent harm to women & girls by rejecting policy to repeal #ACA & defund @ppfa https://www.washingtonpost.com/news/powerpost/wp-content/uploads/sites/47/2017/01/Full-Ltr.pdf?tid=a_inl …,2017-01-19 16:22:17,13,4,822116982925520901
pic.twitter.com/7yHbievBWP,2017-01-18 17:15:12,115,43,821767910138015744
Ready to fight for Planned Parenthood every step of the way #SacramentoPinkOut #PinkOutDay #IStandwithPlannedParenthood @PPactpic.twitter.com/XyDESqJNRI,2017-01-18 16:26:33,66,26,821755670127112193
Great way to start the day!https://twitter.com/dmitchinson/status/821746470017638400 …,2017-01-18 16:15:55,4,2,821752993154527233
Talked #inauguration and #AffordableCareAct with @dmitchinson and @AmyLewisKFBK on @kfbk WATCH: https://www.facebook.com/newsradio1530/?fref=ts …,2017-01-18 16:15:44,0,0,821752944710340608
"I'll be talking to Dan and Amy on @kfbk at 7:40 this morning! tune in at 93.1 FM, 1530 AM or online herehttp://kfbk.iheart.com/ ",2017-01-18 15:37:09,1,1,821743238457544707
"Free support @SacramentoSBDC @Metro_Chamber offers #smallbiz owners = new businesses, new jobs, stronger community #Sacramentopic.twitter.com/PF7vquEnix",2017-01-17 21:53:00,11,4,821475434986545152
Talked with @PaulRobins and Simone_DeAlba on @FOX40 this morning about #ACA and #Inauguration2017 WATCH: http://fox40.com/2017/01/17/affordable-care-act-debate-with-rep-ami-bera/ …pic.twitter.com/C3n0I8p7jK,2017-01-17 19:21:34,3,1,821437325842509824
Great to catch up with @KCRAnews @kcraluery today. Tune in at 6pm to catch the interviewpic.twitter.com/jChtXyiWgZ,2017-01-16 21:56:29,6,1,821113924548431874
"Today is a reminder to live Dr. King’s teachings of equality, justice, and nonviolence.pic.twitter.com/SG4uGYVIkc",2017-01-16 17:23:17,25,7,821045169680220161
Need help? Staff at Carmichael library on Tue. from 10 AM to noon to help you: http://1.usa.gov/1PPFafY pic.twitter.com/gVOr2XOfkC,2017-01-15 23:05:14,2,2,820768835976495104
See how to honor the memory & values of MLK by serving your nation tomorrow int Natl Day of Service: http://www.nationalservice.gov/mlkday pic.twitter.com/39fCQfQ61d,2017-01-15 20:02:46,17,6,820722917575163906
Recently finished scheduling office hours for 2017! See when to get help in your own neighborhood: http://1.usa.gov/1PPFafY pic.twitter.com/gH49yUcq0N,2017-01-14 21:10:28,10,2,820377564908756992
"So great to read about the modern, American made locomotives that were manufactured right here in Sacramento County!http://usat.ly/2it9yEi ",2017-01-13 23:05:08,7,5,820044036119678976
Today I voted against the first step to repeal the Affordable Care Act. Read my statement http://bera.house.gov/media-center/press-releases/rep-ami-bera-statement-on-voting-against-first-step-to-repeal-affordable … #ACA #ACARepeal,2017-01-13 20:45:36,49,10,820008920362188801
Celebrating the contributions that Korean Americans bring to communities across our nation today! Happy #KoreanAmericanDay,2017-01-13 14:26:40,14,4,819913560067293184
How has the Affordable Care Act affected you and your family? Take the survey: http://bit.ly/2igOsKX pic.twitter.com/2Wyqooca7e,2017-01-12 17:35:12,35,22,819598618109870080
Take extreme caution on the roads if you are driving in flood-affected areas. #CAFloodhttps://twitter.com/SacramentoOES/status/819569911164866560 …,2017-01-12 17:10:15,2,3,819592337181523968
Need health care? You now have until 1/20/17 to signup on @CoveredCA for coverage that starts on 2/1/17: http://www.coveredca.com ,2017-01-12 01:47:05,8,7,819360017627447296
"As we await @POTUS farewell address, I want to express my deepest gratitude for his service to our nation. #ThanksObama #ObamaFarewellpic.twitter.com/BNEEQHZY7L",2017-01-11 00:05:08,44,8,818971973204213764
More high wind and rains expected tonight. Are you prepared for a power outage? #CAStorm https://www.pge.com/en_US/safety/emergency-preparedness/natural-disaster/storms/storms.page …,2017-01-10 21:38:52,0,3,818935164491468800
Thanks for the clarification!,2017-01-10 19:47:56,2,0,818907245408907266
.@NWSSacramento asking #Wilton residents to evacuate. #Cosumnes River predicted to crest tonight. Sign up for alerts https://member.everbridge.net/index/453003085611271#/signup …https://twitter.com/NWSSacramento/status/818895165033213954 …,2017-01-10 19:09:06,1,4,818897472114327552
Repealing the Affordable Care Act without a meaningful replacement would do irreparable damage.https://youtu.be/EFGXRWvG5lQ ,2017-01-10 16:44:03,13,1,818860970550427650
Staff holding its first 2017 office hours at the Folsom Library tomorrow – please drop by to get help: http://1.usa.gov/1PPFafY pic.twitter.com/DYALxV6nCM,2017-01-10 01:19:26,2,2,818628283042594816
Hi Janice -- thank you for writing. Can you email your request to ami.bera@mail.house.gov? Thank you!,2017-01-09 18:02:55,0,0,818518427795095554
"Risks aren't over yet for #CAstorm, streams will continue rising this week, even after rain stopshttps://twitter.com/NWSCNRFC/status/818415322713591809 …",2017-01-09 14:05:10,1,1,818458595859824640
"If you see a downed power line, stay clear and DO NOT touch the wires. Call 911 or 1-888-456-7683 #castorm #cafloodhttps://www.smud.org/en/residential/education-safety/powerlines-and-equipment/power-lines.htm …",2017-01-08 21:05:05,7,3,818201884402077702
FLOOD WARNING: Here are the precautions you can take #castorm #caflood http://www.cityofsacramento.org/Living-Here/Winter-Cold …,2017-01-08 20:15:08,1,1,818189312621690880
"FLOOD WARNING: Cosumnes River predicted to crest at NOON. If you live in Wilton area, still time to get sandbags: http://bit.ly/2iWQWxA ",2017-01-08 18:50:16,4,2,818167957096398849
"Wind and rain storm knocking on our doorstep this weekend, are you ready for a power outage or flood? #cawx http://www.waterresources.saccounty.net/stormready/Pages/Sandbag-Information.aspx …",2017-01-06 21:23:56,1,1,817481852609064965
Saddened and disturbed by the shooting at Ft. Lauderdale Airport. My thoughts and prayers are with the victims and their families.,2017-01-06 20:22:20,5,3,817466350700478465
Unused or expired prescriptions? See where you can drop off yours in #CA07 to help prevent addiction:http://1.usa.gov/1J1XtyY ,2017-01-06 19:15:26,2,1,817449515657596929
Being a woman should not be a preexisting health condition. Proud to stand with @NARAL @PPact to #ProtectOurCarepic.twitter.com/51VTAZMuPo,2017-01-05 19:07:30,45,28,817085130925867012
Honored to read from the guiding document of our Republic on the House floor today #Constitution #Constitution115 http://houselive.gov/ ,2017-01-05 15:47:58,1,2,817034918349914112
Proud to be part of this historic moment for Indian Americans #115thcongresspic.twitter.com/z8abLqjRIe,2017-01-04 22:28:27,77,40,816773314853146624
Today I’m honored to be sworn in to the 115th Congress -- grateful to serve and ready for the work ahead.pic.twitter.com/mKcb5TsE4G,2017-01-03 20:34:45,74,18,816382312879296513
"Now that we’re in 2017, please take a moment to share your priorities with me in my survey: http://1.usa.gov/1ycFQ9P pic.twitter.com/UfvJm65epj",2017-01-02 18:50:16,4,2,815993629995048960
Happy New Year!pic.twitter.com/523vd5SeIP,2017-01-01 05:05:27,16,1,815423671258976256
Celebrating the 46th anniversary of the Clean Air Act–  crucial milestone in protecting the health of our families and our environment.pic.twitter.com/Tlsh9bJIc1,2016-12-31 20:10:15,19,2,815288983496327168
Joined my email updates yet? One of the best ways I have to stay in touch: http://www.bera.house.gov/signup pic.twitter.com/GiBvl7Cnxk,2016-12-30 20:05:20,1,2,814925358524985345
Are you or is someone you know a #CA07 veteran who needs help? Returned $1 million+ to local vets: http://www.bera.house.gov/helpforvets pic.twitter.com/dMHNnlUU19,2016-12-29 21:05:16,3,5,814578053452070913
Endangered Species Act became law 43 years ago today. Proud to support conservation to ensure bright future: http://bit.ly/2dzRNhV pic.twitter.com/vWXXSd5V0V,2016-12-28 21:49:58,12,6,814226912281239552
"If you haven’t already, please take my survey on President-elect Trump’s upcoming administration: http://bit.ly/2h39ESa pic.twitter.com/OSHX73KzbH",2016-12-27 21:25:22,1,1,813858334847672323
"As we celebrate holidays, we must always remember those who are in need. #CA07 Job Seeker Guide: http://1.usa.gov/1O2aI2L pic.twitter.com/l953M7QNYy",2016-12-26 20:12:28,4,1,813477602061000705
Wishing you and your family a Merry Christmas!pic.twitter.com/WdGMknnQSE,2016-12-25 18:05:11,17,4,813083181654114308
Wishing a Happy Hanukkah to all who will begin celebrating this evening!pic.twitter.com/gT5lDUXWnM,2016-12-24 21:04:50,6,5,812766005537583104
Good news – have now helped return more than $4 million to #CA07 taxpayers. Call (916) 635 0505 for help or visit http://www.bera.house.gov/gethelp .pic.twitter.com/eXYAWtpa7d,2016-12-23 17:15:14,1,1,812345836021682176
"6 yrs ago today, gay and lesbian service members finally able to serve the nation they love as they are. We are a better nation for it.pic.twitter.com/gbi2CALtYV",2016-12-22 21:25:14,35,13,812046361994657792
"#ICYMI: As the President-elect’s new Admin takes shape, I want to hear your thoughts. Survey: http://bit.ly/2h39ESa pic.twitter.com/AobFRYEm1a",2016-12-21 22:20:17,1,1,811697830075203585
"60 yrs ago today, Montgomery ended racially segregated busing after year+ boycott. May we never forget the heroes who made this possible.pic.twitter.com/81lM04d7M1",2016-12-21 02:08:01,61,32,811392750243475456
"With the new Administration taking shape, I want to hear from #CA07 residents. Share your thoughts in my survey: http://bit.ly/2h39ESa pic.twitter.com/v82vqBNzYn",2016-12-19 19:20:59,3,4,810927930868113408
Safe Drinking Water Act became law 42 yrs ago today. You can count on me to be strong advocate for health + enviro as we enter 2017.pic.twitter.com/Mwi7y4q6H8,2016-12-17 01:32:27,16,5,809934248731873280
Need health insurance? @CoveredCA deadline extended by 2 days for coverage that takes effect by New Year: http://www.coveredca.com ,2016-12-16 02:39:28,3,1,809588724849852416
"As a doctor, I was proud to support the 21st Century Cures Act, which President Obama signed into law this week: https://www.facebook.com/RepAmiBera/posts/1353570397989387 …",2016-12-15 22:16:40,11,2,809522591190941697
Forecasters are expecting a strong storm tomorrow – stay safe! Learn more about Sac County sand bags: http://www.waterresources.saccounty.net/stormready/Pages/Sandbag-Information.aspx …,2016-12-15 01:30:10,1,1,809208896753639425
D.C. office moved to 1431 Longworth House Office Building. Call us at (202) 225 5716 or see how to Connect w/ Me: http://bera.house.gov/contact pic.twitter.com/A1zGf4oFdj,2016-12-12 21:37:47,7,2,808425640194166785
"I join with all Americans in mourning the passing of John Glenn, a true American hero.http://www.nbcnews.com/news/us-news/last-true-national-hero-john-glenn-dead-95-n693391 …",2016-12-08 21:18:31,9,3,806971241299083264
"I join with all Americans in recognizing the 75th anniversary of the attack on Pearl Harbor. To all of our World War II veterans, thank you.pic.twitter.com/Dz8HtZMAIr",2016-12-07 23:02:11,8,3,806634944072208384
"Today, I join in recognizing a crucial historical milestone we must never forget: the abolition of slavery. More: http://www.loc.gov/rr/program/bib/ourdocs/13thamendment.html …",2016-12-06 23:09:14,9,2,806274326794305536
Staff at Elk Grove Library tomorrow from 10AM to noon to serve you: http://www.bera.house.gov/upcomingevents#december …pic.twitter.com/kjymgRWW50,2016-12-05 22:20:13,1,2,805899607020621824
I was proud to vote to ensure fairness and justice for members of California's National Guard today:http://www.sacbee.com/opinion/editorials/article118016068.html …,2016-12-02 22:29:26,1,1,804814762672586752
"A big THANK YOU to my Washington, D.C. interns for their great work in my office. See how to intern in my office: http://bit.ly/2acl8g8 pic.twitter.com/5xxC5GTxsp",2016-12-02 19:52:56,13,0,804775376073490432
"As a doctor, glad to vote for bipartisan 21st Century Cures Act to invest in med research + health care: https://www.facebook.com/RepAmiBera/photos/a.537648192914949.124183.528662157146886/1336207459725681/?type=3&permPage=1 …pic.twitter.com/HwWWyfmfKx",2016-12-01 22:55:59,5,0,804459055926362112
"Great news for our area – Siemens won a major new contract to build new street cars for Charlotte, North Carolina.http://www.sacbee.com/news/business/article117677843.html …",2016-11-30 21:56:14,7,0,804081630059044865
My email updates are one of the best ways I have to stay in touch with you. Join today if you haven’t already: http://www.bera.house.gov/signup pic.twitter.com/3G1o0ypjCh,2016-11-30 01:24:23,5,2,803771626252800000
Unused or expired meds in your medicine cabinet? See where to drop them off in #CA07: http://bera.house.gov/drugdropoff pic.twitter.com/aFXBFFdjYy,2016-11-29 02:02:14,9,4,803418762158505984
Remembering the tragic incident @ppfa clinic in CO 1 yr ago today. We must never accept violence to intimidate women + health providers.pic.twitter.com/j6765JVlmh,2016-11-27 18:30:34,13,5,802942708352425984
Today is Small Business Saturday - Please remember to support our local small businesses and #ShopSmall! #SmallBizSatpic.twitter.com/VtcST7sNh7,2016-11-26 17:20:19,15,5,802562641092812800
I join w/ women & families worldwide in recognizing this Intl Day for Elimination of Violence Against Women: http://bit.ly/2g44PFH pic.twitter.com/vZvPUQ9O9U,2016-11-25 18:10:26,7,1,802212865059016705
"From my family to yours, have a Happy Thanksgiving!pic.twitter.com/HVl203z9p3",2016-11-24 17:15:27,5,1,801836643305058305
"Like many of you, I can’t wait for Thanksgiving! But remember – many get foodborne illnesses each year. Stay safe: http://bit.ly/2fRERHZ pic.twitter.com/1B5xYz0ycr",2016-11-23 19:03:53,5,2,801501543941996548
"Glad to help serve those in need at Loaves and Fishes. As we prepare to celebrate Thanksgiving, let us all give thanks for what we have.pic.twitter.com/klvgp3xRPA",2016-11-23 00:23:19,14,5,801219542894702596
Local veteran who needs help with backlogged benefits or health care? Recovered $1.9 million for #CA07 vets: http://www.bera.house.gov/helpforvets pic.twitter.com/yZ73COONk2,2016-11-22 01:29:15,7,2,800873748501069825
"Happy Birthday, @VP Biden!pic.twitter.com/OhJbSJOB6X",2016-11-20 23:31:51,31,14,800481816557785088
"Did you know that we’re now in Medicare Open Enrollment? Find, review, and compare Medicare plans: http://bit.ly/2g4GAdr pic.twitter.com/TPfRj7xv6X",2016-11-18 22:06:59,0,2,799735682159644673
"#ICYMI: As our nation begins to heal, no place for hateful white nationalism. See letter on Bannon appt:http://bit.ly/2f99lnU ",2016-11-17 22:17:49,14,2,799376018150715392
"November is Military Families month. To all of Sacramento County’s military families, thank you!pic.twitter.com/3SQosMezGS",2016-11-17 01:13:28,11,3,799057837867597824
"Urging President-Elect to reconsider Bannon appt. As we work to heal, there is no place for the hateful views of white nationalism.pic.twitter.com/PD2ZDMoDBV",2016-11-15 22:26:23,53,15,798653401315717122
Staff will be at Orangevale library on Wed from 10AM to noon to help you: http://1.usa.gov/1xRGDKC pic.twitter.com/F1fNUXz8AU,2016-11-14 21:53:13,2,0,798282664033677318
"Yesterday, I had honor of presenting William Huseman, Folsom resident & WW2 vet, with service medals he had earned. http://www.bera.house.gov/helpforvets pic.twitter.com/nflB8pvDCM",2016-11-12 01:28:06,11,5,797249578387046400
"To all of Sacramento County’s veterans, thank you. #VeteransDaypic.twitter.com/9TIT6RpuAb",2016-11-11 21:13:21,8,3,797185469146689536
"Tomorrow, we honor our nation’s heroes for Veterans Day. My office is here to help #CA07 vets however we can: http://1.usa.gov/1tyi1qF pic.twitter.com/wPqZuV7L5s",2016-11-10 21:39:23,4,2,796829632247042048
"As a doctor who has cared for veterans, I’ve seen their sacrifices firsthand. They deserve our unwavering support: http://bit.ly/2elAfJP pic.twitter.com/E80PgE11rN",2016-11-08 03:35:29,15,9,795832083331555328
"As a doctor, I believe a woman’s health decisions are between her and her doctor→ http://1.usa.gov/1tvTZev  #StandwithPP #WomensHealthpic.twitter.com/uhx7B25NJr",2016-11-07 00:54:15,14,5,795429121228701696
No woman or family should ever have to live in the shadow of fear and abuse → http://1.usa.gov/1tvTZev pic.twitter.com/hGwdSndFMt,2016-11-06 00:25:09,5,3,795059411064680448
"At end of the day, making gov work is about making progress. See my new FB album on how I’m working for Sac County → https://www.facebook.com/RepAmiBera/posts/1309968325682928 …pic.twitter.com/ACaBz8mupT",2016-11-04 21:00:45,13,5,794645582992261120
My office has now helped #CA07 recover more than $1 million in Social Security + Medicare benefits: http://1.usa.gov/10Rxyp2 pic.twitter.com/xdA8RzL231,2016-11-04 03:15:07,3,4,794377408824623104
"As a doctor who’s cared for seniors, I’m committed to honoring promises we’ve made to our parents & grandparents: http://1.usa.gov/10Rxyp2 pic.twitter.com/1ZsYbbNCg1",2016-11-04 02:39:00,5,1,794368318501244928
Recently dropped off unused meds as part of drug #TakeBackDay. Have you dropped of yours? Find out where you can: http://1.usa.gov/1J1XtyY pic.twitter.com/wYRChhCla4,2016-11-04 00:39:37,5,3,794338273284026368
"Women face strong challenges in the workplace. But progress is possible if we focus on solutions, not politics → http://1.usa.gov/1tvTZev pic.twitter.com/jdKtjcORKx",2016-11-03 01:50:07,3,1,793993630860058624
"Instead of interfering in women’s health decisions, we should focus on ensuring healthy women & healthy families → http://1.usa.gov/1tvTZev pic.twitter.com/z14uJPIYhP",2016-11-03 00:10:08,7,1,793968467888246785
"Instead of blaming victims, we should stand with women & families who want to rebuild their lives.→ http://1.usa.gov/1tvTZev pic.twitter.com/fhndNlRmbY",2016-11-02 21:51:40,2,1,793933622961180672
We’re in Medicare Open Enrollment – learn more & see how to get help in my new email update: http://bit.ly/2elli9W pic.twitter.com/WckpuKo6cP,2016-11-02 02:13:25,5,0,793637102781161472
