Text,Date,Favorites,Retweets,Tweet ID
Grateful for the service of @CapitolPolice today & every day. Thank you.,2017-03-29 14:51:24,10,2,847098875450155008
Had a wonderful time at Congregation Beth Solomon's 31st Annual Gala with Rabbi Isaacson. http://fb.me/1XF8mEEzc ,2017-03-29 12:00:10,2,0,847055780197085184
"Real government reform starts with #TermLimits for members of Congress.

'Like' & 'Share' if you agree! http://fb.me/8cYJrmyHy ",2017-03-27 22:00:03,50,26,846481973019336711
Attended the Bucks County Community Foundation Service Award Dinner this weekend. Congrats to this years honorees... http://fb.me/4FMop9AWM ,2017-03-27 12:00:03,3,1,846330977953697792
Congratulations to Jake Alps on achieving the rank of Eagle Scout. We wish you the best of luck as you take your... http://fb.me/1jsVBQ5VF ,2017-03-26 16:06:24,9,2,846030583969058816
Met with Treasury Secretary Steven Mnuchin this week regarding my push for a Balanced Budget Amendment to the... http://fb.me/148eVdlc8 ,2017-03-25 21:00:03,7,3,845742095524642816
My statement --> http://bit.ly/2o01f3o pic.twitter.com/qMvP8mwocx,2017-03-24 20:14:01,38,9,845368121695318016
Congressman Brian Fitzpatrick (PA-08) released the following statement Friday after the American Health Care Act... http://fb.me/6kJAUIv67 ,2017-03-24 20:12:11,18,8,845367660623921152
"Whether it is state actors from North Korea to Russia, hacktivists or cyber-criminals targeting consumer and...http://fb.me/swsG6XQZ ",2017-03-23 12:00:11,6,2,844881456535126016
"""Freshman Congressman Brian Fitzpatrick, R-8, of Middletown, saw his first authored bill pass through the House...http://fb.me/6wseCRtiL ",2017-03-22 22:00:08,14,3,844670052431511552
Grateful for the opportunity to meet with Iraqi Prime Minister Haider al-Abadi Tuesday and discuss the fight... http://fb.me/8BfhKroG5 ,2017-03-22 12:00:03,3,0,844519037359022080
Excited to welcome Mae to Capitol Hill today as she continues her push to mark March 21 National Rosie the...http://fb.me/5djTzbVzu ,2017-03-21 13:06:42,29,7,844173423605616640
The U.S. House of Representatives overwhelming passed (409-0) my bill tonight to streamline the Department of... http://fb.me/1ZmtrMWn7 ,2017-03-20 23:36:59,20,3,843969651709218818
"""U.S. Rep. Brian Fitzpatrick (R-8th dist.) successfully passed his first bill through committee after the... http://fb.me/1gq5lSX8B ",2017-03-20 12:00:03,12,1,843794261317484545
Honored to present Kathy Haas with Firefighter of the Year at the Pleasantville Fire Banquet http://fb.me/5JWMF9Cga ,2017-03-19 21:00:03,10,1,843567768951754755
http://fb.me/1QwrPyvCp ,2017-03-19 02:07:18,0,0,843282702291931141
http://fb.me/8E98DN9Hd ,2017-03-19 02:06:40,1,0,843282542396628998
"FITZPATRICK: HEALTHCARE UPDATE

I wanted to provide you with an update on my current thinking regarding our... http://fb.me/6g2xjoO2S ",2017-03-19 01:20:04,116,26,843270817219796992
Great turnout this morning at the Doylestown Fire Company No. 1's Pancake Breakfast! http://fb.me/1do52CJr4 ,2017-03-18 17:30:04,9,1,843152537050120193
"I believe we should use American innovation to improve environmental policy and advance economically viable, and... http://fb.me/1cSgvi5eu ",2017-03-18 14:48:11,13,4,843111796026171393
I joined Congressman Brendan Boyle and Congressman Tim Murphy (PA-18) for a round-table with community leaders... http://fb.me/19SVZ4uzR ,2017-03-17 12:00:11,4,0,842707129941327872
Proud to wear my U.S./Israel Unity pin last night while presiding over the House of Representatives and stand in... http://fb.me/1sA7LxKTZ ,2017-03-16 22:04:40,4,0,842496867325923329
Great work by the Bucks County District Attorney's Office & law enforcement to  investigate & break up this drug...http://fb.me/MPW4ABL2 ,2017-03-16 12:06:55,10,0,842346436196995073
Climate change is real and that humans are a contributing factor. Leaders on both sides of the aisle must take...http://fb.me/1ea3ZZZi8 ,2017-03-15 22:00:41,74,18,842133475075448832
"Proud to join @RepStefanik & 15 other House Rs in introducing HRes focused on enviro. protection & climate change

https://medium.com/@RepBrianFitz/fitzpatrick-lead-resolution-focuses-house-republicans-on-environmental-protection-3a56a832c81c#.yz24uem3j …pic.twitter.com/RiXTnQjjap",2017-03-15 14:58:49,19,4,842027312203853825
"With today's snow, take a moment to read about what to do before, during, and after a snowstorm or extreme cold.... http://fb.me/5WLYKSIBt ",2017-03-14 12:00:05,2,2,841619942332076033
http://fb.me/SfhKzBxT ,2017-03-14 05:00:19,0,0,841514305019351041
Had a wonderful time supporting the Sellersville Volunteer Fire Department at their annual Ham Dinner with former... http://fb.me/7ia1o9QuJ ,2017-03-13 22:00:10,1,1,841408571917123585
ICYMI http://fb.me/1hp03N1Gi ,2017-03-12 14:02:32,2,1,840925981158301697
"The nuclear deal with Iran, the world’s largest state-sponsor of terror, was misguided from the start. But... http://fb.me/8AKsebuxj ",2017-03-11 17:00:28,4,2,840608373691301889
"Last week,I testified in front of the House Appropriations subcommittees on Labor, Health and Human Services,... http://fb.me/1IsVj4p4D ",2017-03-10 13:11:10,2,2,840188280956178434
"My constituents have a right to safe, clean drinking water. Unfortunately, those in the area surrounding the... http://fb.me/4v2Y5wuT7 ",2017-03-09 23:00:19,15,5,839974157504950272
"I told @HouseAppropsGOP why we need funding for #PFOS study & cleanup in #BucksCoPA #MontcoPA http://bit.ly/2m4PZR6 

RT if you're w/ me!",2017-03-09 21:44:48,7,4,839955153008623616
100% agreehttps://twitter.com/RepCurbelo/status/839916476761001987 …,2017-03-09 20:44:04,128,38,839939866200850433
Wearing my #MyKidneysMyLife  badge as part of World Kidney Daypic.twitter.com/ytXEUhZw4J,2017-03-09 15:58:29,2,1,839867999888748548
"Last week,I testified in front of the House Appropriations subcommittees on Labor, Health and Human Services,... http://fb.me/PWiv7IjT ",2017-03-09 13:00:29,1,1,839823202654294016
The Homeland Security Committee unanimously passed my first bill yesterday to streamline acquisition strategy at... http://fb.me/8s6pklvo6 ,2017-03-09 13:00:05,2,1,839823104620773377
I posted a new photo to Facebook http://fb.me/8f2COhzBo ,2017-03-08 22:19:03,1,0,839601383175245825
"#BREAKING Just passed my first bill out of @HouseHomeland to streamline @DHSgov acquisition & save taxpayer $

Read:http://bit.ly/2mFZZVo ",2017-03-08 16:28:46,10,4,839513233186832389
Had the opportunity to address hundreds of fire fighters and emergency services personnel from across the United... http://fb.me/UFTTqdfS ,2017-03-08 13:00:24,6,3,839460792466554880
I’m reading the entire text of the American Health Care Act that was unveiled last night. (You can read the full... http://fb.me/4okEx1vKT ,2017-03-07 22:33:28,10,2,839242622132760576
Braved the cold on Sunday and joined members of St. Matthew's Lutheran Church in Bedminster in breaking ground on... http://fb.me/U5UmqVOA ,2017-03-07 13:02:09,2,0,839098847628562432
"""Political differences will never disappear; Fitzpatrick knows that. But he also knows, as he puts it, that 'on... http://fb.me/1Iw46ui6w ",2017-03-06 23:00:03,1,1,838886925830352897
Great to have Brett Rubin and other constituents visit Capitol Hill as part of JDRF Government Day talking to... http://fb.me/5QcuC0f0q ,2017-03-06 13:02:30,1,1,838736547453288448
Thanks to the Pennsylvanians who traveled to Capitol Hill this week as part of the The Michael J. Fox Foundation... http://fb.me/1m7iZHWSQ ,2017-03-05 22:00:15,4,1,838509490408415232
Support hotline created in Bucks County for first respondershttp://fb.me/L0wu5gVS ,2017-03-05 15:30:24,8,1,838411379287683073
"STATE OF THE NATION: Congressman Brian Fitzpatrick addresses civility, opioid addiction and tax reform before... http://fb.me/8tvduFL0j ",2017-03-04 22:00:18,1,1,838147113708060672
Congratulations to Connor Boucher from Troop 29 of Newtown for your achievement of becoming an Eagle Scout. Thank... http://fb.me/1CikjGxpi ,2017-03-04 15:00:13,4,2,838041396531580930
Enjoyed meeting with PennEnvironment on how we can work together to protect the environment for future generations. http://fb.me/8zEijrzpQ ,2017-03-03 23:00:04,14,3,837799766184558592
"ICYMI: No Labels posted the entire video of yesterday's Problem Solvers Caucus panel. 

Like I said: If Congress... http://fb.me/19UXJLSz5 ",2017-03-03 13:01:36,3,2,837649158701993986
My statement regarding AG Session & Russian investigations: http://bit.ly/2mK924P pic.twitter.com/1PH5HAi0Iu,2017-03-02 16:38:10,17,8,837341270410477568
"“While investigating and prosecuting cases as an FBI agent, the focus was always on facts and evidence. I am a... http://fb.me/5QFLk6dkr ",2017-03-02 16:35:40,1,1,837340640291786752
Great Bipartisan Heroin Task Force hearing this week with 144aday,2017-03-02 13:00:10,2,1,837286407982960642
I had a blast joining fellow Problem Solver Caucus members today at the first-ever No Labels Problem Solver...http://fb.me/9mkRr9gyr ,2017-03-01 23:00:05,7,2,837074993427042304
Honored to host the Mongiello family last night at the president's first address to the joint session of Congress. http://fb.me/6nhJg6Z8C ,2017-03-01 18:00:45,1,1,836999663135952896
"While there will be competing reactions to the president's address from both sides, it’s imperative that this...http://fb.me/1cxaz1HDe ",2017-03-01 12:00:10,7,1,836908921562464256
"Last year, Harvard released a report that concluded: ‘The federal government has made no meaningful progress on...http://fb.me/12yO6qpx1 ",2017-02-28 22:30:09,11,4,836705073560444928
Thanks to representatives from the Housing Alliance of Pennsylvania who stopped by last week to talk about the... http://fb.me/8oImxOIe2 ,2017-02-28 13:00:06,0,1,836561615063560193
Fantastic job! #PennsburyProudhttps://twitter.com/CourierTimes/status/836282272819073025 …,2017-02-27 18:36:04,4,1,836283775638253575
Another disgusting act - this time in our own back yard. There is no place for this kind of hate in our nation.... http://fb.me/2SQtCPRXe ,2017-02-27 18:00:44,7,0,836274886494535681
"Learn more about the bill I introduced with Rep Josh Gottheimer, Congressman André Carson, Rep. Peter King and... http://fb.me/1eeMhxpSP ",2017-02-27 13:00:07,2,0,836199233850077184
"Congress must act, in partnership with local stakeholders, to address our community's opioid epidemic. Here's...http://fb.me/1fmSbcmcd ",2017-02-26 22:00:05,3,0,835972733011910656
Grateful for the opportunity to sit down with the folks at Children’s Hospital of Philadelphia's Bucks County... http://fb.me/5M2wFC9kU ,2017-02-26 15:00:05,2,0,835867036882464769
"Fitzpatrick Calls on Leadership to Prioritize Tax Reform, Spending Measureshttp://fb.me/1fEmjTQJX ",2017-02-25 22:00:06,2,0,835610345947418624
Great to learn more about the important work being done in our community by YWCA Bucks County http://fb.me/5w8kDsDpZ ,2017-02-25 15:00:06,0,0,835504652544270336
Grateful for the opportunity to speak with constituents at North Penn mosque in Montgomery Co. this afternoonpic.twitter.com/f9T9yAdZIh,2017-02-24 19:35:43,27,1,835211623660990469
Grateful for the opportunity to sit down w/ Reps O'Neill & Watson to discuss PFOA & PFOS water contamination in our communities #UnwellWaterpic.twitter.com/r1ja4a7sAx,2017-02-24 17:16:42,4,0,835176639147425793
Grateful for the opportunity to sit down with State Reps. Bernie O'Neill & Kathy Watson to discuss the issues... http://fb.me/7RUB2PuhV ,2017-02-24 13:00:04,3,0,835112057972404224
"As partisan battles rage in Washington at the onset of a new administration, a struggle in our own communities... http://fb.me/80Mi7njaC ",2017-02-23 23:00:08,6,1,834900680330596354
"ICYMI: On my website and in today's paper -

""As announced, I've spent this district work period meeting with...http://fb.me/4bRN2SP2i ",2017-02-23 19:00:44,2,1,834840432576253952
"Thanks to the elected officials, community leaders, law enforcement professionals & experts for joining my... http://fb.me/5TU1ghGe3 ",2017-02-23 13:00:13,1,0,834749706496507904
"This is absolutely fantastic news for Bristol Borough, Bucks County and our whole region. Congrats Bristol & many...http://fb.me/3dROvQZHP ",2017-02-22 19:10:49,16,5,834480583145304068
!!!!!!!!!!!https://twitter.com/CourierTimes/status/834479686847721472 …,2017-02-22 19:07:58,14,5,834479866049339393
"Great joining Cub Pack and Boy Scout Troop 132 in Bensalem for their Blue and Gold Banquet, celebrating Pack... http://fb.me/5vSNPP5i6 ",2017-02-22 13:33:04,2,1,834395584672980992
The epidemic of opioid addiction and abuse - and the strains it puts on our communities and families – is too... http://fb.me/28N6JnLzk ,2017-02-21 13:00:07,6,1,834024904647380993
Congratulations to Art Ball for 50 years of service to the community as a member of the Levittown Fire Company. http://fb.me/1T87IzNMl ,2017-02-20 23:00:04,5,4,833813499830816770
The release of this long-awaited report won't do anything to help women battling cancer who have had their lives...http://fb.me/57aDhPbig ,2017-02-20 13:00:13,2,1,833662540672532480
ICYMI: I joined fellow No Labels Problem Solvers in urging the White House to start moving on bipartisan tax...http://fb.me/4rkbT6yW5 ,2017-02-19 23:00:04,7,0,833451111587708929
"I am.

Earlier this month, I wrote to Director James Comey urging the FBI to fully investigate this string of...http://fb.me/1wEQXuwZG ",2017-02-19 15:00:12,24,5,833330350273200129
Grateful for the support of the Bucks County Courier Timeshttp://fb.me/1fF4lWjWT ,2017-02-18 22:00:04,6,4,833073626568069122
"Learn about the #bipartisan bill supported by:
 9/11 Commission Chair Tom Kean
 Former Sec. of Homeland...http://fb.me/6qAjCrsXX ",2017-02-18 15:00:08,3,2,832967945752043521
"""Freshman Congressman Brian Fitzpatrick, R-8, of Middletown, stated Friday he intends to introduce a bill to pay...http://fb.me/1K402Y9dU ",2017-02-17 23:00:04,8,3,832726337819340800
"MT @CourierTimes: @BrianFitzUSA wants DOD to fund a health study for residents affected by PFOA, PFOS #unwellwater http://bit.ly/2kS3G6m ",2017-02-17 22:00:59,2,2,832711468269309952
MT @CourierTimes ICYMI: @RepBrianFitz introduces aviation safety act in memory of 9/11 victim Victor Saracini:http://bit.ly/2kDVVzJ ,2017-02-17 14:39:00,5,0,832600237663514624
Did you see what the National Fraternal Order of Police had to say about the bill Congressman Brendan Boyle & I... http://fb.me/RStDWaAj ,2017-02-16 23:05:54,4,0,832365414885752832
"As our nation continues to combat the threat of terrorism it’s crucial that we not only prepare for the future,... http://fb.me/Z6YdTdbW ",2017-02-16 23:00:39,2,1,832364093407367169
There is more that unites us than divides us. http://bit.ly/2ljN2j7 https://www.youtube.com/watch?v=e_aP1zxc-Hc …,2017-02-16 16:12:01,25,6,832261257130565632
Very important question. Last week I urged @FBI Dir. Comey to investigate threats: https://medium.com/@RepBrianFitz/fitzpatrick-urges-fbi-investigation-into-threats-against-jewish-community-centers-nationwide-5d379800327b#.agxlmn827 …https://twitter.com/BurkeCNN/status/832207716676300801 …,2017-02-16 14:48:47,18,7,832240310751223809
"Joined Ukrainian Minister of Foreign Affairs, Pavlo Klimkin and Ukrainian Ambassador Valeriy Chaly yesterday... http://fb.me/18bbecNVI ",2017-02-16 13:00:10,4,1,832212977755500546
"If we’re willing to end friendships or block our family members because of Facebook posts, we’re not headed in... http://fb.me/1HRhCYZbr ",2017-02-15 23:00:04,0,0,832001561274490880
"‘Love thy neighbor’ – no exceptions.

Learn more about the 'Commitment to Civility' pledge: http://bit.ly/2ljN2j7 https://www.youtube.com/watch?v=e_aP1zxc-Hc …",2017-02-15 18:31:01,4,1,831933850485874688
Like I said at an ADL - Anti-Defamation League forum at Congregation Beth El of Bucks County last month: there is...http://fb.me/5HdlQRCMv ,2017-02-15 18:00:19,2,2,831926124217323528
#RightToTryhttps://twitter.com/RepAndyBiggsAZ/status/831902556393717761 …,2017-02-15 16:28:02,4,1,831902899932372992
It's always a good day to brag about Bucks County & beautiful Bristol Borough! http://fb.me/8yLhbvsVM ,2017-02-15 12:00:06,3,1,831835473270153217
I support the House Intelligence Committee’s investigation into Russia's attempt to influence the presidential... http://fb.me/2DkRSvzlX ,2017-02-14 19:45:35,46,8,831590229572206596
My statement on Gen. Flynn's resignation: http://bit.ly/2ldQs7n pic.twitter.com/gyka2vO0u1,2017-02-14 19:45:14,32,7,831590140384526337
Learn more about Right to Try and the people behind it http://fb.me/1xHv2p2Cw ,2017-02-14 18:00:08,2,0,831563692756049926
Did you see my piece in The Hill about the importance of the U.S.-Ukrainian relationship? Check it out and learn...http://fb.me/56EsiQSpr ,2017-02-13 23:00:15,7,2,831276830397181957
Congratulations to Tom Cawley of #Holland on earning the rank of Eagle Scout this weekend. Glad I could be part of the #ESCOH @boyscoutspic.twitter.com/OwSFhBN2rg,2017-02-13 18:17:29,4,1,831205670120730624
#RightToTryhttps://twitter.com/RepAndyBiggsAZ/status/831167551937847298 …,2017-02-13 17:39:23,5,0,831196081472077826
"""[Brian Fitzpatrick] from Pennsylvania showed up in Washington this year and wasn't happy with the ""members only""...http://fb.me/2QxYG46ph ",2017-02-12 22:00:09,13,3,830899319406546944
"As a member of House Small Business Committee, I’m committed to visiting 100 businesses across Bucks & Montgomery... http://fb.me/17QMqu5BZ ",2017-02-10 23:13:10,10,2,830192917637656576
Amazing. http://fb.me/8Ect0NIWv ,2017-02-10 13:02:17,5,0,830039186061291521
"As a member of the law enforcement community for nearly a decade and a half, I know firsthand the service and...http://fb.me/MiTy7qV0 ",2017-02-09 23:00:15,4,1,829827278439845893
"#TBT to my first speech to the House of Representatives - urging for real government reform measures like:
 Term... http://fb.me/1MDdsOH6O ",2017-02-09 13:00:47,3,2,829676420624433153
"Thanks to COO Doug Hock & the folks from @ChildrensPhila for stopping by and talking healthcare reform, Medicaid, and NIH funding.pic.twitter.com/33pRGfiCM1",2017-02-08 16:18:12,4,2,829363712481951745
"Since 2015, the U.S. Government Accountability Office (GAO) has been investigating the Food & Drug... http://fb.me/64YfxMCgu ",2017-02-08 14:09:54,1,0,829331425023377408
"Today, I had the opportunity to question the United States Secretary of Homeland Security, Gen. John Kelly...http://fb.me/17M5Vg5af ",2017-02-07 23:00:05,4,1,829102463382863872
"When we talk about Right to Try, we're taking about giving kids like Jordan a chance.

Learn more: https://medium.com/@RepBrianFitz/fighting-for-a-right-to-try-358dedf87504#.zgfkpayti …pic.twitter.com/bWthA9Zquu",2017-02-07 16:15:00,6,4,829000520752787458
"Congressman Brian Fitzpatrick, Arizona lawmaker introduce Right to Try legislationhttp://fb.me/1IXEZ2gLg ",2017-02-07 13:41:27,4,2,828961878202269697
Learn more about the 'Right to Try Act of 2017' & my work to increase access to care for those facing a terminal...http://fb.me/86wV6m5sm ,2017-02-06 23:00:04,1,2,828740068726673410
Attention #PA08 students: Our office is looking for interns THIS SEMESTER! Learn more --> https://brianfitzpatrick.house.gov/media/press-releases/rep-brian-fitzpatrick-announces-internship-opportunities …,2017-02-06 16:01:22,1,2,828634701845917698
Fix. Not Fight.http://fb.me/1phRWDUqE ,2017-02-06 13:00:21,8,3,828589145748566016
Enjoyed meeting with the Moms Clean Air Force yesterday to speak about ways to reduce air pollution in #BucksCo http://fb.me/LpVhWEWK ,2017-02-05 14:53:07,15,1,828255135230992388
Happy I could help recognize Mr. Hufford for his service to our country http://fb.me/7zG8LwLVh ,2017-02-04 22:00:12,3,1,828000229618233345
"Yesterday, I joined the House Foreign Affairs Committee's Subcommittee on the Middle East and North Africa for a...http://fb.me/4C4lVFXrj ",2017-02-03 23:00:06,9,1,827652912906174464
I agree with Chairman Ed Royce - The U.S. needs to be fully committed to holding Iran accountable for its actions... http://fb.me/1IZ6NaM74 ,2017-02-03 18:00:15,4,1,827577453270929408
#Bipartisan Congressional Ukraine Caucus letter to @POTUS --> http://bit.ly/2jGpVj7 pic.twitter.com/ukdUiZLZkx,2017-02-03 16:57:27,24,13,827561651272634368
"""The United States must act strongly to prevent the overturning of a post-Cold War security order in Eurasia that...http://fb.me/3oOISQ0UF ",2017-02-02 22:35:04,42,16,827284226777108486
"In Washington, I serve as an independent voice for this community, and being that voice starts with taking the... http://fb.me/5BmRGNXKy ",2017-02-02 13:01:30,15,4,827139882933972992
Fitzpatrick Urges Action By Trump on Government Reform Package http://fb.me/61OgBVhFl ,2017-02-01 13:00:13,8,3,826777173331759106
Come join the team! http://fb.me/3kQjpV6wt ,2017-01-31 23:00:19,0,1,826565807031386113
"Pleased @POTUS agrees there is no room for #LGBT discrimination in the workplace. Hire the best, keep the best – regardless of orientationhttps://twitter.com/RosLehtinen/status/826451015218188289 …",2017-01-31 17:50:12,47,20,826487760794087426
Sending my condolences to both the Bensalem Police and Quakertown Borough Police Department who lost K9 officers... http://fb.me/1IkwM4FT5 ,2017-01-30 23:00:05,8,3,826203360571318272
"It's true!

Check out The Morning Call's write-up on my new bill to remind lawmakers who we work for --> http://fb.me/18Mu7wbfy ",2017-01-30 13:00:16,12,6,826052407918469120
ICYMI: http://fb.me/4EmA0RgRX ,2017-01-29 18:05:03,5,0,825766725388005376
Interested in visiting that @uscapitol? @librarycongress? @WhiteHouse? We can help --> http://bit.ly/2jjtMxv ,2017-01-29 18:00:03,2,1,825765463091187712
My statement --> http://bit.ly/2kfgypG pic.twitter.com/RIq1uaNDz0,2017-01-29 04:56:59,148,63,825568397840805889
"""For a decade and a half, I served this country as an FBI Supervisory Special Agent supporting global... http://fb.me/7WUPKZM24 ",2017-01-29 04:49:37,61,35,825566547112501248
RT @dcexaminer GOP freshman: No more safe spaces for lawmakershttp://washex.am/2jrDxgh ,2017-01-28 23:46:01,6,2,825490142714540033
"“I am honored to welcome Congressman Brian Fitzpatrick, a former FBI agent, to the Committee for the 115th... http://fb.me/1HrwiiaWW ",2017-01-27 23:00:18,8,4,825116250485432323
Had a blast welcoming students from #ConwellEgan to Capitol Hill today! #ProudAlum #ClassOf92 #FeelingOld @CEC_Alumnipic.twitter.com/9B38uCo0XW,2017-01-27 19:44:46,2,1,825067043745624065
Know any college or graduate students interested in a Congressional internship? Learn more: http://fb.me/8qfTN1xhM ,2017-01-27 13:01:26,2,7,824965540997365760
"'No more safe spaces for lawmakers' 

Check out the @dcexaminer story on my HRes to remove 'Members Only' signshttp://www.washingtonexaminer.com/gop-freshman-no-more-safe-spaces-for-lawmakers/article/2613005 …",2017-01-26 16:04:01,12,6,824649100545052672
"After being elected to Congress to serve as the independent voice of the people of Bucks and Montgomery counties,...http://fb.me/8eignaL6F ",2017-01-26 13:00:55,14,3,824603023792099328
"I'm standing with @NJASAP & @swapapilots #DenyNAI 

Read -->http://washex.am/2jptl8b ",2017-01-25 18:45:01,1,5,824327229895081984
Grateful for the opportunity to participate in Sunday's event with the ADL - Anti-Defamation League at... http://fb.me/ZNs3Gx44 ,2017-01-24 23:00:10,6,0,824029051358707712
"Today, I called on the White House to act embrace the government reform and anti-corruption measures I introduced... http://fb.me/5sA7Ullz1 ",2017-01-23 23:00:03,7,1,823666636041449472
"'Problem Solver Caucus': 3 Pa. GOP reps sign bipartisan appeal to press Trump on roads, tax reformhttp://fb.me/7Z6uhb3K6 ",2017-01-22 23:20:03,7,2,823309281365737472
"Stay up to date on my work in Congress, sign up for my weekly eNewsletter and receive a recap of the week... http://fb.me/3mL0OAkJa ",2017-01-22 15:32:23,3,0,823191587001892866
My Statement on the #Inauguration of President Trump --> http://bit.ly/2jgrAaS pic.twitter.com/W27T3Dh0rR,2017-01-20 18:07:48,3,1,822505924954824704
"""Today, I join with millions of Americans – regardless of party affiliation - in celebrating the peaceful... http://fb.me/1fELqdrZb ",2017-01-20 17:29:53,0,0,822496380673466370
ICYMI -->http://fb.me/1EUpr91Qt ,2017-01-20 13:00:13,0,1,822428520156721153
Investment in energy innovation is critical to powering our country and reducing our reliance on fuels of the...http://fb.me/5jlUPU7M5 ,2017-01-19 22:30:05,5,1,822209541349736449
Are you following me on Instagram? @RepBrianFitz http://fb.me/YhjSKeQO ,2017-01-19 13:00:04,0,0,822066092420059137
Did you read my letter to President-Elect Trump? Learn more --> http://bit.ly/2iQn5Dr ,2017-01-18 13:00:07,2,2,821703716260679681
Had a great time with Habitat for Humanity of Bucks County in #Morrisville! http://fb.me/DnXPRJSK ,2017-01-17 23:00:03,1,0,821492308491337728
Thanks to Federal Law Enforcement Officers Association (FLEOA) Foundation President Jon Adler & Executive Vice... http://fb.me/wIioq16h ,2017-01-17 13:00:03,1,0,821341315057205249
Bucks and Montgomery counties small businesses are the backbone of our local economy – from the family farm to a... http://fb.me/S1LuJV5N ,2017-01-16 23:20:04,4,2,821134957540151297
http://fb.me/7paO4qf0e ,2017-01-16 15:36:01,0,0,821018176276365312
"""The time is always right to do what is right."" http://fb.me/7sjNJCFJO ",2017-01-16 13:40:06,1,0,820989002350284801
ICYMI: Find out how you can help #BristolBorough http://fb.me/12yatzhN8 ,2017-01-15 22:00:03,1,1,820752432347152385
ICYMI: Check out my inaugural floor speech from this weekhttp://fb.me/1PPtbgOEA ,2017-01-15 15:00:11,2,0,820646767934967809
