Text,Date,Favorites,Retweets,Tweet ID
"75 years ago, #EO9066 authorized Japanese internment. Fear and unchallenged prejudice can have dire consequences.pic.twitter.com/n0w1U0NwwL",2017-02-19 14:21:44,56,58,833320670478082048
"The only thing made clear in @HouseGOP's ""plan"" for #ACA is that they don't have one. Repeal and replace with what? http://nyti.ms/2kH9Q8o pic.twitter.com/mkX19jPU1J",2017-02-18 13:51:29,134,77,832950669137047552
"Climate change skeptic and friend to big oil #ScottPruitt has been confirmed as @EPA secretary, marking a scary day for our environment.",2017-02-17 18:59:07,71,22,832665698920919041
"If this is true, @POTUS is acting out his most despotic inclinations. CO. will stand firm against any such action:http://apne.ws/2leoMg7 ",2017-02-17 18:46:30,64,26,832662522029174785
"A tip for @Potus and @HouseGOP: When you're trying to prove that your party respects women, it helps to have more than one in your meetings.pic.twitter.com/Q4B2wbvd2s",2017-02-17 15:02:12,143,46,832606078382784513
"Really, @SpeakerRyan? So why is @HouseGOP so eager to attack women’s health and ditch #TitleX funds? Can you explain? We’ll wait.pic.twitter.com/dfymBPyk9k",2017-02-16 20:48:04,97,40,832330728679546880
#JeanetteBelongsHere. We stand in solidarity with all those like her who risk deportation but deserve a chance to stay in this country.pic.twitter.com/lAt0pAmeQu,2017-02-15 22:52:52,97,43,831999749561659392
"Congrats to Amanda Mathias, a smart young leader named @MHYC's Corpsmember of the year thanks to her amazing work in our community.pic.twitter.com/u3vkkBpqIB",2017-02-15 22:42:00,18,4,831997012149207040
".@POTUS promised affordable care, yet his #ACA rule lets insurers charge higher deductibles & costs #ProtectOurCare:http://bit.ly/2kKzMAN ",2017-02-15 20:28:26,20,10,831963400280403968
What a happy #galentinesday! Last night I hosted a few fellow @HouseDemocrats for a light-hearted dinner that was full of .pic.twitter.com/dBranqrN5J,2017-02-15 14:27:42,36,4,831872617661526024
"#ToImmigrantsWithLove: We are with you. Never let intolerance and xenophobia keep you from standing tall, because you're in good company.pic.twitter.com/tkaFwQbgmU",2017-02-14 19:46:46,52,21,831590526210162689
"We're urging GOP not to undermine #TitleX, which helps millions access high-quality health care. #ProtectOurCare: http://bit.ly/2kH0kCT ",2017-02-14 18:11:28,40,15,831566543142137856
#MichaelFlynn's resignation underscores need for a bipartisan inquiry into Russian influence on the 2016 election:http://bit.ly/2l48JRQ ,2017-02-14 15:07:24,138,60,831520223354318848
".@POTUS , there is no honor in proudly proclaiming you are tearing apart families.https://goo.gl/JVQ2Qd ",2017-02-13 17:18:43,66,30,831190879666831362
Thanks .@DenverGreenScho for inviting my staff to a climate change summit led by kids with a passion for the planet.pic.twitter.com/AXg0gChh7p,2017-02-10 23:20:12,36,5,830194687646564353
"#FF my friend and mentor @JohnDingell, an American icon and seasoned tweeter. Watch out @POTUS!http://usat.ly/2kWB6nC ",2017-02-10 20:55:30,22,5,830158274402123776
.@SenateGOP confirmed #TomPrice for @HHSGov in the dead of night. But millions covered by #ACA are woke and will continue to #DefendOurCare.,2017-02-10 15:50:15,64,17,830081452721184769
9th Circuit unanimous ruling maintaining freeze of @POTUS' #MuslimBan underscores how unjust & just plan wrong it ishttp://wapo.st/2kZ1vR ,2017-02-09 23:43:12,81,18,829838088994160642
"I'm a #productofpublicschools & proud alumna of @denversouthhigh. @BetsyDeVos says she knows what's best for our kids, but we know better.",2017-02-09 16:48:41,84,24,829733769502396418
"Justice #Sotomayor #persisted, despite a disadvantaged background & challenges along the way, to become the 1st Latina on the Supreme Court.pic.twitter.com/J0eQe1VQg5",2017-02-08 23:21:16,90,16,829470178828230656
"Born a slave and later escaping to freedom, #SojournerTruth #persisted, speaking out to unify the causes of abolitionism and women's rights.pic.twitter.com/idinhdRbte",2017-02-08 23:01:24,74,23,829465180744478724
"Despite sexist opposition, Rep. #PatSchroeder #persisted, giving a voice to women and to our community in the House of Representatives.pic.twitter.com/kyDFOEsajN",2017-02-08 22:28:55,105,25,829457005836324864
"Thank you, @SenateMajLdr, for perfectly encapsulating the power of women in three words. #NeverthelessShePersistedpic.twitter.com/TYqMRhzOh8",2017-02-08 17:34:50,486,227,829382998088892416
"I’m looking out for fed. employees, under siege through @POTUS' ill-considered hiring freeze. CO. @AFGENational members, welcome to DC!pic.twitter.com/0wGL2Uaju7",2017-02-08 16:07:27,47,8,829361006006648836
"Hey .@dnvrite, I know that shape!https://twitter.com/dnvrite/status/829336451758256129 …",2017-02-08 15:22:57,32,4,829349809756717056
#BetsyDeVos' confirmation sends a dangerous message that money and partisanship can #trump qualifications in this new administration.,2017-02-07 20:21:29,182,78,829062547387056128
Kids in Colorado & across America stand to suffer if Republicans succeed in repealing the #ACA and gutting other crucial programs.pic.twitter.com/jw99afRemW,2017-02-07 19:33:43,32,21,829050527786860544
"Our world is safer and our kids healthier thanks to the EPA, defending the environment for 47 years. Now’s the time to #DefendEPA.pic.twitter.com/95xdsrIKMH",2017-02-07 16:02:33,178,113,828997386739601408
"As a founding member of the @LGBTEqCaucus, I've been heartened to witness its growth & am honored to join once more for the 115th Congress.pic.twitter.com/PzbBI5GGxx",2017-02-07 14:28:26,84,15,828973702503157760
"I really enjoyed the discussion with constituents at today's community forum. Nearly 1,000 attended -- folks are really fired up!pic.twitter.com/WVy945Agpq",2017-02-04 19:39:55,110,26,827964924924219393
"Standing room only with nearly 1,000 people at our community forum for a wide-ranging dialogue. Thanks for taking part!  #saturdaymorningpic.twitter.com/YQfwwhCvei",2017-02-04 19:18:10,65,16,827959452263444481
Breaking: Court halts portions of @POTUS' #MuslimBan. @DHSgov suspends implementation of executive order:http://nyti.ms/2l8nOBD ,2017-02-04 16:37:31,31,13,827919021035106304
Exec. Orders on investment regs. & reviewing Dodd-Frank don’t bode well for U.S. consumers. Is @POTUS really draining the swamp?,2017-02-03 18:32:52,67,33,827585664719925253
I voted against the #GOP's resolution repealing the @BLMNational's methane waste rule. That rule keeps public lands clean and saves millions,2017-02-03 17:27:04,135,29,827569104282320901
Congressional Republicans had 7 years to come up with a plan and all they have to show is a half-finished bill. #AmateurHourpic.twitter.com/z5D4SPlUh1,2017-02-02 16:38:49,71,46,827194572140904449
The only “plan” Republicans have is to sabotage the #ACA and hope they don't get blamed for it #RepealAndRun #ProtectOurCarepic.twitter.com/XU6JaDDiB4,2017-02-02 16:08:01,36,29,827186822157578240
Do you have one of the following pre-existing conditions? Republicans want to let insurers charge you more for healthcare #ProtectOurCarepic.twitter.com/YHJtkthU99,2017-02-02 15:30:28,21,28,827177371786579971
"This #BHM, we honor the past achievements of Black Americans while noting that the fight for equality hasn't ended. The march continues.",2017-02-01 22:36:05,56,9,826922095791710209
#Gorsuch for #SCOTUS? His work on the #HobbyLobby case cost women birth control coverage.  #NotMyBossesBusinesspic.twitter.com/XQANKP8mUw,2017-02-01 02:13:23,90,43,826614391927873537
7 in 10 Americans don't support @POTUS relentless quest to strike down #RoeVWade. Where does #Gorsuch stand? #SCOTUSpic.twitter.com/QQ9OqeIfY7,2017-02-01 01:19:27,69,39,826600819726417920
"We can't let the #HydeAmendment become permanent law. I'm an original co-sponsor of the #EACHWomanAct, re-introduced today. #BeBoldEndHyde",2017-01-31 21:09:36,117,56,826537944068550661
.@POLITICOPulse highlights the concerns my E&C colleagues and I have about the hiring freeze on @US_FDA :http://politi.co/2jyUnGS ,2017-01-31 16:04:37,15,10,826461189370679297
"Thank you, #SallyYates, for speaking truth to power and opposing a dangerous, discriminatory and unconstitutional directive. #NoBanNoWall",2017-01-31 15:08:12,215,48,826446991563620352
I joined my Democratic colleagues on the steps of the U.S. Supreme Court to demand @POTUS end his unconstitutional and dangerous #MuslimBan.pic.twitter.com/WIR7pMwqqR,2017-01-31 00:51:02,2147,522,826231278559174657
Breaking: Acting AG Sally Yates' instructions to DOJ staff not to defend @POTUS #MuslimBan underscore how unlawful & just plain wrong it is.,2017-01-30 23:55:35,108,35,826217324319485952
Democrats are coming together in front of the Supreme Court to fight for what’s right. #NoBan WATCH LIVE →http://bit.ly/2jK5AHL ,2017-01-30 22:17:34,54,19,826192658703974402
"We must protect our nation's principles, which is why I'm co-sponsoring the #SOLVeAct to deny federal funding for @POTUS’ #MuslimBan.",2017-01-30 21:01:18,160,49,826173466286055424
"In today's @denverpost, I'm tackling #alternativefacts and outlining exactly why #ACA repeal would spell disaster.http://dpo.st/2kCcEnt ",2017-01-28 15:36:27,138,71,825366938398384128
".@POTUS’ refugee ban is discriminatory, hurts asylum seekers worldwide & thwarts our progress countering violent extremism. It's just wrong.pic.twitter.com/ntT8TQEEAz",2017-01-27 22:53:39,199,97,825114577310457859
"No matter what you've heard, it's NOT too late to #getcovered. Sign up by Jan. 31st for coverage starting March 1st. https://twitter.com/GetCoveredUS/status/824750237495463937 …",2017-01-27 15:33:20,35,38,825003766839595010
"Under the plan announced today, every American will be paying for @POTUS' wall whether we like it or not. #Trumponomicspic.twitter.com/P2H0dqw9kM",2017-01-26 22:59:39,87,68,824753697230114817
We must #DefendScience because denying #climatechange could destroy much of the Colorado wilderness we love- and that's no #alternativefact.pic.twitter.com/FHFxOXLW9y,2017-01-26 16:00:39,228,151,824648254222696448
President Trump's executive orders today don't reflect long-held American or Coloradan values. We must hold fast to them.,2017-01-26 02:26:20,215,74,824443322991316994
"Comprehensive immigration reform will make America great again, not extreme exec. orders from @POTUS on immigration and a wall.pic.twitter.com/MCXan99Bbu",2017-01-25 20:04:58,53,33,824347351632515072
"With such widespread support for  #TitleX, @POTUS would be wise to avoid dismantling the crucial services it provides. #WomenAreWatchinghttps://twitter.com/TheNC/status/824307260218339328 …",2017-01-25 19:27:16,33,21,824337863919751171
.@POTUS proposed investigation into alleged voter fraud is just another #alternativefact that seeks to disenfranchise millions of Americans.,2017-01-25 17:12:14,83,28,824303878707544065
"Proud to see the ingenuity of Colorado researchers and engineers at work, further proving that our state is truly out of this world.https://twitter.com/NASA/status/823681116100034560 …",2017-01-24 22:37:15,27,8,824023286929559552
"Today I led @HouseDemocrats in condemning #HR7, part of the anti-choice agenda of @HouseGOP & @POTUS in his very first days on the job.pic.twitter.com/jh9GMD4Z2x",2017-01-24 21:55:46,170,55,824012847608905729
#TrumpGlobalGag signing today proves yet again how long the road ahead will be to reach gender equality. #WomenAreWatchingpic.twitter.com/CBZhRgkeKo,2017-01-23 20:57:19,321,244,823635749820108800
"#TrumpGlobalGag will shut down health clinics around the world, risking lives and  limiting access to care and truthful medical info.pic.twitter.com/nmelIgRwQ3",2017-01-23 16:57:33,91,123,823575410701111296
I’m one of the #7in10forRoe because women deserve full gender equality - and you can’t have that without #reprorights. #Roe44,2017-01-22 22:20:02,160,50,823294177463173122
I’m proud to be one of the #7in10forRoe. #ReproRights are human rights.http://nar.al/5rd ,2017-01-22 19:44:19,69,20,823254990693208064
"What a day! Tremendous demonstrations of resolve in Denver, DC and around the globe. #WomenAreWatchingpic.twitter.com/bJIahju3aN",2017-01-22 01:57:31,139,21,822986519719899136
Amazing turnout for this energizing #WomensMarch!pic.twitter.com/IW4N0wtRQy,2017-01-22 01:54:48,112,18,822985838158086144
So excited to be leading a large group of Coloradans for the #WomensMarch as it gets under way.pic.twitter.com/1cFegukmAB,2017-01-21 14:36:19,163,30,822815091766820865
"Ominous start for @POTUS: rushing out a potentially disruptive exec. order on health care, stoking anxiety among the many who count on #ACA.",2017-01-21 03:14:03,71,39,822643393599832064
.@realDonaldTrump said he had “the most respect” for women. Now he must walk the walk and #ProtectOurCare. #WomenAreWatchingpic.twitter.com/JFmqUgrX8z,2017-01-19 16:55:12,29,16,822125267577688064
Can we trust #RickPerry to oppose a far-right agenda that would put important @ENERGY programs on the chopping block? His record says no.,2017-01-19 16:42:54,27,14,822122168909697025
More than 170 @HouseDemocrats joined @louiseslaughter and me in urging @realDonaldTrump to protect women. Read more:http://wapo.st/2iFgIa0 ,2017-01-19 14:54:01,142,54,822094769769906176
"At @StJoesDenver, good discussion today w/ @COHospitalAssn about the many ways #ACA repeal will devastate hospitals across CO. and the U.S.pic.twitter.com/nASSc4Pgpn",2017-01-18 21:53:38,27,17,821837982445477894
"Tom Price has led the charge in repealing the ACA, specifically advocating to roll back women's health protections. #ThePriceIsNotRight",2017-01-18 18:35:27,32,27,821788106483499019
Tom Price would be a Secretary AGAINST Health and Human Services. He is too extreme to be confirmed. #ThePriceIsNotRightpic.twitter.com/6MiAh3sT6E,2017-01-18 15:01:36,67,39,821734291700846592
Devastating news: @USCBO estimates #ACA repeal would increase uninsured by 32 million. This is why we must all fight to #ProtectOurCare.https://twitter.com/USCBO/status/821372519152320512 …,2017-01-17 21:49:48,58,26,821474628015161344
"Wonderful to speak with the diverse students of @denversouthhigh about their concerns regarding racism, hate speech and how we can end both.pic.twitter.com/LQ1SY70kV1",2017-01-17 19:33:46,34,7,821440394990878720
Join me TODAY at 4 p.m. MT for another #FacebookLive Q&A. Submit questions on FB or chime in during the chat: http://bit.ly/2jGupm7 ,2017-01-17 17:54:25,8,2,821415391394140164
Our community comes together at the annual #marade to honor a man who defined bravery and principle for all. #MLKDAYpic.twitter.com/eL6kY3Eze8,2017-01-16 22:10:47,58,12,821117522795724802
"Let this #MLKDay remind us all that, despite our current struggles, love and light can prevail.pic.twitter.com/oEt4Hf2KcN",2017-01-16 13:51:00,38,15,820991747912306688
Join us today in Denver at 1 p.m. for a rally to halt the heedless rush to repeal the #ACA. #ProtectOurCarehttps://twitter.com/repdianadegette/status/820005086558613504 …,2017-01-15 17:24:18,40,23,820683037516197888
ICYMI - I sat down with @cspanwj to discuss the devastating costs of #ACA repeal and how to fight it. Watch here: http://cs.pn/2j7Ns9a ,2017-01-13 22:10:47,24,16,820030358058110976
Good news: @RepPerlmutter is joining our rally to stop #ACA repeal. The stakes are too high; come raise your voices. http://bit.ly/2ic1i8f pic.twitter.com/LAg21ShwZl,2017-01-13 20:30:22,76,40,820005086558613504
"Tune in to @cspan from 8:30 to to 9 ET, 6:30 to 7 MT, when I'll discuss the dramatic costs of #ACA repeal, and what we're doing to fight it.",2017-01-13 13:20:41,34,15,819896952917790720
"This honor is well-deserved, @VP. Thank you in particular for your strong support of #21stCenturyCures, which will fund the #CancerMoonshot.https://twitter.com/WhiteHouse/status/819658395401777152 …",2017-01-12 23:19:29,35,7,819685259407163393
"Pleased to announce I’m now on three vital subcommittees on @HouseCommerce, which will amplify CO's voice in DC: http://bit.ly/2jJFFS7 pic.twitter.com/H7vvXrcQSH",2017-01-12 22:43:56,45,5,819676314974228481
".@CancerSupportCm members honored @RepFredUpton and me today. Now that it’s law, our #21stcenturycures is helping fight cancer.pic.twitter.com/UNXfLwJIKZ",2017-01-11 23:13:50,13,4,819321449559293952
"@CancerSupportCm members honored @RepFredUpton and me today. Now that it’s law, our #21stcenturycures is helping fight cancer.pic.twitter.com/ewZfD0kn5H",2017-01-11 22:04:17,3,1,819303945873068032
"We need a plan to FIX the #ACA, not empty promises of repeal and replacement. America deserves better. #TrumpPressConference",2017-01-11 18:30:19,67,21,819250101797486593
#JeffSessions' consistently terrible record on #LGBTQ rights proves he will not protect all Americans as Attorney General. #StopSessionspic.twitter.com/MtY5Y1bRvt,2017-01-11 15:01:35,34,23,819197571549761536
#ThanksObama for helping double the production of renewable energy in America so that our kids have clean air and clean water.,2017-01-11 01:44:17,69,12,818996922438524929
#ThanksObama for helping give health coverage to 20 million Americans who didn’t have it before.,2017-01-11 00:54:31,45,10,818984401216438273
Want to put kids at risk for preventable illnesses? Pick #antivax Robert Kennedy Jr. to head this commission:http://wapo.st/2ifUAkW ,2017-01-10 22:25:28,12,7,818946889102069760
The most extreme voices against #reproductiverights would have an eager ally in #JeffSessions if he’s confirmed as #AttorneyGeneral.,2017-01-10 21:57:43,16,5,818939907532062720
My pleasure!https://twitter.com/NYUWashingtonDC/status/818853925910679552 …,2017-01-10 16:45:21,4,0,818861295835418626
"Sessions is dangerously unqualified to be AG, threatening rights & protections for women & minorities. #StopSessionshttp://bit.ly/2jbdszY ",2017-01-10 15:10:28,55,44,818837419432607745
Join me this Sunday at a rally to save the #ACA from repeal. Our voices are stronger when they're united. RSVP here: http://bit.ly/2ic1i8f pic.twitter.com/Ujd0qdRMfO,2017-01-10 14:38:33,22,22,818829384404508675
"I support the #ProtectOurDemocracy Act to look into Russia’s meddling in U.S. elections, a danger to our country. @RepSwalwell @RepCummings",2017-01-09 21:56:24,118,55,818577186831601666
".@SpeakerRyan, why repeal #ACA & throw millions of people off their health insurance? It will #MakeAmericaSickAgain.pic.twitter.com/f2VNJkygZU",2017-01-06 16:37:59,51,30,817409893426728960
Partners in the fight to preserve the #ACA for women and for all sent a powerful message to the #GOP today: We will #ProtectOurCare.pic.twitter.com/Iw1gf83lFv,2017-01-05 20:32:54,86,31,817106622174601217
"Watch LIVE as @NancyPelosi, @CecileRichards, @Ilyseh address how repealing the #ACA hurts women.  #protectourhealth: http://bit.ly/2jeLGpv ",2017-01-05 17:41:59,20,13,817063610103070720
"#ACA means ~85 million women now have access to preventive care like mammograms and flu shots. That's worth protecting, not repealing.",2017-01-05 13:05:52,1268,781,816994121953005570
Proud to stand w/ my Democratic sisters in Congress to fight for an affirmative vision for families & all Americans.pic.twitter.com/Y6D137kABj,2017-01-04 20:09:29,84,13,816738339411939331
.@POTUS meeting today w/congressional Dems helps us solidify plans to protect the gains made under the #ACA. Fired up & ready to go!,2017-01-04 14:46:39,49,9,816657096833953792
"House members today swore to ""defend the Constitution of the United States against all enemies, foreign and domestic""pic.twitter.com/yUB4BNzrLs",2017-01-03 21:21:58,41,9,816394195611095040
Thanks to all who expressed outrage against the attempted gutting of the House ethics office. They backed down!http://degette.house.gov/media-center/press-releases/degette-to-vote-against-new-house-rules-package-a-shameless-power-grab …,2017-01-03 17:36:12,102,28,816337377652277248
Dismal start to 115th Congress: Republican power grab & gutting of the ethics office. The Swamp wins this round.http://www.nytimes.com/2017/01/02/us/politics/with-no-warning-house-republicans-vote-to-hobble-independent-ethics-office.html?_r=0 …,2017-01-03 14:57:04,29,16,816297329930227712
I wish you and yours a joyous and festive holiday season. Here's to cherishing what's truly important during this special time of the year.pic.twitter.com/znwuw4KWFR,2016-12-24 14:30:31,32,3,812666772029575168
 The Path to Cures: How our landmark legislation went from an idea to U.S. law.https://twitter.com/i/moments/811660628809097216 …,2016-12-21 21:59:35,13,5,811692618853781504
2016 has been an unforgettable year. Visit my Facebook page to see how we went out on a high note: http://bit.ly/2h9WqTG ,2016-12-21 15:34:52,3,2,811595801193574401
I joined 100+ members of Congress in urging @realDonaldTrump to #endhyde and support #reprohealth for every woman:http://bit.ly/2gYPHc3 ,2016-12-20 20:43:37,19,5,811311113560293378
House members will defend @ENERGY staff in CO & nationwide against intimidation or censorship from @realDonaldTrump: http://bit.ly/2hML2fb ,2016-12-20 01:24:55,33,17,811019518868852740
"To ensure the strength of our democracy, we must get to the bottom of #Russia's alleged meddling in U.S. elections:http://dpo.st/2hNviLx ",2016-12-19 20:47:25,32,16,810949679869476868
Glad to have the @AmDiabetesAssn as a strong partner as we continue to fight against diabetes and in favor of health coverage for all.https://twitter.com/AmDiabetesAssn/status/809129709988642816 …,2016-12-16 16:02:00,6,2,809790689550696448
"Due to high demand, the deadline to get coverage under the #ACA has been extended to Dec.19. Visit http://healthcare.gov  to learn more.",2016-12-16 15:20:02,10,12,809780127659855872
"We must have an independent, bipartisan inquiry into #Russia's alleged meddling in US elections. Much is at stake.http://bit.ly/2h5u2zD ",2016-12-15 21:35:15,41,18,809512167171092483
DEADLINE TODAY: Enroll at http://healthcare.gov  for coverage starting 1/1. Don’t wait until it’s too late!pic.twitter.com/xAKDV3iZb1,2016-12-15 21:27:04,3,0,809510107939799044
"Thank you, @POTUS, for answering our call to safeguard #reproductiverights for millions of women through Title X:http://bit.ly/2hOUxt1 ",2016-12-14 21:48:10,15,4,809153028775411713
There's only one more day left to select an affordable plan at http://healthcare.gov  and #getcovered for 2017. Don't miss out!pic.twitter.com/h47coKICnP,2016-12-14 20:04:33,1,2,809126952732946433
Today we remember the 26 children & educators murdered at Sandy Hook Elementary. We must work together to #EndGunViolence. #HonorWithActionpic.twitter.com/18sbZkN1WJ,2016-12-14 16:08:59,37,18,809067673405497344
#RickPerry is an unsettling choice for @ENERGY given his past remarks and Trump's plans for the future. We will hold them accountable.,2016-12-14 14:34:27,27,9,809043881610383360
“New 21st Century Cures Law is Proof That Bipartisanship Can Work…” — @RepDianaDeGette https://medium.com/@RepDianaDeGette/new-21st-century-cures-law-is-proof-that-bipartisanship-can-work-wonders-but-partisan-plans-for-711e9ef35d12#---157-319.iko6oyjy5 …pic.twitter.com/K4FWALaEsc,2016-12-13 21:16:49,19,13,808782754649436161
#21stCenturyCures is now law. On to great discoveries in biomedicine that will give hope to millions. Thanks to all involved. @RepFredUpton,2016-12-13 21:11:04,231,81,808781307211894784
"If #RickPerry is nominated to lead @Energy, maybe he’ll forget that he proposed eliminating it. But we won’t.http://bit.ly/2gwuNAR ",2016-12-13 17:12:47,16,9,808721341688008704
"Our #Cures bill, to be signed into law today, will benefit millions of Americans. Here are three of their stories:http://bit.ly/2gwuLJ6 ",2016-12-13 16:23:00,2,0,808708813662617600
The Senate must thoroughly examine Rex Tillerson's qualifications and potential conflicts if he's to be our country's top diplomat.,2016-12-13 16:13:05,27,4,808706316042694656
"Thanks @DenverPost for your kind words & for calling #21stCenturyCures ""full of promise for the American people.""http://www.denverpost.com/2016/12/12/21st-century-cures-acts-passage-also-suggests-a-cure-for-gridlock/ …",2016-12-13 00:34:42,5,2,808470162412335104
Start the year on the right foot! #GetCovered by the 12/15 deadline for coverage starting January 1. Go to http://healthcare.gov  for info.,2016-12-12 22:20:59,3,0,808436512052416512
The chilling prospect of a foreign power meddling in US elections calls for a responsible inquiry. This is a bipartisan issue. #Russianhackhttps://twitter.com/NancyPelosi/status/808379675890372609 …,2016-12-12 20:08:45,45,19,808403234138296320
Does @RealDonaldTrump intend to harass or try to fire @ENERGY career staff for doing their jobs?http://wapo.st/2gjJc39 ,2016-12-09 22:34:55,84,61,807352857049632768
.@Surgeon_General helps us sound the alarm on teen use of #ecigs. Nicotine in any form harms developing brains.http://dpo.st/2gJllLt ,2016-12-09 16:32:54,3,1,807261751708422144
Bipartisan research & lots of legwork got #21stCenturyCures passed. @nytimes notes contrast w/ #ACA repeal effort.http://nyti.ms/2htrzyI ,2016-12-09 16:10:38,6,4,807256148265095168
Proud to have helped secure a $30 million grant from @HUD that will allow Denver to build more affordable housing.http://bit.ly/2h9Oenf ,2016-12-08 22:33:02,29,6,806989995936456704
"Saddened by the passing of the inspirational #JohnGlenn- a World War II veteran, U.S. Senator and pioneer of the space age. #RIPpic.twitter.com/fkwnVRxHI3",2016-12-08 21:06:45,16,5,806968280955101184
Proud to celebrate the historic passage of #21stCenturyCures at today's enrollment ceremony with colleagues on both sides of the aisle.pic.twitter.com/97NpnLi3Nd,2016-12-08 18:49:39,30,8,806933778035834881
