Text,Date,Favorites,Retweets,Tweet ID
"Enough! With millions enrolled in affordable health coverage, House Rs voted for 50th time to repeal & undermine the #ACA #copolitics",2014-03-05 22:22:01,3,2,441337864253497344
If you’re eligible to #GetCovered for health insur w @C4HCO the 2014 enrollment period ends March 31.  http://connectforhealthco.com/how-it-works/enrollment-deadlines/ … #copolitics,2014-02-28 16:43:58,1,2,439440851518111744
.@EnergyCommerce Oversight & Investigations hearing I discussed dangers of counterfeit drugs. WATCH: http://youtu.be/Q2RN17zYoco  #copolitics,2014-02-27 22:41:35,0,3,439168463006101504
This week @PeaceCorps celebrates 53 yrs of tackling the most pressing needs of people around the world.  #PCWeek2014 http://www.peacecorps.gov/media/forpress/press/2332/ …,2014-02-26 21:05:19,10,15,438781848735723520
I signed the discharge petition to vote to #raisethewage because hardworking Americans deserve a livable wage. The #TimeFor1010 is now.,2014-02-26 20:06:04,14,22,438766936235974656
Here are a few of my favorite statues & portraits of iconic African Americans represented at the @uscapitol: http://www.facebook.com/DianaDeGette  #BHM,2014-02-25 22:51:37,2,1,438446209897099264
"144 yrs ago today, Hiram Revels of Mississippi was sworn in as the first African American Senator. #BHM #BHM2014 http://www.senate.gov/artandhistory/history/minute/First_African_American_Senator.htm …",2014-02-25 15:42:51,3,3,438338311179206657
"My mentor & dear friend, @john_dingell the longest serving member of #Congress reminds us all: it's not how long, it's how well you serve.",2014-02-24 16:11:30,4,8,437983131979632641
"After 58 years of service, @john_dingell announced his retirement today. He has truly set the bar for us all.http://youtu.be/EMulPzrZZng ",2014-02-24 16:07:28,1,4,437982117553639424
It was a pleasure meeting w Amb @CarolineKennedy this week & discussing #Colorado's important relationship w #Japanpic.twitter.com/3pPNa5VZIl,2014-02-21 23:41:16,4,1,437009156533653506
SPOILER: #Colorado: where young women strike gold! @MikaelaShiffrin @FranklinMissy #TeamUSA #Sochi,2014-02-21 18:31:55,4,3,436931305612529664
Wishing @MikaelaShiffrin luck today in slalom. One of the many talented athletes representing #Colorado & #TeamUSA in #Sochi.,2014-02-21 16:18:32,0,0,436897736299134976
UI expiration will cost #CO economy $53 million in Jan/Feb alone.  RT If you want Congress to #renewUI. #copoliticspic.twitter.com/ZrsXVVuAcx,2014-02-20 20:43:00,5,36,436601903556730881
BREAKING: 9 couples file suit challenging #Colorado's ban on same-sex marriage. #LGBT #equalityhttp://dpo.st/1c34BFr ,2014-02-20 02:16:44,9,15,436323504821370880
"Tomorrow CO's @justin_reiter competes in alpine snowboard racing. Until then, check out his column on #climatechange:http://www.denverpost.com/opinion/ci_25116948/snowboard-finds-more-worry-about-than-olympics-finish …",2014-02-18 18:56:46,1,3,435850394535596032
Best of luck to #Colorado's @TorinWallace @guskenworthy & Aaron Blunk who are representing #TeamUSA in men's ski halfpipe today. #Sochi,2014-02-18 14:33:24,1,2,435784114822606848
"Very sad to hear the passing of my dear friend Dennis Dougherty, a mentor to many and a linchpin of our community. #copolitics",2014-02-15 18:08:36,3,6,434751111019630592
SPOILER: Congrats to Denver's @guskenworthy who earned a silver medal today & helped #TeamUSA sweep slopestyle in #Sochi!,2014-02-13 22:02:10,3,3,434085112079458304
2.13 might be today's date but it's also the min wage for tipped workers. Now is the time to give America a raise! #RaiseTheWage #copolitics,2014-02-13 19:13:10,6,5,434042580670906368
"We all know when women succeed, America succeeds. #WhatWomenNeed this Valentine's Day is equal pay for equal work.pic.twitter.com/IdVyghGPBt",2014-02-13 16:19:23,7,18,433998847363141633
Today #POTUS raised min wage for fed contractors to $10.10. RT if you want Congress to finish the job & give America a raise #RaiseTheWage,2014-02-12 20:12:02,1,8,433695010932805633
The @Broncos loss was bad enough but today I handed over my @Stranahans & tamales to @RepJimMcDermott #copoliticspic.twitter.com/es3pRA3egK,2014-02-12 00:12:38,2,6,433393171804864512
Proud of my former colleague @GovInslee for suspending the death penalty in Washington state. #Courage #waleg #copolitics,2014-02-11 19:16:50,4,5,433318731511373824
BREAKING: Thx AG Holder for ordering @TheJusticeDept to fully recognize  same-sex marriages in all federal matters #LGBT #coleg,2014-02-10 22:30:02,5,5,433004963321499649
Wishing luck to the Coloradoans & #TeamUSA at #Sochi. Congrats to fellow @ColoradoCollege alum @ElizaOuttrim on her strong showing in moguls,2014-02-09 21:08:29,6,3,432622052441612288
".@politico's #Energy113 panel today, I discussed opportunities Congress has to strengthen our national energy policypic.twitter.com/qaK2M7MDHC",2014-02-06 17:17:47,1,4,431476831641149441
"MT @POLITICOevents: TUNE IN @ 8am ET for POLITICO’s Energy & 113th Congress @OurEnergyMoment #Energy113
http://POLITICO.com/live ",2014-02-06 12:23:40,0,5,431402813324001280
Gave #POTUS @helliemaes caramels from #Denver @WhiteHouse. #smallbiz #copolitics Photo Credit: @BettyMcCollum04pic.twitter.com/sZp5l5IWr8,2014-02-05 22:37:17,7,4,431194846787674112
Big news for #diabetes research: @NIH to collaborate w industry to speed progress for next gen drug development.http://wapo.st/1bZf5Fy ,2014-02-05 19:53:44,1,5,431153689215004672
101 years ago today #RosaParks was born. Her courage in the face of fierce injustice challenged the conscience of America. #BHM #BHMCO,2014-02-04 19:20:09,4,5,430782848765677568
Ready for #SB48. Go #Broncos! #UnitedInOrangepic.twitter.com/Drsj0dIMkO,2014-02-02 23:17:16,9,6,430117747784425472
Ran into former #Broncos @87ED & @NeilSmith_KC on #RadioRow #UnitedInOrange #SuperBowlpic.twitter.com/bqokpTpyFT,2014-01-31 22:05:29,3,4,429374905868906496
Had a great time speaking with Rafael from @Univison & thanks for showing us around #RadioRow! #UnitedInOrangepic.twitter.com/r9NDUHfpqB,2014-01-31 21:08:13,0,2,429360494755856384
Big thanks to my friend Henry A. Waxman for his many years of leadership & service to our nation @WaxmanClimate @EnergyCommerce,2014-01-30 17:09:27,2,4,428938017936379904
Honored be included in this great group at @cowomenschamber's Top 25 Most Powerful Women event last night #copoliticspic.twitter.com/ZGT2O2AxA6,2014-01-24 19:39:02,3,3,426801333878804480
Today we recognize 41st anniversary of #RoevWade & that #weneedroe to ensure women have the right to make their own health decisions. #Roe41,2014-01-22 17:27:42,7,8,426043506340020224
"With the @Broncos heading to #SB48, #Denver is turning orange. Reply to send me your favorite pics.  #copoliticspic.twitter.com/iafrybFWBh",2014-01-22 00:04:10,4,4,425780894167617536
"Today, let's recognize Dr. King's legacy by using words and actions to spread equality and justice #MLK",2014-01-20 21:37:10,2,5,425381512939200512
Looking forward to the #Broncos winning Super Bowl XLVIII! #BroncosNation #Omaha,2014-01-19 23:15:24,5,8,425043847123857408
Proud to stand with House Dems today to #stopHR7. #coleg #copoliticspic.twitter.com/4xLPJqpGPd,2014-01-15 20:16:59,13,10,423549392306458625
TUNE IN: I will join @craigmelvin on @MSNBC at 12:15 ET to discuss the Republican agenda to undermine women’s reproductive rights. #Choice,2014-01-15 16:36:56,1,2,423494016991100928
Preparing to host presser w @louiseslaughter & pro #choice caucus on House Rs reckless agenda against women’s reproductive rights. #StopHR7,2014-01-15 15:46:00,4,7,423481197407535105
BREAKING: #SCOTUS announcement means Arizona's extreme abortion law banning abortions after 20 weeks is struck down. #Choice,2014-01-13 17:26:58,4,5,422781831939760128
Here we go again... House GOP starting off 2014 with same extreme anti #choice agenda. #StopHR7http://degette.house.gov/media-center/press-releases/degette-pro-choice-caucus-leadership-warns-public-republican-crusade …,2014-01-09 20:48:49,4,4,421383079404371968
"Today we reflect on progress made, the challenges that remain, & renew our commitment to “replace despair with opportunity”. #WarOnPoverty",2014-01-08 17:42:39,2,5,420973839682506754
"Today, the Senate took 1st step to #RenewUI & help 20K Coloradoans & 1.3 million Americans pay the bills as they look for a job. #copolitics",2014-01-07 22:00:49,3,2,420676421426487296
BREAKING: Janet #Yellen confirmed by Senate to lead the Federal Reserve. 1st woman chair.,2014-01-06 23:27:51,5,6,420335939051720704
Sending out thoughts and prayers to the family of Claire Davis and the #ArapahoeHigh Community,2013-12-22 15:42:50,4,11,414783093518913536
BREAKING: President announces more than 1 million Americans signed up for health insurance so far this month. #GetCovered #ACA #copolitics,2013-12-20 21:01:38,3,2,414138546354536448
"Eligible to enroll through @C4HCO? To #GetCovered on 1/1/14, you must sign up by 12/23/13. #copolitics DETAILS:http://www.connectforhealthco.com/ ",2013-12-20 18:28:17,1,2,414099953439371266
BREAKING: New Mexico now becomes the 17th state in the nation to embrace marriage #equality after Supreme Court ruling. #copolitics #LGBT,2013-12-19 18:52:35,6,15,413743683108749312
Sending my thoughts & prayers to Claire & her family #prayforclaire http://www.thedenverchannel.com/news/local-news/claire-davis-victim-in-arapahoe-high-school-shooting-not-doing-well-dad-tells-7news …,2013-12-15 01:04:38,5,9,412025371312537600
"I send my thoughts & prayers to the students, teachers, first responders & entire #ArapahoeHighSchool community.",2013-12-13 21:28:41,5,9,411608640143884288
Honored to receive top rating from @FPAction for supporting stronger food security & better food policies. #votefood,2013-12-11 20:12:34,2,2,410864706358747136
"As we mourn the loss of a great leader, we should also celebrate #Mandela's tremendous grace & courage in the face of fierce opposition.",2013-12-05 22:19:32,1,7,408722332060876800
WATCH: I talk about what’s at stake following #SCOTUS announcement to hear employer #BC challenge on @CBSThisMorning.http://www.cbsnews.com/videos/scotus-to-hear-case-over-aca-contraception-benefits/ …,2013-11-27 18:16:28,1,1,405762060744536064
"#SCOTUS to hear challenge to employer BC requirement. RT if you agree women, not bosses, should make own health decisions. #HandsOffMyBC",2013-11-26 20:48:44,4,34,405437990748446720
ALERT: #SCOTUS to hear challenge to #ACA #birthcontrol. This decision belongs to a woman; not her employer. #HandsOffMyBC,2013-11-26 17:11:59,3,12,405383443585835008
Check out my @denverpost Op-Ed on our bipartisan #Compounding bill to help protect lives. Awaiting #POTUS signature.http://www.denverpost.com/opinion/ci_24599081/protecting-american-lives-side-bipartisanship …,2013-11-26 16:46:32,0,2,405377038212542464
Congratulations to my friend & colleague @cathymcmorris on welcoming Brynn Catherine to her family!,2013-11-25 20:32:38,1,1,405071553932451840
"We need to make sure data on http://Healthcare.gov  is secure, but we should not create smoke if there is no fire.http://www.cbsnews.com/8301-250_162-57612953/serious-obamacare-concerns-obscured-by-politics/?tag=socsh …",2013-11-19 18:48:10,0,5,402870934341554176
About to preside over @EnergyCommerce O&I hearing on security of http://healthcare.gov  WATCH here:http://www.ustream.tv/channel/8418471 ,2013-11-19 15:12:14,0,3,402816591408005120
"BREAKING: Senate passed bipartisan Drug Quality & Security Act, providing oversight on #compounding pharmacies. Proud to lead House effort.",2013-11-18 20:05:01,2,9,402527886684332032
"As co-chair of the Cong. Diabetes Caucus, proud to join the fight on #WorldDiabetesDay to expand #diabetes care, research  & education.",2013-11-14 22:21:36,0,4,401112705890676736
Thank you to the men & women who have served our nation. Your service will continue to inspire future generations of Americans. #VeteransDay,2013-11-11 16:39:56,4,3,399939562304053248
"Today, the Senate acted to help ensure workplace equality for #LGBT community. Now is the time for the House to finish the job & #PassENDA",2013-11-07 19:21:46,3,3,398530736342310912
Congrats to my friend & fellow Coloradoan Katherine Archuleta who was confirmed as the new Director of @USOPM by the Senate #copolitics,2013-10-31 16:06:33,0,2,395944892272103424
Proud to recognize #RockyFlats workers' dedication & service today on the 5th National Day of Remembrance.pic.twitter.com/KBkm3edOjQ,2013-10-30 19:19:03,1,1,395630947069997056
.@EnergyCommerce hearing w @Sebelius testifying on solutions for http://Healthcare.gov  & rollout of #ACA. Problems need to be fixed & fast.,2013-10-30 13:19:54,2,4,395540565711781888
Today's @EnergyCommerce O&I hearing on @EPA's proposed rules on #coal shouldn't ignore #climate change. WATCH: http://www.ustream.tv/channel/8418471 ,2013-10-29 17:37:11,0,4,395242928055930880
BREAKING: just spoke with @Sebelius & http://healthcare.gov  is on track to fully functional by end of November.,2013-10-25 17:22:25,2,9,393789659962433536
"At today’s @EnergyCommerce hearing: “These problems need to be fixed, and they need to fixed fast.” http://nyti.ms/1d2l3b4  #ACA",2013-10-24 21:00:41,0,2,393482197673324544
WATCH my statement @EnergyCommerce #ACA hearing urging members to find solutions to improve http://Healthcare.gov :http://youtu.be/FLmnKlpTNA8 ,2013-10-24 15:05:54,1,4,393392914350350336
"About to begin my questioning""@denverpost: WATCH LIVE: Congress questions co's re glitches in #Obamacare website: http://dpo.st/1eMYEz8 ”",2013-10-24 14:09:18,0,1,393378670968307713
"RT @ezraklein Good for Rep. Diana DeGette, first of the Dems to sound actually angry that implementation has been botched",2013-10-24 13:40:52,1,1,393371517662134272
"Tonight I voted to end the #shutdown & pay our nation's bills. In coming weeks, I will work towards plan to secure stronger American future.",2013-10-17 03:50:53,10,9,390686328285040640
Outside Chamber waiting w @RonBarber & @PeterWelch to sign petition to open govt #DemandAVote #GOPshutdownpic.twitter.com/57DkVLGW6v,2013-10-12 14:23:00,8,12,389033465745645569
BREAKING: #POTUS nomination of Janet Yellen as the next #Fed chair is a tremendous choice to ensure a stronger economic future,2013-10-09 01:47:44,4,12,387756232745836544
"Heartfelt thank you to the U.S. Capitol Police & law enforcement who ensure our safety, not just today, but every day.",2013-10-03 21:46:28,2,1,385883573871321089
WATCH: Last night I joined @SteveKornacki on @msnbc's @maddow show to discuss the #GOPShutdown:http://youtu.be/jZgygp0gdqw ,2013-10-03 15:50:00,2,4,385793866445516800
Tune in at 7 PM MT to catch me on @maddow with host @SteveKornacki to discuss the #GOPshutdown.,2013-10-03 00:51:35,1,2,385567772618784768
The #GOPhutdown is reprehensible & the consequences will be felt far & wide.  RT if you've had #EnoughAlreadypic.twitter.com/dVGAmp18Yj,2013-10-02 01:07:10,7,19,385209306024402944
My offices will remain open during the #shutdown to provide assistance & answer your questions. More info here:http://degette.house.gov/index.php?option=com_content&view=article&id=163&Itemid=177 …,2013-10-01 19:28:25,2,6,385124060545314816
"As we stand on the brink, it’s time for House GOP to stop the delaying tactics & allow a vote on a clean CR. #EnoughAlready #GOPShutdown",2013-09-30 21:36:46,4,11,384793969554518016
Check out my @HuffPostPol blog on how we can follow a model for compromise to avoid a govt #shutdown.http://huff.to/18G3mNn ,2013-09-30 17:53:57,0,3,384737896038531072
"In 11th hr, House GOP pursues extreme anti birth control agenda; bringing govt to brink of #shutdown #GOPConscience #GOPShutdown",2013-09-29 02:03:56,2,12,384136429581774848
"#GOPConscience: Limit access to contraception in CR, or shut down the government. #EnoughAlready #GOPshutdownhttp://politicalticker.blogs.cnn.com/2013/09/28/gop-to-add-conscience-clause-to-spending-bill/ …",2013-09-29 00:51:19,3,16,384118157553577984
BREAKING: #GOPWarOnWomen continues with last minute measure limiting access to contraception in CR. #EnoughAlready #GOPshutdown,2013-09-29 00:35:00,3,42,384114048716906496
Marketplaces open on October 1st. FF for all your #Colorado #ACA updates: @C4HCO @SmlBizMajority @COGovHealth #GetCovered #copolitics,2013-09-27 16:11:58,1,5,383625067516555264
Thx to @Rockies legend Todd Helton for all the memories. Lucky to witness a great career as a season ticket holder.pic.twitter.com/VBoA99w7xD,2013-09-26 20:57:36,0,4,383334562975080448
Thx to @Rockies legend Todd Helton for all the memories. Lucky to witness a great career as a season ticket holder.pic.twitter.com/FDuy8fw0QB,2013-09-26 14:32:41,1,4,383237694341402624
BREAKING 95% of uninsured will see lower than expected health care premiums w #ACA #GetCovered http://goo.gl/R3vMxJ pic.twitter.com/Iyh7bgQ75R,2013-09-25 18:52:34,28,116,382940708270645248
VIDEO: Learn how to get ready to enroll in @C4HCO - #CO's health insurance marketplace opening Oct 1 #ACA #GetCoveredhttp://goo.gl/wLzYjM ,2013-09-25 18:49:50,1,2,382940019574337536
"While @tedcruz tries to derail #ACA, Obama & Clinton discuss how its helping Americans. Watch live here: http://goo.gl/3HYb5B  #CGI2013",2013-09-24 21:30:22,0,2,382618033597841409
REMINDER: I am holding an #ACA town hall tomorrow! Also meetings next week have been rescheduled. Details here: http://goo.gl/elDEKG ,2013-09-20 21:26:37,0,5,381167538576424960
House GOP reducing access to food for millions next year; cutting $40 BILLION from #SNAP. RT if you think Congress should #EndHungerNow,2013-09-19 20:01:19,1,10,380783684539793408
"4 yrs & 42 repeal votes later, @RepublicanStudy Cmt announces #ACA alternative. Apparently, GOP thinks fewer protections is #abetterway?",2013-09-18 19:21:48,0,5,380411352319131649
"Happy #ConstitutionDay!  226 years later, this framework remains as vital & relevant to our democracy as ever.",2013-09-17 15:52:57,2,13,379996402698317824
For those in areas affected by flooding please be safe & follow @COEmergency for updates. #COwx #coflood,2013-09-12 20:49:34,1,6,378259110921117696
Learn about #Out2Enroll & health coverage for #LGBT community in #ACA. CC: @One_Colorado WATCH at 11:30 AM MT today:http://www.whitehouse.gov/live ,2013-09-12 16:11:02,0,1,378189016627019778
REMINDER: I'm kicking off a series of town hall meetings on the #ACA tomorrow @NJhealth at 10 AM. Details: http://1.usa.gov/17E18xm  CC: @C4HCO,2013-09-06 15:43:45,1,7,376007824611889153
I strongly urge #POTUS to seek vote & thorough debate in #Congress before military action against #Syria. http://goo.gl/1gshNo ,2013-08-30 20:28:44,6,20,373542826669510656
BREAKING: @DOJ will honor the will of #Colorado voters & not block CO #marijuana laws. http://1.usa.gov/15joJWa  #copolitics #coleg,2013-08-29 19:32:38,0,6,373166319585095680
BREAKING: @USTreasury announces ALL same-sex couples will receive same recognition for tax purposes as other married couples. #LGBT #coleg,2013-08-29 19:25:13,4,7,373164455829327872
What do you think about the new #Colorado logo unveiled by @brandCOLORADO today? #COpolitics #COlegpic.twitter.com/nHAgaUO4AF,2013-08-29 17:37:30,0,1,373137347736399872
Today's historic anniversary is an opportunity to renew our commitment to realize Dr. King’s dream of full #equality and #justice. #MOW50,2013-08-28 14:53:41,1,2,372733730554540032
Proud to visit @NJHealth today to talk about my bill to help #vets exposed to toxic #chemicals.pic.twitter.com/M2zMDW2H3v,2013-08-27 20:01:42,0,3,372448858254499840
"As we celebrate Women's Equality Day, we must continue our commitment to advancing equal rights & opportunities for all women. #WED2013",2013-08-26 17:34:16,1,6,372049369890971648
Questions about the Affordable Care Act? Join 1 of 4 town halls to learn about the benefits of #ACA. Details here: http://goo.gl/c08pqU ,2013-08-21 20:32:25,2,10,370282260299534336
"Great profile on Kirk Johnson, former @DenverMuseumNS curator MT @postpolitics Background Check Smithsonian's Johnsonhttp://wapo.st/18HE0NB ",2013-08-20 16:59:09,1,3,369866204787138560
Today @BerthaLynn7News signs off from @DenverChannel. #Denver thanks her for yrs of hard work & we wish her well on her next adventure!,2013-08-09 18:53:23,1,1,365908684980756481
"Today marks 20th anniversary of the landmark Family & Medical Leave Act, helping millions balance responsibilities of family & work. #FMLA",2013-08-05 18:42:57,1,5,364456509344083968
Thrilled Senate passed #hydro bill I authored w @cathymcmorris! Now heading to #POTUS desk. Streamlined process = good jobs & #cleanenergy,2013-08-02 16:07:07,1,3,363330128467591170
"Happy #ColoradoDay, even though I believe everyday is Colorado Day! Reply with what you love most about our amazing state. #copolitics",2013-08-01 18:56:10,2,4,363010283926589441
Thank you! RT @RepDWStweets: Happy Birthday to fourth-generation Coloradoan @RepDianaDeGette! #Colorado,2013-07-29 19:31:42,3,1,361932061021437952
"Thank you! RT @WhipHoyer: Wishing my friend from Colorado, @RepDianaDeGette, a very happy birthday.",2013-07-29 19:16:12,0,2,361928160431972353
TOP STORY: @denverpost editorial renews push for #hydro & bill I introduced w @cathymcmorris to streamline process.http://bit.ly/13Tiogw ,2013-07-29 16:04:34,0,3,361879933271818240
Honored to join so many this weekend to celebrate pan-Asian culture at the CO Dragon Boat festival. #copolitics,2013-07-27 23:39:27,3,2,361269633564680192
"Yesterday, I supported #AmashConyers amendment to promote transparency & protect privacy of Americans.http://nyti.ms/1biWB7H ",2013-07-25 17:04:09,5,1,360445378534969345
"Today we remember the victims of the Aurora theater Massacre, who remain in our hearts, thoughts & prayers. They will not be forgotten.",2013-07-20 17:43:27,2,12,358643328859897856
"Breaking News: 136 days after nomination, #Senate finally confirms Gina McCarthy as next @EPAgov administrator.",2013-07-18 20:11:26,2,3,357955792718151680
"Proud to #StandWithTXWomen MT @WendyDavisTexas: By signing #HB2, Perry shows he doesn't care about TX families.pic.twitter.com/jmasghElzd",2013-07-18 16:58:18,3,4,357907192529170432
"#ObamacareInAction in #CO01: 192K people, including 36K kids & 80K women have health plans covering preventive care @ no cost. #copolitics",2013-07-18 15:53:01,1,10,357890762379239426
LAST CALL: 1 day left to send your best CO pics for my FB cover photo contest. Send pics to: PhotoContest.DeGette@mail.house.gov #copolitics,2013-07-18 14:59:38,0,0,357877326438080512
"MUST READ: http://nyti.ms/13tokrZ . NY health plan costs to drop 50% thx to #ACA. Meanwhile, GOP will attempt 38th vote to repeal law today.",2013-07-17 15:47:33,2,2,357526998601580544
For 2 years #GOP has blocked Richard Cordray as @CFPB chief. His confirmation today is a positive step to #EndGridlock.,2013-07-16 21:36:20,6,11,357252385367785472
Washington can’t agree on #energy solutions? @ThirdWayEnergy has some ideas to fix that. #PowerBook http://powerbook.thirdway.org/ ,2013-07-12 19:32:12,0,5,355771592132931584
#FF for latest updates on US & #Colorado #energy news: @ByMarkJaffe @NRDC @EnvDefenseFund @TaliaBuford @evanlehmann @CAPenergypolicy @CandBP,2013-07-12 18:52:47,0,1,355761674990530560
Congrats to you! MT @ThirdWayEnergy Thx to @RepDianaDeGette & Team for helping make #PowerBook launch a HUGE success! http://powerbook.thirdway.org ,2013-07-12 18:24:47,0,0,355754628291371010
#FF for updates & #StandWithWomen: @PPFAQ @PPRockyMountain @CecileRichards @WendyDavisTexas @ReproRights @Guttmacher @NARAL @nwlc @ChoiceUSA,2013-07-12 12:56:56,3,4,355672122623930368
Congrats to a great team! MT @MarkWThrun: Denver Public Health named national local public health dep. of the year! http://www.naccho.org/membership/lhd-of-the-year.cfm …,2013-07-11 20:45:56,0,3,355427762187673602
Send your best #Colorado photos to enter my FB photo contest http://www.facebook.com/DianaDeGette  Check out our favorites so far!pic.twitter.com/Y7Kt4Nf1WK,2013-07-11 20:30:28,1,3,355423870565617665
Now is time for comp. #ImmigrationReform to deliver countless benefits to US & #Colorado. RT if U want action now!http://nyti.ms/1apjaab ,2013-07-11 16:54:29,1,6,355369513396604928
Today @HouseAppropsGOP Subcmte passed new #antichoice provision impacting #abortion coverage for women under #ACA. Say NO to #sonofstupak,2013-07-10 21:50:28,3,12,355081613819916288
Enter my Facebook photo contest & send your best shots of Colorado; YOUR pic could be my new cover photo!  https://www.facebook.com/DianaDeGette/posts/10151761112463489?comment_id=28101659&offset=0&total_comments=1 …,2013-07-09 16:58:03,0,2,354645637398134784
"Happy birthday to my dear friend & mentor, Chairman @john_dingell & watch this tribute to his service & leadership:http://youtu.be/EMulPzrZZng ",2013-07-08 16:20:13,4,2,354273726361108480
Check out @denverpost's editorial urging Congress to pass my bill to provide lasting framework for #StemCell researchhttp://bit.ly/12SPoVO ,2013-07-08 15:26:52,0,6,354260302570864640
"On 49th anniv. of Civil Rights Act #SCOTUS #VRA ruling is reminder Congress must act to secure our most fundamental right, the right to vote",2013-07-02 20:31:10,1,5,352162552681218049
The tragic news of 19 heroes who fell in Sunday's blaze is felt far beyond #Arizona's borders. Our prayers are with their families.,2013-07-01 15:00:34,1,3,351716969134833664
"One year ago today, #SCOTUS upheld the #ACA, ensuring millions of Americans & Coloradoans access to quality, affordable care. #coleg",2013-06-28 17:17:54,1,1,350664366854643712
BREAKING: #Senate passes #Immigration Reform 68-32. Now it’s time to put forth a comprehensive bipartisan #House version. #copoltiics,2013-06-27 20:33:39,2,14,350351240531681280
