Text,Date,Favorites,Retweets,Tweet ID
@GovEdRendell and former Transportation Secretary Ray LaHood visited the @NoLabelsOrg Problem Solvers’ Caucus today to discuss how we can move forward in a bipartisan way to create jobs with new transpo investments.pic.twitter.com/i9L11vDhnH,2017-11-30 22:40:57,0,1,936364456040456193
"According to @EPA, there are at least 66 brownfields sites in central & NW #CT. Renewing these properties will grow local economies, encourage new business, and put people to work.",2017-11-30 22:02:31,2,1,936354784784896000
"Just got back from the floor, where the House passed my bipartisan legislation to renew brownfields in #CT and throughout the country. Every acre of brownfields cleanup creates close to 10 good-paying jobs for Americans.pic.twitter.com/B0CWBNkUR0",2017-11-30 21:33:57,17,3,936347593042522113
"Proud to make this happen. We must step up our efforts to combat human trafficking in America. The average age a teen enters the sex trade in the U.S. is 12-14, and many victims are young runaway girls who were abused as children.https://twitter.com/TransportDems/status/936270982783885312 …",2017-11-30 16:33:33,16,5,936271996782030848
We need a bipartisan path forward on guns that recognizes the 2A rights AND the safety of every American. Closing the gaps in our background check system with #FixNICS is a step on that path. Reciprocity isn't. #StopCCR,2017-11-29 22:03:10,5,5,935992558789984256
"So-called ""reciprocity"" will make it even harder for law enforcement to do its job. Worse than that, it contains especially extreme language holding officers personally liable for questioning a concealed carry permit. Police officers could be sued directly. #StopCCR",2017-11-29 22:00:38,4,4,935991922992336896
"For years, we've been told that national standards aimed at ending gun violence would harm the rights of states with weaker gun laws. Well, what about the states who've chosen tougher standards to keep families safe? #StopCCR #EndGunViolence",2017-11-29 21:55:49,8,6,935990710066712576
"Let's break down the concept of #CCR for a second: many states throughout the country have passed tough concealed carry standards that respect Americans' 2A rights. ""Reciprocity"" would allow people to travel to states with weaker laws and get a license to carry. #StopCCR",2017-11-29 21:51:11,1,3,935989544775835649
"The bad news = #FixNICS is being advanced at the same time as ""concealed carry reciprocity"" legislation, which would allow people to have hidden guns virtually anywhere & any time. #NoCCR",2017-11-29 21:43:28,6,4,935987599151452161
The good news = bipartisan #FixNICS Act to strengthen our background check system is being considered by the House Judiciary Committee.,2017-11-29 21:41:04,6,2,935986995741982720
We've got some good news and some bad news for Americans who are demanding that Congress pass legislation to #EndGunViolence.,2017-11-29 21:39:56,1,3,935986712404217857
Joined @HouseGVP this morning to discuss how we can put a stop to the epidemic of gun violence in our communities. #EndGunViolencepic.twitter.com/noLba8ygaU,2017-11-29 17:36:47,27,9,935925521141166080
With the iconic Ken Burns yesterday evening following votes - he believes in history and facts & helps all of America to believe in them too.pic.twitter.com/En57Sg3dcI,2017-11-29 14:16:25,25,2,935875099093323776
Scott Johnson’s contributions to improving Connecticut vibrate through the lives he touched and the communities that knew and loved him. May he rest in peace.http://www.courant.com/community/new-britain/hc-news-new-britain-scott-johnson-20171127-story.html …,2017-11-29 01:30:01,3,1,935682224615313408
Heartbreaking first-hand accounts from residents about what life is still like in Puerto Rico—two months after Hurricane Maria first hit. We need to do better.http://www.courant.com/news/connecticut/hc-puerto-rico-relief-day-3-20171128-htmlstory.html …,2017-11-28 23:00:03,11,6,935644484976726016
It’s Albanian Independence Day today! It was an honor to join Waterbury’s Albanian Mayor of the Day last week. Our community is made better by the contributions of Albanian-Americans.pic.twitter.com/DY2SJ4A8I4,2017-11-28 20:44:48,11,2,935610450917683200
It doesn't have to be a partisan issue: we need to pass the #DREAMAct and #ProtectDreamers in #CT and throughout the nation. It's good for our economy & good for our country.pic.twitter.com/8ja32m0Grx,2017-11-28 16:03:33,74,34,935539670028562433
"I'm with @CT4aDREAM and all those working throughout our state and the country to #ProtectDreamers, who enrich our communities, keep us safe, and grow our economy.",2017-11-27 21:22:20,15,7,935257505441243136
"Like mother, like daughter - Sarah and I find we’ve unintentionally worn the same thing once again. Grateful for time w/family this Thanksgiving, and for those who’ve given it up to keep us safe. #HappyThanksgivingpic.twitter.com/1n9Yf3K7Oo",2017-11-23 17:21:52,45,3,933747438661357569
"And, of course, you can provide feedback here and on my Facebook page (https://www.facebook.com/RepEsty/ ) Your comments in support of saving #NetNeutrality - and on all issues - are appreciated.",2017-11-22 17:47:16,12,2,933391445129662464
You can send a letter to our #CT or #DC offices:https://esty.house.gov/contact/offices ,2017-11-22 17:45:49,6,4,933391077427564545
Constituents can e-mail our office at:https://esty.house.gov/contact/email ,2017-11-22 17:44:38,5,2,933390780365983744
"To those calling my office to urge Congress to #SaveNetNeutrality - please know I support you and stand with you. I'm sending my staff home early to be with their families for the holiday, however, so here are some ways you can reach me:",2017-11-22 17:43:56,16,2,933390606889553920
We've gotten dozens of calls about #NetNeutrality this morning. Keep it up: I stand with you against the FCC's misguided attempt to tamper with a free and open internet.,2017-11-22 15:21:19,230,83,933354714477006848
Enjoyed joining @WestConn students to learn about their research on Lyme disease.pic.twitter.com/iPRk1pmBJr,2017-11-21 20:44:25,10,3,933073639192301569
"So, if the FCC erodes #NetNeutrality protections under the cover of a holiday week, Congress should take swift and immediate legislative action when we return.",2017-11-21 17:16:14,22,7,933021246018727937
"The last time the FCC attempted to roll back #NetNeutrality protections, 22 million comments were filed in response. A record number of Americans made their voices heard on the issue.",2017-11-21 17:14:21,22,5,933020773010366466
"#NetNeutrality is one of the most important issues of our time. What we decide here will determine whether or not we care about innovation, job growth, freedom of expression, and core democratic values in our society.https://twitter.com/politico/status/933016945787572226 …",2017-11-21 17:11:35,44,22,933020078270042112
"Transgender Day of Remembrance is a time to grieve the lives lost to violence and hate crimes this year. No one, regardless of gender identity, should have to live life in fear of physical harm. #TDORpic.twitter.com/PwEUBFcjSr",2017-11-20 18:45:37,18,9,932681352293560323
"Proud to join @ChrisMurphyCT and @SenBlumenthal to discuss the Fix NICS Act, a bill to strengthen our background check system.pic.twitter.com/jdhFffBQAg",2017-11-20 17:23:46,18,4,932660754163163136
It’s #NationalTakeAHikeDay! I had a chance to get out to Roaring Brook Falls last weekend - make sure you head outside!pic.twitter.com/IFCefeXxdJ,2017-11-17 18:07:09,19,3,931584508574478336
Glad to join you. #CT families: there's still time to sign up for or change your healthcare plan. Open Enrollment for 2018 health insurance continues through  12/22. Make sure to #GetCoveredCT!https://twitter.com/AccessHealthCT/status/931557494995988480 …,2017-11-17 16:39:42,3,3,931562501162053633
I’m about to head to vote “NO” on this partisan #GOPTaxPlan that raises taxes on middle-class families in Connecticut.pic.twitter.com/Mvt6kSjD2B,2017-11-16 18:30:33,132,20,931228009264287744
When public opinion on background checks just doesn’t match up to the corporate gun lobby’s talking points…http://www.courant.com/politics/hc-pol-q-poll-supports-gun-control-20171115-story.html …,2017-11-16 15:59:01,4,4,931189872907472901
No more. We must end the attack on women’s reproductive healthcare. It is sexist in nature & practice. We must do better. 3/end,2017-11-15 20:53:05,9,3,930901490323087360
Choice and access to contraception have been the constitutional standard for decades. The current administration is not exempt from this. 2/,2017-11-15 20:52:42,6,2,930901394319663105
Birth control is health care. POTUS should not try to isolate contraception from health care. #HandsOffMyBC 1/pic.twitter.com/AdCJB6HIiF,2017-11-15 20:52:17,23,9,930901291072720897
Joined @DEAHQ officials and colleagues in the New England delegation to receive the latest updates on our response to the opioid crisis ravaging communities throughout #CT and our country.pic.twitter.com/NOMtnXPIoD,2017-11-15 20:02:47,1,1,930888833524228096
"Nearly a fifth of our aerospace engineers are eligible for retirement, and women only represent about a quarter of all STEM workers. We need more people, and more qualified people, entering this high-skill field. #WomenInAerospace",2017-11-15 16:04:55,3,2,930828970538553345
One of our common goals is to inspire more people - and particularly more women - to pursue careers in the sciences. #WomenInAerospace,2017-11-15 16:03:39,5,2,930828652606033921
Our bipartisan bill to encourage women to consider careers in aerospace with @SteveKnight25 is about to be considered by the House Science Committee. Watch the livestream here:https://www.youtube.com/watch?v=hmj0t8NGinc …,2017-11-15 15:51:50,3,2,930825678458585089
"Thirty two times the number of people in favor of the #GOPTaxPlan in my district are against it. The tally thus far:

Support: 40
Oppose: 1,277",2017-11-14 21:21:33,27,11,930546268841095168
"I will be voting an emphatic ""NO"" on the tax plan when it comes up this week. #CT families would pay a steep price.https://twitter.com/Regina_Griffin/status/930532065975644160 …",2017-11-14 20:30:15,82,12,930533357708021760
"I’ll be livestreaming a press conference shortly with the Rondos family, their attorney, and @SenBlumenthal on my Facebook page.",2017-11-13 16:54:14,10,3,930116607254388736
"This is one step on a long road, but I am grateful for the efforts of all those who worked so hard to keep Denada home.",2017-11-13 16:12:23,22,5,930106075579322368
Learned just a little while ago that Denada Rondos will be able to stay together with her family tonight.,2017-11-13 16:09:26,81,14,930105331358814209
Why are we even debating a tax bill that would hurt our middle class?  My op-ed in today’s @NewsTimes:http://m.newstimes.com/opinion/article/U-S-Rep-Elizabeth-Esty-Scrap-partisan-tax-plan-12348469.php …,2017-11-12 15:43:22,43,19,929736383094194176
Cheshire comes together to bring light and hope on a dark and chilly night.pic.twitter.com/6Oz2b04sOv,2017-11-11 23:50:48,17,3,929496665471553536
"Happy Birthday, Sarah! We can't believe that it's been 28 years!pic.twitter.com/VOBl1UZFu8",2017-11-11 23:36:01,42,1,929492941478989824
Proud to join #CT vets at the Gold Star Family Luncheon in Waterbury today.pic.twitter.com/0ZGWhQxOeD,2017-11-11 20:53:31,5,1,929452049124724738
"This #VeteransDay, we thank the men and women who’ve served our country in uniform & recommit to giving our vets the support they’ve earned.",2017-11-11 20:52:06,9,7,929451693972041730
"But #CT stands with those who come to this country to work hard, pay taxes, and raise a family. To the whole Rondos family: we are with you.",2017-11-10 22:18:19,5,1,929111001072586752
"As a mother, I am heartsick at the thought of what Denada’s children are feeling right now.",2017-11-10 22:16:48,4,3,929110618925387777
And yet Denada has been told that she must leave this country by Monday.,2017-11-10 22:14:27,4,2,929110029067747328
Denada Rondos is the kind of person we should be welcoming into this country with open arms - not throwing out to face an uncertain future.,2017-11-10 22:11:45,9,5,929109349506732032
"Her husband Viron works twelve hours a day to support his family, not to mention the jobs he provides in Cheshire.",2017-11-10 22:10:37,4,2,929109065686544386
"Denada Rondos takes care of three children, a home, and the books for her family’s restaurant.pic.twitter.com/jOoF8s3p5U",2017-11-10 22:09:30,6,4,929108782944309248
I‘m joining the Rondos family in Cheshire this afternoon to call on @ICEgov to give Denada a chance to make her case and stay w/family.https://twitter.com/dennishousetv/status/928805397263192064 …,2017-11-10 18:28:37,40,16,929053196168908802
"In Hartford this morning to speak out against the Senate’s #TaxPlan, which would totally scrap #CT families’ state/local tax deduction.pic.twitter.com/vDvB5f2oyf",2017-11-10 15:40:15,27,7,929010824848560128
We cannot afford to lose more time - real lives are on the line. Republicans and Democrats need to come together and pass the #DreamActNow.,2017-11-09 19:52:52,9,4,928712011176972290
I stand with the Dreamers in Connecticut and throughout the nation who are calling for Congress to pass a clean #DreamActNow. Our armed forces and small businesses are better because of #DREAMers.,2017-11-09 19:51:45,42,12,928711726996099072
Great to join you. It's more important than ever that we understand the link between diabetes and heart health.https://twitter.com/Aging_Research/status/928664464018300929 …,2017-11-09 16:48:15,2,0,928665551026737152
Let’s come together and support our veterans’ mental health. Read my op-ed in special @thehill: http://thehill.com/opinion/national-security/359516-we-need-national-commitment-for-our-veterans-mental-health …pic.twitter.com/vaZ7vjnpy8,2017-11-09 14:02:03,15,8,928623724126973952
"Thank you for your years of leadership, Ron.http://www.courant.com/politics/capitol-watch/hc-pol-ron-pinciaro-connecticut-against-gun-violence-20171106-story.html …",2017-11-08 21:36:27,3,1,928375688490639360
Because we need more girls to make history like Mae Jemison.,2017-11-08 20:00:16,1,1,928351483824832512
"Aerospace will provide the jobs of the future for Connecticut. Our employers need more good, qualified people - and that means starting everybody at an earlier age.",2017-11-08 19:15:47,0,2,928340288820711424
This bipartisan bill I introduced with @SteveKnight25 would encourage women and girls to consider careers in aerospace by ensuring our teachers are comfortable talking about the field.,2017-11-08 19:13:41,2,1,928339762179641349
It's #STEMDay! Grateful to join @Reporter_Savino to discuss the Women in Aerospace Education Act. Read & listen here: http://www.myrecordjournal.com/News/State/Esty-bill-aims-to-get-more-women-in-aerospace.html …,2017-11-08 19:11:51,10,2,928339301141794816
"In other words, this #TaxPlan would take from our future to give more to multinational corporations today. It's wrong, and you can bet I'm opposed to it.",2017-11-08 17:14:23,5,4,928309738122678272
"My colleague @jahimes says it best: fiscal responsibility isn't just an issue for ""deficit hawks"" - it matters to anyone who cares about investments in schools, roads, tech, nat'l security, and other key priorities.",2017-11-08 17:12:38,6,4,928309297548791809
Yet those currently ramming this partisan #TaxPlan through the House are casting aside any concern for the long-term fiscal impact of their actions.,2017-11-08 17:09:20,3,2,928308468238471169
"Throughout President Obama's tenure, we heard time and time again of the importance of reducing the national debt.",2017-11-08 17:07:26,1,2,928307987671810050
I say *at least* because of the difficulty of calculating the massive interest payments we'll heap on our children and grandchildren just to give the wealthiest Americans a tax cut.,2017-11-08 17:05:06,2,2,928307403577286657
Now we find out that this #TaxPlan would raise the national debt by *at least* $1.7 trillion over the next ten years.http://thehill.com/policy/finance/359353-gop-tax-bill-would-add-17-trillion-to-debt-cbo …,2017-11-08 17:04:20,20,9,928307209594900482
"Happy to work with you. Safer roads = saving lives and preventing injuries, creating good jobs by making biz more efficient.https://twitter.com/RepLouBarletta/status/927997702092320768 …",2017-11-07 20:42:02,2,0,927999606960590848
Proud to join my colleagues to stand against #TaxPlan that would hurt #CT middle-class families.https://twitter.com/repjohnlarson/status/927695956073746433 …,2017-11-07 00:37:28,7,4,927696467413872640
"#CT appreciates your voice on this, Geno. We need to work together and stop this epidemic of mass shootings.https://twitter.com/GenoAjustsayin/status/927556856792453121 …",2017-11-06 21:52:56,26,10,927655061194407936
Heartsick once again with news from Texas. We cannot accept this as the new normal.http://www.cnn.com/2017/11/05/us/texas-church-shooting/index.html …,2017-11-06 00:21:36,40,20,927330086935842816
How's this for a Friday surprise: the administration agrees that climate change is driven by human activity!https://www.washingtonpost.com/news/energy-environment/wp/2017/11/03/trump-administration-releases-report-finds-no-convincing-alternative-explanation-for-climate-change/?utm_term=.fa745a79a3d0&wpisrc=al_news__alert-hse--alert-national&wpmk=1 …,2017-11-03 19:03:03,8,6,926525146642440192
The elimination of teachers' $250 tax deduction for classroom supplies is yet another failure of this #TaxPlan. Hurts middle class.,2017-11-03 14:15:33,7,5,926452792662876160
It's already outrageous that teachers have to use *their own money* for classroom supplies. We want to make them pay more?,2017-11-03 14:12:57,6,4,926452141815926784
"Right now, teachers get a small break on their taxes - $250 - to offset costs in the classroom. This plan takes that away.",2017-11-03 14:05:17,3,4,926450209680494594
Say you're an elementary school teacher in #CT who spends hundreds (if not thousands) of $ - your own money - for supplies every year.,2017-11-03 14:03:50,3,4,926449845182910464
Now we find out that this #TaxPlan would eliminate the tax break teachers receive to pay for classroom supplies.https://www.washingtonpost.com/news/education/wp/2017/11/02/teachers-spend-nearly-1000-a-year-on-supplies-under-the-gop-tax-bill-they-will-no-longer-get-a-tax-deduction/?utm_term=.08d4863f63d5 …,2017-11-03 14:01:21,12,15,926449220504227841
Orgullosa de unirme a ustedes y representar a la gente de Puerto Rico.https://twitter.com/RepGutierrez/status/926182511440474112 …,2017-11-02 20:41:57,1,1,926187647546134528
"So, no, I'm not happy with this tax proposal. I'm going to work with the Rs & Ds who are concerned. We'll fight this.",2017-11-02 20:02:33,15,2,926177731875950592
What's worse is that this is all being done to give even more money to those who've already done tremendously well in life. 3/,2017-11-02 19:54:51,7,3,926175794140938241
Let's call the plan to slash this deduction what it is: a middle-class tax increase. Terrible for our families. 2/,2017-11-02 19:52:44,10,3,926175259404972034
I've heard from senior citizens in CT who fear that they'll lose their homes without the state and local tax deduction. 1/,2017-11-02 19:50:38,16,6,926174733791649793
Spoke to fed’l officials at @TransportDems today to demand necessary aid to PR & USVI.https://youtu.be/n-gOlmgz_Xo ,2017-11-02 19:39:38,3,3,926171964552761344
He’d better be MVP! #AstrosvsDodgershttps://twitter.com/chrismurphyct/status/925937093326622721 …,2017-11-02 04:12:08,18,4,925938551304409088
All of New Britain is proud of George tonight.https://twitter.com/lenaspringer/status/925894173168893952 …,2017-11-02 02:32:23,39,9,925913449229565952
Our bill w/@RepBost to help veterans receiving disability benefits and their families was signed today!pic.twitter.com/ON8obRr2as,2017-11-01 22:20:04,17,1,925849950138830849
11/1 isn’t just the first day of the month—it’s also the first day of open enrollment. Get the facts here: http://www.accesshealthct.com/ pic.twitter.com/Npv8gOX6fF,2017-11-01 18:21:09,7,11,925789825839587328
We should *cut cut cut* this out and get to work on actual bipartisan tax reform.https://twitter.com/tarapalmeri/status/925764435989458944 …,2017-11-01 16:57:29,19,5,925768771687604225
Happy to join you and learn more about the work you’re doing!https://twitter.com/UTCpolicy/status/925710271141818368 …,2017-11-01 15:00:51,5,1,925739418723536896
Honored to welcome San Juan Mayor Carmen Yulín Cruz to hear about what we still need to do to help our fellow Americans in Puerto Rico.pic.twitter.com/jK5uuNwK4M,2017-11-01 14:22:13,38,9,925729694586109952
"Our space program creates good #CT jobs. Happy to join @UTC to discuss how Congress can help spark innovation, support suppliers.pic.twitter.com/h0AvjQfHaJ",2017-10-31 17:49:38,5,1,925419508138946560
A reminder that tomorrow is the start of Open Enrollment in #CT - runs from 11/1-12/22. Visit http://AccessHealthCT.com  to #GetCovered.pic.twitter.com/WVrfzfWCdq,2017-10-31 17:01:32,13,11,925407400198369282
We need to make smart & timely investments to rebuild Puerto Rico & USVI. Delayed action is a disservice to our fellow citizens.,2017-10-31 14:14:26,4,5,925365348572061697
In #Meriden at @La_Casa_Boricua to discuss the latest updates in Puerto Rico and the U.S. Virgin Islands.pic.twitter.com/LNoemCFsY7,2017-10-31 14:12:25,5,3,925364840780230661
I like to think @Byron31Jump's time as my intern walking/sprinting the Capitol hallways prepared him for this:http://www.espn.co.uk/nfl/recap?gameId=400951732 …,2017-10-30 20:49:21,2,2,925102347088531456
The independence of the Mueller investigation is of paramount importance and must be maintained. /2.,2017-10-30 15:24:15,18,3,925020533586046976
I have said before that the American people deserve to know the truth about Russia's attack on our democratic institutions. 1/https://twitter.com/thehill/status/924969518916603904 …,2017-10-30 15:22:46,25,11,925020160498503681
"Happy to join you in support of this bipartisan legislation to create jobs, upgrade our infrastructure.https://twitter.com/repcomstock/status/924008335300587522 …",2017-10-27 21:06:04,10,1,924019387639705600
Make sure you do what you need to do to #GetCovered!https://twitter.com/AccessHealthCT/status/923974838343094272 …,2017-10-27 18:11:43,3,7,923975512606769154
Office essentials for fall... #NationalPumpkinDaypic.twitter.com/mLYnzIra6O,2017-10-26 17:54:01,26,3,923608672160419841
"Introduced H.RES 587 to protect the SALT deduction for #CT families w/@jahimes, @RepJoeCourtney, @RepJohnLarson @rosadelauro #FairerTaxespic.twitter.com/SQQGEwOHRv",2017-10-26 17:39:04,8,4,923604908095475712
"It's not just about funds, either - @HHS, @DHSgov, @DEAHQ need solid leadership in key posts now before opioids take more of our loved ones.",2017-10-26 17:10:06,3,4,923597616767819777
"The @HHS public health fund has $57,000 in it right now. That's it. Grossly inadequate for an epidemic claiming lives daily.",2017-10-26 17:07:20,6,1,923596924053348352
"Sent letter to @POTUS today on #opioidepidemic declaration: if we're serious about treatment and prevention, let's fully fund our response.pic.twitter.com/Q1LKdPULPc",2017-10-26 17:02:21,68,21,923595666710061056
"Thank you! Republicans and Democrats agree that support for our manufacturers, investment in infrastructure = common sense. #TimeToBuildhttps://twitter.com/ShopFloorNAM/status/923242646314811392 …",2017-10-25 17:46:39,6,2,923244430492160000
We've also received the support of engineers and experts who understand the link between infrastructure & jobs. #TimeToBuildpic.twitter.com/e7huAbAaU5,2017-10-25 17:08:54,2,1,923234929781170176
Labor leaders like @AFLCIO's @RichardTrumka agree: infrastructure is about putting Americans back to work. #TimeToBuildpic.twitter.com/hveVOGgcwJ,2017-10-25 17:05:48,5,0,923234150127230977
"Our bipartisan Infrastructure Caucus is supported by leading business organizations like @USChamber, who know it's #TimeToBuild for jobs.pic.twitter.com/emL1YpCHHB",2017-10-25 17:04:02,4,3,923233705300242433
#CT needs to upgrade its infrastructure to create jobs: 338 bridges are currently classified as structurally deficient. #TimeToBuild,2017-10-25 17:02:20,2,2,923233276818591755
"Joining @RepSeanMaloney, @RepGarretGraves, @RepJohnDuncanJr to announce the formation of the bipartisan Congressional Infrastructure Caucus.",2017-10-25 17:01:15,17,5,923233002578153472
"Instead of punishing families who deduct their state & local taxes each year, let's focus on encouraging companies to create more #CT jobs.",2017-10-25 14:51:03,2,1,923200235937193985
"Close to half (41%) of Connecticut filers claim the SALT deduction. We should reform our tax code, but not in a way that hurts workers.",2017-10-25 14:47:49,2,1,923199423999553536
Read this morning's @hartfordcourant article on the state & local tax deduction:http://www.courant.com/politics/hc-pol-trump-budget-tax-deductions-20171024-story.html …,2017-10-25 14:45:23,2,2,923198812021239808
Eliminating SALT would be devastating to CT families & communities who depend on these deductions.http://www.ctpost.com/local/article/Trump-adviser-defends-proposed-SALT-cut-12296167.php …,2017-10-24 23:00:03,9,6,922960908514574336
Incredible display of community at the Newtown Savings Bank grand opening last week.https://newtownbee.com/newtown-savings-bank-hosts-grand-opening-ribbon-cutting/ …,2017-10-24 21:52:39,4,2,922943949194563584
It's Breast Cancer Awareness Month - a good time to remember the importance of women's healthcare & medical research!pic.twitter.com/KcqwgeunCO,2017-10-24 18:42:41,17,2,922896140420419584
