Text,Date,Favorites,Retweets,Tweet ID
Ecstatic to be elected Vice Ranking Member of the Transportation Committee! Let's get to work rebuilding America! @Transport @TransportDemspic.twitter.com/RlILomrSSY,2017-01-24 19:51:40,46,7,823981615042928640
"This is a problem. Directly at odds with what @POTUS has promised, and clearly against the public interest. #ACAhttp://www.politico.com/story/2017/01/tom-price-confirmation-hearing-health-human-services-234094 …",2017-01-24 19:06:54,17,13,823970349066944516
#TrumpGlobalGag is a travesty. Banning abortion won't stop it from happening but it'll make abortion more dangerous.http://www.vox.com/identities/2017/1/23/14356582/trump-global-gag-rule-abortion …,2017-01-23 23:49:43,29,9,823679132303323136
"Tip: If you're interviewing with @ravingryan1, come prepared! Such insightful questions, & he's just 14. Watch here:https://youtu.be/IYgq3bVHzzQ ",2017-01-23 18:30:19,3,0,823598753441607681
"44 years ago, #RoevWade made reproductive freedom the law of the land. Yesterday, millions of us took to the streets to say: #WeWontGoBack.pic.twitter.com/y3fdcCZ0iX",2017-01-22 23:23:35,2619,727,823310168352026624
"Before #RoeVWade, seeking an abortion was often a terrifying ordeal that many women didn't survive. #WeWontGoBack.http://www.huffingtonpost.com/entry/heres-how-crazy-it-was-to-get-an-abortion-pre-roe-v-wade_us_569ff124e4b0404eb8f00a7c …",2017-01-22 23:18:17,45,30,823308837381931008
What a day! Wonderful to see my good friend and great gun-violence-prevention activist Lucia McBath! #WomensMarch #NoMoreSilencepic.twitter.com/Fj37iDGKRq,2017-01-21 21:58:08,76,10,822926278135320576
Welcoming the masses of #WomensMarch advocates in D.C.! The T & I room has never been so colorful - or so female.pic.twitter.com/eJzUzOmpRa,2017-01-21 19:49:51,45,14,822893995856723968
American democracy in action. It's an amazing thing. #WomensMarchpic.twitter.com/gqKK5IpFXI,2017-01-21 17:09:16,84,38,822853583397933057
Beautiful day for a march. Make your voice heard! #WomensMarch #democracypic.twitter.com/t49faxlVjJ,2017-01-21 15:03:48,62,13,822822005892386816
11/ It is time for us to put country first. [end] #InaugurationDay2017,2017-01-20 20:28:17,5,1,822541278101602305
10/ There is so much good and important work that the American people are counting on ALL their elected officials to do together.,2017-01-20 20:27:55,3,0,822541188171497473
"9/ If @POTUS is truly committed to tackling these and other problems in a bipartisan way, then I stand ready to work with him.",2017-01-20 20:26:34,6,0,822540847912783874
"8/ Let today be the day @POTUS starts working in bipartisan way to improve infrastructure, support our veterans & promote US manufacturing.",2017-01-20 20:26:14,9,0,822540761388433409
7/ Let today be the day @POTUS leads his party away from the shameful political crusade against Americans’ health coverage. #ProtectOurCare,2017-01-20 20:24:44,9,0,822540383611748352
6/ Let today be the day @POTUS drops his reckless assault on US intel agencies & stands up for America’s security & leadership in the world.,2017-01-20 20:24:07,12,0,822540228627988481
Let today be the day @POTUS swears off Twitter feuds & starts reaching out to Americans from all walks of life in search of common ground,2017-01-20 20:23:13,16,1,822540002785640451
"4/ When fulfilling that mission means opposing @POTUS, I will be as loud & forceful as I need to be in defense of our American values.",2017-01-20 20:22:18,9,1,822539773504065536
"3/ When fulfilling that mission means working with @POTUS, I will work with him.",2017-01-20 20:21:47,5,0,822539642583089152
2/ My mission is to find solutions to the problems facing the people of CT-5. I believe in that mission & I’m more committed to it than ever,2017-01-20 20:21:22,13,0,822539537440247813
1/ @realDonaldTrump was officially sworn in as our nation's 45th President. I wanted to share some thoughts on the road ahead. #Inauguration,2017-01-20 20:20:43,7,0,822539374051069953
"To: @realDonaldTrump
From: America's women

We are watching. http://wpo.st/oskS2 
#ProtectOurCare #StandWithPP #WomenAreWatching",2017-01-19 15:30:04,8,1,822103840082239488
Great visit to CT Tools & Manufacturing. Terrific company investing in CT's talent & workforce. http://www.myrecordjournal.com/news/plainvillecitizen/plainvillenews/9863735-154/congresswoman-esty-tours-plainville-manufacturing-facility.html …,2017-01-18 21:54:08,4,1,821838107356053506
Immigration reform is a vital but difficult topic & I appreciate all who came to share their story w/ me in #Meridenhttp://www.registercitizen.com/government-and-politics/20170117/us-rep-esty-convenes-meriden-discussion-on-immigration-reform-ahead-of-trump-inauguration …,2017-01-18 21:30:45,3,1,821832224647614464
Betsy DeVos' baffling answer to @ChrisMurphyCT's question about gun violence suggests she's given the issue no serious thought. Horrifying.,2017-01-18 18:34:43,45,18,821787923452461069
"Delicious ""nutty"" salad at Cafe Dolce in Meriden!pic.twitter.com/gf2XXvxziD",2017-01-17 18:18:43,10,2,821421506827874304
Thanks to New Britain civil rights hero Alton Brooks for joining us to mark #MLKDAYpic.twitter.com/cjgrklfQN4,2017-01-16 15:56:18,19,4,821023281469882368
Roberto brought down the house this morning!pic.twitter.com/ONV44NjvAH,2017-01-16 15:48:24,5,1,821021292916867073
Our two youngest and very impressive speakers at the #MLKDAY New Britain breakfast. Inspiring way to kick off the day!pic.twitter.com/uDjvoce6CZ,2017-01-16 15:19:16,14,5,821013959478231040
Today let's not only reflect on the legacy of Martin Luther King; let's act on his legacy by working for social & economic justice. #MLKDAYpic.twitter.com/4sW6HXnCQ2,2017-01-16 15:16:46,28,11,821013331398066176
"Another message for Congress from our rally for health care today in Hartford:

Protect Medicare. @SpeakerRyan @HouseGOPpic.twitter.com/Do5OyKI5Xy",2017-01-15 19:43:13,29,12,820717997551742976
"Proud to stand with Ben, who, through his work with #Medicaid, helps people get health insurance made possible by the #ACA.pic.twitter.com/HXFS8gNi2H",2017-01-15 19:37:53,14,3,820716653570850816
"Let's be real. There is no ""replace"" in @HouseGOP's #ACA plan. It's repeal-and-then-hope-something-great-falls-from-the-sky. #protectourcarepic.twitter.com/97SQIjmD3R",2017-01-15 19:11:13,38,22,820709945289142272
"Danny from #Meriden: ""My life is on the line, and they're making it up as they go along. I can't accept that."" He speaks for millions. #ACApic.twitter.com/Vd7ljfNFts",2017-01-15 18:39:57,104,61,820702077194215425
Chants of #ACA in Hartford. Story after story from folks who fear @housegop is sacrificing their future to service a political crusade.pic.twitter.com/8OdvlrdEu6,2017-01-15 18:22:29,440,213,820697679713931265
Huge group in Hartford today with a message for @HouseGOP: Save our health care. Drop the gutless political crusade against the #ACA.pic.twitter.com/DKSKRg9LLG,2017-01-15 18:13:25,156,97,820695400181075969
.@repjohnlewis's actions changed the course of history. His courage and decency are above reproach.,2017-01-14 16:41:51,167,63,820309967236460544
House Republicans just voted to rob 30M Americans of health care. Their vote is a national disgrace. But we're not giving up #ProtectOurCarepic.twitter.com/URTHIufM2q,2017-01-13 20:47:26,95,63,820009381983125507
A sobering reminder that our nation MUST do more to repay those who risk their lives in our defense.http://www.wsj.com/articles/the-man-who-redeems-lost-veterans-1484320709 …,2017-01-13 17:01:45,4,1,819952589131411457
Proud to be from the same state as these three extraordinary women! #ConnecticutStrong #ProudNutmeggerhttp://www.registercitizen.com/general-news/20170111/3-to-be-inducted-in-connecticut-womens-hall-of-fame …,2017-01-12 17:56:34,4,0,819603994511339520
Congrats to Larry Rifkin on his last day hosting @1talkofthetown! Thank you for having me on today! So many terrific convos over the years.,2017-01-12 16:06:09,0,0,819576207645741060
"Happy birthday, Alexander Hamilton! A great American who brought us the Federalist Papers, an amazing musical, & the modern banking system.pic.twitter.com/RAQuzSIXhP",2017-01-12 03:41:43,20,7,819388864271945728
"In CT, 43,000 kids stand to lose health coverage if #ACA is repealed. I ask my colleagues: Imagine you're the parent of one of those kids.pic.twitter.com/HwCs5zJzY1",2017-01-11 23:03:50,89,71,819318932456742912
"You may ask, why do we need a bill to support women in the sciences? It's an economic imperative. Here's why.https://www.youtube.com/watch?v=vdgLl5FPxDQ&feature=youtu.be …",2017-01-11 16:15:03,7,0,819216058498371585
"A fitting, extraordinary farewell. #ThanksObama.pic.twitter.com/qs0q1jpWFw",2017-01-11 03:05:18,52,10,819017313353601024
President Obama makes the case for science and facts as core to what we believe and stand for as Americans. #FarewellObamapic.twitter.com/gYXwXgUCyH,2017-01-11 02:33:43,23,10,819009364740702208
"Seriously, #ThanksObama. Your courage, optimism, and leadership have given our nation so very much to be proud of. https://www.whitehouse.gov/Farewell ",2017-01-11 02:01:56,49,21,819001365414498304
Proud to pass my first 2 bills of 2017 today w/ @RepComstock! Promoting Women in Entrepreneurship Act & INSPIRE Women Act. #Bipartisanshippic.twitter.com/8jktHgQD1f,2017-01-10 22:25:37,40,11,818946927823884288
"""I will lose my home and/or I will die,"" said Gaye Hyre, a breast cancer survivor.http://www.courant.com/politics/hc-connecticut-obamacare-repeal-reaction-20170109-story.html …",2017-01-09 22:50:37,8,13,818590832353628160
"Happy birthday, CT! Connecticut was admitted as the 5th state in the Union 229 years ago today. #TodayInHistory #ProudNutmeggerpic.twitter.com/3t6WBnKx76",2017-01-09 20:52:13,29,21,818561034671837184
This is a myth. Congress is covered by the #ACA. It's shameful that myth is being used to justify taking health care away from millions.https://twitter.com/TwBaran/status/818499580966961154 …,2017-01-09 16:50:30,27,14,818500205880475650
The political consequences of the #ACA repeal are nothing compared to human cost: loss of health care for millions of kids & families.,2017-01-09 16:48:01,18,5,818499580237152256
"This is Gaye Hyre, a cancer survivor who won't be able to get health coverage if #ACA is repealed. @housegop, don't #MakeAmericaSickAgain.pic.twitter.com/BPYPpmnDqS",2017-01-09 16:45:23,15,9,818498917616746498
Great read in @TheAtlantic that highlights the growing importance of advanced manufacturing in the US economy:https://www.theatlantic.com/business/archive/2017/01/america-is-still-making-things/512282/ …,2017-01-06 22:45:00,9,1,817502255523962882
Heartbroken for the people lost in #FortLauderdale. Grateful for the fast work of 1st responders & praying the injured have a swift recovery,2017-01-06 21:31:33,45,14,817483769338793990
"Planned Parenthood is largest provider of health services to women. That means breast exams, pap tests, cancer screenings. #ProtectOurCare",2017-01-05 22:18:54,236,188,817133300020027392
I grew up in a town where many young women had no access to basic reproductive health care. @HouseGOP must not take America down this road.,2017-01-05 22:16:59,21,4,817132814755917825
"Stripping Planned Parenthood of funding would be a shameful, partisan attack on women's health. RT if you'll fight hard to #ProtectOurCare.",2017-01-05 22:15:22,191,246,817132410252959745
Ripping health coverage from millions & replacing it with ????? is a recipe for disaster. Health care is too serious to make it up as we go.,2017-01-05 18:58:34,20,10,817082880769789953
"Repealing ACA will mean skyrocketing costs for working families, but big tax breaks for corporations. #MakeAmericaASickAgain #Draintheswamp",2017-01-05 18:54:30,10,7,817081860324990980
People should always come before politics. Repealing #ACA would harm millions of Americans. A disastrous plan to #MakeAmericaSickAgain.pic.twitter.com/gE1G7ZXGUT,2017-01-05 18:35:10,19,17,817076994546565122
Ignoring the science behind #gunviolence has deadly consequences. Time for Congress to act. #HonorWithActionhttp://www.newstimes.com/local/article/Yale-study-confirms-gun-violence-is-contagious-10834544.php …,2017-01-05 16:16:59,5,4,817042216732524545
"Thankful no one was killed, but crashes occur too often. We have to get serious about train safety, incl use of PTC.http://www.npr.org/sections/thetwo-way/2017/01/04/508200568/more-than-100-people-injured-in-new-york-train-crash …",2017-01-04 19:58:34,0,1,816735596072857600
An inspiring start to 2017: Meeting with @GabbyGiffords and @ShuttleCDRKelly on how we can #honorwithaction & save lives from #gunviolence.pic.twitter.com/USheVBpVi7,2017-01-04 17:37:14,38,5,816700024797200387
We have to do better.https://twitter.com/SUPGVNetwork/status/816283238285135872 …,2017-01-04 17:04:12,11,7,816691712877850624
Wanted to take a moment to say how grateful I am to serve central & northwest CT in Congress these next two years. Let's get to work!pic.twitter.com/0bmnTJXVvL,2017-01-03 23:43:08,23,6,816429721458274304
"Proud to stand up for the Constitution with @repjohnlewis, a true hero. When he's on your side, you can bet history is, too.pic.twitter.com/drqLepirjT",2017-01-03 22:21:40,48,13,816409219100459008
Proud to serve alongside these incredible colleagues in the 115th Congress! #floorphotography #nomoresilencepic.twitter.com/YXjRNIBTWd,2017-01-03 19:01:55,14,1,816358949423316992
The power of a public outcry. Never doubt that your voice matters. #ethicsmatterhttp://www.politico.com/story/2017/01/gop-congress-ethics-office-233123 …,2017-01-03 17:29:33,86,66,816335703281909761
Do ANY of our constituents want less ethics oversight in Congress? This move incentivizes corruption and betrays public trust. Disgraceful.,2017-01-03 15:27:44,27,7,816305050041589760
I intend to.,2017-01-03 15:21:56,1,0,816303589438136320
This attempt to gut ethics oversight in Congress is unconscionable. I hope PE Trump's disapproval persuades @HouseGOP to do the right thing.https://twitter.com/realDonaldTrump/status/816298944456232960 …,2017-01-03 15:21:10,10,3,816303395443183620
This attack on civilians based on their religion is horrifying. We must stand against terrorism wherever it occurs.http://mobile.nytimes.com/2017/01/02/world/europe/istanbul-nightclub-attack.html?0p19G=c …,2017-01-02 22:02:23,7,3,816041976881618949
"Russia's actions are a serious, ongoing security threat. We can't let politics stop us from protecting ourselves.https://www.washingtonpost.com/world/national-security/russian-hackers-penetrated-us-electricity-grid-through-a-utility-in-vermont/2016/12/30/8fc90cc4-ceec-11e6-b8a2-8c2a61b0436f_story.html?utm_term=.43b6490cc70b …",2016-12-31 17:16:28,13,6,815245248418807808
".@SpeakerRyan, 7 children EACH DAY die from gunshots. If the House would take action to prevent this violence, sit-in wouldn't have occurred",2016-12-27 21:09:48,18,13,813854416256307200
".@SpeakerRyan should be focused on preventing gun violence, not on silencing those who stand up to the gun lobby.https://www.bloomberg.com/politics/articles/2016-12-24/ryan-proposes-fines-ethics-moves-on-grandstanding-house-members …",2016-12-27 21:04:34,61,54,813853100075347969
"The hit of Christmas - Thinking Putty, which Sarah used to make a Goldfinger hand.pic.twitter.com/YCDSNSB108",2016-12-25 16:38:19,4,1,813061319054200837
And enjoyed a communal viewing of the Maccabeats version of Hamilton!pic.twitter.com/yN1SlXEvyD,2016-12-24 23:59:08,6,0,812809867547250692
Lighting the candle for the first night of Hanukkahpic.twitter.com/57fMYSuTja,2016-12-24 23:58:10,12,4,812809626257424389
Gingerbread cookie decorating for the cousins!pic.twitter.com/b5YXxJnkb9,2016-12-24 20:46:58,9,1,812761507045974016
"To progress as a country, we need to keep politics out of science & a bipartisan approach to issues like climate change, STEM ed. & beyond.https://twitter.com/Gizmodo/status/812339671934140416 …",2016-12-23 18:41:44,12,9,812367605168279554
"Proud to join women entrepreneurs & educators in #Meriden last week to discuss STEM education. When we invest in our women, we see progress.pic.twitter.com/Iakk46HqiR",2016-12-23 15:59:17,17,9,812326723966631937
Manuel Zaldivar is the type of teacher I aspire to see in classrooms across the country. http://www.centralctcommunications.com/newbritainherald/article_7f6af758-c72a-11e6-bb39-fb2d907ffe02.html …,2016-12-22 22:00:00,4,2,812055113246343168
Had a great day yesterday visiting shops along Main Street in #Danbury. Small businesses are vital to our economy.http://www.newstimes.com/business/article/Esty-tours-small-businesses-on-Main-Street-in-10811250.php …,2016-12-22 20:22:07,7,0,812030476336660482
Wonderful to have the kids home so we can trim the tree!pic.twitter.com/iNCeQw70CM,2016-12-22 04:31:43,8,2,811791304061517825
"There are challenges ahead, but our mission is clear: Fight for the future of every single child.http://wnpr.org/post/rep-elizabeth-esty-urges-more-support-children-wake-trump-election …",2016-12-21 22:13:48,6,4,811696196607541248
Hi Erin- I strongly support & have called for an investigation into Russia's actions:https://esty.house.gov/media-center/press-releases/esty-calls-full-investigation-russian-interference-us-elections …,2016-12-21 21:58:33,1,0,811692357175287809
A woman's personal health care decisions should be between her and her doctor. Period. #BeBoldEndHydehttps://www.buzzfeed.com/emaoconnor/house-democrats-ask-trump-to-eliminate-hyde?utm_term=.yyNowM4NL4#.ejle69v80v …,2016-12-21 17:11:19,28,20,811620075673387010
"2016 was a trying year, but I'm proud to report important victories for the people of CT. It's an honor serving these families in Congress.pic.twitter.com/vbU0tCetqp",2016-12-20 19:59:00,16,3,811299883332337664
"Saddened to hear about the passing of Charles Barlow, #NewMilford's own incredible historian.http://www.newstimes.com/local/article/New-Milford-historian-Charles-Barlow-dies-10806957.php …",2016-12-20 19:07:09,1,1,811286836345708544
Great talking w/ @bpshow about the resilience of the #SandyHook families & the future of the gun safety movement. https://youtu.be/7vBQbUrZ1vA ,2016-12-20 17:32:04,3,4,811262909355589633
"Always great to see Waterbury's and America's Teacher of the Year, @JahanaHayes!pic.twitter.com/S3W3fYui80",2016-12-19 22:57:27,12,3,810982403925688320
Here's my statement from Monday calling for a full investigation:https://esty.house.gov/media-center/press-releases/esty-calls-full-investigation-russian-interference-us-elections …,2016-12-17 02:41:02,1,1,809951509601517569
I’m committed to finding long-term solutions for our nation’s opioid epidemic. One life lost is one too many.http://www.registercitizen.com/health/20161213/esty-blumethal-discuss-opiate-addiction-with-local-stakeholders …,2016-12-16 19:46:44,5,1,809847246120505344
Important! You now have until Saturday to enroll in health coverage for next year>>>https://twitter.com/accesshealthct/status/809460546995109888 …,2016-12-15 20:21:51,2,2,809493696890683396
"As a mom, I'm so grateful for @MomsDemand. They work hard each day to protect us from gun violence. It's changing the world. #KeepGoing",2016-12-15 19:20:13,23,8,809478186522255364
".@RepDonBeyer: It's deeply immoral that in the course of a normal American lifespan, more than 2 million Americans die from gun violence.pic.twitter.com/c4gUAFyEZK",2016-12-15 16:04:48,45,25,809429007062224896
".@ChrisVanHollen: ""We don't know if it will be next week or next month, but we will win this battle."" #EndGunViolencepic.twitter.com/Vjhvz1t2xR",2016-12-15 15:59:36,27,8,809427699735392256
".@NewtownAction's Po Murray: ""We will outshout the gun lobby."" Yes, we will. #HonorWithActionpic.twitter.com/vk1rEiA65C",2016-12-15 15:33:40,22,15,809421174413422592
Folks from across the country are at the Capitol today demanding action to #EndGunViolence. Watch live here:https://m.youtube.com/watch?feature=youtu.be&v=Ga0t7xYsYzY …,2016-12-15 15:06:30,17,10,809414335445528576
"We have many car safety laws (seatbelts, licenses, speed limits). They've saved many lives. If only Congress took gun safety as seriously.https://twitter.com/stemmy54/status/809382201297137664 …",2016-12-15 14:06:42,27,7,809399286744150016
Going live on @bpshow in a couple minutes to discuss the road ahead on gun violence prevention in the next Congress. #HonorWithActionpic.twitter.com/wCUSPoD2kt,2016-12-15 13:02:57,6,2,809383243061592065
.@MartinOMalley: We can't let grief crush is. We must transform it into action. #SandyHook #4yearspic.twitter.com/LWBMEGFxax,2016-12-15 00:26:25,15,5,809192857093472265
".@vj44: ""I will never forget the tears of grief streaming down President Obama's face"" after #SandyHook.pic.twitter.com/HKCriTwhcr",2016-12-15 00:15:02,18,8,809189992664858633
Suicide attempts carried out w/ a firearm are by likeliest to result in death:http://www.usatoday.com/story/news/nation/2013/07/21/guns-most-deadly-choice-in-suicide-attempts/2572097/ …,2016-12-14 22:14:06,1,0,809159555276013568
many accidental shootings & gun suicides could be prevented with sensible gun laws. Homicides aren't only issue.,2016-12-14 21:52:44,28,4,809154179084197888
Thank you Don for being a strong champion of commonsense reform. My neighbors in Newtown truly appreciate your leadership. #HonorWithActionhttps://twitter.com/RepDonBeyer/status/809088904334819328 …,2016-12-14 17:41:34,73,22,809090970587234304
"The pain in #SandyHook was unimaginable. But every day, more families experience the agony of losing a child to gun violence. We must act.",2016-12-14 16:39:03,147,87,809075238923276288
"In America, we should be able to attend school, see a movie, go dancing, & worship without fear of being gunned down. #HonorWithAction",2016-12-14 16:26:21,65,31,809072042846851072
The gun violence epidemic is a test of Congress's courage - of its basic effectiveness. We cannot be silent. We must act. #EndGunViolence,2016-12-14 16:14:30,107,56,809069059803348992
"In the 4 years since #SandyHook, 130,000 Americans have died from gun violence. I don't accept that that's normal. #HonorWithAction",2016-12-14 16:11:24,56,54,809068282531692546
"Four years later, we won’t be silent and we won’t give up. It’s time to #EndGunViolence. #SandyHook #HonorWithActionpic.twitter.com/E9FDIJQSpt",2016-12-14 15:57:50,52,47,809064864798953474
"Today we grieve for the 26 precious children and educators killed at Sandy Hook, and we pledge to #HonorWithAction.https://www.youtube.com/watch?v=hN4JTVKn_fA&feature=youtu.be …",2016-12-14 14:10:54,112,77,809037957164318720
"Over 400,000 Americans have been killed or injured by guns since Sandy Hook. #HonorWithAction to #EndGunViolence.http://thndr.me/QdPtW0 ",2016-12-14 14:01:05,7,8,809035486543093760
Very pleased we could help this talented young woman complete her medical training and keep her family together.http://danbury.dailyvoice.com/politics/esty-helps-medical-student-renew-visa-to-finish-danbury-residency-program/691358/ …,2016-12-13 18:44:45,3,1,808744486192971777
"In the face of tragedy, the people of Newtown responded with love. Yesterday folks across CT followed their example.http://www.courant.com/community/new-britain/hc-new-britain-week-of-kindness-1213-20161212-story.html …",2016-12-13 17:44:04,16,9,808729213188636673
Final #DayOfKindess stop: making dinner for folks at @svdpmission in Waterburypic.twitter.com/9mB72QklJm,2016-12-12 22:27:31,9,0,808438159323316224
"We cannot let Russia's assault on our democracy go unanswered. This is a serious security threat requiring a serious, bipartisan response.pic.twitter.com/w8hJRYj0EC",2016-12-12 21:14:01,48,20,808419659477303296
Thanking our brave police officers and first responders in #Torrington. #DayOfKindnesspic.twitter.com/C71F8w2jmU,2016-12-12 20:54:27,3,0,808414735863607296
So great to visit w/ student veterans at Tunxis Community College. Thank you for your service! #DayOfKindnesspic.twitter.com/MZE8mN9iH7,2016-12-12 19:07:42,0,0,808387872319557636
Reading with preschoolers at the YWCA in New Britain. (I'm an enthusiastic narrator!) #DayofKindnesspic.twitter.com/Kfk2Bi1GBC,2016-12-12 15:56:49,5,1,808339834427338752
"Today I'll be reading w/ preschoolers, visiting student veterans, thanking police officers in Torrington, & serving dinner at a shelter.",2016-12-12 15:35:48,8,1,808334546567593984
"Every December, we dedicate a day to acts of service in remembrance of the tragedy at Sandy Hook. Our community chooses love.",2016-12-12 15:33:56,9,6,808334076650409984
Kicking off #ActsOfKindness with @ChrisMurphyCT and @SenBlumenthal at the New Britain YWCA. Spending the day giving back to the community.pic.twitter.com/MTXnp1xevw,2016-12-12 15:31:21,2,0,808333425719595008
Surprised these students at Kaynor Tech in #Waterbury today to let them know they'd won the Congressional App Contest! #ComputerScienceWeekpic.twitter.com/jp4SB5jGHr,2016-12-09 22:11:07,5,1,807346865272459264
"John Glenn was a pioneer, an American icon, a loving dad, a beloved husband, a patriot, and a public servant.http://www.dispatch.com/content/stories/local/2016/12/john-glenn/john-glenn.html …",2016-12-08 21:44:48,14,1,806977854567223296
No one wants their identity stolen. Check out these tips on how you can protect yourself: https://www.irs.gov/uac/irs-security-awareness-tax-tips … #TaxSecurityAwarenessWeek,2016-12-08 19:56:35,1,0,806950623027433472
"An incredible evening with inspiring tales of perseverance, hard work, and the power of a positive attitude. http://www.newstimes.com/local/article/Latino-Leadership-Academy-nurtures-activism-10778804.php …pic.twitter.com/xV2dSG4Sbv",2016-12-08 15:28:23,3,1,806883126093955072
