Text,Date,Favorites,Retweets,Tweet ID
"On #WorldAidsDay, we’ve never been closer to ending this crisis. But we must continue to invest in finding a cure!pic.twitter.com/Z8Ov1aYT75",2015-12-01 16:58:19,3,2,671735086216290305
Proud to cosponsor the bipartisan Amateur Radio Parity Act and support the future of telecommunications.https://twitter.com/njvfc123/status/671132663856668672 …,2015-11-30 20:25:16,2,0,671424777484181504
"#OTD in '93, Pres. Clinton signed the bipartisan Brady bill, requiring background checks for gun purchases. NOW, let’s close the loopholes!",2015-11-30 17:08:06,7,5,671375161417965568
Buying American-made products in #Cheshire to celebrate #SmallBizSat. Join me & stay #LoyalToLocal & #ShopSmallpic.twitter.com/rcoE8rewCZ,2015-11-28 16:30:08,6,3,670640828281319426
"On Sat., 12/5, join me for a “Congress on your Corner” @ Five Points Gallery, 33 Main St, Torrington from 1-2:30 PMpic.twitter.com/kSRp9YGqry",2015-11-28 14:00:06,2,1,670603074658897921
"When tragedy strikes one of our communities, it hurts us all. Praying for our friends and law enforcement officials in Colorado Springs.",2015-11-28 13:50:48,3,0,670600731511103488
"Thanksgiving is one of my favorite holidays, and I cherish every tradition and moment I have with my… https://instagram.com/p/-j83p9mgnV/ ",2015-11-26 20:38:46,4,1,669978626817982464
"Good morning, #Waterbury. I'll be on with @1talkofthetown at 11:15AM. Listen live: http://watr.com/ ",2015-11-25 13:41:10,1,0,669511145108201472
Thank you to the #Wolcott Food Pantry for its work to end hunger & lending a helping hand to those in need.pic.twitter.com/v75px33Ojp,2015-11-25 13:30:12,0,0,669508384958214144
Programs like #MealsonWheels are vital to keeping seniors healthy. Great time delivering warm meals in #Wolcott.pic.twitter.com/Tsn18qA2GD,2015-11-24 17:59:37,15,12,669213796381126660
Let’s expand @DeptVetAffairs training programs to produce more mental health professionals:http://federalnewsradio.com/legislation/2015/11/house-lawmaker-joins-effort-improve-va-health-care/ …,2015-11-24 13:02:03,1,3,669138911206109184
Proud to have introduced an amendment to ensure milk is moved quickly and safely. Read more: http://www.rep-am.com/news/local/923118.txt …pic.twitter.com/PEEBTopecI,2015-11-23 21:33:12,2,1,668905158475124737
Thanks to all 50 applicants! It is an honor to nominate young men and women to our U.S. Service Academies.pic.twitter.com/Z774G0ADNw,2015-11-23 17:29:41,4,0,668843878225723392
Proud the @EnergyDems advanced our bill to protect the Farmington River and Salmon Brook. http://1.usa.gov/1la2n1P ,2015-11-21 13:00:15,1,0,668051298080526336
"Great launch of this year's ""It's a Hand Up, Not a Handout."" @UnitedWayofGWpic.twitter.com/9XJblhrOyv",2015-11-21 01:17:04,6,3,667874334606774273
Ensuring our national security&safety is my greatest responsibility. Additional info on the resettlement of refugees http://1.usa.gov/1PF0yHg ,2015-11-20 22:50:20,0,1,667837408688386050
"When we talk about the safety & equality for women, we must include ALL women in the conversation #equality4trans.pic.twitter.com/ziWXvuv0Th",2015-11-20 18:30:05,2,1,667771914262188032
"#TBT to our last year's #CAC. This year, let's get creative and get working. Apply today! http://1.usa.gov/1OSDC7a pic.twitter.com/KAVCJnXihE",2015-11-19 18:17:04,1,0,667406251920375809
"During #AmericanEducationWeek, we celebrate those who work hard to ensure every child receives a quality education.pic.twitter.com/b18XqtdtUn",2015-11-18 18:01:58,1,0,667040063918878720
"Pleased the House advanced bills I coauthored to bring home unclaimed veteran remains & honor Guard, Reserve members http://1.usa.gov/1SASnJI ",2015-11-17 19:42:51,3,0,666703062686396417
Barriers to voting are unacceptable! All voices must be heard. #RestorationTuesday #RestoreTheVOTEpic.twitter.com/0HOk5PcROx,2015-11-17 18:02:08,2,1,666677717157343232
Proud to score 100% on @FPAction's Food Policy Scorecard! See all the scores here: http://fpa.ac/Scorecard  #votefoodpic.twitter.com/bQgaiQdoUY,2015-11-17 15:36:02,2,3,666640950622560256
Those who put their lives on the line to protect this great nation deserve the very best our system can provide: http://1.usa.gov/1WWsKd0 ,2015-11-17 13:01:05,7,5,666601955838459904
Joined @RepRubenGallego in introducing a bill to improve health care services for our #veterans: http://1.usa.gov/1WWsKd0 ,2015-11-17 13:00:17,11,11,666601753463250945
Met with leaders from @NorcomMortgage in #Avon. Pleased to learn of their tremendous growth in past 5 yrs.pic.twitter.com/PAxIH6zrzY,2015-11-16 22:05:41,1,0,666376621893529600
Our hearts and prayers will continue to be with the French people as they seek to move forward in the wake of such horrific attacks.,2015-11-14 12:52:48,4,1,665512705776877568
"Let’s let women—not politicians—make the decision when it comes to their privacy, their bodies, & their autonomy. #StopTheSham",2015-11-13 21:07:54,12,4,665274912580456448
There are resources available that our #veterans don’t know about that provide more skills and better engagement: http://www.myrecordjournal.com/meriden/meridennews/7984217-129/meriden-veteran-goes-from-military-service-to-entrepreneurship.html …,2015-11-13 18:05:00,0,1,665228886939144192
It's time we see action on stricter gun & safety measures. That's why I asked the @WhiteHouse to take action today:http://www.huffingtonpost.com/entry/obama-gun-safety-executive-action_5643b5a1e4b08cda348754fb?c3ow29 …,2015-11-12 20:47:56,13,9,664907500064514049
Let's bring care to all veterans! Read my op-ed with @RepRyanCostello:http://thehill.com/blogs/congress-blog/homeland-security/259678-bring-care-to-all-veterans …,2015-11-11 17:15:24,0,1,664491629600972800
Honoring our veterans and military families in #Waterbury. Happy Veterans Day!pic.twitter.com/1yNMDhG7Jx,2015-11-11 17:06:51,1,0,664489478548021248
"On Veterans Day, we thank our veterans for their selflessness, and commit to do what we can: http://1.usa.gov/1PCgSXM pic.twitter.com/hbhGcY3tjX",2015-11-11 14:35:37,2,2,664451417571254272
"Happy 240th Birthday, @USMC! Today, we reflect on our courageous Marines who sacrifice so much for our great nation.",2015-11-10 15:34:07,1,6,664103753000337408
Made sure I received my annual flu shot #Flublok from Meriden-based Protein Sciences. #vaxwithmepic.twitter.com/8hgDYX6laW,2015-11-06 16:50:46,5,3,662673489950810113
"After hearing from #CT dairy farmers, I proposed an amendment to change the classification of milk.pic.twitter.com/CcDXrNlHjC",2015-11-05 18:48:03,1,0,662340615783505920
"Pleased the House advanced a long-term, bipartisan infrastructure bill that includes multiple solutions I proposed: http://1.usa.gov/1QgLCxW ",2015-11-05 18:44:19,3,2,662339676666265601
"Stood with clergy, my colleagues in Congress, and advocates at Washington National Cathedral to #StopGunViolencepic.twitter.com/LQC2e1uVfb",2015-11-04 20:46:23,13,14,662008009837707264
"Education leader, reformer, and my father-in-law. Celebrating John C. Esty:https://youtu.be/97X-IZvO96U ",2015-11-04 20:31:22,0,0,662004230367158276
Thanks @RepRyanCostello for highlighting the importance of supporting veterans’ caregivers. Let’s expand caregiver support to ALL veterans!,2015-11-04 15:46:42,1,2,661932592447545344
"NOW  Speaking on the House floor in honor of my father-in-law, former education reformer John Esty. Watch live: http://www.c-span.org/video/?400198-1/us-house-morning-hour&live …",2015-11-04 15:15:57,0,1,661924854510321664
Need health insurance? Now is the time to enrollhttp://www.newstimes.com/news/article/Esty-Need-health-insurance-Now-is-the-time-to-6605709.php …,2015-11-03 18:12:35,0,1,661606916758597632
"Standing with victims, advocates, faith leaders, and my colleagues this evening at @WNCathedral to #stopgunviolence http://www.cathedral.org/pdfs/november32015stopgunviolence.pdf …",2015-11-03 14:53:35,2,5,661556834378096640
It's time to #GetCovered! Open enrollment through @AccessHealthCT runs through Jan. 31. http://1.usa.gov/1k5fnpq pic.twitter.com/3K11Z0uwBO,2015-11-02 17:53:15,1,1,661239664259502080
"Thank you, Sharon! Our competitiveness depends on ensuring that employers can draw from a STEM-educated workforce.https://twitter.com/sclapp/status/660130151280328706 …",2015-10-30 16:48:27,1,0,660136190352482305
Meeting with 3D printing students. We need to get young people excited about innovative careers. @CCSU_ITBDpic.twitter.com/TTCLZZwgNx,2015-10-30 16:43:51,1,2,660135033345282048
I look forward to working with @SpeakerRyan on the many critical issues facing our country http://1.usa.gov/1NDwvw7 pic.twitter.com/rQauhiesf1,2015-10-29 19:00:38,2,1,659807069676113920
Hard-working Americans earned their #SocialSecurity benefits. Let’s work to protect & expand this vital program.https://twitter.com/SSWorks/status/659792168954019840 …,2015-10-29 18:02:51,1,6,659792528355540992
"My statement on the two-year, bipartisan budget agreement: http://esty.house.gov/index.php/news/press-releases/932-congresswoman-esty-statement-on-bipartisan-budget-deal …",2015-10-28 21:39:50,0,1,659484743831048192
Legislation I cosponsored to provide education funding for students with dyslexia passed unanimously in the House!http://blog.dyslexicadvantage.org/2015/10/27/hr-3033-project-read-unanimously-passes-the-house/ …,2015-10-28 18:34:01,2,2,659437983683190788
Proud to be named a @Campaign4Kids Defender of Children for work to #InvestInKids http://1.usa.gov/1GGWzXs ,2015-10-27 19:36:04,4,1,659091211756662786
"Now, speaking with @AlanChartock of @WAMCNews for the Congressional Corner.pic.twitter.com/BXOk7oYQYQ",2015-10-27 17:20:17,2,1,659057040321589249
Visited with #STEM students in #Plainville. The skills they are learning will be in high demand: http://www.centralctcommunications.com/bristolpress/article_ae0498f4-7c4d-11e5-8cad-03fc987153c3.html …,2015-10-27 15:42:37,0,4,659032460458639360
PHS offers a wide-range of unique #STEM courses & extracurricular programs to engage the next generation of leaders: http://1.usa.gov/1O3bgXt ,2015-10-26 17:23:49,2,2,658695539089870849
"Visiting #Plainville HS to highlight my #STEMEducation Act, which @POTUS signed into law this month.pic.twitter.com/RZQSduZAF4",2015-10-26 17:23:11,1,3,658695379345678336
We must reform our criminal justice system—our families and communities deserve better.http://www.ctpost.com/news/article/Reconsider-focus-on-non-violent-offenders-6586148.php …,2015-10-23 18:15:26,3,4,657621367135862785
Bipartisan success improving highway bill: http://1.usa.gov/1Mfd9jL ,2015-10-23 18:10:40,0,1,657620166273036289
NOW Participating in the House markup of a critical 6-year highway bill. @TransportDems Watch: http://transportation.house.gov/ ,2015-10-22 14:10:06,2,4,657197239459299328
Doesn't look like the Cubs will win the World Series. Happy #backtothefutureday https://instagram.com/p/9HhkGIGgqz/ ,2015-10-21 23:12:30,1,1,656971351446724608
".@educationweek article on my #STEMEducation Act, which @POTUS signed into law this month #computersciencehttp://www.edweek.org/ew/articles/2015/10/21/new-law-brings-computer-science-under-stem.html …",2015-10-21 20:21:34,1,3,656928332500619264
Proud to cosponsor criminal justice reform legislation that builds upon evidence-based initiatives passed in states: http://1.usa.gov/1QTTQu5 ,2015-10-21 18:09:39,0,0,656895137004593154
NOW House Science Committee hearing on #cybersecurity. @SciCmteDems Watch live:https://www.youtube.com/watch?v=-y09A_xdK8s …,2015-10-21 15:09:19,0,0,656849755264413696
"Congrats @GerryBrooks, @AlTerzi and all members of the new #Connecticut Broadcasters Association Hall of Fame!pic.twitter.com/DcI6edipuf",2015-10-20 18:14:00,2,0,656533841562181632
".@RichFrenchLive, Great chat with your crew about my #GoldStarFathersAct, signed into law this month by @POTUS.pic.twitter.com/aAnbZsBUWK",2015-10-20 16:42:18,1,0,656510766409891840
Meeting with constituents in #Newtown at the C.H. Booth Library. This is my 9th #CongressOnYourCorner this year.pic.twitter.com/uRsqAO15W6,2015-10-19 21:55:09,3,1,656227107857694720
I'll be in #Newtown this evening from 5:30 to 6:30 p.m. for my #CongressOnYourCorner. Hope to see you there!http://www.newstimes.com/news/article/Esty-drops-in-on-Newtown-Monday-night-to-discuss-6577705.php …,2015-10-19 17:45:35,0,1,656164302093746176
"""I’m not an activist, I’m an angry American."" Powerful op-ed by Steve Elliott who started #OneLessGun. ICYMI:https://www.washingtonpost.com/posteverything/wp/2015/10/15/im-a-responsible-gun-owner-so-i-destroyed-my-gun/?wpmm=1&wpisrc=nl_headlines …",2015-10-19 15:44:27,1,3,656133820371107841
Learning about beekeeping at Hannan Honey in #Woodbury. We must address the alarming decline in pollinators.pic.twitter.com/XLmtlpWZlt,2015-10-16 15:17:28,2,1,655039866158366720
Wearing purple for #SpiritDay as a way to show support for #LGBTQYouth & take a stand against bullying! @glaadpic.twitter.com/iYlQFh4f68,2015-10-15 19:03:23,11,7,654734330170773504
Met with educational leaders to discuss ways to expand @USDA School Breakfast Program. We can do better for our kids http://www.rep-am.com/articles/2015/10/15/news/local/914425.txt …,2015-10-15 15:16:06,0,0,654677132468092928
Joined @RepBillFoster @repdonnaedwards @RepSeanMaloney in introducing bills to combat heroin and opioid drug abusehttp://www.newstimes.com/news/article/Esty-and-colleagues-back-bills-to-combat-heroin-6570348.php …,2015-10-14 18:57:25,3,3,654370442388619264
Thank you for working to ensure that our students are prepared for the careers of tomorrow.https://twitter.com/PeterVermilyea/status/654329438423924736 …,2015-10-14 16:59:15,0,2,654340701916938240
I am working to grow our skilled workforce to be prepared for jobs that employers are looking to fill. #STEM,2015-10-14 15:32:25,0,3,654318850989760512
"Great time speaking about the importance of #STEMEducation at @Metrohartford's annual ""Dialogue with the Delegation.""pic.twitter.com/2tvrPNEX5P",2015-10-14 15:31:56,1,1,654318728239255552
.@PhillyInquirer highlights burn pit exposure among veterans. Why I introduced legislation to speed up research: http://www.philly.com/philly/news/20151011_War_vets_suspect_burn_pits_causing_thousands_of_serious_illnesses.html …,2015-10-13 18:44:10,1,0,654004720877608961
Reflecting on the Pope's powerful message to Congress with middle grade students at St. Rose School. #Newtownpic.twitter.com/2ziPbe83X6,2015-10-12 14:52:39,3,2,653584066676064256
Looking forward to tomorrow's christening ceremony for the USS Illinois with @FLOTUS in #Groton @USNavy @RepJoeCourtney @GDMS,2015-10-09 21:41:56,1,0,652599905995878400
ICYMI: I stopped by @cspanwj studios this morning to discuss #gunsafety legislation. We can and we must act. http://www.c-span.org/video/?328538-4/washington-journal-representative-elizabeth-esty-dct …,2015-10-09 16:43:14,0,1,652524735318872064
"All of my colleagues need to know how you feel, Amber. Tell your friends! http://www.house.gov/representatives/find/ … https://twitter.com/ambamae19/status/652469076078534656 …",2015-10-09 16:38:40,1,0,652523584368320512
We need to make sure that our young women and girls have the #STEM skills they need to excel in high-demand careers.https://twitter.com/vincebertram/status/652493759914098688 …,2015-10-09 14:45:46,3,1,652495173897879556
"These are not natural disasters, these are man-made disasters. We have to do better. #gunviolenceprevention",2015-10-09 12:42:16,1,3,652464090644893696
NOW: On @cspanwj. Join us!pic.twitter.com/eV8tqUjjDR,2015-10-09 12:33:45,2,7,652461949607874560
We have held 16 moments of silence on the House floor since the tragedy at Sandy Hook. And then refused to do anything. Shameful.,2015-10-08 20:18:34,4,8,652216538150404096
I joined my colleagues on the floor in an effort to force a vote on #gunsafety legislation. @HouseDemocrats Watch:https://youtu.be/cMh4IlN-LDw ,2015-10-08 20:16:08,0,0,652215923638714368
I'll be on @cspan tomorrow morning from 8:20 to 9 a.m. Tune in!https://twitter.com/cspanwj/status/652194211324932097 …,2015-10-08 18:56:16,0,0,652195825402126336
HAPPENING NOW: Speaking on the House floor in an effort to force a vote on bipartisan #GunViolencePrevention legislation!,2015-10-08 17:48:23,4,1,652178741104377857
Learn about my Gold Star Fathers Act: http://bit.ly/1VGXCxr  Read about my STEM Education Act: http://1.usa.gov/1Losg3C  #newlaws,2015-10-08 16:32:55,2,0,652159748024827904
"Two bills I authored in the House were signed into law! One supports families of fallen heroes, the other strengthens #STEMEducation.",2015-10-08 16:32:25,2,0,652159624376774657
"I urge @HouseGOP to work with us to replace cuts to defense & non-defense priorities, so we can ensure a #StrongerAmericanFuture.",2015-10-07 17:48:53,0,1,651816478631686144
Excited to discuss ways to increase female retention and participation in #STEM fields @AAUW @Make_Scentspic.twitter.com/Ux4O1Fr0Rc,2015-10-07 15:58:13,12,3,651788628239196161
That's why I introduced the Public Safety and Second Amendment Rights Protection Act and cosponsored the Background Check Completion Act,2015-10-07 14:55:23,0,0,651772816791089152
".@NewsTimes, I agree! Editorial: Close the loophole on all background checkshttp://www.newstimes.com/news/article/Editorial-Close-the-loophole-on-all-background-6554185.php …",2015-10-07 14:55:13,0,0,651772773753331712
Looking forward to working w/ the women of @Make_Scents & @SusanWBrooks to spread the word about great STEM careers!https://twitter.com/Make_Scents/status/649223625120313346 …,2015-10-06 19:14:06,1,0,651475536422825984
It is long past time that Congress addresses this national epidemic.,2015-10-05 17:44:58,1,1,651090715955593216
ICYMI: I joined 147 bipartisan members urging @SpeakerBoehner to bring #gunsafety legislation to the @HouseFloor http://1.usa.gov/1LnRmG8 ,2015-10-05 17:44:15,3,4,651090535529189376
Celebrating #NationalManufacturingDay at Trumpf Manufacturing in #Farmington. https://instagram.com/p/8WRlJcGgvo/ ,2015-10-02 20:14:31,1,1,650041190604275713
ICYMI: I spoke with @maddow about the need for Congress to act on #gunsafetyhttp://www.msnbc.com/rachel-maddow/watch/congress-prodded-to-use-its-power-for-change-536970307728 …,2015-10-02 17:58:06,5,5,650006858997088258
I'll be on @maddow tonight at 9 talking about yet another mass shooting at a school. #senselessviolence #thishastostop,2015-10-02 00:41:04,8,4,649745883215568896
"My heart breaks for the community of Roseburg, and the families and friends who lost loved ones today. http://1.usa.gov/1RiDP1i ",2015-10-01 19:44:07,0,4,649671150709116928
Our bill to protect children from liquid nicotine poisoning passed @HouseCommerce unanimously! @SusanWBrooks http://1.usa.gov/1VpKUTE ,2015-10-01 13:56:51,1,1,649583758794952704
We ought to do all we can to help tens of thousands of American families who struggle to navigate a broken missing persons system.,2015-09-30 17:50:58,1,0,649280289190060032
Joined @ChrisMurphyCT today in introducing bipartisan legislation to help find the missing. http://1.usa.gov/1O2mJEU ,2015-09-30 17:50:16,3,0,649280114375684096
"Welcome to DC, @jacksonlab! Thanks for all that you do to advance biomedical research in #Connecticut.pic.twitter.com/eR0yvAsa8w",2015-09-29 19:17:03,2,2,648939564954992640
My #GoldStar Fathers bill now goes to the @WhiteHouse for signature and enactment! http://bit.ly/1WvIeAQ ,2015-09-29 16:19:00,1,1,648894756404260865
WATCH my remarks on the @HouseFloor moments before final passage of my bill to support #GoldStar families:https://youtu.be/NPiqsGmpCos ,2015-09-28 20:05:40,0,1,648589409999278080
Those willing to make the ultimate sacrifice deserve to know that we will support and care for the loved ones they leave behind.,2015-09-28 20:01:58,0,0,648588480549928960
Proud to announce final passage of my Gold Star Fathers Act! http://1.usa.gov/1LhtxQ1 ,2015-09-28 20:01:31,1,0,648588368918482945
NOW Heading to the House floor to support passage of my Gold Star Fathers Act. Watch live: http://www.c-span.org/networks/ ,2015-09-28 19:11:07,1,0,648575683577442305
Congrats @NASA on your amazing discovery—water on Mars! Looking forward to learning more in the weeks to come #STEMhttp://nbcnews.to/1GcpNaZ ,2015-09-28 16:16:21,2,1,648531702164398080
".@RepChrisGibson, @gracenapolitano, @RepMimiWalters Thanks for cosponsoring my #suicideprevention resolution! http://1.usa.gov/1iWdStf ",2015-09-28 14:59:54,0,1,648512462921297920
The reality that we lose as many as 22 veterans to suicide each day is heartbreaking and inexcusable.,2015-09-28 14:24:17,2,1,648503498284367872
Introduced a bipartisan resolution to raise awareness for #suicideprevention among #veterans and service members: http://1.usa.gov/1iWdStf ,2015-09-28 14:22:52,3,2,648503143609798656
Beautiful day for the annual IBEW Local 420 clambake in Waterbury!pic.twitter.com/zLx9yIgSPd,2015-09-26 20:06:52,4,3,647864936690024448
Great news! The Senate passed my #STEMEducation Act. It’s headed back to the House where I and @LamarSmithTX21 will make sure it becomes law,2015-09-25 15:55:25,4,2,647439271205449729
"Busted by @kelmej! here's a copy of my notes MT @kelmej ""@RepEsty is taking notes on the Pope's speech... @CQnow""pic.twitter.com/T61nFH7dWl",2015-09-24 17:42:15,2,6,647103769273073664
"Thanks for your kind words, Steve. Glad you made it down!https://twitter.com/swhin/status/647069421735936000 …",2015-09-24 15:34:30,0,1,647071617483411456
"Proud to welcome my guest for today's historic Papal address, Monsignor Robert Weiss of #Newtown. #PopeInDCpic.twitter.com/R2c4Yac2qU",2015-09-24 12:45:32,5,3,647029098326458368
"With @ChrisMurphyCT, @mayoroleary, and Fritz Blasius this morning at the White House for @Pontifex… https://instagram.com/p/7--bnnmgmw/ ",2015-09-23 19:02:48,4,2,646761649353965571
Wishing a meaningful Yom Kippur to all who are observing!,2015-09-22 20:52:19,2,1,646426823635636224
#Spoontember selfie: 1 in 7 Americans struggle with hunger. I challenge @RosaDeLauro to join me! #HungerActionMonthpic.twitter.com/UmGvSElxLT,2015-09-22 16:45:02,4,3,646364590956277760
We build strength in our country when we invest in our young people.,2015-09-21 19:24:27,2,5,646042324733173760
Celebrating #Danbury's new @PathwaysInTech-model school! #STEMeducationpic.twitter.com/TGgai1GLgP,2015-09-21 19:20:12,3,2,646041252861972480
Fall festival season is in full swing! Had a great time meeting with vendors and constituents in #Watertown.pic.twitter.com/TP9uJDO61c,2015-09-20 13:47:32,0,1,645595146285883392
"We need more access to quality health care, not less. WATCH my speech on protecting women's access to health carehttp://bit.ly/1MhdGhC ",2015-09-18 18:02:33,5,4,644934551047917568
NOW Offering the only amendment to HR 3134 to protect women's access to vital health care! Defunding @PPFA would have a devastating impact.,2015-09-18 16:06:47,9,9,644905417420750849
Called on Congress to focus on creating jobs by reauthorizing #ExImBank and passing a long-term Highway Bill.https://www.youtube.com/watch?v=bxW23GZPvrs …,2015-09-17 21:24:55,2,1,644623090467663872
"On #CitizenshipDay, #tbt to my first immigration case for a family from #NewBritain. Yuriy became a citizen in 2013!pic.twitter.com/V8jGmE1ACz",2015-09-17 16:45:14,3,1,644552704224829440
"We still have tickets to see the Pope! If you’re a #CT5 resident interested in heading to DC next week, email me: http://1.usa.gov/1OwDtVw ",2015-09-16 18:50:55,2,2,644221943676280832
"COMING UP at 1:45, joining @ConnAFLCIO Field Director Todd Birch on WATR to highlight #STEMeducation. Listen live: http://watr.com/ ",2015-09-16 17:34:44,0,1,644202774276743168
Join me in celebrating the diverse culture and contributions of our Latino community. Watch my #HHM message: https://youtu.be/BFgZAJy6kaA ,2015-09-16 15:05:07,1,0,644165122672476160
"Proud to support David Hill, of #NewBritain, and home care workers across #CT as they #FightFor15 https://instagram.com/p/7n5ei9mgrB/ ",2015-09-14 19:51:55,1,3,643512518812565504
Pleased #NewBritain students are now receiving free breakfast & lunch. Our children need adequate nutrition to focuspic.twitter.com/XmNJzJ2JoA,2015-09-14 17:10:05,3,1,643471793559351301
"L'shana tova to all who are observing #RoshHashanah. Best wishes for a healthy, joyous, and safe new year!",2015-09-13 22:17:50,1,2,643186852405444608
Wishing my former intern @Byron31Jump the best of luck tonight in his first #SNF game!pic.twitter.com/tcORvpLtzq,2015-09-13 19:40:01,1,0,643147137002434560
Honored to be with the heroes of the Newtown Foundation who encourage us to #HonorWithActionpic.twitter.com/AGiR2Tlqxk,2015-09-12 15:41:21,1,2,642724687278133248
"Today, we honor the memory of our courageous first responders, firefighters, police officers, volunteers, and fellow citizens. #NeverForget",2015-09-11 13:51:54,6,8,642334754222809088
WATCH my remarks on the House floor in support of the nuclear deal with Iran:http://bit.ly/1JYkJbV ,2015-09-10 21:09:08,0,1,642082399996772352
I believe that it is better to have this imperfect international agreement that we can aggressively enforce than to have no agreement at all,2015-09-10 20:12:44,5,1,642068208820822016
NOW speaking on the House floor in support of the Iran Nuclear Deal. Watch live on @cspan http://www.c-span.org/networks/ ,2015-09-10 20:10:12,4,0,642067571244711936
Gun permit protections save lives. That's why @ChrisVanHollen & I intro'd H.R.2732 #whateverittakes #WorldSuicideDay http://1.usa.gov/1Lmhw66 ,2015-09-10 16:22:42,1,0,642010317615144960
ICYMI: #CT made it harder to get guns – and suicides fell significantlyhttp://www.vox.com/2015/9/2/9242147/gun-control-connecticut-suicides …,2015-09-10 16:22:25,2,2,642010246676905984
