Text,Date,Favorites,Retweets,Tweet ID
Wearing purple to raise awareness for World Pancreatic Cancer Day #PurpleForAPurpose #WPCD2014 http://www.worldpancreaticcancerday.org pic.twitter.com/TDuSlhu7yC,2014-11-13 15:10:43,10,3,532913453670080513
"Last night, we celebrated my daughter Sarah's birthday. Can't believe it's been 25 years!pic.twitter.com/Q0B9CvbyDE",2014-11-12 21:32:55,4,1,532647249374113792
Congrats to @ESA_Rosetta and @NASA on the first ever #cometlanding!,2014-11-12 17:10:16,6,6,532581151907794945
Just uploaded a new Veterans Day photo album to my Facebook page. Check it out here https://www.facebook.com/media/set/?set=a.512841678818530.1073741874.292076514228382&type=1 … #VeteransDay,2014-11-12 15:36:20,0,0,532557512357453825
Enjoyed the Veterans Day commemoration at @CCSU in #NewBritain. Wonderful ceremony to honor student & local veteranspic.twitter.com/GRpqhBWYHe,2014-11-11 23:52:40,2,2,532320034316496897
With Gold Star Families in #Waterbury. Honored to be with those who have sacrificed so much for our countrypic.twitter.com/qM2lmDJh4y,2014-11-11 17:51:58,0,0,532229260745129984
Honoring Private First Class Harry Liebeskind. Thank you for your service in World War I. #Waterbury #VeteransDaypic.twitter.com/U5jPRgFFiU,2014-11-11 16:56:35,1,2,532215323941146624
Beautiful day to honor our veterans at the Veterans Day ceremony on the #Waterbury Greenpic.twitter.com/NicpXDdJfj,2014-11-11 16:44:51,0,1,532212368617766913
At Winslow Automatics in #NewBritain to highlight new @SOTS registry to help veteran-owned businesses thrivepic.twitter.com/tbbRzFwyk2,2014-11-11 15:43:26,0,1,532196913182167040
"On Veterans Day, we honor the men and women who have courageously put on the uniform to serve and protect our freedom http://esty.house.gov/media-center/press-releases/rep-elizabeth-esty-s-statement-on-veterans-day …",2014-11-11 14:12:26,2,1,532174012190056448
Enjoyed visiting the Veterans' Oasis at @tunxisccpic.twitter.com/4TFP8prUdx,2014-11-10 22:56:43,1,0,531943563366760451
Productive convo today at @tunxiscc in #Farmington about the importance of addressing veterans’ mental health issuespic.twitter.com/9zRuYtlCPC,2014-11-10 22:53:46,2,2,531942824024219649
In #NewBritain to help announce $6.7M @USDOL grant to @cwpjobs. Funding will provide training for health care jobspic.twitter.com/DbylZRZIav,2014-11-10 19:11:43,2,0,531886941663666176
Happy birthday to the United States Marine Corps. Thank you for 239 years of unwavering service & sacrifice to our nation #SemperFi #USMC239,2014-11-10 15:37:29,3,5,531833027748716544
Great night at the Meriden/Wallingford NAACP's 18th Annual Freedom Fund Dinnerpic.twitter.com/gn8LBpG9D2,2014-11-09 01:17:10,1,1,531254134398541824
"With Cheshire's Lights of Hope scholarship recipient, Meaghan. Congratulations!pic.twitter.com/w0YAw049bP",2014-11-08 21:38:17,3,1,531199050327289857
Beautiful fall afternoon with my neighbors at Cheshire's Lights of Hope. What an incredible community event.pic.twitter.com/Ue153xr04v,2014-11-08 21:27:46,1,0,531196403545276417
Great to meet veterans & health care providers at the #Waterbury VA Community Based Outpatient Clinic this afternoonpic.twitter.com/VvdmzuKSPl,2014-11-07 18:31:52,0,0,530789749280497664
"Starting Nov. 15, enroll online at https://www.accesshealthct.com  or visit the enrollment center in #NewBritain. More info: http://learn.accesshealthct.com/enrollment-centers/ …",2014-11-06 17:44:52,0,0,530415533494398977
Open enrollment for 2015 coverage is only 9 days away! @AccessHealthCT makes it easy for you and your loved ones to sign up and #getcovered,2014-11-06 17:44:42,0,1,530415490729263105
Proud to say that several fire companies in #CT5 received @fema #AFG grants for Fiscal Year 2013. Read more:http://newtownbee.com/news/news/2014/09/03/fema-equipment-grants-approved-two-volunteer-fire/227410 …,2014-11-03 22:06:16,1,1,529394154124492801
#FYI: The application period for the @fema Assistance to Firefighters Grant opens today & closes on 12/5 @ 5PM #AFG https://www.fema.gov/welcome-assistance-firefighters-grant-program …,2014-11-03 22:03:56,0,3,529393566468960256
"My sincere condolences to Treasurer Denise Nappier and her family on the passing of her mother, Barbara",2014-11-02 20:46:43,0,0,529011744044486657
"Today, I was proud & delighted to help announce that @PraxairInc will be building new HQ in #Danbury & adding jobspic.twitter.com/ffaldwTPZy",2014-10-31 16:37:16,0,1,528224196212826113
My e-newsletter is a great way to stay up to date on the work I’m doing around #CT5. Sign up here:https://esty.house.gov/contact/newsletter …,2014-10-30 20:03:40,0,0,527913750020751360
This is why I've advocated to the FDA to recognize narcan as a safe & effective way to treat & reverse an overdose http://www.courant.com/breaking-news/hc-state-police-narcan-save-1101-20141030-story.html …,2014-10-30 17:58:55,0,0,527882356053770240
The new expansion of #Torrington facility will create jobs & allow #FuelCell to continue to develop groundbreaking technologies,2014-10-29 22:15:37,1,1,527584567126163458
Great news for #FuelCell Energy in #Torrington!http://www.registercitizen.com/general-news/20141029/fuelcell-energy-to-expand-torrington-manufacturing-plant-add-more-than-300-jobs …,2014-10-29 22:15:20,0,1,527584497836253184
On 2nd anniv of #StormSandy we are reminded that disaster preparedness keeps our families safe. Visit http://www.ready.gov  for info & tips,2014-10-29 17:52:52,1,0,527518445630685185
#ICYMI @NewBritHerald article on my Goodwin Tech visit. Enjoyed hearing from students prepping for manufacturing jobs http://www.newbritainherald.com/articles/2014/10/23/news/doc5449ab5c27bfa734762152.txt …,2014-10-28 18:11:49,0,0,527160826109902849
"Now at Sanchez Repair Services to speak with owner Jose. They go by the motto ""If it has a motor, we can fix it""pic.twitter.com/FVMokJ71e0",2014-10-27 19:31:18,0,0,526818439923777537
"Next stop: Britos Restaurant on South Street. Great to hear directly from the owner, Ricarda. #Danbury #smallbizpic.twitter.com/yQNvA340m5",2014-10-27 19:22:01,0,0,526816102819856384
"Just started minority-owned small business tour with @ChrisMurphyCT in #Danbury. First stop, Angelo's Pizzapic.twitter.com/6alGy9zFIw",2014-10-27 19:05:32,0,0,526811954942582784
My thoughts and prayers are with students at Marysville-Pilchuck High School,2014-10-24 19:04:45,2,0,525724595614400513
"Pleased the CT DOT is moving forward with the widening of I-84. The construction will bring good paying jobs to #CT
http://www.ct.gov/dot/cwp/view.asp?A=2135&Q=555450 …",2014-10-24 18:17:56,3,4,525712812652638208
Enjoyed the Girls & STEM Expo at @NaugatuckValley in #Waterbury. Great to see girls get excited about #STEMpic.twitter.com/rvFNPUmsWC,2014-10-24 14:22:42,2,4,525653615021920256
Reminder for #CT5 students! The deadline for submitting an app for a military academy nomination is tomorrow @ 5 PMhttps://esty.house.gov/services/military-academy-nominations …,2014-10-23 18:12:03,0,0,525348944998858752
"Students @ Goodwin Tech are gaining valuable skills to prep for good paying, 21st century jobs #ManufacturingMonthpic.twitter.com/5krWhgMtQl",2014-10-23 16:25:54,0,0,525322231652831232
Great to tour Goodwin Tech in #NewBritain w @ChrisMurphyCT to celebrate #ManufacturingMonthpic.twitter.com/1HWqgM2UEs,2014-10-23 16:23:07,0,0,525321530834972672
Great news! I'm proud that #Connecticut has been recognized as a top state for educational opportunityhttp://www.huffingtonpost.com/2014/10/21/opportunity-index-2014_n_6017638.html …,2014-10-22 16:10:48,0,3,524956044095934464
"If you or a loved one need help, call the National Domestic Violence Hotline at 1-800-799-7233 #DVAM14",2014-10-21 14:47:20,1,1,524572648278614016
October is #DomesticViolenceAwarenessMonth. I'm committed to working towards solutions to prevent domestic violencepic.twitter.com/IfR3HtETs3,2014-10-21 14:46:29,7,14,524572437099597825
#ICYMI: Great article in the @NewBritHerald on why #NewBritain is a top place to retire #CT5 http://newbritainherald.com/articles/2014/10/14/news/doc543c8de45342d468817899.txt …,2014-10-20 20:27:21,0,0,524295831407841281
Proud to help announce $77M in funding for #LIHEAP from @HHSGov. Need home energy assistance? Call my office for infohttp://news.hamlethub.com/hartfordcc/politics/775-feds-release-77-million-for-ct-low-income-energy-assistance …,2014-10-20 13:35:00,1,1,524192060799471616
"As we discuss Ebola, let's not forget the flu can cause 3,000-49,000 deaths each yr. Have you had the flu shot yet? http://www.flu.gov/prevention-vaccination/vaccination/index.html …",2014-10-17 19:10:46,2,1,523189392111046656
Great visiting Pulaski Elementary School in #Meriden. Congrats on receiving @USDA HealthierUS Gold School award!pic.twitter.com/fDlXBg5gyV,2014-10-17 15:36:45,0,1,523135534513004544
"For more information on military academy nominations, visit my website or call my office at 860-223-8412https://esty.house.gov/services/military-academy-nominations …",2014-10-17 13:44:37,0,0,523107315843862528
Are you or a loved one applying to a military academy? The deadline for submitting an app for a military academy nomination is 10/24 at 5 PM,2014-10-17 13:44:23,0,2,523107255596904448
Today is #SpiritDay! Join me in taking a stand against bullying to make our schools safer for #LGBT studentspic.twitter.com/hzpKX02x9N,2014-10-16 15:18:24,3,3,522768528932605952
Questions about health care coverage? @AccessHealthCT will be hosting a Healthy Chat #Danbury tonight http://learn.accesshealthct.com/events/ ,2014-10-16 14:52:15,0,2,522761948942061568
#Medicare open enrollment begins today and goes through December 7. Questions? Visit http://www.cms.gov/Center/Special-Topic/Open-Enrollment-Center.html … for more information,2014-10-15 18:48:27,0,1,522458999774781441
I signed a letter to urge the @EPA to reconsider regulations on the use of pesticides. Read more in @TheNewtownBeehttp://newtownbee.com/news/news/2014/10/13/state-lawmakers-urge-epa-reconsider-neonicotinoid/235063 …,2014-10-15 16:42:40,0,0,522427347694542851
#ICYMI: Great news for seniors! @HHSGov announced no increase in Medicare Part B premiums & deductibles for 2015 http://www.hhs.gov/news/press/2014pres/10/20141009a.html …,2014-10-14 18:53:12,0,2,522097807269044224
Visiting DC this weekend? The While House Fall Garden Tours are taking place on 10/8 & 10/19. Call my DC office @ 202-225-4476 for more info,2014-10-14 14:39:34,0,0,522033980011728897
http://Dems.gov/Jumpstart  allows for the refinancing of student loans at lower rates & provides renewed hope for the American Dream. #HigherEd,2014-10-14 13:47:19,29,81,522020830516367360
"By age 3, children in low-income homes hear 30mil fewer words than those in other homes. Let's invest in #EarlyEd! http://Dems.gov/Jumpstart ",2014-10-14 12:14:46,0,4,521997538552217601
Honored to receive a 100 on the @HRC Congressional scorecard. I’ll continue to stand for #LGBTEquality #LoveisLove http://www.hrc.org/press-releases/entry/hrc-releases-scorecard-of-113th-congress-showing-record-gains-in-support-fo …,2014-10-13 14:23:25,1,0,521667528146165761
Every week should be #MentalIllnessAwarenessWeek. Here’s how I’ve made addressing mental health issues a priority: http://www.registercitizen.com/general-news/20140425/us-rep-esty-discusses-mental-health-issues-at-torringtons-prime-time-house …,2014-10-10 19:07:11,1,0,520651777507864576
"Proud #CT leads the way on raising the minimum wage. 45,000 workers in #CT5 benefit #RaiseTheWage",2014-10-10 14:13:29,0,3,520577866405539840
Time to #RaiseTheWage because no one should work full-time & live in poverty #NationalMinimumWageDaypic.twitter.com/HcY05I1uD5,2014-10-10 14:10:11,2,7,520577032854732801
"This #FirePreventionWeek, let's commit to keeping our families safe by testing smoke alarms monthly & replacing batteries @usfire",2014-10-09 19:56:41,0,1,520301846318288896
"#TBT: A year ago today, I took to the House floor & offered a motion demanding we reopen the entire federal gov'thttps://www.youtube.com/watch?v=9Qziue16swM&list=TLAZ1gmDkiT5QgPMr7Sy6uEtx5acOj6LGv …",2014-10-09 15:44:38,0,0,520238417654071296
Did you know that Latinas earn only 56 cents for every $1 paid to white male counterparts? Time to ensure #equalpaypic.twitter.com/yzNLPlvMuU,2014-10-08 19:30:21,2,0,519932829564932096
Questions about health care coverage? @AccessHealthCT will be hosting Healthy Chats in #NewBritain & #Danbury http://learn.accesshealthct.com/events/ ,2014-10-08 15:57:29,0,0,519879262112088064
Proud to introduce a new e-newsletter focused on #grants. Sign up: http://esty.house.gov/contact/grants-subscribe … & check out October’s here: http://esty.house.gov/sites/esty.house.gov/files/Rep.%20Esty%20October%20Grant%20E-Newsletter.pdf …,2014-10-07 20:12:28,0,0,519581043548905472
Great to be in Farmington for @jacksonlab grand opening. New facilities will bring cutting-edge research & jobs to CTpic.twitter.com/81gb8yxJ4L,2014-10-07 19:32:32,2,2,519570992000008194
Great news for equality! I applaud #SCOTUS for clearing the path for marriage equality in 5 more states  http://www.nytimes.com/2014/10/07/us/denying-review-justices-clear-way-for-gay-marriage-in-5-states.html …,2014-10-06 17:01:21,0,0,519170558857334784
Enjoyed visiting the Boys & Girls Club of Greater #Waterbury last weekpic.twitter.com/Ze6nV1JyQ6,2014-10-06 15:05:22,2,3,519141371400425474
Congrats #Wolcott High for being recognized as one of America's top high schools & top school for low-income studentshttp://www.newsweek.com/high-schools/americas-top-schools-2014 …,2014-10-06 13:33:13,0,0,519118180552544257
Honored to be in #Plymouth this morning to present Mr. Pelletier the medals he earned for his service in the U.S Armypic.twitter.com/m5JkO6fnk7,2014-10-04 15:54:03,2,3,518428844127432704
Wishing a meaningful Yom Kippur to all who are observing.,2014-10-03 22:01:00,3,1,518158803586805760
In honor of #ManufacturingDay check out this @NewsTimes article on $1.7M @USDOL grant to @NaugatuckValley http://www.newstimes.com/local/article/Danbury-to-get-new-training-program-for-factory-5795262.php … #MfgDay14,2014-10-03 19:39:27,1,1,518123183917268992
Proud to announce that my office helped recover nearly $2.6M in savings to #CT5 from gov't agencies. I'm here to help http://esty.house.gov/constituent-corner-stories-from-around-connecticuts-5th-district …,2014-10-03 17:47:48,0,0,518095083552636929
"It's #NationalManufacturingDay! Celebrating by speaking w/ students about quality, innovative jobs in manufacturingpic.twitter.com/ZcEh4RYr4o",2014-10-03 13:47:35,0,2,518034632642949120
#ConstituentCorner: My staff helped reunite #Waterbury resident with his fiancée http://esty.house.gov/constituent-corner-stories-from-around-connecticuts-5th-district …,2014-10-02 18:45:37,0,2,517747246088335360
New Secret Service director should restore trust after unacceptable breaches & ensure the President and family are safe.,2014-10-02 13:51:03,3,3,517673115149946881
Optimistic that Sgt. Tahmooressi may be released from Mex. prison soon. Release should happen as quickly as possible http://www.latimes.com/local/la-me-marine-mexico-20141002-story.html …,2014-10-02 13:25:38,0,0,517666720832831488
Congratulations to @wamogorhs in #Litchfield for being recognized as a  @usedgov National Blue Ribbon school!,2014-10-01 21:01:32,2,1,517419064613150720
"Happy 56th birthday, @NASA! Looking forward to another great year of discoveries, exploration, and inspiration #NASA #STEM",2014-10-01 19:34:16,2,3,517397101421268992
Great to be back at @NaugatuckValley to celebrate $1.7M grant from @USDOL to support #manufacturing training programspic.twitter.com/RzQZvki1Da,2014-10-01 16:21:16,1,4,517348530596614144
"As National #BreastCancerAwareness  Month approaches in October, I'm urging Medicare to cover 3D mammographyhttp://esty.house.gov/media-center/press-releases/rep-esty-calls-on-medicare-to-support-medical-advances-in-early-breast …",2014-09-30 18:31:53,0,0,517019014779117569
Today is National #PrepareAthon! Day. How do you and your loved ones prepare for emergencies? More info here: http://www.community.fema.gov/connect.ti/AmericasPrepareathon … @fema,2014-09-30 14:26:32,1,0,516957270773481472
#ICYMI Proud that Community Health & Wellness Center in #Torrington received @HHSGov grants to help expand serviceshttp://www.registercitizen.com/general-news/20140926/torringtons-community-health-and-wellness-center-receives-240000-in-federal-funding …,2014-09-30 12:55:26,0,0,516934345966514176
"115 yrs ago today, the Veterans of Foreign Wars was established. Let’s continue to properly honor the men & women who serve our country #VFW",2014-09-29 21:34:00,2,3,516702456739160065
"Today, @EPA was in #CT accepting comments on proposed #CleanWaterAct rules. Submit your comment by 10/20. More info: http://www2.epa.gov/uswaters ",2014-09-29 20:27:18,0,0,516685670975561729
It’s #NationalPublicLandsDay! Enjoy & help preserve your fav public land. Here I am @ Fulton Park in Waterbury in Maypic.twitter.com/XST6DJSgRk,2014-09-27 12:48:42,0,1,515845487183028224
Veterans account for 20% of all suicides each year. We need to continue to do all we can to support those who have served  #Powerof1,2014-09-26 21:42:55,0,0,515617540052353024
Earlier this month I intro’d resolution commending the @DeptofDefense & @DeptVetAffairs for their #Powerof1 campaignhttp://esty.house.gov/media-center/press-releases/rep-elizabeth-esty-to-introduce-resolution-to-raise-awareness-about …,2014-09-26 21:41:56,0,0,515617292009603073
#ConstituentCorner: My staff helped an Avon family cut through the red tape to become permanent residents http://esty.house.gov/constituent-corner-stories-from-around-connecticuts-5th-district …,2014-09-26 15:49:45,0,0,515528660968026113
"(2/2) With all of the issues that still need to be addressed, he shouldn’t have cancelled votes. The American people deserve better.",2014-09-25 16:42:31,0,0,515179553975992320
"(1/2) Last week, I signed a letter to urge Speaker Boehner to not cancel votes from September 29-October 2.",2014-09-25 16:42:22,0,0,515179513677099008
L'Shana Tovah to everyone celebrating Rosh Hashanah. Best wishes for a happy and healthy new year!,2014-09-24 20:55:48,1,0,514880904310042625
I applaud the #UNSC for unanimously adopting resolution 2178. Important to address global terror threats.,2014-09-24 19:42:52,0,0,514862550161571840
.@AstroRM gave me a great pic of #Waterbury from space! Thanks for your hard work on the #InternationalSpaceStationpic.twitter.com/xsMofaxqIr,2014-09-24 19:01:28,0,2,514852130612838400
Honored to present Kazimierz Spaczynski of #NewBritain the medals he earned for his service during the Korean Warpic.twitter.com/2yCimyb9oC,2014-09-24 15:53:11,0,0,514804750634983425
Beautiful day for a tour of Ultimate Professional Grounds Management in #Wolcottpic.twitter.com/p59juAlauf,2014-09-23 21:12:53,1,0,514522814997884929
Great to visit the Advanced Manufacturing Technology Center at @NaugatuckValley in #Waterburypic.twitter.com/CJdUUbTAbL,2014-09-23 19:57:58,0,2,514503964893904897
#ICYMI It's important that we make sure the next generation of workers are prepared for 21st century #jobs. Read more http://esty.house.gov/media-center/in-the-news/esty-proposes-bills-to-promote-manufacturing-stem-jobs …,2014-09-22 15:17:11,0,1,514070915601432577
Honored to present the #CongressionalAward Bronze Medal to the very impressive Risa Lewis from #Avon. Congrats!pic.twitter.com/XPGWyaLNtE,2014-09-20 19:41:40,1,1,513412698001121280
I fly the #POWMIA flag at my office to honor those who make sacrifices for our freedoms #NeverForgetpic.twitter.com/Xl0TIB1keR,2014-09-19 19:58:02,2,1,513054428837208064
#ConstituentCorner: My office helped secure non-profit status for an organization in #Southbury http://esty.house.gov/constituent-corner-stories-from-around-connecticuts-5th-district …,2014-09-19 18:02:24,0,0,513025327871041536
Today we commemorate national #POWMIA Day. Let’s renew our commitment to bring home all the men & women who protect our freedom #NeverForget,2014-09-19 15:35:38,0,1,512988393350111232
Pleased House just unanimously passed resolution I cosponsored condemning anti-Semitism & violence against Jewish community in Middle East,2014-09-18 23:11:59,1,5,512740849247989760
I intro'd 2 bills to prepare students for 21st century jobs so the next generation of #STEM professionals can succeedhttp://esty.house.gov/media-center/press-releases/rep-elizabeth-esty-introduces-bipartisan-bill-creating-a-manufacturing …,2014-09-18 19:17:17,1,0,512681786942717952
Great to have Adam Platosz from #NewBritain here for the Joint Meeting of Congress with the President of Ukrainepic.twitter.com/iK7u3DanI7,2014-09-18 14:50:52,1,0,512614740464787456
My statement on tonight's vote against arming and training Syrian rebelshttp://esty.house.gov/media-center/press-releases/rep-elizabeth-estys-statement-on-today-s-vote-on-the-mckeon-amendment …,2014-09-17 23:15:46,2,2,512379414395772928
The Constitution was signed 227 yrs ago today. Time to reflect on the freedoms it protects for all Americans #ruleoflaw #ConstitutionDay2014,2014-09-17 17:20:10,4,8,512289923547029504
"Right now, I’m at the National Ideas Meeting hosted by @NoLabelsOrg. I'm proud to be a pragmatic problem solverpic.twitter.com/3YUgMOA8vy",2014-09-17 13:15:20,4,5,512228309313544192
Congrats to #Waterbury's @astroRM on a great 188 day mission in space. You're an inspiration to our students! #STEMpic.twitter.com/6s8Db9JWYO,2014-09-16 20:36:40,1,3,511976985678340096
"Thrilled Linda Schwartz was just confirmed as newest @DeptVetAffairs Asst. Sec., bringing #CT leadership in serving veterans to the VA",2014-09-16 19:29:09,1,1,511959994426613760
Let me know what you think about the situation with ISIS athttp://www.esty.house.gov/contact ,2014-09-16 16:12:27,1,3,511910495012814848
Off to classified briefing on ISIS at 2. House expected to start debating POTUS plan to arm & train moderate Syrian rebels and vote on Wed.,2014-09-16 16:11:36,0,1,511910282810392576
"Last night, the Senate blocked the #PaycheckFairnessAct. Unacceptable. It’s time to ensure #equalpay for equal work.",2014-09-16 13:10:27,0,3,511864695083794432
"This morning, I joined my colleagues to highlight the 14.4 million #TIGERGrant to support #Waterbury's WATER Projectpic.twitter.com/UusJsQuCsv",2014-09-15 15:47:32,0,1,511541837681926145
"Great night at ""Dancing with our Heroes""pic.twitter.com/GS1zIWQksu",2014-09-13 23:09:52,0,1,510928377617084416
"Happy 200th birthday to our National Anthem, the Star-Spangled Banner!",2014-09-13 18:25:02,2,6,510856697158848512
Great to be at #NewBritain High this afternoon to help get students interested in applying to service academiespic.twitter.com/KjElanX4Cm,2014-09-12 19:25:50,0,0,510509609472507904
"On the 20th anniversary of @AmeriCorps, I'd like to thank all past & present members for their service #AmeriCorps20",2014-09-12 13:26:42,1,0,510419231998234625
"Thirteen years ago, our nation was rocked by horrific acts of terrorism. We will never forgethttp://esty.house.gov/media-center/press-releases/rep-elizabeth-esty-s-statement-on-the-anniversary-of-september-11 …",2014-09-11 16:06:24,0,1,510097033433468928
Pres. Obama laid out a plan to stop ISIS. I’m attending a classified briefing this morning to learn more. Regional partners must be engaged.,2014-09-11 14:14:44,0,0,510068932561342464
We need to do all that we can to support the men and women who have courageously served our country #Powerof1,2014-09-10 21:50:35,1,0,509821259992276992
Proud to be introducing a resolution commending the @DeptofDefense & @DeptVetAffairs for their #Powerof1 campaignhttp://esty.house.gov/media-center/press-releases/rep-elizabeth-esty-to-introduce-resolution-to-raise-awareness-about …,2014-09-10 21:50:02,0,0,509821124071677952
#ConstituentCorner Honored to help a veteran from #Avon who was exposed to Agent Orange during his service in Vietnam http://esty.house.gov/constituent-corner-stories-from-around-connecticuts-5th-district …,2014-09-10 19:52:37,1,2,509791576332439552
Great to chat with my DC interns this morning! Applying for an internship? Visit http://esty.house.gov/services/internships … for more infopic.twitter.com/PCTKtDE2Th,2014-09-10 16:39:35,3,2,509742996590718977
The TIGER grant will create good- paying jobs and help develop downtown #Waterbury,2014-09-09 21:40:28,1,2,509456328491012096
Great news for #Waterbury! Proud to announce $14.4 million TIGER grant from @USDOThttp://esty.house.gov/media-center/press-releases/release-esty-malloy-blumenthal-murphy-delauro-o-leary-announce-144 …,2014-09-09 21:37:43,0,2,509455637739094016
Always great to see young women pursuing #STEM fields. Congratulations & good luck to Catherine Herrick of #Newtown!http://www.newstimes.com/local/article/Newtown-girl-semi-finalist-in-STEM-competition-5742265.php …,2014-09-09 15:25:11,1,0,509361885150736384
"I called on Speaker Boehner to cancel recess. He should've. 1 day back & lots of work to do e.g. ISIS, imm reform, infrastructure investmnts",2014-09-08 23:27:13,4,1,509120803292868608
Glad Senate is moving forward on the #Democracy4All amendment to overturn #CitizensUnited. Time for House to act,2014-09-08 22:57:40,1,3,509113368863846400
Proud to be from a state that values educators. Check out @washingtonpost op-ed on why #CT is the best state to teachhttp://www.washingtonpost.com/opinions/best-state-in-america-connecticut-for-its-teachers/2014/09/05/8e11ac88-3457-11e4-8f02-03c644b2d7d0_story.html?hpid=z5 …,2014-09-08 16:31:09,1,2,509016097572786176
