Text,Date,Favorites,Retweets,Tweet ID
Happy to join you! #NY19 has 216 organic producers and we benefit tremendously from farmers markets.https://twitter.com/OFRF/status/867433900582334471 …,2017-05-24 17:41:48,4,1,867435478001254401
@coynereports @LTpatch @MattSpillane @PoJoEnviro @bnearing10https://twitter.com/RepJohnFaso/status/867398583066218496 …,2017-05-24 16:08:43,0,0,867412052947734528
@RepBillShuster @transport @RobAstorino @marcmolinaro @SNeuhausOC @SheriffButchDChttps://twitter.com/matt_hamilton10/status/867390590132080640 …,2017-05-24 15:32:59,0,0,867403057612677121
JUST APPROVED: My provision halting #barge rule for #HudsonRiver until all voices are heard. http://faso.house.gov/news/documentsingle.aspx?DocumentID=338 … @marcmolinaro,2017-05-24 15:15:12,6,2,867398583066218496
"Honoring my neighbor and friend, former Congressman @ChrisGibsonNY. Thank you for your service, Chris.https://youtu.be/Dh7iwklyuFA ",2017-05-24 13:38:38,2,2,867374282887790596
"WATCH: Raise a glass to @BreweryOmmegang & @RoscoeBeerCo, two #NY19 winners https://youtu.be/aL58Y9zNUJQ ",2017-05-23 19:12:39,4,2,867095952192151552
NEW: My statement on 2018 #budget request >>> http://faso.house.gov/news/documentsingle.aspx?DocumentID=336 …,2017-05-23 16:42:37,1,2,867058193586954241
"Please send your thoughts and prayers to the people of #Manchester this evening. We stand with our ally, always. #ManchesterArena",2017-05-23 01:38:45,31,5,866830731334619136
Happy to support our #CatskillHS students at @CBCSpringRush!pic.twitter.com/jcFVvA1rNT,2017-05-21 17:18:33,11,4,866342460984885248
Congrats to @RoscoeBeerCo and @BreweryOmmegang for winning the Taste New York Craft Beer Challenge. #ny19 is proud!https://twitter.com/sullivancats/status/865222410915782656 …,2017-05-18 21:00:03,4,0,865311041487556613
We must act now to prevent future flooding and protect our fisheries.https://faso.house.gov/news/documentsingle.aspx?DocumentID=321 …,2017-05-18 17:19:21,3,0,865255501340319745
"Today I met with Canadian MPs from Ontario, New Brunswick and Quebec. We discussed dairy trade,… https://www.instagram.com/p/BUPKOf7DhOt/ ",2017-05-18 14:22:08,4,2,865210901959520256
Mr. Mueller has unquestioned integrity and is a wise choice to lead the DOJ investigation as Special Counsel.https://twitter.com/WNYT/status/864979879447609345 …,2017-05-18 00:23:35,14,3,864999873363427328
Learn more about it here: https://faso.house.gov/news/documentsingle.aspx?DocumentID=316 …https://twitter.com/SPECNewsAlbany/status/864910119561302018 …,2017-05-17 20:05:09,9,1,864934839052587014
An available seasonal labor supply is crucial to the success of our local family farms. #nofarmsnofoodhttps://youtu.be/i9sgyXrKkp8 ,2017-05-17 17:30:11,2,2,864895837960318977
#NationalPoliceWeek is a time for us to remember the men and women of law enforcement who lost… https://www.instagram.com/p/BUHyo2djyvg/ ,2017-05-15 17:41:47,3,0,864173982140047360
Thanks to all the moms who work so hard every day to provide for their families. Happy Mother's Day!pic.twitter.com/1EwlxaERZt,2017-05-14 13:15:13,14,3,863744509217255424
You are never too young to start learning good financial habits! It’s encouraging to see banks… https://www.instagram.com/p/BT_2_JCD8Xb/ ,2017-05-12 15:45:24,4,1,863057528652955648
I had a great meeting today with Greene County Senior Corps RSVP volunteers as well as Erin… https://www.instagram.com/p/BT95gdcDKw2/ ,2017-05-11 21:28:56,12,3,862781595626983425
http://thehill.com/blogs/pundits-blog/homeland-security/332869-heres-the-incorruptible-independent-fbi-director-the …,2017-05-11 16:07:10,0,0,862700619588657156
"Today I had the opportunity to tour the Amphenol Aerospace plant in Sidney, Delaware County.… https://www.instagram.com/p/BT7USUaj-iN/ ",2017-05-10 21:25:13,0,0,862418272322506756
Today I toured custom wood manufacturer Unalam’s Sidney facility where I learned about the… https://www.instagram.com/p/BT7G0OkDVW3/ ,2017-05-10 19:27:31,2,0,862388649786265600
The Administration owes it to the American people to explain the reasons behind this termination. http://faso.house.gov/news/documentsingle.aspx?DocumentID=305 …pic.twitter.com/R5oqOh8R3B,2017-05-10 13:58:30,42,13,862305852509892608
ICYMI: Big thanks to @AlanChartock and all our callers today on @WAMCVoxPop. Listen here:http://wamc.org/post/open-forum-5917-john-faso …,2017-05-09 19:39:32,2,1,862029288861835266
Today I spoke to a gathering of constituents at the NY Statewide Senior Action Council's spring… https://www.instagram.com/p/BT13YmSj7ja/ ,2017-05-08 18:36:29,5,1,861651032014802944
ICYMIhttps://www.washingtonpost.com/news/fact-checker/wp/2017/05/06/no-the-gop-health-bill-doesnt-classify-rape-or-sexual-assault-as-a-preexisting-condition/?tid=sm_tw&utm_term=.ce6668b0da68 …,2017-05-08 15:53:53,1,0,861610114863726592
Friday evening I had the privilege of commemorating Ed Hamm and his 30 years of service as well… https://www.instagram.com/p/BTzqfx0jt9B/ ,2017-05-07 23:11:43,1,0,861357911074889732
https://www.washingtonpost.com/opinions/my-son-has-a-preexisting-condition-hes-one-of-the-reasons-i-voted-for-the-ahca/2017/05/04/26c234b2-30fd-11e7-9534-00e4656c22aa_story.html?utm_term=.64d875e9dd81 …,2017-05-05 11:42:32,15,2,860459694850265088
Read my full statement on the passage of the AHCA here:http://faso.house.gov/news/documentsingle.aspx?DocumentID=301 …,2017-05-04 18:20:10,27,17,860197375385767936
"After careful review of the changes to the AHCA, I believe that this legislation addresses my concerns and I will support it as amended.",2017-05-04 13:56:22,115,112,860130988642504704
This bipartisan agreement avoids a government shutdown and includes an array of legislative victories for #ny19.http://faso.house.gov/news/documentsingle.aspx?DocumentID=298 …,2017-05-03 22:57:23,0,0,859904750342615040
"Dairy farmers, parents and schoolchildren agree: more milk options will provide a healthy alternative to sugary juice and sports drinks.https://twitter.com/thedailystar/status/859725130146103296 …",2017-05-03 14:59:15,5,2,859784423650340864
Today I welcomed a group of Bruderhof Platte Clove School students from Greene County to our… https://www.instagram.com/p/BTmk2LSDcE6/ ,2017-05-02 20:05:53,8,0,859499201478230018
".@secretarysonny expands milk options for our schoolchildren, providing choice and helping our dairy farms.http://faso.house.gov/news/documentsingle.aspx?DocumentID=296 …",2017-05-02 00:00:01,4,2,859195738730921984
"During this #SmallBusinessWeek, I had the opportunity to tour Plug Power’s innovative fuel-cell… https://www.instagram.com/p/BTkXxK9jaCI/ ",2017-05-01 23:33:07,3,2,859188968168062976
This weekend I visited the Sands Creek Restoration Project site in the heart of one of the Upper… https://www.instagram.com/p/BTkNBIwDD2y/ ,2017-05-01 21:59:10,0,1,859165325186785280
I spoke w/ @sarbetter on @CapPressRoom about tackling much-needed tax reform. Listen here:https://youtu.be/-dfbYQpvFpY ,2017-04-28 18:00:03,5,3,858017983901204481
My statement on passing a continuing resolution that will fund the government through May 5.http://faso.house.gov/news/documentsingle.aspx?DocumentID=287 …,2017-04-28 16:49:53,4,1,858000328997953536
"This week I spoke w/ @fud31 on @TALK1300 about funding the government, tax reform, and healthcare. Listen here:https://youtu.be/JDlZznqHz8M ",2017-04-28 14:49:03,2,0,857969919169875968
Tune in at 11AM to @CapPressRoom where I speak with @sarbetter about tax reform. Listen here: https://www.wcny.org/radio/capitolpressroom/ …,2017-04-27 14:57:20,2,1,857609616498319360
Saturday is National Prescription Drug Take-Back Day. Find your collection site to safely dispose of old Rx drugs at http://DEA.gov pic.twitter.com/YG5OmzfgqE,2017-04-25 18:34:18,3,1,856939440446558208
LISTEN: I'm talking now with @fud31 on @TALK1300. Tune in!,2017-04-25 14:17:30,3,1,856874815998881792
Today marks the beginning of what I think will be greatly beneficial to family farmers of #ny19.… https://www.instagram.com/p/BTSObjvDnd9/ ,2017-04-24 22:25:11,5,2,856635157218037760
Join me in reflection and prayer to remember the victims of the Holocaust on this Yom HaShoah. #NeverForget #HolocaustRemembranceDaypic.twitter.com/Vp1MrcV61M,2017-04-24 20:16:40,7,1,856602813799043073
"In honor of #EarthDay, let’s do our part to preserve our natural treasures. Conservation is a bipartisan value.pic.twitter.com/PQU9fGw7Qe",2017-04-22 13:55:30,23,13,855782114620579840
"Great day in Delaware and Otsego counties yesterday. I toured Mallinckrodt Pharmaceuticals,… https://www.instagram.com/p/BTKSrMUDyVJ/ ",2017-04-21 20:28:21,6,1,855518591634075649
I recently toured SUNY New Paltz with President Donald Christian to visit some of the facilities… https://www.instagram.com/p/BTH1DIYjU1R/ ,2017-04-20 21:31:00,5,0,855171970878636032
I was in Sullivan County this week meeting with constituents on topics from immigration to… https://www.instagram.com/p/BTHgqHDDhrA/ ,2017-04-20 18:32:49,5,1,855127126693093376
Watch the livestream here: https://www.youtube.com/watch?v=mt5fKJci61k … #fasoforumhttps://twitter.com/DailyFreeman/status/854671674926551041 …,2017-04-19 13:23:42,2,1,854686946962137089
Did you know Americans spend 6.1 billion hours each year complying with the bloated tax code? Time for a simpler system. #TaxDaypic.twitter.com/kz3DUBq8bT,2017-04-18 16:13:59,4,0,854367412686376961
It’s National Park Week! #FindYourPark and take advantage of free admission to any park in the US on April 22 and 23!pic.twitter.com/HH9TUvx4qo,2017-04-17 19:30:04,18,6,854054370945769472
"May the blessings of Easter bring you a renewed sense of hope, faith and happiness.pic.twitter.com/Oou80ozC6A",2017-04-16 11:12:38,11,1,853566801539715074
I recently met with @sunycobleskill President Dr. Marion Terenzio and Provost Dr. Susan… https://www.instagram.com/p/BS4Ia9OjN8e/ ,2017-04-14 19:12:37,4,0,852962817716219904
Thanks to everyone who attended and tuned in to tonight's town hall with WMHT! https://www.instagram.com/p/BS2TOVCjOPo/ ,2017-04-14 02:08:21,6,3,852705049721663488
Behind the scenes of my interview with @FiOS1NewsLHV. Tune into “Richard French Live” at 6 p.m.… https://www.instagram.com/p/BS1g3jjjw6i/ ,2017-04-13 18:49:39,2,0,852594651202809857
Started the week off with a constructive day of constituent meetings in our Kingston district office.pic.twitter.com/Rnj6mS7cyW,2017-04-13 16:17:54,7,1,852556458545885184
More info on how to watch LIVE #FasoTownHall here: http://faso.house.gov/blog/default.aspx?postid=274 … cc: @WMHTPubMedia,2017-04-12 22:10:36,4,4,852282830306541568
Great meeting with #ny19 dairy producers at the Kinderhook district office today. We had an… https://www.instagram.com/p/BSwyaFjDuUX/ ,2017-04-11 22:45:24,6,0,851929200563040256
To all our friends and neighbors observing Passover: Chag Sameach! #pesach https://www.instagram.com/p/BSuTb3wj1n8/ ,2017-04-10 23:36:16,7,0,851579616183689217
Save the date! I’ll be joining @WMHTPubMedia for a LIVE televised town hall. #FasoTownHall #ny19 For more details: http://www.wmht.org/fasotownhall/ pic.twitter.com/mTm8DtaOyG,2017-04-10 17:07:54,8,8,851481877844299776
"Another $35M spending gift in the supposedly ""lean"" NYS budget. https://www.empirecenter.org/publications/more-tax-goodies-for/ …",2017-04-10 15:36:57,2,0,851458991402213377
Spent the morning in Oneonta with our dedicated Red Cross volunteers installing smoke detectors… https://www.instagram.com/p/BSo31wjDjUC/ ,2017-04-08 20:58:56,5,0,850815244066852864
Calling all high school artists: Participate in this year’s Congressional Art Competition. Learn more: https://faso.house.gov/constituent-services/arts-competition.htm … #ny19,2017-04-07 15:14:10,2,2,850366095429074945
My statement on U.S. air strikes in Syria:http://faso.house.gov/news/documentsingle.aspx?DocumentID=270 …,2017-04-07 11:15:00,9,3,850305905702907904
Thanks to Major General Tony German and Brigadier General Ray Shields of the New York National… https://www.instagram.com/p/BSj0zD9j3xD/ ,2017-04-06 21:56:08,0,0,850104865267253248
"WATCH: A simpler, fairer tax code would greatly benefit our family farms. @HouseAgNewshttps://youtu.be/D-dePJ0joAQ ",2017-04-06 20:44:32,3,0,850086845568430085
@RepChrisCollins @RepTomReed @RepStefanik @RepTenney @RepLeeZeldinhttps://twitter.com/repjohnfaso/status/850058176020041728 …,2017-04-06 18:52:57,1,0,850058764581560321
My Property Tax Reduction Act cuts property taxes and reins in costs.http://faso.house.gov/news/documentsingle.aspx?DocumentID=259 …,2017-04-06 18:50:37,5,0,850058176020041728
Our family farms need the certainty of effective credit programs during economic downturns. #nofarmsnofoodhttps://youtu.be/nWXHb5_m0Ro ,2017-04-05 23:42:07,6,1,849769147621924866
Read my full statement on the Hudson River barge accident here: http://faso.house.gov/news/documentsingle.aspx?DocumentID=247 … /3,2017-04-04 17:54:40,3,1,849319321482526720
I am in contact with Greene County Sheriff Seeley and continue to receive updates and accident assessments as they become available. /2,2017-04-04 17:54:27,3,0,849319267636006914
I am relieved to see that there were no major injuries or spillage resulting from today’s barge incident on Hudson River. /1,2017-04-04 17:54:17,4,0,849319223465832449
This weekend I attended opening day of trout fishing season at the Catskill Fly Fishing Center… https://www.instagram.com/p/BScK4R3D1sX/ ,2017-04-03 22:35:18,6,1,849027555499929600
Home-care professionals can continue to provide care w/out Washington getting between patient & caregiver.http://faso.house.gov/news/documentsingle.aspx?DocumentID=246 …,2017-04-03 22:15:24,2,0,849022549895790592
I look forward to working with colleagues on the bipartisan #ClimateCaucus. @citizensclimatehttp://faso.house.gov/news/documentsingle.aspx?DocumentID=242 …,2017-03-31 21:32:43,14,1,847924642572533761
It’s on Mr. Cuomo and Albany to end the Medicaid Mandate.http://faso.house.gov/news/documentsingle.aspx?DocumentID=225 …,2017-03-30 21:41:26,4,0,847564450529988609
This morning I was joined by members of @goppolicy as we met with General David Petraeus to… https://www.instagram.com/p/BSRT7cuDILG/ ,2017-03-30 17:23:08,4,0,847499446963150849
This week I met with students participating in the SUNY Students on the Hill program. I had a… https://www.instagram.com/p/BSQz8oLji3Q/ ,2017-03-30 12:43:09,4,0,847428986602889218
I met with constituents from Rensselaer and Greene counties with the Northeastern Retail Lumber… https://www.instagram.com/p/BSPAMXyDM7e/ ,2017-03-29 19:51:40,4,1,847174438403686401
WATCH: @HouseAgNews subcommittee talk SNAP and a pathway to work and independencehttps://youtu.be/AM6pTM32XtQ ,2017-03-29 13:43:35,1,0,847081807950548997
Today I met with constituents from Columbia and Delaware counties to discuss rural broadband and… https://www.instagram.com/p/BSNCHSMDl9g/ ,2017-03-29 01:29:59,10,1,846897190018592768
"Ultimately, consumers have the right to decide how their information will be used. http://faso.house.gov/news/documentsingle.aspx?DocumentID=224 … #SJR34",2017-03-28 23:13:22,36,3,846862811942682624
I had the honor of paying tribute to Columbia County veteran Bruce Hotaling. Mr. Hotaling was… https://www.instagram.com/p/BSKB-KPjDwi/ ,2017-03-27 21:31:00,6,1,846474660992761859
"“The Collins-Faso New York Medicaid proposal, were it law, could be a great favor to every one of us” http://www.lockportjournal.com/opinion/our-view-about-the-governor-s-unbelievable-medicaid-rant/article_88cb27d3-162f-51f7-831a-838248b2c697.html …",2017-03-27 16:15:51,4,2,846395349535260674
"I joined @HARRISFAULKNER on @FoxNews to discuss healthcare, the budget and tax reform. Watch here:http://video.foxnews.com/v/5373288925001/?#sp=show-clips …",2017-03-27 12:28:14,40,7,846338067602518016
"@TheLeaderHerald: We support lifting the Medicaid cost burden off local taxpayers, however that can be resolved now. http://www.leaderherald.com/opinion/editorials/2017/03/collins-faso-had-merit/ …",2017-03-26 17:41:40,0,0,846054560456200192
Property taxpayers need relief.http://www.watertowndailytimes.com/opinion/its-time-to-shift-state-should-relieve-counties-of-the-burden-to-fund-medicaid-20170326&template=mwdt …,2017-03-26 13:49:55,5,1,845996238696787968
I was pleased to speak at today's grand opening and ribbon-cutting of the Lebanon Valley… https://www.instagram.com/p/BSFZ7pVjmAY/ ,2017-03-26 02:24:10,3,0,845823664444575745
My statement on the decision to pull the AHCA from consideration today.http://faso.house.gov/news/documentsingle.aspx?DocumentID=220 …,2017-03-24 23:02:02,3,1,845410407510671360
It’s time to bring overdue property tax relief to Upstate and Long Islandhttp://nypost.com/2017/03/23/this-federal-medicaid-fix-rights-a-decades-old-new-york-wrong/ …,2017-03-24 16:39:44,5,0,845314196040536064
I spoke with @fud31 on @TALK1300 about my Medicaid amendment that will lower taxes for homeowners & small businesseshttps://www.youtube.com/watch?v=Oif1JFwjBR0&feature=youtu.be …,2017-03-24 01:17:49,12,5,845082191537287169
New Yorkers are fleeing in large part because their property taxes are too high. It's time to bring some relief! http://www.wgrz.com/news/upstate-ny-hit-hard-as-more-migrate-out/424916453 …pic.twitter.com/e1Lwj8tyM7,2017-03-23 22:20:52,6,0,845037659085029376
"Stop with the fake news, Governorhttp://faso.house.gov/news/documentsingle.aspx?DocumentID=209 …",2017-03-23 22:03:09,18,6,845033201022226434
"Hey, @NYGovCuomo & @LtGovHochulNY: Look at all these “millionaires” unhappy w/ economic opportunity in NYS:http://www.poughkeepsiejournal.com/story/news/local/2017/03/23/leave-ny-dutchess-population-shrinks/99513178/ …",2017-03-23 17:02:15,5,1,844957474151157761
Mr. Cuomo has also forgotten that Governor Mario Cuomo made a similar proposal early in his tenure.http://faso.house.gov/news/documentsingle.aspx?DocumentID=208 …,2017-03-22 23:04:11,11,1,844686171410239488
https://twitter.com/matt_hamilton10/status/844636913587945472 …pic.twitter.com/1vwBDMRYGS,2017-03-22 20:15:18,4,3,844643669089112064
pic.twitter.com/bRQQnw0pAS,2017-03-22 18:32:12,4,1,844617725557325826
Another example of unnecessary spending from Albany. http://ow.ly/LNVh30a7W26 ,2017-03-21 20:34:25,4,1,844286094980120576
"Not zealotry, just long overdue Medicaid program consolidation.https://twitter.com/matt_hamilton10/status/843955670160478212 …",2017-03-20 22:57:34,20,10,843959732499070977
"Recently I met with constituents at the Maple Weekend festivities at Shaver-Hill Maple Farm,… https://www.instagram.com/p/BR3gesXjC3R/ ",2017-03-20 16:52:01,4,0,843867737290145792
I joined a majority of @housebudgetGOP members to approve a procedural step for #AHCA. Read my statement here:http://faso.house.gov/news/documentsingle.aspx?DocumentID=193 …,2017-03-16 22:36:31,9,6,842504880153550849
"Due to a high volume of calls to our office, I encourage those who cannot get through to send an email here: 
https://faso.house.gov/contact/ ",2017-03-16 14:12:28,14,17,842378033340272640
Learn more here: http://faso.house.gov/news/documentsingle.aspx?DocumentID=191 …https://twitter.com/matt_hamilton10/status/842062495527391232 …,2017-03-15 17:22:15,7,2,842063404269481984
Thanks to everyone who participated in Monday’s teletown hall. More of your questions answered here:https://www.youtube.com/playlist?list=PLCHSYcWRnWsf1wW8MM_BXGT8Bz0Go0UVO …,2017-03-15 01:54:28,3,0,841829922645643264
I talked with @radiotalkermike today about the #AHCA and the multiphase process of fixing our healthcare systemhttp://www.mikeonline.com/congressman-johnfasony-mike-breakdown-the-cbo-numbers-on-the-gop-healthcare-plan/ …,2017-03-14 22:59:27,1,0,841785876912955393
I spoke with @ArthelNeville on @foxnews recently about the American Health Care Act. Watch here:https://youtu.be/wg5QdefdfbY ,2017-03-14 17:55:18,1,0,841709337584291840
Talking with @radiotalkermike this morning. Make sure to tune in. http://www.mikeonline.com/congressman-johnfasony-and-mike-breakdown-the-cbo-numbers-on-the-gop-healthcare-plan/ …,2017-03-14 14:02:23,2,0,841650722001293312
"Tonight I contacted 20,000 residents of #ny19 and heard from them on various topics of concern,… https://www.instagram.com/p/BRmS9R8DGTh/ ",2017-03-14 00:26:46,13,2,841445464067190785
I spoke with @lizclaman on @foxbusiness about the American Health Care Act. Watch the interview here:http://video.foxbusiness.com/v/5358010486001/?#sp=show-clips …,2017-03-13 22:35:58,3,1,841417581743476740
Nothing like a hot cup of coffee after the St. Patrick's Day parade with County Executive Kathy… https://www.instagram.com/p/BRjnJuwDNhh/ ,2017-03-12 23:25:31,5,1,841067660020502528
Had a great time at the Hoosick Falls St. Patrick's Day parade yesterday. It was great seeing… https://www.instagram.com/p/BRjXGBJjiVg/ ,2017-03-12 21:05:12,3,0,841032351060750336
I talked with @CTLizB last night about the American Health Care Act. Catch the interview here: http://www.twcnews.com/nys/capital-region/capital-tonight-interviews/2017/03/9/john-faso-030917.html … @CapitalTonight,2017-03-10 15:49:17,6,1,840228070405656576
Watch my discussion on the importance of clean-water infrastructure and broadband https://www.youtube.com/watch?v=5bvIiFySa8I … @HouseAgNews #ny19,2017-03-10 00:38:40,5,1,839998907111374848
Today I discussed the defense budget and local employment conditions with Steve Bartells and Bob… https://www.instagram.com/p/BRb5Mdtjcpl/ ,2017-03-09 23:29:16,4,1,839981440846684160
I joined @fud31 on @talk1300 to discuss the American Health Care Act. Have you #readthebill? http://ReadTheBill.GOP  https://youtu.be/CgS2I2s__ow ,2017-03-09 01:58:20,1,0,839656568132100100
My take: http://faso.house.gov/news/documentsingle.aspx?DocumentID=157 …https://twitter.com/HouseGOP/status/839260122572533761 …,2017-03-08 00:54:18,3,1,839278063632416772
"It was a pleasure meeting Joshua Brennan, who was made an Honorary Member of the Pawling Fire… https://www.instagram.com/p/BRTZDJjDFCm/ ",2017-03-06 16:14:26,4,0,838784848999366656
This week I met with various organizations and constituents in Washington and #ny19. Thanks to… https://www.instagram.com/p/BRMhphJDhCx/ ,2017-03-04 00:14:53,2,1,837818595832958980
Did you miss the livestream editorial meeting today with the @PokJournal ? Watch the replay here:http://www.poughkeepsiejournal.com/story/opinion/2017/03/01/journal-live-stream-meeting-faso-friday/98588526/ …,2017-03-03 22:37:14,1,0,837794018461380608
Letting Washington know that the Capital Region’s local manufacturing matters.https://youtu.be/DWBVJS_w81c ,2017-03-02 20:29:41,3,1,837399531763400704
#LIHEAP is critical to vulnerable families who need assistance paying their energy bills.http://faso.house.gov/news/documentsingle.aspx?DocumentID=126 …,2017-03-01 22:12:24,7,4,837062994173521922
Great meeting with @NYFarmBureau! Thanks for stopping by while on Capitol Hill.pic.twitter.com/emJfxCVNjt,2017-03-01 18:37:59,5,1,837009033378807813
My statement on the @POTUS #JointAddress.pic.twitter.com/LowAuTQvCV,2017-03-01 03:32:33,8,3,836781176106942464
Necessary defense funding can rebuild military readiness and strengthen national security. #JointAddress,2017-03-01 02:56:25,7,3,836772081803083776
"Keep what works in #ACA, fix what doesn’t, and lower costs: http://thehill.com/blogs/congress-blog/healthcare/320879-healing-the-aca-and-lowering-costs … #JointAddress",2017-03-01 02:40:57,12,2,836768188067115008
"We need economic growth. Our promises to seniors, veterans, schools cannot be fulfilled without it. #JointAddress",2017-03-01 02:30:35,8,1,836765582536159234
"@POTUS spot-on in call for unity. As Lincoln said in 1st Inaugural: “We are not enemies, but friends. We must not be enemies.” #JointAddress",2017-03-01 02:11:27,1,1,836760766728515584
"#WOTUS rule is a dangerous expansion of EPA's authority over #ny19 family farms, businesses and property owners.http://faso.house.gov/news/documentsingle.aspx?DocumentID=124 …",2017-02-28 23:25:08,5,2,836718910133125120
Proud to join @RepJoeCourtney and @CongressmanGT in supporting our next generation of farmers. #YFSA http://www.hpj.com/general/bipartisan-bill-seeks-to-help-young-farmers-serve-their-country/article_276b4b31-76cc-5b26-bd56-d7473ab9c4bd.html …,2017-02-28 16:29:29,3,0,836614310751264768
"In response to add'l threats against JCCs, I'm urging our fed officials to assist those targeted by acts of hate. http://bit.ly/2mEzWdz https://twitter.com/NBCNightlyNews/status/836359097050095616 …",2017-02-28 00:15:30,24,6,836369196485394432
Today I met with @NYSCounties to discuss how we can provide relief to local taxpayers and reduce the high cost of living in NY.pic.twitter.com/d2gDINR6TB,2017-02-27 23:27:19,3,0,836357073294221313
"I spoke with @sarbetter on how I’m representing #ny19, the ACA, and my letter to the EPA about Hoosick Falls. http://ow.ly/SAcv309puw4 ",2017-02-27 20:57:36,3,0,836319396213702657
Great week back in #ny19 meeting constituents from all over our district to discuss various… https://www.instagram.com/p/BRBQ4rJDVfh/ ,2017-02-27 15:16:46,4,0,836233622260695040
"During district work week, I toured the Northeast Treaters facility in Athens. I learned about… https://www.instagram.com/p/BQ_XSyED25I/ ",2017-02-26 21:34:16,3,0,835966236370558981
Thanks to @recordonline for the thoughtful discussion at today’s meeting of its editorial board: https://www.facebook.com/RepJohnFaso/posts/707714126078123 …,2017-02-24 20:19:39,3,1,835222681180114944
