Text,Date,Favorites,Retweets,Tweet ID
So far 57 House Dems have broken with their party's leadership to support our effort to prevent federal workers from being used as pawns.,2013-10-04 00:25:40,7,19,385923641575104512
"This includes national guard/reservist pay, cancer research, national parks, DC city government, and veterans benefits.",2013-10-04 00:25:06,4,5,385923499157508097
The House has stepped up though and is continuing to pass clean/non-controversial spending bills to fully fund aspects of the federal gov't,2013-10-04 00:24:50,4,11,385923430018588673
"In the history of the US, this is the very first time one of the party's has taken the stance of refusing to negotiate on the budget.",2013-10-04 00:24:29,2,15,385923342223413248
Day three of a government shutdown and President Obama and Harry Reid are continuing to publicly state that they will not negotiate.,2013-10-04 00:23:26,1,9,385923078292660224
@Orangeone4 @vmpcott like I said yesterday. Not true. Please stick to facts,2013-10-03 20:51:38,0,0,385869775047372800
Very thankful for the Capitol Police who work tirelessly to keep Members and the public safe here on the Hill.,2013-10-03 19:42:54,5,9,385852477645402112
That last retweet demonstrates my point...,2013-10-03 17:16:42,9,0,385815685089488896
The dems new talking point of referring to GOP as terrorists needs to stop. Same goes with their refusal to negotiate #MakeDCListen,2013-10-03 17:07:58,24,56,385813488578215936
"US is still spending in the red, even after Fiscal Cliff tax increases and sequester budget cuts. We have to borrow that $, hence our debt",2013-10-03 15:28:29,2,3,385788454862614528
Our Nation is almost $17 Trillion in debt ..... That's not chump change.....,2013-10-03 15:23:28,2,13,385787189218783232
@RepJeffDuncan *our,2013-10-03 15:22:29,0,1,385786944653119488
Out nation is almost $17 Trillion in debt. That's not chump change.....,2013-10-03 15:22:07,2,3,385786852546187265
Are you able to keep your insurance plan if you like it? Obama said you could... #SenateShutdown,2013-10-03 15:16:02,2,6,385785320119472128
"""OBAMACARE won't add a dime to deficit"" BHO 9/9/09 (actually adds $6.2 Trillion over next decade according to GAO in Mar.'13)#SenateShutdown",2013-10-03 15:14:53,5,17,385785030641209344
Words of wisdom from James Madison and Federalist 58,2013-10-03 13:17:30,3,13,385755489759264768
"...the immediate reps of the people, for obtaining a redress of every grievance, & for carrying into effect every just & salutary measure.""",2013-10-03 13:16:59,3,12,385755361682022400
"""This power over the purse may, in fact, be regarded as the most complete and effectual weapon with which any constitution can arm...""",2013-10-03 13:16:23,7,23,385755209365856257
"Harry Reid replied, ""Why would we want to do that?"" Make no mistake, this is Harry Reid's shutdown.",2013-10-03 12:16:39,3,15,385740175264870400
"CNN reporter Dana Bash asked Harry Reid about the medical research bill: ""If you can help one child who has cancer, why wouldn't you do it?""",2013-10-03 12:16:15,2,8,385740075083902976
"However, the President said he would veto those bills if they made it to his desk.",2013-10-03 12:15:36,0,5,385739911308902400
he House voted last night to restart funding for critical medical research and our national parks (with no strings or conditions attached).,2013-10-03 12:15:13,1,7,385739816098209792
"However, the White House reiterated that the meeting was not a negotiation since they will not negotiate on those two issues.",2013-10-03 12:14:47,2,7,385739706652049408
Last night Congressional leaders met with the President at the White House this to discuss the government shutdown and the debt ceiling.,2013-10-03 12:14:23,1,2,385739605204422656
Nothing like #DuckDynasty to take your mind off the day!,2013-10-03 02:10:07,14,13,385587539207528448
@DickersonHouse those are compromises. I also voted to delay individual mandate for a year. That has bipartisan support. I want full repeal,2013-10-02 23:57:10,0,1,385554080669515776
"@DickersonHouse for starters I've voted to fully fund military, veterans, and NIH with no strings attached.",2013-10-02 23:50:31,0,1,385552405883916288
@DickersonHouse I'm happy to work with him. Need the President to change his position & be willing to negotiate in order for that to happen,2013-10-02 23:45:53,0,0,385551238521454592
"starting to see where the President is getting the idea for his ""no negotiating"" strategy. from the extreme left of his party",2013-10-02 22:05:07,0,11,385525879855927297
@ryanreal sure. Just held a town hall in Dacusville last week.,2013-10-02 21:53:14,0,0,385522890109890560
".@dpleasant if the President takes his oath of office seriously, he will always negotiate with the people's representatives",2013-10-02 21:46:47,3,9,385521267966611456
"If POTUS snipes at Congress with veto threats he must negotiate also RT @ravngsofamadman: POTUS executes law, it's Congress job to negotiate",2013-10-02 21:40:59,1,1,385519810013954048
Why is President Obama unwilling to negotiate? What is he afraid of? A President who won't negotiate is a President who lacks leadership,2013-10-02 21:31:29,6,25,385517418891579393
RT @mikeallen: Carney says this afternoon’s meeting with congressional leaders won’t be a negotiation http://politi.co/GzKXHX  #makeDClisten,2013-10-02 21:28:26,0,8,385516650411208705
Reid would rather use vets & cancer patients as political pawns than support a clean funding bill to protect them. That's low even for DC,2013-10-02 19:51:22,6,19,385492222197514240
"CNN’s Dana Bash: “If you can help one child who has cancer, why wouldn't you do it?""  Sen. Reid:  “Why would we want to do that?”",2013-10-02 18:55:24,4,48,385478138102173696
The White House just issued 5 more veto threats on clean budget bills to open parts of gov't. POTUS again shows he won't negotiate,2013-10-02 15:19:39,1,33,385423840777486336
President Obama seems more interested in spending his time comparing Republicans to terrorists than he does leading the country. #notleading,2013-10-02 14:58:04,2,14,385418410487582720
"House GOP moved forward on a bill to fully fund Veteran's services, but President Obama threatened to veto it #MakeDCListen",2013-10-02 14:57:28,0,20,385418261006782465
The Senate voted yesterday morning AGAINST creating a conference committee to work out the differences with the House #MakeDCListen,2013-10-02 14:56:14,3,21,385417949760069632
So far President Obama and Senator Reid have continued their stance of refusing to negotiate. #MakeDCListen,2013-10-02 14:55:45,5,13,385417826116198400
An interesting read from @politico highlighting the horrid way in which #ObamaCare was pushed on the American peoplehttp://tinyurl.com/o8wy7hv ,2013-10-02 14:52:15,0,11,385416945077477376
"Heartbroken to learn that one of my favorite authors, Tom Clancy, has passed away. My prayers are with his family during this difficult time",2013-10-02 14:42:12,3,7,385414416612618240
I am unabashed about wanting to shutdown Obamacare - B4 Obamacare shuts down America by crippling job creation & wage earners#SenateMustAct,2013-10-02 02:40:24,12,39,385232770102206464
"How long can gov continue to spend $ it doesn't have, tax production, borrow money it can't repay & keep chipping away at our liberties?",2013-10-02 02:35:43,5,19,385231591737671680
We're planning on passing one. @barackobama just threatened to veto it RT @justridelow: Stop playing games. Pass a clean budget bill.,2013-10-01 22:52:23,2,3,385175390169219072
The VA bill is a clean bill. POTUS still threatens veto. RT @justridelow: @RepJeffDuncan @repjustinamash - Pass a clean bill,2013-10-01 22:46:43,11,39,385173964533678081
"Pres Obama isn't interested in ending the shutdown. That's why he won't negotiate, and why he is putting politics ahead of our Vets.",2013-10-01 22:36:45,20,75,385171452795686912
Update: Pres Obama issues veto threat on bill to fully fund veteran services. Continues to put his extreme ideology ahead of the country,2013-10-01 22:35:01,2,19,385171016181248001
@pamnsc I oppose gang of eight bill. I've made my position fairly clear. I have the highest score from NumbersUSA in SC on immigration,2013-10-01 20:52:29,0,0,385145213368279040
@pamnsc you need to read the Rand Paul letter. The letter is not in support of amnesty.,2013-10-01 20:46:53,0,0,385143806653259776
@pamnsc @weeklystandard you need to read the Rand Paul letter. Rand Paul letter does NOT support amnesty.,2013-10-01 20:41:05,0,0,385142343814225920
Just to make sure everyone fully understands. President Obama's stated position is that he will NOT negotiate. Where's the leadership?,2013-10-01 17:34:56,14,59,385095497834168320
Once again President Obama says he will not negotiate. That's not leading Mr. President,2013-10-01 17:19:54,22,51,385091717126299648
They didn't fund the law's defense. @dpleasant @nupe88,2013-09-30 21:41:51,0,1,384795251287662592
.@dpleasant @nupe88 read for yourself. http://tinyurl.com/4fkboag ,2013-09-30 21:38:43,0,0,384794461915447296
Well that's what he did to DOMA RT @nupe88: @RepJeffDuncan @RepJeffDuncan @delbethann @aubman @KelinSC,2013-09-30 21:33:59,0,0,384793272536674304
pres Obama did that with DOMA RT @nupe88: @RepJeffDuncan How can it possibly b legal 2 NOT fund a LAW.,2013-09-30 21:31:49,1,6,384792724139806720
@nupe88 @delbethann @aubman @KelinSC actually it's not free. That's a myth,2013-09-30 21:30:15,0,0,384792329766178817
http://rsc.scalise.house.gov/solutions/rsc-betterway.htm … RT @aubman: @RepJeffDuncan Do u have a plan 2 offer me and/or my fam insurance?,2013-09-30 20:40:25,0,3,384779790231695360
@bubear2001 Grassley Admt to ACA actually put all Congress into exchanges. Personnel ruled July that Employer could pay a portion of cost.,2013-09-30 20:13:33,0,0,384773030578487296
"Respectfully, I feel that it's a step back & will significantly hurt our country RT @aubman #obamacare is a step forward.",2013-09-30 20:10:57,2,4,384772376023420928
Should employers & special interest groups get delay from Obamacare when avg American family doesn't?  Stop ACA from shutting down America!,2013-09-30 20:07:26,1,12,384771491138928641
.@aubman #obamacare is a BAD law. It was rammed through in a partisan way with zero GOP votes. Prob is now POTUS needs GOP votes to move fwd,2013-09-30 19:57:52,1,9,384769081477308416
Why is it ok for Pres Obama to stand on principle but not ok for GOP? #HarryReidsShutdown #NoSpecialTreatment #ReplaceReid,2013-09-30 19:52:06,10,44,384767631330271232
The choice is clear:  Shut down the thing that is shutting down America by #DefundingObamacare #HarryReidsShutdown,2013-09-30 19:49:20,12,42,384766934266691584
.@kc5gpm I've voted to fund the government. I just haven't voted to fund ObamaCare.,2013-09-30 19:09:33,4,9,384756922353987584
.@kokomo0795 @Truth_Wins sure. http://rsc.scalise.house.gov/solutions/rsc-betterway.htm …,2013-09-28 18:20:12,1,3,384019727666147328
".@Truth_Wins when House isn't in session we're not on vacation, we're out listening to the people. @barackobama should try that sometime",2013-09-28 18:15:27,4,11,384018533451325440
In case you hadn't heard: Obama just started a round of golf while the House works to keep government open... #makeDClisten #justsayin,2013-09-28 17:59:43,7,45,384014572530982912
"Reid's parting shot to Boehner: Pass our bill, or it's a shutdown
So-we don't have bi-Cameral legislative Branch - just Harry Reid governing",2013-09-27 22:11:50,9,58,383715632522752000
RT @MacBoney3: @RepJeffDuncan Every business that sends out a layoff or hour cut notice ought to send a copy of each to the White House,2013-09-27 21:42:16,1,14,383708190640451584
RT @leogirlis: @RepJeffDuncan You can't find full time now. Almost all employers in my area are only hiring part time employees.,2013-09-27 21:41:58,1,4,383708116808105984
"I have no desire to shut down the government, but make no mistake, #ObamaCare will shut down America unless we act to stop it. #MakeDCListen",2013-09-27 21:34:04,10,33,383706129953329152
The President needs to stop trying to protect his personal legacy and focus on what’s best for the country. #MakeDCListen #PJNET,2013-09-27 21:33:23,17,154,383705957747793920
"The House has voted to fully fund the federal government, with the lone exception of #ObamaCare. #MakeDCListen",2013-09-27 21:32:57,3,12,383705846909112321
The negative impacts of #ObamaCare represent a far greater threat to the country than any impact of a shutdown #MakeDCListen #PJNET,2013-09-27 21:32:25,20,198,383705712863358976
#ObamaCare will shut America down if Congress does not act to stop it. #MakeDCListen,2013-09-27 21:31:10,0,2,383705399938928640
"With all due respect to @BarackObama, saying something over and over again isn’t enough to make it true. #PJNET",2013-09-27 21:30:42,31,190,383705279797284864
"Leadership isn’t about lecturing, leadership is about leading. Had Obama decided to work with Congress we wouldn’t be in this situation",2013-09-27 21:30:01,2,4,383705109256892416
How many small businesses will be forced to close their doors or stop hiring because of the negative impacts of the new healthcare law?,2013-09-27 21:29:21,3,7,383704939077185537
How many Americans will be unable to find full-time employment because of new ObamaCare regulations on employers? #PJNET,2013-09-27 21:29:03,13,144,383704865819463680
How many Americans will no longer be able to see their current doctor like President Obama promised wouldn’t happen? #PJNET,2013-09-27 21:28:40,11,134,383704767727284224
How many Americans will lose the insurance that President Obama promised them they could keep? #pjnet,2013-09-27 21:28:14,16,144,383704659543617536
I'd ask @BarackObama to think about how many millions more will be hurt if his healthcare law goes into effect? #pjnet,2013-09-27 21:27:49,10,134,383704556481175552
The President asked us to think about who would be hurt if the government were to shutdown...,2013-09-27 21:27:11,0,2,383704395872862208
"...through his unworkable healthcare law, than could ever happen in a government shutdown.",2013-09-27 21:26:45,0,6,383704287701766144
"I don’t appreciate being lectured to by a President who has done more to hurt American families, businesses, and our economy...",2013-09-27 21:26:38,6,22,383704256177377280
"@BarackObama's willing to negotiate with Russia & Iran, but not willing to negotiate with the elected representatives of the American people",2013-09-27 20:00:53,2,6,383682679587094528
"RT @dwallbank: Several House Republicans on the Senate floor for CR vote -- @repjustinamash, @TimHuelskamp, @RepJeffDuncan, @CynthiaLummis",2013-09-27 17:47:09,0,7,383649024676335616
@Bakari_Sellers HHS datahttp://tinyurl.com/qdkg8lg ,2013-09-27 17:40:25,0,0,383647329342861312
Young males in SC buying health insurance on the private market will see their premiums increase by 44% #rateshockpic.twitter.com/KuS8QzeTGg,2013-09-27 17:00:13,4,20,383637209359740928
Walking over to the Senate floor right now to watch the cloture vote on defunding #Obamacare. The time to act is now! #PJNET,2013-09-27 16:36:11,8,120,383631165149569024
.@thestate newspaper ran my Letter to the Editor on energy this morning http://tinyurl.com/l2b3tvn  #pjnet #sctweets,2013-09-27 12:28:02,7,114,383568715062583296
I'll be on live shortly w @KellyNashRadio @WVOCColumbia Listen here - http://www.iheart.com/live/2085/?autoplay=true … #sctweets,2013-09-26 21:35:11,1,2,383344022514708482
RT @IJSCOTTJBRYAN: U.S. @Repjeffduncan in favor of defunding #Obamacare through CR bill. #sctweets #Politics http://bit.ly/15vR99G ,2013-09-26 21:33:29,1,5,383343595081576448
RT @UpstateTodaySC @mikaylakreuz was on a conference call w Rep Duncan yesterday. Here's what he said on Obamacare http://buff.ly/1fohcJO ,2013-09-26 21:32:05,0,2,383343239865974784
@Rep_Southerland has become one of my best friends in life. Please read this article & pray for Steve & his service-http://goo.gl/5RVsqL ,2013-09-26 13:13:27,0,1,383217756448886784
RT @DolphBell: US Rep. Jeff Duncan says he's willing to let the government shutdown rather than fund it without changing Obamacare #PJNET,2013-09-25 21:40:05,11,122,382982864704262144
@Gerilenn @RightNowLady @SenTedCruz both,2013-09-25 01:58:54,0,0,382685613109288960
"@RightNowLady @SenTedCruz I'm in South Carolina, I had a town hall meeting tonight. Support Senator Cruz from SC!",2013-09-25 01:50:47,0,1,382683570105761792
#KeepCruzing @SenTedCruz - I support your efforts - #defund #ObamaCare #MakeDCListen #tcot #pjnet,2013-09-24 21:10:21,47,278,382612997639643137
"@SSReaney I stand with Cruz. I'm in SC today, holding a town hall meeting in edgefield tonight",2013-09-24 20:55:17,1,1,382609204554784768
Not according to @barackobama RT @justgrateful: Wrong---@BarackObama WILL negotiate with Republicans,2013-09-24 20:37:26,0,2,382604712052535296
@RWBowen I would but I'm in SC. I'll be up there tomorrow. Very proud of him.,2013-09-24 20:35:33,0,2,382604236728852480
@LanderHiott that's a full time job. No promises!,2013-09-23 22:55:32,1,0,382277080244707330
Looking forward to holding another town hall in Dacusville tonight!!pic.twitter.com/97DWSbxDj6,2013-09-23 22:32:21,3,2,382271242813726720
"What does ObamaCare mean to the average family? $7,450 increase in health spending.... http://goo.gl/bngFDz  #SenateMustAct #tcot #pjnet",2013-09-23 19:54:51,19,215,382231606028554241
Thanks guys. Enjoyed it as always.,2013-09-22 23:46:20,0,2,381927474193760256
.@gpmcleer check this healthcare proposal out http://rsc.scalise.house.gov/solutions/rsc-betterway.htm …,2013-09-22 23:44:06,3,7,381926912765214720
".@gpmcleer I do. Allow association health care plans, provide individuals same tax benefits as biz, encourage high risk pools",2013-09-22 23:40:44,1,2,381926066530811904
Sorry you feel that way. I think we can respect each other & still disagree RT @And_truuuuuu: you make me embarrassed to be South Carolinian,2013-09-22 23:37:47,1,0,381925322067017728
Pelosi may vote 4 bills based on their title but I don't RT @USAFVeteran1: Why defund? It's called Patient Protection & Affordable Care Act?,2013-09-22 23:33:35,3,3,381924267879051264
I am. Extremely difficult situation for family. RT @sctuten: @RepJeffDuncan are you familiar with the baby veronica case.,2013-09-22 23:30:56,0,0,381923598094843904
I'll never believe that freedom is a lost cause RT @Daddywss: @RepJeffDuncan why hurry back... your battle is a lost cause! #PJNET,2013-09-22 23:17:09,12,109,381920130391101440
You're welcome! RT @Aikenbound: @RepJeffDuncan just wanted to thank you for your vote to #DefundObamacare,2013-09-22 23:14:56,2,5,381919571084861441
.@EWReschke yup. Held several in July/August as well,2013-09-22 23:11:12,1,1,381918633481764864
".@kokomo0795 haven't had a chance to read it yet but I hope to do so soon. Recently finished ""power hungry"" by Robert Bryce",2013-09-22 23:10:20,0,2,381918414425849856
.@Prairie_Cajun @SenTedCruz I'm proud to be an early #defund supporter. We have to use whatever leverage we can to stop #obamacare.,2013-09-22 23:06:17,5,9,381917394031362048
.@LJCambria2 @mericanrefugee we do. We need to fight harder and we need help from the public but we can turn this country around.,2013-09-22 23:04:14,0,2,381916878878560256
.@LibMuncher ha! since I'm not running for President I think I get a free pass on that question.,2013-09-22 23:02:46,1,1,381916511658848257
I'm around for a few minutes if anyone has any questions or comments for me. #PJNET #tcot #sctweets,2013-09-22 23:00:09,2,105,381915852221972480
Looking forward to some great meetings in SC over the next few days before heading back to DC on Wednesday for #obamacare/#defund battle,2013-09-22 22:58:56,2,4,381915547103141888
@GlobalPolitico glad you enjoyed it. Robert is a talented writer.,2013-09-22 22:56:50,0,0,381915017173794816
@GlobalPolitico,2013-09-22 22:56:10,0,0,381914851414913024
.@chucktodd @jaketapper hope you read my previous tweets and report on the games the WH is playing with the public and media.,2013-09-21 14:21:25,2,16,381422919307780096
"Then a day later when the story disappears, the WH reverts back to its original position of not negotiating?",2013-09-21 14:18:42,1,10,381422237200678912
"So when Republicans raise the point in the media that @barackobama won't negotiate, his staff then lies to the press and says he will?",2013-09-21 14:17:09,12,48,381421845234614272
"RT @politico: Obama calls Boehner, rules out debt talks 9/21/13 http://politi.co/1bwxqOd  #PJNET",2013-09-21 14:10:54,7,145,381420275386318848
"From @politico ""Boehner's suggestion that Obama won't negotiate with him is 'irrefutably false,' Carney said."" 9/19/13 #PJNET",2013-09-21 14:09:18,3,114,381419871890055169
"So WH is back to saying they won't negotiate? #noleadership RT @politico: Obama calls Boehner, rules out debt talkshttp://politi.co/1bwxqOd ",2013-09-21 13:59:12,0,13,381417330653532160
The House stands w the American people in defunding ObamaCare. Time for the Senate to show America who they stand with #SenateMustAct #pjnet,2013-09-20 17:44:52,43,234,381111731541401600
Statement on passage of H.J.Res.59 - http://goo.gl/zlM0Eg  - the Senate must get off their hands and act. #SenateMustAct #tcot #pjnet,2013-09-20 15:37:47,10,130,381079752221523968
Pelosi on the House floor now talking on #ObamaCare. How about read the bill next time.... #tcot #pjnet #SenateMustAct,2013-09-20 14:19:50,28,174,381060134652223488
"Today the House considers a CR that defunds #ObamaCare, a bill in direct response to the American people #tcot #pjnet",2013-09-20 13:52:55,14,127,381053359953674240
It has been 5 years.... #timetobuild Keystone XL Pipeline http://youtu.be/Q3fUxj1i-wg  #enoughalready,2013-09-19 21:48:28,8,35,380810649338535936
Proud of my friend @TGowdySC for demanding answers on #Benghazi http://youtu.be/ofDh5TNI9xI  #pjnet,2013-09-19 20:38:02,33,183,380792921856802817
DHS acquisitions consume hundreds of billions of dollars and deserve rigorous Congressional oversight.,2013-09-19 18:11:22,4,12,380756014124908545
Chairing a subcommittee hearing now on DHS acquisitions & lessons to be learned from private sector. Watch here:http://goo.gl/lih5GT ,2013-09-19 18:08:35,0,0,380755312724017152
Team Duncan loves the Tigers!!! #solidorange #gotigers #beatncstate #alumni http://instagram.com/p/ec4jTDLcjc/ ,2013-09-19 18:04:36,2,2,380754310495502336
Join me shortly on Conversations with Conservatives here: http://goo.gl/kSdz9f  #tcot #pjnet @conversations,2013-09-19 17:12:04,3,96,380741090795470849
@dmcdonald141 thanks for coming by the office!,2013-09-19 16:28:43,0,0,380730180139888641
.@BarackObama will negotiate with Putin but he won't negotiate with Republicans? Where's the leadership? http://youtu.be/qbMqSjkxGm4  #pjnet,2013-09-19 16:27:29,14,142,380729869765586944
"Unsettling how much this Admin misleads the American people…""you will>can>may get coverage"" http://goo.gl/nsyCIH  #ObamaCare #pjnet #tcot",2013-09-18 18:56:24,9,124,380404960107560960
About to ask my questions during the House Foreign Affairs Committee hearing on #Benghazi,2013-09-18 16:02:23,6,8,380361167069122562
A good article on funding the government vs. funding #ObamaCare http://goo.gl/njKswu  #pjnet #tcot,2013-09-17 18:19:39,11,130,380033322551754753
"The families and the public deserve answers to what really happened before, during, and after the attacks in #Benghazi. #pjnet",2013-09-17 13:23:57,13,139,379958908078407681
The House will hold 3 hearings on #Benghazi this week. I'm going to keep pushing for a more aggressive & complete investigation. #PJNET,2013-09-17 13:23:11,28,154,379958712753856512
Fox News: Charles Woods discusses Congressional Outreach on #Benghazi http://goo.gl/2Q0W5S  @GovMikeHuckabee @jasoninthehouse #NeverForget,2013-09-16 18:23:48,1,6,379671980502302720
Praying #NavyYardShooting,2013-09-16 15:00:38,7,9,379620849973620736
Is that a hint of Fall in the air?,2013-09-14 12:37:10,3,6,378859971602956288
@brianjulian thanks for adding another to the list,2013-09-13 13:29:39,2,0,378510790799540226
"Within 24 hours I've been called an ""anarchist"" by Reid & a ""neanderthal"" by Biden. Dems are getting desperate...",2013-09-13 13:24:39,46,120,378509532399280129
Looking forward to meeting with students at Edwards Middle School this morning! #sctweets,2013-09-13 12:17:50,0,2,378492716457275392
"@beguero9963 I support 2nd amendment, some don't. pointing out hypocrisy",2013-09-13 00:39:58,0,1,378317091893673984
It's wrong for law abiding Americans to own guns but it's okay to give them away to terrorists? http://tinyurl.com/o6xspra  #pjnet #Syria,2013-09-12 20:58:37,70,379,378261387702595584
"My son Graham and me, back in the day! #tbt http://instagram.com/p/eK3ZVhLckd/ ",2013-09-12 19:53:36,5,2,378245028029923328
@TaylorMade014 thanks Taylor!,2013-09-12 18:20:38,0,0,378221633040687104
@3bluestarmom I support the defund #obamacare movement,2013-09-12 18:20:17,1,1,378221543915917312
"Liberals argue Republicans are beating a dead horse on ObamaCare, but the court of public opinion begs to differ.http://goo.gl/YzxFHA ",2013-09-12 17:41:56,2,13,378211891115352065
The House just passed HR 2775 requiring income verification before receiving gov #ObamaCare subsidies #CommonSense,2013-09-12 15:31:05,3,13,378178963782131712
September 11th Congressional Remembrance Ceremony  #September11 #neverforget http://instagram.com/p/eIAICSrcuB/ ,2013-09-11 15:30:45,1,7,377816492529954820
The terrorists failed to break our resolve & our nation showed that freedom would always persevere #september11 http://goo.gl/NNO27R ,2013-09-11 14:18:48,4,11,377798382091137024
Please join me at 8:46am for a moment of silence to commemorate those who lost their lives on 9/11 #neverforget,2013-09-11 12:45:22,0,3,377774870538358784
