Text,Date,Favorites,Retweets,Tweet ID
Sad to hear about death of Brooklyn resident Bradley Doyley in possible campus hazing incident → http://m.nydailynews.com/new-york/brooklyn-man-21-dies-hazing-incident-article-1.2538185 …,2016-02-20 20:59:11,1,1,701149121621712896
Police department that repeatedly  violated the Constitution wants to unlock smartphones with impunity? #HeckNopic.twitter.com/3EOJT3UXY7,2016-02-19 18:29:12,8,8,700748987477917697
"""They who can give up essential liberty, to obtain a little temporary safety, deserve neither liberty nor safety"" - Ben Franklin #NoBackDoor",2016-02-17 19:19:38,4,6,700036903274467329
".@POTUS made clear that SCOTUS nominee will be ""indisputably qualified for the seat."" It's time for Republicans to #DoTheirJob",2016-02-17 12:36:33,113,107,699935462421635072
Apparently Senate Republicans plan to major in obstruction this year,2016-02-17 00:10:09,7,3,699747627835981824
Proud to support women and minority owned businesses throughout New York Statepic.twitter.com/fmwMWH0CbV,2016-02-15 15:51:39,13,8,699259786567745536
"We disagreed on almost everything, but he served his country with distinction on the highest court in the land. Rest in Peace #JusticeScalia",2016-02-13 23:52:57,8,11,698656134501179392
House Judiciary Committee unanimously passes #PrisonReform bill. The fight to end mass incarceration is on.,2016-02-12 13:53:06,36,44,698142788710502401
Brooklyn jury finds officer guilty of manslaughter in the death of unarmed civilian #AkaiGurley http://m.nydailynews.com/new-york/nyc-crime/nypd-peter-liang-guilty-fatal-shooting-akai-gurley-article-1.2528827 …,2016-02-12 01:58:50,8,5,697963037064568832
Investigation exposes possible police department abuse of #nuisanceabatement law in NYC → http://m.nydailynews.com/new-york/nypd-booting-people-homes-draws-outrage-officials-article-1.2523677 …,2016-02-11 00:57:17,1,5,697585160238268416
"Harriet Tubman, Warrior Queen → http://we.tv/1TQpCfd  #BlackHistoryMonthpic.twitter.com/OT0tnGl8EH",2016-02-09 18:02:26,23,14,697118374229368833
"Today we celebrate the #LunarNewYear, with public schools off for the first time. Thanks @RepGraceMeng #YearoftheMonkey",2016-02-08 15:37:53,5,2,696719609194549248
71 consecutive months of private sector job creation under @POTUS #Progress,2016-02-07 01:49:44,12,8,696148809039085569
"Today we celebrate the life of #TrayvonMartin. He would have been 21. Rest in peace, young brother.pic.twitter.com/lVeOoXuzA7",2016-02-05 21:05:25,488,485,695714871858565120
Proposal to build streetcar line between Brooklyn & Queens waterfront sounds promising,2016-02-04 22:18:57,4,2,695370985692749824
Apparently @MartinShkreli does know when to keep his big mouth shut #Turing #PriceGougepic.twitter.com/OtoSbVnA1h,2016-02-04 20:54:51,3,0,695349821608108034
My House floor remarks about the African-American journey for justice #Slavery #CivilRights #MassIncarceration  →https://www.youtube.com/watch?v=etHwNur-4RE …,2016-02-03 16:48:10,7,5,694925356772495360
NY State has significant minority contracting opportunities for the LaGuardia Redevelopment Project. Learn more: http://bit.ly/1mat2Mg ,2016-02-02 20:23:41,2,1,694617202171973633
Explosion in heroin use makes clear the war on drugs has failed. Time to end mass incarceration → http://m.huffpost.com/us/entry/democrats-criminal-justice-reform-heroin_us_56abc647e4b00b033aaf1167?utm_hp_ref=politics …,2016-02-02 14:01:14,7,4,694520958984589312
Makes sense. Grandma used to say speak only when it improves upon the silence.http://mobile.nytimes.com/2016/02/02/us/politics/clarence-thomas-supreme-court.html?referer=https://www.google.com/ …,2016-02-01 20:10:11,2,3,694251417515737088
Black History is American Historypic.twitter.com/NYBYDKAiPI,2016-02-01 15:42:00,55,55,694183929906085888
House returns to do the people's business tomorrow. Let's resume the work of rolling back mass incarceration in America,2016-01-31 23:58:57,22,18,693946603346866178
No QB celebrated more than #BrettFavre. Can someone explain why @CameronNewton has received so much criticism?pic.twitter.com/iK8nvtz9E0,2016-01-30 20:11:28,12,10,693526965664481280
We must have justice for the children of #Flint. Let's make sure the wrongdoers are not #TooBigToJail,2016-01-29 15:25:06,9,6,693092510168645632
Moving discussion between @BarackObama and @HouseDems this evening,2016-01-29 01:56:34,4,0,692889038722715648
Today is #HolocaustMemorialDay. Let's all recommit to the principle of #NeverAgain,2016-01-27 20:32:09,13,12,692445009665212422
The Pentagon's effort to demilitarize local law enforcement agencies is a good thing #Liberty #Ferguson,2016-01-27 16:23:35,1,3,692382454389276673
NYC taxpayers send more money to Albany then we get back in return.  What about that fact do state senate Republicans not understand?,2016-01-26 22:40:55,8,8,692115022990950400
Texas grand jury vindicates #PlannedParenthood and exposes the real lawbreakers →http://mobile.nytimes.com/2016/01/26/us/2-abortion-foes-behind-planned-parenthood-videos-are-indicted.html?referer=https://www.google.com/ …,2016-01-26 00:57:47,14,10,691787080310063104
"Winter Storm Jonas knocked us down, but New York City is never out",2016-01-24 13:54:02,4,8,691257654656643072
Toured blizzard conditions near boardwalk with @BilldeBlasio @MarkTreyger718 & A/M Pamela Harris this afternoon →http://www.capitalnewyork.com/article/albany/2016/01/8588952/cuomo-de-blasio-issue-travel-bans-limit-mta-service …,2016-01-24 02:33:50,7,8,691086477288148992
So far so good out on the Coney Island Peninsula #BrooklynStrongpic.twitter.com/r9GQpJWAm3,2016-01-23 21:36:30,9,10,691011652414787584
Spent some time with the seniors of Fort Greene & Clinton Hill yesterday  #ProtectSocialSecuritypic.twitter.com/4sbdIfUVI8,2016-01-21 12:44:17,6,5,690152937428008965
The people of Michigan deserve a governor who cares about all of its residents #FlintWaterCrisis,2016-01-19 20:37:24,8,5,689547226859847681
America is a much better place today because of the Rev. Dr. Martin Luther King Jr.'s social justice ministry #MLK,2016-01-18 14:14:25,3,6,689088457117986816
Look forward to delivering the #MLK service message this morning at the First Baptist Church of Crown Heightspic.twitter.com/25reI04vu9,2016-01-17 14:04:31,19,6,688723576002875392
Thankful that American prisoners in Iran are on their way to freedom #Diplomacy,2016-01-16 19:44:05,12,7,688446643025264640
Marijuana Arrest Reform campaign in NYC has led to significant drop in misdemeanor charges #Progresspic.twitter.com/m8fkuTzBV9,2016-01-15 20:55:48,5,5,688102304407392256
"It's time that smart guns be made available in America →
 http://m.nydailynews.com/new-york/manhattan/top-pols-urge-mayor-invest-smart-guns-nypd-article-1.2493061 …",2016-01-14 00:21:21,2,3,687429256595542018
The so-called Brooklyn Renaissance has clearly left the good people of Brownsville behind.http://mobile.reuters.com/article/idUSKCN0UQ20E20160112 …,2016-01-12 18:15:01,2,6,686974679207297024
Hse Judiciary Committee unanimously reauthorizes the #SecondChanceAct. Momentum around bipartisan #CriminalJusticeReform continues to build,2016-01-12 16:15:31,7,6,686944606517346304
Will take to the House floor shortly with @RepBeatty and @OfficialCBC to defend @BarackObama's strong executive actions on #GunSafety,2016-01-12 01:08:39,7,3,686716384185827328
We need a full accounting of the father's behavior.  So many unanswered questions. #Brownsville,2016-01-11 23:39:09,6,4,686693863868751873
Joined with @ScottMStringer and @MetroIAF to urge NYC to join fight re smart gun technology #GunSafetypic.twitter.com/AYrOgX0fYG,2016-01-11 20:22:40,7,15,686644416031883264
Proud to stand with the Beraca Community Development Corp. in supporting the people of Haitipic.twitter.com/vpkfJozZO5,2016-01-10 19:29:02,1,1,686268529885196288
Strong job creation continues under the #ObamaEconomy →http://mobile.nytimes.com/2016/01/09/business/economy/jobs-report-hiring-unemployment-december.html …,2016-01-08 18:11:03,1,2,685524130834309121
"The Empire State has a long history of jurists, but #JudithKaye was one of the greatest. May she rest in peacepic.twitter.com/Uiomn4d84O",2016-01-07 16:49:34,5,3,685141236244738048
Just voted against @HouseGOP's 62nd attempt to destroy #Obamacare. They really need an intervention #obsession,2016-01-06 22:37:44,13,5,684866465422557185
Statement on President Obama's new executive actions on #gunviolencehttps://jeffries.house.gov/media-center/press-releases/rep-jeffries-statement-on-president-obama-s-new-executive-actions-on-gun …,2016-01-05 22:30:23,1,0,684502230465134592
"With strong leadership from @NYGovCuomo and @CarlHeastie, NY can become first state to raise #minimumwage to $15 for all workers #Fightfor15",2016-01-05 15:40:37,7,6,684399108442976256
Gun-toting protesters illegally occupy federal land and the police do nothing.  Why can't we see this type of restraint in the inner-city?,2016-01-04 17:13:06,13,13,684059995604832257
May you find peace and blessings in 2016.  Happy New Year!!!,2016-01-01 18:22:25,6,1,682990276533698560
"Tamir Elijah Rice (2002-2014) killed by a rogue police officer, then robbed of his humanity by an unjust systempic.twitter.com/0M6cUQDjaA",2015-12-31 03:23:08,36,30,682401575948648448
The great #MeadowlarkLemon has arrived in basketball heaven. May he rest in peace #HarlemGlobetrotters,2015-12-28 19:47:40,0,1,681562178579787777
Thankful for the men and women of our military during this holiday season #HomeOfTheBravepic.twitter.com/u8uMqTtSre,2015-12-26 20:28:20,1,3,680847633812865024
Merry Christmas!!!,2015-12-25 14:26:27,9,1,680394177532669954
72 degrees and sunny in New York City? Santa won't need his sleigh tonightpic.twitter.com/tBVa5cXBiP,2015-12-24 20:31:36,3,1,680123681197129728
Apparent hate crime at MEC will not be tolerated #WeStandTogether http://jpupdates.com/2015/12/23/jewish-student-assaulted-in-apparent-hate-crime-inside-brooklyn-college/ …,2015-12-24 19:06:26,6,1,680102247116570624
Dr. King made clear that there is never a convenient time to combat racial injustice #MallOfAmerica,2015-12-23 21:23:20,25,28,679774312715403264
"Nearly 12,000 Americans lose their lives to gun violence every year #EnoughIsEnoughpic.twitter.com/qDl3BZkkyR",2015-12-21 22:42:15,2,5,679069398116794369
An early Christmas present for the big apple #KristapsPorzingis →http://mobile.nytimes.com/2015/12/20/nyregion/the-knicks-needed-a-hero-enter-kristaps-porzingis.html?referer=https://www.google.com/ …,2015-12-20 01:20:43,2,3,678384502880657408
My thoughts on the debt crisis in #PuertoRico and the failure of the @HouseGOP to act →https://m.youtube.com/watch?v=44ALfxc-rYQ …,2015-12-18 17:38:13,2,2,677905720898158592
#AmadouDiallo died in a hail of 42 shots.  One of the officers who killed him just received a promotion.  #Accountability?,2015-12-18 14:01:16,1,3,677851123903029249
The failure to give the citizens of Puerto Rico the same bankruptcy protections as those in the continental U.S. is a national disgrace,2015-12-17 17:43:34,9,7,677544680096182273
"While neighborhoods gentrify, public schools in those communities remain highly segregated #SaveOurNeighborhoods →http://mobile.nytimes.com/2015/12/15/opinion/what-would-it-take-to-integrate-our-schools.html …",2015-12-16 15:57:12,4,4,677155521988796417
The American People have a right to know if their food has been genetically engineered,2015-12-15 20:06:59,4,4,676855994635444226
Something is rotten in the Clinton Correctional Facility #PrisonReform →http://mobile.nytimes.com/2015/12/14/nyregion/clinton-correctional-facility-inmate-brutality.html?smprod=nytcore-iphone&smid=nytcore-iphone-share&referer= …,2015-12-14 02:04:25,4,4,676221172414078978
Leadership from @BarackObama on the world stage helps yield historic climate change agreement #ParisAgreement,2015-12-13 03:35:50,13,10,675881788301049856
How can we have a secret black ops site in the middle of a major American city? #Chicago http://gu.com/p/4dcnx/stw pic.twitter.com/3rzQBq9bkL,2015-12-11 18:09:51,3,5,675376968272060416
We must prevent suspected terrorists on #NoFlyList from buying #guns used to hunt Americans http://bit.ly/1NY3Ghr pic.twitter.com/okpIQQ2xA0,2015-12-10 19:37:54,8,3,675036735907188736
Has Justice Scalia completely lost it?http://www.thedailybeast.com/cheats/2015/12/09/scalia-affirmative-action-hurts-blacks.html …,2015-12-09 22:26:29,6,2,674716776106692609
Memo to the Supremes: Under our constitution children & immigrant families deserve representation #EveryoneCounts  →http://mobile.nytimes.com/2015/12/09/us/politics/supreme-court-to-hear-arguments-on-one-person-one-vote.html?referer=https://www.google.com/ …,2015-12-08 17:14:17,4,6,674275821570408448
Thanks to all of the Coney Island residents who came out to this weekend's town hall meeting #SaveOurBankpic.twitter.com/jd7A8PVBbV,2015-12-07 20:04:20,3,1,673956227286769664
Happy Hanukkah!,2015-12-07 02:27:25,8,3,673690244961693696
150 years ago today slavery became unconstitutional in America #Freedom,2015-12-06 16:34:29,105,116,673541027505025024
Did you know that suspected terrorists on the #NoFlyList can still legally purchase guns in America? #WeAreBetterThanThis,2015-12-05 19:54:19,13,17,673228930963345409
Criminal Justice Reform agenda continues to move forward → http://politic365.com/2015/12/04/president-obama-meets-with-justicereform-leaders-in-congress/ …,2015-12-05 05:35:50,3,6,673012883844898816
"One year after the miscarriage of justice in the #EricGarner case, the struggle continues. #policeaccountabilitypic.twitter.com/dlkJxHMATP",2015-12-03 18:18:38,2,7,672480075992973313
As a country we are better than this #PrayForSanBernadino,2015-12-02 22:06:52,5,1,672175121512157186
I was a stranger and you invited me in -Matthew 25:35 #SyrianRefugees,2015-12-01 17:49:34,8,4,671747982564397056
Made clear on House floor Chicago PD #bluewallofsilence must come down #LaquanMcDonald https://www.youtube.com/watch?v=3idrfh8LB4Y … …pic.twitter.com/jum4f9o1A0,2015-12-01 02:04:31,98,128,671510153397739520
Heading to House Floor to discuss Shakespearean cover-up of the #LaquanMcDonald case,2015-12-01 01:11:01,111,82,671496691787415552
Memo to @HouseGop: It's time to stop being Bamboozled by the National Rifle Association →http://abc7ny.com/1103793/ ,2015-11-30 21:45:38,9,9,671445002703216640
"Joined @TheRevAl, @SpikeLee & @cbrangel to urge Congress to #DoTheRightThing and address our gun violence epidemicpic.twitter.com/gsGflKDENz",2015-11-30 19:16:14,28,28,671407406274990080
The #gentrification of Crown Heights has been swift and merciless #StopTenantHarassment #AffordableHousingNowhttp://mobile.nytimes.com/2015/11/29/nyregion/gentrification-in-a-brooklyn-neighborhood-forces-residents-to-move-on.html?_r=0&referer=https://www.google.com/ …,2015-11-29 22:56:10,6,10,671100368126877696
Terrorism is terrorism whether abroad or at home #StandWithPlannedParenthood→https://www.youtube.com/watch?v=7s5_8dzrgYU …pic.twitter.com/JX8FRItx4B,2015-11-29 21:07:30,10,3,671073020035887104
20 prior civilian complaints + 16 shots + 15 seconds = Another American Tragedy #LaquanMcDonaldhttps://www.youtube.com/watch?v=GwJVOlPf-DQ …,2015-11-28 16:47:57,4,6,670645312437035009
Not everyone can afford to shop this holiday season #FightFor15pic.twitter.com/847ZNdgqzM,2015-11-27 21:57:31,7,9,670360832807669760
Have a blessed Thanksgivingpic.twitter.com/vN6JbohTDF,2015-11-26 15:15:03,2,1,669897159513407488
Grateful to @BarackObama for awarding the Presidential Medal of Freedom to the legendary #ShirleyChisolmpic.twitter.com/fjXBrsgYq6,2015-11-25 17:00:56,27,22,669561417327054848
Airport workers deserve a living wage #FightFor15pic.twitter.com/rvpXctBv8t,2015-11-24 22:29:10,4,2,669281630675161088
#BrooklynRepresenthttps://twitter.com/nytmetro/status/667825709927141376 …,2015-11-23 17:37:58,10,5,668845962169860096
Spent the morning with some hardworking New Yorkers at @UPS. It's time for Congress to deliver for the American pplepic.twitter.com/se372sO0yN,2015-11-23 15:55:27,9,9,668820162653634560
Pray for the people of Mali #EnoughIsEnough,2015-11-21 20:25:44,3,1,668163406797643776
My thoughts on #SyrianRefugeeshttps://youtu.be/v6M-Sa8Bfp8 ,2015-11-20 15:16:21,1,0,667723157135097856
It's time for the government to respect #attorneyclientprivilege for all Americanshttp://n.pr/1SE3EJh ,2015-11-19 19:01:53,6,5,667417529967595520
Did @CommissBratton really just dis the entire @nyccouncil? #SeparationofPowers #Wow,2015-11-18 22:27:13,7,2,667106816191430658
Discrimination is alive and well in the automobile lending industry →https://youtu.be/Y8avVuRxxYQ ,2015-11-18 20:57:14,0,0,667084171135877120
Questioned @LorettaLynch at Judiciary Committee hearing about #gunviolence & #EricGarner case →https://youtu.be/LdRugoBqTr4 ,2015-11-17 21:35:18,0,1,666731362460803076
"The more things change, the more they stay the same. Another #GovernmentShutdown looms in 11 legislative dayspic.twitter.com/rv3r7Mqiq3",2015-11-16 19:17:19,1,5,666334249264508928
Thx @AGSchneiderman for your leadership as we stand together to defend the unfettered right to collectively bargainpic.twitter.com/eiLI0y301r,2015-11-15 18:54:46,6,6,665966185964544000
The world must come together to crush violent extremism once and for all. Vive la liberté,2015-11-14 14:13:53,6,5,665533113355935745
Universities should be a safe place for all students. Proud of students at @Mizzou & @Yale for their activism on this issue #GoodTrouble,2015-11-13 17:19:41,6,8,665217484048453633
Justice delayed will not be justice denied #ComprehensiveImmigrationReform,2015-11-13 02:21:58,2,3,664991564918337536
Thx to all of the East New York residents who came out to last evening's Town Hall meeting on the proposed rezoningpic.twitter.com/tjyJkbNku1,2015-11-12 00:34:27,6,4,664602119081693184
May God continue to bless the #veterans of our great countrypic.twitter.com/VkmczREB1e,2015-11-11 15:19:07,3,4,664462364436246529
"This one's a Whopper: since 1968 the real value of the minimum wage has gone DOWN, not up. #FightFor15http://www.pewresearch.org/fact-tank/2015/07/23/5-facts-about-the-minimum-wage/ …",2015-11-11 03:18:38,4,3,664281050911084544
Even #Barbie has gotten into the #surveillance business #PrivacyMatters,2015-11-10 19:07:36,2,2,664157476342898688
Thieves who prey on unsuspecting homeowners to snatch houses away should be vigorously prosecuted #DeedTheft →http://mobile.nytimes.com/2015/11/08/nyregion/real-estate-shell-companies-scheme-to-defraud-owners-out-of-their-homes.html?referer= …,2015-11-08 15:14:19,5,5,663373995069333504
It's time for Congress to crack down on #TradeSecretTheft in America →http://thehill.com/policy/cybersecurity/259394-hatch-foresees-swift-action-on-bill-to-cut-trade-secret-theft …,2015-11-06 21:17:24,0,1,662740590816133120
An early history lesson #TBTpic.twitter.com/fPyVwdrLKi,2015-11-05 17:26:02,2,1,662319977760968705
Momentum builds for renaming the Tompkins Community Center after #DetectiveRamos and #DetectiveLiu →http://www.capitalnewyork.com/article/city-hall/2015/11/8581662/de-blasio-great-idea-rename-community-center-after-slain-officers …,2015-11-05 16:53:49,1,1,662311870586593281
Memo to @HouseGOP: It's time to the permanently reauthorize the Zadroga 9/11 Health and Compensation Act #SupportOurHeroes,2015-11-04 16:49:35,5,7,661948417640374272
"In memory of slain detectives Liu and Ramos, we should rename the Tompkins Community Center in their honor →http://bit.ly/1RtiVML ",2015-11-03 20:46:00,4,2,661645524307718148
Very positive step taken by @BarackObama in promoting opportunity for the formerly incarcerated with #BanTheBox executive order,2015-11-03 14:59:12,7,10,661558248269565952
Is the aggressive use of mandatory #arbitration undermining the integrity of the judicial process?http://nyti.ms/1MAw0WA ,2015-11-02 18:21:13,2,2,661246702058344449
"#SuperstormSandy hit us 3 yrs ago. We've come a long way, but won't stop until everyone is made whole #BrooklynStrong #QueensResiliency",2015-11-02 00:16:02,2,0,660973603408773121
Effort by @HouseDemocrats to strengthen our gun violence prevention laws has prominent ally in @NYGovCuomo →http://mobile.nytimes.com/2015/10/31/nyregion/cuomo-planning-role-in-national-gun-control-campaign.html?referer= …,2015-10-31 15:07:11,2,0,660473093706633216
Proud to join with @RepDougCollins to protect the #SixthAmendment right to effective counsel in the digital era →http://politics.blog.ajc.com/2015/10/30/gop-candidates-revolt-attempt-to-seize-control-over-debates/ …,2015-10-31 03:14:13,1,2,660293672538345472
No more excuses.  It's time to address the gun violence epidemic in America → https://m.youtube.com/watch?v=w7TlB2rf22k …,2015-10-29 16:51:23,1,2,659774543473586176
Statement on Third Anniversary of #SuperStormSandyhttp://jeffries.house.gov/media-center/press-releases/rep-jeffries-statement-on-third-anniversary-of-superstorm-sandy …,2015-10-29 12:48:45,0,1,659713481265053696
Rest in Peace #DetectiveRandolphHolder. May God bless his family during this difficult time,2015-10-28 21:10:35,5,2,659477385696419841
Congratulations @shanakn on release of important book about the life of #JusticeGinsburg aka the Notorious R.B.G. #BrooklynRepresent,2015-10-27 15:02:05,5,6,659022259617710080
This video is deeply disturbing #EndTheSchoolToPrisonPipeline →http://www.cnn.com/2015/10/27/us/south-carolina-school-arrest-video/index.html …,2015-10-27 13:18:04,10,7,658996084287668224
How many more Americans have to be buried before Congress confronts America's #gunviolence epidemic? #RandolphHolderhttp://7ny.tv/1LSuARq ,2015-10-26 21:12:18,4,1,658753039524868096
Proud to join @NydiaVelazquez to support the Reducing Gun Violence in Our Neighborhoods Act. Thx 4 your leadership!pic.twitter.com/lqViTpHQ7H,2015-10-26 19:12:22,8,2,658722857741107200
The perils of #DrivingWhileBlack →http://mobile.nytimes.com/2015/10/25/us/racial-disparity-traffic-stops-driving-black.html …,2015-10-25 14:37:49,1,0,658291376430428160
Happy 5th Pastoral and Church anniversary to the Brooklyn Community Church!pic.twitter.com/HGnkG95ndT,2015-10-25 00:30:04,3,3,658078032192782336
Once again @HouseGOP seeks to repeal the #AffordableCareAct. Will they ever put #PeopleOverPolitics?,2015-10-23 15:32:29,4,4,657580359786303488
How many times can you ask the same irrelevant question?  #BenghaziWitchHunt,2015-10-22 23:48:18,7,6,657342746840186880
Questioned the #FBI director about #massincarceration in America →https://youtu.be/8_gtZyxM-JE ,2015-10-22 21:19:59,3,1,657305421565313025
$4.8 million + 532 days = Taxpayer-funded #Benghazi Witch-hunt #EndTheCharade,2015-10-22 15:21:58,1,8,657215326187196420
"Very sad to hear that another hero, Officer Rudolph Holder, has fallen in the line of duty. May he Rest in Peace.",2015-10-21 13:24:43,3,1,656823429744717824
The real issue that demands investigation is the @HouseGOP failure to govern #EndTheDysfunction,2015-10-19 15:05:56,0,1,656124125119950848
Thanks to all of the residents from Fort Greene & Clinton Hill who came out to this weekend's #CongressOnYourCornerpic.twitter.com/L4tu5gfI45,2015-10-19 01:12:30,2,2,655914387182612481
"There is a reason Chicago is known as ""The Second City"" #LetsGoMets",2015-10-18 00:59:34,5,5,655548741324316672
#Republicans threaten to undermine America's full faith & credit as @HouseGOP civil war rages on. Can anyone save them from themselves?,2015-10-16 14:21:20,1,1,655025737196507136
Discussed #inmatebasedgerrymandering and #felondisenfranchisement with @rolandsmartin →http://newsone.com/3208670/rep-hakeem-jeffries-proposes-bill-restore-voting-rights-to-ex-felons/ …,2015-10-15 16:13:21,0,2,654691540443377664
Spotlight on the #fantasysports gaming industry intensifies as FBI opens probe →http://mobile.nytimes.com/2015/10/15/sports/draftkings-fanduel-fbi-investigation.html?_r=0&referer=https://www.google.com/ …,2015-10-15 14:51:17,1,0,654670886675419136
It's time for the @HouseGOP to shutdown wasteful #Benghazi witch hunt #EndTheCharade,2015-10-14 18:17:55,5,3,654360499790987264
From the campus to the congress: Thanks @BinghamtonU for laying a strong foundation →http://www.bupipedream.com/news/59102/hakeem-jeffries/ …,2015-10-13 18:23:02,9,9,653999399027232769
Dark Knight Rising @MattHarvey33 #LetsGoMets,2015-10-12 15:30:22,1,1,653593557991821312
Enjoyed commemorating the 20th anniversary of the #publicaffairs program at @BinghamtonU #MakeADifference →http://www.twcnews.com/nys/binghamton/news/2015/10/10/u-s-congressman-returns-to-binghamton.html …,2015-10-11 23:52:08,5,2,653357445092352002
Victory over dysfunction with successful Export-Import Bank discharge petition #Jobs,2015-10-10 14:49:58,0,0,652858615808827392
The @HouseGOP obsession with @PlannedParenthood is a waste of your tax dollars #PlannedParenthoodHatersExposed →https://m.youtube.com/watch?v=2i6u41KGSEI …,2015-10-09 14:01:09,2,0,652483942038245376
Members of @OfficialCBC explain at town hall why #BlackLivesMatter →https://shar.es/1uHYBp ,2015-10-09 12:41:39,2,0,652463938983038976
"Chaos reigns in the @HouseGOP. Extremism wins, America loses.",2015-10-08 16:35:15,9,18,652160338272452609
Joined @RepSwalwell & colleagues on House Floor to discuss college affordability crisis #DropTheDebt #FutureForum →https://m.youtube.com/watch?feature=youtu.be&v=EDfKazB3y3s …,2015-10-08 13:04:56,7,2,652107409071185920
The #righttovote is central to our democracy. Join @RepTerriSewell in her fight against suppression in #Alabamahttps://sewell.house.gov/media-center/press-releases/rep-sewell-asks-doj-investigation-alabama-driver-s-license-closures#.VhVTyKkIZmk.twitter …,2015-10-07 17:23:07,4,4,651809996469092354
