Text,Date,Favorites,Retweets,Tweet ID
that is a talking point.  Explain gun-show loophole,2016-09-21 17:46:23,0,0,778651603456917504
I am a proud Tiger @ClemsonPrez to be speaking with Clemson BOV this AM in DC!  #ClemsonFamily #GoTigerspic.twitter.com/l6xAmuHpRK,2016-09-21 12:21:37,68,13,778569873681162240
This shows how bad the situation has become in Europe. Will we take steps now to prevent this from happening here?http://tinyurl.com/j7en3gp ,2016-09-20 20:48:28,21,13,778335038823927809
staff handles that. You're welcome to ask them 202-225-5301,2016-09-20 14:59:55,0,0,778247322010546176
Thank you to USA TODAY for including my concerns about our refugee and immigration programs.http://www.usatoday.com/story/news/nation/2016/09/19/terror-bombings-raise-immigrant-security-screening-concerns/90708704/ …,2016-09-20 13:55:51,12,5,778231199705731072
...all forms of immigration and visas from countries classified as terrorist safe havens by the State Department. (3/3),2016-09-19 19:47:39,26,18,777957344252747776
"...immediately deport any non-citizens residing in the United States who are listed on a terror-watch list, and indefinitely suspend...(2/3)",2016-09-19 19:47:23,37,25,777957278423146496
I am reiterating my previous calls for the @POTUS to halt the Syrian refugee resettlement program...(1/3),2016-09-19 19:47:15,45,28,777957244088582145
"If the Fed Gov't can't vet people living in the US for citizenship, how can they fully vet Syrian refugees? http://tinyurl.com/j4k7f82 ",2016-09-19 19:43:39,30,21,777956336898301952
check out my fb. I talk about this issue often. http://www.fb.com/repjeffduncan ,2016-09-19 16:29:50,2,1,777907561081307137
glad to help!,2016-09-18 12:31:54,1,0,777485295277137920
"Praying for NYC after explosion last night (Mayor de Blasio says looked ""intentional""). #NYCStrong",2016-09-18 11:51:56,17,4,777475240217706496
What will President Obama do with the most dangerous ones remaining in the facility? #Gitmopic.twitter.com/4JlpF6DrLd,2016-09-16 15:53:39,7,9,776811291847561217
"which is why we shouldn't use it to take away  2nd Amd rights. I am turning ""No Fly, Goodbye"" into a bill. Will offer due process",2016-09-14 17:33:23,6,1,776111614827302914
"Forget about ""No Fly, No Buy,"" how about ""No Fly, Goodbye."" If you are a non-citizen and on the terror watch list, you should be deported.",2016-09-14 17:26:16,79,40,776109826149650433
Democrats on the House floor arguing for why we shouldn't make it easier to fire bad employees at the VA. Ridiculous!,2016-09-13 21:38:58,33,33,775811031335600128
"Obama just said felt good 2 be back on campaign trail. Other than golf course, where else has he been 4 the past 7.5 years?CampaignerInChief",2016-09-13 17:50:16,60,27,775753476160839680
Would HRC email these docs on her unsecured server? (Note: I have shares nothing here but the classification stamps)pic.twitter.com/w3Oc4V6ESs,2016-09-13 14:16:29,8,6,775699676372803584
"who is Nathan Johnson? What is his background, and what experience does he have that prepares him to take over as POTUS if needed?",2016-09-09 18:57:55,0,0,774320950833770497
I gotta admit - this is funny. ,2016-09-09 15:31:06,1,0,774268904092884992
So loving my earbuds being plugged into my headphone jack on my iPhone 6S! #WhatWereTheyThinkingAtApple #GoodLuckWithThat,2016-09-09 15:30:11,17,4,774268671304802304
.@mmartin9095 my terrorist deportation act is in the final stages of drafting.,2016-09-09 13:04:27,8,4,774231998206468096
"Clemson grad staffers who @ClemsonPrez @ClemsonFB 
ROCK the Orange! #SolidOrangeFriday #GoTigers! #SC3 #CUinDCpic.twitter.com/XAajp4z37N",2016-09-09 12:44:19,75,7,774226929432006656
".@papajohn56 its part of the reason my bill is so revealing. Dems don't express due process concerns on guns, but they do for non-citizens.",2016-09-09 10:15:38,9,6,774189514432536576
Looking forward 2 hopefully listening 2 CHS Red Devil JV football t'nite on radio.If the line will give QB time & he throws 2 Parker D =WIN!,2016-09-08 15:41:40,1,0,773909176028463104
Parts of the Committee rooms I love in the Halls of Congress!pic.twitter.com/P883AjPzGN,2016-09-08 15:35:34,12,2,773907640514547712
Glad to see HRC FINALLY having a presser in NY today after how long?? #WhereAreTheEmailsClinton #InvestigateClintonFoundation,2016-09-08 13:44:10,10,3,773879603605737472
my legislation gives them the right to a deportation hearing before a judge.,2016-09-08 13:14:08,0,1,773872046501601280
"I have a better idea. If they are in the US, on a terror watch list, and a non-citizen, let's deport them.https://twitter.com/MegKinnardAP/status/773679048346128384 …",2016-09-08 00:33:35,67,46,773680646707408897
Nothing good happens after midnight... or before Christmas in a lame duck session... #NoLameDuck #ObamaWatch,2016-09-07 20:50:34,18,9,773624523128184832
Renovations to Capitol are abt complete. Scaffolding coming down. Rotunda back open!pic.twitter.com/Iq14SNpou4,2016-09-07 17:59:26,43,13,773581458724167684
"well, buddy, it's called respect and honor for our flag, nation and those who have served her.Sorry you feel otherwise",2016-09-07 13:11:52,1,1,773509086595940352
That's what I'm talking 'bout!http://www.foxnews.com/sports/2016/09/07/team-usa-hockey-coach-says-hell-bench-any-player-who-sits-for-national-anthem.html …,2016-09-07 12:09:55,66,30,773493498347712513
This tweet has not aged well.https://twitter.com/TheDemocrats/status/260497619862835201 …,2016-09-06 21:25:01,197,165,773270804389822464
Does anyone else remember when Democrats mocked @MittRomney for saying Russia was our #1 geopolitical foe? Apologies anyone?,2016-09-06 18:42:49,63,36,773229986815803392
Ok @ClemsonFB Here we go!  Go Tigers!  Beat Auburn! #GoTigers #BCSNnation #4ForHeisman,2016-09-04 01:11:27,10,2,772240624795938816
Ok Georgia fans:  thoughts on Kirby Smart so far?,2016-09-04 01:01:13,3,2,772238052739649536
Oklahoma!?  Now LSU??  Wow!  What an opening Saturday! #CollegeGameDay #DayOfTheUpsets #GoTigers,2016-09-03 23:00:57,12,3,772207785195008000
It's finally here!  Opening kick offs for the 1st Saturday of College Football!  Getting my long-awaited fix!  Now - Go Tigers! @ClemsonFB,2016-09-03 16:08:28,13,2,772103980323377152
The FBI's document release definitively shows that Sec Clinton is either too incompetent or too corrupt to be President of the United States,2016-09-02 18:35:41,124,105,771778639566348288
you tweeted at the wrong congressman. But my friend Duncan Hunter is in fact a veteran.,2016-09-01 22:11:28,0,0,771470558273863681
h res 617 is a creative approach.  Bill can't be vetoed or filibustered. Happy to talk about more creative strategies on fb,2016-09-01 12:43:04,0,0,771327514635624448
please call jordan in my anderson office. But I'd encourage you to send me a message on fb so we can go in more depth,2016-09-01 12:40:39,0,0,771326905568137216
"if you're a constituent, call my anderson office and I'd be happy to meet with you.",2016-09-01 12:38:03,0,0,771326249767624704
"I can multitask. But look at getting rid of boehner, look at creation of HFC, growing a more conservative gop",2016-09-01 12:36:50,0,0,771325944074305536
look at my bill h res 617. I think that is creative and proactive. Doing everything I can. Happy to take recommendations.,2016-09-01 12:33:54,0,0,771325207344717824
not show votes on my part. I've been consistent. I fully support using power of the purse.,2016-09-01 12:32:54,0,0,771324956344881153
"so, I wasn't elected king for the day. I have pushed for such 4 six years.we even had a Govt shutdown. So, convince Spkr Ryan",2016-09-01 12:19:25,0,0,771321560305115136
I did not know that!  Who?  Where? TV?,2016-09-01 12:18:00,0,0,771321203659247616
I support defunding both. And have pushed for that.,2016-09-01 11:12:34,0,0,771304740562964481
I admit that I am a junkie. A College Football junkie. My annual fix begins t'nite w/ SC v Vandy. There will be football tweets this fall.,2016-09-01 11:03:35,65,8,771302479371833344
multiple outlets reported that as well as a Senate inquiry,2016-08-31 21:46:56,0,0,771101995969241088
I guess spell check and iPhone and your perfect self never misspelled anything. Good to know,2016-08-31 12:24:20,0,0,770960411730534400
why don't you google it.,2016-08-31 12:22:20,0,0,770959907738808320
"Exactly! You should show an ID to vote as well. If you care about election integrity, care about it all aroundhttps://twitter.com/Babyboomerfedup/status/770950244259561476 …",2016-08-31 11:46:11,17,4,770950811014852608
http://www.foxnews.com/politics/2016/07/13/state-department-sent-taxpayer-money-to-group-that-attempted-to-oust-israels-netanyahu.html …,2016-08-31 11:44:26,0,0,770950370235392000
"If Harry Reid really wanted no foreign meddling in elections, wouldn't he be upset over tax dollars spent against Netanyahu by Obama Admin?",2016-08-31 11:33:28,50,48,770947609779470336
"If the feds were truly concerned about protecting election integrity, they would support voter ID.",2016-08-31 11:31:13,41,24,770947045549105152
States should be leary of an attempt by the Feds to take over the election systems.,2016-08-31 11:04:11,34,25,770940240596992000
I sent you the news article of the possible gitmo transfers.,2016-08-31 02:35:25,0,0,770812205025689600
have you tried at my website http://jeffduncan.house.gov ?,2016-08-31 01:52:04,0,0,770801296991485952
how have you tried?,2016-08-31 01:25:32,0,0,770794617755217920
so many bad rumors float out there on the internet. We need to do our best to remove the misinformation.,2016-08-30 13:43:16,0,0,770617887409180672
"yes but if someone comes across your tweet and didn't see the whole convo, the misinformation may spread.",2016-08-30 13:42:32,0,0,770617704675934209
again not accurate. Please delete as to not spread misinformation.,2016-08-30 13:39:32,1,1,770616946765209600
Cool morning air in SC today gives a hint of the coming autumn & most importantly: College Football Season!  #GoTigers #BCS2016 ,2016-08-30 12:30:42,28,9,770599625166163968
NDAA doesn't have that provision in it. This is bad info.,2016-08-29 22:45:01,1,0,770391835676147713
"RIP Sir.  And remember, as Igor said: ""Walk this way.....no .... THIS way.""",2016-08-29 22:14:42,16,4,770384205918400512
"Wilder was an incredible actor who, the family says, died of complications stemming from Alzheimer's - same as my Dad...",2016-08-29 22:14:28,14,2,770384145923117056
Sad to learn of the passing of Gene Wilder today. Willie Wonka and Young Frankenstein are two of my all time favorite movies...,2016-08-29 22:13:33,20,3,770383917069246464
not in my district. In gowdy's. But it looks like they shifted their position already.,2016-08-29 22:12:30,0,0,770383653188829184
"Thank you to Fountain Inn Rotary for the invite! Discussed the budget, immigration, Islamic State, Zika & GITMOpic.twitter.com/LDwd1oWA4c",2016-08-29 18:29:48,7,5,770327608328196096
I am upset as well. I heard about it this AM.,2016-08-29 14:08:35,1,0,770261871609909252
http://www.postandcourier.com/article/20150814/PC1603/150819568/charleston-navy-brig-to-be-reviewed-as-possible-terrorist-holding-site …,2016-08-29 02:01:27,0,1,770078883404255234
Visiting my son in Clemson today.  OMG! Sooo ready for @ClemsonFB & Dabo's Tigers to spot the ball! #4forHeisman #GoTigers #BCS2016 ,2016-08-28 22:29:24,24,6,770025516208386048
"Congrats to Endwell, NY Little League team - 2016 Little League World Series Champs!  2-1 victory over S. Korea. #USA #LLWS2016 #Endwell",2016-08-28 21:09:17,22,9,770005354222616577
Sending prayers of healing to @cmshaw8. Hope to see you back out on the field again soon!,2016-08-28 01:28:25,24,9,769708182671360000
"The FBI's made it very clear that Clinton mishandled classified information so sensitive, that I as a Member of Congress can't even read it",2016-08-27 22:54:36,111,124,769669471225151488
It's a travesty that the Obama Administration gave Secretary Clinton a classified briefing today for being the Democrat Party nominee.,2016-08-27 22:53:35,47,33,769669215750066176
7 days to Opening Day of @ClemsonFB Tiger football! This is my 2016 GameDay hat!@ClemsonPrez Go Tigers! #4ForHeismanpic.twitter.com/Hw9OGVtVzC,2016-08-27 13:59:04,40,6,769534700654321664
What a game!  Clinton wins Laurens County Championship in nail biter 34-29 vs Laurens! Came down to the last drive/the last minute!Congrats,2016-08-27 03:24:48,18,10,769375081936150536
Praying for the hurt Clinton HS Red Devil player - being taken off field on stretcher.,2016-08-27 00:27:45,13,1,769330523856441344
Clinton Red Devils hold Raiders on 1st Drive! Great to be back in the stands for football!!,2016-08-26 23:40:17,5,2,769318580064227329
Ready for High School Football Season! Clinton vs Laurens!pic.twitter.com/taOTMeVoIR,2016-08-26 23:27:30,12,1,769315364903804928
"congress did pass. Obama indicating he may ignore law, claim its unconstitutional.",2016-08-26 12:10:36,0,0,769145017235599361
"its law. Obama threatened to veto, but saw the writing on the wall and signed it anyway.",2016-08-26 12:09:43,0,0,769144795143045120
"I anticipated this confrontation, which is why I filed H Res 617. Make sure your representative is a co-sponsor.",2016-08-25 20:20:00,0,0,768905789964705792
I filed H Res 617. Cannot be filibustered or vetoed. Would give us authority to get courts to block transfershttps://twitter.com/TheDrunkenPhin/status/768892305944313860 …,2016-08-25 19:38:30,6,6,768895347372404736
I'm afraid of SC becoming a magnet for terror attacks. GITMO is the perfect location to house these peoplehttps://twitter.com/Wolf_Counselor/status/768892479932338177 …,2016-08-25 19:36:35,8,4,768894862200442880
"The citizens of SC need to demand that every elected official say whether they support bringing terrorists to a place like Charleston, SC.",2016-08-25 19:26:00,18,13,768892199580766208
"No state deserves to become a terrorist dumping ground, especially not SC. The Administration's planned lawlessness cannot stand.",2016-08-25 19:20:07,58,34,768890720249745408
"Yet VP Biden says that they are moving forward on closing the prison, which means these dangerous terrorists could be coming to the US",2016-08-25 19:16:11,6,5,768889731161608192
"A bipartisan, veto-proof majority passed legislation saying that GITMO terrorists could not be transferred to the US...",2016-08-25 19:10:57,24,16,768888412183011328
welcome! Glad to have you!,2016-08-22 17:04:09,0,0,767769338199760896
Welcome! Glad to have you!https://twitter.com/genebrooks/status/767464089274707968 …,2016-08-22 17:03:56,3,0,767769283933765632
"I didn't say break relations with them. But we had billions of Iranian money. Before any talks, release our people",2016-08-20 13:35:27,0,0,766992042530598912
it is that simple. You make the release of all americans a recondition to negotiations. We have (had) the leverage.,2016-08-20 12:21:09,0,0,766973342201090048
.@scdp I'm criticizing Barack Obama for not making the release of American hostages a precondition to ANY nuclear negotiations.,2016-08-19 14:24:33,14,7,766642009469816832
".@scdp Okay let's weigh the costs. Is it smart to give a state sponsor of terror, with American military blood on its hands, $400M in cash?",2016-08-19 14:13:24,8,5,766639203597910016
.@scdp Wait.. A $400M payment that just so happens to arrive with the simultaneous release of American prisoners is not a ransom payment?,2016-08-19 14:09:07,8,4,766638128320905216
Why do the Dems support deals that put American national security and US citizens abroad at risk? #IranRansom #Gitmo,2016-08-19 13:50:46,20,7,766633510228688896
If it quacks like a duck... This hostage payment will put Americans in danger worldwide.http://tinyurl.com/zexchht ,2016-08-19 13:45:34,19,17,766632198086754305
Iran's US hostages should have been RELEASED as a precondition to negotiations. I warned them. Now looks like ransomhttp://tinyurl.com/h3bp5jr ,2016-08-19 13:43:05,10,11,766631575132012544
Did the @scdp just admit that the Obama Admin payed a ransom for American hostages? Will they condemn the action? @postandcourier,2016-08-18 22:40:45,9,8,766404494448025600
.@POTUS not a ransom but State Depart is confirming money was contingent on release of the hostages? You owe us an explanation & an apology,2016-08-18 20:33:07,67,48,766372377433284608
"After watching this video of @HillaryClinton's testimony before Congress, do you believe she committed perjury?http://tinyurl.com/zlu87e9 ",2016-08-18 20:09:52,9,8,766366524856799232
.@scdp Bill Clinton.,2016-08-17 19:41:14,18,1,765996932401692676
I am! Did you see my tweet about H Res 617,2016-08-16 00:35:47,0,0,765346281128689664
no decision has been made yet. But I have legislation to stop it. Charleston is one of three possible relocation centers.,2016-08-15 23:38:36,2,1,765331889670479872
I'll keep talking about nat security & keeping people safe from the terrorists you want to bring to SC @scdp. You keep talking about a BBQ,2016-08-15 23:37:05,34,13,765331508840263685
I am not willing to gamble with people's lives. South Carolina should not be allowed to become a terrorist dumping ground.,2016-08-15 23:28:14,66,34,765329281908109313
Sometimes leadership means having the foresight to address an issue before it can become a problem.https://twitter.com/scdp/status/765327777465716736 …,2016-08-15 23:27:05,8,4,765328993579073537
brig still there. Lots of navy functions left in charleston.,2016-08-15 23:24:28,0,0,765328331579486209
A big thank you to @nikkihaley for coming to Washington to boldly say that no state deserves to become a ... http://tmi.me/1ffmAA ,2016-08-15 23:23:55,8,5,765328196913000448
You're fine w bringing them 2 Charleston. Which could make the battery ground zero for a terror attack. Shame on youhttps://twitter.com/scdp/status/765326744844763138 …,2016-08-15 23:20:59,4,3,765327456236609536
I care about preventing SC from becoming a terrorist dumping ground. That's why I filed H Res 617. Hold those who oppose accountable!,2016-08-15 23:16:31,37,22,765326333828329472
.@scdp thinks this is where we should send the world's most dangerous terrorists! #outoftouchpic.twitter.com/n0Cw9yfGRH,2016-08-15 23:11:09,23,11,765324980896825344
".@scdp calls security concerns revolving around housing terrorists in Charleston ""ridiculous."" Amazing how out of touch some people can be!",2016-08-15 23:06:51,13,5,765323898544095232
Issue is less about security inside brig. Issue is making SC a target for terrorist attacks.https://twitter.com/JeffTClinton/status/765321048980070400 …,2016-08-15 22:57:26,9,5,765321530855284736
Guess you dont follow the issue. DOD has said there are terrorists at GTMO too dangerous to release from US custodyhttps://twitter.com/Bakari_Sellers/status/765319715677888512 …,2016-08-15 22:52:17,10,5,765320234035281921
I hope @scchamber & others quickly condemn @SCDP's comments. SC shouldn't become a terrorist dumping groundhttps://twitter.com/scdp/status/765312721789210624 …,2016-08-15 22:34:32,12,2,765315765767643137
Apparently the @scdp is too busy losing elections and loving on Obama to read the news. http://www.postandcourier.com/article/20150814/PC1603/150819568/charleston-navy-brig-to-be-reviewed-as-possible-terrorist-holding-site …https://twitter.com/scdp/status/765312919919702016 …,2016-08-15 22:27:28,8,4,765313987512770560
This is unreal. @scdp is apparently fine bringing terrorists to Charleston. No wonder yall don't win here.https://twitter.com/scdp/status/765312192996597760 …,2016-08-15 22:22:57,18,3,765312853645623298
Again @scdp refusing to state whether you oppose sending GITMO terrorists to Charleston. Wow!https://twitter.com/scdp/status/765310978846097408 …,2016-08-15 22:18:40,6,1,765311773423628288
"Breaking News: @scdp refuses to say whether they oppose bringing terrorists from GITMO to Charleston, SC.",2016-08-15 22:14:41,12,11,765310769995124736
Proud of our coach!pic.twitter.com/C9OkRFVXOA,2016-08-12 14:54:03,37,5,764112717871476736
If you're interested in what I'm doing to keep country safe. You should review my proposals to protect us from Islamic State,2016-07-25 10:06:06,0,0,757517273183780865
glad I commented since we now know it led White House to not invite her to perform. GOPer would have faced boycott for remarks,2016-07-25 10:04:48,0,0,757516947810553856
it was a comment I made nearly a year ago pointing out the hypocrisy in how the situation was being handled.,2016-07-25 10:02:50,0,0,757516450902970373
These Islamic State arrests in RIO are a big deal. Security Forces told me yesterday they were watching the group closely.,2016-07-21 16:43:04,27,21,756167621435805698
ISIS terror cell arrested in Rio planning attacks on Olympics! I was there yesterday talking with security forces!http://tinyurl.com/jektt8s ,2016-07-21 16:18:58,24,33,756161556082077698
read the article. Sounds like France has made some major mistakes allowing too many people in.,2016-07-18 22:39:19,6,1,755170109505753088
which article?,2016-07-18 01:26:17,0,0,754849741851230208
So ready @ClemsonPrez @ClemsonFB to hear the Song That Shakes the Southland - Tiger Rag! #Ready4CollegeFootball #LoveMyTigers #4forHeisman ,2016-07-17 13:13:42,34,8,754665380128387072
why is it ok for Obama to suspend Iraqi resettlement b/c of terror concerns but not when I suggest other terror havens?,2016-07-16 15:02:19,4,0,754330327452160000
"Obama stopped refugee resettlement from Iraq in 2011, now he lectures the American people on Syrian refugees?",2016-07-16 14:55:06,40,29,754328512283246592
we're talking about non-citizens who shouldn't have the level of due-process rights as citizens. But they will all have a hearing,2016-07-16 12:40:14,1,0,754294571471736832
how about considering the restrictive gun laws in places like Illinois so that law-abiding citizens can protect themselves,2016-07-15 18:53:52,3,1,754026210292793344
"I had the best chicken sandwich and waffle fries EVER today @ChickfilA in Laurens, SC #LoveChickfiA #ThatsHowWeDoLunch",2016-07-15 18:52:17,34,8,754025813876637696
benefit of a hearing. Gov't has to present its case.,2016-07-15 16:30:32,2,1,753990141593518080
deportation hearing allows you to address reason why you are being deported. Including presence on watch list.,2016-07-15 16:26:49,1,1,753989203319554048
legislation makes it a violation to be in the US if you are a non-citizen and on a terror watch list.,2016-07-15 16:23:37,4,3,753988398625329152
"standard deportation hearing, same as what we already use.",2016-07-15 16:21:15,1,1,753987802623270912
"Thanks for the dialog. Some were more respectful than others, but the threat of Islamic terrorism is very real. We must ACT!",2016-07-15 15:54:07,33,5,753980975516790784
"Again, @iggy12_20 my legislation gives all nom-citizens a deportation hearing. Thus protecting due process.https://twitter.com/iggy12_20/status/753980267182686208 …",2016-07-15 15:52:43,9,2,753980624088674309
I never said banning Muslims. I said banning immigration from terrorist hotbeds.  https://twitter.com/MMonides/status/753979622161809408 …,2016-07-15 15:50:01,15,8,753979943034290177
what is your plan?,2016-07-15 15:48:07,0,0,753979465286373376
.@iggy12_20 I havent heard concern from dems on due process for 2nd amend. But non-citizens would get deport hearinghttps://twitter.com/iggy12_20/status/753978066544697344 …,2016-07-15 15:47:18,5,6,753979262093316096
I wouldn't bar anyone from France or the EU. But does put stress on visa waiver program.,2016-07-15 15:43:26,1,1,753978287978721280
.@tdwest74 my positions are 100% constitutional. We're talking about non-citizens who don't have a right to be here https://twitter.com/TDWest74/status/753977165922926592 …,2016-07-15 15:41:55,12,7,753977904493568000
already answered that.,2016-07-15 15:39:43,0,0,753977353617813504
"Have you ever seen the state flag of SC? Too much snark, too few alternative solutions  https://twitter.com/MMonides/status/753975854053588997 …pic.twitter.com/mAvdGtHPLs",2016-07-15 15:37:41,9,0,753976838490165248
"I wouldn't call what's happening in Europe & US a ""perceived threat"", when people die it becomes a real threathttps://twitter.com/speechboy71/status/753975181627035648 …",2016-07-15 15:35:38,17,9,753976324977340417
Is France alienating and disenfranchising immigrants? They seem to have been very welcoming. That's not the issuehttps://twitter.com/PresumablyDrL/status/753974363851001856 …,2016-07-15 15:29:52,5,3,753974873970532352
Easy to call names and nay say @speechboy71. What is your plan?https://twitter.com/speechboy71/status/753969880483766272 …,2016-07-15 15:16:59,7,3,753971629621784576
read my previous tweets on the subject.,2016-07-15 15:12:04,0,0,753970392511819776
Which @rothschildmd I would point you to the FBI Director's comments that we can not fully vet Syrian refugees.https://twitter.com/rothschildmd/status/753966772600971264 …,2016-07-15 15:00:37,12,6,753967511297675265
thank you,2016-07-15 14:58:46,0,0,753967048288407552
thank you.,2016-07-15 14:58:18,2,0,753966929379856386
".@kylegriffin1 again, is a concern which is why I worry ab visa waiver program. We must triage situation & look at largest terror cells.",2016-07-15 14:57:31,4,4,753966731849105411
Wrong @kylegriffin1 but it does put strain on visa waivers. Look at Babin's bill. Lists countries of highest concernhttps://twitter.com/kylegriffin1/status/753952809058525184 …,2016-07-15 14:44:24,8,5,753963432697663488
yes.,2016-07-15 14:38:45,0,0,753962008383336454
I'm saying it shows the concern about who we grant citizenship to. Should we allow radicalized people to come here?https://twitter.com/rothschildmd/status/753960272910364672 …,2016-07-15 14:37:51,9,4,753961783799402500
