Text,Date,Favorites,Retweets,Tweet ID
House cancels votes due to storm. America should rejoice. No misery todaypic.twitter.com/1VUmeDw6iL,2017-03-14 13:14:37,215,65,841638699175673856
"#TrumpCare = Higher costs/Less coverage for millions of Americans. For yrs Trump screwed his workers, now it's America's turn #Resist",2017-03-13 22:05:54,58,30,841410013600071680
"Breaking, 14 million LESS Americans insured under #TrumpCare according to Congressional Budget Office. Time to #SaveTheACA & STOP repeal",2017-03-13 20:30:02,45,17,841385887913111554
"Trump advisor who uses ""alt facts"" says ""I'm not in the job of having evidence."" Yeah, we figured that out months agopic.twitter.com/Gr4NIg0G3d",2017-03-13 19:08:00,110,38,841365241778851843
Trump has produced zero evidence that Obama wiretapped his phone. Kinda like the birth certificate charade. Will the lies ever stop?,2017-03-12 20:43:19,633,268,841026844824592384
Trump just fired prosecutor renowned for public corruption cases. So much for the rule of law. Sad!https://twitter.com/preetbharara/status/840645773985492992 …,2017-03-11 21:28:55,189,99,840675932029501447
Interviewed by @WolfBlitzer on @CNN. Asked about Trump. Russia. Taxes. HealthCare. And Biggie. Never thought Hip Hop would take it this farpic.twitter.com/SUyJWmSMaO,2017-03-11 18:18:08,163,82,840627916912369665
Trump has spent his entire life cheating others to enrich himself. Period. Full stop. Why would anything change now?https://nyti.ms/2msKU8B ,2017-03-11 13:56:53,206,154,840562171016810496
Are Trump/Kremlin hacking connections coincidence or collusion? We plan to find out https://youtu.be/lPhLFzi3VhU pic.twitter.com/Bs5eDjdEcg,2017-03-10 22:56:40,72,40,840335625098264576
Proud to stand w/ @NYGovCuomo in support of $1.4 Billion effort tackling poverty/suffering in central Brooklynhttps://www.nytimes.com/2017/03/09/nyregion/cuomos-1-4-billion-plan-targets-brooklyn-in-fight-against-poor-health-and-poverty.html?smprod=nytcore-iphone&smid=nytcore-iphone-share …,2017-03-10 18:26:50,66,21,840267719509438464
Just paid tribute to late/great #BiggieSmalls on House flr. Gone but never forgotten. #WhereBrooklynAt @OmariHardwick @diddy @MichaelSkolnikpic.twitter.com/2QaXOkmJdp,2017-03-10 00:57:47,3798,2447,840003718166794242
Sickened and outraged by bomb threat directed at Jewish Children's Museum in Brooklyn early today. This must STOPhttp://www.nydailynews.com/new-york/bomb-threat-prompts-evacuation-jewish-children-museum-article-1.2993040 …,2017-03-09 23:38:01,126,81,839983645691637760
"Blasted #TrumpCare on House Floor, bill will increase costs and gut coverage! DISASTER for Americahttps://www.youtube.com/watch?v=cyt8jXgH0g8&sns …",2017-03-09 20:40:05,94,27,839938865397968896
"Just introduced Resolution of Inquiry w/ @RepTedLieu & @HouseDemocrats demanding Trump come clean, re: #RussianHackingpic.twitter.com/wvoOngIBpP",2017-03-09 17:57:09,242,156,839897862154645504
"Proud to rep the neighborhood that gave the world Brooklyn's Finest. May 21, 1972 - March 9, 1997 #BiggieSmallspic.twitter.com/4iPzyJdgBZ",2017-03-09 14:56:09,218,79,839852311283367937
The GOP civil war has begun #Trumpcare #SaveTheACAhttps://twitter.com/heritage_action/status/839149103330258945 …,2017-03-07 20:35:00,42,27,839212809481306112
"TrumpCare will drive up costs and gut coverage. If they break it, they own it!https://nyti.ms/2mzaeL6 ",2017-03-07 19:17:13,29,20,839193237734699012
"New travel ban from Trump, same old Xenophobia  #NoBanNoWall",2017-03-06 17:18:27,91,28,838800958519922690
Nobody held it down like Harriet Tubman #WomensHistoryMonthpic.twitter.com/aAvdq1KfTg,2017-03-06 15:18:25,163,53,838770751847206912
"Let's be clear Donald, only bad (or sick) guy connected to White House is YOU #FakePresidenthttps://twitter.com/realdonaldtrump/status/837996746236182529 …",2017-03-05 16:03:05,199,80,838419603088891904
"Trump lashes out, acknowledges serious investigation. He's in BIG trouble, may have run criminal enterprise. SHAME!",2017-03-05 14:22:41,137,43,838394336274432000
"Republicans seek to destroy ACA, but refuse to produce so-called replacement plan. What are they hiding?https://nyti.ms/2lFgm0I ",2017-03-04 16:54:48,63,39,838070233554374656
Enjoyed spending time with the brilliant MS 207 Robotics team in Howard Beach today. Our future is bright!pic.twitter.com/PpY7H86SbB,2017-03-03 21:16:14,30,6,837773635595223042
Waste $20 billion on a wall that doesn't work? NYET!http://thehill.com/blogs/blog-briefing-room/news/322144-a-mexican-lawmaker-climbed-the-border-wall-to-prove-a-point-to …,2017-03-03 14:04:35,45,18,837665008947429376
Join me in Canarsie for mtg this evening w/ Army Corp of Engineers to discuss Storm Resiliencypic.twitter.com/0L4NIBSrbm,2017-03-02 22:36:23,12,8,837431418443685888
"Just in, Sessions recuses himself from Trump/Russia investigation. Now he should hire a criminal defense attorneyhttp://thehill.com/homenews/house/322020-dems-demand-fbi-perjury-probe-of-sessions …",2017-03-02 21:48:39,73,28,837419406632304641
FBI director unloaded on Hillary but clams up re Trump & #RussianHacking scandal. Double standard is NOT acceptable.http://politi.co/2mPYKiD ,2017-03-02 19:16:11,96,47,837381036971524098
Watergate began as simple break-in. Nixon denied involvement. 2 yrs later resigned in disgrace. Where will the #RussianHacking scandal lead?,2017-03-02 17:00:58,104,46,837347009350807552
The @FBI must investigate Jeff Sessions for lying to Congress under oath #Perjury,2017-03-02 14:45:38,104,39,837312951380029440
BREAKING NEWS: Sessions hid mtgs w/ Russian Ambassador. AG must step aside from #RussianHacking investigationhttp://wapo.st/2mb2deO ,2017-03-02 03:40:46,95,36,837145631831506945
"Just left House Floor, made clear American people deserve to know whether the President is a crook #Nixon #StayWoke https://www.youtube.com/watch?v=Bg6VB3e_G7I …pic.twitter.com/uZ8Eh8RqHQ",2017-03-01 17:18:10,126,47,836988947083444224
"Next time you come to the House, bring your tax returns with you #FollowTheFactspic.twitter.com/4sjGIOcIfb",2017-03-01 03:13:33,762,309,836776395376324608
Question for @RepJoeWilson: When are you planning to blurt out YOU LIE during this speech? http://www.cnn.com/2009/POLITICS/09/09/joe.wilson/ …,2017-03-01 02:12:16,104,44,836760970982731776
Sessions withdraws DOJ objection in TX voting rights case and lifts up private prisons. They have no shame #ProtectOurDemocracy,2017-02-28 20:12:15,62,54,836670371600429060
Trump & his legions prepare to storm Capitol tonight. House Democrats ready to #resistpic.twitter.com/cBuGmyeLGp,2017-02-28 15:10:54,73,34,836594534406586368
"Just in, @HouseGOP votes to keep Trump tax returns hidden from America people. SHAME!",2017-02-28 00:19:44,145,127,836370262555779072
House back in session today. Still waiting for Trump & House Republicans to produce health care plan. Likely to happen? NYET!,2017-02-27 20:29:45,91,28,836312387791777793
We will NOT allow so-called president to target hardworking Muslim-Americans in our community based on religion. Not today. Not ever.pic.twitter.com/DEikhhru3S,2017-02-27 00:54:07,156,42,836016529426776064
Join me today for town hall mtg to discuss Trump attacks on religious freedom & immigrant families #Resistpic.twitter.com/MMwyu3r96u,2017-02-26 15:33:58,96,43,835875562883284992
Hidden tax returns. Illegal contact w/ Russia. Election interference. Obstruction of Justice. Lock HIM up?http://www.msnbc.com/rachel-maddow-show/white-house-contacts-fbi-take-russia-scandal-new-direction …,2017-02-25 14:12:14,148,78,835492604053712897
Touring Texas/Mexican border fence in Brownsville. Trump claims it's the Wild West down here. Wrong!pic.twitter.com/jD0a4Kb47g,2017-02-24 20:21:19,97,31,835223099377389568
Heading to Texas/Mexican border in Rio Grande Valley w/ @RepFilemonVela @RepRichardNeal & Immigration advocates #NoBanNoWall,2017-02-24 16:45:25,51,10,835168766568894464
Paid Protestor Claim = Fake News. GOP  scared. Real question: Does Putin have paid asset in White House? #FollowTheFacts,2017-02-23 14:13:43,109,44,834768201183612928
Rising tide of Anti-Semitic hate crimes unacceptable. Anytime. Anywhere. DOJ must vigorously investigatehttp://cnn.it/2lliuNc ,2017-02-22 13:48:58,364,167,834399585544056833
Trump is correct. Country is divided. He has made problems worse by fanning flames of hatred & divisionpic.twitter.com/PFQQAeAUue,2017-02-21 22:52:04,165,67,834173872798834688
Focused on Trump. No final decision about City Hall until the Spring. #resist,2017-02-21 20:46:29,41,15,834142269645135874
"What a tough guy this President of ours, attacking Sweden w/ #FakeNews. Pick on someone your own size. Sad!",2017-02-21 00:14:40,94,28,833832274957332481
If America & the world is such a mess why is @POTUS always on vacation? #DoYourJob,2017-02-20 20:02:10,184,51,833768730123440130
"Trump says news media the enemy of the American people. No 45, your best friend Putin is the real enemy #FollowTheFacts",2017-02-19 19:10:58,108,42,833393455191748609
Who's in charge Trump or Bannon? #Resistpic.twitter.com/8KHi3cGjct,2017-02-19 00:41:29,125,53,833114248331010048
Straight Talk from @RepJerryNadler (and the NY congressional delegation). Repeal of the ACA will be a death sentencehttp://cbsloc.al/2lZ3ItZ ,2017-02-18 23:04:01,100,60,833089718971686913
Joined with @NydiaVelazquez @repjoecrowley & @RepJerryNadler to #ProtectOurCare. We will defend the ACA with everything we have!pic.twitter.com/3w0XkiYv60,2017-02-18 19:12:23,80,31,833031427658760195
Trump tells reporter set up mtg w/ Congressional Black Caucus. @OfficialCBC Strikes Backhttp://www.huffingtonpost.com/entry/congressional-black-caucus-trump_us_58a76e93e4b037d17d27cb22 …,2017-02-18 14:01:56,101,45,832953300215554048
Partnered w/ @RepJohnConyers & Dems to ask DOJ Inspector General to look into Trump/Sessions conflicts of interesthttp://www.huffingtonpost.com/entry/democrats-trump-whistleblower-threats_us_58a737bee4b07602ad544da5?ncid=engmodushpmg00000004 …,2017-02-18 03:14:23,137,81,832790337777045504
#Factshttps://twitter.com/katyturnbc/status/832690449991110656 …,2017-02-17 20:45:36,409,154,832692496765292544
Demanded @HouseJudiciary Committee put country over party and investigate Trump #FollowTheFacts https://www.youtube.com/watch?v=cKHKUr_rQu0 …pic.twitter.com/hI5eVtw9KO,2017-02-17 17:30:55,298,152,832643503146426370
"Trump just claimed he inherited a mess. Actually, you didn't.  President Obama inherited a mess, and turned the situation aroundpic.twitter.com/oHAiskWfWv",2017-02-16 19:09:18,522,306,832305874265919488
Where was the outrage at law enforcement leaks designed to hurt Hillary Clinton? #Phonies,2017-02-16 16:30:10,120,31,832265826623447041
Blasted so-called president during @HouseJudiciary hearing. How dare Trump question legitimacy of others #Fraud http://bit.ly/2lSh3TR pic.twitter.com/k2ySFOGO7q,2017-02-15 23:46:03,167,92,832013132625240064
"It's official, Trump's proposed labor secretary is OUT. Two down (Flynn + Puzder) & several more to go. Resistance movement is alive & well",2017-02-15 21:27:20,231,37,831978222187401216
"Just in, Trump's Labor Secretary nominee about to go down. Keep the pressure on, they are caving #Resist",2017-02-15 19:49:05,100,29,831953499139276810
Trump poses greatest threat to our democracy since Nixon #InvestigateTheWhiteHousepic.twitter.com/8tY9mz4Gc4,2017-02-15 17:36:22,111,53,831920099766439936
"Just left House Floor, demanded that Republicans investigate corrupt White House/Russian connection and stop acting like Trump puppetspic.twitter.com/Jp8eKzmf1g",2017-02-14 18:03:24,422,155,831564515972091904
"Michael Flynn has resigned. Good riddance. To be clear, this is just the beginning #Resist",2017-02-14 04:05:48,187,43,831353724501159937
What did the President know and when did he know it about possible Russian blackmail of National Security Advisor? #FireFlynn,2017-02-14 03:22:01,107,35,831342705850589184
Trump National Security Advisor LIED to America about Putin. Drain the Swamp. Fire Flynn. Today.,2017-02-13 19:19:42,101,28,831221329114386433
Republicans flee powerful words from the iconic Coretta Scott King. They can run but they cannot hide #Resistpic.twitter.com/14GysgURaN,2017-02-13 05:46:07,73,26,831016583673872388
"Promises of greatness. All he did was win. Brief tenure a disaster. Yes, it's time  @nyknicks fire Phil Jackson. #Trump #FreeCharlesOakleypic.twitter.com/HYapqXwE1z",2017-02-11 22:33:41,35,13,830545371042557953
Impossible to figure out where Trump family business ends and White House begins. Keep the pressure on,2017-02-11 15:05:27,167,55,830432568751308804
"Pressure on House Republicans mounts throughout the country, including in Utah. RISE of the Resistance https://www.nbcnews.com/news/us-news/amp/rep-jason-chaffetz-faces-angry-town-hall-crowd-utah-n719231 …pic.twitter.com/7njANJB92o",2017-02-10 22:02:53,53,21,830175230186373123
JUST IN: Trump National Security Advisor LIED about illegal communication w/ Russia. We will investigate them all.http://wapo.st/2k97unm?tid=ss_tw-amp …,2017-02-10 16:19:33,118,60,830088828887109632
pic.twitter.com/qLri6uVDX3,2017-02-10 15:08:26,83,31,830070929300545537
Court strikes down Trump travel ban in a victory for OUR security and the Constitution #Resist,2017-02-10 00:34:42,104,18,829851048143646722
"White House focused on Trump family business, while @HouseDemocrats are promoting the people's business #Jobspic.twitter.com/6mGkWcUQsB",2017-02-09 22:00:28,47,17,829812233572143106
Classic abuse of power. There must be consequenceshttps://nyti.ms/2kODZa4 ,2017-02-09 01:19:45,67,25,829499998471589888
How dare Mitch McConnell silence @SenWarren. He's the one who needs to shut his mouth. And listen to the American People #ShePersisted,2017-02-08 20:20:47,165,40,829424759603658775
"If Donald Trump wants to drain the swamp, he should start at 1600 Pennsylvania Avepic.twitter.com/DBz7cyZ3iC",2017-02-08 15:44:08,137,53,829355138808737793
House Republicans starting to feel heat of resistance movement. Save our country. Keep the pressure on.,2017-02-07 23:39:34,227,69,829112396442718208
Trump falsely claims media doesn't cover terrorist attacks. Why do some think it's ok to have a liar-in-chief in the White House?,2017-02-07 14:45:50,54,14,828978080605732865
"Repeal and replace is a slogan, not a solution.  We will resist the so-called president and #SaveTheACA",2017-02-06 22:09:51,129,48,828727431980793856
Thankful to police department for arresting suspect in tragic killing of Howard Beach resident Karina Vetranohttp://nydn.us/2jPDyfY ,2017-02-06 00:27:55,17,4,828399791398907904
Trump suggests Russia under Putin and America are morally equivalent. What exactly does Putin have on the 45th President?,2017-02-05 18:16:45,159,72,828306381518282752
Here's a thought for the so-called President: Independent judiciary is hallmark of our democracy #PopularVote #RussianHacking #ComeyLetter,2017-02-05 16:27:09,102,33,828278802203758593
"Trump baselessly attacks Judge who blocked travel ban, clearly doesn't get there are 3 government branches separate & co-equal",2017-02-05 01:11:22,145,41,828048338683572225
President Obama handed Trump a thriving economy. How long will it take the Bluffer-In-Chief to blow it?pic.twitter.com/vIwfCnflyl,2017-02-04 01:47:48,85,34,827695117209321474
Chaos. Carnage. Constitutional Crisis. And it's only Day 14 #Disaster,2017-02-02 13:18:40,135,49,827144202454724609
"Not every American who voted for Donald Trump is a racist, but every racist in America voted for Donald Trump #PresidentBannonpic.twitter.com/oA6mZ9Rc6t",2017-02-01 22:32:08,243,99,826921100017803270
"WH counsel is the President's attorney.  Attorney General is the people's attorney. Apparently, only Nixon & Trump don't get the difference",2017-02-01 00:17:37,248,128,826585259198263296
Trump fires Acting AG Sally Yates for refusing to defend Un-American executive order. History will absolve her #MondayNightMassacrepic.twitter.com/tiJsnGEKy7,2017-01-31 14:24:10,82,20,826435909998477316
Matthew 25:35 #Resistpic.twitter.com/SkL4gQiAyT,2017-01-30 23:38:58,151,33,826213144565522434
It's time for @SpeakerRyan to put country over party & help us block Trump's unconstitutional immigration order #ManUp,2017-01-30 16:36:04,260,87,826106717842898947
"Heading back to D.C. this morning, where we will fight to defund Trump's unconstitutional executive orderpic.twitter.com/yZLhzruEsv",2017-01-30 14:26:37,233,63,826074141291864064
FREE!  #Resistpic.twitter.com/0k64FtIwvd,2017-01-29 21:33:49,454,118,825819261234974721
Just met with active duty US soldier. Elderly mom flew in from Iraq. 30+ hours in detention. I refuse to leave JFK until she is free ,2017-01-29 20:57:03,3307,1661,825810008055091201
Trump's Chief of Staff claims green card holders aren't impacted. Wrong! I've helped several here at JFKpic.twitter.com/YYfgJIAD2M,2017-01-29 20:24:56,3363,2428,825801927497748483
Father reunited with his son after being detained at JFK for almost 30 hours. He is a permanent legal resident! #Resistpic.twitter.com/d1DF93E7Sa,2017-01-29 18:31:49,390,203,825773458273529859
Four detainees just released. More to come. #Resistpic.twitter.com/ljbd1g2MQy,2017-01-29 16:53:03,347,101,825748604765736960
"Here at JFK with the families of individuals w/ visas who are STILL being detained, some w/ relatives who are active duty military #Shameful",2017-01-29 16:06:15,1277,1005,825736825855672320
En route to JFK to determine if Feds are trying to send refugees back home in defiance of Federal court order,2017-01-29 15:40:38,487,201,825730378228973568
"Does America realize what it has done in ""electing"" this dangerous man?  #Disgraceful",2017-01-29 00:41:40,299,122,825504146346356736
Have no interest in wasting billions of dollars in taxpayer  to pay for the Hater-in-Chief's stupid wall. Period. Full stop.,2017-01-27 17:49:55,429,120,825038137554567168
"We've been knocked down, but a knockdown is very different than a knockout #Resistpic.twitter.com/egcZlWdK9h",2017-01-27 14:34:50,80,33,824989044744519680
Watch live at 7:30p as I take on Trump in my annual State of the District address in Brooklyn! #Resist https://facebook.com/RepHakeemJeffries/ …,2017-01-27 00:18:10,53,7,824773455690289152
"Reagan told the Soviets to tear down that wall, but Trump and House Republicans want to build one up. Sad!",2017-01-25 21:20:08,85,21,824366266408431616
All I can say is the brother kept it real →pic.twitter.com/TngctRn5lO,2017-01-25 18:22:47,494,161,824321632739196939
Should the Prison Ship Martyrs' Monument in Fort Greene Park be designated as a national monument? http://patch.com/new-york/fortgreene/part-fort-greene-park-could-be-run-feds-under-new-proposal …pic.twitter.com/JaalE1v5Et,2017-01-25 00:31:31,15,3,824052043270811653
Trump falsely claimed (again) to congressional leaders this evening that illegal immigrants cost him the popular vote. Wow. Liar-in-chief?,2017-01-24 02:58:29,128,43,823726639033024512
Senate Republicans cave on Trump's Secretary of State nominee. Vladimir Putin will get his man. What happened to putting America first?,2017-01-23 20:32:20,83,33,823629459681120256
America deserves to know what impact the Russians and the FBI director had on the electionpic.twitter.com/oxhC9fJAoe,2017-01-22 22:03:35,171,72,823290037018251266
"Yes donald, size DOES matter #GhostTownpic.twitter.com/rjt9Z7Uu5v",2017-01-22 15:11:55,81,26,823186437256445953
This is what the Popular Vote looks like #WomensMarchpic.twitter.com/ZLt7CCwQSA,2017-01-21 23:39:28,305,67,822951780438994944
The women of America have risen up in the spirit of the great Shirley Chisholm. We're not going backward #WomensMarchpic.twitter.com/Kc2QFIqafw,2017-01-21 19:51:34,158,59,822894427345747968
"Yea, though I walk through the valley of the shadow of death, I will fear no evil: for thou art with me. Psalm 23:4",2017-01-20 14:07:18,62,19,822445399692681217
"Sad to hear about the passing of Wayne Barrett, one of the best investigative reporters the City has ever seenpic.twitter.com/dgmFaRxtbM",2017-01-20 04:08:45,21,2,822294770466820096
Clock is ticking on whether outgoing Justice Department will indict Eric Garner's killer → http://bit.ly/2iGD76X  #Accountability,2017-01-19 20:07:53,13,6,822173755736727553
CBO Report makes clears that Republican ACA repeal will strip 32 million Americans of Healthcare #Shameful,2017-01-18 16:08:50,30,15,821751209476427778
"The dream is alive!  Don't Agonize, Organize #HappyKingDay #MLKDAYpic.twitter.com/2J3OQvroUg",2017-01-16 18:24:54,77,27,821060676928028672
"Ringling Bros just announced the circus is ending after 146 yrs. Don't despair, the #Trump circus is just getting startedpic.twitter.com/gJAw8Y6qZg",2017-01-15 21:32:02,86,22,820745380489007108
"John Lewis did more for America on 1 day March 7, 1965 than Trump will ever do in his entire lifetime #BloodySunday #StandwithJohnLewispic.twitter.com/pYq7uPQjrf",2017-01-15 00:11:24,816,305,820423102026883073
The #fakepresident now attacks an American hero. I stand with @repjohnlewis. Join mepic.twitter.com/fEX4g5Gz4s,2017-01-14 18:05:55,471,178,820331121665855488
Made clear on House Floor that Republican effort to destroy healthcare will screw the American people #RealTalk https://youtu.be/nhqGbsGq9VQ pic.twitter.com/XkE2fiWpQl,2017-01-13 20:06:27,129,45,819999069821108224
Seven Congress Members wrote to outgoing Justice Department on #EricGarner case. Here is our letter:http://bit.ly/2jIKCuq ,2017-01-12 18:35:17,35,22,819613740085682176
Obama Justice Department must begin to prosecute Eric Garner's killer. Today. Tomorrow. Prior to leavingpic.twitter.com/kf11WFM2n7,2017-01-12 17:13:30,67,33,819593155972628482
"Sen. Sessions supports mass incarceration, thinks #VotingRightsAct is intrusive & defends Confederate Battle Flagpic.twitter.com/YtfDa9XCvy",2017-01-12 14:35:05,53,34,819553291000483840
Trump said today only the press cares if he releases tax returns. True or False? Let me know . . .pic.twitter.com/8LHKlsmxrh,2017-01-11 19:52:57,26,10,819270896384954374
"Is Donald Trump's real objective to  #MakeRussiaGreatAgain?  Patriots rise up, we must stop him",2017-01-11 14:09:18,45,11,819184412587859968
Our President just dropped the  #YesWeCan #YesWeDidpic.twitter.com/YcJCLklLrA,2017-01-11 03:27:23,100,27,819022869015490561
Jeff Sessions is not fit to lead the Department of Justice #WeDeserveBetterhttps://youtu.be/1rVfcwc3-6M ,2017-01-10 22:13:53,30,7,818943974652125184
Joined @OfficialCBC on House floor last evening to oppose nomination of Jeff Sessions. Dept. of Injustice?pic.twitter.com/yTtPMfOrfQ,2017-01-10 14:58:06,90,36,818834305140998144
Why is the President-elect reacting to Celebrity Apprentice & the Golden Globes? #DoYourJobpic.twitter.com/8r1l2UJ5f1,2017-01-09 14:48:58,69,20,818469619992264704
The resistance movement in BK is alive and well #FightBack https://pix11.com/2017/01/07/ny-lawmakers-healthcare-providers-rally-against-repeal-of-obamacare/ …pic.twitter.com/52Vo8x4gws,2017-01-08 20:05:42,59,18,818186942005346304
Proud to stand with Brooklyn Congressional Delegation in battle to protect healthcare in Americapic.twitter.com/v5xRYYHiXz,2017-01-07 22:36:38,77,18,817862537781936129
No dispute that Putin interfered with Presidential election. Will Trump invite his buddy to the inauguration? #Shame,2017-01-06 22:45:24,30,12,817502356560637952
#ACAworks to fight a history of poor access to care in minority communities. I refuse to allow @HouseGOP to #MakeAmericaSickAgain!,2017-01-06 12:56:43,218,124,817354208500453376
Groundbreaking leadership shown by @NYGovCuomo. Free college for New York's middle-class families is a game changer for so manypic.twitter.com/g3mhsKQNt6,2017-01-06 02:45:44,43,12,817200446901256192
"Correction Mr. Pence, Americans didn't vote for change last November. The electoral college did #PopularVote",2017-01-04 19:26:39,61,18,816727560029667328
Powerful meeting between congressional Democrats and OUR President #YesWeCan #YesWeDidpic.twitter.com/TYiK658iWp,2017-01-04 16:24:08,145,68,816681629208952832
House Republicans seek to destroy America's social safety net on Day One #BackOffpic.twitter.com/KhGPxjExcg,2017-01-03 21:56:00,90,66,816402760799285248
"After intense criticism, House Republicans back off plan to gut Congressional Ethics Office #CultureOfCorruption",2017-01-03 18:37:20,21,14,816352762820698112
"House Republicans return to DC, immediately vote to castrate independent ethics office. Did you really think they meant #DrainTheSwamp?",2017-01-03 03:00:07,99,62,816116904389672960
Is it ego stopping the President-elect from acknowledging that the Russians interfered with our election and helped him win?,2017-01-02 21:28:29,28,5,816033445281484800
Happy New Year!!!  May God bless you and your family in 2017,2017-01-01 16:19:55,14,0,815593404830720000
"Unlike the president elect, we deal in reality. Here are the facts #ObamaEconomypic.twitter.com/td307qXRjo",2016-12-31 21:12:36,85,68,815304674899267584
"More than 20 million previously uninsured Americans now have affordable health coverage. Next year, we fight for them #Obamacare",2016-12-30 18:02:01,46,5,814894324299218944
Trump voters in places like Kentucky & Ohio benefit from the ACA. Republicans want to dismantle it. Buyer's remorse?,2016-12-29 19:43:08,18,8,814557381921243138
"Carl Paladino (Trump advisor), your apology is NOT accepted #TimeToResign #NegateTheHate",2016-12-28 19:05:07,36,15,814185427649384448
"Republicans spent 8 yrs obstructing our President, now want to lecture @HouseDemocrats on etiquette #PipeDown",2016-12-28 17:15:44,65,28,814157900042137600
Trump plans to shut down charitable foundation that he claims did great work. Will anyone even notice?,2016-12-26 23:25:22,32,5,813526145329143808
