Text,Date,Favorites,Retweets,Tweet ID
Calling on federal officials to enhance security & investigate in wake of threats against Jewish community centers: https://fasoforms.house.gov/UploadedFiles/Final_Joint_Congressional_Letter_to_DHS_DOJ_and_FBI_Regarding_Threats_to_Jewish_Community_Centers.pdf …,2017-02-23 22:19:04,22,3,834890345578119170
Gen. McMaster is a warrior-intellectual who will bring experience & toughness to America’s foreign policy interests.https://www.google.com/amp/www.timesunion.com/tuplus-local/amp/Gibson-McMaster-an-awesome-commander-10949734.php?client=safari …,2017-02-22 19:42:04,10,4,834488446987206656
Encouraged by newly confirmed EPA Admin Pruitt’s comments on the need to address pollution in Hudson River.http://on.wsj.com/2lUzCLB ,2017-02-22 16:56:56,5,0,834446889638576128
Spent the day in Sullivan County meeting with constituents and taking their questions at the… https://www.instagram.com/p/BQy4N0RjLwP/ ,2017-02-22 01:11:56,7,1,834209074052988928
It was a pleasure to meet with you in Monticello while traveling the district. #ny19https://twitter.com/davita/status/834107068957069312 …,2017-02-21 20:39:17,6,0,834140459018702848
"In honor of Presidents Day, let us look to George Washington and Abraham Lincoln for… https://www.instagram.com/p/BQvHdTqDAdF/ ",2017-02-20 14:08:19,3,1,833679679085301760
"In honor of #PresidentsDay, I look to the talented individuals from the Empire State who have served as our President.pic.twitter.com/MkQFJYrrxv",2017-02-19 14:13:28,18,2,833318588807274496
Are you receiving my weekly e-newsletter? Catch up on my past newsletters and sign up! http://faso.house.gov/news/email/ pic.twitter.com/UxqlT72DtZ,2017-02-18 14:00:44,1,0,832952995545481217
We will reform and fix the #ACA in an open and transparent way.http://ow.ly/uAzi3096QiN ,2017-02-17 18:16:06,11,3,832654872105218049
"Recently I met Tommy Mooney, an athlete from Troy who competes in the @specialolympics. He will… https://www.instagram.com/p/BQnhJ6TjZdE/ ",2017-02-17 15:18:40,5,0,832610222669778944
WATCH: At today’s @houseagnews hearing I discussed a $3 billion-plus cost to taxpayers.https://youtu.be/a2JIEUSDpRY ,2017-02-16 21:49:07,1,1,832346095061704704
What can we do to expand the domestic market for dairy products and help our farmers? https://youtu.be/ZY_x95Ld-S4  @HouseAgNews,2017-02-15 19:37:40,3,1,831950626091368460
I recently spoke with the Cobleskill Times-Journal about my first few weeks in office. http://www.timesjournalonline.com/article.asp?id=101812 … #ny19,2017-02-15 15:54:52,0,0,831894556698349569
Valentine’s Day is also National Organ Donor Day. Organ donation saves lives. https://organdonor.gov/index.html ,2017-02-14 20:12:56,9,4,831597111795912708
Our veterans deserve reliable access to resources and the best care from the VA. http://ow.ly/5GFR308YwUd  #WINGMAN,2017-02-13 23:42:32,11,3,831287469702275072
I was humbled and honored to pay tribute and memorialize the life of US Navy veteran Philip… https://www.instagram.com/p/BQeEDf2hvbY/ ,2017-02-13 23:11:13,6,1,831279590383300608
Have you signed up yet for my e-newsletter https://faso.house.gov/forms/emailsignup/ …,2017-02-10 16:18:56,3,2,830088673412706304
"Capital Region residents, don’t fall prey to this latest phone scam. #CanYouHearMehttp://ow.ly/WF1l308Rprg ",2017-02-10 14:00:52,1,1,830053928020606981
Check out today’s @PokJournal for my op-ed on ACA reform.http://ow.ly/x0Nk308OUJV ,2017-02-09 14:01:10,3,2,829691614343856131
ICYMI: Last night I spoke with @tuckercarlson on the President’s recent executive order. http://ow.ly/epER308O1zl  #Tucker,2017-02-08 15:05:51,4,3,829345506090504193
Thanks @TuckerCarlson for having me on the show tonight! @FoxNewspic.twitter.com/5bj8jJ3YKP,2017-02-08 03:20:44,129,4,829168055351701504
ICYMI: I spoke w/ @CTLizB on @CapitalTonight. Watch here: http://ow.ly/GplH308Ma80 ,2017-02-07 19:16:12,2,1,829046120827482112
"H.R 387 ensures that as technology advances, our privacy protections under the 4th Amendment are not diminished.http://ow.ly/uwqx308KhPb ",2017-02-06 23:59:42,8,2,828755078140018688
"Happy birthday, Gipper!pic.twitter.com/j3zkJFZQj4",2017-02-06 17:50:02,5,1,828662045478359044
Iran continues to destabilize region and provide support for international terrorism. @POTUS is correct to respond to latest provocation.,2017-02-03 18:04:34,7,3,827578540518432768
Talking with @fud31 on @TALK1300 right now. Tune in! http://www.talk1300.com ,2017-02-03 15:46:10,2,0,827543709696790529
Thanks to @cspanwj for having me on today's show. I enjoyed my discussions with Bill Scanlan and loyal @cspan viewers.pic.twitter.com/ZDoIjCQifs,2017-02-03 14:37:24,1,0,827526404191436800
Tune into @cspan at 8:30a where I will be live with Bill Scanlan on @cspanwj.,2017-02-03 12:44:39,3,1,827498032694489092
ICYMI: I spoke with Tom Sipos on @1450WKIP earlier this week. Listen here:https://www.youtube.com/watch?v=7kcmfmmFlco …,2017-02-03 00:30:15,1,0,827313212328652802
Thanks to @repdougcollins for hosting today's general speeches. Proud to introduce #ny19 to the 115th Congress!https://youtu.be/Fsati79H3JE ,2017-02-02 23:03:12,2,0,827291307445977097
Posed some questions to the @USCBO director about their budget and economic outlook at today’s @HouseBudgetGOPhttps://www.youtube.com/watch?v=nccOft6auHc …,2017-02-02 21:17:26,3,1,827264689788694528
"Honored to be named Vice Chairman of @Transport’s Subcommittee on Railroads, Pipelines, and Hazardous Materials.http://ow.ly/azHG308CjSz ",2017-02-02 19:00:43,2,2,827230282696814592
"I look forward to serving on the @HouseAgNews Subcommittee on Nutrition as well as Subcommittee on Commodity Exchanges, Energy, and Credit.https://twitter.com/HouseAgNews/status/826816116316053504 …",2017-02-02 17:09:48,2,2,827202370308284416
Celebrate Black History! African Americans have contributed greatly to our nation. Join me in recognizing these timeless achievements. #BHMpic.twitter.com/x8MZmHe2aL,2017-02-02 00:26:12,4,0,826949806929084416
https://www.youtube.com/watch?v=SMssxPYN-SM …https://twitter.com/RepBillShuster/status/826828978640019457 …,2017-02-01 16:29:59,2,0,826829962602741760
Judge Gorsuch receives bipartisan support as a fair and decent jurist. #SCOTUShttps://mobile.nytimes.com/2017/01/31/opinion/why-liberals-should-back-neil-gorsuch.html?_r=0&referer= …,2017-02-01 13:28:28,4,1,826784280412045313
VIDEO: Judge Gorsuch is a great pick to succeed the late Justice Antonin Scalia.https://www.youtube.com/watch?v=sSlH5Q6j4pY …,2017-02-01 02:06:41,12,4,826612705041727488
The appropriate course for Ms. Yates would have been simply to resign her position in protest. http://ow.ly/BWZO308yitn  @TWCNewsAlbany,2017-02-01 00:30:57,4,1,826588615270682624
Everyone deserves the right to work w/o fear of harassment or discrimination. I applaud @POTUS for maintaining #LGBTQ workplace protections,2017-01-31 22:42:49,24,5,826561402118733829
Stop taxing lifesaving medical innovations. Repeal the Device Tax:http://ow.ly/O9OO308xUiN ,2017-01-31 21:08:18,3,0,826537616875065345
"I appreciate Brigadier General Diana Holland, the 76th Commandant of the US Corps of Cadets from… https://www.instagram.com/p/BP8Aw4fBFzq/ ",2017-01-31 17:48:42,3,0,826487386297151488
Great news out of Ulster County! http://ow.ly/8L7H308xtdF  #ny19,2017-01-31 17:34:21,4,2,826483772166172678
Talking with Tom Sipos on @1450WKIP. Tune in now: http://ow.ly/G2UH308wHXk  #ny19,2017-01-31 12:41:07,1,1,826409979485749248
Thanks for all your calls alerting the offices to the teletown hall sign-up glitch. It has been fixed. Sign up here: http://ow.ly/UhmU308vre3 ,2017-01-30 21:34:31,6,3,826181824955240449
My full statement on the recent executive order can be found here: http://ow.ly/Hkec308uKQJ pic.twitter.com/GHX8IWQf5Q,2017-01-30 17:27:01,41,10,826119541730246656
"For over 60 years, the Center for Disability Services has been a beacon of hope, providing… https://www.instagram.com/p/BP3H7Oah35F/ ",2017-01-29 20:14:40,4,0,825799343261126657
Last night I attended the Delaware Agricultural Society dinner. Thanks for having me! #ny19 https://www.instagram.com/p/BP0qAl1h4TW/ ,2017-01-28 21:14:46,2,1,825452080546541568
I spoke with Dr. @AlanChartock on @WAMCNews’s “Congressional Corner” recently. ICYMI listen here: http://ow.ly/zn1J308olWI  #ny19,2017-01-26 21:56:16,5,1,824737748305182720
"Protecting funding for our finite natural resources, permanently. http://ow.ly/SLa3308nGXS  #ny19pic.twitter.com/Yil2xmBEU3",2017-01-26 16:46:21,14,2,824659752236027909
Have you connected with me on Facebook yet? http://facebook.com/repjohnfaso ,2017-01-25 13:01:28,1,1,824240773252186113
Today I questioned multiple witnesses during a @BudgetGOP cmte hearing on the failures of the ACA. Watch here:https://youtu.be/DDa3MqdDCug ,2017-01-24 21:10:47,3,1,824001525748039682
Currently in my first @housebudgetGOP hearing. You can watch live here:http://ow.ly/VewY308iRHY ,2017-01-24 15:14:09,6,8,823911774600790017
Delighted to join the Oppenheim-Ephratah-St. Johnsville HS band for their performance at the Jefferson Memorial!http://ow.ly/wbAz308hGal ,2017-01-24 15:05:22,1,0,823909563661484033
Want to stay up to date with the latest news from our District and the nation’s capital? Sign up for my newsletter: http://ow.ly/dDSx308gzQo ,2017-01-23 17:05:13,1,0,823577339288240129
This weekend I had the opportunity to give a Capitol tour to a great group of students and… https://www.instagram.com/p/BPnGy51B6xC/ ,2017-01-23 14:57:39,1,0,823545233673596930
Did you know FDR’s second inauguration was the first to be held in January? Previous inaugurations were held in March. #TBTpic.twitter.com/tmJx2h4mGE,2017-01-19 17:46:40,4,0,822138217071869952
"With this ill-advised action, Pres @BarackObama sets a dangerous precedent for our nat'l security.http://ow.ly/ZGad3086rah ",2017-01-18 00:28:15,2,1,821514503355506688
"Thanks to everyone who called in to @WAMCVoxPop today, & for the invitation to participate in this discussion. #ny19",2017-01-17 20:44:22,1,0,821458160355606528
"“The ultimate measure of a man is not where he stands in moments of comfort and convenience, but… https://www.instagram.com/p/BPVH0LEBEJA/ ",2017-01-16 15:20:14,4,0,821014201594298368
"Honored to be invited to speak at today's Hudson Interfaith Council's Annual #MLK Jr. Celebration, held at Shiloh Baptist Church.pic.twitter.com/FVfMs7F5Ab",2017-01-16 02:00:38,1,0,820812979373535232
Had a great time at the Ames Breakfast today. It was nice talking with Shawn Bowerman of the… https://www.instagram.com/p/BPSzozXhgjh/ ,2017-01-15 17:44:44,1,0,820688180231868416
Thanks to the Chatham Fire Dept for inviting me to take part in the dedication of their new fire engine with Assemblyman @SteveMcNY. #ny19pic.twitter.com/JpK8raZDOs,2017-01-15 03:01:40,9,3,820465947374944259
You'll always know where I stand. Read my thoughts on #FY17 Budget Resolution here --> http://ow.ly/Q4dL307ZuKM  #ny19,2017-01-13 23:51:17,2,4,820055651720241153
"I look forward to working with my colleagues on @housebudgetGOP,@HouseAgNews, and @Transport. http://ow.ly/2rTo307Z087  #ny19",2017-01-13 19:21:47,4,1,819987826074931200
"""On this day, January 11, 1878, the first bottles of milk were delivered in New York State.… https://www.instagram.com/p/BPI8KF8hPRp/ ",2017-01-11 21:47:02,2,0,819299605238063104
This is my first time serving the people of #ny19 as presiding officer on the House floor. Honored and humbled.pic.twitter.com/ab1xqshJbe,2017-01-11 00:38:04,6,0,818980258619723777
Ready to get to work!https://twitter.com/repdianeblack/status/818904140638208001 …,2017-01-10 19:37:57,3,1,818904731519160320
"Had a great discussion with @fud31 on @TALK1300 earlier today. If you missed it, you can listen here: http://ow.ly/dqCW307RTTA . #ny19",2017-01-10 16:58:13,2,6,818864535549386752
Thank you to the men and women in blue who selflessly serve and protect our communities. #SupportBlue #TaketheLEAD2017 #ThankACoppic.twitter.com/peobFI0tjI,2017-01-09 20:03:20,6,3,818548732044132356
"Nice, Berlin, #Jerusalem: We stand with you. The fight is for civilization itself. #ny19",2017-01-08 16:56:12,13,6,818139251292438528
I spoke with @sarbetter yesterday on @WCNY. Take a listen. http://ow.ly/rOqG307LByL  #ny19,2017-01-07 15:00:47,4,2,817747817460617217
this is the official account. Thanks! -Staff,2017-01-06 23:06:44,1,0,817507725307498496
"Stay connected, subscribe to my newsletter #ny19 https://faso.house.gov/contact/newsletter …pic.twitter.com/8GJjk9SJeY",2017-01-06 22:40:17,5,3,817501066518528001
"As an original cosponsor of #HRes11, I am pleased to see unequivocal bipartisan support for the Jewish State.pic.twitter.com/SczUzbzlOy",2017-01-06 00:20:58,4,1,817164016263041026
"Today, I was able to participate in a House tradition and recited a portion of the US Constitution.pic.twitter.com/eo7NAalcbg",2017-01-05 20:51:22,6,0,817111267966091265
"Want to send an email, contact one of our offices or schedule a tour? Please visit my website: http://faso.house.gov ",2017-01-05 16:59:42,3,2,817052969929768961
I spoke with @CBS6Albany today. Watch the interview here: http://ow.ly/ae2Y307HfI4 . #ny19,2017-01-04 22:50:18,2,3,816778810259542016
I am thrilled to get to work serving the people of the 19th Congressional District. Thank you for your support!pic.twitter.com/JlxzITpASL,2017-01-03 23:24:44,6,5,816425087826100224
It's official! Follow me here to stay up to date on the latest in Washington and in the district.,2017-01-03 19:46:23,6,2,816370141143384064
