Text,Date,Favorites,Retweets,Tweet ID
#Union representation makes a difference when it comes to quality of lifehttp://mobile.nytimes.com/2014/09/08/nyregion/some-retail-workers-find-better-deals-with-unions.html?_r=0&referrer= …,2014-09-07 20:24:43,3,3,508712490495401984
W/ @SenSchumer & @BilldeBlasio announcing $108 million in federal funding to repair public housing damage from #Sandypic.twitter.com/4I4CpwEjLJ,2014-09-05 16:27:50,2,2,507928101859627008
States w/ higher minimum wages are creating more jobs. Will fact-based evidence convince @HouseGOP to hold a vote to #RaiseTheWage?,2014-09-05 12:19:38,45,126,507865639491747840
We should all support effort by food service workers to obtain a #livingwage http://bit.ly/1CuhGXU ,2014-09-04 16:08:08,8,15,507560755701751808
"Proud to serve the largest Caribbean-American community in the country, along with Her Excellency @YvetteClarkepic.twitter.com/Qw0tRlBtSo",2014-09-01 16:03:55,3,1,506472531256426496
"This labor day weekend, let's all honor the men and women of #OrganizedLabor who helped build our great country",2014-09-01 01:36:42,3,4,506254285378965504
"As economy continues to recover, when the House goes back in session next month let's make things better, not worse",2014-08-31 17:30:20,0,0,506131889141587969
"After decade-long luxury condo explosion in Brooklyn, we need #AffordableHousing for working families  http://www.ny1.com/content/politics/brick_by_brick/214520/brick-by-brick--neighborhood-residents-often-oppose-housing-plans/ …",2014-08-27 18:43:28,6,13,504700744000606209
How many members of the police sergeants' union actually live in the City they have chosen to defame?http://nyti.ms/1nCApGO ,2014-08-27 13:18:35,1,3,504618983631634434
Under @BilldeBlasio #BigApple remains safest big city in America. Any suggestion to contrary is irresponsible fear-mongering,2014-08-26 21:33:59,0,2,504381266045972480
"After laying #MichaelBrown to rest, let's transform this moment of anguish to a movement that changes police-community relations #Justice",2014-08-25 19:32:23,1,4,503988278228688897
"We are here to demand an end to police brutality throughout America, & make sure justice is achieved for #EricGarnerpic.twitter.com/y3lRcdxT0C",2014-08-23 19:47:13,6,15,503267235671310336
Spent the morning with Society of Old Brooklynites commemorating #PrisonShipMartyrs who died so we could be freepic.twitter.com/z7zZJ5X0ve,2014-08-23 16:30:57,3,1,503217840229744641
Joining @TheRevAl at the @NationalAction march to demand justice for #EricGarner #wewillnotgoback #marchforjusticepic.twitter.com/XcJnMoxHix,2014-08-22 22:40:35,5,24,502948475416629248
"Pray for the family of James Foley, may he forever rest in peace",2014-08-20 17:55:14,3,5,502151887555403776
"A step toward justice in the #EricGarner matter, but long march aheadhttp://1.usa.gov/1AvtHKv ",2014-08-19 17:27:53,0,5,501782616920825856
Autopsy reveals unarmed teen #MichaelBrown shot multiple times. What else is the #FergusonPoliceChief not telling us?,2014-08-18 22:12:56,1,2,501491964093956096
"House is back in session next month, but don't expect the people's business to be done http://bit.ly/1pFPATO ",2014-08-18 21:10:25,0,0,501476231595180032
Six Members of Congress to Eric Holder: DOJ should investigate NYC chokehold death and broken windows policinghttp://bit.ly/1ldv5ON ,2014-08-18 17:06:15,4,12,501414784865415169
Discussed public housing and police reform with @DavidUshery4NYhttp://www.youtube.com/watch?v=PCY4Z7YfuKw&sns=tw …,2014-08-17 18:52:10,1,3,501079052078563328
"Just concluded service at East New York SDA church, welcoming a new Pastor. Happy Sabbath to my Adventist constituents!",2014-08-16 17:42:21,0,1,500699095183659010
Spent the morning with @TheRevAl and the family of #EricGarner at @NationalAction's rallypic.twitter.com/9r9FEsy2XS,2014-08-16 16:13:10,1,2,500676652855476224
Did #EricGarner deserve to die?  The videotape speaks for itselfhttp://nypost.com/2014/08/14/lawmakers-demand-federal-probe-into-death-of-eric-garner/ …,2014-08-15 22:53:19,0,3,500414962649812992
It's time to lift the veil on the damage done by broken windows policing #MichaelBrown #EricGarnerhttp://www.usnews.com/news/articles/2014/08/14/michael-brown-eric-garner-deaths-add-scrutiny-to-broken-windows-policing …,2014-08-15 01:29:55,6,8,500091987195076608
@TheJusticeDept should investigate the chokehold death of #EricGarner http://nyti.ms/1oMbgIO  #policebrutalitypic.twitter.com/Lz4Qw9S5lj,2014-08-14 20:45:29,1,2,500020405936328707
"We cannot bring P.J. back to life, but we can make sure he did not die in vain #FundPublicHousing",2014-08-13 19:58:50,2,2,499646280118075392
Who knew #baseball would be the antidote to the stresses of a dysfunctional #Congress?http://huff.to/1yrDzSI ,2014-08-12 15:52:19,6,7,499221852720738304
Thanks to the residents of Coney Island who came out in force to this weekend's Congress on Your Cornerpic.twitter.com/998RduX0sj,2014-08-10 23:40:46,1,2,498614965989691394
"Spent afternoon at a senior celebration in East New York, where support for @BarackObama remains highpic.twitter.com/QkFiiEytpu",2014-08-09 02:43:42,5,3,497936228428169216
@NAACP CEO makes the case that residents must be concerned about both the cops and the robbershttp://nydn.us/1A0Cxjd ,2014-08-08 19:18:16,0,0,497824131841527809
We should all care about #incomeinequality if we care about our nation's well-beinghttp://nyti.ms/1lDAEjK ,2014-08-05 18:45:44,2,2,496728779625357312
Looking forward to spending some time with the @makerbot team this morning #Brooklyn #3DPrinting #Tech,2014-08-05 13:47:10,6,2,496653642217578496
House Republican march toward #impeachment exposed during #FoxNewsSunday debate https://www.youtube.com/watch?v=9XauI2dZiM0 …,2014-08-03 19:45:35,3,3,496019063865626624
"Will debate House GOP #lawsuit and march toward #impeachment on #FoxNewsSunday at 10:30 am, tune in for morning fireworks",2014-08-03 13:59:24,2,12,495931945210355712
Spent morning with Bedford Stuyvesant residents talking quality of life issues at Congress on Your Cornerpic.twitter.com/NF3YoK0YJb,2014-08-02 22:05:08,0,4,495691798590025728
Why is Lady Liberty crying right now? http://bit.ly/1kr3KrT pic.twitter.com/CL4YdWJ6Y1,2014-08-01 23:21:31,2,3,495348632724709376
"Voted NO on House Repub. #MartialLaw rule, designed to jam an egregious border bill down the throats of the peoplepic.twitter.com/arjoUjNPts",2014-08-01 17:48:29,1,0,495264818937745408
Can anybody tell me what's wrong with this screenshot of @SpeakerBoehner's website? #hypocrisy #lawsuitpic.twitter.com/qkyI2kavK5,2014-08-01 13:19:23,8,17,495197100532330496
"America deserves action. But as the nation waits, House GOP procrastinates #DoNothingCongress",2014-07-31 20:20:03,4,5,494940574546264066
Just voted no on authorizing dangerous House GOP lawsuit against the Presidentpic.twitter.com/bTHp3HCU8v,2014-07-30 22:52:57,8,9,494616664990687232
Debunking the myth of a @WhiteHouse #IRS targeting scandal: http://bit.ly/1uI05dm ,2014-07-30 20:31:28,0,0,494581060433231872
"Reckless Republican lawsuit against @BarackObama is a down payment on #impeachment, paid for by the American taxpayerhttp://bit.ly/1obRypy ",2014-07-30 18:22:20,0,2,494548564421660672
"About to confront Republicans on the House floor, re: Lawsuit & the GOP march toward impeachment against @BarackObama http://cs.pn/1eJo5om ",2014-07-30 16:25:02,1,2,494519045954502656
Making the case for a #minimumwage increase  http://on.msnbc.com/1nFrnMO  #MiddleClassFirst,2014-07-30 13:09:04,0,3,494469725767094272
It's time for the @NatlParkService to fix the Canarsie Pier. Further delay is unacceptablehttp://nydn.us/1laczRR ,2014-07-29 16:35:27,2,3,494159278081843200
We should not allow @SpeakerBoehner & the #BlameBarackObamaCaucus to get away with suing the Presidentpic.twitter.com/khegpiiEnC,2014-07-29 00:56:24,3,5,493922959635910656
Went to bat for @BarackObama on the House floor tonight,2014-07-29 00:55:07,4,4,493922633755291649
"Traveling down to DC, after speaking @JCRC and @UJAfedNY #StandWithIsrael rallypic.twitter.com/UtYtedJ1cC",2014-07-28 22:14:30,7,5,493882214556651520
Spent time yesterday w/ Brighton Beach residents at #CongressOnYourCorner discussing #Israel #SandyRecovery #Housingpic.twitter.com/Uj5HqiWulz,2014-07-28 13:49:00,3,0,493755003136659456
House GOP lawsuit against #BarackObama nothing more than a frivolous impeachment trial balloon,2014-07-27 01:07:30,4,2,493200974517764099
"In the aftermath of tragedy, need to re-examine policing strategy becomes more urgenthttp://nyti.ms/1nYXQsB ",2014-07-25 18:15:02,1,3,492734785249619971
"GOP ""anti-poverty"" effort may actually expand inequality in America #RyanPlanhttp://youtu.be/BBXbMs_MgT4 ",2014-07-25 15:04:07,0,2,492686740315176960
For some New Yorkers @NYPDnews excessive force is an all too common occurrencehttp://nydn.us/1mGE3Oo ,2014-07-24 15:07:31,1,4,492325210054737920
Iron Dome saves lives.  Congress should act swiftly on the supplemental funding request supported by @DeptofDefense,2014-07-23 21:27:06,7,5,492058347261399041
The case for humane treatment of unaccompanied minors:http://youtu.be/UF_PIzmPlz0 ,2014-07-23 17:20:51,1,4,491996374855348224
"Will address unaccompanied minor crisis and criticism leveled @barackobama on the House floor at 10 am, tune in http://www.c-span.org/live/ ",2014-07-23 13:30:28,0,0,491938399981674496
Perhaps it's time the civilian complaint review board be given authority to discipline wayward police officers http://tinyurl.com/l22tf5x ,2014-07-22 19:26:40,1,2,491665650814058497
Is this depraved indifference to human life? You decide:http://tinyurl.com/qewqwv9 ,2014-07-20 23:15:56,4,3,490998570518990848
"The more things change at the #NYPD,  the more they remain the same. #Justice4EricGarner",2014-07-19 22:10:01,5,10,490619596572229632
Debunking the myth of executive lawlessnesshttps://www.youtube.com/watch?v=4qJnp8ccWNo …,2014-07-17 19:12:36,1,2,489850171904499712
Traditionally conservative federal appeals court upholds racial diversity as an important factor in college admission http://www.nytimes.com/2014/07/16/us/appeals-panel-upholds-race-in-admissions-for-university.html?_r=0 …,2014-07-16 16:07:47,0,1,489441271535386624
Nashville #songwriters take their creative brilliance to the Hill. Thanks for your advocacy. #SongwriterEquitypic.twitter.com/EBxRFuWIB2,2014-07-15 18:27:06,2,0,489113946365124608
Expediting removal proceedings for unaccompanied minors in the absence of counsel would be a grave error. #DueProcessMatters,2014-07-15 16:10:05,1,4,489079462349520896
Stop and Frisk apologists try to revive a flawed program. We can't let it happen:http://www.nydailynews.com/opinion/bratton-stop-frisk-study-mistake-article-1.1863847 …,2014-07-14 16:19:25,2,3,488719424837668865
Spent the morning at Congress on Your Corner in Bed-Stuy. Thanks to @TishJames & @KarimCamara for stopping bypic.twitter.com/IiGCxtk1zj,2014-07-12 23:58:46,3,2,488110248633171968
The only entity that should be sued are House Republicans for legislative malpractice. #RenewUI,2014-07-11 18:41:24,11,27,487667994298826753
House GOP takes its obsession with the #AffordableCareAct to another level with its frivolous lawsuit against @BarackObama,2014-07-10 22:42:58,1,3,487366396733849600
Shameful assault on rent-stabilized #NYC residents continues by any and all means  http://www.nytimes.com/2014/07/10/nyregion/as-new-york-landlords-push-for-buyouts-tenants-stand-their-ground.html?module=Search&mabReward=relbias%3Aw%2C%7B%221%22%3A%22RI%3A5%22%7D …,2014-07-10 13:34:53,2,3,487228468481236992
It is time to make work pay in America #RaisetheMimimumWagehttps://www.youtube.com/watch?v=G5z9UyrUnnQ&feature=youtu.be …,2014-07-09 16:27:11,1,1,486909438150721538
Pressing the case for the Vulnerable Immigrant Voice Act. #UnaccompaniedMinors #VIVAhttps://www.youtube.com/watch?v=J00WL-6uzFM …,2014-07-08 16:48:17,1,3,486552361717211137
"The 1964 Civil Rights Act turned 50 last week, but the road to equality is still under construction.",2014-07-07 13:46:11,6,2,486144148009791488
"Gentrification continues to ravage central BK,threatening to eradicate working families in its way #KeepNYCaffordablehttp://mobile.nytimes.com/2014/07/06/realestate/crown-heights-brooklyn-gets-its-turn.html?_r=0&referrer= …",2014-07-05 17:15:06,7,4,485471946696429569
Happy Birthday #America!,2014-07-04 13:09:35,4,7,485047771448107008
Economy continues its upward trajectory as job growth in June exceeds expectations #AmericaRising,2014-07-03 21:18:40,0,1,484808465810878465
"Justice for Bed-Stuy slay victim Channel Petro-Nixon has not been swift, but her memory lives on in the community http://blogs.wsj.com/metropolis/2014/07/01/after-eight-years-family-still-hopes-for-justicein-teens-murder/ …",2014-07-02 18:54:02,2,0,484409680790188032
"Why has the repair of crumbling bridges, roads and tunnels become such a partisan issue?http://mobile.nytimes.com/2014/07/02/us/obama-urges-funding-for-infrastructure-projects.html?referrer= …",2014-07-02 13:40:03,4,4,484330665086058496
May prayers of comfort grace the families of the West Bank kidnap victims who were tragically slain in cold blood.,2014-07-01 19:01:50,2,3,484049255720812544
"Supreme Court appears to decide that closely-held corporations are people, extending rights heretofore unrecognizedhttp://wapo.st/1qrbjAt ",2014-07-01 02:39:45,1,2,483802106886119424
"Governor Cuomo steps up effort to address #HIV infection in NY, a welcome initiative in central #Brooklynhttp://mobile.nytimes.com/2014/06/29/nyregion/cuomo-plan-seeks-to-end-new-yorks-aids-epidemic.html?_r=0&referrer= …",2014-06-30 02:05:39,7,8,483431138867019776
"Spike Lee back in #Bedford-Stuyvesant to commemorate 25th anniversary of urban classic ""Do the Right Thing""http://www.brooklynpaper.com/stories/37/26/dtg-spike-lee-block-party-2014-06-27-bk_37_26.html …",2014-06-28 22:49:23,2,4,483019356335771648
Will affordable housing at Atlantic Yards finally become a reality?http://www.nytimes.com/2014/06/27/nyregion/plan-expedited-for-affordable-units-at-atlantic-yards-near-downtown-brooklyn.html?partner=socialflow&smid=tw-nytmetro&_r=0 …,2014-06-27 21:33:56,0,1,482637981505699840
It's time to move forward with comprehensive immigration reform. #CIR @cspanwj http://www.c-span.org/video/?320103-5/washington-journal-vulnerable-immigrant-voice-act …,2014-06-27 14:49:58,0,2,482536320968179713
Supreme Court steps forward to protect cell phone privacy. A victory for civil liberties.http://www.nytimes.com/2014/06/26/us/supreme-court-cellphones-search-privacy.html?hp&action=click&pgtype=Homepage&version=LedeSum&module=first-column-region&region=top-news&WT.nav=top-news&_r=0 …,2014-06-25 22:28:49,0,7,481927018104516609
All artists who share their sound recordings with the world should be fairly compensated #RespectAllMusichttps://www.youtube.com/watch?v=C3zXhRWPpVE …,2014-06-25 17:53:50,3,2,481857815171305473
#Unaccompanied minors fleeing extreme violence deserve legal counsel even in a foreign land #VIVAhttps://www.youtube.com/watch?v=hMY6RIcuw58 …,2014-06-25 02:16:48,4,7,481622005469675520
Tenants remain under intense pressure as Rent Guidelines Board once again approves rent hike http://www.ny1.com/content/211030/rgb-approved-rent-hike-leaves-both-renters---property-owners-dissatisfied/ …,2014-06-24 15:17:50,2,2,481456171279458304
Introduced legislation to provide unaccompanied minors w/access to legal counsel during immigration proceedings #VIVAhttp://lat.ms/1uZc7Kv ,2014-06-24 01:53:46,7,11,481253820853682176
House back in session today: will obstruction of the #unemployment insurance extension continue? #RenewUI,2014-06-23 20:47:57,9,19,481176857615028224
Children fleeing the Central American Northern Triangle need their home countries to step up:https://www.youtube.com/watch?v=qfjbj1qlCkA&feature=youtu.be …,2014-06-22 20:54:21,1,5,480816080035012608
"Started off the day in #HowardBeach, during the 2nd installment of our #Congress on Your Corner series this monthpic.twitter.com/jyy9iz0GuE",2014-06-22 00:05:03,0,3,480501682493587456
Fair and balanced at its best. #BushCheneyWar http://bcove.me/pxsvxyto ,2014-06-20 17:00:44,2,0,480032515399618560
"Justice for the #CentralParkFive was not swift, but appears to have finally arrived:http://www.nytimes.com/2014/06/20/nyregion/5-exonerated-in-central-park-jogger-case-are-to-settle-suit-for-40-million.html?hp …",2014-06-20 14:52:55,1,4,480000345557725184
Can someone tell Dick #Cheny to pipe down?http://www.washingtonpost.com/opinions/ej-dionne-dick-cheney-reveals-his-chutzpah-in-iraq-op-ed/2014/06/18/756bce06-f713-11e3-a606-946fd632f9f1_story.html?tid=pm_pop …,2014-06-19 22:59:37,6,3,479760440046919680
Is your rent too high? You may be able to keep it from climbing further. http://www.ny1.com/content/news/210759/final-public-hearing-tonight-before-rent-hike-vote/ …,2014-06-19 17:31:42,1,3,479677919284187136
Happy Freedom day this #Juneteenth 2014 http://www.bkreader.com/2014/06/what-is-juneteenth-and-why-do-we-celebrate/ …,2014-06-19 14:59:04,0,2,479639508439539713
"Instead of extending a helping hand, House Republicans continue to slap unemployed Americans in the face. #RenewUIhttps://www.youtube.com/watch?v=YCqNMvcnGnc …",2014-06-18 16:35:10,6,9,479301303777366016
"War hawks lied our way into #Iraq, and now blame others for the mess they created. #Hypocrisy http://thedailyshow.cc.com/videos/a6yqrp/mess-o-potamia---now-that-s-what-i-call-being-completely-f--king-wrong-about-iraq …",2014-06-17 19:34:09,8,5,478983957795848193
"Pray for the safe return of Naftali, Eyal and Gilad from their captors in the West Bankhttp://www.nydailynews.com/news/world/israel-expands-west-bank-hunt-kidnapped-teens-palestinian-killed-article-1.1831366 …",2014-06-17 16:17:07,6,15,478934372469735425
Senior day @NewYorkAquarium in #ConeyIslandpic.twitter.com/0wxIjzm5yY,2014-06-16 18:10:48,3,4,478600597134782466
Humanitarian crisis at the border requires a compassionate response,2014-06-16 14:03:26,2,4,478538342238134272
Happy Father's Day!pic.twitter.com/zxGUiOpswG,2014-06-15 17:19:55,1,2,478225403434123264
#Fatherhood matters.This weekend let's celebrate dads who are doing the right thing&help others who want to do betterpic.twitter.com/qrYt51uoz6,2014-06-13 21:25:26,1,1,477562411919368192
"May God bless the memory of #RubyDee, a legendary actress and pioneer.",2014-06-12 20:53:09,7,3,477191899741032448
America needs to step up and deal with the gun violence problem ripping us apart from the seams. #EnoughIsEnoughhttps://www.youtube.com/watch?v=UPvr9qbZVMk&feature=youtu.be …,2014-06-11 21:31:02,3,7,476839046308974592
"Real men cook #healthy food, just ask @RSherman_25 and @MichelleObama:https://www.youtube.com/watch?v=3PhV9DzkV-s …",2014-06-11 14:32:57,0,3,476733830041468928
Without #songwriters the entire music ecosystem as we presently know it ceases to exist:http://bit.ly/1mDeu15 ,2014-06-10 16:46:11,3,7,476404972251545600
"Heading into House Budget Committee on the #WaronPoverty , 50 years after President Johnson challenged us to create a great society.",2014-06-10 14:03:20,1,1,476363992462794752
A new Fire Department Commissioner was sworn-in today. Let's hope he works to diversify a department long known for its racial exclusivity.,2014-06-09 22:07:16,2,4,476123389354987520
"House GOP practice the politics of distraction, while leaving unemployed #Americans behind on the great recession's battlefield. #RenewUI",2014-06-09 00:05:43,24,55,475790809967890432
Spent the morning with constituents in #Canarsie at Congress on Your Corner. The recovery continues.pic.twitter.com/Qk63Hveur4,2014-06-08 03:00:17,2,3,475472352265142272
70 yrs ago brave Americans stormed the beaches of Normandy & changed world history for the good. Let's never forget the #GreatestGeneration,2014-06-06 21:55:27,0,4,475033249975398400
The #economy continues to improve for the good of the #American people. Will House GOP obstructionism finally end? http://www.washingtonpost.com/business/economy/economy-adds-217k-jobs-in-may-jobless-rate-holds-steady-at-63-percent/2014/06/06/b0c2ee10-ed7e-11e3-b84b-3393a45b80f1_story.html?hpid=z5 …,2014-06-06 19:46:33,0,3,475000810976198656
May God continue to bless and keep the memory and spirit of P.J. Avitto alive in our community.,2014-06-06 16:49:48,0,2,474956332442062849
Thanks @NYPDnews for your apprehension of the murder suspect. Please continue to pray for Mikayla and the families of those we lost.,2014-06-05 01:24:08,2,7,474360993116852226
We need all hands on deck in the effort to catch the psychopath who is on the loose in #Brooklyn:http://observer.com/2014/06/hakeem-jeffries-calls-murders-in-east-new-york-unspeakable-crimes/ …,2014-06-04 16:09:34,2,13,474221432306929665
The precious #EastNewYork stabbing victims deserve justice that is swift and comprehensive:http://blogs.wsj.com/metropolis/2014/06/03/congressman-calls-on-fbi-to-investigate-brooklyn-fatal-stabbings/?KEYWORDS=hakeem+jeffries …,2014-06-03 18:30:27,2,7,473894496661692417
"Judge Baer was a great man, who lived a great life and left a great legacy. May God continue to bless his family:http://nyti.ms/1gCpJKa ",2014-06-01 17:43:30,0,1,473157907711008770
Shout out to the #innovators and inventors of the Breukelen Girl Scout Troop who learned about #patents this eveningpic.twitter.com/8SxgXcj5EP,2014-05-31 01:37:50,0,2,472552501343158273
Repealing mandatory minimum sentencing for drug abuse offenses will not unleash a crime wave on the American peoplehttp://bit.ly/1gIhw7l ,2014-05-30 15:21:30,2,9,472397396543299584
Discussing #marijuana arrest reform in NYC on HuffPost Live at 1:15pm. Join the conversation: http://live.huffingtonpost.com/ ,2014-05-29 17:10:44,0,4,472062495327539200
Thanks to @DrugPolicyNews and @VOCALNewYork for your strong advocacy on #marijuana arrest reform. A change will come.http://huff.to/1k2s4O7 ,2014-05-29 14:33:36,9,9,472022955267198976
Healthy food is a successful recipe for a hearty #education. We should all support @MichelleObama on nutritional standards for our children.,2014-05-28 20:54:46,2,10,471756490169020416
"#MayaAngelou has departed for heaven, but her eloquence & poetic genius will never be forgotten. May God bless her family & all she touched.",2014-05-28 18:42:01,3,8,471723080947990528
It is time #NewYorkCity stopped being the #marijuana arrest capitol of the country: http://bit.ly/1ntkX50 ,2014-05-28 03:22:11,8,15,471491596257468416
Let us never forget our brave soldiers who died so that America could remain free. #MemorialDay,2014-05-26 17:50:04,4,2,470985230174531585
Prison Industrial Complex rears its ugly head at detention centers throughout the land:http://mobile.nytimes.com/2014/05/25/us/using-jailed-migrants-as-a-pool-of-cheap-labor.html?_r=0&referrer …,2014-05-25 22:22:35,1,5,470691425894797312
The Administration's move toward a more compassionate #immigration system is a welcome step in the right direction:http://m.washingtonpost.com/politics/obama-administration-likely-to-refocus-deportation-policy-police-chiefs-say/2014/05/13/afc298d2-daad-11e3-bda1-9b46b2066796_story.html …,2014-05-25 14:02:05,3,5,470565471817719809
"House #GOP refuses to allow vote on winding down the war in Afghanistan, but continues to politicize #Benghazi #MoreofTheSame",2014-05-22 13:07:24,0,2,469464544503689218
"Why would D. Cheney, who is looking for WMDs in Iraq 11 yrs later, think he has the credibility to question @barackobama on the #RuleofLaw?",2014-05-21 14:14:13,1,0,469118973762891776
Trey Whitfield School in the House (of Representatives)!pic.twitter.com/a5E0KUDwqq,2014-05-20 22:49:00,1,0,468886135528517633
March toward educational equality continues sixty years after historic Brown v. Board of Education decision:http://bit.ly/1oNsYRI ,2014-05-20 14:18:36,0,6,468757686268755968
Good riddance to NH police commissioner who picked up baton from #DonaldSterling for latest display of hateful ignorance in 2014.,2014-05-20 01:42:21,3,4,468567370089631745
Happening now: @OfficialCBC discussing the 60th anniversary of Brown v. Board of Education decision live on C-SPAN: http://www.c-span.org/live/ ,2014-05-19 23:31:00,3,6,468534317883609088
West Africa must crush the rise of extremism in their land. #BringBackOurGirlshttp://www.nytimes.com/2014/05/18/world/africa/west-african-nations-set-aside-their-old-suspicions-to-combat-boko-haram.html?_r=0 …,2014-05-17 23:19:29,0,3,467806641686323200
A conversation with the Fourth Estate: http://www.qchron.com/editions/south/jeffries-meets-the-press-in-brooklyn/article_1b79b0b9-f5df-59da-98b9-e2b5b6815b70.html …,2014-05-16 18:54:23,0,0,467377540194402305
FCC effort to scale back #NetNeutrality could stifle innovation: http://www.washingtonpost.com/blogs/the-switch/wp/2014/05/15/fcc-approves-plan-to-allow-for-paid-priority-on-internet/ …,2014-05-16 15:35:55,1,0,467327593415704576
Prison Ship Martyrs Monument bill continues to gain support: http://brooklyn.news12.com/news/rep-hakeem-jeffries-pushes-to-make-prison-ship-martyr-s-monument-national-monument-1.7999765 …,2014-05-14 02:16:24,2,3,466401611724898304
Thanks to all of the Bedford Stuyvesant residents who stopped by Congress on Your Corner this evening in Fulton Parkpic.twitter.com/NSNa47S407,2014-05-13 01:12:38,1,4,466023179148742656
Happy #MothersDay to all of the amazing and hard-working moms who make our community great.,2014-05-11 17:23:26,5,2,465542712213909505
Spent the evening with the mothers of #ConeyIsland  who have done so much for so many over the years.pic.twitter.com/wpRIR0kOba,2014-05-11 02:29:40,4,2,465317788500774914
