Text,Date,Favorites,Retweets,Tweet ID
Granger Statement on Working Group to Address Crisis at Southern Border http://tinyurl.com/ouvvlnz ,2014-06-24 21:26:36,1,1,481548971207561216
My latest e-newsletter on supporting the North Texas defense industry http://tinyurl.com/pdxm7sj ,2014-06-12 18:38:41,0,1,477158062680457216
Granger’s Monuments Men Bill Officially Becomes Law http://tinyurl.com/kxukb5s  #MonumentsMen #GoldMedal,2014-06-10 14:47:37,6,5,476375137210859521
"Photo of Fort Worth's newest statue honoring our city's founder, Ripley Arnold #FortWorthpic.twitter.com/7k6Uk2Ffgl",2014-06-06 17:38:52,0,2,474968678619160576
It was great to be on hand during the Ripley Arnold statue unveiling & McMillian Plaza dedication this AM! #FortWorthpic.twitter.com/fUhpn8UQya,2014-06-06 17:38:04,0,1,474968477540057088
Today we pause to honor & pay tribute to the greatest generation and all they did 70 years ago #DDay70pic.twitter.com/BmR9oBY3F5,2014-06-06 17:31:26,1,0,474966807431086080
It was great to be in Weatherford this afternoon to speak to the Weatherford Rotary Club. #TX12pic.twitter.com/4EWSQI7Gef,2014-06-03 20:30:38,3,0,473924741258960896
Honored to receive the Morton Herman Service to Veterans award from the Jewish War Veterans Post 755 in FW on Sundaypic.twitter.com/SlArEtDPEf,2014-06-03 18:50:35,0,2,473899565310291968
Congrats to Ansun Sujoe of Bethesda Christian School in FW on being named co-champion of the National Spelling Bee!http://tinyurl.com/q9jp8l6 ,2014-05-30 19:04:20,1,0,472453473083359233
My statement on Interim Inspector General Report regarding Phoenix VA  http://tinyurl.com/l5tkt46 ,2014-05-29 22:24:10,0,2,472141373798621185
My latest E-newsetter: VA Accountability Needed http://tinyurl.com/mjbhhjp ,2014-05-21 22:28:30,1,1,469243361246081024
"House moves to honor Monuments Men, Jack Nickalus, Shimon Peres via @latimes http://tinyurl.com/ntzpo92  #MonumentsMen",2014-05-20 21:28:58,1,1,468865992786186240
Granger’s Monuments Men bill passes House vote via @startelegram http://tinyurl.com/obngrtw  #MonumentsMen,2014-05-20 12:52:52,2,2,468736112970977280
Granger Applauds Passage of Monuments Men Gold Medal Bill http://tinyurl.com/lhuc4om  #MonumentsMen #WWII #Veterans,2014-05-19 22:27:28,1,1,468518328269828096
My floor remarks in support of the Monuments Men Recognition Act which passed the House this afternoon!http://youtu.be/9c7zEdrpP_g ,2014-05-19 22:10:33,5,4,468514068153008128
Speaking on House floor soon in support of my Monuments Men Recognition Act honoring the #MonumentsMen with the Cong. Gold Medal #Veterans,2014-05-19 20:33:49,2,0,468489726073528320
It was great to be back aboard the USS Fort Worth. I'm proud of the entire crew & all they do to protect our country.pic.twitter.com/BVQRnsdmqP,2014-05-14 20:55:29,0,2,466683237864337408
Great article on #MonumentsMen in @latimes - One more album of Nazi-looted art is handed over to National Archiveshttp://tinyurl.com/o78wkzl ,2014-05-09 15:49:11,3,1,464794218104639488
My latest e-newsletter: Leading Globally http://tinyurl.com/nxkst5p ,2014-05-09 15:06:04,0,0,464783366173491200
Happy 30th birthday to @Dell a great Texas company! Keep up your innovative spirit #Dell30more,2014-05-07 22:19:37,2,2,464167695135825921
Congrats to Kimmie Etheredge on being named Texas 2014 Distinguished Principal of the Year. Very proud of you!http://tinyurl.com/optlfrl ,2014-05-06 14:11:14,0,0,463682404910374912
My e-newsletter this week on the DATA Act http://tinyurl.com/mpyrnze ,2014-05-01 16:12:10,0,1,461900896134504448
Learn more about measles and the importance of vaccinations here:http://www.cdc.gov/features/measles/ …,2014-04-28 19:34:18,0,1,460864602713391104
This year the US has seen the most measles outbreaks since 1996. Learn how you can get vaccinated in Tarrant County http://tinyurl.com/7bqf5k6 ,2014-04-28 19:33:45,0,1,460864466297823232
Granger Statement on Reported Palestinian Unity Government Agreement http://tinyurl.com/lpudma9 ,2014-04-24 00:38:39,1,2,459129257659486208
Legislation gains majority support of the House in only four months http://tinyurl.com/pv54kfo  #monumentsmen #WWIII #Veterans,2014-04-10 14:03:54,4,5,454258474156060672
Granger Announces Monuments Men Gold Medal Bill Surpasses 290 Co-Sponsors http://tinyurl.com/pv54kfo  #monumentsmen #WWIII #Veterans,2014-04-10 14:03:27,4,3,454258358561013760
My op-ed in @rollcall this morning on how strategic planning is paying off and strengthening North Texashttp://tinyurl.com/krpbfec ,2014-04-08 14:49:25,0,1,453545151320064000
I enjoyed participating in the Fort Worth Rotary Club's dedication ceremony for the new Rotary Plaza on Saturday.pic.twitter.com/pXL8xSRDQS,2014-04-07 20:51:16,3,6,453273826042736640
"Today, I had the honor to meet up with a DFW Honor Flight group of WWII veterans at their memorial in Washington.pic.twitter.com/j2Fys1IOQr",2014-04-04 21:18:02,2,5,452193397210509312
My thoughts and prayers go out to all those impacted by the tragedy at Fort Hoodpic.twitter.com/WbrQ5TJ01d,2014-04-03 14:37:58,4,3,451730329611411456
Enewsletter about arrival ceremony of the KC-130J place last week at Naval Air Station Fort Worth Joint Reserve Base. http://tinyurl.com/k9l3fuq ,2014-03-25 18:44:23,2,2,448530854810517504
"The defense industry is facing unprecedented challenges, but with the help of a new group of women leaders... http://tinyurl.com/qa6umr3 ",2014-03-18 22:34:13,0,2,446051977584459778
How Women Are Reshaping the Defense Industry http://tinyurl.com/qa6umr3  #WomensHistoryMonth,2014-03-18 22:30:25,0,0,446051020830150657
My op-ed today on how women are reshaping the defense industry posted on the @TIME website http://tinyurl.com/qa6umr3  #WomensHistoryMonth,2014-03-17 15:20:15,3,8,445580378066415616
Granger Statement on Ukrainian Aid Legislation http://tinyurl.com/ojzppwd ,2014-03-06 13:42:15,1,3,441569451608010752
Today I met w/ students participating in the public health masters & doctoral programs at UNT's Health Science Centerpic.twitter.com/hGbTJKge22,2014-03-05 21:23:54,1,3,441323238363103232
"This afternoon, I met with student government leaders from TCU. I always enjoy meeting our future leaders!pic.twitter.com/98AYs1EfNX",2014-03-04 23:04:30,7,4,440986168327274496
Congresswoman Wants Clooney’s Support for Real @MonumentsMen via @wallstCS http://tinyurl.com/mxjs3aq  #WWII #GoldMedal,2014-02-25 21:47:38,0,2,438430107917897728
Information on my bill to honor the @MonumentsMen with the Congressional Gold Medal http://tinyurl.com/kaoqf3z  #WWII #GoldMedal,2014-02-25 15:10:40,3,3,438330211755909120
USA Today: Lawmaker seeks George Clooney’s help with Monuments Men bill http://tinyurl.com/mt9pu3m  #WWII #MonumentsMen #GoldMedal,2014-02-25 15:05:48,0,0,438328983164579840
The Hill: GOP lawmaker works with Bill Murray on Monuments Men bill http://tinyurl.com/o6adufa  #WWII #MonumentsMen #GoldMedal,2014-02-25 15:04:30,0,0,438328656990306305
@USATODAY Lawmaker seeks George Clooney's help with Monuments Men bill http://tinyurl.com/mt9pu3m  #MonumentsMen #WWII,2014-02-24 23:06:12,0,0,438087494488571904
"The Hill: Granger pushes bill to honor Monuments Men   
http://tinyurl.com/o6adufa  #MonumentsMen #GoldMedal #WWII #veterans",2014-02-24 15:33:38,0,2,437973601413640192
My latest e-newsletter: ID Theft Tax Refund Crimes on the Rise http://tinyurl.com/onfsp2n ,2014-02-21 16:55:23,0,0,436907011335528448
Met with members of the Greater Fort Worth Arlington Chapter of the Juvenile Diabetes Research Foundation today.pic.twitter.com/VvXh6yXa06,2014-02-18 21:11:09,2,2,435884211711401984
My latest e-newsletter on the Fort Worth connection to the #MonumentsMen http://tinyurl.com/ojwno5d  #GoldMedal,2014-02-14 16:50:14,0,2,434368998302420992
@CBSThisMorning segment on #MonumentsMen last year when I intro my bill to award them the Congressional #GoldMedalhttp://tinyurl.com/mo639wk ,2014-02-14 15:23:41,0,0,434347218636517376
Great feature by @FWTXmag on the #MonumentsMen including my effort to award them with the Congressional #GoldMedalhttp://tinyurl.com/l9ay3wx ,2014-02-14 15:20:06,0,2,434346317641310208
ICYMI: @ABC interview on the #MonumentsMen and my effort to award them the Congressional #GoldMedal http://tinyurl.com/omecsrd ,2014-02-14 15:17:31,1,1,434345665775144960
ICYMI: @meetthepress PRESS Pass Interview about the #MonumentsMen & awarding them the Congressional #GoldMedalhttp://tinyurl.com/no7cvay ,2014-02-14 15:15:59,2,7,434345282176704512
"Fashion Times: The Real Monuments Men, Congresswoman Kay Granger Aims to Promote Their Work http://tinyurl.com/nvb4osj  #MonumentsMen #GoldMedal",2014-02-14 15:13:11,0,0,434344577978220545
"I was on @meetthepress PRESS PASS program this morning with @RobertEdsel to discuss the #MonumentsMen
http://tinyurl.com/p33qb26  #GoldMedal",2014-02-09 18:23:04,6,9,432580421943963651
Politico: Granger's 'Monuments Men' bill http://tinyurl.com/p63jwsr  #GoldMedal #WWII (cc: @MonumentsMen @RobertEdsel ),2014-02-09 18:16:36,2,4,432578795522891777
My latest e-newsletter: Washington's Red Tape Problem http://tinyurl.com/q2bqotm  #RedTape #tcot,2014-02-07 17:31:47,0,3,431842742583304192
ICYMI: The real story behind 'The @MonumentsMen' movie  http://tinyurl.com/omecsrd  (VIDEO) #GoldMedal #WWII #veterans,2014-02-07 16:38:03,1,1,431829218188476417
"ICYMI: Behind Hollywood glitz, ‘@MonumentsMen' is the work of a Texas oilman turned art lover http://tinyurl.com/kvp7cpk  #GoldMedal",2014-02-06 15:58:30,0,2,431456877461770241
Great piece by @RobertEdsel in the @dallasnews about the @MonumentsMen Read it here: http://tinyurl.com/ksbmfdv  #GoldMedal,2014-02-05 15:51:13,1,0,431092656936988673
This morning I spoke at the annual Texas Water Day on the Hill.pic.twitter.com/txn0K5CphZ,2014-02-05 15:28:07,1,0,431086843057037312
Earlier today I met with members of the Texas Association of School Boards to discuss the education systempic.twitter.com/pUTdCQyevl,2014-02-04 22:16:38,3,2,430827260413620224
Great feature in @FWTXmag about the @MonumentsMen in the Feb. issue. Read it here: http://tinyurl.com/l9ay3wx  #GoldMedal #veterans #WWII,2014-02-04 17:14:11,0,0,430751149717602304
"Yesterday, I met with students and teachers from R.L. Paschal High School at the U.S. Capitol.pic.twitter.com/tDoI9QJ6Fk",2014-01-30 22:08:19,2,7,429013228442509312
Granger Statement on President Obama’s State of the Union Address http://tinyurl.com/nhn6q67  #SOTU,2014-01-29 03:43:51,0,2,428372896134602753
My latest e-newsletter on the announcement over the weekend of the first step agreement that was reached with Iran http://tinyurl.com/lwy6vb6 ,2014-01-15 19:25:47,0,1,423536508671242240
On Sat. I hosted my Service Academy Nomination Interview Day for the students applying to the US military academies.pic.twitter.com/CVcl20XJkQ,2014-01-13 18:45:40,3,3,422801638806417409
Granger Statement on First Step Agreement with Iran http://tinyurl.com/lb6yq9a ,2014-01-13 00:20:07,0,2,422523418584428544
My latest e-newsletter on the Health Exchange Security & Transparency Act that the House will vote on tomorrow http://tinyurl.com/nmlaotj ,2014-01-09 17:15:04,0,3,421329285052248065
"Obituary: Bob Bolen, former Fort Worth mayor http://tinyurl.com/lmf7766  via @startelegram",2014-01-07 14:24:19,1,3,420561540622712833
I participated in the YMCA Youth & Govt Conference's Opening Ceremony on Sat. It was an honor to help open the event.pic.twitter.com/m8BoXcWQlo,2013-12-16 16:38:11,3,2,412622693750411264
Congrats to @AmbassadorGreen on being named the new president of @IRIglobal today. I look forward to working together in the year ahead.,2013-12-13 17:24:57,0,2,411547301300027392
"Last week, I visited Lockheed Martin to receive an update on the F-35 and take a tour of the production line.pic.twitter.com/7VlJrvvG8n",2013-12-11 17:36:26,0,2,410825417205886976
My remarks on the floor the day I introduced my bill honoring the @MonumentsMen with the Congressional Gold Medalhttp://tinyurl.com/lyfst2k ,2013-12-09 22:32:56,1,4,410175257849262080
ICYMI: Granger Gold Medal Legislation Honoring @MonumentsMen Featured on @CBSThisMorninghttp://tinyurl.com/mo639wk ,2013-12-09 22:31:33,0,3,410174907465474048
DMN: Granger wants top honor for WWII art saviors http://tinyurl.com/lfpjed9  (@MonumentsMen),2013-12-09 22:29:58,0,1,410174509233086464
Editorial: Special WWII art detectives unit deserves nation’s highest civilian honor http://tinyurl.com/lftmcnq  (cc: @MonumentsMen),2013-12-09 22:28:24,0,2,410174116512006144
In Case You Missed It -- FWST:   Congressional effort underway to honor @MonumentsMen http://tinyurl.com/kfn5kp8 ,2013-12-09 22:26:45,0,0,410173700478992384
LA Times: Legislation proposes @MonumentsMen be given congressional gold medalhttp://tinyurl.com/kjp44yb ,2013-12-09 22:25:17,0,0,410173331569008640
@CBSThisMorning aired a piece on the #MonumentsMen & highlighted my bill to honor them w/ the Cong. Gold Medalhttp://youtu.be/2xl7I4BVagY ,2013-12-06 16:46:26,2,1,409000894479351808
VIDEO: Rep. Kay Granger Discussions Introduction of Monuments Men Gold Medal Legislation on House Floorhttp://youtu.be/WSxAn8OiYnQ ,2013-12-05 19:41:46,5,5,408682631086100480
Granger Introduces Congressional Gold Medal Legislation to Honor the Monuments Men http://tinyurl.com/kaoqf3z ,2013-12-05 19:39:56,1,1,408682169872052224
Today is Small Business Saturday #ShopSmallpic.twitter.com/2ScCjiKvB9,2013-11-30 16:32:09,0,3,406822970699444225
"On Friday evening, I participated in the 50th anniversary celebration of President Kennedy's visit to Fort Worth.pic.twitter.com/Fhcp2cRqwr",2013-11-18 20:35:19,1,2,402535511534735360
Granger Statement on ObamaCare Enrollment Numbers http://tinyurl.com/kufa58c ,2013-11-13 22:03:33,0,3,400745779351920641
On Friday I attended the Northwest Pipe company ribbon cutting ceremony to applaud their rapid growth in N. Texaspic.twitter.com/WWNJLbXMg7,2013-11-06 18:59:43,0,3,398162798410096640
I introduced legislation yesterday to help families that are trying to adopt internationally. Learn more: http://kaygranger.house.gov/press-release/granger-bass-introduce-international-adoption-bill …,2013-10-24 18:50:42,1,3,393449488687185920
The House will vote on WRRDA today. This bill is important to cities like Fort Worth. Learn more: http://kaygranger.house.gov/progress-washington …,2013-10-23 14:36:48,0,2,393023204169506817
My office is accepting internship applications for the Spring semester in D.C. and Fort Worth. Click here to apply: http://kaygranger.house.gov/constituent-services/internships …,2013-10-22 20:17:41,1,5,392746600801370112
I’m about to go on with Jon-David Wells to talk about the government shutdown. Tune in to 660AM or listen live: http://saleminteractivemedia.com/ListenLive/Player/KSKYAM …,2013-10-15 19:30:59,1,2,390198136737521664
The USS Fort Worth crew celebrated the Navy’s 238th birthday. Thanks to all Navy service members for your service.pic.twitter.com/Vb15z780Aj,2013-10-15 16:38:35,3,5,390154749808357376
I have received a handful of questions about what the #debtceiling is and what moving it would mean. Don't miss: http://kaygranger.house.gov/whats-being-done-avoid-fiscal-crisis …,2013-10-11 18:49:04,0,2,388738036420198400
Here’s a clip of me talking with Greta Van Susteren about the administration closing the World War II Memorial. https://www.facebook.com/photo.php?v=776921182307&set=vb.49640749719&type=3&theater …,2013-10-07 14:50:20,1,6,387228402148601856
I just posted another update for you on the government shutdown.  I hope you have a chance to take a look. http://kaygranger.house.gov/its-about-spending …,2013-10-04 22:08:00,1,8,386251383101337603
Sent the Chief Administrative Officer a letter asking that my pay be withheld as long as the gov't remains shutdown.pic.twitter.com/ueGfBDGHog,2013-10-04 17:18:09,4,6,386178439482335232
Many constituents are concerned about the gov't shutdown. Read this enewsleter for more on what I've been working on: http://kaygranger.house.gov/finding-solutions-amid-government-shutdown …,2013-10-01 22:45:29,0,7,385173652095762432
I am so pleased to welcome the newest NorthWood Church congregation to downtown Fort Worth! http://www.star-telegram.com/2013/09/27/5199379/keller-church-opens-downtown-fort.html …,2013-09-30 13:45:52,2,1,384675465060810752
"With Grit & Tenacity, we must continually demonstrate our commitment to the USS Fort Worth, her crew & their families.http://kaygranger.house.gov/crew-says-uss-fort-worth-%E2%80%98-best-ship-water%E2%80%99 …",2013-09-26 17:10:33,4,3,383277423371902978
I look forward to working with @susanmccue in her role with the Millennium Challenge Corporation.  Congratulations on the nomination!,2013-09-24 20:54:27,1,0,382608993576685568
Thank you for inviting me to speak at today’s Rotary Club of Western Fort Worth meeting.pic.twitter.com/GqhyvCsHED,2013-09-24 19:35:34,1,1,382589141529030656
Thank you to the United Methodist Church for all the work you do to rid our world of malaria.  Read more: http://umc-gbcs.org/faith-in-action/granger-praised-for-global-health-support … @NoMaleria,2013-09-21 15:00:36,0,2,381432779671486464
The Texas Republican delegation sent a letter to the Senate in support of defunding #Obamacare. #SenateMustAct http://kaygranger.house.gov/press-release/texas-delegation-sends-letter-us-senate-obamacare …,2013-09-20 16:04:10,3,8,381086392513597440
Don't miss my latest e-newsletter offering updates on the situation in Egypt and Syria. http://kaygranger.house.gov/egypt-and-syria ,2013-09-19 20:55:22,0,2,380797286361464832
Read my latest piece on America's future air superiority in today's @WashTimes. http://kaygranger.house.gov/americas-future-air-superiority …,2013-09-18 18:29:03,0,3,380398076315189248
Authorities ask that anyone with information on Aaron Alexis contact the FBI at (202) 278-2000 or 1-800-CALL-FBI. #NavyYardShooting,2013-09-17 16:01:32,0,2,379998564618743808
"The US Constitution not only established a government by the people, but also protects freedoms for the people still today. #ConstitutionDay",2013-09-17 14:02:04,3,2,379968498945908737
I'm horrified by the #NavyYardShooting. I pray for the victims and their families as well as the law enforcement officials who responded.,2013-09-16 21:10:15,4,1,379713865778335744
#ENDALZ Sept is World Alzheimer’s Month. Thanks to all caregivers. Please learn more about Alzheimer’s & its symptoms:http://www.alz.org/northcentraltexas/ …,2013-09-16 14:04:45,0,3,379606787369889792
I'm honored to receive the Charles T. Manatt Democracy Award from @IFES1987. Democracy is the foundation of peace. http://bit.do/ifesaward ,2013-09-12 01:00:17,0,2,377959816737468416
Read how my experiences as a #smallbiz owner influence my approach to legislating today in the Insurance Journal:http://www.insurancejournal.com/news/southcentral/2013/09/10/304559.htm …,2013-09-11 16:42:24,1,2,377834523863441408
Please don't miss my statement on the situation in Syria: http://kaygranger.house.gov/situation-syria ,2013-09-06 21:03:59,4,3,376088413482414080
I toured AVX Aircraft yesterday in Benbrook.  Hope you have a chance to catch the Star-Telegram piece about my visit. http://www.star-telegram.com/2013/09/05/5137749/granger-prepares-fight-to-defend.html …,2013-09-06 14:19:55,1,3,375986726029635584
Thanks to Bishop Mike Lowry for coming into my office yesterday. We discussed global health & malaria eradication.pic.twitter.com/ekcaE3OG1Q,2013-09-04 15:51:42,1,1,375285046191484928
I held a roundtable with Mayors from across the District this week.  Thanks to each of them for all they do to improve our communities.,2013-08-30 18:00:45,3,2,373505585456488448
I had a good meeting at Express Scripts this afternoon to learn more about the company and meet a few of the employees in Fort Worth.,2013-08-29 22:00:43,0,2,373203587054071808
I went on a very interesting tour at the Ambulatory Surgical Center in Fort Worth this morning.pic.twitter.com/URksFhUv9h,2013-08-29 20:26:50,0,2,373179958006276096
Today we honor the 50th anniversary of the March on Washington for Jobs and Freedom. What dreams do you have for our country? #mlkdream50,2013-08-28 18:48:16,0,2,372792769103683585
It was great to speak with so many constituents at the Beth-El Congregation in Fort Worth last night.pic.twitter.com/QQvUfyr670,2013-08-28 16:18:39,2,1,372755114076819456
"The USS Fort Worth is underway for the first time in months after drydocking, maintenance, and upgrades.pic.twitter.com/OsUzEzhgW8",2013-08-27 18:56:56,4,5,372432560627789824
Congratulations to Jason Leap – a Fort Worth resident and U.S. veteran – for being selected to represent the U.S. in the Simpson Cup!,2013-08-27 14:30:38,1,0,372365543270932481
Don't miss my oped in the Weatherford Democrat about human trafficking and the bipartisan legislation I introduced: http://weatherforddemocrat.com/opinion/x125813314/GRANGER-Demanding-justice …,2013-08-08 14:03:10,3,3,365473263800958976
I wish President George W. Bush a speedy recovery from a successful heart surgery today. Both he & his family are in my thoughts & prayers.,2013-08-06 21:29:57,3,8,364860924009521152
Do you subscribe to my e-newsletters?  Sign up here: http://kaygranger.house.gov/contact-kay/newsletter …,2013-08-06 17:25:34,0,0,364799423756247040
I’ve highlighted a few of the #StopGovtAbuse bills I voted on this week in today's enewsletter. Take a look. http://kaygranger.house.gov/stopping-government-abuse …,2013-08-02 19:30:52,1,3,363381402055618560
"Thank you Brooke, Jacquee, Nick, Ben and Madeline for all your great work this summer!pic.twitter.com/mUJ16SwaSr",2013-08-02 16:19:51,1,0,363333332886495232
Yesterday’s DOD/Lockheed agreement is so important to America & our allies.  I'm very proud to represent the workforce behind the F-35.,2013-07-31 14:40:57,1,0,362583667819810817
"To turn our economy around, the 1st step must be to start doing things in DC like we’ve been doing them in Fort Worth.http://kaygranger.house.gov/its-time-get-america-working-again …",2013-07-26 01:00:37,1,5,360565283825516544
Had a great visit with Rob and Kim Catalano and their family this morning.  Thanks so much for stopping by my office!pic.twitter.com/kqRqG7htJ2,2013-07-25 19:16:58,1,0,360478802540912640
I had a meeting with Christians United for Israel to talk about the alliance between the US & Israel.pic.twitter.com/9BMbXPiYL2,2013-07-25 16:36:03,3,2,360438304518328320
Read about my vote to delay the individual mandate in this week’s e-newsletter. http://kaygranger.house.gov/pushing-back-individual-mandate …,2013-07-19 20:43:43,0,1,358326306607337472
Thanks so much for the tour of Anchor Fabrication earlier this week!pic.twitter.com/dV9vncbCOM,2013-07-18 20:24:19,1,2,357959036169244672
I’d like to thank Captain Robert Bennett for his service as the Commanding Officer of the NAS JRB and congratulate him on his retirement.,2013-07-16 01:00:17,1,3,356941320146780162
USS Fort Worth is getting a camo paint scheme so it can blend in with the sea at the waterline & then the sky above.http://www.utsandiego.com/news/2013/jul/05/fort-worth-camouflage-paint-littoral/ …,2013-07-11 21:17:37,1,3,355435735626690561
"While the employer mandate delay is better for businesses, I'm concerned about the way the delay happened. Read more: http://kaygranger.house.gov/delaying-health-care-reforms-employer-mandate …",2013-07-11 18:39:43,0,2,355395995560984579
It was great to see Pastor Paul Shelton and his family in my D.C. office this afternoon.  Thanks for visiting!pic.twitter.com/XpgoARQlSS,2013-07-09 21:46:11,1,1,354718147154173952
Happy 4th of July!  Please take a moment this Independence Day to thank a veteran and their family for serving.,2013-07-04 14:00:37,3,2,352789043555205123
I’ll be heading to the fireworks at Panther Island Pavilion tomorrow with my family.  What are your Independence Day plans?,2013-07-03 20:00:33,0,1,352517237116121088
I'm proud to represent so many service members. I'll never forget their service. Don't miss this special #July4 enews:http://kaygranger.house.gov/land-free-home-brave …,2013-07-03 15:32:37,0,2,352449809531150337
"Hope you can watch my latest PSA, which discusses ideas everyone can put to use to help prevent cancer. RT today!http://youtu.be/1vlCikmvVO8 ",2013-07-02 02:00:22,1,2,351883012402712576
"I did 2 PSAs that hit the airwaves last wk. Check out ""Signs"" which brings awareness to mental health disorders todayhttp://youtu.be/WfkUbKejq7Y ",2013-07-01 20:53:54,0,0,351805886097924097
The relationship between the IRS & Americans has become too lopsided. We need a Taxpayer Bill of Rights. Learn more:http://kaygranger.house.gov/taxpayer-bill-rights …,2013-06-28 18:43:08,2,0,350685813438291969
I'm proud to announce my co-sponsorship of the Death Tax Repeal Act of 2013. http://kaygranger.house.gov/press-release/granger-co-sponsors-death-tax-repeal-act-2013 …,2013-06-27 19:20:22,5,8,350332798072139776
"Today is National #PTSD Awareness Day.  If you know someone suffering, please reach out.  Make a difference.  http://www.ptsd.va.gov/about/ptsd-awareness/steps_raise_awareness.asp …",2013-06-27 15:18:29,0,3,350271924640813057
It was so nice to meet the Gambrell Street Baptist Choir today.  Good luck at your performances later this week!pic.twitter.com/XK22Tc0gkB,2013-06-26 19:32:45,1,0,349973524951212032
Texas Insider picked up my e-newsletter from last week which discussed how the #healthcare law will impact #smallbiz. http://www.texasinsider.org/the-health-care-laws-impact-on-small-business/ …,2013-06-25 14:57:36,0,1,349541896252702720
I’m speaking at the #NYMeeting about our #NationalSecurity interests.  Tune in now and watch LIVE: http://ow.ly/mevcH ,2013-06-24 22:00:08,0,1,349285841463549952
