Text,Date,Favorites,Retweets,Tweet ID
"We have learned so much from the crack cocaine epidemic and how it affected those in the child welfare system. Now, we have to apply those lessons to the epidemic at hand. We must protect #FosterYouthVoices More: http://bit.ly/2ByNKhP pic.twitter.com/6AuZZTklsc",2017-12-01 02:18:11,30,9,936419124061835264
"Who pays for the $1.5 trillion the #GOPTaxScam adds to the deficit? Our kids and grandkids. Instead of prioritizing workers in LA, it gives companies a tax break for outsourcing jobs. We need a #BetterDeal",2017-11-29 22:35:00,90,44,936000569784786945
STUNNING discovery by Al-Jazeera yesterday. The FBI must answer to this.http://www.aljazeera.com/news/2017/11/documents-show-monitoring-black-lives-matter-171128110538134.html …,2017-11-29 18:02:00,161,122,935931867764797441
"HAPPENING NOW: Republicans responding to devastating mass shootings in our country with a bill that would increase the amount of people that could carry a hidden, loaded gun before the end of the year. Voting NO.pic.twitter.com/Q2uktw2maC",2017-11-29 16:23:14,471,266,935907013116203008
I will be introducing a resolution on Thursday that condemns migrant slave auctions in Libya and calls upon the international community to take immediate meaningful action.http://www.independent.co.uk/news/world/africa/migrant-slave-auction-video-libya-footage-refugee-crisis-traffickers-smugglers-a8080146.html …,2017-11-28 23:03:44,279,139,935645414375743488
"Unclear why MSNBC allowed the lead analysis on Ms. Meghan Markle, a now soon-to-be Duchess, to be “she doesn’t look so Black like Obama"". Robert Lacy -- educate yourself.",2017-11-27 20:43:47,468,179,935247807358930954
"Barack Obama. John Lewis. Marshawn Lynch. Colin Kaepernick. Steph Curry.

All strong black men. All attacked by Trump. Maybe he feels inferior?",2017-11-27 03:38:25,2606,760,934989765262311424
9 million children could soon lose health insurance because of republican politics. Heartbreaking,2017-11-26 16:33:30,329,224,934822432124305410
My thoughts are with the hundreds murdered while worshipping in Egypt yesterday. We will be strong against the root causes of this terror.,2017-11-26 06:04:44,371,65,934664196196839424
"Happy birthday to @RepYvetteClarke, a fearless advocate for immigrants and black women and girls. Looking forward to continuing to work hard with you!",2017-11-22 22:31:01,87,22,933462850785472512
"Trump tweets disparaging Black athletes: 14
Trump tweets disparaging a Black father: 3
Trump tweets disparaging a white Republican child molester running for US Senate: 0",2017-11-22 18:19:00,3534,1632,933399428337201152
"My heart is heavy due to the terrible news coming out of Mubi, Nigeria. This tragedy is a reminder that we must address the root causes of extremism.https://www.theguardian.com/world/2017/nov/21/nigeria-mosque-attack-teenage-suicide-bomber-kills-at-least-50 …",2017-11-22 03:46:00,116,61,933179733679865856
"In LA, even if you have money, you can have a hard time finding housing. Last week my office put on the Housing First Resource Fair in South LA with over 35 services focusing on housing retention and more. https://bass.house.gov/media-center/press-releases/office-congressmember-bass-hosts-housing-first-resource-fair-south-los …pic.twitter.com/h9VEzT4c6x",2017-11-22 01:16:00,54,19,933141984209903617
"Just 7 years ago, a 7.0 magnitude earthquake devastated Haiti, killing more than 230k residents and displacing nearly 3 million. Now, Trump has decided to eliminate protections for 60k Haitian immigrants living here in refuge & deport them all by 2019.https://www.nytimes.com/2017/11/20/us/haitians-temporary-status.html …",2017-11-21 23:11:19,43,43,933110605640237056
A dictatorship cannot flourish when knowledge is common and abundant. Proud to support #NetNeutrality and stand with those that continue this fight. Thank you for your persistence -- your voice MATTERS.pic.twitter.com/fMeYRLQCtw,2017-11-21 05:25:02,557,348,932842266850447360
The FBI's Black Identity Extremism guidance document combined with a disingenuous Attorney General leaves the door wide open for legitimate organizations exercising their first amendment rights to be surveilled and harassed by police.pic.twitter.com/FvcLpBRzWf,2017-11-20 22:25:36,153,109,932736714031992832
He can’t think of one better thing to do on a Sunday as the President of the United States?? Another example of Trump diminishing the presidency.pic.twitter.com/8aupzlFoa6,2017-11-20 15:27:24,177,44,932631470421757953
Thousands of kids across the country are searching for a forever family. Join me in celebrating #NatlAdoptionDay!,2017-11-18 16:06:00,165,55,931916408853692416
"Today, my colleagues have a choice -- corporations or teachers & students, big businesses or first-time homebuyers, the super wealthy or the middle class. I'll be with you voting NO on the #GOPTaxScam & I'm hoping my colleagues across the aisle will do the same.pic.twitter.com/ebMkxOPKTz",2017-11-16 17:58:16,218,90,931219886621241344
"This was just the beginning. The FBI/DOJ drafting up an entire report on the threat of ""black identity extremist"" groups is a terror tactic to hold back black activists from exercising their rights. What's that sound like?https://twitter.com/angela_rye/status/930672747105210370 …",2017-11-15 22:10:13,705,276,930920901239037952
"If the AG can't name ONE org that's a ""black identity extremist"" group, we're faced with one reality -- the FBI & DOJ are reverting back to a time when citizens were surveilled based on the color of their skin and their level of activism exercising their first amendment right.pic.twitter.com/7Gw2FIphqx",2017-11-14 21:45:39,6944,4550,930552330860351488
"Asked #JeffSessions to name one black identity extremist group. 

He couldn't. 

Asked him to name ONE white supremacist group that had targeted cops. 

His memory failed until I reminded him. Ridiculous.pic.twitter.com/qDV76ndKNH",2017-11-14 19:36:49,7772,3950,930519911096602624
"""I can only do my best to answer questions as I best understand them"" - AG Sessions

Do you understand the word ""collusion""? #SessionsHearingpic.twitter.com/nMuqDRPL16",2017-11-14 15:46:45,319,116,930462011158421505
Joining my colleagues to question AG Sessions this morning about the real impact his DoJ has already had on communities of color. #SessionsHearinghttps://www.cbsnews.com/news/jeff-sessions-set-to-testify-before-house-judiciary-committee/ …,2017-11-14 15:08:42,178,48,930452435138641925
"Surrendering the DoJ to Trump so that he can prosecute a political adversary is a sign we will look back on and say ""that was a crack in our democracy."" We will not break.https://www.nytimes.com/2017/11/13/us/politics/justice-department-uranium-one-special-counsel.html …",2017-11-14 04:30:18,117,52,930291776316985346
The national security implications of the son of the President corresponding with Wikileaks via DM on TWITTER are terrifying. Our country is less safe now than it was two years ago.https://www.washingtonpost.com/politics/donald-trump-jr-communicated-with-wikileaks-during-2016-campaign/2017/11/13/947e64d4-c8bb-11e7-aa96-54417592cf72_story.html …,2017-11-14 02:35:52,246,124,930262980016726017
South LA has the LOWEST rate of new affordable housing despite one of the LARGEST population growth rates in LA. Learn more about my #HousingFirst event next Saturday here: http://bass.house.gov/housingfirst pic.twitter.com/SwxRrHkRpy,2017-11-12 17:49:01,64,19,929768004568588288
"The commitment to the protection of our freedoms and democracy deserves our recognition, admiration, and unadulterated gratitude. To all veterans -- thank you for your humble service. Happy #VeteransDay.",2017-11-11 16:11:48,61,23,929381152548417536
"As of October 9, the Washington Post reported that 45 has made 1,318 false and misleading claims during over 263 days. We must take a stand against this dishonest administration. That is why #IBelieveFrederica.https://www.washingtonpost.com/graphics/politics/trump-claims-database/?tid=a_inl&utm_term=.356cdb7f05b2 …",2017-11-09 18:52:00,63,35,928696693738045440
.@RepWilson told the truth. Kelly lied to discredit her. We won’t let that stand. #IBelieveFrederica,2017-11-09 18:25:00,153,56,928689898105724928
Loretta Lynch. Susan Rice. April Ryan. Jemele Hill. Frederica Wilson. Powerful Black women of distinction and integrity. 45 was quick to attack them when they shed light on his poor character. #IBelieveFrederica #BelieveBlackWomenpic.twitter.com/ylGlP3g2jq,2017-11-09 18:01:00,545,170,928683859075403776
RSVP to receive help with affordable housing TODAY. More info: http://bass.house.gov/housingfirst  #HousingFirstpic.twitter.com/Eaza4tfvfs,2017-11-08 22:48:00,15,11,928393697498103808
Great start but we cannot let up. #GetCovered at http://coveredca.com http://thehill.com/policy/healthcare/359011-obamacare-signups-surge-in-early-days-to-set-new-record …,2017-11-08 16:18:04,33,21,928295566630629377
LIVE with @rolandsmartin to talk about @realDonaldTrump's despicable reaction to gun violence & last night's election results.pic.twitter.com/NbGxzwK3FD,2017-11-08 13:19:01,30,10,928250507952615427
"TPS is a status granted for immigrants coming from countries recovering from disaster. Today, Trump may decide to rescind it. #SaveTPSpic.twitter.com/LqPuBPtzOq",2017-11-06 16:16:42,41,40,927570446995869696
36 days of thoughts and prayers from Congress since the #LasVegasShooting obviously hasn't worked. We need gun reform NOW.,2017-11-06 13:31:34,374,141,927528889467002888
My thoughts are with the families of those lost after yet another devastating attack.https://twitter.com/latimes/status/927297001775140864 …,2017-11-05 22:56:30,38,11,927308669594816512
9 million kids need us to stop playing politics with the Children’s Health Insurance Program.https://wfpl.org/congress-moves-to-fund-childrens-health-insurance-but-at-others-expense/ …,2017-11-03 14:33:00,41,22,926457186020032513
This is the second instance the ATTORNEY GENERAL lied under oath. He should’ve resigned eight months ago.http://www.cnn.com/2017/11/02/politics/carter-page-testimony-russia-trip/index.html …,2017-11-03 13:05:00,124,83,926435038283038720
"If you purchase your own health insurance, you can buy or change your health plan for 2018 TODAY. #GetCovered here: https://www.coveredca.com pic.twitter.com/MdwHUVxRij",2017-11-01 15:44:12,39,43,925750328519286784
My thoughts are with those injured and the families of those lost. We will not cower.https://twitter.com/latimes/status/925476488043954177 …,2017-10-31 21:57:21,42,11,925481846804185088
Today’s announcement should serve as a wake-up call to the White House that conspiring against the US will not slide. You will be caught.pic.twitter.com/v78VXjT71N,2017-10-30 17:31:52,182,89,925052649094959104
Joined 19 other @HFACDemocrats in demanding an explanation for the delay of key Russia sanctions. What's taking so long?pic.twitter.com/GH9f3P6Q2k,2017-10-26 15:39:12,52,31,923574742568796160
"Congress needs to stand up. At some point it can't be about re-election, it's got to be about LIVES.https://twitter.com/rolandsmartin/status/923523334020661248 …",2017-10-26 12:18:37,94,28,923524265458241541
"Today, LA lost a star and I, a dear friend. Robert, may you rest, without pain, wrapped in the love you hold dear. http://bit.ly/2gzYjrV pic.twitter.com/cxag9uG8hm",2017-10-25 00:27:42,182,40,922982966392958978
The # of hungry people has decreased by 25% since 2000 but progress is uneven. 4 countries still on brink of faminehttp://abcnews.go.com/International/famine-threatening-countries-casts-shadow-global-hunger-progress/story?id=50435363 …,2017-10-24 00:49:00,13,9,922625941125283840
We must pursue a congressional investigation while calling on the WH to establish a clear US-Africa strategy. 4/4http://thehill.com/blogs/congress-blog/foreign-policy/356728-niger-tragedy-underscores-the-need-for-a-coherent-africa …,2017-10-23 21:18:58,38,22,922573083961102338
"Defense alone, without diplomacy and development, is a losing foreign policy proposition. 3/",2017-10-23 21:16:42,31,17,922572513057628165
A coherent policy toward Africa cannot be ad hoc or emerge in response to isolated events on the ground. 2/,2017-10-23 21:16:09,19,9,922572375505465344
The time has more than come for the Trump administration to advise Congress and the American people of its proposed strategy in Africa. 1/https://twitter.com/thehill/status/922541395835084801 …,2017-10-23 21:15:13,90,48,922572141668679680
Applications to intern in my LA and DC offices are open. Learn more here: https://bass.house.gov/services/internships …pic.twitter.com/dxe3OmW2ls,2017-10-23 20:29:00,11,9,922560509026512896
"As a result of Trump sabotage, there are MORE people without health insurance than one year ago for the first time in 3 years.https://twitter.com/thehill/status/921371190463291392 …",2017-10-23 16:51:11,82,66,922505696234606592
"We need real tax reform, not this sorry excuse of a bill that benefits the wealthiest.http://www.chicagotribune.com/news/nationworld/politics/ct--trump-corporations-tax-breaks-20171018-story.html …",2017-10-23 15:52:08,21,18,922490834527899648
".@HouseGOP is raising taxes for America’s poorest families. You don’t need an economics degree to see that, it’s written right into the bill",2017-10-23 15:51:55,54,33,922490778651422720
I'm proud to have worked with .@RepWilson throughout my career here in Congress and look forward to continuing our work together. 7/7,2017-10-22 19:39:04,57,21,922185557047959552
The kidnapping in Nigeria was magnified because of Rep. Wilson. Lives have been transformed because of Rep. Wilson. 6/,2017-10-22 19:38:34,53,13,922185429041995776
"The program has created doctors, scientists, lawyers and LEADERS. And they pay it forward - participating as mentors themselves. 5/",2017-10-22 19:38:05,35,10,922185307243581446
"Almost 25 years ago, she founded the 5000 Role Models of Excellence -- mentoring and nurturing tens of thousands of young lives. 4/",2017-10-22 19:37:36,36,12,922185186388922368
"She founded the #BBOG movement -- she went to Nigeria to shed light on this issue, rallied her colleagues & as a result, lives were saved 3/",2017-10-22 19:36:49,41,20,922184988312920066
It's her unwavering commitment to make sure we #BringBackOurGirls & her dedication to as an educator and mentor that makes her who she is 2/,2017-10-22 19:31:54,69,29,922183751689539584
.@RepWilson is a fearless leader in Congress -- an unrelenting advocate and a sincere voice for the voiceless. 1/,2017-10-22 19:28:40,359,138,922182939215126529
"If this had happened anywhere else, it would've been the top story. We can’t ignore the largest continent on Earth.https://www.rte.ie/news/2017/1021/914134-somalia/ …",2017-10-21 14:34:03,166,85,921746409602338818
"If it looks like an unconstitutional, bigoted Muslim ban, it’s probably an unconstitutional, bigoted Muslim ban.http://www.npr.org/sections/thetwo-way/2017/10/18/558501163/federal-judge-in-maryland-blocks-trumps-latest-travel-ban-attempt …",2017-10-21 02:51:00,183,61,921569478655307779
"The best defense against breast cancer is early detection. This #NationalMammographyDay, be safe and get checked!",2017-10-20 22:20:23,29,18,921501377192480769
What happened in Niger highlights the need to fully assess what our priorities are in the largest continent on Earthhttps://www.washingtonpost.com/news/worldviews/wp/2017/10/20/everything-we-know-about-the-niger-attack-that-left-4-u-s-soldiers-dead/?utm_term=.be7877e5554c …,2017-10-20 18:48:23,42,23,921448023502327810
"Which is more ""totally"" disrespectful?
A: Telling a widow “he knew what he signed up for"" & then forgetting her name
B: Kneeling in protest",2017-10-19 03:43:36,114,116,920857942412464129
And I stand with @RepWilson. No matter how much they refer to her as “a Rep challenging Trump” don’t forget her name either! #LoudAndProudhttps://twitter.com/repwilson/status/920689677425930242 …,2017-10-18 17:49:28,2115,867,920708421153972225
Today’s aid package will also provide relief for the Virgin Islands. We must do all we can to help. Voting YES.https://www.nytimes.com/2017/09/27/us/hurricane-maria-virgin-islands.html …,2017-10-12 15:14:36,71,30,918495121657794561
There are more than 1 MILLION people w/o access to water or power in Puerto Rico. Voting YES on more aid later todayhttps://www.washingtonpost.com/news/post-politics/wp/2017/10/12/trump-warns-puerto-rico-we-cannot-keep-fema-the-military-the-first-responders-forever/?hpid=hp_no-name_no-name%3Apage%2Fbreaking-news-bar&tid=a_breakingnews&utm_term=.34ed1b377ee9 …,2017-10-12 13:26:15,83,26,918467853157851136
Congress has held health care funding for 9 million children for TWO WEEKS. We need to act NOW.https://twitter.com/CCALAC/status/913597968120500225 …,2017-10-11 20:15:54,68,34,918208560164691969
Sec. Tillerson’s expulsion of diplomats helps those seeking to undermine the U.S.-Cuba diplomatic relationship.https://www.nytimes.com/2017/10/03/world/americas/us-cuba-diplomats.html …,2017-10-11 15:49:07,30,30,918141422133501952
"The WH is not just asking for a wall, they're asking to militarize ICE and expand deportation procedure. No deal.http://www.cnn.com/2017/10/08/politics/white-house-daca-deal-principles/index.html …",2017-10-11 02:30:53,134,90,917940537927307265
Clean energy means more jobs and longer lives. This reverses that.http://www.pbs.org/wgbh/frontline/article/scott-pruitt-says-that-epa-will-repeal-the-clean-power-plan/ …,2017-10-10 22:07:43,41,23,917874308768247809
"I wish I could stop tweeting that I’m embarrassed. More than that, I wish he would stop embarrassing us. Lives are on the line.https://twitter.com/cnni/status/915425305954840576 …",2017-10-04 04:05:06,845,269,915427532660461568
"My body, my choice. Voting no on #HR36, an attack on women's choice to have an abortion, on behalf of women EVERYWHERE & our right to choose",2017-10-03 21:48:18,424,147,915332707508523010
I’ve received thousands of devastated calls & letters. DO NOT GIVE UP. Congress will only grow the courage to act if your voices are raised.,2017-10-03 20:11:37,46,17,915308376019611649
Congress could lower the chance of mass shootings tomorrow if Republican leadership wanted to. TOMORROW.,2017-10-03 20:10:55,67,26,915308201360453634
How many more ‘worst mass shootings in American history’ will it take before gun control isn’t “premature”?,2017-10-03 20:07:03,154,51,915307230274232320
"As we wake up to horrific and tragic news out of Las Vegas, our thoughts are with the hundreds harmed and their families.",2017-10-02 12:42:23,107,21,914832938247835648
"Last week I joined two efforts to increase aid in Puerto Rico, the Virgin Islands and the rest of the Caribbean. We must act NOW.",2017-10-01 22:08:43,52,20,914613072534425601
.@realDonaldTrump did you lose on the back 9? Is that why you are being horrible to the MILLIONS of Americans than need help?,2017-10-01 22:07:37,94,22,914612796108795905
Slandering the mayor of an American city that is undergoing the impact of a hurricane demonstrates the maturity of an upset 5 year-old.,2017-10-01 22:06:50,581,209,914612598892527616
"Diplomacy is not a waste of time, it prevents countries from wasting the lives of brave soldiers. @realDonaldTrump what part don't you get?",2017-10-01 17:42:39,538,220,914546114497585152
Spread the word: More than 140K #DACA recipients are eligible to renew their status if they apply before October 5https://www.uscis.gov/humanitarian/consideration-deferred-action-childhood-arrivals-process/renew-your-daca …,2017-10-01 01:04:43,274,345,914294973155209216
Waiving the Jones Act should have happened sooner. #PuertoRico & the U.S. Virgin Islands deserve full & unwavering support from the US gov,2017-09-30 04:03:16,268,83,913977521422643200
"To those observing Yom Kippur tonight, I wish you a good and safe fast.",2017-09-29 23:41:01,88,15,913911523365605376
We’re with you @OfficialJLD!https://twitter.com/officialjld/status/913452227104202752 …,2017-09-29 22:32:00,49,4,913894153133723650
Couldn't agree more. #PuertoRico and the Virgin Islands need every resource we can afford.https://twitter.com/NydiaVelazquez/status/913022076470140929 …,2017-09-27 14:58:00,62,17,913055127874998272
“Including those related solely by marriage” –from my #NoTrumpPardon resolution to stop Trump from pardoning himselfhttp://www.npr.org/sections/thetwo-way/2017/09/25/553427374/jared-kushner-used-private-email-in-trump-administration-lawyer-confirms …,2017-09-26 23:54:00,94,40,912827628461096960
For those that know Chad as an African country now in the ban -- Chad has been a partner combatting terror for yearshttps://www.washingtonpost.com/news/worldviews/wp/2017/09/25/why-did-the-u-s-travel-ban-add-counterterrorism-partner-chad-no-one-seems-quite-sure/?utm_term=.283967cb1967 …,2017-09-26 20:53:00,50,43,912782078336307201
History lesson: All NFL players only started appearing for the national anthem in 2009. It’s a marketing ploy. http://bit.ly/2y3p3eT pic.twitter.com/En3yxYhV6p,2017-09-26 18:32:10,158,122,912746633774977026
Tonight I'm signing a petition for an IMMEDIATE vote on the #DREAMAct. I urge all Members to join me so that we can #protectDREAMers now.pic.twitter.com/gy3dbqKVpz,2017-09-25 22:15:21,144,66,912440412987695109
#Kinship Caregivers play a vital role in our child welfare system. Read more about my resolution of recognition herehttps://bass.house.gov/media-center/press-releases/rep-bass-sens-hatch-and-wyden-introduce-resolution-designating-september …,2017-09-25 21:53:01,16,4,912434791252971525
No 11th hour repackaging of the Muslim travel ban can remove its bigoted nature.https://www.nytimes.com/2017/09/24/us/politics/new-order-bars-almost-all-travel-from-seven-countries.html …,2017-09-25 18:52:01,36,20,912389240939585536
.@POTUS I know antagonizing black athletes is simply irresistible but there are MILLIONS in the Virgin Islands & Puerto Rico that need help.,2017-09-25 15:30:04,1732,725,912338419602350081
"Athletes of any sport have the right to protest racism, whether it's coming from the White House or anywhere else.",2017-09-24 02:45:36,2487,728,911783648592097281
"When I go abroad next, a foreign leader will ask me “what was with that UN speech?”

I’ll tell the truth.http://www.cnn.com/2017/09/18/politics/donald-trump-un-speech-iran-north-korea/index.html …",2017-09-21 15:04:56,88,18,910882543532232704
"To those celebrating Rosh Hashanah at sundown, may you experience joy through this year and into the next. Shanah Tovah!",2017-09-20 22:03:43,138,19,910625547411185667
"54 years ago, a bomb went off. Addie Mae Collins, Cynthia Wesley, Carole Robertson and Carol Denise McNair – we won’t forget your names.pic.twitter.com/gSTqdfQ9Da",2017-09-15 21:46:02,164,79,908809157259808769
"Introducing the #NoTrumpPardon resolution today with over 40 of my colleagues to make sure that at the end of this, there’s no easy way out.pic.twitter.com/ETjzXS8NyH",2017-09-14 16:59:03,204,108,908374545370841088
"According to AG Sessions, it's guilty until proven innocent. #RootOutRacismhttp://www.huffingtonpost.com/entry/congress-civil-asset-forfeiture_us_59b92315e4b0edff9717ea65 …",2017-09-14 12:11:44,23,14,908302240779251712
Happy to see Congress act to stop the DoJ from authorizing police asset forfeiture before determining if someone is proven guilty.,2017-09-14 12:08:16,61,15,908301370071162880
"Happy birthday to @RepRichmond, Chairman of the @OfficialCBC. I look forward to continuing to serve with you.",2017-09-14 02:19:00,12,3,908153077320089600
"Healthcare is a human right. Happy to see the Senate introduce their #MedicareForAll Act today, proud to cosponsor this effort.",2017-09-14 00:58:09,116,45,908132730596143105
"Polls say many people think cops treat black folks the same as others. 
 
“Remember, we only kill black people.”http://www.cnn.com/2017/08/31/us/georgia-cobb-county-officer-racial-comment-trnd/index.html …",2017-09-12 21:45:29,37,17,907721854378536960
"25 years ago, Dr. Mae Jemison became the first African American woman to travel in space. #OurStory #BlackGirlsRock #Sheropic.twitter.com/nIsIoKQvEj",2017-09-12 18:18:00,245,107,907669639848529920
Immigration is an issue that affects us all. We need a clean vote on the #DREAMAct NOW to protect the 200k DREAMers in California.,2017-09-12 16:15:36,47,13,907638837853159424
Saying “we are all immigrants” is not true. Native Americans aren't immigrants & African Americans didn't come here voluntarily.,2017-09-12 16:15:20,378,139,907638769469345792
"As a new generation that didn’t witness this day 16 years ago emerges, it’s increasingly important we honor those lives lost. #NeverForget",2017-09-11 12:58:56,89,34,907226955245813760
To Ethiopians throughout the world celebrating the new year tomorrow -- Melkam Enkutatash!,2017-09-11 03:25:41,235,67,907082692365373440
My thoughts are w those in Puerto Rico and the Virgin Islands as the rebuilding process after #HurricaineIrma beginshttps://www.washingtonpost.com/news/worldviews/wp/2017/09/07/irma-kills-10-in-battered-caribbean-which-is-in-a-rush-against-time-before-the-next-storm/?utm_term=.11871f153458 …,2017-09-08 22:57:48,13,6,906290501367857153
"As #HurricaineIrma sets Florida in its sights, see @FEMA for ways to help.https://twitter.com/fema/status/906205593899339777 …",2017-09-08 22:57:04,28,11,906290318982750209
Watch my full remarks from this morning here: http://bit.ly/2wKEM0R pic.twitter.com/nooQ05Wz64,2017-09-07 16:04:26,20,5,905824086433116160
We cannot and must not sacrifice the health of those on the ground in the name of airline efficiency.,2017-09-07 16:02:20,18,3,905823556881305600
