Text,Date,Favorites,Retweets,Tweet ID
"Visited the international police training facility in Pijaos, #Colombia while in South America. Statement here http://goo.gl/cGMlj #security",2011-03-18 19:28:12,0,0,48828064360169472
"March is Colorectal #Cancer Awareness Month. To bring attention to this disease, I have posted a weekly fact http://goo.gl/AJ8Y8 #prevention",2011-03-18 18:48:56,0,1,48818182252802048
#FF #TX @Samspressshop @RepHensarling @farenthold @RepFlores @RandyNeugebauer @JudgeTedPoe @RepKenMarchant @RepCanseco @JudgeCarter #Texas,2011-03-18 15:15:05,0,0,48764365234634752
Met with General Petraeus earlier today to be briefed on the efforts in #Afghanistan. See photos here http://goo.gl/IdcjJ,2011-03-17 18:54:44,1,1,48457253866569729
Apply to intern for my DC office for the summer at kaygranger.house.gov and see photos of my current interns here http://goo.gl/GnM9p #TX12,2011-03-16 19:15:09,0,0,48100004497338368
Met earlier today with Mayor Oscar Trevino and Council members from @Cityof NRH to discuss issues in the city http://goo.gl/fCutg #Texas,2011-03-16 18:22:43,0,0,48086811054051328
Just met with a few #Firefighters representing @FortWorthFire and the Committee for Responsible Government http://goo.gl/LKHSm #FortWorth,2011-03-16 18:07:22,0,0,48082947156361216
RT @RepKenMarchant: Honored to be joining the influential House Committee on Ways & Means. Full statement here: http://1.usa.gov/gQmUIq #TX,2011-03-16 14:51:14,0,1,48033589329264640
Met with #Bono from U2 to discuss the @ONECampaign and the work they do for poverty and preventable disease globally http://goo.gl/NorWD,2011-03-15 19:41:11,8,34,47744166729482240
Thank you to the Fire Fighters working and volunteering to end the grass fires currently in Wise County. For updates http://goo.gl/Tbok5,2011-03-11 21:40:59,0,0,46324766113665024
Questioned @HHS Secretary Kathleen Sebelius at the Appropriations on Labor-HHS subcommittee hearing for the FY12 Budget http://goo.gl/R8me9,2011-03-11 21:23:55,0,3,46320471431585792
"March is Colorectal #Cancer Awareness Month. To bring attention to this disease, I am posting a weekly fact http://goo.gl/AJ8Y8 #prevention",2011-03-11 20:16:33,0,2,46303517757018112
Interviewed last night by @JudyWoodruff for PBS @NewsHour on #foreignaid spending and security. Watch my interview here http://goo.gl/uqX2A,2011-03-11 14:37:03,1,1,46218078320734208
#FF #GOP @SpeakerBoehner @GOPLeader @GOPWhip #TX @Canseco @PeteSessions @LamarSmithTX21 @RepHensarling @JudgeTedPoe @RepLouieGohmert #tcot,2011-03-11 14:30:37,1,0,46216460078555136
Tune in tonight to PBS NewsHour to see me discussing #foreignaid. Visit @NewsHour site to see when I come on near you http://goo.gl/dLadk,2011-03-10 23:12:23,0,0,45985380016730112
"Met earlier with Mexican Ambassador to the US, @Arturo_Sarukhan, to discuss the US-Mexico bilateral relationship http://goo.gl/QYW2b #Mexico",2011-03-10 23:08:37,0,0,45984432066281472
Tonight I'm on PBS NewsHour at 6:30 pm (EST) discussing #foreignaid. Visit @NewsHour site to see when I come on near you http://goo.gl/dLadk,2011-03-10 22:01:23,1,0,45967512260714496
The subcommittee on State and Foreign Operations held a committee hearing today with Secretary Clinton of the @StateDept http://goo.gl/i0trT,2011-03-10 21:50:31,0,0,45964776110690304
Spoke @CARE International Women’s Day 100th Celebration with @LauraWBush and #MelindaGates to celebrate women http://goo.gl/wmWal,2011-03-10 17:22:42,0,1,45897379920101376
Here is my opening statement from the State and Foreign Ops subcommittee hearing with Secretary of Treasury Geithner http://goo.gl/FUSOX,2011-03-09 22:17:26,0,0,45609163568590848
Met with @BillGates earlier to discuss @gatesfoundation and the great work they do for #globalhealth and development http://goo.gl/kmj5A,2011-03-09 21:33:24,0,5,45598081986740224
"My subcommittee on State-Foreign Operations is questioning @USTreasuryDept Secretary Geithner, my opening statement here http://goo.gl/2Od5v",2011-03-09 20:03:34,0,0,45575475518640128
#FF #TXGOP @RepJoeBarton @RepKevinBrady @MichaelCBurgess @JudgeCarter @CongCulberson @RepKenMarchant @PeteSessions @RepLouieGohmert #Texans,2011-03-04 17:21:47,0,1,43722821045719040
"On The Mark Davis Show with @MarkDavis now, on WBAP - tune into 96.7FM or listen online http://bit.ly/5BbT7 #TX12",2011-03-04 16:37:17,0,0,43711624221175809
In 15 minutes at 10:35 am (CST) I will be interviewed by @MarkDavis on WBAP - tune into 96.7FM or listen online http://bit.ly/5BbT7 #TX12,2011-03-04 16:18:00,0,0,43706770778099712
"At 10:35 am (CST) I will be interviewed by @MarkDavis on WBAP ""The Mark Davis Show"" - tune into 96.7FM or listen online http://bit.ly/5BbT7",2011-03-04 14:11:12,0,0,43674860232245249
"Today I introduced H.R. 912, which is a bill to expand the services for prevention and treatment of #Colorectal #Cancer to help #beatcancer",2011-03-03 22:51:15,0,0,43443346710077442
Met with constituents from Fort Worth @SisterCityIntl to discuss the cultural and economic benefits of this exchange http://on.fb.me/hDYMEP,2011-03-03 19:56:47,0,0,43399441889247232
"Met with 17 women from across the globe with @IRIglobal, who plan on running in upcoming elections in their country http://on.fb.me/hwJ4zc",2011-03-02 23:58:00,0,0,43097756780335104
"Met with President of the American Jewish Committee, Bob Elman, to discuss developments in the Middle East http://on.fb.me/hJZgKB #Israel",2011-03-02 23:10:12,0,0,43085726061039616
"Finished a Defense hearing with Secretary of Defense Gates, Admiral Mullen, and Comptroller Hale on the FY12 Budget http://on.fb.me/hM6K2Z",2011-03-02 18:43:50,0,0,43018695735390208
Met with @tonyblairoffice this morning to discuss #Israel and #Palestine peace process with the former Prime Minister http://on.fb.me/grrDk0,2011-03-02 14:50:04,0,1,42959865915772928
Check out my interview in the March 2011 @MarieClaire Magazine issue discussing #Iraq and women becoming more politically active there.,2011-03-01 23:15:26,0,1,42724655307554816
Visit my facebook page for photos from the @Traffick911 Tailgate Rally to bring attention to domestic sex trafficking http://on.fb.me/htAo1x,2011-02-28 23:23:18,0,0,42364247484809216
"If you would want more details on what I am doing in Washington and #TX12, ""like"" me on Facebook for detailed updates http://on.fb.me/hbWsrQ",2011-02-28 21:23:11,0,0,42334018150207488
Speaking this Sunday @Traffick911 Rally from 2 to 6 at the Aristide Event Center in Mansfield about #humantrafficking http://bit.ly/dazXi8,2011-02-25 20:01:33,1,0,41226314010738688
#FF #GOP @SpeakerBoehner @GOPLeader @GOPWhip #TX @Canseco @PeteSessions @LamarSmithTX21 @RepHensarling @JudgeTedPoe @RepLouieGohmert #tcot,2011-02-25 14:48:39,1,2,41147568511664128
"RT @Traffick911: This Sunday will be the ""I'm Not Buying It"" rally to bring attention to #humantrafficking in #Texas http://on.fb.me/fRsaoI",2011-02-24 23:09:46,0,1,40911289010094081
Attended the “Flip the Switch” event for @TxCowboyHOF receiving two grants to install a solar energy system http://on.fb.me/hQbWqa #tx,2011-02-23 21:06:33,0,1,40517896018853888
Today I was proud to accept the NAM Award for #Manufacturing Excellence from @ShopFloorNAM see my photos here http://on.fb.me/eM4JHZ #TX12,2011-02-22 23:31:20,0,0,40191943573110784
Earlier I presented @theAward to two students from the 12th district who #volunteered over 400 hours to the community http://on.fb.me/eKG02t,2011-02-22 23:03:03,0,0,40184826678099969
On Saturday at 3:00 am I spoke on the House floor to fight for $830 million in Texas Education funding. Watch my speech http://bit.ly/ctfrhQ,2011-02-22 20:35:47,0,1,40147764746792960
#FF #GOP @SpeakerBoehner @GOPLeader @JudgeCarter @PeteSessions @RandyNeugebauer @RepHensarling @RepCanseco @LamarSmithTX21 @RepLouieGohmert,2011-02-18 20:58:35,0,0,38703948797845504
"Met with leadership from @TexasTech to discuss all their new research, including the TTU Health Science Center #TX http://on.fb.me/dI4eyS",2011-02-17 19:25:06,0,0,38318037341974529
Today is the 2 year anniversary of President Obama’s $1 trillion stimulus bill. Less spending and more budget cuts are the solution #GOP,2011-02-17 17:53:55,0,0,38295087528153088
RT @GOPLeader Less government spending = more private sector #jobs,2011-02-17 16:06:16,1,0,38267997248294912
Tune into CSPAN now to watch me speak on the House Floor about the State and Foreign Operations subcommittee budget cuts,2011-02-17 00:09:31,0,0,38027223969705984
"If you missed my House floor speech earlier on the Continuing Resolution, visit my YouTube Channel to watch http://bit.ly/ctfrhQ #GOP #112",2011-02-15 22:47:48,0,1,37644271809073152
Earlier I met with @TCCollege Chancellor Erma Johnson Hadley. See photos of our visit here http://on.fb.me/ikvjIw #TX12,2011-02-15 21:42:31,0,0,37627843458371584
Speaking now on the House floor about Appropriations #billcuts from the subcommittee on State and Foreign Operations http://cs.pn/eA5H7X,2011-02-15 20:01:21,0,0,37602384163241984
Now the House is currently debating the Continuing Resolution H.R. 1 ‘Full-Year Continuing Appropriations Act 2011’ http://cs.pn/eA5H7X #GOP,2011-02-15 19:44:56,0,0,37598251934945280
I am about to be on the House of Representatives floor making a speech about #budgetcuts in the Appropriations bill http://cs.pn/eA5H7X,2011-02-15 19:17:43,0,1,37591402917527554
Chairman Rogers just released the largest budget reduction in discretionary spending in US history. My statement here http://bit.ly/eT7u6h,2011-02-12 00:26:48,0,0,36219634499715074
This week I introduced real #hcr with my bill H.R. 636. My most recent enewsletter explains in more detail at http://bit.ly/g3C8BR #repeal,2011-02-11 22:27:30,1,1,36189613395689472
"Honored to have worked with Mayor Mike Moncrief who is not seeking another term of @CityofFortWorth, he did great work http://bit.ly/f1XV2R",2011-02-11 22:11:44,0,0,36185645265338368
#FF #GOP @SpeakerBoehner @GOPLeader @GOPwhip @RepPaulRyan #TXgop @JudgeCarter @PeteSessions @RandyNeugebauer @RepHensarling @JudgeTedPoe #TX,2011-02-11 15:43:53,2,0,36088038513836033
Meeting with Secretary of State Hillary Clinton @StateDept this morning to discuss America's top national security priorities for the year.,2011-02-11 13:39:46,0,1,36056801761820672
Interesting op-ed in @RollCall by @JudgeCarter  - 'Carter: When Bad Regulation Costs American Jobs' read it here http://bit.ly/h8Y6w2 #TX,2011-02-10 22:08:39,0,0,35822481881174016
Monday my district staff met with @ONECampaign to discuss childhood vaccines to save lives. Read more here http://bit.ly/hOgQEd #TX,2011-02-10 21:57:02,1,3,35819558069608448
"Met with #JaneGoodall of the @JaneGoodallInst, renowned primatologist. She also has a connection to @FortWorthZoo http://on.fb.me/ihOljm",2011-02-10 20:14:16,0,1,35793695986946050
Earlier I met with Israeli Defense Minister Ehud Barak and @IsraelDC Ambassador Oren about #Israel. See photos at http://on.fb.me/gHQ0fy,2011-02-09 22:01:44,1,4,35458352095956992
Met earlier with representatives from the Tarrant Regional Water District to discuss water planning and supply in #TX http://on.fb.me/hFux5T,2011-02-09 21:29:26,0,0,35450222062608384
Please be safe while traveling during the inclement weather hitting North Texas. @TxDOTFTWPIO has safety tips available http://bit.ly/5sw6El,2011-02-09 15:24:45,0,0,35358447600021504
Due to poor weather conditions in North Texas Azle High School will be closed and the exhibit from @LibraryCongress will not be displayed.,2011-02-09 15:18:30,0,0,35356875147051008
Today is the last day to visit @AzleTexas for the @LibraryCongress Traveling Exhibit at Azle Jr. HS from 10 to 6 http://bit.ly/fQ6DAH #TX12,2011-02-09 14:09:09,0,0,35339422224490496
Monday I was on the Mallory Factor Show with @MalloryFactor for my thoughts on international issues and appropriations http://bit.ly/gaX05I,2011-02-08 23:00:43,0,0,35110807444389888
Today and tomorrow visit @AzleTexas for the @LibraryCongress Traveling Exhibit at Azle Jr. High School from 10 am-6 pm http://bit.ly/fQ6DAH,2011-02-08 14:26:46,0,0,34981466345570305
"Great read @Dallas_News on aid to Egypt and my thoughts 'Granger watching Egypt, defends aid' http://bit.ly/ie7MZt #Egypt #Tahrir #Jan25",2011-02-07 14:44:29,0,0,34623536916074496
Tune in to @ESPN in #SundanceSquare to watch the #SuperBowl tonight #SteelersVSPackers at #CowboysStadium http://bit.ly/hxYpuR #FortWorth,2011-02-06 17:29:18,0,0,34302629186117632
RT @Republican Study: Video: RSC Remembers Reagan @100 http://bit.ly/i6hifA Happy 100th Birthday Mr. President! #gipper #Reagan100,2011-02-06 17:25:02,0,0,34301555138101250
RT @gopconference WATCH @RepHensarling deliver the Weekly #GOP Address! http://bit.ly/Z1X6l #TX,2011-02-05 16:52:20,0,0,33930935514697728
"Due to the weather conditions in North Texas, @Traffick911 will postpone the #ImNotBuyingIt Rally to a later date http://on.fb.me/eN8B6f",2011-02-04 19:48:48,0,0,33612960307879936
#FF @SpeakerBoehner @GOPLeader @GOPWhip @PaulRyan #txGOP @JudgeCarter @PeteSessions @RandyNeugebauer @RepHensarling @JudgeTedPoe @Farenthold,2011-02-04 14:49:27,1,0,33537623599353857
#SuperBowlXLV Sunday coming up this weekend. @SundanceSquare in downtown Fort Worth has been #ESPN HQ for #SteelersVSPackers game #TX,2011-02-04 14:11:53,0,0,33528170627989505
The Appropriations Committee Chairman Rogers outlined spending cuts of $74 billion. Back to 2008 levels http://bit.ly/e1xkZz #newmajority,2011-02-03 22:13:35,0,1,33287004665942016
Earlier Chairman of the House Budget Committee @RepPaulRyan announced budget spending cuts #cutspending #pledge #GOP http://bit.ly/hZ1T2I,2011-02-03 20:17:37,0,1,33257823995428865
Feb. 8 & 9 visit @AzleTexas for the @LibraryCongress Traveling Exhibit of American treasures at Azle Jr. HS from 10-6 http://bit.ly/fQ6DAH,2011-02-02 16:15:41,0,0,32834551273226240
3 Days to Feb.5 #Traffick911 Tailgate Rally at the Ariside in Mansfield at noon raising #humantrafficking awareness http://bit.ly/h9PbAv #TX,2011-02-02 14:06:27,0,0,32802026261843968
President Obama will address the nation and world about #Egypt and the events that have been unfolding within the hour #Jan25,2011-02-01 23:03:48,0,1,32574870126596096
Working with @Traffick911 #ImNotBuyingIt before the #SuperBowl to bring attention to #humantrafficking before the game http://bit.ly/gnTJ5E,2011-02-01 20:11:09,0,1,32531421004300289
Yesterday I spoke in Fort Worth on the daily aircraft flyovers between #DFW until #SuperBowl Sunday. See photos at http://on.fb.me/fCumaJ,2011-02-01 17:06:10,0,0,32484866700353536
Read my latest statement on the uprising in #Egypt and the 'Future of Egyptian Aid' on my website at http://bit.ly/gXilNE #Jan25,2011-01-31 22:44:27,0,0,32207611784863746
Florida court case against #ObamaCare finds the individual mandate unconstitutional. Read more on the case http://bit.ly/ftMAlR #repeal #112,2011-01-31 22:21:23,0,0,32201806444503041
Announced earlier the Aviation #SuperBowl Flyover every evening. More on this industry's impact in the #DFW area http://bit.ly/e0yJwY #NFL,2011-01-31 17:53:44,0,0,32134449546137600
Fort Worth is getting ready for the #superbowl on Feb. 6th. Good tips @Dallas_News 'Your Super Bowl Guide' http://bit.ly/g68sRw #tx #NFL,2011-01-31 14:27:37,0,0,32082577477074944
Read my recent statement regarding the ongoing violence in Egypt on my website at http://bit.ly/1a4Arp #Egypt #Jan25,2011-01-28 20:33:43,0,0,31087548549828608
#FF @SpeakerBoehner @GOPLeader @GOPWhip @PaulRyan @JudgeCarter @McCaulPressShop @petesessions @RepHensarling @JudgeTedPoe @RandyNeugebauer,2011-01-28 15:19:35,1,0,31008493720838144
Today I met with students from Paschal High School in Fort Worth. Learn more about the program they are in here http://on.fb.me/gDT0Ao #TX12,2011-01-26 18:34:36,0,0,30332793561026560
I’ll be interviewed shortly by Alice Rios & Will Sterrett at 5:35 pm (CST) KRLD 1080AM. Listen live online at http://bit.ly/hupUqD #TX #SOTU,2011-01-25 23:23:23,0,0,30043081038364672
Shortly I'll be interviewed on the radio by Chris Krok at 5:15 pm (CST) KLIF 570 Radio Dallas. Listen live at http://bit.ly/d9lU6d #TX #SOTU,2011-01-25 22:41:15,0,1,30032479301668864
Spoke earlier today at the National Mentoring Summit in Washington. Read more about the event and see photos at http://on.fb.me/hQDh22 #TX,2011-01-25 19:08:03,0,1,29978824372387844
Interesting read on Fannie Mae and Freddie Mac @nytimes: 'Mortgage Giants Leave Legal Bills to the Taxpayers' http://nyti.ms/hzI4MM #GOP,2011-01-25 15:20:29,0,0,29921554695462913
13 Days until Super Bowl XLV comes to Texas - ESPN is beginning to set up @sundancesquare for the big event. More here http://bit.ly/fSknM9,2011-01-24 15:15:44,0,0,29557972032032768
#FF @RepReneeEllmers @VickyHartzler @KristiNoem @DianeBlackTN06 @SandyAdams4FL24 @RepBuerkle @RepMarthaRoby @RepLynnJenkins @SueMyrick #GOP,2011-01-21 14:53:18,0,0,28465161727643648
Tune in right now to The Mark Davis Show on 96.7FM / 820AM or visit http://bit.ly/h9U0bL to hear my interview with @markdavis on @WBAP #TX,2011-01-21 14:30:30,0,0,28459424557301761
This morning I will be interviewed on The Mark Davis Show at 9:30 am (CST). Visit http://bit.ly/h9U0bL to listen live or tune to WBAP 96.7FM,2011-01-21 14:03:30,0,0,28452629960982528
The House of Representatives just voted to #repeal the Health Care law. To read my full statement visit http://bit.ly/eDBdoj #newmajority,2011-01-19 23:03:55,0,2,27863854918672384
"Today I met with General James Amos, Commandant of the U.S. Marine Corps and received updates on Afghanistan #Marines http://on.fb.me/gGjnhL",2011-01-19 21:23:46,0,0,27838650955862016
Today the House will spend a full day debating to #repeal the government-takeover of health care. Watch live: http://houselive.gov/ #pledge,2011-01-19 16:13:08,0,0,27760479581503489
This weekend I had the honor of participating in the Service Academy Interview Day. View photos of the 35 applicants at http://bit.ly/1a4Arp,2011-01-18 23:37:00,0,0,27509792020897792
Good read @startelegram on Tarrant County leading Texas and possibly the nation in natural gas production http://bit.ly/g6Z6Do #TX,2011-01-18 17:43:01,0,0,27420710125174784
In 19 days Super Bowl XLV will be played at Cowboys Stadium. Interesting read @Dallas_News http://bit.ly/ghnC4b #TX,2011-01-18 15:24:57,0,0,27385964997386240
"Today the House will begin debate on the repeal of the Health Care law, which will be voted on tomorrow http://on.wsj.com/f58v5s #gop #tcot",2011-01-18 15:18:36,0,0,27384368376840192
#FF @SpeakerBoehner @GOPLeader @GOPWhip @JohnCornyn @kaybaileyhutch @petesessions @RepHensarling @RepFlores @JudgeCarter @JudgeTedPoe #GOP,2011-01-14 17:34:51,1,0,25969103814524928
Honored to have worked with @kaybaileyhutch. Her dedication will be missed by Texans as she retires at the end of her term #TX #TXgop,2011-01-13 19:23:56,0,0,25634168566194177
Sign up for my weekly enewsletter for updates about my work in Washington and the 12th District #cityoffortworth #TX http://bit.ly/1a4Arp,2011-01-13 17:36:56,0,0,25607241176457216
In one hour I will be interviewed on The Wells Report. Tune in to 99.9FM at 5:00 pm (CST) to listen or go online at http://bit.ly/ex1mgZ #TX,2011-01-12 22:02:12,0,0,25311609597464576
Welcome to the Texas delegation and Twitter @RepFlores. Looking forward to working with you this 112th Congress #TX17 #TX #txGOP #gop #tcot,2011-01-12 22:00:58,0,3,25311299210579968
Later tonight I will be interviewed on The Wells Report @660KSKY. Tune to 99.9FM at 5:00 pm (CST) or go online at http://bit.ly/ex1mgZ #TX,2011-01-12 14:03:50,0,0,25191224482725888
Pleased to see that one Medicare contractor will continue to cover Avastin for breast cancer patients http://nyti.ms/hdfpWU #pinkribbon,2011-01-11 14:00:26,0,0,24827982229020672
"Congratulations @TCCollege Southeast Campus on the new Science and Academic Wing, honored to take part in the ceremony this morning #TX",2011-01-10 22:00:14,0,0,24586338154061824
"Saddened by the events of yesterday in Arizona, my thoughts and prayers are with Rep. Giffords and all involved http://on.wsj.com/i3C7Gr",2011-01-10 00:59:04,0,1,24268956978122753
Honored to be named the Chair of the Appropriations Subcommittee on State and Foreign Operations for the 112th Congress http://bit.ly/ezWtYV,2011-01-07 17:50:35,0,0,23436349025554432
For weekly updates on the budget cuts the 112th Congress makes visit my website as I keep track http://bit.ly/fH4iZM #newmajority #pledge,2011-01-07 17:35:14,0,0,23432485379506176
Disappointing news has been released that Medicare in some states will not cover Avastin for breast cancer patients http://nyti.ms/gzdyjG,2011-01-07 15:49:29,0,0,23405870553497600
#FF @SpeakerBoehner @GOPLeader @GOPWhip @petesessions @EdWGillespie @cathymcmorris @cansecotx23 @farenthold @RepGoodlatte @RepPaulRyan #GOP,2011-01-07 14:00:47,2,0,23378518461120512
"The House passed a bill today to cut 5% of its budget, totaling about $35 million http://bit.ly/h7DN2E #newmajority #GOP #pledge",2011-01-06 21:51:02,0,2,23134470605381632
The Rules Committee is meeting to discuss the repeal of ObamaCare. To watch the committee online http://tiny.cc/6dzl9 #transparency #pledge,2011-01-06 19:50:53,0,4,23104235985960960
"The House of Representatives will read the US Constitution on the floor today for the first time in history, watch live online at 11 am (ET)",2011-01-06 15:28:10,0,0,23038118512820224
RT @petesessions: The House Rules Committee has posted the Rules Package for the 112th Congress. Read the new rules: http://tiny.cc/5ig0o,2011-01-05 23:22:54,0,1,22795201605017600
Looking forward to working with the new and returning Members of the 112th Congress #bipartisanship #112thCongress #USHouse #TX,2011-01-05 19:29:43,0,0,22736518426660864
Congratulations to Speaker John Boehner to lead the 112th Congress! Watch Congress at live http://on.fb.me/bv0USz #newmajority #GOP #pledge,2011-01-05 18:42:06,0,0,22724535463710720
"The 112th session is about to begin later today, watch the live stream of the opening session: http://on.fb.me/bv0USz",2011-01-05 15:22:07,0,0,22674209805172736
"Proud to represent the 12th District of Texas for the 112th Congress, and honored to be back for the first day of the new session #TX #GOP",2011-01-05 13:45:07,0,0,22649799434047488
The swearing-in ceremony will be on live tomorrow 'Republicans to Live Stream Opening Session of Congress on Facebook' http://bit.ly/fwoTU8,2011-01-04 22:45:26,0,0,22423387359940608
"Republican Leaders announced the House will vote Wednesday, January 12th, to repeal the new health reform law #GOP http://politi.co/gn98Hv",2011-01-03 22:37:34,0,1,22059018461650944
Good read about the New Majority and priorities of the 112th Congress @WSJ: 'Congress Targets Spending' http://on.wsj.com/g3nEsQ #GOP,2011-01-03 15:41:36,0,1,21954337991294976
"'TCU tops Wisconsin 21-19 in Rose Bowl, remains unbeaten' Congratulations @TCU! Go Frogs! #rosebowlchamps #gofrogs #TX http://bit.ly/giuUmV",2011-01-02 02:21:06,0,1,21390497603911681
Happy New Year to you and your family. May everyone have a wonderful year in 2011.,2011-01-01 22:59:11,0,0,21339680792379394
Wishing all the families across Texas a very Merry Christmas and happy holiday season! Please remember all those serving in the military #TX,2010-12-25 19:44:24,0,0,18753949330837504
"Good Read: RT @JohnCornyn ""Texas Just Got Bigger"" http://bit.ly/f2AClA #TX #gop #TXGOP #tcot",2010-12-22 18:39:13,0,0,17650380351479808
Stay informed on what is happening in Washington and the 12th District by signing up for my e-newsletter http://bit.ly/1a4Arp,2010-12-21 15:45:02,0,0,17244159085645824
I am disappointed the FDA announced they will withdraw approval of Avastin for treatment of metastatic breast cancer http://bit.ly/1a4Arp,2010-12-16 16:47:50,0,0,15448023991590912
U.S. Judge from VA rules #ObamaCare provision unconstitutional since it requires individuals to purchase coverage http://on.wsj.com/hSwivn,2010-12-13 21:16:12,0,2,14428397421727744
RT @GOPConference Rep.-Elect Kristi Noem to Deliver the Weekly Republican Address (PHOTO) http://bit.ly/fN9TZc #GOP,2010-12-10 17:51:37,0,0,13289746147057664
#FF @GOPLeader @GOPWhip @LamarSmithTX21 @PeteSessions @RandyNeugebauer @MichaelCBurgess @JudgeTedPoe @KayBaileyHutch @JohnCornyn #TX #GOP,2010-12-10 17:49:21,1,1,13289178573832192
Great read in @WSJ “The Obama Stimulus Impact? Zero” http://on.wsj.com/fpGezI,2010-12-09 15:37:44,0,0,12893666834120704
"Congratulations Ryan Reed, on receiving the 911 Teen Hero Award http://bit.ly/gWBI6n #TX",2010-12-09 15:19:10,0,0,12888995620986880
Take a moment today to remember Pearl Harbor and all those who sacrificed for our freedoms #PearlHarbor #WWII #HonorTheFallen #Military,2010-12-07 14:26:20,0,1,12150921358213120
"To view the side launch of the USS Fort Worth, visit my YouTube channel at http://bit.ly/h5w2Kh #cityoffortworth #TX",2010-12-06 21:31:16,0,1,11895471282851840
View the christening ceremony of the USS Fort Worth from this weekend at http://bit.ly/gBvWmg. What a proud moment for myself and the city.,2010-12-06 16:22:34,0,0,11817787706056704
Today I christened the USS Fort Worth. This is one of the proudest moments of my career. Photos are posted at http://on.fb.me/hcrl0E,2010-12-04 15:54:23,0,2,11085918991552513
"I presented items for the USS Fort Worth during the mast stepping ceremony this afternoon, see the ones from Fort Worth http://bit.ly/dP3eyA",2010-12-03 21:47:33,0,0,10812406745800704
#FF #TX @RepKevinBrady @RepHensarling @JudgeTedPoe @michaelcburgess @LlamarSmithTX21 @JudgeCarter @JohnCornyn @gopconference @kaybaileyhutch,2010-12-03 18:50:30,0,0,10767851820417024
Later today is the traditional mast-stepping ceremony of the USS Fort Worth. I am proud to be a part of it http://bit.ly/eyV08W,2010-12-03 15:44:57,0,0,10721154759135232
