Text,Date,Favorites,Retweets,Tweet ID
The appointment of Steve Bannon brings a supporter of white supremacy to the WH. See my full statement here:http://bit.ly/2ezx9CU ,2016-11-15 00:17:52,58,44,798319069820653569
"Join me TOMORROW to discuss Pres-elect Trump's ""New Deal for Black America"" and his appointment of a supporter of white supremacy to the WH.pic.twitter.com/odJHe0N36Y",2016-11-15 00:15:00,23,23,798318347880460288
Every student deserves a quality public #education. Join me in celebrating the 95th American Education Week! #AEW2016pic.twitter.com/zxNBbcfiRT,2016-11-14 20:40:30,26,13,798264365296353285
It is my commitment to continue to advocate for our veterans. Thank you all for your service.,2016-11-11 17:50:01,11,3,797134297065029632
"Last week I was privileged to assist Command Sergeant Major William Arthur Segee, Jr. in receiving the Legion of Merit for years of service.pic.twitter.com/IW6pcWFOio",2016-11-11 17:49:00,10,2,797134043825442816
"This #VeteransDay, join me in honoring and thanking all of the brave individuals who have risked their lives to defend our country.",2016-11-11 17:48:00,9,4,797133792632774656
The gov’t spent $90 billion last year buying products from small businesses. Why shouldn't your business benefit? http://bass.house.gov/crackingthecode pic.twitter.com/11BaeSwDfD,2016-11-10 19:57:57,8,8,796804106337845248
The U.S. elected the 1st woman to Congress 100 years ago today. Celebrate by turning out to #vote. Find where here: https://www.lavote.net/locator pic.twitter.com/t02PqRDXcf,2016-11-08 19:02:20,31,11,796065336130936833
Planning a trip to DC? Be sure to sign up for tours during your visit here! https://bass.house.gov/services/tours-and-tickets …pic.twitter.com/F4DmzQaPuN,2016-11-08 01:22:01,9,3,795798495596662784
Don't forget! Tomorrow is the 2016 election. Click here to find out where and how to vote: http://www.sos.ca.gov/elections/where-and-how …pic.twitter.com/eMVQ7RAkGv,2016-11-07 17:21:51,6,3,795677659648901120
Nov is #FamilyCaregiversMonth! The work caregivers do to ensure the safety of our loved ones deserves to be recognized and congratulated.pic.twitter.com/bjbHG2siqd,2016-11-06 22:17:01,12,10,795389551044886528
It’s always a pleasure to sit down with the interns in my LA office. Interested in applying for Jan? Click here: https://bass.house.gov/services/internships …pic.twitter.com/2hWOGBlLLt,2016-11-05 18:16:00,13,7,794966511433748480
November is #NationalAdoptionMonth! Thank you to the families who open their hearts to those who needed love most.pic.twitter.com/nVKdNan0nt,2016-11-04 20:55:54,33,14,794644360763731969
Last night I was happy to join Temple Isaiah and First A.M.E. Church of LA congregations for a timely convo about econ and social justice.pic.twitter.com/stzLgcVUK2,2016-11-04 16:22:01,13,2,794575435996667904
It was a pleasure to chat with the inaugural Master’s PA class at @cdrewu! Thank you for your dedication to erasing health disparities in LApic.twitter.com/Cz2wPK5enP,2016-11-03 22:41:00,8,7,794308426142810113
.@Simone_Biles is a perfect example of #kinshipcare helping a child develop to her highest potential. More here:http://bit.ly/2fnuY6h ,2016-11-03 19:45:01,9,5,794264134879739908
"Today, I join South L.A. in mourning the unbelievable loss of local philanthropist and true community hero E.J. Jackson.pic.twitter.com/QPCt4RqY8b",2016-11-02 18:22:53,20,6,793881080990429184
Today celebrates life and brings together friends and family for remembrance of loved ones who have passed. Feliz Día de los Muertos!pic.twitter.com/wZJITOi7vJ,2016-11-02 17:16:27,6,7,793864360129069056
The #paygap has barely budged in a decade: Latinas are paid 54% of what white men are paid. #LatinaEqualPay #Trabajadoraspic.twitter.com/kXL6SZslHh,2016-11-01 18:02:02,13,13,793513442766237697
"Diwali is the Hindu festival of lights, which spiritually signifies the victory of light over darkness and hope over despair. Happy Diwali!pic.twitter.com/N8YeNgrcHZ",2016-10-30 21:03:52,46,24,792834429144051712
We must find a permanent solution and #paythemback. Thank you @RepMarkTakano for your leadership on this issue. http://bit.ly/2eD5zDF pic.twitter.com/5lPRXlOCwk,2016-10-28 15:55:00,6,1,792031924860493824
This morning I’ll be on @MSNBC with @tamronhall discussing the latest breaking news. Tune in @ 8am PST!,2016-10-28 14:46:36,9,3,792014710942134272
"I was happy to participate in #MyDistrictDay, which rallies musicians to engage w/ their Reps. Artists must be able to protect their work!pic.twitter.com/5nYBgKVvE6",2016-10-27 21:16:12,11,9,791750369755992064
Yesterday's action marks another step towards ending years of US hostility towards #Cuba. See more on the vote here:http://bit.ly/2eKjmbN ,2016-10-27 16:14:08,8,4,791674349107412992
"HBCUs educate, empower and excel; yet in 1998 they were listed among 11 endangered historic places. Join me in fighting to #PreserveHBCUs!pic.twitter.com/EihMNGCmlk",2016-10-26 23:21:01,41,35,791419389933387776
It was my pleasure to join @ToFosterChange in the discussion on @PBSSoCal on how best to raise #FosterYouthVoices. Thank you for having me!pic.twitter.com/4DGInTa3Aa,2016-10-26 18:19:04,14,5,791343401962708993
"To create a movement, we must raise #FosterYouthVoices and #FosterChange.https://twitter.com/ToFosterChange/status/791331906675613696 …",2016-10-26 18:05:30,5,2,791339989137235968
"Good news from the Pentagon this morning, but it’s important we continue to work to stop these clawback efforts.http://n.pr/2ffIbx0 ",2016-10-26 16:43:38,7,5,791319388473401344
"There will be an #FAA forum tonight, 6-9p at Palms Middle School about changing flight paths in Nov. More info: http://bit.ly/2dWx9Li pic.twitter.com/E3Nr1tH7qI",2016-10-26 14:36:41,5,3,791287438333403136
"TODAY is the last day to register to vote online! Californians, register here: http://registertovote.ca.gov/?ref=voteusa ",2016-10-24 14:12:00,7,6,790556452742201344
This country was built on the backs of Blacks and the @NMAAHC makes no efforts to hide #OurStory. http://bit.ly/2dHmUdq  #APeoplesJourney,2016-10-21 21:28:42,8,2,789579186440642560
Just became a student at @USC? Be sure to register to vote by MONDAY! Register here: http://registertovote.ca.gov/?ref=voteusa ,2016-10-21 17:12:01,4,3,789514589964800000
"Yesterday, I joined @RepTerriSewell in #Birmingham for a tour of the child welfare system there & 2 discuss ways 2 raise #FosterYouthVoicespic.twitter.com/vdkudMsL1A",2016-10-18 20:50:07,10,2,788482312770027520
"You have ONE WEEK to register to vote online! Californians, register here: http://registertovote.ca.gov/?ref=voteusa ",2016-10-17 19:09:00,7,7,788094478498222080
https://chronicleofsocialchange.org/featured/karen-bass-still-hopeful-family-first-act/22081 …,2016-10-17 18:04:09,3,0,788078159564537857
"To those celebrating the beginning of Sukkot, I wish you a warm week with good health and wellness. Chag Sameach!",2016-10-16 23:43:00,11,2,787801044885450753
"Had a great time yesterday at @tasteofsoulla! I was proud to be a co-chair of this event, which puts the LA's best on display! #TOS16pic.twitter.com/wXlE4jBcSs",2016-10-16 21:32:00,12,4,787768078398476288
"21 years ago, the #MillionManMarch reminded Congress it must not leave African Americans behind. Let's remember that reminder. #OurStorypic.twitter.com/qhYXA6RGNz",2016-10-16 19:55:00,24,7,787743667662446592
Congrats to @PPFA on 100 years of expansions in women’s health! #100YearsStrongpic.twitter.com/30zlvd1M4r,2016-10-16 18:16:01,11,5,787718755673530368
See more info about last Tuesday’s grand opening of the Tom Bradley Global Awareness School Computer Lab here: http://bit.ly/2dqiJTv  #CA37pic.twitter.com/VzVkzRgjmk,2016-10-15 22:41:01,3,1,787423056847335429
Great story about LA #fosteryouth in the @latimes yesterday! #FosterYouthVoiceshttp://lat.ms/2dQeAc4 ,2016-10-15 17:20:00,5,1,787342273344368642
"52 years ago, Dr. Martin Luther King Jr. won the #NobelPeacePrize. #CivilRights #MLKpic.twitter.com/WrytlxogfM",2016-10-14 21:16:10,194,116,787039317701132289
The news of today’s release of 21 #ChibokGirls in #Nigeria is bittersweet. See my full statement here:http://bit.ly/2dNfNkm ,2016-10-13 23:05:01,9,9,786704322063065088
"Californians, remember you have until Oct 24 to register to vote! Register here: http://registertovote.ca.gov/?ref=voteusa ",2016-10-13 18:56:00,12,18,786641657697480704
About 40% of #FosterYouth end up homeless upon aging out. Here's what @WeLiftLA is doing about it http://bit.ly/2e6jJyA  #FosterYouthVoices,2016-10-12 19:38:04,22,18,786289854141177856
Quality edu is 1 of the best things we can give kids. See yesterday's Tom Bradley School Computer Lab opening here: http://bit.ly/2e1ttpH pic.twitter.com/7wEFsVWPED,2016-10-12 18:27:00,2,3,786271971340328960
"For those observing Yom Kippur this evening and tomorrow, I wish you an easy fast and a reflective and meaningful service.",2016-10-11 19:30:00,9,3,785925438560276480
This land was not discovered in 1492. #IndigenousPeoplesDaypic.twitter.com/8JH4OEBb9k,2016-10-10 14:20:00,42,33,785485036623585280
Int'l community integration is important to foster young leaders with worldwide visions. More about @AFSUSA here: http://www.afsusa.org pic.twitter.com/g1i0s5zgJa,2016-10-09 21:07:00,11,6,785225072273395713
"As #HHM comes to a close next weekend, I’m happy to recognize  @menjivar, founder/CEO of @URBANTxT. #hustleNcodehttp://bit.ly/2dW6Szh ",2016-10-09 17:20:00,4,1,785167947203481600
October is #BreastCancerAwarenessMonth. Early detection saves lives. Click here for breast cancer clinics in LA http://bit.ly/2dSxL1t pic.twitter.com/KPXV61qoEr,2016-10-08 20:00:02,4,3,784845831576903681
"12 years ago, Wangari Maathai became the 1st African woman recipient of the #NobelPeacePrize. Info here: http://bit.ly/1f79xv9 pic.twitter.com/4POLWifkmn",2016-10-07 21:22:13,10,4,784504124998033408
"For over a year, Republicans have been obsessed with taking lifesaving care away from millions of American women. http://bit.ly/2dS3b8l ",2016-10-07 18:35:59,64,36,784462291895025664
Planning to visit DC on Dec. 1? Register for the National Christmas Tree Lighting Ceremony here:http://bit.ly/2dA8OKg ,2016-10-07 15:34:46,0,0,784416685046497280
".@SpeakerRyan's big idea for '17—repeal #ACA in budget, but forgets he couldn't pass a budget this year #DoYourJobhttp://politi.co/2dUluuX ",2016-10-07 12:29:00,182,156,784369936600793088
Terrible news today as #HurricaneMatthew passes. My thoughts are with those affected as the death toll rises.http://abcn.ws/2dNDw1r ,2016-10-06 18:19:47,5,6,784095827803471872
Good news! The #NMAAHC is re-releasing tickets for January-March of 2017. Get them TOMORROW at 6AM (PST) here: http://nmaahc.si.edu/passes pic.twitter.com/vTX4kLGPlf,2016-10-04 22:59:49,1,2,783441522050076672
We must discuss ways officers can defuse dangerous situations without shooting. My heart is with #SouthLA. More:http://bit.ly/2dCiQMy ,2016-10-04 20:24:13,19,10,783402366708092928
"Happy National #PAWeek! Physician Assistants are essential to quality medical care, which is why I introduced these: http://bit.ly/2c9nd1N pic.twitter.com/4o86EJak4R",2016-10-03 21:02:16,2,1,783049554140758016
Tickets to visit the @NMAAHC from January – March of next year are available NOW: http://nmaahc.si.edu .,2016-10-03 13:00:03,4,2,782928198413594626
Happy Rosh Hashana!pic.twitter.com/TbA3iy6hqh,2016-10-03 01:24:00,19,6,782753032853258240
Tix to visit the @NMAAHC from January – March will be available on Monday at 9:00 AM EST here: http://nmaahc.si.edu  #APeoplesJourneypic.twitter.com/hjCx2xP5ir,2016-10-01 18:23:01,9,2,782284699058176000
"Great news! You can begin submitting your 2017-18 #FAFSA starting tomorrow, 3 months earlier than usual. Apply here: http://bit.ly/2dl9Viw ",2016-09-30 22:54:18,5,4,781990584068235265
"Today, I join the many voices mourning the passing of Israeli elder statesman Shimon Peres. See my statement here:https://bass.house.gov/media-center/press-releases/rep-bass-statement-passing-shimon-peres …",2016-09-28 19:11:19,13,6,781209690676101120
"The opening of the @NMAAHC has helped validate our struggle but even in victory, this fight is not over. More here: http://bit.ly/2dtSa1B https://twitter.com/OfficialCBC/status/781180062615961601 …",2016-09-28 17:59:45,3,3,781191683895590912
"Today is National Gay Men’s #HIV/#AIDS Awareness Day. End the stigma, #EndAIDS. #NGMHAADpic.twitter.com/LIBiFbjKjz",2016-09-27 20:15:01,12,11,780863335906603012
The U.S. and Africa must maximize #AGOA benefits in the remaining 9 years of the renewal. Read more here:http://bit.ly/2d3WKEA ,2016-09-27 18:20:00,3,2,780834392105246722
Congrats to California and @HollyJMitchell on proving there's #NoSuchThing as a child prostitute.http://bit.ly/2dbTYcQ ,2016-09-27 16:36:31,39,33,780808349256417281
"Since April 2014, thousands of children & families in #Flint have been drinking, bathing in poisonous water. #DontForgetFlint",2016-09-26 17:01:03,22,27,780452135871717376
#NMAAHC #OurStorypic.twitter.com/RBYw28RUfD,2016-09-24 17:12:26,11,6,779730223197814784
Congrats to #CulverCity on 100! All the best as you embark on the next century. #CULVERPRIDE More here: http://culvercity100.org/ pic.twitter.com/pbFyTRrEjZ,2016-09-24 15:59:08,10,6,779711776455663616
"100 years in the making, the @NMAAHC is finally here. #OurStory #APeoplesJourneypic.twitter.com/G5HWUm2YIr",2016-09-24 14:11:07,34,21,779684593934807041
Thank you @AWEPA for sharing your thoughts and ideas for the future of U.S. – Africa policy.  Photos here: http://bit.ly/2dni85V pic.twitter.com/aLAu7oRPIw,2016-09-22 23:04:06,6,4,779093946269958144
"Today, I joined my #CBC colleagues outside the DoJ for action against the targeting of unarmed Blacks. #StopKillngUs http://bit.ly/2crLekB pic.twitter.com/Re9UIn7rM4",2016-09-22 22:24:59,8,6,779084103383650304
We all have a responsibility to ensure the safety of our constituents. #DontForgetFlint #FundFlint,2016-09-22 21:34:34,20,11,779071413273686016
Live feed of CBC press conference to address police shootings against unarmed African Americans https://www.c-span.org/video/?415753-1/congressional-black-caucus-holds-news-conference-policeinvolved-shootings …,2016-09-22 16:50:11,8,11,778999847466795008
LIVE on #Periscope: The CBC demands the Dept of Justice take action on the unarmed shootings of African Americanshttps://www.pscp.tv/w/arKxHDF6WUtiR1d2Wkp5amV8MVlxS0REbk5kREVLVjqE7T2jaPlizdt_XYIUcQwkpfciIzLZ6uvq_SfgKk9W …,2016-09-22 16:47:24,20,21,778999149043785729
Tune 2 CNN for live coverage of the CBC's Press Conference to Address Police Accountability and Latest Shooting Deaths of Unarmed Black Men,2016-09-22 16:30:08,7,4,778994804185325572
154 years ago today.pic.twitter.com/BDhfzaavDI,2016-09-22 13:51:03,8,10,778954767708020740
"Congratulations to #CA37’s Angel in Adoption, Franco Vega, Exec. Director and Founder of @TheRightWay. More info: http://bit.ly/2d6E422 pic.twitter.com/Tyslf0KE5s",2016-09-20 22:56:57,6,0,778367370737967105
#TerenceCrutcher #StopTheKillingpic.twitter.com/TBbH0Ai2N2,2016-09-20 19:35:28,14,9,778316668279877633
New study shows that the pay gap is reversed for women in #CA37. Read more here:http://bit.ly/2cZne9p ,2016-09-19 22:15:07,4,3,777994458247761925
Honored to receive the Grandfamilies Champion Award from @GensUnited last week. Read their new report here: http://bit.ly/2cpYtQH pic.twitter.com/nHHQ380XAW,2016-09-19 20:50:11,7,4,777973082233434112
Congrats @RamsNFL on your win in #CA37! Welcome home.https://twitter.com/RamsNFL/status/777646296228175872 …,2016-09-19 00:38:47,2,0,777668225052139520
Thank you to all the Lost Boys and Girls of South Sudan that came to advocate for H.R. 6006! http://bit.ly/2crUzdJ pic.twitter.com/1CEfTqMI25,2016-09-15 23:35:52,9,7,776565227567677440
"53 years ago, a bomb went off in the 16th Street Baptist Church. We will not forget your faces. #Birminghampic.twitter.com/77Sux7GNCb",2016-09-15 15:09:11,72,69,776437717366296576
"I'm proud to sponsor House Res. 867, which would recognize September 2016 as ""Kinship Care Month."" We must support #kinshipcare!",2016-09-15 02:07:20,14,6,776240955305385984
"Yesterday, I spoke with @PAEAonline about 2 bills I introduced in November. http://bit.ly/2c9nd1N  Safe travels!pic.twitter.com/YttjVyCUX5",2016-09-14 17:48:01,3,2,776115299179388928
"The constituents of #CA37 want Congress to #DoYourJob. End gun violence in our community, let us vote! #NoFlyNoBuy #GunVote",2016-09-14 16:39:03,13,8,776097945007501312
We have not forgotten! When will @SpeakerRyan give us a vote? #NoFlyNoBuy #CloseTheLoophole #GunVote,2016-09-14 16:29:02,18,33,776095422485901312
"Good luck tonight, @RamsNFL! Even though you're on the road, welcome home.",2016-09-13 00:04:06,3,0,775485168521883648
"24 years ago today, @maejemison showed us that the atmosphere is no glass ceiling. #OurStory #Sheros",2016-09-12 21:39:56,4,2,775448887343648773
"I send my deepest condolences to the family of my friend and LA social justice giant, Stanley Sheinbaum.http://bit.ly/2cHHc42 ",2016-09-12 18:34:51,3,3,775402307437625344
Today we remember those lost 15 years ago and those that heroically responded in the face of imminent danger. #NeverForget #September11,2016-09-11 13:53:03,17,5,774969003148124160
I’m proud to announce my co-sponsorship of the Improved Employment Outcomes for Foster Youth Act of 2016. More info:http://prn.to/2bYSjUU ,2016-09-10 14:50:06,25,11,774620974968811520
"166 years ago, #California became the 31st state to join the United States.pic.twitter.com/iX7z0Rzy70",2016-09-09 22:27:33,16,6,774373707955507200
"On Wednesday, the #AGOA Enhancement Act passed by a unanimous voice vote on the House Floor. See my remarks here:http://bit.ly/2cqTdxE ",2016-09-09 16:03:31,1,0,774277059765997568
"Joining @NancyPelosi, @SenatorReid & @VP Biden to give Republicans a clear message: #DoYourJob. Watch live at noon:http://bit.ly/2cw0OIj ",2016-09-08 14:54:29,5,3,773897299726594048
Today I participated in the House Subcommittee on Africa’s hearing regarding #SouthSudan. See my statement here:http://bit.ly/2cDmENu ,2016-09-07 23:26:32,6,4,773663772774981632
I extend my condolences to the people of Ethiopia and the families of all who died in the Qilinti Prison fire.http://bit.ly/2c1HX8Q ,2016-09-06 18:02:33,66,64,773219851812888581
Don't forget! At 9:00am EST the #NMAAHC will be releasing extra tickets for Grand Opening Weekend! More info:http://bit.ly/2cfZ0TY ,2016-09-06 12:35:50,4,3,773137631693668352
Today we celebrate the workforce of our nation and a labor movement that has improved the rights of working individuals in the US. #LaborDay,2016-09-05 14:26:04,29,17,772802987248857089
"In #CA13 37 years ago, Robert Maynard became the first African American to head a daily newspaper #OurStory .@RepBarbaraLee",2016-09-03 17:22:07,8,3,772122512884834304
Be sure to check out pictures from recent events in #CA37! https://www.flickr.com/photos/repkarenbass/albums ….,2016-09-03 15:20:04,1,0,772091799162675200
Missed the first round of #NMAAHC tickets? The museum is expanding their hours for opening weekend! Info here:http://bit.ly/2cfZ0TY ,2016-09-02 18:50:48,5,6,771782446480289796
Congrats to the 2015-16 #Fulbright scholars of #CA37!http://bit.ly/2bIa7U6 ,2016-09-02 15:58:46,8,4,771739150664040448
Creative solutions to some of the most challenging aspects of our #childwelfare system are coming from LA! - http://www.congressplus.com/events/index.cfm?action=EventTracking&bypass=true&code=QSPfW05INgIg …,2016-09-02 14:37:10,1,1,771718617058582528
"Inspiring article about my former intern, David. Read more here:http://www.visaliatimesdelta.com/story/life/inspire/2016/08/30/volunteer-finds-home/89578974/ …",2016-09-01 20:36:24,1,2,771446633091493888
"Last Saturday, I had a great convo with the women of Dahomeyian Passages, an org that provides services for #CA37!pic.twitter.com/oDXcIFdrzE",2016-08-31 22:23:22,12,0,771111163140636672
"The first commercial flight to #Cuba has landed, a significant day for #Cuba and the U.S.http://fox61.com/2016/08/31/us-commercial-flights-take-off-for-cuba-after-more-than-half-century/ …",2016-08-31 15:27:41,21,18,771006552551649280
"Last week I toured the Regional Council of Carpenters Buena Park Training Center, a job program that works in #CA37!pic.twitter.com/Cfw42FUPdI",2016-08-30 16:10:30,9,0,770654940616331264
"49 years ago today, Thurgood Marshall became the first African American to take a seat on the Supreme Court. #OurStory",2016-08-30 13:05:09,51,49,770608293882400768
Relieved to hear that no one was hurt this morning at #LAX.http://www.cnn.com/2016/08/29/us/lax-police-emergency/ …,2016-08-29 22:45:07,2,0,770391860497920000
It’s work by organizations like the @LAYouthNetwork that make change in the #childwelfaresystem possible.http://www.huffingtonpost.com/entry/let-love-define-family-august-26_us_57bf2abde4b04193420e06de …,2016-08-29 21:41:11,1,1,770375769944158209
Great turn out at the Doing Business in Africa Forum & Resource Fair yesterday in #CA37! Thanks to all that came!pic.twitter.com/GdRZ4r452o,2016-08-27 16:03:39,19,7,769566051591974912
Planning a visit to the #NMAAHC this fall? Find out how to get tickets here: http://bit.ly/2c2Agl2 pic.twitter.com/ppdIU9jTwd,2016-08-26 21:56:32,7,2,769292470412779521
"Women are two-thirds of minimum wage workers.  For women’s economic equality, let’s raise the minimum wage! #WomensEqualityDay #womensucceed",2016-08-26 14:19:49,13,10,769177533644431360
"To celebrate #WomensEqualityDay let’s pass expanded access to affordable child care, allowing both parents to earn paychecks. #womensucceed",2016-08-26 14:19:00,18,11,769177329750933504
"Today, we celebrate one of the great leaps forward for our democracy – giving women the right to vote. Info here:http://bit.ly/2bp9nCZ ",2016-08-26 14:17:33,3,3,769176964498395136
"Great visit with constituents at @UPS today, congratulations on 109 years of service!pic.twitter.com/KffLeMlpEI",2016-08-25 22:17:47,15,4,768935429869490179
Don't forget! The #Africa Forum is tomorrow morning. Info here: http://bit.ly/2bOVtLU pic.twitter.com/z5X3vX1fpw,2016-08-25 20:50:49,3,0,768913544003727360
"Congratulations @NatlParkService on your 100th birthday! Don’t forget that #LWCF protects our National Parks, it’s vital to the next 100!",2016-08-25 14:09:06,6,3,768812449986256896
Just 2 days until the Africa Forum & Resource Fair! Come discuss opportunities for trade and investment in Africa.https://bass.house.gov/LA-Africa-Business …,2016-08-24 18:21:06,2,2,768513481549099009
We must protect our children from overmedication with #childwelfarereform. Read the new CA audit here: http://bit.ly/2bfGdfD ,2016-08-24 17:01:34,6,3,768493462400315392
"Black women who work full time are paid only 63 cents for every dollar paid to white, non-Hispanic men. We need #BlackWomensEqualPay",2016-08-23 21:11:04,24,14,768193865769549826
It’s #BlackWomensEqualPay Day. The wage gap for women of color is unacceptable.http://bit.ly/1HGLiUf ,2016-08-23 21:10:08,4,5,768193628556537857
"This morning I participated in the groundbreaking of the new home for .@LAFC, which will create 3,000 new jobs!pic.twitter.com/s7NsLrMVbz",2016-08-23 20:32:28,60,14,768184151539326976
Remember to attend the Africa Forum & Resource Fair this Friday! https://bass.house.gov/LA-Africa-Business …,2016-08-23 15:17:11,1,1,768104809387986944
"In 1970, there were fewer than 8,000 women in American jails. By 2014, that number was 110,000. We need #reform now.http://huff.to/2aTwUAC ",2016-08-22 15:31:27,6,6,767746012060520448
The “Doing Business in Africa Forum & Resource Fair” is coming up! Join us! https://bass.house.gov/LA-Africa-Business …,2016-08-20 16:20:08,5,1,767033487928942593
Mental health must be a priority in child welfare reform. Congrats to the CA State Leg on the progress!http://www.eastbaytimes.com/breaking-news/ci_30263625/first-three-bills-protect-foster-youth-passes-assembly?source=rss …,2016-08-19 15:42:24,9,6,766661603815223296
"This is more than an issue of prison reform, this is an issue of human rights.https://www.washingtonpost.com/news/post-nation/wp/2016/08/18/justice-department-says-it-will-end-use-of-private-prisons/?postshare=9221471534255226&tid=ss_tw&utm_term=.4b446b4cf8a9 …",2016-08-18 18:28:07,18,8,766340919117410304
The decision of the FAA to use a bureaucratic loophole to keep SMO open through 2023 is appalling. More here:http://bit.ly/2b6P6UI ,2016-08-18 14:45:29,3,1,766284888748228608
"Be sure to attend the ""Doing Business in Africa Forum & Resource Fair"" on August 26th!
https://bass.house.gov/LA-Africa-Business …pic.twitter.com/zcwRo9syVV",2016-08-17 18:08:07,7,4,765973496274878464
Happy to be back in the 37th! Be sure to check here for upcoming events in the district:https://bass.house.gov/about/events ,2016-08-17 16:40:46,4,2,765951516725407744
"#ICYMI: I met with the President of Senegal last week with a Congressional Delegation. For more info, click here:http://bit.ly/2b9oZOC ",2016-08-16 14:01:32,6,1,765549054365429760
"Wishing a Happy Birthday to @MaxineWaters, my wonderful colleague and a tireless advocate, and champion, for South Los Angeles.",2016-08-15 14:27:34,23,8,765193219923709952
#SocialSecurity keeps over 21 million Americans out of poverty! It's time to #ExpandSocialSecuritypic.twitter.com/0qDqTG5b9u,2016-08-12 17:01:37,118,60,764144823443914754
Proud to support #YouthDay and @UN4Youth. Find out how you can get involved here:http://bit.ly/2030Youth ,2016-08-12 16:04:18,1,0,764130396942532608
The Weingart Foundation's commitment to creating opportunity for Californians has my admiration and ardent support! http://bit.ly/2bkjOfN ,2016-08-11 18:11:59,6,5,763800141597904896
