Text,Date,Favorites,Retweets,Tweet ID
"Today, the @USDA made farms in 13 counties in the Fourth District eligible for emergency loans. More information:https://moolenaar.house.gov/media-center/press-releases/usda-declares-crop-disaster-designations-13-counties …",2015-03-25 19:19:53,0,0,580811359501361152
"Today, I met with Sen. Demers, Sen. Massicotte, and MOP Carmichael from Canada. It was great to speak with them.pic.twitter.com/Unwd5NCpM1",2015-03-24 22:02:42,0,1,580489942847078400
"This afternoon, I spoke on the House floor about the federal budget and the national debt. Video here: https://www.facebook.com/video.php?v=625502297584785 …",2015-03-24 21:11:18,0,0,580477007919747072
"This morning, I met Dr. Francis Collins, director of the @NIH, at the White House Science Fair. It was a great event.pic.twitter.com/yaLJWO3G7j",2015-03-23 16:33:45,0,0,580044774431973377
Thank-you to everyone who listened and asked questions during today's tele-townhall meeting.pic.twitter.com/fy63kzYBvy,2015-03-20 16:48:01,0,0,578961200303718400
I have just finished my first tele-townhall. Thanks to everyone who participated and asked a question. It was great to hear from you!,2015-03-20 15:10:45,0,0,578936723519983616
There's still to listen in and ask a question in my first tele-townhall meeting. https://vid1.teleforumonline.com/video/streaming.php?awesm=vekeo.buzz_h0a&client=14147 …,2015-03-20 14:43:39,0,1,578929901685833728
"Right now, I am taking a question about the problems at the VA during my first tele-townhall. https://vid1.teleforumonline.com/video/streaming.php?awesm=vekeo.buzz_h0a&client=14147 …",2015-03-20 14:21:47,1,0,578924401439166465
My first tele-townhall meeting is starting shortly. Go to the link to listen and submit any questions you have. https://vid1.teleforumonline.com/video/streaming.php?awesm=vekeo.buzz_h0a&client=14147 …,2015-03-20 13:59:52,0,2,578918884000063489
"Enter your email address and name at the link, and you will be able to listen to my first tele-townhall meeting. https://vid1.teleforumonline.com/video/streaming.php?awesm=vekeo.buzz_h0a&client=14147 …",2015-03-20 13:56:26,0,0,578918019835027457
"This morning, I am hosting my first tele-townhall meeting. You can listen-in here: https://vid1.teleforumonline.com/video/streaming.php?awesm=vekeo.buzz_h0a&client=14147 …",2015-03-20 13:55:13,0,0,578917715613716480
"Today in Midland, basketball legend @MagicJohnson gave a great keynote at the @boyscouts Friends of Scouting event.pic.twitter.com/N3jvijqvEW",2015-03-20 13:41:09,1,1,578914172349583360
There are 29 days left to enter the Fourth District's Congressional Art Competition. More details available here: https://moolenaar.house.gov/services/art-competition …,2015-03-20 00:17:16,0,1,578711869571076096
"Last night, during the budget debate, I discussed the importance of state flexibility for Medicaid. Video: https://www.facebook.com/video.php?v=622311594570522 …",2015-03-20 00:16:21,0,0,578711641438756864
The House Budget Committee markup of the 2016 budget has resumed. You can watch the committee debate here: http://www.c-span.org/video/?324892-3/awaiting-house-budget-committee-markup-fiscal-year-2016-budget-resolution&live= …,2015-03-18 21:12:56,0,0,578303095572156417
"Today, I am participating in the House Budget Committee markup of the 2016 federal budget. You can watch here: http://www.c-span.org/video/?324892-2/house-budget-committee-markup-fiscal-year-2016-budget-resolution&live …",2015-03-18 19:28:07,0,0,578276714884784128
"Today, the House passed the Secret Science Reform Act in a bipartisan vote. More info here: https://www.facebook.com/RepMoolenaar/photos/a.587618808039801.1073741833.572656369536045/621553431313005/?type=1 …pic.twitter.com/l8vPGZAdUc",2015-03-18 19:27:16,0,0,578276503038857216
"As a member of the House Budget Committee, I spoke on the floor in support of the budget we released. Watch here: https://www.facebook.com/video.php?v=621079011360447 …",2015-03-18 01:12:45,0,1,578001059483951104
The @CMUMensBBall team is having a great season. Good luck to them tonight in the NIT. Fire up Chips!pic.twitter.com/eXBZmUQJJM,2015-03-17 23:41:20,0,1,577978052489175040
"Today, my colleagues and I on the Budget Committee introduced the @HouseGOP budget for 2016. http://www.c-span.org/video/?324868-1/house-budget-committee-news-conference-fiscal-year-2016-budget-resolution …pic.twitter.com/Lu2l5ToyXg",2015-03-17 15:56:34,1,0,577861087443468288
"Today, @HouseGOP released our budget for 2016. Here are some key facts about the budget:http://budget.house.gov/fy2015/factsandsummary.htm …",2015-03-17 13:35:12,0,0,577825512057360384
Thank you to everyone who came to the open house at the new district office on Friday.http://www.ourmidland.com/news/moolenaar-opens-office-downtown/article_231dd421-801b-5302-a778-706854a2485b.html …,2015-03-17 12:52:57,0,1,577814882319536129
"Tomorrow, House Republicans will present our budget for 2016. Here's a video preview: https://www.youtube.com/watch?v=9Pd2WPjzfzg …",2015-03-16 17:49:51,0,0,577527211709857792
"Today, I had the privilege of presenting First Lt. William Milzarski with the Purple Heart Medal. He's a true hero. https://www.facebook.com/RepMoolenaar/posts/616441821824166 …",2015-03-12 21:56:46,0,0,576139796717944832
"Thank-you to @MIVeteran for these photos from the ceremony, and all they do for Lt. Milzarski and all our veterans.pic.twitter.com/R0LfyfvjTM",2015-03-12 17:54:02,1,0,576078711348416512
It was an honor to present the Purple Heart Medal to Lt. Will Milzarski today in Lansing. A true American hero.pic.twitter.com/Wicfm3ZVq7,2015-03-12 17:52:31,1,0,576078330425974785
I also taped an interview with the Gladwin County Record and Beaverton Clarion.pic.twitter.com/909D9pFQWt,2015-03-11 21:14:17,0,0,575766717932134400
"Today, I was in the district meeting with local newspapers, including the Houghton Lake Resorter.pic.twitter.com/V2zWmLCSdv",2015-03-11 21:13:37,0,0,575766548427702272
"Reminder: My new district office will be hosting an open house on Friday, from 11 AM to 1 PM. Details here: https://www.facebook.com/RepMoolenaar/photos/a.587618808039801.1073741833.572656369536045/615688851899463/?type=1 …",2015-03-11 16:29:09,0,1,575694963058589696
Thank you to the staff of the @greenvilledn for having me in to speak with them about the issues of the day.pic.twitter.com/9jyDHksTYr,2015-03-10 18:16:09,0,1,575359499856429056
Thank you to Alma High School for inviting me to speak to students studying government.pic.twitter.com/qjXavy5rgl,2015-03-10 15:06:24,0,0,575311751526416384
"Reminder: On Friday at 11 AM, I am hosting an open house at my new district office. https://www.facebook.com/RepMoolenaar/posts/612965168838498 …",2015-03-09 17:46:25,0,0,574989631256727552
"239 Reps, including me, signed a letter objecting to the ATF's proposed AR-15 ammo ban. https://www.facebook.com/RepMoolenaar/photos/a.587618808039801.1073741833.572656369536045/612898605511821/?type=1 …pic.twitter.com/dHMpGFgT6B",2015-03-06 18:51:40,0,1,573918888846561280
It was great to hear from students from @SVSU's Wolohan Fellowship program today. https://www.facebook.com/RepMoolenaar/posts/611047875696894 …pic.twitter.com/fcvasAb47I,2015-03-04 00:33:01,0,0,572917630161588224
"If you missed PM Netanyahu's speech, you can watch it here: http://www.c-span.org/video/?324609-2/israeli-prime-minister-benjamin-netanyahu-address-congress … You can read a transcript here: https://www.weeklystandard.com/blogs/transcript-netanyahus-address-congress_873668.html?nopager=1 …",2015-03-03 17:28:22,0,0,572810762328133633
PM Netanyahu's speech was a clear and stirring reminder of the threats Israel faces. The U.S. must stand with Israel.pic.twitter.com/VyTGMEWhnL,2015-03-03 17:09:46,3,0,572806081027694594
Reminder: Prime Minister Netanyahu is addressing Congress this morning. You can watch the speech here:http://www.speaker.gov/live ,2015-03-03 15:58:38,0,0,572788181067816963
"The Midland office is experiencing phone difficulties. If you need assistance, please call the Washington, D.C. office at 202-225-3561.",2015-03-03 14:14:33,0,0,572761986011959296
I look forward to attending PM Netanyahu's speech tomorrow. Israel is a great U.S. ally. https://www.facebook.com/RepMoolenaar/posts/610665542401794 …pic.twitter.com/PMX8LFY795,2015-03-03 01:20:47,1,1,572567262198149120
"This afternoon, @RepHuizenga and I met with college students from Michigan. Thanks for stopping by the Capitol today.pic.twitter.com/VI7qjMfMmQ",2015-02-27 23:09:41,0,0,571447105061048322
"Today, I signed a letter to the ATF objecting to the proposed AR-15 ammo ban. https://www.facebook.com/RepMoolenaar/photos/a.587618808039801.1073741833.572656369536045/609305039204511/?type=1 …pic.twitter.com/6ak3nadLzG",2015-02-27 21:27:34,7,11,571421407877459969
Great to see GLL players make it. MT @greatlakesloons Julio Urias ('13) as the next #MLB international star? Story:http://foxs.pt/18rxLDo ,2015-02-27 15:43:07,1,0,571334723231997952
"It's been a busy week. MT @saginawnews Rep. John Moolenaar on net neutrality, Keystone XL veto, college savings planshttp://bit.ly/1BHbAFZ ",2015-02-27 15:32:57,0,0,571332162416451584
"This month is Black History Month, and one American to remember is Rosa Parks. Read more: https://www.facebook.com/RepMoolenaar/posts/608844249250590 …pic.twitter.com/w23ftHPWt5",2015-02-27 15:15:51,0,0,571327859089928195
Glad to join with @CandiceMiller and MI members in co-sponsoring a bipartisan bill to protect the Great Lakes. https://www.facebook.com/RepMoolenaar/posts/608770262591322 …,2015-02-26 21:16:13,1,0,571056162868744192
"Today, the House passed legislation to strengthen savings plans that allow American families to save for college.pic.twitter.com/URFds1OtZy",2015-02-25 22:16:04,1,0,570708837126287361
"Today, the House passed @HouseScience's STEM Education Act, 412-8. Yesterday, I spoke on the floor about the bill. https://www.facebook.com/video.php?v=607888722679476 …",2015-02-25 19:32:49,1,0,570667755030126593
"Today, the House will vote to expand, modernize and strengthen 529 college savings plans.pic.twitter.com/JiduLK5JdN",2015-02-25 16:01:09,1,0,570614485351837697
STEM will help students pursue future opportunities. Glad H.R. 1020 has bipartisan @HouseScience Committee support. https://www.facebook.com/video.php?v=607888722679476 …,2015-02-24 23:05:47,2,2,570358959485222912
Sincere thank-you to @LamarSmithTX21 for granting floor time to speak on the STEM Education Act of 2015. https://www.facebook.com/video.php?v=607888722679476 …,2015-02-24 22:57:59,1,0,570356996844580864
Disappointed to hear that President Obama has vetoed the bipartisan Keystone Pipeline bill that supports jobs and improves energy security.,2015-02-24 20:37:13,0,1,570321572302622721
"Today, I met with constituents who are members of the @AmericanLegion. It was an honor. https://www.facebook.com/RepMoolenaar/photos/a.587618808039801.1073741833.572656369536045/607847099350305/?type=1 …pic.twitter.com/4SaN527Yho",2015-02-24 20:27:38,1,1,570319161244721152
#KeystoneXL pipeline heading to #POTUS desk today. It's time to approve this critical infrastructure project.pic.twitter.com/RpkS89U7g9,2015-02-24 15:35:29,0,0,570245639143100416
"Tomorrow night at 7:30, I will be on @WCMUTV's Capitol Report with David Nicholas. Tune in. https://www.facebook.com/RepMoolenaar/posts/607296589405356 …pic.twitter.com/9UBXwcfiIs",2015-02-23 21:00:04,1,1,569964932671918081
"This month is Black History Month, and one American to remember is Frederick Douglass. https://www.facebook.com/RepMoolenaar/photos/a.587618808039801.1073741833.572656369536045/607272789407736/?type=1 …pic.twitter.com/x03CMDSMc1",2015-02-23 20:09:35,1,1,569952228586479616
"Thanks for the interview last week. MT @saginawnews @RepMoolenaar weighs in on ISIS, drones, federal budgethttp://bit.ly/1w2qj6C ",2015-02-23 15:09:24,0,0,569876685853761536
"It's been a frigid week in MI, so I am glad to see that spring training has started. RT @tigers #BaseballIsBack!pic.twitter.com/LUwqotZrQO",2015-02-20 21:21:35,4,1,568883186161360897
"Yesterday, I visited AAR Mobility in Cadillac. Read the @CadillacNews story on the visit. http://www.cadillacnews.com/news_story/?story_id=1824943&year=2015&issue=20150220 …pic.twitter.com/TNucP0ie2R",2015-02-20 21:18:36,0,0,568882433128574977
I've had a great week traveling around the district and meeting with constituents. Check out the photo album. https://www.facebook.com/RepMoolenaar/timeline/story?ut=43&wstart=0&wend=1425196799&hash=944536514426659657&pagefilter=3 …,2015-02-19 21:06:11,0,2,568516922700009472
"It was great to speak with @arguspress yesterday. If you're a subscriber, you can log-in and read the article. http://www.argus-press.com/news/community/shiawassee_area/article_57628b9e-b850-11e4-933d-ebb9b69c061b.html …",2015-02-19 17:08:39,0,0,568457144665829376
RT @4geeman My colleagues @AARCORP Mobility Systems in Cadillac are amped-up 2 host @RepMoolenaar in a little bit.pic.twitter.com/vVUkuFLSg3,2015-02-19 15:21:25,1,1,568430160854298624
"Yesterday, I talked with @MTowerSaginaw & @MLive about my first six weeks working for you in Congress.http://www.mlive.com/news/saginaw/index.ssf/2015/02/qa_us_rep_john_moolenaar_on_hi.html …",2015-02-19 14:49:24,0,0,568422101914427393
Thanks for having me. RT @arguspress Rep. John Moolenaar stopped by  today to reflect on his first six weeks in... http://fb.me/3xYp7csOp ,2015-02-18 17:20:52,0,0,568097833850695680
"Next week, constituent relations representatives will hold office hours in Gratiot County and Isabella County. https://www.facebook.com/RepMoolenaar/posts/602349116566770 …",2015-02-13 21:06:10,0,2,566342590954754050
"Today, the House passed the Small Business Tax Relief Act. Read more about it here: https://www.facebook.com/RepMoolenaar/photos/a.587618808039801.1073741833.572656369536045/602259929909022/?type=1 …",2015-02-13 17:34:18,0,0,566289274560335873
It was great to meet with former Rep. Dale Kildee and Michigan students in my office today in Washington. https://www.facebook.com/RepMoolenaar/posts/601792009955814 …,2015-02-12 20:36:14,0,0,565972669116731392
Abraham Lincoln was born on this day 206 years ago. His steadfast faith and leadership saved the United States.pic.twitter.com/DfvpHRsALs,2015-02-12 17:10:02,1,0,565920778588536834
"Tonight, I presided over the last vote in the House. It's an honor to serve the people of Michigan's 4th District. https://www.facebook.com/video.php?v=601422413326107 …",2015-02-11 23:34:50,1,0,565655227324706817
"I am presiding over House proceedings right now. Tune into C-SPAN now, or watch online here: http://houselive.gov/ ",2015-02-11 22:21:23,1,0,565636745111560193
"Today, I spoke on the Floor in support of Keystone XL. It's #TimeToBuild the pipeline. https://www.facebook.com/video.php?v=601388459996169 …pic.twitter.com/LJAqCADSQU",2015-02-11 21:38:16,0,0,565625893490806787
Thank you for following me on Twitter. You can also subscribe to my newsletter for updates. https://moolenaar.house.gov/contact/newsletter …pic.twitter.com/iElu0vraWD,2015-02-09 20:35:43,0,0,564885377312620545
"Next Friday, constituent relations representatives will be holding office hours in Saginaw and Mecosta counties. https://www.facebook.com/RepMoolenaar/posts/598618790273136 …",2015-02-06 21:10:40,0,1,563807007606857729
"On Thursday, constituent relations staff will be holding office hours in Osceola, Gladwin, and Clare counties. https://www.facebook.com/RepMoolenaar/posts/598618790273136 …",2015-02-06 21:09:15,0,1,563806652940713985
Saddened to hear about the passing of @RepAlanNunnelee. My prayers go out to his family.,2015-02-06 19:02:35,1,0,563774773667586048
#RonaldReagan would have been 104 today. The Great Communicator was a true statesman. https://www.facebook.com/RepMoolenaar/photos/a.587618808039801.1073741833.572656369536045/598525690282446/?type=1 …pic.twitter.com/fD8aLFk53M,2015-02-06 16:51:51,0,0,563741876613029888
"Update: Here's video of my exchange with Budget Director @ShaunOMB, about funding for protecting the Great Lakes. https://www.facebook.com/RepMoolenaar/posts/598155940319421 …",2015-02-05 22:42:50,0,0,563467816041713665
"Yesterday, I spoke to @9and10News about the federal budget. You can watch the report here:http://www.9and10news.com/story/28027325/rep-john-moolenaar-expresses-concern-over-presidents-proposed-budget …",2015-02-05 13:57:22,1,1,563335578109112320
The House Budget Committee is hearing from the president's budget director this morning. You can watch here: https://www.congress.gov/committees/video/house-budget/hsbu00 …,2015-02-04 15:36:39,1,0,562998175758569479
"I was honored to meet with Maj. Gen. Gwendolyn Bingham, the leader of @USArmyTACOMLCMC. https://www.facebook.com/RepMoolenaar/posts/597618643706484 …pic.twitter.com/Ygglq1QmX3",2015-02-04 15:31:49,0,0,562996959318126593
"Today, the House voted to repeal the unaffordable Affordable Care Act, 239-186. You can watch my speech here: https://www.facebook.com/RepMoolenaar/posts/597262930408722 …",2015-02-03 23:42:26,0,0,562758036830572545
"Reminder: Office hours will be held on Thursday and Friday, in Shiawassee, Clinton, and Montcalm counties. https://www.facebook.com/RepMoolenaar/posts/597323407069341 …",2015-02-03 23:39:19,0,1,562757252910940160
"Today, I spoke during the debate over repealing the unaffordable Affordable Care Act.https://www.youtube.com/watch?v=a0D4m7l0C18 …",2015-02-03 20:12:40,0,1,562705249161723904
"This afternoon, I will speak during debate over repeal of the Affordable Care Act. You can watch the House live here: http://www.house.gov/content/features/story2/ …",2015-02-03 19:00:52,0,0,562687178535604224
"This month, office hours will be happening throughout the Fourth District. Click the link for dates and times. https://www.facebook.com/RepMoolenaar/posts/595404150594600 …",2015-02-03 01:35:13,0,0,562424034122813440
"It's disappointing to see that the president's budget increases the debt, and spends more money we don't have. https://www.facebook.com/RepMoolenaar/posts/596934663774882 …",2015-02-03 01:32:34,0,2,562423365961789440
"This week, I spoke to @agripulse for its “Meet the Lawmaker” series. You can watch the interview here: https://www.facebook.com/RepMoolenaar/posts/595356717266010 …",2015-01-30 17:03:05,0,1,561207987927547904
"I will be on the @HouseAgNews Subcommittee on Nutrition, and the Subcommittee on Biotech, Horticulture, & Research. https://www.facebook.com/RepMoolenaar/photos/a.587618808039801.1073741833.572656369536045/594501634018185/?type=1 …",2015-01-28 18:57:58,2,2,560512122812387331
"Yesterday, I heard from the CBO about the long-term issues in the federal budget. https://www.facebook.com/RepMoolenaar/posts/594488890686126 …pic.twitter.com/SaD3dkMG4k",2015-01-28 18:03:43,0,1,560498469983772672
"Today, at my first hearing as Vice Chair of the Research & Technology Subcommittee, we heard about cyber threats. https://www.facebook.com/RepMoolenaar/photos/a.587618808039801.1073741833.572656369536045/594167327384949/?type=1 …",2015-01-27 22:39:23,1,1,560205454325067777
"Today, we remember the anniversary of the liberation of Auschwitz on #HolocaustMemorialDay.pic.twitter.com/MeOfvr9HH9",2015-01-27 19:56:24,0,0,560164439736217600
It's great to see Owosso make the list of best places in the Midwest to start a small business.http://www.mlive.com/news/flint/index.ssf/2015/01/report_names_owosso_in_top_10.html …,2015-01-27 15:28:49,0,0,560097099145302017
"On this day in 1837, Michigan became the 26th state admitted to the Union. #PureMichiganpic.twitter.com/bNX0muqNJw",2015-01-27 00:15:54,3,2,559867357041283072
"Today, I voted in support of H.R. 7, the No Taxpayer Funding for Abortion Act. https://www.facebook.com/RepMoolenaar/posts/591947210940294 …pic.twitter.com/UbXTo1BjBq",2015-01-22 23:28:04,2,0,558405766286422016
"Tonight, President Obama proposed more tax hikes, but Americans can't afford a big-government agenda. https://www.facebook.com/RepMoolenaar/photos/a.587618808039801.1073741833.572656369536045/590908741044141/?type=1 …",2015-01-21 05:39:25,1,1,557774446451523584
It was great to speak with @RickAlbinWoodTV before tonight's #SOTU speech. #AmericasNewCongresspic.twitter.com/BmRlR4fYx1,2015-01-20 23:07:15,2,1,557675753639534593
"Today, we honor Martin Luther King Jr. and his legacy of fighting for civil rights. #MLKDay https://www.facebook.com/RepMoolenaar/photos/a.582732358528446.1073741832.572656369536045/590124207789261/?type=1 …pic.twitter.com/FajmlETGI9",2015-01-19 18:31:48,1,0,557244045274390529
"Today, I voted to block funding for President Obama’s unconstitutional amnesty programs. https://www.facebook.com/RepMoolenaar/photos/a.587618808039801.1073741833.572656369536045/587957294672619/?type=1 …pic.twitter.com/a9ekArY0dX",2015-01-14 19:20:54,1,6,555444462676344832
"Regulations cost households $15,000 a year. I voted for HR 185 to increase accountability. https://www.facebook.com/RepMoolenaar/photos/a.587618808039801.1073741833.572656369536045/587617991373216/?type=1 …pic.twitter.com/R9SoDifMTD",2015-01-13 23:14:35,0,1,555140883285557249
"This morning, I will participate in reading the Constitution on the House floor. Watch: http://houselive.gov/ pic.twitter.com/B7Ogidgcfr",2015-01-09 14:08:16,2,1,553553849496387584
Representative Moolenaar just took the oath of office and is excited to begin representing Michigan's Fourth Congressional District.,2015-01-06 19:28:58,1,0,552547392814579713
