Text,Date,Favorites,Retweets,Tweet ID
"Initially, it was supposed to be anytime, anywhere inspections. Now, Iran can delay an inspection up to 24 days.http://www.ourmidland.com/news/moolenaar-opposes-iran-nuclear-deal-now-before-congress/article_a4c59faf-dcd0-5b8e-a33d-3548412e8048.html …",2015-08-19 18:46:25,1,1,634073952458027010
"Today in the @MDN, I talk about my opposition to the Iran deal. http://www.ourmidland.com/news/moolenaar-opposes-iran-nuclear-deal-now-before-congress/article_a4c59faf-dcd0-5b8e-a33d-3548412e8048.html …",2015-08-19 18:44:46,1,2,634073535485452293
Thanks for having me!https://twitter.com/MidlandMIChmber/status/633679014473924608 …,2015-08-18 17:22:18,1,0,633690396208574464
Wonderful news! Congratulations!https://twitter.com/SpeakerBoehner/status/631895786306052096 …,2015-08-13 19:47:36,1,2,631915024311812097
The EPA should not make electricity and everyday products more expensive and should withdraw this new rule.,2015-08-04 21:38:14,0,0,628681374476730368
Americans have seen their wages stagnate and rules like this one increase their electric bills and the cost of everyday products.,2015-08-04 21:37:35,0,1,628681210538160128
Americans are already making smart environmental choices and don’t need the EPA making new rules for their lives.,2015-08-04 21:36:42,1,2,628680986340016128
"Yesterday, President Obama introduced new EPA regulations for electricity plants across the U.S. This rule will increase electricity bills.",2015-08-04 21:36:27,0,0,628680924713119744
"Michigan farms use technology to produce more food than ever before, keeping it safe and affordable.http://www.detroitnews.com/story/opinion/2015/07/30/moolenaar-gmos-demand-food-transparency/30841467/ …",2015-07-30 21:56:37,0,0,626874059725373440
Read my op-ed in the @detroitnews and @DetNewsOpinion on the Safe and Accurate Food Labeling Act: http://www.detroitnews.com/story/opinion/2015/07/30/moolenaar-gmos-demand-food-transparency/30841467/ …,2015-07-30 21:55:37,0,1,626873807718977536
"Michigan family farms use technology to produce more food than ever before, keeping it safe and affordable. http://www.detroitnews.com/story/opinion/2015/07/30/moolenaar-gmos-demand-food-transparency/30841467/ …",2015-07-30 15:01:52,1,1,626769687448289280
"This morning in @DetNewsOpinion, read my op-ed on the Safe and Accurate Food Labeling Act: http://www.detroitnews.com/story/opinion/2015/07/30/moolenaar-gmos-demand-food-transparency/30841467/ …",2015-07-30 15:01:19,0,1,626769547589255168
"With the VA Accountability Act, the VA will have the tools to hold employees accountable and care for our heroes!pic.twitter.com/JovaBMLaaq",2015-07-29 22:22:07,0,0,626518088469618688
This bill is about better care. Accountability for bad employees means more money for veterans. #VAaccountabilitypic.twitter.com/A2OChb04ha,2015-07-29 22:17:29,3,2,626516925997273089
I voted for the VA Accountability Act to hold the VA accountable for its failures & to improve care for veterans!pic.twitter.com/ollOUGGj1E,2015-07-29 22:12:50,1,0,626515754800816132
I believe our veterans deserve the best care and the VA Accountability Act holds the VA accountable for its failures.pic.twitter.com/b97rzp2Zg7,2015-07-29 22:11:51,0,0,626515505944338437
A great way to get assistance if you need help with a federal agency. No appointment necessary.https://twitter.com/mlive_lansing/status/626422939483635712 …,2015-07-29 16:15:37,0,2,626425858044096512
"If you're in the Cadillac area, you can read my op-ed on food labeling in today's edition of the @CadillacNews.",2015-07-28 19:18:03,0,0,626109381101395968
Thank you to @MDN for running my op-ed about the Safe and Accurate Food Labeling Act of 2015.http://www.ourmidland.com/opinion/editorials/new-transparency-for-food/article_7a93dcf2-4cf5-560d-b76e-d1ee926ee134.html …,2015-07-27 21:42:41,0,0,625783392232210436
More than 1200 people have already answered my survey on the #IranDeal. Add your opinion: https://moolenaar.house.gov/iransurvey pic.twitter.com/SGd1awWHI2,2015-07-24 21:03:16,0,0,624686306619228160
The four brave Marines who were killed gave their lives in service to our nation and its ideals. We are forever grateful for their service.,2015-07-16 21:36:55,1,0,621795671658622976
My prayers are with the families and friends of those who were killed and injured in the attack in Chattanooga today.,2015-07-16 21:36:25,0,1,621795548895571969
"This week, the House passed the Steve Gleason Act! It's great legislation that helps those with ALS. #NoWhiteFlagspic.twitter.com/DTHGB4qP6U",2015-07-16 20:00:22,0,0,621771375246639104
#Cures2015 will allow medicines to advance more quickly from the research lab to the patients who need them.pic.twitter.com/yIKx02QZVp,2015-07-10 16:30:28,1,0,619544226804695040
"Today, I voted for the 21st Century Cures Act to modernize medical research! It passed 344-77!pic.twitter.com/3A7fNvxsAR",2015-07-10 16:22:39,2,0,619542256991797248
"Including Blake Groulx, the Fourth District winner from Midland!https://twitter.com/conginst/status/619510362224857089 …",2015-07-10 16:15:10,1,0,619540373539561472
Thanks to @HouseScience for its work in preparing for yesterday's hearing with @GinaEPA. Here's what I asked her: https://www.facebook.com/RepMoolenaar/videos/676191042515910/ …,2015-07-10 13:53:09,0,0,619504636110708736
"The EPA's Waters of the U.S. rule is unclear, so I asked @GinaEPA about how it would apply to farm ditches. https://www.facebook.com/RepMoolenaar/videos/676191042515910/ …",2015-07-10 13:00:06,0,0,619491285439787008
The Veterans ID Card Act of 2015 has passed the House and Senate & now goes to the president. http://www.militarytimes.com/story/military/benefits/veterans/2015/07/08/id-cards-veterans/29852467/ …pic.twitter.com/Yb3VqYvevo,2015-07-08 14:44:19,0,0,618792735206711296
"Yesterday, the House unanimously passed a law that will let veterans leave their DD-214 forms at home. http://www.militarytimes.com/story/military/benefits/veterans/2015/07/08/id-cards-veterans/29852467/ … @MIVeteran",2015-07-08 14:41:32,1,2,618792036737658880
Thanks for having me on Friday!https://twitter.com/kstew_edu/status/612053745053106176 …,2015-06-22 20:37:08,1,3,613083319861932032
"Back home in Michigan, Amir’s father is gravely ill. He deserves to see his son again. Iran must #FreeAmirNow.pic.twitter.com/vJSkvvre20",2015-06-15 23:20:59,10,25,610587838296518660
Iran must also provide the United States with all the information it has on other Americans who have gone missing in Iran. #FreeAmirNow,2015-06-15 23:19:30,1,4,610587463422185472
"Today, the House unanamiously passed House Resolution 233 calling on Iran to #FreeAmirNow and other American prisoners.",2015-06-15 23:19:17,2,7,610587408569077761
Amir is a MI resident & he served our country as a Marine. Iran has imprisoned him since August of 2011. #FreeAmirNowpic.twitter.com/ONGnV4dpiE,2015-06-15 23:17:03,15,30,610586847291539458
"I was honored to meet her and to introduce her to other representatives, including @GOPLeader, during her time in Washington. #FreeAmirNow",2015-06-15 23:12:55,2,5,610585807494246400
"In April, @RepDanKildee introduced me to Amir Hekmati’s sister, Sarah, & I heard Amir’s inspiring story. #FreeAmirNowpic.twitter.com/ueDQBMZ2ik",2015-06-15 23:12:01,8,11,610585580926279680
It was wonderful to see your group. Thanks for stopping by!https://twitter.com/dynaracer33/status/609325313210884096 …,2015-06-12 19:43:27,4,2,609445929519857664
It was great to raise money for charity and build relationships with other members of Congress at the game. https://soundcloud.com/mibigshow/dan-kildee-us-congressman-d-flint-and-john-moolenaar-us-congressman-r-midland?in=mibigshow/sets/friday-june-12-2015 …,2015-06-12 14:12:03,2,4,609362531493281792
"This morning, I was on the @mibigshow with @RepDanKildee to talk about last night's Congressional Baseball Game. https://soundcloud.com/mibigshow/dan-kildee-us-congressman-d-flint-and-john-moolenaar-us-congressman-r-midland?in=mibigshow/sets/friday-june-12-2015 …",2015-06-12 14:10:32,4,4,609362148796538880
"Yesterday, I spoke on the floor about HR 2393 to protect MI jobs. The bill passed 300-131. Watch my speech here: https://www.facebook.com/RepMoolenaar/videos/vb.572656369536045/663270227141325/?type=2&theater …",2015-06-11 14:06:25,1,0,608998725768343552
You can watch this report from @9and10News for more on the dedication of Veterans Memorial Park in Lake City:http://www.9and10news.com/story/29256858/missaukee-veterans-memorial-park-honors-thousands-of-vets …,2015-06-08 14:59:15,1,1,607924858605977600
"About 2,200 service members from Missaukee County have bravely served our country and they will always be remembered.pic.twitter.com/2NgOFjvDXt",2015-06-08 14:55:53,2,1,607924011096514560
The dedication of Missaukee County's Veterans Memorial Park in Lake City on Saturday was a great event.pic.twitter.com/JzQV6CUlsw,2015-06-08 14:53:31,1,1,607923416973385729
"I also met with Thomas Robbins (third from the left), a Delta Airlines pilot from Cadillac.pic.twitter.com/JHujOXz93z",2015-06-03 22:28:31,5,1,606225982014517248
"Today, I met Seth Lattimore, a cattle farmer from Mecosta County. Here's what we talked about:https://www.facebook.com/RepMoolenaar/photos/a.587618808039801.1073741833.572656369536045/659944450807236/?type=1 …pic.twitter.com/79l1W96v5o",2015-06-03 22:10:11,2,1,606221367827173377
Here are some more great pictures at the World War II Memorial from today's @MidMichhonfligh!https://twitter.com/NewsManBoyerEIC/status/605773366008541184 …,2015-06-02 21:41:28,2,2,605851753888620544
Proud to co-sponsor this legislation and glad to see it pass the Foreign Affairs Committee. #FreeAmirNowhttps://twitter.com/SpeakerBoehner/status/605838661842706433 …,2015-06-02 20:56:14,4,7,605840369096400896
It was a privilege to welcome today's @MidMichhonfligh to the World War II Memorial. God bless our veterans.pic.twitter.com/w0Azn8zdse,2015-06-02 19:53:02,3,1,605824465138679809
Here's a complete list of times and locations for June office hours across the Fourth District:https://moolenaar.house.gov/officehours ,2015-06-01 16:06:16,1,2,605405009619128320
Read the @bigrapidsnews article about my visit to @BatesFootwear's factory with @RepHuizenga:http://news.pioneergroup.com/bigrapidsnews/2015/05/28/congressmen-moolenaar-and-huizenga-visit-big-rapids-manufacturing-facility/ …,2015-06-01 13:18:42,1,3,605362836869627904
Thanks to @adorakn from @9and10News for interviewing me at Munson Hospital yesterday. Watch her report here:http://www.9and10news.com/story/29172535/local-congressman-visits-munson-mercy-hospital-cadillac …,2015-05-28 19:55:52,1,3,604013235906449408
Yesterday I was in Cadillac and toured the Munson Health Care Hospital. Read the story from the @CadillacNews: http://www.cadillacnews.com/news_story/?story_id=1827123&year=2015&issue=20150528 …,2015-05-28 19:53:12,0,0,604012567367819264
The EPA should focus on stopping invasive species in the GL and not burden Michigan farms & businesses with more costly regulations. #WOTUS,2015-05-27 20:25:16,2,1,603658249548779520
The EPA’s misplaced priorities on #WOTUS and not invasive species jeopardize Michigan’s tourism and fishing jobs.,2015-05-27 20:24:06,0,0,603657956807340032
"In February, the administration proposed cutting funding for protecting the Great Lakes from invasive species. #WOTUS",2015-05-27 20:23:46,0,0,603657870090084352
The Clean Water Act already protects the Great Lakes and the EPA needs to focus on stopping invasive species. #WOTUS,2015-05-27 20:23:23,0,1,603657774384427008
"I will continue fighting for the thousands of MI residents who farm, so they can work w/o being saddled by onerous gov’t rules. #WOTUS",2015-05-27 20:22:07,1,0,603657454199709696
The opposition to #WOTUS is bipartisan. Republicans and Democrats in the House voted against it earlier this month.,2015-05-27 20:21:36,0,0,603657325266771970
"When I hear from farmers, #WOTUS is one of their top concerns. They are worried about gov’t regulating mud puddles on their private land.",2015-05-27 20:20:57,0,0,603657160778743808
"Today, the Environmental Protection Agency announced its Waters of the United States (#WOTUS) rule.",2015-05-27 20:20:33,0,0,603657061579300864
It was great to meet @chefjoenader from the @Lions at today's House Subcommittee on Nutrition hearing!pic.twitter.com/lhgloUb83C,2015-05-20 23:13:49,3,4,601163951481745408
The #COMPETES Act also makes the National Science Foundation and its research grants more accountable to taxpayers: https://www.facebook.com/RepMoolenaar/videos/653000761501605/ …,2015-05-20 22:00:28,1,0,601145489124392961
"This afternoon, I spoke on the #COMPETES Act, which adds computer science to the definition of STEM education: https://www.facebook.com/RepMoolenaar/videos/653000761501605/ …",2015-05-20 21:59:31,0,1,601145251693273088
"We must make highway funding a higher priority, without raising taxes on hardworking Michigan families.pic.twitter.com/wmlX9b82a9",2015-05-19 21:51:12,0,0,600780770727370752
"Today, the House passed an extension of the Highway Trust Fund, 387-35.pic.twitter.com/AL0RfKWkP5",2015-05-19 21:50:04,0,1,600780484361203712
It is a cool name!https://twitter.com/sjorsmoolenaar/status/599259914943504384 …,2015-05-15 18:45:56,1,2,599284594647662592
It was great to have students from @FerrisState's School of Criminal Justice visit my office today. Go Bulldogs!pic.twitter.com/r6L8zBPjYk,2015-05-14 22:52:51,5,3,598984347765596160
#HR36 demands we all work harder to prepare safe outcomes for expectant mothers and their unborn children.#prolifepic.twitter.com/XGhBMSwfak,2015-05-13 21:42:12,1,3,598604178311766016
"#HR36, the Pain-Capable Unborn Child Protection Act, is supported by 60% of Americans, and 59% of women. #ProLifepic.twitter.com/m59mrvGS2X",2015-05-13 21:39:00,3,1,598603374624399360
#HR36 protects the most vulnerable in our country against a tragic end. #TheyFeelPain #ProLifepic.twitter.com/evwAX0Eui4,2015-05-13 21:37:25,3,1,598602974752014336
"Today, my colleagues and I in the House passed legislation to protect unborn children on a bipartisan vote, 242-184.pic.twitter.com/KkQsekBm6E",2015-05-13 21:36:11,2,1,598602665585696768
A child in a mother’s womb is a blessing and at 20 weeks an unborn child can feel pain.pic.twitter.com/xJAsXVMlhJ,2015-05-13 21:34:32,3,1,598602251792490496
"Today, the House opposed the EPA's plan to regulate mud puddles on farmer's fields. Here's more information: https://www.facebook.com/RepMoolenaar/photos/a.587618808039801.1073741833.572656369536045/649470261854655/?type=1&theater …",2015-05-13 00:20:47,2,2,598281699080929283
"Office hours will be held this week in Mecosta, Corunna, Gladwin, St. Johns, Stanton, Clare and Evart.https://moolenaar.house.gov/officehours ",2015-05-12 17:04:24,1,2,598171881112522752
Here's a list of May office hours. Residents can receive help on issues with fed. agencies: https://moolenaar.house.gov/officehours pic.twitter.com/ZAtvH1Lguv,2015-05-12 17:02:24,0,0,598171377011716096
I had a great time speaking to students in Frank Dame's government class at Ogemaw Heights High School.pic.twitter.com/PI3PmPrD6Z,2015-05-11 21:04:56,2,2,597870026998296576
Happy Mother's Day!pic.twitter.com/L5Z6uMTZJZ,2015-05-10 16:22:40,1,2,597436602785247234
@RepSinema Thank you!,2015-05-09 01:03:51,0,0,596842987356868608
@HouseAgNews Thank you!,2015-05-08 21:04:42,0,0,596782801715879938
@RepTomEmmer @HouseAgNews Thank you!,2015-05-08 21:03:05,0,0,596782395531141122
@SteveScalise Thank you!,2015-05-08 21:02:50,1,0,596782330875924481
"In honor of VE Day, a ceremony & flyover is happening on the National Mall now. Live video: http://events.dacast.com/?webcast_id=9 pic.twitter.com/zikeYaCyuL",2015-05-08 15:02:06,2,1,596691551268503552
"Today, I joined with residents in Owosso, and with millions across the U.S., to celebrate the #NationalDayofPrayer.pic.twitter.com/WPAwr7xERj",2015-05-07 17:31:04,4,5,596366654021447683
"Today, I toured businesses in Alma and Ithaca. More pictures and details here: https://www.facebook.com/RepMoolenaar/posts/647369182064763 …pic.twitter.com/CvSnA1P6CR",2015-05-06 22:04:45,0,0,596073139882348544
"If you're having problems with a federal agency, my staff is ready and able to assist you.http://www.mlive.com/news/saginaw/index.ssf/2015/05/us_rep_john_moolenaar_announce_1.html …",2015-05-06 18:37:54,1,0,596021083205144576
There were also three regional winners in this year's #MI04 art competition. You can read more about them here: https://www.facebook.com/RepMoolenaar/posts/646752628793085 …,2015-05-04 22:39:11,0,0,595357030195560448
Blake will receive two round trip tickets to Washington D.C. to see his art in the Capitol. The art will be displayed for one year.,2015-05-04 22:23:09,0,0,595352994671124482
"Congratulations to Blake Groulx of Midland H.S. for ""Portrait of Evie,"" his winning entry in this year's art contest!pic.twitter.com/bdrGT64bfv",2015-05-04 22:21:15,0,0,595352516222648321
It was great to speak with the Rotary Club today!https://twitter.com/tolver/status/595283720069873665 …,2015-05-04 18:51:46,1,0,595299798997213184
I hope everyone is alright after the earthquake that was felt by many in mid and northern Michigan.https://twitter.com/breakingweather/status/594552541360291841 …,2015-05-02 17:38:24,0,0,594556558555664384
It was great to see students from Frankenmuth's Rittmueller Middle School in Washington today! Ken Horn was here too!pic.twitter.com/J39U8HW9oT,2015-05-01 18:47:42,3,0,594211608756428800
I will be a co-sponsor for @RepDanKildee's resolution calling on Iran to #FreeAmirNow! https://www.congress.gov/bill/114th-congress/house-resolution/233/text?q=%7B%22search%22%3A%5B%22233%22%5D%7D …pic.twitter.com/U8c3UIJ6ui,2015-04-30 19:21:27,25,31,593857717632106496
"Amir Hekmati's sister, Sarah, @RepDanKildee and @Montel_Williams shared his story with me today. #FreeAmirNowpic.twitter.com/dD89nIdN1B",2015-04-30 19:17:50,35,44,593856806633472000
"Amir Hekmati of Flint is being held prisoner in Iran. Today, his sister Sarah, @RepDanKildee & @Montel_Williams shared his inspiring story.",2015-04-30 19:15:52,10,24,593856312280293376
The #balancedbudget up for debate today doesn't raise taxes & calls for reform. More info in my @HouseGOP blog post:http://gop.gov/a-balanced-budget-for-a-stronger-america/ …,2015-04-30 16:48:19,4,7,593819179968548865
House @NASA bill supports only government agency responsible for space exploration #SupportSpace http://ow.ly/MhG3J ,2015-04-30 16:25:15,0,0,593813372455538688
Watch now as my colleagues and I on @HouseScience consider House @NASA bill #SupportSciencehttp://ow.ly/MhDix ,2015-04-30 16:23:37,0,1,593812964265844736
STEM degrees are great preparation for any field!https://twitter.com/NASAWatch/status/593804417058615296 …,2015-04-30 16:08:00,0,0,593809031136976897
The budget reported by my colleagues & I on the conference committee balances w/in 10 years. https://www.facebook.com/RepMoolenaar/photos/a.587618808039801.1073741833.572656369536045/644270292374652/?type=1 …pic.twitter.com/amaAfkazLh,2015-04-29 20:22:12,0,0,593510615785680896
"Today, the House & Senate Budget Conference Committee reported a unified budget. Learn more: https://www.facebook.com/RepMoolenaar/photos/a.587618808039801.1073741833.572656369536045/644270292374652/?type=1 …pic.twitter.com/on6DBt2m8u",2015-04-29 20:20:25,1,0,593510167263596545
This morning I met with members of the @msasnow. It was great to hear from them about their concerns.pic.twitter.com/tRJ3Tgi2y7,2015-04-21 22:16:16,0,0,590640217494790145
"ICYMI yesterday, here are my remarks to the House and Senate Budget Conference Committeehttps://www.youtube.com/watch?v=Af12n75mPLw …",2015-04-21 22:14:56,0,1,590639883359752193
My chance to speak at the House & Senate Budget Conference Committee is scheduled to come up soon.You can watch here: http://www.c-span.org/video/?325466-1/bicameral-fiscal-year-2016-budget-resolution-conference-committee&live …,2015-04-20 20:15:29,0,0,590247437375295488
The House and Senate Budget conference meeting on the 2016 federal budget is underway. See it on C-SPAN: http://www.c-span.org/video/?325466-1/bicameral-fiscal-year-2016-budget-resolution-conference-committee&live …,2015-04-20 19:33:29,1,0,590236863916593153
Repeal of the #DeathTax will allow families to pass their farms to their children w/o worrying about an extra tax.pic.twitter.com/59HXXezzCN,2015-04-16 22:36:10,4,1,588833289475125248
"For many in my district, the American Dream is the chance to pass the family farm on to sons and daughters.pic.twitter.com/O0CWh9aMks",2015-04-16 22:34:18,1,0,588832818861596674
"Today, the House passed a repeal of the #DeathTax. This will help more Americans realize the American Dream.pic.twitter.com/0dBeZn448Z",2015-04-16 22:31:49,0,0,588832191242723328
"President Abraham Lincoln is my favorite president. Yesterday, I spoke on the floor about his legacy.https://www.youtube.com/watch?v=dBlJT-olXHk&feature=youtu.be …",2015-04-15 19:28:48,1,0,588423749441101825
The tax code is too long and complex. This leads to abuse. The IRS paid $5.8 billion in fraudulent returns. #TaxDaypic.twitter.com/MFaham1Jnr,2015-04-15 14:54:54,1,4,588354818680483840
"Gov't needs to be accountable. Employees at the Post Office, HHS and the VA owe millions in unpaid taxes. #TaxDaypic.twitter.com/OzZAhsRVhy",2015-04-15 14:41:21,1,3,588351406727376896
"#TaxDay Federal employees owe over $2.5 billion in unpaid taxes, while being paid by taxpayers. For example, the EPA:pic.twitter.com/hogF1xMyi8",2015-04-15 14:36:10,0,0,588350105335549953
Today is #TaxDay and House Republicans will be working on bills to hold government accountable to taxpayers.pic.twitter.com/VMOhJ8Xvnx,2015-04-15 14:34:49,0,0,588349764586078208
I look forward to working on the House and Senate Budget Conference Committee to pass a #BetterBudget:https://moolenaar.house.gov/media-center/press-releases/moolenaar-named-budget-conference-committee …,2015-04-15 13:14:16,0,1,588329494383067136
"I look forward to working on the House-Senate #Budget Conference Committee with @RepTomPrice, @MarioDB, @ToddRokita & @RepDianeBlack.",2015-04-14 23:00:14,0,0,588114569723322368
April 17 is the deadline for entries in the Fourth District's Congressional Art Competition: https://www.facebook.com/RepMoolenaar/posts/635173016617713 …pic.twitter.com/FCvBlXQIIa,2015-04-13 22:42:29,0,0,587747713598513154
"150 years ago today, Lee surrendered to Grant at Appomattox ending the Civil War. A great day in American history!pic.twitter.com/HDvn6kZiGF",2015-04-09 13:57:07,0,0,586165951307067392
"There was a power outage, but we still had a great event in Cadillac yesterday. @minews26 reports:http://www.minews26.com/content/?p=37806 …",2015-04-08 14:20:02,1,0,585809328776605696
Tune in to MI News 26 tonight for their report on my visit to Cadillac this morning.https://twitter.com/minews26/status/585514407863648256 …,2015-04-07 20:33:25,0,0,585540904859086850
We still had a great event. Thanks to everyone who attended!https://twitter.com/26EricWotila/status/585453612882530308 …,2015-04-07 20:31:56,0,0,585540533814177794
It's great to have baseball back. Good luck to the Tigers on #OpeningDay! Bring home the World Series title!pic.twitter.com/FD6kb7plih,2015-04-06 14:35:19,2,0,585088401348632577
Reminder: The deadline for the Congressional Art Competition is April 17. More information here: https://www.facebook.com/RepMoolenaar/photos/a.587618808039801.1073741833.572656369536045/629856517149363/?type=1 …,2015-04-02 20:06:43,0,0,583722246390296576
I was on the @mibigshow this morning. Have a listen here: https://www.facebook.com/video.php?v=628521840616164&set=vb.572656369536045&type=2&theater …,2015-03-30 17:48:05,1,0,582600195713736704
We passed a budget this week. Read about it in my op-ed in the @detroitnews:http://www.detroitnews.com/story/opinion/2015/03/27/moolenaar-gop-budget-balance/70501774/ …,2015-03-27 13:08:20,0,0,581442629633724416
"RT if you think the EPA should release the 6,000 texts the #EPA Administrator sent on her government cell phone! http://ow.ly/KQKmF ",2015-03-26 20:20:04,0,2,581188894038859777
The SGR fix gives doctors in the Fourth District certainty over the costs of treating Medicare patients. #docfixpic.twitter.com/eDJsgpeQia,2015-03-26 16:10:49,0,0,581126167257812992
"Fixing the SGR provides health care access for the Fourth District's 130,000 Medicare-eligible individuals.pic.twitter.com/BcTzAFoQIs",2015-03-26 16:09:35,0,1,581125857315594240
In an overwhelming 392 -37 bipartisan vote the House passed a permanent fix for Medicare’s SGR.pic.twitter.com/NVuZhVdPog,2015-03-26 16:08:56,1,1,581125690633904130
I am at the @HouseScience subcommittee hearing on the EPA's destruction of text messages. You can watch here:http://www.ustream.tv/channel/hclive10 …,2015-03-26 14:47:05,0,3,581105095414308864
"This morning, @HouseScience will be holding a hearing on the destruction of records at the EPA. http://science.house.gov/hearing/joint-subcommittee-oversight-and-subcommittee-environment-hearing-destruction-records-epa …",2015-03-26 12:59:33,0,0,581078031348985857
"The budget passed tonight also calls for a simpler, fairer tax code that promotes a better economy.pic.twitter.com/S4lbFnlcLZ",2015-03-25 23:11:32,0,1,580869657109880832
The budget passed tonight allows states to adapt federal programs to their needs. States know best. #BetterBudgetpic.twitter.com/BCu9aqx4G4,2015-03-25 23:10:22,0,1,580869360622927873
I voted for the House budget resolution tonight. The budget balances within 10 years w/o raising taxes. #BetterBudgetpic.twitter.com/2kOJmZ7lM6,2015-03-25 23:07:57,0,0,580868755271630848
