Text,Date,Favorites,Retweets,Tweet ID
This is something concrete Congress can do to help #Flint move forward with its healing.https://twitter.com/Kyle_Feldscher/status/781240744094892032 …,2016-09-28 21:20:11,6,3,781242122934575104
My amendment with @RepDanKildee for #Flint is on the floor now. I will be speaking soon. http://www.house.gov/content/features/story2/ …,2016-09-28 20:57:22,2,3,781236379070193664
It passed Rules tonight. Glad to work on this with @RepDanKildee and House leadership. This will help Flint rebuild its infrastructure.https://twitter.com/fischlerCQ/status/780967980406571009 …,2016-09-28 04:16:02,40,21,780984385034223617
This bipartisan amendment is a step forward for Flint and its future. Glad to work on it with @RepDanKildee and House leadership.https://twitter.com/TiffanyStecker/status/780967622963716096 …,2016-09-28 04:13:21,3,2,780983711684825088
Glad to work on this amendment with @RepDanKildee and House leadership. The amendment is a step forward for Flint and its future.https://twitter.com/kelmej/status/780969983362863104 …,2016-09-28 04:04:53,2,3,780981580328296448
Congratulations to the @greatlakesloons on winning the Midwest League Championship!https://twitter.com/greatlakesloons/status/777623810786942976 …,2016-09-19 15:06:49,6,1,777886669244624896
It was a great event in Elsie today. Thank you to these brave men for their service to our country!pic.twitter.com/O2hNkH1Rsv,2016-09-17 21:47:02,2,1,777262614095208448
Honored to present the Vietnam War 50th Anniversary Commemorative Lapel Pin to a group of veterans in Elsie.pic.twitter.com/JYMauaFCrc,2016-09-17 21:46:28,4,1,777262472671690752
Thank you! It was great to meet with you.https://twitter.com/ACSCANMichigan/status/775749895936434176 …,2016-09-13 17:42:16,3,1,775751464929128448
I am saddened by the death of State Representative Peter Pettalia. He was a great friend and colleague.pic.twitter.com/xWKTnvPVWH,2016-09-13 03:01:18,4,4,775529762840272897
This morning I joined my colleagues to commemorate the 15th anniversary of 9-11. We will never forget that day.https://twitter.com/uscapitol/status/774285027588866048 …,2016-09-09 16:44:00,5,1,774287251526254593
Office hours will be happening in the district throughout September. A great way to get help with a federal agency:https://moolenaar.house.gov/officehours ,2016-09-06 18:31:34,0,0,773227156109484032
"I am having a listening session on Thursday in Cadillac.

10:30-11:30 AM
Suite 301 
201 North Mitchell Street 
Cadillac, MI 49601",2016-08-23 16:35:42,1,0,768124568871534593
I welcome the decision by @USDA to fund greater nutrition access for #Flint students. My statement:pic.twitter.com/gm3JGZxvU4,2016-08-10 21:43:19,0,1,763490938878558208
Great to meet you yesterday! Thank you for hosting the Roscommon listening session at the library. https://twitter.com/caseyadams360/status/763145309140639744 …,2016-08-10 21:38:28,1,0,763489719170764806
Good to see you! Thanks for coming out to the listening session.https://twitter.com/DanJenDig/status/763127830465085441 …,2016-08-10 14:07:53,4,1,763376325830832128
"I am hosting listening sessions this week in Roscommon, Clare, Freeland and Owosso. More details available here: https://www.facebook.com/RepMoolenaar/posts/858966387571707 …",2016-08-08 16:04:05,1,0,762680794313854977
Thank-you to everyone who came out. We had a great conversation.https://twitter.com/elisabethwaldon/status/761618974337593344 …,2016-08-05 18:37:09,1,1,761632147446853632
I also met with the Friends Committee on National Legislation yesterday.pic.twitter.com/8sQDVuX5Bq,2016-07-27 19:33:14,0,0,758384774130110464
"@mckinneykelsey @elisabethwaldon Previous tweet was wrongly sent, does not represent his views & was immediately deleted. Sincere apologies.",2016-07-27 19:06:20,0,1,758378003537821696
"Great meetings with constituents in the district this week. Yesterday, I met with AARP members.pic.twitter.com/DPSJ0hYKMf",2016-07-27 18:52:16,1,0,758374464119836672
Prayers for the family & friends of Congressman Takai. May he rest in peace.https://twitter.com/ABCPolitics/status/755849295794843652 …,2016-07-20 20:51:24,2,1,755867730276868096
"The Moving Wall, a half-size replica of the @VVMF, is in Sanford the next four days. Great to see in our community!pic.twitter.com/UHxJO63n9x",2016-07-14 19:37:10,4,2,753674719342321664
Thank you for coming to the Capitol today!https://twitter.com/MASA_GOV/status/753306910594588672 …,2016-07-13 19:48:34,0,0,753315202700087297
Congratulations to @theresa_may!https://twitter.com/SpeakerRyan/status/753272496204419072 …,2016-07-13 19:02:15,4,2,753303545634512900
I enjoyed meeting with you at the Capitol and I hope you have a safe trip home.https://twitter.com/EdOptionsMom/status/752859308216442880 …,2016-07-12 17:03:14,0,1,752911204641832960
Thank you for coming by. It was great to discuss education options for parents & students.https://twitter.com/aleyminton/status/752855505933131776 …,2016-07-12 17:00:30,1,0,752910516524294145
.@JohnDingell Happy birthday! Always good to see you at the Capitol. Best wishes for another great year!https://twitter.com/RepDebDingell/status/751430892699066368 …,2016-07-08 16:21:33,5,1,751451164143595521
I am glad to help this effort to win important compensation for Michigan victims. https://twitter.com/RepMikeBishop/status/751170558943985664 …,2016-07-07 22:30:37,1,0,751181656099282944
Congratulations to the @NASAJuno team on a successfully guiding #Juno into Jupiter's orbit this week!https://twitter.com/NASA/status/750188352423374848 …,2016-07-06 19:12:03,5,1,750769296951939072
#TSCA enjoys great bipartisan support. Here is my statement with @RepLipinski on the signing today:pic.twitter.com/OjnHE2AlSb,2016-06-22 18:43:25,9,4,745688660633325568
"This morning, the President signed into law the first overhaul of the Toxic Substances Control Act in 40 years. #TSCA",2016-06-22 18:40:19,2,1,745687881864347648
The Native American Health Savings Improvement Act eliminates an unfair penalty on those who use HSAs at IHS: https://www.congress.gov/bill/114th-congress/house-bill/5452 …,2016-06-21 23:56:18,1,3,745405013195792386
Thank you to my colleagues for their support of this important legislation that helps Native Americans with HSAs.https://twitter.com/GOPLeader/status/745399604586250240 …,2016-06-21 23:54:41,1,2,745404604750274560
This is the #BetterWay for your weekend. Happy #FathersDay!https://twitter.com/SpeakerRyan/status/743894600989970432 …,2016-06-17 21:03:20,25,24,743911933074608128
"Great news for visitors to the Capitol! For more information on tours, visit my website: https://moolenaar.house.gov/tours https://twitter.com/uscapitol/status/743498496976781312 …",2016-06-17 19:24:56,0,0,743887170079948800
Here is a link to my entire speech on #FarmCredit100: https://www.facebook.com/RepMoolenaar/videos/vb.572656369536045/829919867143026/ …,2016-06-15 15:40:38,1,1,743105947871117312
"Last night, I spoke about the 100th anniversary of farm credit & its important role in Michigan agriculture.pic.twitter.com/FfPbT3sbxC",2016-06-15 15:38:47,3,2,743105479124090882
It's #FlagDay and the 241st #ArmyBDay. God bless @USArmy soldiers as they defend our flag and country!pic.twitter.com/gNVXhHtTTY,2016-06-14 18:13:30,4,1,742782030031769600
The price of dinner could cost more if the Senate doesn't act soon: http://www.detroitnews.com/story/opinion/2016/06/08/voluntary-food-labeling/85629298/ …pic.twitter.com/3RphU9T50S,2016-06-09 22:38:43,3,2,741036832838799361
The National Academies of Science has found that GE food has no negative impact on human health. #sciencehttps://twitter.com/MiChemCouncil/status/740905797966794752 …,2016-06-09 14:01:30,1,0,740906670243614721
".@SafeAffordable estimates that family grocery bills could increase $1,050 a year if a new standard is not passed.http://www.detroitnews.com/story/opinion/2016/06/08/voluntary-food-labeling/85629298/ …",2016-06-09 13:48:17,0,0,740903343745290240
The House passed a bipartisan bill with 275 votes last July & Senate action is needed to prevent rising food prices. http://www.detroitnews.com/story/opinion/2016/06/08/voluntary-food-labeling/85629298/ …,2016-06-09 13:46:40,0,0,740902938902724608
I have an op-ed this morning in @DetNewsOpinion calling for the Senate to pass a voluntary food labeling standard: http://www.detroitnews.com/story/opinion/2016/06/08/voluntary-food-labeling/85629298/ …,2016-06-09 13:46:21,0,1,740902858472755200
Office hours are a good opportunity for constituents who need assistance with a federal agency.https://twitter.com/saginawnews/status/740187666105413632 …,2016-06-07 20:08:29,1,0,740274248481144832
Thousands made the ultimate sacrifice and we will never forget the price they paid. #DDaypic.twitter.com/anrr7dX4Gj,2016-06-06 18:14:45,2,2,739883242212462593
"Today, we pause to remember the courageous soldiers who stormed the beaches at Normandy to fight for freedom. #DDaypic.twitter.com/Of05wSErmv",2016-06-06 18:13:55,5,2,739883032212045824
I also want to thank @minews26 for attending yesterday's medal presentations. Here is their report:http://www.minews26.com/content/?p=44386 …,2016-06-02 17:09:38,0,0,738417300001460224
It was wonderful to present military service medals in Prudenville yesterday. Here's a report from @NewsManBoyer:http://www.9and10news.com/story/32117605/two-veterans-honored-with-medals-at-prudenville-ceremony …,2016-06-02 17:08:25,1,0,738416996300263424
Thank you for inviting me!https://twitter.com/brandon_defrain/status/738052431049818112 …,2016-06-01 17:21:17,1,0,738057844906418176
June office hours start week. Here is a complete list of times and locations:https://moolenaar.house.gov/officehours ,2016-05-31 15:56:31,0,0,737674125469188096
May their families know peace and may we never forget them or take their sacrifice for granted. #MemorialDayWeekendpic.twitter.com/PLfZvZspoq,2016-05-27 18:26:11,5,1,736262238223405056
God bless the men and women who made the ultimate sacrifice for our country. #MemorialDayWeekend #MemorialDaypic.twitter.com/iQo7FLzW4s,2016-05-27 18:25:44,2,1,736262125312708608
"The House just passed the first reform of #TSCA in 40 years. It was overwhelmingly bipartisan, 403-12. My statement:pic.twitter.com/rxeX6cUhqi",2016-05-24 21:34:07,3,3,735222370785452032
Happy to help! Thank you for your leadership on this issue.https://twitter.com/reppittenger/status/735218104909877249 …,2016-05-24 21:26:29,0,0,735220447764172802
"Today, @RepLipinski and I announced support for the TSCA legislation on the House floor this week. #ChemistryCaucuspic.twitter.com/Fy5MikZ4fr",2016-05-23 20:24:34,3,6,734842478461865984
Office hours are a great way to get assistance if you need help with a federal agency.https://twitter.com/saginawnews/status/727528866743508992 …,2016-05-09 13:40:59,0,0,729667484740128768
This is going to be a great event on May 4 and I look forward to seeing our Vietnam veterans in Mt. Pleasant.https://twitter.com/MIVeteran/status/725396768343597056 …,2016-04-27 20:54:04,2,0,725427817769476098
Very happy to announce the new Congressional Chemistry Caucus with co-chair @RepLipinski today! #mijobs #STEMhttps://twitter.com/MiChemCouncil/status/725414929151352832 …,2016-04-27 20:52:10,3,1,725427340348690432
"My legislation, the Safe Water and Nutrition Access Act, is a step forward to help Flint and rural communities.https://twitter.com/MLive/status/724749960307191808 …",2016-04-26 14:12:02,1,0,724964256555360256
"On May 4 at @CMUniversity, I am hosting an event to honor our Vietnam veterans. RSVP here: https://moolenaar.house.gov/vietnamveterans ",2016-04-25 14:17:20,2,1,724603203585728512
Thanks to @RepWalberg for co-sponsoring the Safe Water and Nutrition Access Act:http://www.detroitnews.com/story/news/politics/2016/04/22/mich-gop-lawmakers-push-flint-inspired-aid-plan/83384140/ …,2016-04-22 16:48:22,0,0,723554048109101057
Thank you to @RepFredUpton for co-sponsoring the Safe Water and Nutrition Access Act: http://www.detroitnews.com/story/news/politics/2016/04/22/mich-gop-lawmakers-push-flint-inspired-aid-plan/83384140/ …,2016-04-22 16:47:22,1,1,723553794030755840
Thank you to @RepDaveTrott for co-sponsoring the Safe Water and Nutrition Access Act: http://www.detroitnews.com/story/news/politics/2016/04/22/mich-gop-lawmakers-push-flint-inspired-aid-plan/83384140/ …,2016-04-22 16:46:29,0,0,723553571774586880
Thank you to @CandiceMiller for co-sponsoring the Safe Water and Nutrition Access Act: http://www.detroitnews.com/story/news/politics/2016/04/22/mich-gop-lawmakers-push-flint-inspired-aid-plan/83384140/ …,2016-04-22 16:45:39,0,0,723553361996460032
Thanks to @RepHuizenga for co-sponsoring the Safe Water and Nutrition Access Act: http://www.detroitnews.com/story/news/politics/2016/04/22/mich-gop-lawmakers-push-flint-inspired-aid-plan/83384140/ …,2016-04-22 16:44:09,0,1,723552985989681153
Thanks to @RepMikeBishop for co-sponsoring the Safe Water and Nutrition Access Act: http://www.detroitnews.com/story/news/politics/2016/04/22/mich-gop-lawmakers-push-flint-inspired-aid-plan/83384140/ …,2016-04-22 16:43:04,0,0,723552714685296644
Thank you to @CongressmanDan for co-sponsoring the Safe Water and Nutrition Access Act: http://www.detroitnews.com/story/news/politics/2016/04/22/mich-gop-lawmakers-push-flint-inspired-aid-plan/83384140/ …,2016-04-22 16:42:09,0,1,723552484296368128
"Today, I welcomed students from Saginaw Arts & Sciences Academy w/@RepDanKildee @uscapitol today. Enjoy your visit!pic.twitter.com/ev3yASbK7h",2016-04-12 23:26:29,8,1,720030356297158656
Thank you for your work at #MPSCS. #MPSCS is great for our first-responders and will help them in emergencies.https://twitter.com/StoddardBA/status/719628096706646016 …,2016-04-11 20:53:44,1,1,719629527245320194
This was a great event and I am glad to lend my support to this effort. Thank you to everyone who attend today.https://twitter.com/MPSCS/status/719521028628721665 …,2016-04-11 17:46:58,0,1,719582529561436160
If you need help with a federal agency be sure to visit office hours or the district offices in Midland & Cadillac.https://twitter.com/saginawnews/status/719568222220066818 …,2016-04-11 17:12:52,1,1,719573945574387712
"Last week @HouseAgNews, Calan from @CustomsBorder showed us how he protects our food supply. #NationalPuppyDaypic.twitter.com/uboa10vAJr",2016-03-23 20:04:11,2,1,712731689076830209
This is great news for our district and for Michigan manufacturing! Congratulations to everyone @BatesFootwear!https://twitter.com/BigRapidsDN/status/712671283796844544 …,2016-03-23 16:55:47,2,1,712684278241484801
These are great bills that promote entrepreneurship and STEM learning opportunities and I voted for them today.https://twitter.com/HouseScience/status/712366580844384256 …,2016-03-22 20:00:29,1,0,712368370902036480
It was wonderful to meet original Rosie the Riveters at the Capitol! Thanks to these women for serving our country!pic.twitter.com/hrQ2eQzK99,2016-03-22 19:20:54,9,1,712358408343691264
It was wonderful to have exchange students from the district stop by for a visit at the Capitol.https://twitter.com/SDubHenry/status/710170168148627456 …,2016-03-16 19:52:28,0,0,710192028353691648
Thank you for coming by! Hope you have a safe trip back to our district. #FireUpChipshttps://twitter.com/DanJenDig/status/709526841581817856 …,2016-03-16 19:51:03,2,2,710191671519158273
Good luck to @CMUWBBall tomorrow in the #WNIT!http://www.cmuchippewas.com/sports/w-baskbl/spec-rel/031416aaa.html …,2016-03-16 16:50:06,2,1,710146132681297920
It was great to meet @DrMarkSchlissel. Thanks for coming by!https://twitter.com/UM_DCOffice/status/709836062529421312 …,2016-03-15 23:29:31,2,1,709884261856313349
"As always, I am thankful for the 15,000 farmers in my district and their contributions to our local communities. #agday2016",2016-03-15 15:12:24,7,3,709759159022034946
Congratulations and good luck next week!https://twitter.com/MMCCWomensBball/status/704907891405430789 …,2016-03-04 15:45:08,0,0,705781128213491712
Thanks for coming by. Great to see you!https://twitter.com/acdkids/status/704771172865601537 …,2016-03-01 21:01:57,1,0,704773693990412289
Enjoyed talking with voters about important federal issues last week at @MontcalmCC.https://twitter.com/greenvilledn/status/702996696859541508 …,2016-02-29 21:25:49,0,1,704417313928441862
Office hours are a great way to get assistance if you need help dealing w/a federal agency. https://moolenaar.house.gov/officehours https://twitter.com/elisabethwaldon/status/704403666460151809 …,2016-02-29 20:37:34,0,0,704405172211093504
Good luck in the first round!https://twitter.com/almacollege/status/704360914418606084 …,2016-02-29 18:51:20,3,1,704378437553811457
Congratulations!https://twitter.com/GoAlmaScots/status/703802450105470976 …,2016-02-29 18:50:49,0,0,704378305907130369
It's great to have Amir home in Michigan & to see him in the House of Representatives with @SpeakerRyan. #freedAmirhttps://twitter.com/SpeakerRyan/status/702964745935196164 …,2016-02-25 21:44:16,43,21,702972406474907648
Good to see you! Thanks for coming by.https://twitter.com/GLARDucks/status/702866826330394624 …,2016-02-25 15:50:21,1,0,702883336981708802
Congratulations to fmr intern Steve Elmer on his upcoming graduation from Notre Dame & all the best in the future.http://www.und.com/sports/m-footbl/spec-rel/021616aae.html …,2016-02-16 22:07:24,3,0,699716734614425600
Looking forward to it. We are scheduled to be in Boon and Cadillac on Thursday.https://twitter.com/LudingtonDN/status/699692312851570688 …,2016-02-16 20:39:50,0,0,699694697015541760
"Good to see you, Jimmy!https://twitter.com/JimmyEGreene/status/699678172305035265 …",2016-02-16 20:02:34,1,0,699685319935967237
Congratulations! Great to see you @MontcalmCC last week.https://twitter.com/greenvilledn/status/692883019934203906 …,2016-01-29 20:37:22,0,0,693171094266777601
Happy Birthday @SpeakerRyan!,2016-01-29 20:35:56,0,0,693170734928101376
Read or watch Ronald Reagan's poignant natl speech on the #Challenger tragedy. Text: http://history.nasa.gov/reagan12886.html … Video:https://www.youtube.com/watch?v=DqilE4AAa-M …,2016-01-28 21:38:48,2,2,692824169763991552
"Today, we remember the astronauts lost in the #Challenger tragedy. http://www.spacetoday.org/SpcShtls/ChallengerSevenPhotoNASA.html …",2016-01-28 21:35:40,2,0,692823380182044673
Welcome home Amir! Great to see you back on American soil! All the best to you and your family. #FreedAmirpic.twitter.com/sWlivJn8MO,2016-01-21 21:40:17,25,16,690287828442419201
Thank you to @MontcalmCC and President Bob Ferrentino for hosting this informative tour.https://twitter.com/elisabethwaldon/status/689498758917132289 …,2016-01-19 17:31:07,0,0,689500345626537985
Congratulations to Saylor-Beall for being this week's featured manufacturer!https://twitter.com/Proudtomfrinmi/status/686557439345451009 …,2016-01-11 22:05:33,1,0,686670307814457344
Should be a great show!https://twitter.com/petehoekstra/status/679007140695142400 …,2015-12-21 18:50:25,0,1,679011054781915136
Constituents oppose #CommonCore. I'm glad today's #education bill prohibits spending their tax dollars on it.pic.twitter.com/eAcaL5NqeB,2015-12-09 17:11:16,1,0,674637450384404480
This #education bill repeals federal mandates and returns power to parents and teachers to do what is best for student success.,2015-12-09 17:07:07,0,0,674636403494543360
A great event in Blanchard last week!https://twitter.com/greenvilledn/status/668778850113974272 …,2015-11-23 16:09:09,0,2,668823610665103361
Thanks for coming to the event and thanks to the Andersens for hosting!https://twitter.com/elisabethwaldon/status/667809289344409600 …,2015-11-20 21:00:27,0,0,667809752848601089
Hope you enjoyed it! #Bacon #Baseball #NextYearhttps://twitter.com/RepDanKildee/status/664899242549383168 …,2015-11-12 22:15:30,3,0,664929537092923392
Thanks to CPI for hosting the visit!https://twitter.com/AmChemistry/status/664545843853271040 …,2015-11-12 16:48:01,1,0,664847123230408705
Thank you for hosting!https://twitter.com/HelenTaylor_TNC/status/664135220153745408 …,2015-11-10 17:45:48,3,0,664136891533537280
This is a great resource for constituents who need assistance with a federal agency.https://twitter.com/mlive_lansing/status/661200113700745216 …,2015-11-02 15:53:55,0,0,661209630970892292
"Congratulations, @SpeakerRyan! I look forward to working with you!pic.twitter.com/OKZt7ultmC",2015-10-29 16:02:01,2,1,659762119357898752
We have a great outdoor heritage in our state. Congratulations to Greg Gasiciel of Rhodes for this new record!https://twitter.com/9and10News/status/656575796841091072 …,2015-10-22 17:01:55,1,0,657240476341374977
Congratulations to Midland native Terry Collins on guiding the New York Mets to the World Series!http://www.ourmidland.com/sports/midlanders-thrilled-about-collins-run-with-mets/article_866926c1-280d-5479-8314-69a7b69a66e7.html …,2015-10-22 03:54:44,3,4,657042376066736128
One of my constituents had an idea for tax relief and now it's a bill! Thanks to @greenvilledn for publishing.https://twitter.com/greenvilledn/status/656541546758717440 …,2015-10-20 18:47:13,0,1,656542202370355200
Good news! The Sixth Circuit Court has issued a nationwide stay of the EPA's overreaching Waters of the U.S. rule. http://www.washingtonexaminer.com/appeals-court-blocks-epas-clean-water-rule/article/2573771 …,2015-10-09 15:27:59,4,4,652505797398798336
"These are a great resource for constituents who need help with a federal agency, like the IRS and the VA.https://twitter.com/saginawnews/status/651442740228587520 …",2015-10-06 20:01:44,1,0,651487524850958336
Sanctions against Iran should not be lifted until Iran pays victims what they are owed. #NotOneCent.pic.twitter.com/ktdkKsIEkZ,2015-10-01 19:47:09,2,0,649671913808203776
Chief Warrant Officer Kenneth Welch of Michigan was a victim of Iranian sponsored terror in in Lebanon in 1984.pic.twitter.com/V9MdrAsxPW,2015-10-01 19:46:47,6,5,649671824670855168
"Today, the House passed the Justice for Victims of Iranian Terrorism Act. Iran owes $43.5 billion to terror victims.pic.twitter.com/pZ5Zi7L7Jb",2015-10-01 19:46:09,7,7,649671664054194176
It's harvest time! Here's info about legislation that supports the priorities of 4th District farming families.https://twitter.com/greenvilledn/status/648964741084377089 …,2015-09-30 20:47:17,0,1,649324660191047680
Congratulations to Chestnut Hill Elementary in Midland on being named a National Blue Ribbon school!http://www.ourmidland.com/news/chestnut-hill-one-of-top-schools-in-state-says-department/article_bf788116-66d3-11e5-98c4-f78fcb7daa98.html …,2015-09-30 18:17:02,1,1,649286847055708160
Thanks to Dr. Buhler of @michiganstateu for accepting my invitation and testifying today!https://twitter.com/HouseAgNews/status/648962113239678977 …,2015-09-29 21:44:54,0,0,648976771518439424
Thanks for coming by today!https://twitter.com/jenpackfan/status/648957256734801922 …,2015-09-29 20:45:31,1,2,648961827427209217
Happy #NationalCoffeeDay! Hope you enjoyed your favorite cup of joe today!pic.twitter.com/R9LncLt0Co,2015-09-29 20:44:40,2,1,648961612947288065
"If you missed it this morning, here is Pope Francis's call for protecting life at every stage of development.https://www.youtube.com/watch?v=UKux4-PDvw8 …",2015-09-24 21:51:44,0,0,647166553461551108
"The Pope's speech to Congress has started, you can watch live here:http://www.speaker.gov/pope ",2015-09-24 14:03:07,0,0,647048620848586752
Thank-you to Ted for his service! Happy to help him get his medals after all these years!https://twitter.com/BigRapidsDN/status/646135121586688000 …,2015-09-22 14:36:03,1,0,646332134681128960
Happy Birthday! Thank you for your service!https://twitter.com/usairforce/status/644873787914235904 …,2015-09-18 18:13:02,1,1,644937188355014656
"Today, the House voted to defund Planned Parenthood. Here's my speech on this critical issue. https://moolenaar.house.gov/media-center/videos/john-moolenaar-speech-restoring-taxpayer-trust-and-improving-health-care …pic.twitter.com/ZqH2s8LxOu",2015-09-18 18:11:34,4,5,644936818878717952
"Today, I join those across our state in praying for Dennis’s family, friends and colleagues during this difficult time.",2015-09-16 19:57:56,2,1,644238809563983873
The funeral for Lansing firefighter Dennis Rodeman was today. Dennis was always serving the community and he made the world a better place.,2015-09-16 19:57:44,1,1,644238760226373633
Thanks for meeting with me today!https://twitter.com/experienceworks/status/643827362967089153 …,2015-09-15 17:41:00,1,1,643841962387312640
"Today, we remember the victims of the 9/11 terrorist attacks. My prayers go out to all who grieve on this day.pic.twitter.com/4oYBDScCB9",2015-09-11 20:50:03,1,1,642439987674394624
"Today, I spoke on the House floor in opposition to the #IranDeal. It's bad for the U.S. and the world.https://www.youtube.com/watch?t=3&v=XL8MFtWsTp8 …",2015-09-10 18:59:18,2,1,642049728054738944
College football is back. Good luck to @CMU_Football as it hosts Oklahoma State tonight! #FireUpChips! (Photo: CMU)pic.twitter.com/JjIlm1nYuC,2015-09-03 17:43:20,2,1,639493893881483265
Thanks to Elisabeth and everyone who attended. It was great to see you!https://twitter.com/elisabethwaldon/status/639092544161357824 …,2015-09-02 15:26:31,1,1,639097077453058050
