Text,Date,Favorites,Retweets,Tweet ID
"If true,the suggestion that @POTUS would try to pressure FBI Dir into dropping investigation is gross abuse of powerhttps://www.washingtonpost.com/world/national-security/notes-made-by-former-fbi-director-comey-say-trump-pressured-him-to-end-flynn-probe/2017/05/16/52351a38-3a80-11e7-9e48-c4f199710b69_story.html …",2017-05-17 00:10:28,38,15,864634183716659202
.@POTUS admits he shared sensitive info w/Russians. Congress needs to be fully briefed to determine next stepshttps://www.washingtonpost.com/news/post-politics/wp/2017/05/16/trump-acknowledges-facts-shared-with-russian-envoys-during-white-house-meeting/?utm_term=.6db56bdf3cd1 …,2017-05-16 21:44:08,47,24,864597360147664896
.@POTUS’s pick for @Interior No. 2: a lobbyist who threatens our water &wildlife. He's a wolf guarding the henhousehttp://www.sfchronicle.com/opinion/editorials/article/Trump-s-wrong-choice-for-No-2-post-at-Interior-11145480.php …,2017-05-16 02:01:08,28,24,864299648546213888
".@POTUS called 4 expanding women’s healthcare, but Trumpcare guts protections 4 women. Sounds like an empty promisehttp://www.rollingstone.com/politics/features/with-trumpcare-gop-takes-womens-health-hypocrisy-to-a-new-level-w481524 …",2017-05-15 20:25:03,25,9,864215067746865152
Very encouraged to see the Supreme Court reject bringing back North Carolina’s unconstitutional voter ID law.https://www.nytimes.com/2017/05/15/us/politics/voter-id-laws-supreme-court-north-carolina.html …,2017-05-15 16:39:54,28,8,864158406923431937
"GOP trying to spin what’s in their ACA repeal. Despite their claims, it guts protections for pre-existing conditionshttps://www.washingtonpost.com/powerpost/republicans-misstate-again-and-again-on-tv-and-at-town-halls-whats-in-their-health-care-bill/2017/05/11/80e72ab8-34dd-11e7-b4ee-434b6d506b37_story.html …",2017-05-14 18:02:54,27,20,863816907748671493
"Happy #MothersDay! I’m proud to celebrate with my wife, Janet. Thank you for everything you’ve done for our children and grandchildren.pic.twitter.com/Yw4ZTpEiYo",2017-05-14 16:10:24,31,2,863788597010468864
.@POTUS admits he fired Comey b/c of Russia probe. What's he worried it will find? We need a special prosecutorhttps://www.vox.com/2017/5/11/15628276/trump-comey-fired-russia …,2017-05-13 13:44:09,61,24,863389402512445440
Cancelling daily briefings would be a dangerous blow to free press & keep us in the dark about @POTUS's actionshttps://www.washingtonpost.com/news/post-politics/wp/2017/05/12/trump-threatens-to-cancel-white-house-briefings-because-it-is-not-possible-to-always-tell-the-truth/ …,2017-05-12 17:52:59,26,10,863089635441946626
.@POTUS's reasons for firing Comey don’t add up. We need a special prosecutor & independent investigation nowhttps://www.washingtonpost.com/politics/how-trumps-anger-and-impatience-prompted-him-to-fire-the-fbi-director/2017/05/10/d9642334-359c-11e7-b373-418f6849a004_story.html …,2017-05-11 20:10:46,57,19,862761924722917376
Comey’s firing can't derail Russia probe. They tampered w/our elections. We have to see how deep this goes.http://www.politico.com/story/2017/05/09/comey-firing-trump-russia-senate-238187 …,2017-05-11 00:54:12,35,10,862470865522487296
Serious questions remain about why @POTUS fired Comey. Something doesn’t add up. We need a special prosecutor now.https://www.vox.com/world/2017/5/9/15602846/trump-comey-firing-clinton-emails …,2017-05-10 19:27:03,247,92,862388531704074241
FBI Dir. Comey's firing shows urgent need for special prosecutor to investigate Russian interference in our electionhttp://www.rollcall.com/news/politics/fbi-director-james-comey-dismissed …,2017-05-10 00:41:51,77,24,862105369686024192
News alert for GOP: women use healthcare too. So why didn’t McConnell include a single woman in his working group?http://www.latimes.com/opinion/opinion-la/la-ol-women-health-care-overhaul-20170509-story.html …,2017-05-09 19:08:44,34,11,862021536995258368
"Proud to work the grill for Napa police, firefighters, & dispatchers! Thank you all for your service & dedication to our community!pic.twitter.com/LXqL0HOjQe",2017-05-09 17:53:11,19,4,862002522105548800
Some of my colleagues should listen to @BarackObama and find the courage to champion the sick and the infirm.https://www.nytimes.com/2017/05/07/us/politics/obama-trump-health-care.html …,2017-05-08 23:15:21,31,10,861721209817493504
Still so much we don’t know about ties between White House & Russia. We need an independent investigation.http://www.npr.org/sections/thetwo-way/2017/05/08/527406535/watch-live-sally-yates-testifies-before-senate-on-russia-trump …,2017-05-08 18:54:13,51,19,861655494095757313
GOP pushed healthcare repeal through w/out waiting for CBO score. We still know it’ll be devastating for millions.https://www.washingtonpost.com/news/politics/wp/2017/05/04/in-lieu-of-a-cbo-score-heres-an-overview-of-the-expected-effects-of-the-gop-health-care-bill/ …,2017-05-07 12:59:42,18,8,861203891932868608
Wishing @RideOnTeam26 safe travels on their trip back to Newtown. Proud to work w/you to prevent gun violence!pic.twitter.com/V5LjUEoUB2,2017-05-06 12:28:38,17,5,860833685960089601
"If the Republican health plan moves forward, only 1 in 3 Californians would have health insurance. Unacceptablehttp://www.sacbee.com/news/local/health-and-medicine/article148703944.html …",2017-05-05 20:59:52,21,17,860599951151202304
20 Republicans joined every Dem in voting against gutting healthcare. It still passed. Sad day for American peoplehttp://mikethompson.house.gov/newsroom/press-releases/thompson-condemns-healthcare-repeal …,2017-05-04 19:23:13,78,39,860213241762504705
"Under #TrumpCare, folks in our district could see their healthcare costs jump more than $4K per year. Congress shouldn't pass this bad bill",2017-05-04 15:40:54,37,26,860157294176239617
"#TrumpCare lets insurers charge more if you've been sick. This isn't a healthcare bill, it's a tax cut for big biz at the expense of people",2017-05-04 15:03:05,61,41,860147778042900481
The ACA brought 20M Americans into our healthcare system. #TrumpCare will cost 24M Americans their coverage. This is a bad deal.,2017-05-04 14:40:00,18,13,860141966973120512
GOP's plan rips healthcare away from 24M Americans & ends protections for pre-existing conditions. It's a bad bill & it WILL hurt people,2017-05-04 13:34:56,84,50,860125595463757828
Had a good discussion with Sec. David Shulkin of @DeptVetAffairs on how we can improve service and care for our veterans.pic.twitter.com/1HY0QDzJW4,2017-05-03 22:07:50,13,2,859892280966103040
If you serve our country—risking your life for our freedoms—you shouldn’t have to worry about being deported.http://mikethompson.house.gov/newsroom/press-releases/thompson-ros-lehtinen-propose-immigration-reforms-for-non-citizen-military …,2017-05-03 20:41:13,30,11,859870482140733442
"There's no such thing as a good shutdown. They cost billions, create backlogs, grind government to a halt, & are a huge hassle for everyone.",2017-05-03 17:53:59,22,3,859828396909633538
Too many innocent lives have been lost to gun violence. I stand w/@GabbyGiffords in calling on Congress to stop the bloodshed & keep us safepic.twitter.com/OIVm5blW7j,2017-05-03 17:07:19,43,17,859816653084930049
"In many states, you can lose your job or your housing just for being LGBT. The Equality Act would prevent that.https://www.vox.com/identities/2017/5/2/15505132/lgbtq-discrimination-cap-survey …",2017-05-02 21:19:44,18,7,859517786879664128
"Study shows @CoveredCA enrollees in our district could see costs spike by $4,092 if GOP repeals ACA. Unacceptablehttp://www.cbpp.org/research/health/house-gop-health-plan-cuts-tax-credits-raises-costs-by-thousands-of-dollars-for …",2017-05-02 19:36:58,21,15,859491925505826816
Janet Capello dedicated her life to helping Vallejo. Naming our post office after her would be a fitting tributehttp://www.timesheraldonline.com/general-news/20170428/thompson-floats-bill-to-name-new-vallejo-main-post-office-after-janet-capello …,2017-05-02 13:51:09,6,0,859404898009534464
".@POTUS needs to read his bill. He says people w/pre-existing conditions would be covered, but they'd be priced outhttps://www.vox.com/2017/4/30/15492354/trump-ahca-interview …",2017-05-01 19:36:41,42,54,859129469013045248
"Since @POTUS took office, economy performed at its worst since 2014. He needs to focus on what really matters: jobs.http://www.politico.com/story/2017/04/28/us-gdp-2017-slow-growth-trump-237739 …",2017-04-30 18:08:26,32,24,858744871863152641
"In #100days, @POTUS delivered nothing. No jobs bill. Nothing to improve healthcare. Just a failed plan to hike costs for seniors & sick",2017-04-29 14:14:58,46,14,858323728786219008
I’m w/the majority of gun owners: the gun lobby’s dangerous policies are out of touch with our priorities.http://americansforresponsiblesolutions.org/2017/04/25/gun-owner-poll/ …,2017-04-28 16:44:05,40,15,857998869099155457
I’ll go live on FB at 2:45PM ET/11:45AM PT about the Republicans’ latest plan to gut our healthcare system: https://www.facebook.com/RepMikeThompson/ …,2017-04-27 17:41:20,22,9,857650888604864513
Great meeting with Napa Vintage High alum and noted astronaut Dr. Kate Rubins about her recent mission on the International @Space_Stationpic.twitter.com/UB82NruSFd,2017-04-27 13:37:11,22,1,857589445339619328
Berryessa Snow Mountain is a cherished National Monument. Overturning its designation would defy community's wisheshttp://www.pressdemocrat.com/news/6923147-181/trump-move-to-review-national?artslide=0 …,2017-04-26 23:25:12,25,10,857375034385416192
GOP made their healthcare repeal worse: letting insurers price gouge sick people & making seniors pay 5 times morehttp://www.vox.com/2017/4/25/15422478/gop-ahca-amendment …,2017-04-26 14:42:54,15,12,857243594754842625
Wishing the 201st Transportation Detachment a safe deployment to the Persian Gulf. I applaud your courage & thank you for your servicepic.twitter.com/VqEN0fCTE8,2017-04-26 13:07:38,12,2,857219619152695296
Immigration enforcement is fed's job not cities--& they shouldn't be punished for saying so. This is the right call.http://www.politico.com/story/2017/04/25/sanctuary-cities-trump-judge-blocks-237597 …,2017-04-25 22:07:55,28,5,856993200900378629
"Great visit to Vallejo's @KPThrive to talk about how we can strengthen Telehealth, combat the opioid epidemic, & improve care for everybodypic.twitter.com/ezPWaRx2WQ",2017-04-25 21:13:23,7,1,856979476705628160
White House must turn over Flynn docs to Oversight Cmte. Refusing makes it look like there's something to hidehttp://thehill.com/policy/national-security/330410-white-house-rejects-oversight-request-for-flynn-documents …,2017-04-25 19:46:04,37,19,856957500758872066
Honored to speak at Friday’s Los Cien luncheon about the importance of immigration to our country and our community.pic.twitter.com/e9A1jQaa3E,2017-04-25 13:27:14,13,3,856862166846144515
Building a border wall's a nonstarter. @POTUS shouldn't hold our government hostage for sake of a campaign sloganhttps://www.washingtonpost.com/powerpost/showdown-looms-as-trump-demands-funding-for-wall-on-us-mexico-border/2017/04/23/5e0a2840-276a-11e7-b503-9d616bd5a305_story.html …,2017-04-24 17:21:14,22,10,856558665586937857
Deeply proud to ride in @Cycle4SightNapa today! Couldn’t have asked for a better day to enjoy our beautiful district & support a great causepic.twitter.com/LfAS8f01Do,2017-04-22 22:45:31,11,0,855915497136771073
"Proud to see so many joining the #MarchForScience! We must all take a stand for the facts, research, & vigorous debate that move us forwardpic.twitter.com/TrHSmZpPyX",2017-04-22 20:21:58,75,17,855879371063787520
"Happy #EarthDay! Our community enjoys some of the cleanest air in CA, but 40% of US lives w/dangerously high air pollution. We must do more.pic.twitter.com/urMsx1rXAB",2017-04-22 15:21:41,27,9,855803804045987840
"One more weekend to #FindYourPark. National parks are waiving entrance fees, so I hope everyone has the chance to enjoy the great outdoors!",2017-04-22 12:28:49,28,7,855760299823165441
Congrats to my friend Judy Sakaki on officially becoming President of @SSU_1961! I know you’ll give all our students a great educationpic.twitter.com/6aixRhMtYq,2017-04-21 18:48:15,16,3,855493400371527680
Always enjoy hearing from constituents about the issues they care most about. Thanks to everyone who joined me for my Town Hall in Sonoma!pic.twitter.com/ggrfsTP4pE,2017-04-21 13:43:57,15,2,855416821524164608
Tune in now to my Town Hall Meeting in Sonoma: https://www.facebook.com/805371932867169/videos/1465189253552097 …,2017-04-21 01:14:28,16,6,855228206244401152
"Hearing @POTUS wants to repeal ACA next week, letting insurers hike prices for those w/pre-existing conditionshttp://www.politico.com/story/2017/04/20/obamacare-repeal-republicans-new-deal-237397 …",2017-04-20 18:00:31,7,3,855119001122418689
You can learn more about our plan to strengthen Social Security & prevent seniors from retiring into poverty here: https://mikethompson.house.gov/newsroom/press-releases/thompson-larson-talk-social-security-with-local-seniors …pic.twitter.com/bnFZGuRmiV,2017-04-20 14:01:09,5,2,855058760871673856
Thanks to everyone who joined @RepJohnLarson & me for our Social Security Town Halls! We're fighting hard to raise benefits & help seniors,2017-04-20 13:58:11,12,3,855058015518691332
GOP still wants to rip healthcare away from 24M Americans. Unacceptable. No one should have to go w/out coveragehttp://thehill.com/policy/healthcare/329580-ryan-gop-putting-finishing-touches-on-healthcare-bill …,2017-04-19 20:56:31,31,24,854800902078816256
.@POTUS should honor the promise we made to DREAMers across the country—many of whom know no other home but America.https://www.usatoday.com/story/news/world/2017/04/18/first-protected-dreamer-deported-under-trump/100583274/ …,2017-04-19 19:05:20,21,11,854772924095623168
"We need a thoughtful, appropriate response to N Korean aggression to avoid fanning the flames of an unstable regime.http://www.pressdemocrat.com/news/6898612-181/rep-mike-thompson-faults-north …",2017-04-19 14:50:39,27,9,854708828193083392
"Cutting funding to @NIH would hurt our fight to cure cancer, ALS, & other devastating illnesseshttps://www.washingtonpost.com/opinions/why-slashing-the-nih-budget-is-indefensible/2017/04/18/727f16cc-2383-11e7-b503-9d616bd5a305_story.html …",2017-04-18 21:03:26,11,5,854440257919602688
The healthcare of millions of Americans shouldn’t be a bargaining chip in @POTUS's attempts to repeal the ACAhttps://www.washingtonpost.com/news/wonk/wp/2017/04/13/trump-is-playing-a-risky-game-of-chicken-with-health-insurers …,2017-04-18 16:00:05,17,7,854363917774094336
".@POTUS hasn't filled 475 of 554 key posts. The longer seats go unfilled, the harder it is to tackle complex issueshttp://www.cnbc.com/2017/04/13/trump-administration-hasnt-even-named-candidates-for-hundreds-of-key-positions.html …",2017-04-17 19:53:07,22,16,854060172632879104
Just returned from South Korea & Japan to discuss national security. We must work arm-in-arm with our allies to keep all our countries safepic.twitter.com/2k0qy8P7Dn,2017-04-17 16:51:05,33,12,854014362058711041
Very moving documentary on the USS Indianapolis at the Mare Island Museumhttp://www.timesheraldonline.com/arts-and-entertainment/20170406/about-700-witness-uss-indy-film-on-mare-island …,2017-04-16 22:57:29,8,3,853744181377978368
"Since 2008, more than 190 veterans have been hired by House Wounded Warrior Fellowship. Congress must keep funding this important program",2017-04-16 18:34:38,21,6,853678033076617217
Happy Easter to everyone celebrating today! Hope you and your loved ones enjoy a great holiday!,2017-04-16 14:24:16,31,2,853615028280455168
Any action on Korean Peninsula  must be in partnership w/S Korean allies. Congress must debate & be part of decisionhttps://www.nytimes.com/2017/04/14/world/asia/north-korea-china-nuclear.html …,2017-04-14 23:46:54,33,15,853031843326775296
Antibiotic resistance threatens millions. So I joined @RepErikPaulsen to encourage development of new antibiotics http://www.healio.com/infectious-disease/antimicrobials/news/online/%7Bd7be26ee-3822-414b-8f3b-36a98e119fba%7D/readi-act-offers-incentives-for-new-antibiotics-rapid-diagnostics …,2017-04-14 16:08:18,22,7,852916432484659201
"Tax season's here & so are phone scams. Fake IRS calls can be alarming, but you can protect yourself. Learn more: https://www.irs.gov/uac/newsroom/irs-reminds-seniors-to-remain-on-alert-to-phone-scams-during-tax-season …",2017-04-14 13:32:13,9,5,852877153402318850
Got questions about what’s happening in Washington? Please join me for a Town Hall Meeting in Sonoma: https://www.facebook.com/events/1496169090396350/ …pic.twitter.com/kCuNs1xU7c,2017-04-13 19:45:10,19,9,852608620764311553
Hardworking families count on deducting state & local taxes from their income. Congress shouldn't ax this provisionhttp://www.latimes.com/business/la-fi-state-tax-deduction-20170403-story.html …,2017-04-12 17:11:48,17,10,852207638406451200
Do you have questions or comments about immigration policy? Please join me for a Town Hall Meeting next week https://www.facebook.com/events/1539333832744755/ …,2017-04-11 19:11:15,10,3,851875308584173568
Are you concerned that ISPs—the companies you get your internet from—can sell your personal info w/out your permission or knowledge?,2017-04-11 15:12:18,5,5,851815174797500417
Wishing good health and happiness for everyone celebrating this Passover season!,2017-04-10 22:53:16,24,1,851568794824826880
"It is Day 81 of the President’s term, and he has yet to put forward any plan to put Americans back to work. Where’s the job bill?",2017-04-10 16:41:06,46,16,851475134909227008
"ICYMI: I led a bipartisan letter to support background checks to keep guns away from felons, fugitives, & abusers  http://beniciaheraldonline.com/reps-thompson-king-lead-call-for-background-checks-funding/ …",2017-04-09 18:40:06,46,10,851142693778587648
All reports suggest there's no plan going forward w/Syria. The Speaker should call us back immediately to debate this serious matter,2017-04-08 19:03:51,131,76,850786282015993856
We added less than 100K jobs to the economy in March. We need a jobs bill so we can put Americans back to work.https://www.washingtonpost.com/news/wonk/wp/2017/04/07/u-s-added-98000-jobs-in-march-unemployment-rate-dipped-to-4-5-percent/ …,2017-04-08 12:13:44,30,8,850683076170723329
Assad’s actions against civilians is an atrocity. He must be held accountable & Congress needs to be included as @POTUS considers next steps,2017-04-07 19:30:17,32,12,850430546434035712
"Productive meeting with the @DeptVetAffairs about how we can improve claims, appeals, and care for vets in our district and across the USpic.twitter.com/ZOy8yrKejF",2017-04-06 22:01:12,17,4,850106140516114434
Not enough for Nunes to step aside. We need fully independent investigation into link between White House & Russiahttp://www.politico.com/story/2017/04/nunes-to-step-aside-from-russia-probe-236951 …,2017-04-06 15:42:02,69,23,850010719324180481
"Social Security's the bedrock of our retirement. Glad to join @RepJohnLarson's plan to raise benefits, cut taxes & keep seniors from povertypic.twitter.com/TnlRjssDOh",2017-04-05 20:59:53,48,20,849728321264824320
"Congrats Mia Johansson on winning the 5th District's @CongressionalAC w/Times Table Math, which teaches elementary students multiplicationpic.twitter.com/EerVBxAsyY",2017-04-05 17:44:17,16,7,849679096196083716
Latest in ACA repeal: letting Sec. Price waive essential benefits & consumer protections. #PayMoreForLess indeedhttps://www.nytimes.com/2017/04/04/upshot/freedom-caucus-health-care-pre-existing-conditions.html …,2017-04-05 13:28:37,10,8,849614755425812480
Flame jetting is a real problem that can cause severe burns. I spoke w/@CBSThisMorning about my bill to save lives https://www.youtube.com/watch?v=2gdbCxiH2sE …,2017-04-04 18:48:44,9,1,849332928517722115
"Even in CA, women still earn just 86 cents for every $1 men make. That’s unacceptable. Women deserve #EqualPay for the work they do.pic.twitter.com/IC1kXNlOrc",2017-04-04 17:22:15,19,14,849311164664303616
Proud to work w/@RepPeteKing to strengthen our background check system & keep guns away from dangerous individualshttps://mikethompson.house.gov/newsroom/press-releases/thompson-king-call-for-funding-to-strengthen-criminal-background-checks …,2017-04-04 16:00:25,21,8,849290568790421504
"So...if @POTUS doesn't get his way w/GOP, he'll work with Dems to make a ""not as good"" but also ""very good"" form of healthcare. Clear as mudpic.twitter.com/npnj8TEuiF",2017-04-03 21:11:44,53,15,849006527927209984
Great meeting w/@lifeatccc Chancellor & Board about how we can continue to support our great community colleges & help students find successpic.twitter.com/0AA8jJNPX1,2017-04-03 19:42:28,11,2,848984062668701697
Great to speak with @AFLCIO in Napa & Solano about how we can grow the middle class and put Americans back to work!pic.twitter.com/lcd5UF36Cl,2017-04-02 22:08:49,16,4,848658506160984064
Thanks to everyone who came to my Town Hall in Kelseyville! I always enjoy hearing your thoughts & answering your questions on the issues!pic.twitter.com/vruIQiW1AB,2017-04-01 23:28:07,35,5,848316071564193792
"Wetlands are critical to our environment, so I'm leading 100+ bipartisan Members in urging Congress to protect them.https://mikethompson.house.gov/newsroom/press-releases/thompson-calls-for-funding-to-protect-wetlands …",2017-04-01 15:50:38,59,18,848200943569170433
Today we honor #CesarChavez & his fight to protect rights of farm workers. We must keep speaking out in the face of injustice & inequality,2017-03-31 18:55:51,43,11,847885166940966914
Title X helps millions of women get healthcare--especially in rural areas. Cutting it off would be a mistakehttps://www.theatlantic.com/politics/archive/2017/03/pence-congress-planned-parenthood/521349/ …,2017-03-31 01:34:55,28,18,847623206491926528
"ICYMI – I’m fighting to help homeowners protect their property from earthquakes, keeping them safe & saving moneyhttp://www.timesheraldonline.com/general-news/20170322/thompson-cook-introduce-tax-incentives-for-homeowners-preparing-for-earthquakes …",2017-03-30 23:52:36,14,5,847597460402745346
Sad to hear @SpeakerRyan try to stop WH from working w/Dems. Congress shouldn't be an echo chamber. We can & should work across the aisle,2017-03-30 15:08:31,95,43,847465570274496516
I urge @POTUS to do as I did: reject this terrible bill to let your ISP sell your private info to the highest bidderhttp://www.vox.com/new-money/2017/3/28/15089396/house-republican-privacy-bill …,2017-03-29 17:32:00,47,17,847139291218296834
Climate change is real. @POTUS’s science denial hurts our environment and our influence in the worldhttps://www.washingtonpost.com/news/worldviews/wp/2017/03/29/trumps-climate-change-shift-is-really-about-killing-the-international-order …,2017-03-29 15:05:59,105,70,847102543075459072
It was an honor to join @NancyPelosi & veterans service organizations for a roundtable on improving healthcare for our women veterans.pic.twitter.com/WPMjHEDqnK,2017-03-29 13:38:00,19,5,847080402623889409
Deeply troubled House Intel Chair reviewed sensitive info w/those it concerns. We need an independent investigationhttps://www.washingtonpost.com/powerpost/senate-panel-plans-to-interview-trump-son-in-law-kushner-in-russia-probe/2017/03/27/84fe10ae-12f9-11e7-ada0-1489b735b3a3_story.html …,2017-03-28 20:36:06,61,20,846823231130685440
ISPs shouldn’t sell your personal info to the highest bidder. We can't roll back the clock on privacy protectionshttps://arstechnica.com/tech-policy/2017/03/house-could-vote-tomorrow-to-let-isps-sell-your-web-browsing-history/ …,2017-03-28 13:33:35,63,28,846716900855959552
It’s my honor to recognize this year’s Women of the Year. Thank you all for the incredible contributions you’ve made to our district!pic.twitter.com/X3G4gwXGVY,2017-03-26 03:58:10,58,13,845847319870410753
Agree w/ @JoeBiden & @SenJohnMcCain: time for select committee to look into ties between @POTUS’s campaign & Russiahttps://www.washingtonpost.com/news/post-politics/wp/2017/03/23/biden-weighs-in-on-russia-probe-need-select-committee …,2017-03-25 15:25:33,100,42,845657916841562112
"Your calls, emails, & letters worked. Speaking out at town halls worked. The GOP pulled their bad bill b/c you spoke out. We can’t stop now!",2017-03-24 20:04:57,206,60,845365842346946560
ICYMI: I spoke on the House floor against this bad bill that would rip healthcare away from millions.pic.twitter.com/AlN8vpeWS5,2017-03-24 19:12:01,151,37,845352520222490626
ICYMI: I gave an update on FB Live about the current state of the GOP's healthcare repeal: https://www.facebook.com/RepMikeThompson/videos/10154531009185748/ …,2017-03-23 23:45:33,18,4,845058969446088705
"Despite assurances not to touch essential health benefits or preexisting conditions, GOP's looking at cutting both. They should be ashamed",2017-03-23 18:12:40,152,72,844975198021582848
Why did Nunes brief the White House on alleged surveillance & not Intel Committee? We need an independent review.http://www.politico.com/story/2017/03/devin-nunes-donald-trump-surveillance-obama-236366 …,2017-03-23 01:54:16,91,37,844728973514985472
GOP’s #PayMoreForLess ACA repeal costs CA $24.3B. This is an irresponsible cost shift that takes funds away from other important programs,2017-03-22 22:38:27,29,16,844679694314295300
