Text,Date,Favorites,Retweets,Tweet ID
Voted against the House Republican’s partisan attempt to block the President’s recent executive actions on immigration.,2014-12-05 19:02:10,4,2,540944235848282113
Toured center  where @FEMA and @SBA are helping people w/ earthquake aid. You’ll find them at 301 1st St in Napa.pic.twitter.com/kYgQD5QAmP,2014-12-04 15:47:19,0,2,540532811917434880
"Voted against tax legislation, much of which is important, but all of which was unpaid for. We need to pass tax laws but also pay for them.",2014-12-03 22:46:55,0,1,540276021363507200
ICYMI: check out my @sfchronicle op-ed on the importance of permanently protecting the Berryessa Snow Mountain Region http://www.sfgate.com/opinion/article/xxAn-executive-order-needed-here-5920696.php …,2014-12-02 20:55:22,3,2,539885560014594048
"On World AIDS Day, let’s commit ourselves to a AIDS-free generation.pic.twitter.com/DvaIZkXZSg",2014-12-01 21:33:55,0,1,539532873226010625
"During #NationalHospiceMonth let’s thank our hospice workers for serving patients, comforting families, & easing loss during hard times.",2014-11-30 14:08:48,2,8,539058467680845825
It’s #SmallBusinessSaturday. Our district is home to many excellent small businesses. Think local as you’re doing your holiday shopping!,2014-11-29 14:23:50,2,3,538699863308107776
"It's #MilitaryFamilyMonth, a time to remember that military service is a family commitment. Many thanks to the families of our troops & vets",2014-11-28 14:12:50,2,3,538334707403194368
"Happy Thanksgiving! I hope everyone has a great day with their family, friends and loved ones.",2014-11-27 14:53:14,2,0,537982486417252352
Tonight at 6 p.m. I’ll be at Veterans Park in Napa to light our official Christmas tree with Mayor Jill Techel. I hope to see you out there!,2014-11-26 16:26:49,0,0,537643647639232512
Honored to recognize 4 retiring members of the Sonoma County Board of Education.pic.twitter.com/B6ZkbpKfT1,2014-11-24 19:24:44,1,0,536963649349627904
Toured the Fresenius Dialysis Center in Santa Rosa. Big thanks to the outstanding staff at the center for their work!pic.twitter.com/MKYfFLPkcO,2014-11-23 15:00:14,0,2,536534697820823553
Met w/ new Lake County Farm Bureau Ex. Director Allison Tucker. Many thx to Allison & the Farm Bureau for their work!pic.twitter.com/OztOPPNA0O,2014-11-22 14:34:03,1,2,536165717771845632
"Glad to see Senate won’t be pursuing a secret & flawed water bill. Look forward to now working on a transparent, science-based water bill.",2014-11-21 20:25:32,1,2,535891783860117504
Our immigration system is broken & the Pres took steps to help fix it. But truly fixing it requires GOP voting to pass immigration reform.,2014-11-21 01:24:05,1,2,535604531032498177
"Honored to be appointed to the Democratic Steering and Policy Committee, giving our district’s priorities a voice at the leadership table.",2014-11-19 22:09:32,1,2,535193179667333120
"As a vet who went to college on the GI Bill, it was a special honor to speak to our @SSU_1961 student veterans.pic.twitter.com/93OL3lsTs3",2014-11-18 19:02:05,3,3,534783621769752576
"I #StandWithNancy because no matter what, she will fight to put the #MiddleClassFirst!pic.twitter.com/inCbUS7zf2",2014-11-17 21:08:48,0,1,534453123033878529
It's National Alzheimer's & Family Caregivers Month. Many thanks to the 1.5 million+ Alzheimer's caregivers in CA!,2014-11-16 19:37:30,2,4,534067755470057472
".@CoveredCA open enrollment starts today. Go to http://CoveredCA.com  to update your account, reenroll, & shop around for a plan.",2014-11-15 12:02:34,0,4,533590882902360064
It was a great to speak w/CAP Sonoma County about their work to combat poverty. Many thanks to CAP for all they do.pic.twitter.com/9hMQqiQFAL,2014-11-14 18:26:42,2,2,533325165250510848
The deadline for those with earthquake damage to register for @fema aid is December 29thhttp://mikethompson.house.gov/newsroom/press-releases/thompson-last-day-to-register-for-fema-aid-is-december-29-2014 …,2014-11-13 18:38:09,0,4,532965656028004354
Proud to have joined community heroes & heroines for Veterans Day ceremonies yesterday in across our district.pic.twitter.com/tKgCO5aqC1,2014-11-12 19:06:14,0,0,532610335640154112
"To all our vets & their families on Veterans Day: thank you for your service, your sacrifice, and your selfless commitment to our country.",2014-11-11 12:28:52,0,0,532147948218773505
Please consider participating in our district’s Veterans History Project. Click here more information:http://mikethompson.house.gov/newsroom/press-releases/thompson-encourages-local-veterans-schools-to-participate-in-veterans …,2014-11-10 20:47:33,0,1,531911060367101952
"November is National Healthy Skin Month. 1 in 5 Americans will develop skin cancer. If you see something unusual, see a doctor.",2014-11-09 14:43:25,0,0,531457035653885952
Congrats to all who earned their citizenship this week with the help of NVCF’s One Napa Valley Initiative!pic.twitter.com/5Gv3XImbq6,2014-11-08 13:40:02,2,1,531078694211956736
Many thanks to the American Canyon Chamber for hosting me for a talk about how we can strengthen our middle class.pic.twitter.com/Z15aOz252D,2014-11-07 19:10:38,1,0,530799506800275457
Visited Napa @USPS men & women whose service went above and beyond after the recent earthquake.pic.twitter.com/V59RwpJ0nq,2014-11-06 19:14:19,1,4,530438042428116992
Joined leaders for the opening of Clinic Ole St. Helena. Very proud of our community & all who made this possible.pic.twitter.com/z0HbiLHvMN,2014-11-05 20:30:44,3,3,530094887602225152
Our democracy is strongest when everyone makes their voices heard. Make sure to vote! Find your polling place here: http://www.sos.ca.gov/elections/find-polling-place.htm …,2014-11-04 15:29:20,0,1,529656651482427392
Important info for those with earthquake damage in Solano County: https://www.facebook.com/RepMikeThompson/posts/10152516731525748 …,2014-11-03 19:20:50,1,2,529352519349456896
Many thanks to the students and teachers at Harvest Magnet Middle School for having me on a tour!pic.twitter.com/jLJ1RzfQ3F,2014-11-02 13:28:21,3,3,528901428124069888
Toured Lakeside Health Center. Many thanks to the great workers at our health centers for all they do.pic.twitter.com/9O3EphH0Iw,2014-11-01 15:33:48,1,2,528570611384475648
It was a high honor to celebrate Filipino American History Month by unveiling our new mural in Vallejo.pic.twitter.com/aMhaDHtYFA,2014-10-31 18:59:13,2,2,528259919116767232
Earthquake news: @FEMA and @SBA are on the ground to assist people with earthquake aid. You’ll find them at 301 1st St in Napa.,2014-10-30 20:23:10,1,4,527918657750728704
Congrats to our World Series Champion @SFGiants!,2014-10-30 18:43:33,0,2,527893586839617537
Game 7. GO @SFGIANTS! #OctoberTogether,2014-10-29 20:13:40,1,1,527553875289853952
SBA loans approved to help businesses & homeowners recover from earthquake damage. Learn more: https://www.facebook.com/RepMikeThompson/posts/10152505117925748 …,2014-10-28 19:06:29,0,0,527174581615075328
FEMA funds to help individuals & families repair personal property damaged by the earthquake has been approved: https://www.facebook.com/RepMikeThompson/posts/10152504743860748 …,2014-10-28 14:34:01,1,3,527106013431070720
Attention: Robo call scams have been reported by constituents in our district. Learn more here: https://www.facebook.com/RepMikeThompson/posts/10152503161265748 …,2014-10-27 18:59:30,0,0,526810435182690304
It’s #BullyingPreventionMonth. Bullying has no place in our classrooms or communities. Help #StopBullying365. Learn more: @StopBullyingGov,2014-10-26 13:08:40,0,4,526359759600230400
ICYMI: check out this great video on the recently opened Newell Open Space & wetlands in American Canyon.https://vimeo.com/109192137 ,2014-10-25 14:49:20,1,2,526022703942488064
Game 3 back home in San Francisco tonight: Let’s go @SFGiants! #OctoberTogether,2014-10-24 22:06:16,2,0,525770276165144576
Proud to receive a 100% positive score for my voting record from @civilrightsorg http://civilrightsdocs.info/pdf/voting-record/Voting-Record-October2014-forweb.pdf …,2014-10-23 18:03:03,2,0,525346680728997888
#OctoberTogether continues tonight: LET’S GO @SFGIANTS!,2014-10-22 20:59:38,1,1,525028728154648577
Go @SFGiants !,2014-10-21 21:32:22,1,1,524674579877617667
Many thanks to all who came out to the “Make Kids Smile” awards dinner to support the Pediatric Dental Initiative!pic.twitter.com/wwRg4djzOL,2014-10-21 14:42:59,1,0,524571554399940608
Proud to receive a 100% score from @HRC for my voting record in support of LGBT equality …http://hrc-assets.s3-website-us-east-1.amazonaws.com//files/assets/resources/HRC-113th_CongressionalScorecard_Updated.pdf#__utma=149406063.840460150.1413824348.1413824348.1413824348.1&__utmb=149406063.1.10.1413824348&__utmc=149406063&__utmx=-&__utmz=149406063.1413824348.1.1.utmcsr=google|utmccn=%28organic%29|utmcmd=organic|utmctr=%28not%20provided%29&__utmv=-&__utmk=234724766 …,2014-10-20 18:31:30,1,2,524266676993667073
Great News: VA funds for Santa Rosa that will provide veteran mothers & their children with housing and stabilityhttp://mikethompson.house.gov/newsroom/press-releases/thompson-announces-more-than-160000-to-assist-homeless-women-veterans-in …,2014-10-19 15:16:24,2,1,523855187254202368
"Good luck to our Cal Maritime national champion sailing team as they compete in the Student Yachting World Cup in La Rochelle, France.",2014-10-18 13:31:27,1,2,523466390913966080
Congrats to our NL Champion @SFGiants!,2014-10-17 13:31:39,1,2,523104051656151040
"I’m going purple with @glaad on #spiritday, a time to take a stand against bullying & support our LGBT youth.pic.twitter.com/SNvQOb5FE2",2014-10-16 15:23:30,4,4,522769811546578945
Go @SFGiants!,2014-10-15 22:20:05,1,1,522512260909256704
Children’s Health Initiative is hosting an event to learn about health insurance programs tomorrow at Calistoga Elementary from 430-730 pm.,2014-10-15 21:18:08,1,0,522496668969623552
"ICYMI, this is a good read about a new Pentagon report on climate change and national security.http://thehill.com/policy/energy-environment/220575-pentagon-unveils-plan-to-fight-climate-change …",2014-10-14 17:32:31,3,2,522077502483992576
My bipartisan bill to strengthen accountability & transparency at hospice facilities was signed into lawhttp://www.timesheraldonline.com/breaking_news/ci_26675680/thompsons-hospice-care-legislation-becomes-law …,2014-10-13 21:11:31,2,3,521770232025997312
October is National #BreastCancerAwareness Month. Now is a great time to talk with your doctor and get screened.,2014-10-12 15:40:33,5,2,521324551264034817
Congrats to Calistoga Elementary on being named a National Blue Ribbon School for 2014! Read more about the program: http://www2.ed.gov/programs/nclbbrs/index.html …,2014-10-11 15:30:33,1,1,520959647520686080
Had a great time at the State of Sonoma County Latino Community event!pic.twitter.com/I5W6NCUzrd,2014-10-10 13:11:35,0,1,520562288282316800
Wished Sonoma native Chuck Williams & happy 99th bday & congratulated him on success of his Williams-Sonoma storespic.twitter.com/LG9lUNGP6A,2014-10-09 15:51:04,3,4,520240032494649344
Children’s Health Initiative is hosting an event to learn about health insurance programs tomorrow at St. John’s Hall in Napa from 430-730.,2014-10-08 17:16:59,0,1,519899267692240896
Met w/ U.S. Army Corps Brigadier General Mark Toy about the importance of completing the Napa Flood Projectpic.twitter.com/Brvrx0Abfs,2014-10-07 16:31:32,1,1,519525442072502274
October is Domestic Violence Awareness Month. Need help? Call the Nat’l Domestic Violence hotline @ 1-800-799-7233. #StopDomesticViolence.,2014-10-06 18:47:49,2,1,519197352138379264
Toured Donlop in Benicia. They do great work manufacturing equipment that saves energy & supports the music industrypic.twitter.com/Q6aNTRl808,2014-10-05 14:19:10,4,3,518767354889908224
Honored to meet & speak w/ Korean War vets from our community. Many thanks to these heroes for their service.pic.twitter.com/ejaium8O68,2014-10-04 13:12:44,0,1,518388247853277185
Toured quake damage w/ @SenFeinstein. President needs to approve disaster aid so folks can begin recoveringpic.twitter.com/7zTfhbjwQ1,2014-10-03 15:51:59,4,4,518065938072371201
Great @USATODAY story. It’s important for our economic future that we invest in education & job training. http://www.usatoday.com/longform/news/nation/2014/09/30/job-economy-middle-skill-growth-wage-blue-collar/14797413/ …,2014-10-02 20:33:23,1,2,517774365728202752
"Toured Sweetwater Spectrum, an innovative residential community for adults w/ autism in Sonoma:http://www.sweetwaterspectrum.org/home0.aspx pic.twitter.com/zBnPJRmSWE",2014-10-01 18:30:08,3,2,517380961483640832
Thanks to all who made the Napa Rocks Concert happen & all who came to support those recovering from the earthquake.pic.twitter.com/3euFMsg4GQ,2014-09-30 18:34:05,1,1,517019567768743936
Toured Napa earthquake damage w/ @SenatorBoxer & @JillTechel. President needs to provide families w/federal aid.pic.twitter.com/zODztpGVW1,2014-09-29 18:32:59,4,4,516656902441537536
Celebrated Napa Valley’s 3rd Latino Heritage Month.pic.twitter.com/HZAmTQ0o7Z,2014-09-28 15:22:33,1,2,516246591272153088
Prescription Drug Take Back Day is today. Dispose of your unused Rx drugs safely.  Find a collection site near you. https://www.deadiversion.usdoj.gov/NTBI/ntbi-pub.pub?_flowExecutionKey=_c6180CD79-BACA-50CF-3CF1-CCEDC841E0E0_kC313E5E8-C328-98D3-7115-E78FFF01EF3A …,2014-09-27 12:24:45,0,2,515839460404375552
Great news: @CDCgov awarded  @Solano_County a $3.69M grant to prevent chronic diseases. Read more: https://www.solanocounty.com/news/displaynews.asp?NewsID=739&TargetID=1 …,2014-09-26 18:00:30,0,4,515561565517783040
Did you know that 1 in 7 tipped wage workers rely on food stamps? It’s time to #RaisetheWage & pass http://Dems.gov/Jumpstart  Agenda!,2014-09-26 12:50:28,56,96,515483544379224065
Proud to announce a $1M grant for the runway project at Charles M. Schulz- Airport. Read more from @NBBJ: http://www.northbaybusinessjournal.com/99968/santa-rosa-airport-gets-final-grant-for-airport-expansion/ …,2014-09-25 18:48:26,1,1,515211241502285824
"Great news: @CatalystNapa received $125,000 in Drug-Free Communities Support Program grants http://napavalleyregister.com/news/local/catalyst-coalition-receives-federal-grant/article_c90d49c2-7541-520a-9a84-63d118f7ba30.html …",2014-09-24 19:35:39,0,1,514860735323979776
I’ve authored a bill to protect Berryessa Snow Mountain. Check out this video of businesses urging its preservation: https://www.youtube.com/watch?v=0eRIwcOqJpo …,2014-09-23 19:08:04,0,2,514491403960074240
"Second guessing of WH secret service is unwarranted. Once you put on a badge and swear to take a bullet for someone, then you can criticize.",2014-09-22 19:20:03,0,0,514132034928013312
"According to @IAVA  22 veterans a day die from suicide. If you need help, please get help. #SuicidePreventionMonthpic.twitter.com/fa1cL8YGvq",2014-09-21 13:39:52,2,3,513684034594279424
"Met with @AmericanCancer. Many thanks for their tireless work to improve palliative care, cancer screening & researchpic.twitter.com/Y4qsGAmkNb",2014-09-20 14:46:58,2,2,513338535836123139
5 yrs ago our economy was reeling. The middle class must be part of our recovery. That means investing in infrastructure/energy/research/ed.,2014-09-19 18:12:14,2,10,513027804678868993
I voted against arming Syrian opposition groups to fight ISIL. Here’s why: http://mikethompson.house.gov/newsroom/press-releases/thompson-votes-against-arming-syrian-opposition-groups-to-fight-isil …,2014-09-18 17:50:24,2,0,512659921482285056
Today's Benghazi hearing is a farce. Bipartisan @HouseIntelComm report showed no one was deliberately misled & no stand down order was given,2014-09-17 18:33:42,0,2,512308429407649792
Proud to announce $250K in TRIO funds for @SSU to help people from disadvantaged backgrounds achieve their educational dreams.,2014-09-16 18:20:26,1,3,511942701617803264
Earthquake damage assessment update: https://www.facebook.com/RepMikeThompson/posts/10152415328145748 …,2014-09-15 18:34:09,0,1,511583765823754240
Many thanks to all who participated in the recent ZERO Run to End Prostate Cancer.pic.twitter.com/6AfHYJM0AT,2014-09-14 12:10:33,1,1,511124842134138880
We’ve seen a 63% decline in intimate partner violence since ’93 thanks to #VAWA. We recommit to Not One More on law's 20th anniversary.,2014-09-13 12:32:29,1,0,510767975117639680
Info on partial approval of federal disaster aid for earthquake impacted areas: https://www.facebook.com/RepMikeThompson/posts/10152408929520748 …,2014-09-12 17:15:29,1,1,510476808241029120
Help #EndSuicide. Learn the warning signs and get help for someone in need. #SuicidePreventionWeek,2014-09-12 13:52:56,1,0,510425832305991680
#NeverForget the extraordinary acts of courage & kindness we witnessed from our first responders 13 years ago. They’re America’s heroes.,2014-09-11 14:35:01,2,0,510074036756680704
Pres should do all he's legally able to do to fix our immigration system. But truly fixing it requires GOP voting to pass immigration reform,2014-09-10 13:02:34,2,2,509688382864506880
Many thanks to everyone who participated in the second annual Napa Valley Walk to End Alzheimer's.pic.twitter.com/wHa18ZeWHf,2014-09-09 19:09:01,3,4,509418213873303552
Very helpful information on one-stop location for individuals & businesses needing earthquake assistance: https://www.facebook.com/RepMikeThompson/posts/10152402206920748 …,2014-09-08 21:23:24,0,4,509089647176462338
GO @49ers. Beat Dallas!,2014-09-07 15:53:49,1,1,508644313136652289
Officially cut the ribbon on the Jameson Canyon / Highway 12 road widening project!  http://napavalleyregister.com/news/local/officials-celebrate-completion-of-jameson-canyon-widening-project/article_d4a1d9c1-3708-558b-af1f-cd422d57d5ef.html …pic.twitter.com/nc5PdtKQI9,2014-09-06 11:41:15,4,2,508218367262851072
Had a great time speaking w/ sisters & brothers of labor from across CA05.  Big thanks to labor for all they do!pic.twitter.com/HjWgVgmxHM,2014-09-05 22:05:35,3,2,508013096854904832
Toured the vets home in Yountville. Many thanks to everyone who has served our country in the Armed Forces.pic.twitter.com/fi5BPvCXEN,2014-09-04 17:37:09,2,1,507583157080576005
CA has requested fed earthquake assistance. I have urged the White House to quickly approve this request.http://mikethompson.house.gov/newsroom/press-releases/thompson-calls-on-president-to-provide-federal-disaster-aid-to-areas …,2014-09-03 18:14:18,2,4,507230115512995840
"Alleged IS actions are cold-blooded, vicious & appalling. Those responsible must be brought to justice & IS terrorist group must be stopped.",2014-09-02 20:20:47,0,0,506899558564364290
"Happy Labor Day. Many thanks to all the sisters and brothers of labor who fight on behalf of our hard working, middle class families.",2014-09-01 12:53:35,0,2,506424631528792064
Thanks to all who attended our community meeting on concussions at @srjcpic.twitter.com/YFsyeHYFvz,2014-08-31 13:43:57,3,3,506074919260946432
Helpful information for those in Sonoma County who suffered property damages due to the recent earthquake: https://www.facebook.com/RepMikeThompson/posts/10152381485800748 …,2014-08-31 00:46:20,0,5,505879224197332992
"TTB considering waiving late filing, payment, or deposit penalties for biz who were affected by the earthquakehttp://mikethompson.house.gov/newsroom/press-releases/rep-mike-thompson-announces-tax-relief-for-earthquake-victims …",2014-08-30 13:58:20,1,1,505716150672826368
Vallejo is offering no cost building permits to repair earthquake damage to red & yellow tagged homes and biz. Info: http://www.ci.vallejo.ca.us/cms/One.aspx?portalId=13506&pageId=95227 …,2014-08-29 20:33:40,2,5,505453251266105344
Important reminder about scams in the wake of the recent earthquake: https://www.facebook.com/RepMikeThompson/posts/10152379402245748 …,2014-08-29 20:21:33,1,2,505450201046609920
Thanks to @NapaVintners for creating disaster relief fund & donating $10M. Read more: http://bit.ly/napaearthquake pic.twitter.com/vbtvMkcSV1,2014-08-28 19:07:21,1,3,505069141171404800
Big thanks to @RedCross for their great work at the earthquake Evacuation Centers in our districtpic.twitter.com/iedjyoqNHQ,2014-08-27 20:03:51,1,6,504720972285755393
.@PGE4Me is conducting gas safety checks at homes & businesses at earthquake impacted areas. Info if you smell gas: https://www.facebook.com/RepMikeThompson/posts/10152371548305748 …,2014-08-26 16:52:59,0,0,504310552001519616
Thanks to men & women in hard hats & blue trucks @PGE4Me for their hard work & dedication to getting the lights back on & gas flowing safely,2014-08-25 21:41:19,9,11,504020722877231104
Info for those who suffered property damages due to Sunday morning’s earthquake: https://www.facebook.com/RepMikeThompson/posts/10152368179835748 …,2014-08-25 19:39:22,0,2,503990033184219136
"For those impacted by today's earthquake, please be aware of scams and fraud: https://www.facebook.com/RepMikeThompson/posts/10152365948130748 …",2014-08-24 21:43:18,3,8,503658835379486721
Another Red Cross Evacuation Center is open in Vallejo: https://www.facebook.com/RepMikeThompson/posts/10152365769930748 …,2014-08-24 20:04:32,0,2,503633978931560449
Info on Red Cross Evacuation Center in Napa: https://www.facebook.com/RepMikeThompson/posts/10152365611445748 …,2014-08-24 18:22:48,0,0,503608377457795072
Info for those impacted by this morning's earthquake: https://www.facebook.com/RepMikeThompson/posts/10152365241840748 …,2014-08-24 17:01:12,3,11,503587843277860865
Great news for Santa Rosa Junior College that will help increase ed opportunities for our Hispanic population:http://mikethompson.house.gov/newsroom/press-releases/rep-mike-thompson-announces-265-million-grant-for-santa-rosa-junior-college …,2014-08-24 13:55:24,2,2,503541084300259330
It was a high honor to recently meet and spend time with the brave men and women of the Hercules Fire Department.pic.twitter.com/eGkO6bSFh9,2014-08-23 14:55:37,1,0,503193852136943617
Attention: On Monday at 5 p.m. I’ll be hosting an event on concussion identification and prevention at @srjcpic.twitter.com/t18Ei86WDq,2014-08-22 15:53:20,0,1,502845988487565312
Had a great time at the Solano Land Trust’s Aim for Ag Sporting Clay Shoot. Thanks to the Land Trust for their work.pic.twitter.com/5WiqzqAl1m,2014-08-21 18:55:58,0,0,502529558999216128
Introduced bipartisan bill to expand telehealth services under Medicare so best care is available to all Americans no matter where they live,2014-08-20 17:51:25,2,2,502150926837506048
Thanks to all who came to Alhambra High School for our meeting on concussion identification and preventionpic.twitter.com/9jiVjnMudv,2014-08-19 18:34:28,3,0,501799372519383040
Hosting meeting on concussion identification and prevention tonight at 6 pm at Alhambra High Schoolpic.twitter.com/evxPuTdlQp,2014-08-18 14:36:40,2,3,501377142723465216
Threw out the first pitch at the @VallejoAdmirals game. Go Admirals!pic.twitter.com/W5nQZtEOqz,2014-08-17 14:27:41,4,2,501012491644985345
Toured Santa Rosa’s Vista Family Health Center in recognition of National Health Center weekpic.twitter.com/3Lw9X7lTk1,2014-08-16 16:21:33,2,2,500678761235632129
"Had a great event with @NancyPelosi & community leaders - When Women Succeed, America Succeeds!pic.twitter.com/5EcVVjs1sO",2014-08-15 16:28:25,2,3,500318101473603584
Recently had a meeting with the Hercules Rotary Club. Many thanks for their great work on behalf of our communitypic.twitter.com/3XnUJVQslT,2014-08-14 18:37:01,0,1,499988077193220096
Joined local leaders to open the new Napa Berryessa Resort Improvement District Wastewater Treatment Plantpic.twitter.com/BRwf0iyxDK,2014-08-13 15:25:00,1,7,499577365669093376
Hosting community meeting on concussion identification and prevention this Monday at 6 pm at Alhambra High Schoolpic.twitter.com/f5YOaiAKbA,2014-08-12 15:42:14,0,1,499219316144087040
"As a Vietnam vet, was honored to speak to a group of Vietnam vets & their families on 50th anniversary of Tonkin Gulfpic.twitter.com/MpLIqmSdue",2014-08-11 17:08:17,2,2,498878584753508352
Toured two Fish Friendly Farming (FFF) recognized properties. Many thanks to FFF for all their workpic.twitter.com/r1PYv1PXXw,2014-08-10 18:45:49,1,2,498540737861259265
Proud to announce an important $1 million grant for the Charles M. Schulz-Sonoma County Airport. Read more:http://www.pressdemocrat.com/news/2445614-181/rep-mike-thompson-announces-1 …,2014-08-09 12:38:11,1,1,498085833539616768
Many thanks to all who came to our community meeting on concussion identification and preventionpic.twitter.com/81Pyz1yhEr,2014-08-08 14:43:59,0,1,497755105295597568
Thanks @facebook 4 hosting a great event for small businesses to learn how to use social media to grow their businesspic.twitter.com/7euRr1SA3o,2014-08-07 13:37:07,2,2,497375889806884864
Hosting a community meeting on concussion identification and prevention tonight at 5pm at Kelseyville High Schoolpic.twitter.com/Tx8RQK8GpL,2014-08-06 14:23:06,1,1,497025072671248384
"The Polar Star has arrived at Mare Island for dry docking and ship repairs, creating 70 full-time jobspic.twitter.com/ggA1dc7gnb",2014-08-05 16:10:16,0,1,496689653341519874
My thoughts and prayers are with the Brady family. James and his wife Sarah’s work has made our country better and safer place.,2014-08-04 19:15:37,3,0,496373910209048576
Proud to recognize St. Helena native Rich Salvestrin as the 2014 Napa County Farm Bureau Agriculturalist of the Year.pic.twitter.com/lNCepjd57f,2014-08-03 13:49:53,2,0,495929550900330496
