Text,Date,Favorites,Retweets,Tweet ID
Designating North Korea as a state sponsor of terrorism is a critical piece of what must be a comprehensive US strategy for addressing the Kim regime's destabilizing and dangerous agenda.,2017-11-22 23:05:21,3,1,933471490305150976
"My thoughts and prayers are with the Sailors onboard the transport flight that crashed off the coast of Japan today. Hoping for a quick resolution to the status of the three who remain missing at this hour, and a speedy recovery to all involved.",2017-11-22 18:58:28,16,6,933409363980685312
"This weekend, Afghan women ran in the Bamiyan Marathon...This month, I met with former First Lady Laura Bush & Afghanistan’s First Lady Rula Ghani on programs to strengthen women’s freedom & participation in that country...https://www.facebook.com/USRepKeating/photos/a.189264207754847.51504.183092598372008/1851998711481380/?type=3&theater …",2017-11-14 01:11:25,21,4,930241726987558912
Continuing to commemorate the 242nd birthday of the US Marine Corps in Falmouth.pic.twitter.com/dlLIGresTO,2017-11-09 22:05:56,20,8,928745496860078080
Marking the 242nd Birthday of the US Marine Corps with an early celebration in the Capitol.pic.twitter.com/hkClst50KT,2017-11-09 19:39:25,7,4,928708625203417089
Heading home after last votes and had good company on the runway at TF Green when I landed.  Any predictions for this week's game?pic.twitter.com/9KeMdtZ7Q1,2017-11-09 19:25:22,24,5,928705090839547904
"From @GlobeScotLehigh: 

""So let’s consider more apt and accurate names.

Like, say, the National Debt Expansion Plan. Or the Medicare Benefits Endangerment Package. Or perhaps even the Tax Hike for the Next Generation Act.

Does it still sound good?""https://www.bostonglobe.com/opinion/2017/11/07/tax-reform-not-even-close/kKLQS9dLyfSpalhRChadoN/story.html …",2017-11-08 20:21:12,9,4,928356751392600065
Today I participated in a bipartisan briefing with drug enforcement professionals and public health officials: https://www.facebook.com/USRepKeating/photos/a.189264207754847.51504.183092598372008/1839391776075407/?type=3&theater …,2017-11-01 21:20:26,10,2,925834942319341569
Sec. DeVos is denying loan forgiveness for those defrauded by for-profit colleges without explanation to victims.http://www.apnews.com/bfc1cfa1c7ae42f6a4489373be5b9262 …,2017-10-30 21:09:23,13,24,925107388637765632
America cannot be a country that allows discrimination against people w/ pre-existing conditions. #GrahamCassidy allows this discrimination.,2017-09-20 17:45:16,48,24,910560505919664128
"Congress can, and must, take action to make #DACA law. (4/4)",2017-09-05 17:48:47,19,6,905125573281898496
Action begs question: Where was @realDonaldTrump’s focus on “law & order” last week when he pardoned a convicted Sheriff? (3/4),2017-09-05 17:48:24,23,6,905125475265150976
".@realDonaldTrump's decision and AG Sessions statement fail to recognize that #dreamers, by definition, are law-abiding Americans. (2/4)",2017-09-05 17:47:49,24,7,905125330012209152
Congress must take swift action and bring a vote to the floor to preserve DACA. (1/4),2017-09-05 17:47:02,29,9,905125132422742017
Hoping all those living through Hurricane Harvey stay safe.  Our thoughts and prayers are with you.,2017-08-26 14:51:43,30,13,901457132041773056
"Condolences to victims, families, & all affected by act of terrorism in Barcelona. The United States stands with the people of Spain. ",2017-08-17 20:04:53,19,2,898274453120929793
"POTUS's words demonstrate a moral compass where north is south, east is west.We must be of one course as a country-to condemn hate & racism.",2017-08-15 22:21:59,31,16,897584178182541312
My thoughts are with all those injured today in Charlottesville.,2017-08-12 20:41:59,14,7,896471850359894016
It has become a beacon for all and we will continue to endure in those beliefs regardless of those who wish to destroy our values.,2017-08-12 20:41:44,17,8,896471789093752832
America does not belong to one race or ethnicity or group.,2017-08-12 20:41:13,23,11,896471656226586624
"Hatred and violence have no place in our society, but the white supremacy marches yesterday and today go beyond that.",2017-08-12 20:38:53,43,17,896471068734623745
The recklessness of the President's statement on North Korea yesterday is undercutting diplomacy and putting us all in danger.,2017-08-09 21:10:42,30,10,895391913397956608
"Simply stated, MA is a better place thanks to @nikiinthehouse's lifetime of service. Proud to call her a friend.",2017-08-09 19:28:00,19,3,895366069271003136
"Today's POTUS anti-transgender tweets are repugnant. To the est.15,000 currently serving: I value you, I support you, I will fight for you.",2017-07-26 17:56:51,84,22,890269701447843840
John McCain is an American hero and a colleague on foreign affairs issues. He and his family are in our thoughts and prayers.,2017-07-20 12:21:50,34,5,888011064453083136
My prayers are with the families of the Marines & Sailor who tragically lost their lives yesterday in Mississippi.,2017-07-11 18:38:35,17,2,884844385074106369
chief of which is to serve others. Self-serving attacks belittle office. Time for Trump to stop tweeting and get to work. (3/3),2017-06-30 15:25:12,20,5,880809452680642560
"kids & seniors going hungry w/o SNAP; climate change rollbacks.  Holding public office comes with responsibilities, (2/3)",2017-06-30 15:24:41,10,2,880809320077819904
Trump attack on Mika was unacceptable.  Also unacceptable: nearly doubling healthcare premiums for all Americans; (1/3),2017-06-30 15:21:25,40,16,880808499017658370
"And don’t forget: Senate #Trumpcare still strips 22 million people of their health insurance, including 15 million in 2018—as in next year.",2017-06-27 18:33:36,7,3,879769698187046913
2.4 million women—*and men—receive vital health services from Planned Parenthood each year. Senate #Trumpcare eliminates their support.,2017-06-27 18:33:05,10,7,879769570105602052
"#Trumpcare cuts Medicaid by $772B. Who gets hurt: 40% of all children, 64% of seniors in nursing homes, & 49% of families giving birth.",2017-06-27 18:12:57,8,8,879764502945902592
Senate #Trumpcare lets insurers discriminate against women simply because they’re women.,2017-06-27 17:51:37,5,5,879759136388526086
"If you’re an older American, Senate Trumpcare makes you pay 115% more per month for your health insurance.",2017-06-27 16:49:29,6,4,879743500253900802
"If you’re sick and want to buy insurance to help pay for your care, Senate #Trumpcare makes you wait six months.",2017-06-27 16:10:52,3,1,879733782030548992
No more help with substance use disorders. No more coverage for maternity care. No more preventative care to help control diabetes.,2017-06-27 16:02:34,4,2,879731689437749248
Senate #Trumpcare guts essential health benefits and protections for pre-existing conditions.  No more coverage for cancer survivors.,2017-06-27 16:02:03,3,4,879731562799132672
No more help with substance use disorders. No more coverage for maternity care. No more preventative care to help control diabetes.https://twitter.com/USRepKeating/status/879726868890603521 …,2017-06-27 15:55:56,2,2,879730021690208257
Senate #Trumpcare guts essential health benefits and protections for pre-existing conditions.  No more coverage for cancer survivors.https://twitter.com/USRepKeating/status/879726806819065856 …,2017-06-27 15:43:24,3,3,879726868890603521
Further analysis of Senate #Trumpcare:,2017-06-27 15:43:09,7,4,879726806819065856
Latest #Trumpcare estimate: 22m lose insurance. Those who don’t lose insurance have to choose between less coverage or higher premiums.,2017-06-26 20:52:16,13,10,879442208608464896
Hero @CapitolPolice officer David Bailey threw first pitch last night. Took this on my iPhone as Joe Torre and Roberto Clemente Jr. look on.pic.twitter.com/ZkqDyi4mPx,2017-06-16 14:18:22,12,2,875719201679454208
"As situation in Alexandria develops, my prayers for a speedy recovery are with Rep. @SteveScalise, our Capitol Police, and staffers.",2017-06-14 13:11:47,26,15,874977669103878144
My op-ed in the Globe on how we can get to the bottom of Russia's attack on our country:https://www.bostonglobe.com/opinion/2017/06/09/clear-decks-are-under-attack-from-russia/kE8X4oKxuJngw47Hd8J7UP/story.html …,2017-06-10 13:02:29,17,7,873525776339132416
Keeping all affected in London attacks in my thoughts & prayers. Will continue to monitor situation as Ranking Member of Terrorism Subcomm.,2017-06-04 00:16:16,36,14,871158624512593920
US has stepped aside & allowed allies & adversaries alike to fill our shoes as both an economic & moral leader. #ParisAgreementpic.twitter.com/Av0y4xHB22,2017-06-01 20:04:15,21,6,870370426693849090
"If Trump moves to leave #ParisAgreement, he will single-handedly limit US leadership, stifle economic growth & threaten our security.",2017-05-31 15:19:10,31,10,869936296839479297
"Today we honor the memory of our fallen heroes who sacrificed all, so that we can live free.pic.twitter.com/Z6Mn6rbyNd",2017-05-29 15:23:08,11,4,869212521458257920
Kaiser Family Foundation: #GOP voted for Medicaid & CHIP cuts that jeopardize treatment for 3 in 10 Americans w/opioid addiction. #Trumpcarepic.twitter.com/w9F2IZDgjM,2017-05-25 19:48:19,7,4,867829701846421506
#Trumpcare steals from us all to give to the richest of the rich.,2017-05-24 21:52:02,10,6,867498450908270592
"CBO: #GOP voted to gut Medicaid, strip guarantees for basic services & pre-existing conditions; & #Trumpcare still leaves 23m uninsured.",2017-05-24 21:49:35,11,7,867497832470560768
"Disastrous data from Globe: uninsured in MA could rise to over 10% under #Trumpcare. Currently ~3%, lowest in US.http://bit.ly/2qOVzwE ",2017-05-24 14:04:28,5,7,867380784751095808
Is anyone surprised that POTUS boasted to Russian diplomats about his dismissal of Comey to relieve pressure? Careless & dangerous.,2017-05-19 19:46:51,31,10,865655007764332544
Proud to be original co-sponsor of legislation in Congress to make 5/17 International Day Against Homophobia & Transphobia #IDAHOT,2017-05-17 21:24:28,31,6,864954799019749376
"As frmr prosecutor, I believe an obstruction of justice investigation is warranted. Investigation should not be limited to Intel Committees.",2017-05-16 22:32:15,83,31,864609467823947780
"With American lives & those of our allies jeopardized, the long silence from Congressional Republicans is no longer acceptable. (2/2)",2017-05-16 01:31:51,49,19,864292276931088385
POTUS revealing classified information to a hostile foreign nation betrays his fundamental obligation as commander in chief. (1/2),2017-05-16 01:30:34,47,13,864291956750462976
Time to end Republican silence in the House. Support special prosecutor or be part of the coverup.,2017-05-12 11:40:37,48,23,862995925614067713
More important than ever to keep investigation going. All Americans must keep demanding answers. Only way we'll get to truth.,2017-05-11 11:49:32,38,11,862635782179311616
So clear Comey was fired because investigation was heating up.,2017-05-11 11:48:12,34,9,862635448266522624
"Taking place in middle of investigation into cyber attack on US and Trump involvement, this shatters public confidence in our systems. (2/2)",2017-05-09 23:25:15,62,29,862086090534080512
"As a former prosecutor, Comey firing again underscores the need for independent investigation of Trump campaign. (1/2)",2017-05-09 23:24:43,83,48,862085956035280897
House Republicans TrumpCare Vote:https://www.youtube.com/watch?v=hlqm_09XvMs …,2017-05-04 19:24:50,6,3,860213646647058433
Today I voted in favor of the Fiscal Year 2017 Omnibus Appropriations Act. Full statement: https://www.facebook.com/notes/us-representative-bill-keating/keating-statement-on-funding-bill/1377982855596882/ …,2017-05-03 21:11:58,7,3,859878221403348993
"Great job #Falmouth Prevention Partnership, @Falmouth_Police, & #ProjectPurple on today's #DEA drug take back - open at FPD til 2 PM!pic.twitter.com/SLd84rXuMc",2017-04-29 16:36:54,6,3,858359445985873922
I enjoyed having a discussion with @NECouncil this morning about national security and other important issues facing our nation.pic.twitter.com/M3ysayLE6L,2017-04-12 15:13:01,11,4,852177742787424260
Statement on last night's missile strike in Syria.pic.twitter.com/LgfwNfjzU2,2017-04-07 16:20:16,8,2,850382730516975616
"Proud to join @RepJohnLarson to reintroduce the Social Security 2100 Act in support of MA09’s 185,000+ beneficiaries & all older Americans.pic.twitter.com/tj4VFnb2To",2017-04-05 21:07:00,16,7,849730112517832704
"Major reason behind GOP pulling #AHCA today? Your calls, emails, letters, tweets... Don't let up the pressure, don't stop paying attention.",2017-03-24 20:33:25,65,26,845373005266124800
#AHCA = $600b in tax breaks for the wealthiest paid for by the rest of us - $5k extra out of pocket in 2017 alone for #MA09 residents 55-64.pic.twitter.com/ifgLqQz3Kh,2017-03-24 18:56:41,18,17,845348663014633472
20 Foreign Affairs Dems joined op-ed I authored. Have long maintained need for ind invest of Trump/Russia tieshttp://thehill.com/blogs/congress-blog/politics/325388-independent-investigation-into-russian-interference-needed …,2017-03-23 17:50:14,44,28,844969550143729665
"Trump says GOP plan is ""a thing of beauty"" - there's nothing beautiful about 24 million people losing their healthcare.",2017-03-13 22:20:28,70,43,841413678259961862
Latest from the small government GOP: Step into the boss's office for your weigh-in.https://nyti.ms/2mvmRG4 ,2017-03-11 23:16:43,13,11,840703060741636096
"As @RepJoeKennedy points out, 11 million would lose coverage for opioid treatment under the GOP health plan. #ProtectOurCare #ACAhttps://twitter.com/RepJoeKennedy/status/839625760575008768 …",2017-03-09 22:08:16,501,382,839961058727059459
"To the women of #MA09, to my wife Tevis & daughter Kristen, to the women on my team: I support you and stand with you on #ADayWithoutAWoman.pic.twitter.com/UdfOuGm3QM",2017-03-08 23:32:56,37,9,839619977170792448
"NYT: #Republicare cuts funding for the poor, taxes for the rich. USAToday: Hard to find winners under #Republicare. What were they thinking?",2017-03-07 17:40:12,37,16,839168818941472770
15 mil people who gained coverage will lose it. Older Americans get charged 5x more for their plans. GOP made us wait 7 years for that? #ACA,2017-03-07 13:03:14,651,504,839099120459608064
To @GavinGrimmVA & all trans students: I support your right to a safe education. SCOTUS must rule to #ProtectTransKids. #StandWithGavin ,2017-03-03 16:48:47,862,201,837706328596426752
"Earlier this morning, I called on Attorney General Sessions to resign.  http://ow.ly/l5v7309wGp1 ",2017-03-02 18:49:52,58,12,837374412022300672
Proud to be a @janedoe #WhiteRibbonDay Ambassador & to bring pledge to Congress for the 6th year in a row. http://bit.ly/2mffy60  #WRD2017,2017-03-01 21:10:28,9,2,837047406881538048
What we've know all along.  MA is #1.http://ow.ly/1yR4309rMZs ,2017-02-28 18:37:06,20,7,836646423353511938
#TBT to my post last week: #ProtectTransKids #YouAreLoved http://ow.ly/rXb2309iA9a ,2017-02-23 20:35:49,14,4,834864362447892480
Everyday activities shouldn’t provoke fear of discrimination. Protect & respect our transgender citizens. #EveryoneWelcome @LGBTEqCaucus,2017-02-17 21:08:12,45,19,832698185403359233
My op-ed in today's Globe: why we need an independent commission to investigate this Administration’s ties w/Russiahttp://ow.ly/xAjA3096uyc ,2017-02-17 15:52:06,67,48,832618633645916160
Sgt. William Carney: Civil War Hero & 1st African American Congressional Medal of Honor Recipient #BlackHistoryMonth http://ow.ly/5Arj30953TS ,2017-02-16 21:56:09,9,5,832347864370126848
"Today, the House passed legislation to strip away Title X funding. #WarOnWomen http://ow.ly/V4ny3094Xzf ",2017-02-16 21:26:59,6,7,832340523146997761
What a game. Congratulations to the @Patriots!,2017-02-06 04:35:20,48,8,828462055543955457
"Yesterday, my bipartisan airport perimeter security bill passed the House & is on its way to the Senate for a vote.http://ow.ly/O3Xy308CWZT ",2017-02-02 22:10:04,14,4,827277933718835200
"Today, I spoke w/ Braude & Eagan on @BosPublicRadio  Listen to our discussion on recent EO & my airport safety bill.http://ow.ly/5Bv6308CVq1 ",2017-02-02 21:39:50,5,0,827270325393977344
Today is the last day of open enrollment for 2017 health coverage. Visit MA Health Connector to #GetCovered today. http://ow.ly/NYxp308xYmW ,2017-01-31 21:47:03,12,11,826547365905592320
Proud to stand on steps of the Supreme Court with House & Sen Dems to oppose @POTUS Executive Order on immigration.pic.twitter.com/N9tAvPlo27,2017-01-31 01:17:06,99,17,826237838815531009
HR 7: Another attempt to deny women their fundamental right to make health decisions. (2/2) @PPMASS @ProChoiceMass http://ow.ly/J5An308jQJL ,2017-01-24 22:42:37,26,9,824024633993285635
"Despite millions marching Sat., the magnitude of GOP’s #WarOnWomen remains astounding. (1/2) @PPMASS @ProChoiceMass http://ow.ly/J5An308jQJL ",2017-01-24 22:38:52,27,9,824023690853699584
Corporations are not people & money is not speech. Proud to cosponsor #Democracy4All amendment to overturn Citizens United. #GetMoneyOut,2017-01-24 20:43:05,42,9,823994553598349312
Great energy among the 600+ ppl at today's #FalmouthMarchForAmerica - Thanks @WoodsHoleResCtr & #EngageFalmouth for sponsoring! #WorkToDopic.twitter.com/4OSZQRfneo,2017-01-22 03:19:09,38,8,823007066042335236
@PPact provides countless women w/critical health services. The GOP plan to defund it is outrageous. Time to get on the phone. #IStandWithPPhttps://twitter.com/PPact/status/817096502640312320 …,2017-01-05 23:04:03,28,13,817144658405027842
Anything less will not only undermine our national security but our democracy. (3/3),2017-01-05 17:58:12,15,10,817067690569433089
"conducted & will likely continue to conduct hostile cyber attacks. In order to thwart this, we must first acknowledge its existence. (2/3)",2017-01-05 17:57:39,13,11,817067553566625793
"As someone who has sat across from the FSB on 2 trips to Russia, it’s time for our President-elect to accept the fact that Russia (1/3)",2017-01-05 17:57:09,17,13,817067426210844672
Critical to have your voice heard over next 2 years to protect our values. (2/2),2017-01-04 20:20:39,19,5,816741153605349376
Clear example your voice matters: GOP pulling plan to gut independent ethics committee because of public outcry. (1/2),2017-01-04 20:19:44,19,4,816740920829890560
.@RepJoeKennedy Thanks for stopping by to celebrate the start of the 115th Congress with Tevis and me!pic.twitter.com/xILd2ntw4l,2017-01-03 22:11:02,17,2,816406542585131008
"Great to speak with you & other service members while visiting Okinawa, Tokyo, & U.S. Pacific Command last week.Thank you for your service.https://twitter.com/rideout_charles/status/811117803189071872 …",2016-12-29 22:27:24,10,6,814598722357260292
Great tour (and lunch!) at @GreasyLuckBrew this week - lots of exciting new establishments in #downtown #NewBedford #hotspotspic.twitter.com/T5kJ6CnePX,2016-12-17 22:37:01,6,0,810252486502219776
Proud to join Cape Cod @GmasAgainstGV & @MomsDemand to mark the 4th Anniversary of the #SandyHook shooting - impt to remember AND to actpic.twitter.com/ph6cu1nVQb,2016-12-16 19:57:02,31,15,809849838032551936
Congrats to #MA09 @CongressionalAC winners Alec Lawrence & Justin Gaiser of @Pembroke_Titans! Can't wait to congratulate them in person!pic.twitter.com/WzIHJZVqyH,2016-12-07 20:28:52,7,3,806596357322579968
Congrats to @DuxAthletics @FHSClippers @HanoverHSMA @MashpeeAthletic on your @MIAA033 Super Bowl wins at @GilletteStadium today!,2016-12-04 03:19:34,9,2,805250162281025536
"My staff & I wore Purple to #WageHope against pancreatic cancer, 3rd deadliest cancer in US #PANCawarepic.twitter.com/SRv0nejaSM",2016-11-17 23:11:04,14,1,799389419182690304
"#ThxBirthControl for letting women decide if, when and under what circumstances they make 1 of the most important decisions of their lives",2016-11-17 02:23:14,43,9,799075394469171200
"We are a country and a world of diverse communities and ideas. Embrace #tolerance for a stronger, more peaceful tomorrow #ToleranceDay",2016-11-16 20:15:52,25,2,798982943251120128
Great #VeteransDay in #MA09 - moving tributes in #Falmouth #Bourne & #Plymouth to veterans of all eras #ThankYouVetspic.twitter.com/ynVhcRvfln,2016-11-12 00:11:47,11,2,797230371335237645
Thank you @VeteransHouse for invite to SE MA Veteran of the Year dinner - congrats to 2016 honoree Priscilla Fonseca #VeteransDaypic.twitter.com/wfBTjw73jC,2016-11-11 03:53:54,10,1,796923881546194945
Any original app created w/i the last year is eligible! Deadline is 12 noon on Wednesday 11/2!https://twitter.com/CongressionalAC/status/791749110466392064 …,2016-11-01 14:43:14,1,2,793463414739836928
"Tomorrow (Wed) is deadline for @CongressionalAC App Challenge! #MA09 students, go 2 http://www.congressionalappchallenge.us  to register & submit by 12 noon",2016-11-01 14:40:13,2,1,793462653624737793
One week until the @CongressionalAC app challenge deadline! #MA-09 students: Submit your apps by Wed 11/2pic.twitter.com/FCdgphTYh4,2016-10-26 15:57:59,2,1,791307897133273088
Thanks Bishop @emdacunha for joining  our Clergy Roundtable on opioids in #FallRiver last night - great discussionspic.twitter.com/9QDHRmdrlb,2016-10-25 23:53:42,6,4,791065228389646336
Deadline for @CongressionalAC App Challenge submissions is Nov 2!  Can't wait to see this year's ideas from #MA09 students!pic.twitter.com/IKYqHxlXAp,2016-10-20 16:44:00,4,4,789145149985198080
Staff office hrs in W Tisbury tomorrow & on Nantucket next Monday. Stop by for help w/federal issues or call Hyannis off. at 508-771-0666.pic.twitter.com/8xEzKFVJXc,2016-10-18 01:40:41,5,2,788193048815599616
#ITIN taxpayers in MA-09 should know about changes that may impact your #IRS return - go to http://irs.gov/ITIN pic.twitter.com/iCaa0ytuun,2016-10-07 15:19:48,1,1,784412921321312257
Or will inaugural champs @NBPublicSchools return to the winner's circle in the MA09 @CongressionalAC ? Deadline for entries is November 2!,2016-10-05 01:44:47,2,1,783483037870718976
Will @Pembroke_Titans repeat as champions in the #MA09 @CongressionalAC App Challenge? You can't win if you don't enter an app by Nov. 2!,2016-10-05 01:35:07,2,1,783480607435329536
Thanks Mr. Harrison! Let's get some Bulldogs into the @CongressionalAC !!https://twitter.com/rocklandhs/status/781906494488973312 …,2016-10-04 19:59:10,3,2,783396059590500353
#MA09 is in for the @CongressionalAC App Challenge - open to HS students or younger; for more info http://www.congressionalappchallenge.us/  - Nov 2 deadline!,2016-10-04 19:35:19,5,0,783390059064164353
Proud to join colleagues on both sides of the aisle in celebrating opening of @NMAAHC - impt to add diverse voices to historical discussion,2016-09-24 19:30:10,5,3,779764885127323648
Mayflower II is an important linchpin in #MA09 travel industry - congrats @plimoth!https://twitter.com/bostondotcom/status/779359957976227840 …,2016-09-23 17:15:51,4,0,779368696305233920
"Very pleased that the House passed my bill to cut terrorist financing, the Prevent Trafficking in Cultural Property Act",2016-09-22 22:50:35,13,9,779090546107228165
Proud to stand w/the Veterans who served on the USS Duxbury Bay as #Duxbury marks 50th Anniversary of decommissioning - TY for your servicepic.twitter.com/flcgSuYhuG,2016-09-20 00:41:21,9,3,778031256034430976
Proud to kickoff the #Walk2EndAlz in #Plymouth w/ @alzassociation - beautiful morning and a great crowdpic.twitter.com/Nu7s1qBmZJ,2016-09-17 14:52:07,14,5,777158194447679488
.@AlessiaLRiccio Thanks for making the trip to DC for #CancerLobbyDay. Keep up the good work & good luck @RelayBU!pic.twitter.com/s3Abruf2Oh,2016-09-13 17:06:12,9,4,775742388748820480
"Honored to join the #Falmouth community at 9/11 events, praying for peace and for our 1st responders #NeverForget http://www.capenews.net/falmouth/ ",2016-09-12 02:16:12,3,0,775156024382746624
"Let us mark the sacrifice of those lost 15 years ago by serving the community, honoring Veterans & supporting First Responders #NeverForget",2016-09-11 15:26:33,17,4,774992536012197890
Honored to once again serve as #grandmarshal of  @SeasideLemans #CapeCod - kudos to organizers for a great eventpic.twitter.com/Llw1fy2Z5U,2016-09-10 20:49:16,18,6,774711360781418496
Honored to join @MassGovernor @JonMitchellNB & state/city officials to mark progress on wind power in #NewBedford!pic.twitter.com/tqhACbrVKc,2016-09-06 21:03:01,3,2,773265268680318976
An honor to meet Dr. T. Berry Brazelton & discuss the great work @ABabyCenter does for Cape Cod families #MA09pic.twitter.com/jfF83DuQNm,2016-09-01 00:44:03,14,3,771146565356486656
Great meeting w/Scouts from #Pembroke on Eagle project to encourage safe disposal of unwanted Rx drugs #Ma09pic.twitter.com/qv2hR8TxXB,2016-08-30 22:35:25,14,2,770751808427978753
Happy Birthday #NPS100! #TBT to Cape Cod National Seashore's 50th Anniversarypic.twitter.com/RIhZPNwWZV,2016-08-26 00:57:07,13,6,768975528149811200
Pleased that @USCGNortheast will hold meetings on aids to navigation in Buzzards Bay thank u @SenWarren @SenMarkey & Rep Straus for advocacy,2016-08-22 20:47:44,7,4,767825606071418880
Proud to join @GenDunford & @PembrokeMA in honoring Brian McPhillips & Matthew Bean. May their service inspire us.pic.twitter.com/Ly8OOsu8lM,2016-08-17 12:30:59,11,4,765888654359289856
Weapons of war->no place on our streets. Tomorrow LGBTQ community & gun violence prev groups demand action. I stand w/them. #DisarmHateRally,2016-08-12 21:18:32,9,4,764209478417940481
Plymouth: $600K Grant Awarded to Clean Up Former Toxic Waste Dumping Site on Water St.http://959watd.com/blog/2016/08/plymouth-600k-grant-awarded-to-clean-up-former-toxic-waste-dumping-site-on-water-st/ …,2016-08-09 16:45:09,4,1,763053514033602560
