Text,Date,Favorites,Retweets,Tweet ID
Congrats to my friend @DreamaDenver on receiving a lifetime @VVAmerica membership for her dedication to #WV veterans.pic.twitter.com/ikSTjLcKhG,2015-03-31 17:35:17,4,6,582959361867149312
Recognizing our mine safety achievements today on anniv of the #CoalAct which passed after 1968 Farmington disaster:  http://1.usa.gov/1EUUlMW ,2015-03-30 16:30:29,2,4,582580667952730112
"Great opportunity for #WV veterans to voice their concerns on Tues, March 31 at 2pm at Huntington VA Medical Center:http://bit.ly/1AuyaL0 ",2015-03-29 14:00:15,5,6,582180469938098176
During #VoteARama I passed out Chico's pepperoni rolls to colleagues & staff. Watch their journey to the @uscapitol:https://vimeo.com/123370341 ,2015-03-27 16:53:23,4,7,581499266306310144
Excited to cheer on @WVUhoops tonight & then enjoy Derby-Pie® w/ my staff afterwards. #HailWV http://1.usa.gov/1FMGnlS pic.twitter.com/Cc7fAWfnql,2015-03-26 22:00:36,20,12,581214193665224704
Introduced 2 amendments to the budget today that will directly impact #WV communities and economic growth. Details:http://1.usa.gov/1FMOChO ,2015-03-26 20:01:58,1,1,581184335748845569
Whats better for lunch than a #WV pepperoni roll? Sharing some Chico's pepperoni rolls with all my colleagues today.pic.twitter.com/SHipyercE0,2015-03-26 17:19:21,27,5,581143413719977984
VIDEO: Yesterday I weighed in on @EPA new ground level ozone standard that hinders economic opportunities. #ICYMI: http://bit.ly/1xCaaew ,2015-03-26 17:15:56,0,0,581142551475789824
Only a few more days left until  summer intern application deadline. Staff at #Concord right now talking with interested students. Stop by!,2015-03-26 15:33:06,1,0,581116675048632321
Congress could learn a lot from #WV youth on how to #budget. Proud of our kids for highest financial literacy scores: http://bit.ly/1FLilrt ,2015-03-26 15:25:06,1,0,581114659601682432
Thank you @fightalzwv for meeting with me this morning and for your commitment to #ENDALZ. http://bit.ly/1LXOBLA pic.twitter.com/0gWnpX8s7E,2015-03-25 15:30:14,12,11,580753564173090816
Interning is a great way to jumpstart your career. Stop by my booth at @marshallu starting at 11 & talk w/ staff abt my internship program.,2015-03-25 13:50:14,4,0,580728398370111488
"In light of recent accidents, I urge the Senate Appropriations Cmte. to invest in safety efforts for crude-by-rail:http://1.usa.gov/1Irreo0 ",2015-03-24 20:15:51,1,6,580463057085693952
Encouraged that @DeptVetAffairs has taken an impt first step toward fixing the Veterans Choice Program 40-mile rule:http://1.usa.gov/1Ox7L9N ,2015-03-24 18:30:15,1,2,580436480201338880
"My staff was proud to help recognize Libby Stout, Clarksburg native & former Rosie the Riveter for her loyal service: http://bit.ly/1IlXKrG ",2015-03-23 22:29:05,5,2,580134197920059393
"Congrats @WVUhoops on #Sweet16. I was there in 2010 when we beat #1 Kentucky, and I know we can do it again. #HailWVpic.twitter.com/K3iYMswLie",2015-03-23 17:04:03,23,10,580052400721006592
Ready to cheer on the #Mountaineers. Good luck tonight @WVUhoops. #MarchMadness #WVUvsMD,2015-03-22 23:46:19,31,12,579791247172182016
Congratulations on a great win #WVUHoops. Today is a great day to be a #Mountaineer! Looking forward to Sunday. #HailWV,2015-03-20 20:43:56,22,17,579020569154301952
#ICYMI Take a look at what I've been working on this week in Washington: http://1.usa.gov/1I6vzNr pic.twitter.com/CRehZmxERA,2015-03-20 20:30:08,2,1,579017098342469632
Great first half @WVUHoops. Keep it up #Mountaineers. #HailWV #MarchMaddness Let's #BeatBuffalo,2015-03-20 19:15:41,16,8,578998361866387457
"Enjoying watching our #Mountaineers lead against Buffalo. Let's go @WVUhoops, keep it up! #WVUvsBUF #MarchMadness",2015-03-20 18:41:05,12,8,578989656328523776
It was a pleasure to be part of the Inaugural Bridge Valley Founder's Day today & to help unveil the new Toyota Hall.pic.twitter.com/RTNPINJD45,2015-03-20 18:08:57,1,3,578981567206416384
March is #NationalNutritionMonth - celebrate the importance of healthy eating by reviewing these great @MyPlate tips: http://1.usa.gov/1B5ZgbL ,2015-03-19 19:25:05,4,4,578638339764396033
So sorry to learn of the passing of our dear friend Gus Douglass.  Thoughts are w/ the entire family during this timehttp://1.usa.gov/1CA2fQL ,2015-03-19 15:50:15,1,3,578584276070850560
Proud to introduce the TRAIN Act with @RoyBlunt that would promote additional investment in railroad infrastructure.http://1.usa.gov/1F8NnZN ,2015-03-19 15:00:37,4,8,578571785374818306
Enjoyed meeting with @CloseUp_DC students from Bridgeport HS today. Thanks for stopping by and sharing your ideas.pic.twitter.com/nwTKxdACbQ,2015-03-18 22:02:06,18,15,578315468072587266
Our agricultural industry contributes so much to #WV and our entire nation. For info on how to recognize #agday2015:http://www.agday.com ,2015-03-18 20:21:03,2,5,578290035994206208
"Thank you #WV farmers/producers for feeding our families, enriching our communities & contributing so much to our economy. @agday #agday2015",2015-03-18 20:20:17,9,10,578289842842271746
"Best of luck @CoachHuggs and @WVUhoops in the #NCAATournament. We got a tough draw, but that’s how we like it in #WV.pic.twitter.com/Lm7EqqcoiC",2015-03-18 18:23:14,28,22,578260387184971776
Right before my meeting with Loretta Lynch. Proud to support her nomination for AG.#ConfirmLynchpic.twitter.com/u9ALWjODgQ,2015-03-18 14:32:08,25,21,578202228915236864
Meeting w/ AG nominee Loretta Lynch. It's time to put politics aside & vote to confirm her nomination. #ConfirmLynchpic.twitter.com/6gUEXZipJf,2015-03-18 14:05:06,9,8,578195427712872450
"Good luck 2 all of the teams competing in #WVSSAC Boys State Tournament starting today, & congrats on a great season. http://bit.ly/1MN3Ceg ",2015-03-18 12:40:03,2,3,578174020387909633
"#WV is honored to have 107 year old Charles P. Clark, the oldest living confirmed WWII veteran, at  @MartinsburgVAMC: http://1.usa.gov/1xbHQPT ",2015-03-17 19:48:11,15,9,577919379024658432
"Thanks @SteveKornacki for a great discussion on @hardball last night about the #IranTalks. #ICYMI, Watch here:http://bit.ly/1xuXTCV ",2015-03-17 18:39:05,5,3,577901986739142656
"I’ve always said we need to strike a balance btwn the environment & the economy, which is what the CASE Act would do:http://1.usa.gov/1GjwFnD ",2015-03-17 16:36:07,3,1,577871042548396033
State staff had a great morning at @WVWesleyan. Next stop is @ABU1871 at 1:30pm. Stop by & talk with them about internship opportunities.,2015-03-17 16:34:00,4,0,577870509469118464
#ICYMI: Earlier I spoke with @ehasselbeck on @foxandfriends about the Iran nuclear negotiations. Watch:  http://bit.ly/1EZgn6g  #IranTalks,2015-03-17 15:41:03,3,4,577857183771009024
"Did you know theres an Ireland, #WV in Lewis County? Happy #StPatricksDay everyone! #funfact http://bit.ly/1bdt2pK pic.twitter.com/NNJIIMSWFn",2015-03-17 14:33:13,21,14,577840113880694785
Thank you @ahcancal for supporting our legislation that will ensure our #veterans can access the services they need. http://bit.ly/1APnbfh ,2015-03-16 21:14:35,3,6,577578731281117184
"Congratulations Woodrow Wilson HS teacher Karen Bonnett, & thank you for your extraordinary commitment to WV's youth:http://1.usa.gov/1MGiQBK ",2015-03-16 20:09:09,1,0,577562266494615552
"Thanks to @SenateYouth, our front office looks and smells better than it ever has before. The flowers are beautiful.pic.twitter.com/bqXoHjyJXU",2015-03-16 19:30:27,8,1,577552524959334400
Such a wonderful @wvgazette story about the Keystone Apostolic Church and this community’s great hope and resilience:http://bit.ly/1AwaPd1 ,2015-03-16 17:00:48,3,0,577514867063549952
"The ""Veterans Access to Extended Care Act"" will impact #WV veterans who deserve quality, long-term care. Learn more:http://1.usa.gov/19rNnqM ",2015-03-16 16:01:03,4,4,577499829678411776
Video: @SenJohnHoeven and I introduced a bill that will empower our veterans to use local long-term care providers: http://bit.ly/18xzzKi ,2015-03-16 16:00:45,4,2,577499755841875968
Interested in learning more about public service? Today at 11am my staff will be at @davisandelkins to discuss my internship programs.,2015-03-16 14:34:57,4,3,577478160092119040
#ICYMI: Watch my interview with @bobschieffer on @FaceTheNation this morning regarding the GOP #IranLetter:http://bit.ly/1BIX8eC ,2015-03-15 19:50:16,4,9,577195127086534656
We're very proud of our granddaughter Sophie. Congrats to all of the athletes who competed in the WVSSAC tournament.pic.twitter.com/4q4Vs0agES,2015-03-15 16:00:27,17,2,577137289811243008
#ICYMI: Continuing to work hard for West Virginians in Washington. Check out my new weekly review: http://1.usa.gov/1MyOdQq  #CatchingUpWithJoe,2015-03-13 21:30:31,2,2,576495577963216897
Read my full statement on my visit to the @YeagerAirport landslide site this morning: http://1.usa.gov/1FYPaO5 pic.twitter.com/Hw2KhUZqFB,2015-03-13 16:50:46,1,8,576425176440684544
Cheering on our granddaughter Sophie at the #WVSSAC High School State Tournament. Congrats/good luck 2 all the teams.pic.twitter.com/wk1pxxKFQk,2015-03-13 15:55:09,7,3,576411183210610688
Devastating damage from the @YeagerAirport landslide. Our staff will do all we can to help this community rebuild.pic.twitter.com/pgz07889EW,2015-03-13 15:05:16,12,43,576398627293134848
Meeting now with Airport Director Rick Atkinson & other officials at @YeagerAirport to assess the landslide damages.pic.twitter.com/b2M8UlmYVn,2015-03-13 14:31:26,5,4,576390113850220545
Happened to run into @SenateYouth students on the walk back to my office from the @uscapitol earlier today.pic.twitter.com/R3U69IOhZS,2015-03-12 22:11:27,15,4,576143491312574464
Thank you to the @GirlScouts for 103 yrs of great contributions to our communities. Happy #NationalGirlScout Day to all the troops!,2015-03-12 21:45:00,4,5,576136837279936512
I strongly oppose SB 347 that irresponsibly removes permit and safety training requirements for people who carry concealed weapons #gunsense,2015-03-12 21:26:42,190,198,576132229241372672
I congratulate Heritage Farm Museum & Village for being named #WV's 1st @smithsonian affiliate! What a unique place to learn abt WV heritage,2015-03-12 18:46:59,5,2,576092036790628352
Just attended a great #Senate ENR Cmte hearing on the Bipartisan Sportsmen’s Act that enhances opportunities for outdoor enthusiasts.,2015-03-12 16:12:25,2,1,576053139998175232
"I truly enjoyed meeting this year's @SenateYouth student delegates, who all have bright futures ahead of them #USSYPpic.twitter.com/jMMeCFMuG2",2015-03-12 13:21:22,18,8,576010091377369088
"Without CHIP, more than 37,000 children in #WV and millions across the country could become uninsured. #ExtendCHIPpic.twitter.com/oVUOKNrEcb",2015-03-12 03:43:04,16,29,575864558302052352
Thx @ahahospitals & @AAMCtoday for supporting @senrobportman & my bill to reform #ACA hospitals readmissions programhttp://1.usa.gov/1B1VlfN ,2015-03-11 19:38:00,3,3,575742489245675520
It was great to start my morning by Skyping w/ members of the South Fairmont Rotary. I truly enjoyed our conversationpic.twitter.com/tE4iLGzi1Y,2015-03-11 15:50:07,3,2,575685140606750720
"Its impt to make sure our kids have a healthy start in life, and that includes making sure they have access to health care. #ExtendCHIP",2015-03-11 15:35:14,16,17,575681394145296386
This #ACA fix aims to reform the  Readmissions Program so that all #WV hospitals are evaluated and reimbursed fairly: http://1.usa.gov/1BtTBzx ,2015-03-10 21:21:13,2,0,575406076754972672
Proud to cosponsor groundbreaking legislation that will modernize our severely outdated chemical regulatory system:http://1.usa.gov/1wWCW96 ,2015-03-10 20:40:17,8,3,575395774567075841
The bill that I introduced today with @SenatorBurr will go a long way to assist homeless veterans across our country:http://1.usa.gov/199piEZ ,2015-03-10 18:17:46,5,2,575359910168276992
"Today I introduced a bill that will help WVians access quality, affordable housing for themselves and their families:http://1.usa.gov/1MoKcML ",2015-03-10 15:56:03,5,4,575324242780102657
Happy Birthday @GirlScouts. Thanks for empowering girls everywhere for 103 yrs. To learn abt @GSBlackDiamond in #WV: http://bit.ly/18vIcog ,2015-03-09 21:28:08,10,5,575045426493063168
"Proud to be co-chairing #USSYP2015, and I'm eager to meet with the @SenateYouth delegates @ tonight’s opening dinner:http://1.usa.gov/1E1AJpX ",2015-03-09 20:18:44,20,11,575027962061307906
Sending our deepest condolences to the loved ones of the fallen miner in the Marshall Co. mine collapse. Statement:http://1.usa.gov/1wkwsAs ,2015-03-09 16:10:16,7,5,574965435885465600
Need internship experience? Come talk with my staff today at @WheelingJesuit from 11am-1pm: http://1.usa.gov/1Bgoojk ,2015-03-09 12:00:22,2,6,574902544759029762
This is wonderful news for Tucker Co. and for the entire state of #WV. Thanks @NOAA for approving this impt proposal:http://bit.ly/1aV5NAG ,2015-03-09 00:31:28,11,4,574729178697703424
I'm so pleased that @NOAA has approved @NYSCdotORG's proposal for a state-of-the-art #STEM center at the CVI facility in Tucker County.,2015-03-09 00:29:11,13,5,574728604547862528
Today is #InternationalWomensDay - a day to celebrate the achievements of women in #WV & around the world. http://bit.ly/1DTjS8Q  #IWD2015,2015-03-08 11:54:04,13,13,574538570280529921
"In 2013, I was honored to receive @VH1SaveTheMusic award b/c I know how impt music can be in a child’s life #MIOSM30pic.twitter.com/9XPXNNczBL",2015-03-07 14:15:16,12,5,574211716763930625
Having access 2 music opens so many doors for our kids. Help raise awareness this #MIOSM30:  http://bit.ly/1Ewzfrw  @NAfME @VH1SaveTheMusic,2015-03-07 14:14:16,32,28,574211465634144256
Good op-ed in @thehill today explaining how the ACA's definition of “full-time” employee is hurting small businesses:http://bit.ly/1MeTRal ,2015-03-06 16:20:11,2,3,573880765307465728
"UPDATE: Warming stations & shelters are open in Jackson, Tyler, Monongalia, Marion, Gilmer, Logan & Raleigh counties: http://on.fb.me/1DYO0Ce ",2015-03-05 17:25:49,2,11,573534895139651585
I know many WVians are experiencing severe conditions as a result of #WinterStormThor. Please click here for updates: http://on.fb.me/1aLKYYz ,2015-03-04 21:16:12,2,5,573230486220242945
"I encourage @JimCantore to visit #WV and broadcast from the Capitol. The weather may be inclement, but WVians will be happy to welcome you.",2015-03-04 00:04:08,26,20,572910358001680384
Pleased that the House finally passed a clean bill to fund @DHSgov through the fiscal year.,2015-03-03 20:45:13,10,0,572860301411950593
"Happy birthday @navy_reserve. Thank you for 100 yrs of honor, courage & commitment to our nation.#NR100 @AmericasNavyhttp://bit.ly/1aJSpiT ",2015-03-03 15:00:42,9,4,572773600089882625
#ICYMI I joined the @Morning_Joe  conversation earlier about @IsraeliPM @netanyahu speech today. Watch here:http://bit.ly/1BQZdqL ,2015-03-03 14:20:07,8,3,572763385458110465
Congrats to Beckley #WV native @Cody_Wickline on @NBCTheVoice. Cody has remarkable talent and makes our state proud. http://bit.ly/1vTP4XF ,2015-03-03 00:15:12,38,26,572550757481725953
I look forward to discussing my experience in Israel last year at @AIPAC's #PC15. Tune in to the livestream at 4 pm:http://www.policyconference.org/ ,2015-03-02 20:40:14,3,3,572496658849648640
I encourage all WVians to #BeAHero this #RedCrossMonth and give blood or volunteer. Click here for more ways to help: http://tinyurl.com/kgtxgay ,2015-03-02 19:35:07,2,4,572480272337276929
Thanks @ARCWV for your service to #WV communities. This #RedCrossMonth help Red Cross make a difference in our state:http://rdcrss.org/1wEtbwr ,2015-03-02 19:34:04,3,3,572480005017493505
It's an honor to request @SECNAV Mabus to consider naming a @USNavy ship after #MedalofHonor recipient Woody Williamshttp://1.usa.gov/1DZsFcN ,2015-02-27 15:43:33,8,4,571334830136410113
Today @SenCapito and I wrote to @DeptVetAffairs because too many #WV vets are being excluded from the Choice Program:http://1.usa.gov/1wlJrfU ,2015-02-26 22:00:34,7,4,571067323160797184
Proud to support legislation that expands the rights of pilots and aviation industry leaders in #WV and nationwide:http://1.usa.gov/1DWQJwT ,2015-02-26 17:50:19,3,3,571004344222351363
My staff is touring the state seeking interns – next stop West Virginia State University @ 11:30 tmrw @WVSU_GoJackets http://1.usa.gov/17UzCiQ ,2015-02-25 22:30:14,5,4,570712401655369728
Today I joined @SenatorKirk and #smallbiz supporters to discuss  @EximBankUS reauthorization: http://1.usa.gov/1Fu4NfV pic.twitter.com/4IGAHwOLQl,2015-02-25 22:00:46,7,5,570704985106681856
"To recognize #VISTA50, I encourage WVians 2 learn more about our state's @VISTAbuzz project and how 2 get involved: http://bit.ly/1zeZMTL ",2015-02-25 20:48:03,4,6,570686687551967232
Happy 50th anniv @VISTAbuzz. Thank you for your great work in communities across #WV & America. Learn more: http://1.usa.gov/1DaWJyr  #VISTA50,2015-02-25 20:47:04,4,5,570686439324721152
My op-ed in @TheJournalWV today talks about why we cannot afford 2 play partisan games w/ @DHSgov funding. Read here: http://bit.ly/1BTPq2H ,2015-02-25 16:00:38,3,6,570614354212622336
So sorry to hear the loss of my good friend & wonderful West Virginian Mike Perry. Our hearts go out to Henriella & the entire Perry family.,2015-02-25 14:46:01,11,8,570595576154333184
"For those in Boone Co. without water due to main breaks, there are distribution sites set up at Racine VFD, Van VFD and Wharton-Barrett VFD.",2015-02-24 23:30:26,0,4,570365165402607616
Encouraging #WV students seeking valuable internship experience to learn more abt our program: http://1.usa.gov/17UzCiQ pic.twitter.com/9WCtilgYFo,2015-02-24 23:03:10,6,5,570358302657228800
ICYMI: I weighed in on the President's disappointing #KeystoneXL veto on @FoxNews @TeamCavuto:http://bit.ly/1Aqj2CS ,2015-02-24 22:50:19,8,15,570355066781065217
I'll be on with @TeamCavuto shortly to respond to the President's #KeystoneXL veto. Tune in to @FoxNews around 4:35pm,2015-02-24 21:27:13,11,7,570334153947742209
It’s disappointing that the President has vetoed #KXL legislation that has so much support from the American people and from Congress.,2015-02-24 20:56:30,30,53,570326425103769600
"I’m willing to take a separate vote against the President’s executive orders, but lets pass clean #DHS funding first:http://bit.ly/17SI7uC ",2015-02-24 15:15:25,14,17,570240588206862336
Getting ready to join @ChrisCuomo on @CNN @NewDay in just a few minutes to discuss funding @DHSgov. Tune in.pic.twitter.com/LaYdZLJvVd,2015-02-24 13:00:57,2,6,570206747421499392
Tune in to @CNN around 8am MT @NewDay: Can a #DHS shutdown be averted?  @Sen_JoeManchin weighs in this AM on #NewDay. http://cnn.it/1FQfWeL ,2015-02-24 12:55:15,0,2,570205312768024576
Photo: Enjoyed talking with my friends @kilmeade @ehasselbeck & @sdoocy about funding @DHSgov this morning. #FundDHSpic.twitter.com/g9bN3hvuvi,2015-02-24 12:51:08,5,5,570204278997909505
Joining @foxandfriends this morning to discuss why we must put politics aside and #FundDHS. Tune in around 7:30 a.m.,2015-02-24 12:15:13,16,14,570195241493331968
"Pleased that the Greenbrier County CBOC will reopen its doors to the nearly 2,000 veterans in the area this Friday:http://1.usa.gov/1BIoGCg ",2015-02-23 21:50:04,4,3,569977518939181057
#WVderail Update:The @CSX Outreach Center is temporarily relocating to Valley High School for the weekend. More info: http://1.usa.gov/1Lj3vWY ,2015-02-20 15:38:31,1,6,568796852063211520
"For WVians being impacted by the pwr outages & extremely cold temps, here is a list of Kanawha Co. warming stations: http://bit.ly/1LiHR5k ",2015-02-20 14:13:52,2,8,568775547788140544
Stopped by the Beckley VA this afternoon for a tour and to talk with local officials and veterans about #ClayHuntSAV.pic.twitter.com/OGLSxj9qPe,2015-02-18 21:45:13,4,5,568164358351495170
Thanks 2 the Raleigh Co Chamber of Commerce for having me join you at the Beckley Moose Lodge for the board meeting.pic.twitter.com/GhN6X1d5qr,2015-02-18 19:10:12,1,1,568125347448754176
Joined a discussion at the Beckley Senior Center this morning on legislation that will protect and help our seniors.pic.twitter.com/UXAtcnAQdw,2015-02-18 17:45:13,0,1,568103957752463362
My statement after touring the @CSX train derailment site in Fayette County today:http://1.usa.gov/1E2X5ew ,2015-02-17 19:57:13,1,8,567774791541616640
Viewing the derailment wreckage as I talk with @HoppyKercheval on #Talkline. Tune in now: http://wvmetronews.com/shows/ pic.twitter.com/3CWaNTwx8b,2015-02-17 16:21:36,5,16,567720527402639360
Just arrived at the Command Post in Mount Carbon to view the wreckage & meet with responders/officials.pic.twitter.com/ZERejHYTz7,2015-02-17 16:06:37,5,9,567716756626878464
"On my way now to Fayette Co. to view wreckage & meet w/ federal, State & local officials, responders & residents impacted by derailment. #WV",2015-02-17 15:47:03,11,9,567711835894185984
The @CSX community outreach ctr will open @ 8 am today at the Glen Ferris Inn for displaced residents. For more info: http://1.usa.gov/1DZU8vj ,2015-02-17 12:00:26,2,9,567654806219530240
Were doing everything we can to help get resources & assistance to Fayette/Kanawha Counties as quickly as possible: http://1.usa.gov/1DZU8vj ,2015-02-17 00:39:09,8,10,567483355222904833
"Our office has been in close touch with federal/State/local officials, CSX reps, residents & responders following today’s train derailment.",2015-02-17 00:34:13,5,4,567482111968305152
"Wishing my friend & WV native @GenChuckYeager a happy birthday. Hes an inspiration 2 pilots everywhere, including me.pic.twitter.com/5GKWYziFPo",2015-02-13 17:25:03,13,8,566286945794289664
Spoke w/ @WVVA yesterday 2 thank #WV's veteran community for helping to bring the VA clinic to Mercer Co. Watch here:http://bit.ly/1AfY3V9 ,2015-02-12 19:40:15,4,4,565958582210793472
ICYMI: I wrote an op-ed in today's @charleywest on the importance of protecting #WV children in schools: http://bit.ly/1CZVLtI ,2015-02-12 18:28:59,0,0,565940647673491456
Great story in @charleywest on my bill w/ @SenToomey to keep predators out of our kids’ classrooms. Tnx @wburdette_DM http://bit.ly/1vnR6Kc ,2015-02-12 18:00:37,5,2,565933507965247488
Thrilled to announce that our Mercer Co veterans will finally have access to the permanent health services they need. http://1.usa.gov/1AYHAEq ,2015-02-11 19:25:13,2,3,565592409636347904
HS juniors: @WVWesleyan will award full scholarship through the 2015 #WV Scholar Program. Deadline to apply is 4/10: http://bit.ly/1DBilYt ,2015-02-10 19:22:04,4,11,565229231416672256
#WV has 1 of the strongest #schoolbreakfast program participation rates in US. Lets continue to reduce hunger & improve learning @fractweets,2015-02-10 18:55:10,12,10,565222459855499265
"Kids who eat #schoolbreakfast miss fewer school days, score higher on standardized tests& are more likely 2 graduate high school @fractweets",2015-02-10 18:55:10,12,15,565222459809341440
Great news that @ProcterGamble plans to build Berkeley Co. facility that will create hundreds of permanent #WV jobs: http://1.usa.gov/1ILZUVr ,2015-02-10 16:40:19,6,11,565188523175587843
Honored 2 join American Legion members for their conference on Sat. Thanks for your commitment to #WV & our veterans.pic.twitter.com/U7bbQUzNHn,2015-02-09 20:31:15,7,9,564884252643168256
Great to meet w/ @DeptVetAffairs Sec. McDonald for breakfast on Fri. to talk abt the needs of our nation's veterans.pic.twitter.com/RcNouuIGMz,2015-02-09 19:55:12,6,3,564875181575770112
"Before my event at historic Storer College, I visited downtown businesses & spoke with park rangers at Harpers Ferry.pic.twitter.com/WoNPGMzdTL",2015-02-06 21:14:56,5,8,563808084095942657
So sorry to hear abt the passing of Larry McKay. He was a great man & a fair reporter. Hearts go out to his family & to the WBQE family. #WV,2015-02-06 20:16:44,6,5,563793433991856129
Good op-ed in the @IntelligencerWV on making sure DoD resources are used efficiently & effectively: http://bit.ly/1LV7zQy  #AuditThePentagon,2015-02-06 18:00:52,0,2,563759244034314240
Questioned Defense Sec nominee Ashton Carter today on sending immediate aid 2 Jordanians in their fight against ISIS:http://bit.ly/1LNqg8I ,2015-02-05 00:00:32,0,0,563124979739283456
It is simply unacceptable that the DoD has not completed a financial audit. Our bill will help solve that.  @TheHillhttp://bit.ly/1C1xLn2 ,2015-02-04 21:30:23,4,3,563087194697379840
"ICYMI: In my @theloganbanner op-ed today, I discuss #ClayHuntSAVAct & improving mental health care for #WV veterans: http://bit.ly/1z9TLHN ",2015-02-04 17:30:25,4,6,563026805389393920
Read my full statement on President Obama’s FY 2016 Budget: http://1.usa.gov/1EGlzLO ,2015-02-04 16:46:15,3,2,563015689481379840
"While the President’s budget includes critical funding and many impt policy changes, it falls short of the big fix that this country needs.",2015-02-04 16:45:20,3,0,563015460954710016
"At a time when we face many threats, both at home & abroad, I'm not willing to hold @DHSgov funding hostage over any piece of legislation.",2015-02-03 21:00:35,14,20,562717308661952512
I urge the Senate to take up the clean @DHSgov funding bill that's already been introduced & could be voted on today.http://1.usa.gov/1CtrPG6 ,2015-02-03 21:00:24,4,2,562717262289719296
Proud that the Senate has passed #ClayHuntSAVAct to improve mental health/suicide prevention resources for veterans.http://1.usa.gov/1uUvjcT ,2015-02-03 18:00:30,10,7,562671988217364480
WV restaurants have tremendous impacts on our communities & I hope all WVians will celebrate #cwvrestweek & #eatlocal http://on.fb.me/1K44FqR ,2015-02-02 20:39:02,14,12,562349497259290625
