Text,Date,Favorites,Retweets,Tweet ID
"Thanks to our interns for all their hard work! To learn more about our internships, visit: http://www.ernst.senate.gov/public/index.cfm/internships …pic.twitter.com/VBL9uG3aKK",2017-03-06 19:53:18,27,5,838839930189119495
"Enjoyed visiting Tyson Foods in Louisa Co, where we discussed increasing trade opportunities & cutting regulations. #99CountyTourpic.twitter.com/wr9Tq2PORv",2017-03-06 19:23:51,17,4,838832515645329413
"Pleased the House passed the SCRUB Act. We need to let our businesses focus on what they do best, innovate & create jobs- not regulations.",2017-03-01 21:26:38,21,7,837051477029974018
Heading to President Trump's first address to a Joint Session of Congress with Senator @ChuckGrassley!pic.twitter.com/3nbkhHTsHv,2017-03-01 01:35:46,155,41,836751785146601472
Today's action is a significant step forward toward rolling back the burdensome WOTUS rule. Read my full statement:http://www.ernst.senate.gov/public/index.cfm/press-releases?ID=9403CFA3-452F-419E-B745-0C6C78F78066action …,2017-02-28 21:32:09,22,7,836690477256683520
Thanks to everyone who came out to my veterans roundtable discussion in Jackson County last week. #99CountyTourpic.twitter.com/ARoQAXE85G,2017-02-28 17:44:42,16,6,836633236264615936
Enjoyed visiting with folks at Flint Hills Resources Ethanol Plant in Ida Co. #99CountyTourpic.twitter.com/ZEIEbJKb6Y,2017-02-27 20:07:57,13,3,836306899477925888
"At American Coating & Welding in Monona County, we talked about overcoming regulatory challenges. #99CountyTourpic.twitter.com/lyYR8eaDle",2017-02-27 16:00:02,20,8,836244510250151938
Inspired by our veterans' healing through art & thankful for the support provided by New Century Art Guild in Audubon Co. #99CountyTourpic.twitter.com/v7Eybj1PVD,2017-02-27 15:30:01,19,6,836236955633344513
"At Gateway ImpACT Coalition in Clinton Co, we talked about opioid abuse, prevention & treatment in the community & across Iowa #99CountyTourpic.twitter.com/Pep8BxkvA6",2017-02-27 15:27:26,6,4,836236306833371138
It was a privilege to tour Gilda's Club in Scott Co & visit with the brave Iowans battling cancer & their loved ones. #99CountyTourpic.twitter.com/s3V0p0F0pU,2017-02-27 14:00:11,11,1,836214347311562752
Happy Independence Day #Kosovo!,2017-02-17 13:36:30,30,7,832584510353072128
Thinking of visiting DC for spring break? Learn how my office can assist in planning your trip: http://www.ernst.senate.gov/public/index.cfm/visiting-washington-dc …,2017-02-11 15:00:00,14,3,830431197650038784
Sign up for my e-newsletter to stay up to date on what I'm working on in Iowa & DC: http://www.ernst.senate.gov/public/index.cfm/get-the-newsletter …,2017-02-10 21:25:39,6,3,830165861692559362
Mr Pruitt answered 1200+ questions from this cmte - over 1k more answers than the incoming noms from the last 4 administrations #Delayocrats,2017-02-01 17:42:12,51,31,826848137868431363
...but there comes a point when vetting has been turned into obstruction and that is what we are witnessing here today. (2/2) #Delayocrats,2017-02-01 17:42:00,53,25,826848086387519488
Vetting nominees is an important role and one that I take seriously as do my colleagues... (1/2) #Delayocrats,2017-02-01 17:41:21,38,14,826847920708272128
Democrats were ‘glaringly’ absent at today’s EPW committee meeting. #Delayocratspic.twitter.com/NLVBQ9SgLj,2017-02-01 17:40:02,41,31,826847590369095680
Read my statement on Judge Neil Gorsuch's nomination to the Supreme Court of the United States: http://www.ernst.senate.gov/public/index.cfm/press-releases?ID=5D477B4E-AD11-46D4-8045-255C0AE06CAF …pic.twitter.com/jHwbt9AJqe,2017-02-01 01:40:01,154,51,826605996483178496
"Today marks one year since Iowans lost Sarah Root. Today, let us remember and honor her life.https://youtu.be/t0mgkMTJLY8 ",2017-01-31 22:35:39,19,11,826559598605778945
Pleased the Senate has confirmed Elaine Chao as Secretary of the Department of Transportation: http://www.ernst.senate.gov/public/index.cfm/press-releases?ID=8432DA3D-D528-40FA-8A21-6267FD082197 …pic.twitter.com/AKYU0ckXjO,2017-01-31 18:33:15,75,28,826498596493201414
I’ll be speaking soon at today’s #MarchforLife2017. Click the link to watch it live: https://www.c-span.org/video/?422535-1/public-officials-address-march-life-rally …,2017-01-27 17:10:24,57,16,825028192767389697
Pleased that @POTUS executive orders include parts of Sarah’s Law:http://www.ernst.senate.gov/public/index.cfm/press-releases?ID=1A7ADA20-115D-408A-944A-1E2641AA1AF0 …,2017-01-25 22:21:34,34,13,824381725107228672
Pleased Senate confirmed @RepMikePompeo to be Director of @CIA. Read my full statement:http://www.ernst.senate.gov/public/index.cfm/2017/1/senate-confirms-pompeo-for-cia-director …,2017-01-24 01:33:08,23,11,823705160794906624
Pleased the Senate has confirmed Gen. Kelly to be Secretary of DHS & Gen. Mattis to be Secretary of Defense.http://www.ernst.senate.gov/public/index.cfm/press-releases?ID=8D923C1F-B616-485D-B06D-21124C09E026 …,2017-01-20 23:23:42,82,11,822585424233304064
"Great to attend the inauguration with 2 of my friends, @SenThomTillis & @sendavidperdue. Such an energetic crowd!pic.twitter.com/hcj4BfWFkE",2017-01-20 19:17:19,173,31,822523420642422784
Congratulations to @POTUS and @VPhttp://www.ernst.senate.gov/public/index.cfm/press-releases?ID=596915EE-6CEE-4A01-8D21-AA19EE490D07 …,2017-01-20 18:07:10,28,3,822505766271721472
during his confirmation hearing to be our next for Secretary of Defense. Watch our exchange here: http://www.ernst.senate.gov/public/index.cfm/press-releases?ID=D203653C-9C0A-46D6-8121-C6DF5E27C0BF … (4/4),2017-01-20 00:22:00,7,3,822237708437295104
I was also glad last week to hear General Mattis say he would work with me to address our military's outdated weapon systems... (3/4),2017-01-20 00:21:42,38,6,822237630599405570
I am pleased to see the Army finally selected a new handgun for our soldiers: https://www.armytimes.com/articles/army-your-new-handgun-will-be-a-sig-sauer … (2/4),2017-01-20 00:21:17,14,3,822237525376909313
After over 30 years with the M9 & countless issues with the Modular Handgun System acquisition program to replace it... (1/4),2017-01-20 00:20:17,8,2,822237275866230786
Check out how we celebrate #NationalPopcornDay in my office by adding me on @Snapchatpic.twitter.com/P0ddUNfQez,2017-01-19 15:47:51,6,2,822108318202208257
I am pleased to join @SASCMajority in giving my support to General Mattis to be Secretary of Defense.,2017-01-18 20:40:31,29,6,821819580389748736
I am honored to serve as the Chairman of the @SASCMajority Subcommittee on Emerging Threats & Capabilities:http://www.ernst.senate.gov/public/index.cfm/press-releases?ID=BEA0A629-F02D-45CA-8E1E-BF3496BF6B0A …,2017-01-18 20:30:31,20,5,821817063291416579
"Encouraged to hear US Supreme Court will take up jurisdiction issue surrounding the WOTUS rule. This is good news for farmers, manufacturershttps://twitter.com/EENewsUpdates/status/819993143894482944 …",2017-01-13 21:51:47,25,15,820025576991944704
Proud to join @SenatorFischer in introducing a resolution expressing the need to scrap the harmful WOTUS rule today:http://www.ernst.senate.gov/public/index.cfm/press-releases?ID=CC7D89BD-D728-4D6C-938D-B3C8C114EC16 …,2017-01-12 18:30:14,12,16,819612466598514690
I’m talking about my Allowing Greater Access to Safe and Effective Contraception Act on @Snapchat today. Add me to learn more.pic.twitter.com/8834dUkm9k,2017-01-11 19:08:50,10,3,819259793898688513
Today @SenCoryGardner & I introduced the Allowing Greater Access to Safe & Effective Contraception Act: http://www.ernst.senate.gov/public/index.cfm/press-releases?ID=CE3FB3A6-E56C-4E53-BE57-F563D7FF3F48 …pic.twitter.com/AmmrrHulhA,2017-01-11 16:10:43,21,10,819214969711501317
Be sure to add me on @Snapchat to get a behind the scenes look at my work on behalf of Iowanspic.twitter.com/TESQaZKZdx,2017-01-11 00:32:47,15,6,818978932053725184
"Today I met with the Secretary of the Army nominee, Vincent Viola. Read more about it here: http://www.ernst.senate.gov/public/index.cfm/2017/1/photo-ernst-meets-with-nominee-for-secretary-of-the-army-vincent-viola …pic.twitter.com/rE1xE9K919",2017-01-10 20:18:25,13,6,818914918590251009
On Saturday I kicked off my #99CountyTour with a town meeting in my home county of Montgomery. Thanks to all who joined.pic.twitter.com/k3CcQ1UVdL,2017-01-10 19:12:04,13,3,818898219044368385
Thankful to have spent time with the students of Clarinda Academy in Page Co & to share my 4 pillars of success with them. #99CountyTourpic.twitter.com/T6CHgqdN7k,2017-01-10 17:10:18,9,3,818867573865541632
Thoughtful discussion with Warren Co. business leaders & officials on improving our infrastructure at Saturday's roundtable. #99CountyTourpic.twitter.com/YOnypyP1Ng,2017-01-10 17:06:00,2,1,818866494918590466
Have you added me on @Snapchat yet? Be sure to watch my story from yesterday’s #99CountyTour kickoff before it disappears!pic.twitter.com/Umyxt9sk4H,2017-01-08 15:00:01,16,4,818110011796754432
I’m kicking off my 2017 #99CountyTour today. Be sure to add me on @Snapchat to follow along with mepic.twitter.com/J7E8DGYKmf,2017-01-07 14:30:01,31,6,817740074162995200
I am heartbroken over the news of the shooting at the Fort Lauderdale airport. My prayers are with the victims and their families. #FLL,2017-01-06 21:38:53,39,12,817485617286221824
"Yesterday, I reintroduced Sarah's Law so that families like the Roots can receive justice. Read more in @OWHnews:http://www.omaha.com/news/politics/nebraska-iowa-lawmakers-reintroduce-bill-named-for-sarah-root-who/article_948814ae-7bf3-5b57-a761-0d2abbbc1d55.html …",2017-01-06 15:19:22,24,16,817390106357153792
I’m excited to head out on my 2017 #99CountyTour tomorrow. Follow along by adding me on @Snapchatpic.twitter.com/lFDSsX9m27,2017-01-06 13:41:06,16,13,817365376396914688
Pleased the House passed a resolution condemning anti-Israel UN action. Proud to have introduced bill in Senate to show we #StandwithIsrael,2017-01-06 00:43:28,95,30,817169680737697793
"I greatly appreciate the time Scott Pruitt, nominee to be EPA Administrator, took to visit with me today http://www.ernst.senate.gov/public/index.cfm/2017/1/photo-ernst-meets-with-scott-pruitt-nominee-to-be-epa-administrator …pic.twitter.com/oibTAIGPNF",2017-01-05 20:35:24,629,282,817107252414939137
I enjoyed meeting with Small Business Administration nominee Linda McMahon today http://www.ernst.senate.gov/public/index.cfm/2017/1/photo-ernst-meets-with-small-business-administration-nominee-linda-mcmahon …pic.twitter.com/tkPQZljsk7,2017-01-05 18:28:00,14,10,817075191264268288
Today I reintroduced Sarah's Law as my first bill in the 115th Congress w/ @ChuckGrassley @SenatorFischer @SenSasse: http://www.ernst.senate.gov/public/index.cfm/press-releases?ID=DE7DCE98-E0DF-4165-BFF3-F965D9648CFF …pic.twitter.com/WAk90VBpOk,2017-01-05 17:52:24,39,28,817066229844373505
Had a productive meeting with Secretary of Homeland Security nominee Gen. John Kelly http://www.ernst.senate.gov/public/index.cfm/2017/1/photo-ernst-meets-with-secretary-of-homeland-security-nominee-general-john-kelly …pic.twitter.com/beXDECaeKC,2017-01-04 18:30:24,39,17,816713406396985344
Great to meet with Sec. of Defense nominee Gen. Mattis today http://www.ernst.senate.gov/public/index.cfm/2017/1/photo-ernst-meets-with-secretary-of-defense-nominee-general-james-mattis …pic.twitter.com/MDMbuW65xQ,2017-01-03 22:50:33,44,19,816416485283426304
"Congrats to my friend @ChuckGrassley, Iowa's commonsense voice in the United States Senate, who was sworn in today!pic.twitter.com/sEZK6ZkOLJ",2017-01-03 18:28:33,196,59,816350554804854786
Wishing you a happy and healthy new year!pic.twitter.com/JZhH4yMekm,2017-01-01 14:00:01,49,3,815558197234769921
"Today we celebrate 170 wonderful years of statehood. Happy Birthday, Iowa!pic.twitter.com/HSwnoVfXUO",2016-12-28 14:00:04,104,49,814108658988621824
"From my family to yours, we wish you a Merry Christmas and Happy Holidays!pic.twitter.com/2R86bNSDc5",2016-12-25 14:00:02,58,5,813021489154834432
This legislation will help uphold our commitment to provide quality & timely care for our veterans (3/3),2016-12-16 21:00:58,9,2,809865928116699136
"Veterans shouldn't have long waits for VA appointments, & this bill modernizes processes by allowing vets to schedule & confirm online (2/3)",2016-12-16 21:00:46,39,9,809865876723929088
"The Faster Care for Veterans Act, which I worked on with @amyklobuchar was signed into law: http://www.ernst.senate.gov/public/index.cfm/2016/12/klobuchar-ernst-bill-to-cut-red-tape-and-wait-times-for-veterans-scheduling-appointments-at-va-medical-facilities-signed-into-law-by-president … (1/3)",2016-12-16 21:00:30,43,19,809865808600068100
"Today, our DC staff cheered on 5 year old #SuperKaheem as he helped save the day at the @uscapitol! #KaheemSavesDCpic.twitter.com/2S65BziLTh",2016-12-16 19:36:49,46,9,809844750043979776
"This marks my 4th bill to be signed into law, and I look forward to continuing to find new ways to eliminate govt waste. (3/3)",2016-12-16 15:24:46,55,12,809781319995682816
This bill has the potential to save billions of $ that could otherwise have been wasted on large govt prgms http://www.ernst.senate.gov/public/index.cfm/2016/12/ernst-heitkamp-program-management-bill-signed-into-law …  (2/3),2016-12-16 15:24:29,14,8,809781250185633792
Thrilled that my bipartisan Program Management Improvement and Accountability Act I intro'd with @SenatorHeitkamp was signed into law (1/3),2016-12-16 15:24:13,16,5,809781180413464576
Congrats to these Iowa students nominated to be considered for an appointment at a US Service Academy:http://www.ernst.senate.gov/public/index.cfm/press-releases?ID=EE7B82FF-6E5E-4913-AF3F-5A2B0AE42E76 …,2016-12-15 20:03:49,23,7,809489159677218817
"Happy 380th Birthday, @USNationalGuard!pic.twitter.com/K3odlx7HdL",2016-12-13 14:48:09,50,27,808684942687424512
"Joined @Varneyco to discuss ISIS, @transition2017, @TerryBranstad & @KimReynoldsIAhttps://youtu.be/3bdihfaK0J0 ",2016-12-08 22:10:47,10,5,806984394435166210
Thrilled for @TerryBranstad & @KimReynoldsIA! http://www.ernst.senate.gov/public/index.cfm/2016/12/ernst-statement-on-branstad-reynolds …pic.twitter.com/5CnlFAOXnE,2016-12-07 21:27:09,36,16,806611028037554183
My day got 1775% better after @USMC Corporal Chesty stopped by.pic.twitter.com/wMf1jV0UmG,2016-12-07 19:15:17,105,25,806577839923490818
I am thankful to have served alongside @KellyAyotte in the United States Senate & incredibly thankful to call her my friend. (2/2),2016-12-07 17:02:38,45,9,806544460846919680
".@KellyAyotte has tirelessly served the people of NH with passion & dedication, and has supported those serving in our armed forces. (1/2)",2016-12-07 17:02:23,37,7,806544397349306368
"At the Parliamentary Intelligence Security Forum, I emphasized the need for US & allies to partner so we can defeat ISIS across the globe.pic.twitter.com/sVNG51x3yO",2016-12-07 15:53:42,9,5,806527112186384384
75 years have passed since the attack on Pearl Harbor. We will never forget the sacrifices & heroic acts of our servicemembers on that day.pic.twitter.com/N5gYfxEWkC,2016-12-07 13:00:03,66,38,806483411690921984
Our veterans should be able to easily schedule their own appointments w/ the VA. We will keep working to make that a possibility. 2/2,2016-12-06 22:59:47,29,10,806271950507180032
The House version of our Faster Care for Veterans Act passed the House today!  CC @amyklobuchar 1/2,2016-12-06 22:59:34,22,10,806271896891363330
"At @SASCMajority hearing, I spoke with Ret. Gen. Keane on ISIS spreading in SE Asia. We need a strategy to defeat ithttps://www.youtube.com/watch?v=AIUg9sslj2o&feature=youtu.be …",2016-12-06 17:50:23,15,3,806194089293135872
"My regional directors are in Audubon, Shelby, Grundy, Harrison, Tama & Benton today to assist you: http://www.ernst.senate.gov/public/index.cfm/press-releases?ID=3AE083C5-B1FE-40B5-AC39-1FF9C0C556DE …pic.twitter.com/NZ0h1rI81G",2016-12-06 14:46:14,6,3,806147746046550016
Been a great & productive 2 years with my freshman colleagues. I look forward to keeping the momentum going in 2017.https://twitter.com/SenateGOP/status/804702405556338688 …,2016-12-02 21:00:43,155,42,804792434316210177
Proud my legislation w/ @clairecmc to further curb sexual assault in the military has been included in NDAA http://www.ernst.senate.gov/public/index.cfm/2016/12/breaking-defense-bill-to-include-mccaskill-ernst-bipartisan-plan-to-further-curb-sexual-assault-in-military …,2016-12-01 20:27:38,54,17,804421722568945664
My Program Management Accountability & Improvement Act marks my 6th bill to head to the President's desk. Read more:http://www.ernst.senate.gov/public/index.cfm/2016/12/ernst-heitkamp-program-management-bill-heads-to-president-s-desk …,2016-12-01 19:12:19,15,2,804402768970661888
My bill w/ @SenatorHeitkamp to streamline federal government program management practices is headed to @POTUS' desk http://www.ernst.senate.gov/public/index.cfm/2016/12/ernst-heitkamp-program-management-bill-heads-to-president-s-desk …,2016-12-01 18:26:07,9,7,804391141760270336
Great to join my friend @SteveDaines in sending holiday cards to our troops serving overseas @RedCross #HolidaysforHeroes event!pic.twitter.com/yWYok1t1Zf,2016-11-30 18:16:57,56,25,804026445559369728
We must make sure our first responders have the best training and equipment possible to better protect them as well as our communities.(4/4),2016-11-30 15:08:03,30,6,803978908597153793
The findings and recommendations would then be reported to Congress so we can act. (3/4),2016-11-30 15:07:26,2,1,803978753219186688
response plans and overall strategies used by our first responders when they are faced with railroad hazardous materials incidents. (2/4),2016-11-30 15:07:14,4,2,803978701557952512
"Glad our bipartisan bill, RESPONSE Act, passed the House which would establish a council to evaluate the current training methods, (1/4)",2016-11-30 15:07:06,5,2,803978668989181952
Read my column in TIME about the need for a comprehensive strategy to combat ISIS in the Philippines here: http://www.ernst.senate.gov/public/index.cfm/columns?ID=47E439B7-6433-4300-B4F8-5DC484C101A6 … (2/2),2016-11-28 15:25:51,14,10,803258610910457856
News of a bomb near the US Embassy in Philippines is alarming. I continue my call for @POTUS to focus on spread of ISIS in SE Asia (1/2),2016-11-28 15:24:52,17,8,803258365350707200
So thankful to have visited the 211th Aviation Battalion & the 185th Combat Support Sustainment Battalion of Iowa in Afghanistan.pic.twitter.com/AyqHuzvgLj,2016-11-24 20:26:04,136,49,801884612599447552
"From my family to yours, Happy Thanksgiving!pic.twitter.com/FVB4FYxvNy",2016-11-24 14:00:00,43,3,801787456504950784
Read my statement on the EPA’s release of RFS volume requirements for 2017:http://www.ernst.senate.gov/public/index.cfm/press-releases?ID=36CFA350-D75B-4E02-A0C3-65EC51C392A3 …,2016-11-23 16:01:53,6,5,801455740007415810
November is National Family Caregivers Month. Read my column in @gazettedotcom thanking Iowa's family caregivers: http://www.thegazette.com/subject/opinion/guest-columnists/a-heartfelt-thank-you-to-iowas-family-caregivers-20161122 …pic.twitter.com/NYt3EoXJcQ,2016-11-23 14:16:09,11,8,801429132156477440
Tater & Tot of Iowa have a lot to be thankful for this year: they are being pardoned by the President tomorrow for #TurkeyPardon2016pic.twitter.com/kiWGJO66S6,2016-11-22 18:52:26,225,102,801136271577858048
Today I completed my 2nd annual #99CountyTour. Watch the journey:https://youtu.be/GH7UnxENl0Y ,2016-11-21 21:05:07,15,2,800807274499358720
Just wrapped up a town meeting in Cherokee County. Great way to complete this year’s #99CountyTour!pic.twitter.com/Y9fWjleL1u,2016-11-21 19:30:05,13,2,800783361254064128
Discussed the need to improve our IT capabilities for rural areas at a roundtable at Pocahontas County Farm Service Agency #99CountyTourpic.twitter.com/XTjDbwLLoJ,2016-11-21 17:34:36,11,2,800754297596092416
Thousands of kids across the country are searching for a forever family. Join me in spreading the joys of adoption on #NatlAdoptionDay.pic.twitter.com/bbFDWGBIbL,2016-11-19 14:00:03,34,33,799975528430116864
".@SenPatRoberts @SenDanSullivan @USMC Those are nice ties, but I think they'd be even better if they were in Army gold and black!",2016-11-18 16:52:30,5,3,799656540437291008
... let us remember to lend a helping hand to all those struggling in our communities. (2/2),2016-11-18 14:30:41,45,25,799620848609017856
It’s National Hunger and Homelessness Awareness Week. As colder weather and the holiday season approaches... (1/2),2016-11-18 14:30:27,46,27,799620790526164992
I so enjoyed visiting Marion on Veterans Day last week. Read about my stop & work for Iowa vets in the Marion Times: http://www.mariontoday.org/times/article.php?id=5557 …,2016-11-17 18:49:59,2,3,799323718497566721
"Today, I'm wearing purple to raise awareness for World Pancreatic Cancer Day & in support of all those battling this devastating disease.pic.twitter.com/UCRA4GsKNI",2016-11-17 17:55:34,87,23,799310022702268416
"Whether it's help with Medicaid enrollment or the VA, stop by and learn the many ways my office can serve you. (2/2) http://www.ernst.senate.gov/public/index.cfm/press-releases?ID=3AE083C5-B1FE-40B5-AC39-1FF9C0C556DE …pic.twitter.com/jR0gtbpfCe",2016-11-17 16:01:45,7,2,799281381008252928
Today my staff will be in 16 counties to take your questions & provide assistance with the federal gov... (1/2) http://www.ernst.senate.gov/public/index.cfm/press-releases?ID=3AE083C5-B1FE-40B5-AC39-1FF9C0C556DE …pic.twitter.com/5T2AMYIAlI,2016-11-17 16:01:25,2,0,799281297327853568
to the health care services they need by promoting the use of telemedicine and fighting to protect our community hospitals. (2/2),2016-11-17 14:02:39,10,10,799251408293724162
Today is National Rural Health Day. I’m working to ensure that Iowans living in rural and underserved areas have access...(1/2),2016-11-17 14:02:29,16,11,799251365285466112
"being held over the next few weeks. For dates and locations near you, visit my website: http://www.ernst.senate.gov/public/index.cfm/press-releases?ID=3AE083C5-B1FE-40B5-AC39-1FF9C0C556DE … (2/2)pic.twitter.com/BgkzE4G3L9",2016-11-16 16:59:48,2,1,798933598707519488
"My staff is able to assist with Medicare Open Enrollment, which ends December 7th, at all of the traveling office hours... (1/2)pic.twitter.com/KCwhvSvsH0",2016-11-16 16:59:17,3,3,798933471670530048
"Tickets to the Presidential Inauguration are limited & will be awarded on 1st-come, 1st-serve basis. More info here: http://www.ernst.senate.gov/public/index.cfm/presidential-inauguration-tickets …pic.twitter.com/WsxIvhbAmf",2016-11-16 16:43:32,5,5,798929507633811456
We cannot ignore where ISIS will spread next. Read my column in @CNNOpinion:http://www.cnn.com/2016/11/04/opinions/cant-let-isis-get-away-ernst/index.html …,2016-11-16 13:59:56,22,24,798888337016844288
"No presumption, but I hit a deer last night @ChuckGrassley. What do you think its odds are?",2016-11-16 02:01:17,91,46,798707479710416897
The President must make the growth of extremism in Latin America a priority during his visit to Peru:http://thehill.com/policy/defense/305837-gop-senator-urges-obama-to-address-growing-islamic-terror-in-latin-american …,2016-11-15 18:00:05,7,3,798586382071402496
On Veterans Day I had the pleasure of attending the Van Horne Legion Veterans Day Ceremony & Memorial Dedication to thank all who served.pic.twitter.com/CUrs9HRUqP,2016-11-15 16:15:09,21,5,798559976939782148
… to speak with a member of my staff and learn about the many ways my office can better serve you. http://www.ernst.senate.gov/public/index.cfm/press-releases?ID=3AE083C5-B1FE-40B5-AC39-1FF9C0C556DE … (2/2)pic.twitter.com/S9kIgIJCoA,2016-11-15 15:28:24,2,2,798548211904417792
"Need assistance with the VA, IRS, or more? My office is here to help. Stop by one of these many locations today… (1/2)pic.twitter.com/mNrjbDbvpR",2016-11-15 15:27:51,6,2,798548072267513856
In October I made over a dozen stops across the state to speak with folks in the ag industry. Here's what I heard:http://www.ernst.senate.gov/public/index.cfm/columns?ID=6C5AF521-C048-4332-BD5C-4FF08DD8B0D6 …,2016-11-14 21:16:25,4,3,798273403459399680
Today I wrote President Obama urging him to address w/ leaders the spread of ISIS in Latin America while in Peru:http://www.ernst.senate.gov/public/index.cfm/press-releases?ID=20D6029F-3E21-4D03-9E5E-E101CB0EB930 …,2016-11-14 19:04:36,15,10,798240230100893696
Team Ernst is headed to you! Today's traveling office hours & upcoming dates/locations can be found here: http://www.ernst.senate.gov/public/index.cfm/press-releases?ID=3AE083C5-B1FE-40B5-AC39-1FF9C0C556DE …pic.twitter.com/lVarMoW559,2016-11-14 16:14:23,2,1,798197396517900289
"by an enemy torpedo on this day in 1942. They, and all Iowans who gave their lives for our freedom, are true heroes. (3/3)",2016-11-13 23:07:49,23,8,797939049356881920
"the attack on Pearl Harbor, and they tragically all lost their lives at the battle for Guadalcanal after the USS Juneau was struck... (2/3)",2016-11-13 23:06:19,28,10,797938674671435776
Today we remember the five Sullivan brothers from Waterloo. These Iowans courageously decided to enlist together following... (1/3),2016-11-13 23:05:14,52,16,797938401680953344
Read my column in @qctimes on fighting for those who faithfully served. #VeteransDayhttp://qctimes.com/news/opinion/editorial/columnists/guest/ernst-fighting-for-those-who-faithfully-served/article_d9692b9a-6ac5-51fc-a149-2497eff5189a.html …,2016-11-11 15:00:03,9,8,797091525851103232
