Text,Date,Favorites,Retweets,Tweet ID
It’s time to #DitchTheRule. #WOTUS is harmful to rural America.pic.twitter.com/h8sUuakcl9,2015-11-04 16:13:03,14,19,661939221846958080
This expanded #WOTUS rule is a blatant power grab by the Administration that threatens Iowa.pic.twitter.com/EGnplnrxmu,2015-11-04 15:23:04,5,9,661926644022706176
I’m joining @DougWagner at 6:25AM CT. TUNE-IN to @600WMTAM or listen online:http://600.wmtradio.com/onair/doug-wagner-51054/ …,2015-11-04 10:58:26,1,3,661860048356794368
"Today, the Senate moved forward with Sen. Ernst’s resolution to end the harmful #WOTUS rule. #DitchTheRule http://www.ernst.senate.gov/content/ernst-leads-effort-against-harmful-wotus-rule-resolution-senate-floor …",2015-11-04 00:15:11,13,13,661698165612134400
VIDEO: Sen. Ernst took to the Senate floor to urge support for her legislation to eliminate #WOTUS. WATCH:https://www.youtube.com/watch?v=VmfFpdApkOI&feature=youtu.be …,2015-11-03 23:42:28,2,6,661689934194061312
"Surprised @ChuckGrassley with a “donut cake” to celebrate his 12,000th vote!pic.twitter.com/QKwnDw6Cen",2015-11-03 18:14:32,33,22,661607406812717056
"Congratulations to my dear friend & colleague @ChuckGrassley on his 12,000th vote! http://www.ernst.senate.gov/content/ernst-congratulates-grassley-12000th-vote …",2015-11-03 17:59:44,5,4,661603684292435968
Joined @SenatorRounds in calling for renewed and strengthened support of Kurdish Peshmerga forces: http://www.ernst.senate.gov/content/ernst-rounds-call-renewed-strengthened-support-kurdish-peshmerga-forces …,2015-11-03 16:27:40,3,6,661580512419569666
"Not an Iowa sunrise, but a great morning at the @USCapitol!pic.twitter.com/XSExB2KUGR",2015-11-03 12:32:08,15,7,661521237647220736
"ICYMI, check out our e-newsletter on my vote against raising the debt limit & the #99CountyTour:https://outreach.senate.gov/iqextranet/view_newsletter.aspx?id=100685&c=JErnst …",2015-11-02 21:11:39,1,2,661289590641266688
Click here to watch highlights of this year’s #99CountyTour:https://www.youtube.com/watch?v=6b6ZZuLdkgI&feature=youtu.be …,2015-11-02 17:00:21,3,1,661226350645264384
Have 2 min? Here’s why it’s time to take away Washington’s limitless credit card:https://www.youtube.com/watch?v=rJ7rOrszGPE&feature=youtu.be …,2015-10-30 18:40:40,2,3,660164433247911936
Here’s why I oppose increasing the debt limit: http://www.ernst.senate.gov/content/ernst-opposes-increasing-national-debt-limit …pic.twitter.com/Hs8nTXz9sz,2015-10-30 13:54:59,18,13,660092538905317376
#TBT A quick re-fuel during this year’s #99CountyTour at one of my favorite spots for pizza & donuts!pic.twitter.com/QKHuTOdJNH,2015-10-29 21:03:36,6,3,659838013577539584
The Senate will consider my resolution to tackle the harmful #WOTUS rule: http://www.ernst.senate.gov/content/ernst-gains-enough-support-tackle-wotus-rule …,2015-10-29 18:54:26,4,9,659805509780918273
.@KMANews1: Ernst Blasts Budget Deal: http://www.kmaland.com/news/ernst-blasts-budget-deal/article_b49ecbee-7d92-11e5-a6e8-37c2390beea5.html …,2015-10-29 16:04:11,4,3,659762664726491136
Carved a Jack-O-Lantern! How are you getting in the #Halloween spirit?pic.twitter.com/UTMykEAC09,2015-10-28 23:00:23,6,4,659505017326542848
No better way to celebrate #NationalChocolateDay than by enjoying some of Iowa’s own – chocolate covered soybeans!pic.twitter.com/FPpIgA17Q1,2015-10-28 19:36:38,9,3,659453739363758080
Scary fact before #Halloween: Our government borrows $1.1 billion each and every day.,2015-10-28 15:12:08,4,7,659387178565435392
"Learn more about my tour across Iowa by following the hashtag #99CountyTour on @Facebook, @Instagram & @Twitter.pic.twitter.com/tpTXruKDwH",2015-10-27 20:07:18,1,2,659099069260910593
"Our nat'l debt exceeds $18,400,000,000,000! It’s time for Congress to find real solutions, rather than leaving this problem for our children",2015-10-27 17:44:44,21,12,659063192925151232
.@marshalltowntr: Ernst tours CIH’s new outpatient clinic: http://www.ernst.senate.gov/content/sen-ernst-tours-cih%E2%80%99s-new-outpatient-clinic …,2015-10-26 22:25:07,2,1,658771365286252544
"$57,000 of national debt per person, including these Iowans. Time to address our debt now for future generations.pic.twitter.com/M2Il47CVIQ",2015-10-26 21:13:20,9,7,658753299781414912
The best part of my #99CountyTour is meeting Iowans across the state & hearing their ideas.pic.twitter.com/2kQKb28D2B,2015-10-26 18:01:43,2,4,658705078220623876
If you missed it – Wrapped up this year’s #99CountyTour on Saturday! READ MORE: http://www.ernst.senate.gov/content/senator-ernst-completes-99-county-tour …pic.twitter.com/DooHwbo1L8,2015-10-26 17:06:35,2,1,658691204763271168
.@WHORadio: Sen. Ernst Finishes 99 County Tour: http://www.whoradio.com/articles/1040-who-radio-news-121648/sen-ernst-finishes-99-county-tour-14064104 …,2015-10-26 16:02:05,1,2,658674971699490816
Just completed my #99CountyTour of Iowa: http://www.ernst.senate.gov/content/senator-ernst-completes-99-county-tour …,2015-10-24 17:10:42,9,2,657967464312008704
Last #99CountyTour stop at @Marshalltownmed. The tour has been invaluable ... https://www.facebook.com/senjoniernst/photos/a.368712846623489.1073741828.351671691660938/468423579985748/?type=3&theater …pic.twitter.com/Gawnfr7HSR,2015-10-24 16:43:44,6,4,657960677538209793
So exciting to watch my daughter’s @NHS_NJHS induction ceremony online! #ProudMompic.twitter.com/NyYWayKQAw,2015-10-22 20:24:50,11,3,657291542944727040
I’ll speak at a 2PM CT press conference on the President’s scheduled veto of #NDAA. Watch Live:https://www.youtube.com/channel/UCD506yORW2voSanqEgLOUIQ …,2015-10-22 18:32:14,0,1,657263205618733056
In case you missed my column in @WavNewspapers: GMOs are vital for food production: http://www.ernst.senate.gov/content/gmos-are-vital-food-production …,2015-10-21 22:07:03,3,7,656954878338727936
@ktivnews: Sen. Ernst says trip to Middle East was ‘eye opening’: http://www.ktiv.com/story/30308930/2015/10/20/sen-ernst-says-trip-to-middle-east-was-eye-opening …,2015-10-21 19:00:48,1,1,656908005993259009
Nat'l debt has continued to climb since #MartyMcFly drove the #DeLorean. A reminder that now is the time for fiscal reform #BackToTheFuture,2015-10-21 16:03:27,5,4,656863374588923904
I voted to protect law-abiding citizens & end #SanctuaryCities that can harbor dangerous criminals: http://www.ernst.senate.gov/content/ernst-stresses-need-protect-law-abiding-citizens-end-sanctuary-cities …,2015-10-20 19:10:28,14,6,656548053223133184
Honored to greet @EIHonorFlight veterans and thank them for their service to our nation.pic.twitter.com/HPOkolMrMH,2015-10-20 18:52:48,12,4,656543607046979584
Need assistance cutting through federal agencies’ red tape? We can help. Learn more: http://www.ernst.senate.gov/content/casework …pic.twitter.com/YYGTBfoseN,2015-10-19 22:37:20,0,3,656237722898690048
The #VETSAct expands telehealth services to meet the wide-ranging needs of veterans in IA & across the country.pic.twitter.com/PHDwbRDIuI,2015-10-19 18:46:25,1,2,656179614574878720
Click on the link to read this week’s newsletter:https://outreach.senate.gov/iqextranet/view_newsletter.aspx?id=100638&c=Jernst …,2015-10-13 21:40:03,1,5,654048981333483521
".@kcautv reported on the #VETSAct, legislation to improve health care access for veterans. Watch:https://www.youtube.com/watch?v=JCsck2aeNyM …",2015-10-13 19:32:25,1,8,654016862703996931
.@KMANews1: Ernst introduces bill aimed to assist veteran’s health care: http://www.kmaland.com/news/ernst-introduces-bill-aimed-to-assist-veteran-s-health-care/article_e564444a-6deb-11e5-a8c1-13cdfea65ce9.html …,2015-10-13 14:57:15,7,9,653947614711431168
Stay up to date – sign up for my e-newsletter. It comes out this Sunday! http://www.ernst.senate.gov/content/contact-joni …pic.twitter.com/7LHZWsx1WT,2015-10-09 21:31:39,0,3,652597314637430784
Read my statement on today’s federal ruling stalling Obama EPA’s #WOTUS rule:  http://www.ernst.senate.gov/content/ernst-statement-nationwide-suspension-wotus …,2015-10-09 19:54:43,2,5,652572921370648576
Watch @Cbs2iowa’s report on the #VETSAct:https://www.youtube.com/watch?v=lM03Opu_SM4 …,2015-10-09 17:08:03,1,2,652530977672167425
.@WCFCourier: Ernst pushes for expansion of telehealth care for veterans:http://wcfcourier.com/news/local/govt-and-politics/ernst-pushes-for-expansion-of-telehealth-care-for-veterans/article_28d343e4-1c6f-572e-bb54-ecb868167d57.html …,2015-10-09 15:59:32,2,3,652513735744061440
The VETS Act moves us one step closer to achieving the healthcare our veterans deserve (3 of 3) #VETSActpic.twitter.com/siTcF6Ji3w,2015-10-08 22:10:13,5,11,652244634995965952
"#VETSAct overcomes unneeded hurdles, allowing qualified VA doctors to conduct telehealth services across state lines for veterans. (2 of 3)",2015-10-08 22:05:10,2,5,652243362930683904
Should veterans seeking telehealth treatment have to travel to federal facilities to use a camera or phone? (1 of 3) #VETSAct,2015-10-08 22:00:49,1,2,652242266669584386
Telehealth care is an innovative & important means to meet the needs of veterans in IA & nationwide #VETSActpic.twitter.com/qMXMdlERm5,2015-10-08 20:19:07,4,2,652216674804998149
Introduced a bill w/ @MazieHirono to improve telehealth care access for veterans #VETSAct http://www.ernst.senate.gov/content/ernst-hirono-introduce-vets-act …,2015-10-08 19:23:22,3,2,652202642890977280
"I’m pleased to announce my new initiative to help the over 200,000 veterans in Iowa & over 21 million veterans nationwide. #VETSAct",2015-10-08 19:22:43,7,3,652202479636119552
"Does info sharing between Iraq, Russia & Syria put US at risk? I asked Gen. Keane at today's @SASCMajority hearing:https://www.youtube.com/watch?v=iiGFA3Wbpb8&feature=youtu.be …",2015-10-08 16:28:40,1,1,652158678255046656
#TBT Coach Ferentz in DC this summer. Best of luck to @HawkeyeFootball this weekend! #OurIowa #Homecoming2015pic.twitter.com/DBSy5qmr81,2015-10-08 15:06:21,8,7,652137966161129472
"As we face some of the most complex security challenges in more than a generation, I urge #POTUS to sign this NDAA: http://www.ernst.senate.gov/content/five-ernst-provisions-included-ndaa-conference-report …",2015-10-07 20:08:26,1,4,651851596561825792
I went “On the Record” with @Greta to discuss yesterday’s @SASCMajority hearing on the situation in Afghanistan:https://www.youtube.com/watch?v=y3t7V3qqyN0&feature=youtu.be …,2015-10-07 15:49:26,6,7,651786418914742272
The @SASCMajority hearing this AM centers on the situation in Afghanistan. You can stream it live at 8:30AM CT: http://www.armed-services.senate.gov/hearings/15-10-06-the-situation-in-afghanistan …,2015-10-06 13:01:24,0,1,651381744722149376
Did you know today is National Manufacturing Day? #MFGDAY15 Read more here: https://www.facebook.com/senjoniernst/posts/463045740523532:0 …pic.twitter.com/Q4nOcLv0dg,2015-10-02 20:23:33,4,3,650043463027851264
"In yesterday’s @SASCMajority hearing, I stressed the significant need for program management in the Navy: http://www.ernst.senate.gov/content/ernst-stresses-significant-need-program-management-navy …",2015-10-02 16:57:07,3,1,649991514177806336
.@WHOhd reported on my efforts to push back on the harmful OSHA guidance that prohibited input from farmers. WATCH:https://www.youtube.com/watch?v=crXznmmKbcg&feature=youtu.be …,2015-10-01 18:31:19,1,2,649652829775360002
Let's remember those who have fought #BreastCancer & focus our efforts towards education & support of a cure!pic.twitter.com/LUbAZ4fCRE,2015-10-01 16:29:42,2,7,649622223435788288
A great honor to meet with one of Iowa’s veterans - Cindy of Ankeny. Thank you for your service!pic.twitter.com/TSRs7tDkjQ,2015-09-30 22:11:12,4,0,649345777765105664
Russia’s involvement will have disastrous consequences for the U.S. and Syria: http://www.ernst.senate.gov/content/ernst-russia%E2%80%99s-involvement-will-have-disastrous-consequences-us-and-syria …,2015-09-30 21:07:31,2,3,649329751329517568
I’m tired of DC's habit of governing from one emergency to the next. Americans deserve a sustainable path forward: http://www.ernst.senate.gov/content/sen-ernst-statement-continuing-resolution …,2015-09-30 15:28:52,14,3,649244528839380992
@EmmetsburgNews: Ernst Hosts Gathering http://www.emmetsburgnews.com/page/content.detail/id/525152/Ernst-Hosts-Gathering.html?nav=5001 …,2015-09-30 15:15:29,0,0,649241159664029696
Great to meet with Iowa #smallbiz owners like Mona of @LifeandHealthWCpic.twitter.com/zjNCOpXuOe,2015-09-29 22:31:29,4,2,648988496733061120
Is the Administration’s counter-ISIS strategy in cyberspace working? Watch responses to my @SASCMajority questions:  http://www.ernst.senate.gov/content/ernst-presses-witnesses-us-counter-isis-effort-cyberspace …,2015-09-29 21:55:30,0,2,648979441255862272
Happy birthday @VFWHQ!pic.twitter.com/M9zUToTyvR,2015-09-29 17:05:57,6,4,648906570210877441
Today’s @SASCMajority hearing will consider US cybersecurity policy & threats. You can stream it live at 8:30AM CT: http://www.armed-services.senate.gov/hearings/15-09-29-united-states-cybersecurity-policy-and-threats …,2015-09-29 12:56:14,2,2,648843729793609728
My office can help assist Iowans in dealing with federal agencies. Learn more: http://www.ernst.senate.gov/content/helping-you …pic.twitter.com/48BlWNAbV6,2015-09-28 18:54:56,5,3,648571611826814976
"If you didn’t read last night’s newsletter, you still can! https://outreach.senate.gov/iqextranet/view_newsletter.aspx?id=100590&c=JErnst …. To sign up, visit http://Ernst.Senate.Gov .",2015-09-28 17:05:53,0,1,648544169221296128
Planning a trip to Washington? My office can help schedule tours of the U.S. Capitol and other DC area attractions.pic.twitter.com/9sADkitgXk,2015-09-25 20:02:45,2,2,647501514295115780
A look at yesterday’s address from #PopeFrancis… #PopeInUSpic.twitter.com/RlkEfnSdhK,2015-09-25 17:26:15,6,1,647462130241941504
Yesterday I welcomed the Quad Cities Honor Flight. It’s a special honor to thank our Iowa veterans for their service.pic.twitter.com/OCFpY3uE0I,2015-09-25 15:41:08,12,5,647435677127299072
Glad @BishopPates could join me for today’s visit from Pope Francis #PopeInDC #PopeInUSApic.twitter.com/PV6Af7xKkE,2015-09-24 16:11:31,9,3,647080935104618496
Pleased to welcome Pope Francis to the U.S. Capitol & I look forward to his historic address. Watch live here:http://www.speaker.gov/pope ,2015-09-24 12:59:24,2,2,647032587203014656
"If you missed it, read the @TelegraphHerald's editorial on our bipartisan 'Ban the Box’ legislation http://www.thonline.com/news/opinion/article_a2c450ba-458f-5009-b95b-c40c7ef70e59.html …",2015-09-23 21:41:33,2,1,646801601043238912
It’s officially autumn in Iowa! #FirstDayOfFallpic.twitter.com/k5jOvAQ10J,2015-09-23 20:00:14,9,5,646776106620596224
".@KMANews1: Ernst, Congress prep for Papal visit http://www.kmaland.com/news/ernst-congress-prep-for-papal-visit/article_723cc782-616e-11e5-8514-23aaa58efafb.html …",2015-09-23 18:30:11,1,2,646753440811642882
Visited with Iowans who dropped by to pick up their tickets to tomorrow’s telecast of the Pope address. #popeinDCpic.twitter.com/Y7Az0E2c6Q,2015-09-23 16:51:16,0,1,646728550071054336
Exciting to read about the first all female #HonorFlight traveling through @Reagan_Airport. Thanks for your service!pic.twitter.com/qtZ9QRtCGq,2015-09-22 21:03:04,19,8,646429528647147521
It’s a great honor to welcome veterans with the Waterloo #HonorFlight to DC.pic.twitter.com/VbxLQJgFok,2015-09-22 16:39:35,7,7,646363222161915904
I’m standing with Micah & will continue working to protect the futures of innocent babies: http://www.ernst.senate.gov/content/ernst-statement-support-5-month-abortion-ban …pic.twitter.com/87obw8pTBO,2015-09-22 16:17:57,5,4,646357778529972224
Looking forward to witness testimony at today's #HSGAC hearing focused on VA accountability: http://www.hsgac.senate.gov/hearings/improving-va-accountability-examining-first-hand-accounts-of-department-of-veterans-affairs-whistleblowers …pic.twitter.com/8C6dc1OndI,2015-09-22 13:00:04,5,1,646307976773550080
"Tonight, I shared an Iowa family’s powerful story in calling for support of a 5 month abortion ban: http://www.ernst.senate.gov/content/ernst-shares-iowa-family%E2%80%99s-powerful-story-calling-support-5-month-abortion-ban …",2015-09-22 00:28:02,8,6,646118722931982336
Heading to the Senate floor to discuss support of 5 Month abortion ban. Watch here: http://www.c-span.org/video/?327431-1/us-senate-debate-planned-parenthood-funding …,2015-09-21 21:25:16,12,11,646072726793396224
Spoke with @WHOhd about the harmful impact of WOTUS’ overreach:https://www.youtube.com/watch?v=O2ejbaRjEEk&feature=youtu.be …,2015-09-21 18:51:00,1,0,646033903942299649
#SuicidePreventionMonth reminds us there must be no delay in mental health care when a veteran is suffering.pic.twitter.com/PGHiO4LA6G,2015-09-21 18:07:02,7,4,646022842497298438
Great discussion over the weekend with folks at my town meeting in Palo Alto County. #99CountyTourpic.twitter.com/DyoU9UUl1t,2015-09-21 17:07:12,2,0,646007782341279745
Happy birthday to @USAirForce and thank you to our brave #Airmen for their dedication & service #AFBDay2015,2015-09-18 21:21:11,5,7,644984536015720448
It’s not too late! Ticket inquiries to simulcast of the Pope’s address to Congress? Read more http://www.ernst.senate.gov/content/office-sen-ernst-announces-tickets-iowans-watch-simulcast-west-lawn-pope-address …pic.twitter.com/ONsfGyCnGM,2015-09-18 19:33:39,1,2,644957476450902016
"I hosted my first telephone town hall on Thursday. If you missed it & want to sign up for future calls, click here: http://www.ernst.senate.gov/content/contact-joni …",2015-09-18 17:36:21,2,0,644927956947742720
We must always remember our heroes who haven't come home #POWMIApic.twitter.com/zCWjVZK6ET,2015-09-18 16:57:14,9,7,644918112308084736
It’s time to put an end to the #WOTUS definition that hurts Iowa & rural communities nationwide.pic.twitter.com/f6PkXHTWR4,2015-09-17 23:28:39,5,11,644654227671769088
Hardworking Iowans don’t need more DC bureaucrats from #EPA telling our job creators how to best use their land.pic.twitter.com/O5Ag4arXMe,2015-09-17 21:49:47,17,10,644629348503453696
A one size fits all expanded #WOTUS definition is the wrong approach & puts our ag communities at a disadvantage.,2015-09-17 20:49:50,6,8,644614258148409344
Today I introduced a resolution to nullify the expanded #WOTUS definition harmful to Iowa: http://www.ernst.senate.gov/content/ernst-46-additional-senators-introduce-resolution-nullify-expanded-wotus-definition-harmful …pic.twitter.com/VFuG6uPxax,2015-09-17 20:16:53,23,21,644605967217377280
May we always pass on the importance of our liberties to our children & grandchildren for generations to come. #ConstitutionDay #TBT,2015-09-17 18:09:07,3,4,644573815180271616
Staff & I started off the day calling @ChuckGrassley to sing him happy birthday!pic.twitter.com/7yiDUBpYwa,2015-09-17 12:09:22,12,9,644483280306368512
Pleased to meet with folks from different Iowa businesses representing @IowaABIpic.twitter.com/0iBhJKnRU0,2015-09-16 21:16:54,7,4,644258682788704260
I urged the @OPMDirector to inform and protect Iowans with compromised information impacted by cybersecurity breach: http://www.ernst.senate.gov/content/ernst-urges-opm-inform-protect-iowans-compromised-information-impacted-cybersecurity-breach …,2015-09-16 16:05:41,1,2,644180362961272832
I remain committed to rejecting the President's #IranDeal: http://www.ernst.senate.gov/content/ernst-remains-committed-rejecting-president%E2%80%99s-iran-nuclear-deal …,2015-09-16 00:03:03,10,10,643938106719240192
"Iowans inquiring about tickets to simulcast of the Pope’s address to Congress, click here: http://www.ernst.senate.gov/content/office-sen-ernst-announces-tickets-iowans-watch-simulcast-west-lawn-pope-address …pic.twitter.com/nTCwCKqzmu",2015-09-15 15:38:04,2,4,643811024425062400
"Did you read last night’s newsletter? If not, click here:https://outreach.senate.gov/iqextranet/view_newsletter.aspx?id=100519&c=JErnst …",2015-09-14 19:00:50,2,1,643499664965304320
Friendly office rivalry in anticipation of today’s #CyHawk football game! Who are you rooting for?pic.twitter.com/xSTNFSHA9u,2015-09-12 19:02:15,10,6,642775244336402433
Today we remember the sacrifices and those who lost their lives on 9/11 #NeverForgetpic.twitter.com/HRiJOOaOic,2015-09-11 17:53:32,25,17,642395566132097024
Read my column in @CNN on the dangers of the President’s Iran deal:http://www.cnn.com/2015/09/10/opinions/ernst-iran-nuclear-deal/index.html …,2015-09-11 16:57:02,5,5,642381345461809153
We pay tribute to the victims of the tragedies on 9/11 & their families. #UnitedWeStand #NeverForgethttps://www.youtube.com/watch?v=Nbev5fN2gik …,2015-09-11 13:56:34,20,19,642335929542250496
Read my statement on this evening’s vote on the President’s #IranDeal: http://www.ernst.senate.gov/content/sen-ernst-opposes-president%E2%80%99s-nuclear-deal-iran …,2015-09-10 22:06:19,2,5,642096792511844352
@RadioIowa: Ernst says Iran ‘poised to double-down on… terrorism’ http://www.radioiowa.com/2015/09/10/ernst-says-iran-poised-to-double-down-on-terrorism/ …,2015-09-10 18:04:03,0,4,642035825090396160
"Started the day with IA delegation bfast @ChuckGrassley, @RepRodBlum, @RepDavidYoung, @SteveKingIA, & @daveloebsackpic.twitter.com/7sFen01Tjw",2015-09-10 13:58:13,14,9,641973958963765248
VIDEO: Ernst Highlights Failures Within President’s Iran Deal: http://www.ernst.senate.gov/content/ernst-highlights-failures-within-president%E2%80%99s-iran-deal …,2015-09-10 00:43:25,7,8,641773941598629890
"HAPPENING NOW: Sen. Ernst to speak on the Senate floor about the President's #IranDeal. Watch live on C-SPAN2:
http://www.c-span.org/networks/?channel=c-span-2 …",2015-09-09 23:02:03,7,5,641748430759530496
Best way to start my morning? Coffee and conversation with Iowans visiting DC!pic.twitter.com/NJ441cR9N4,2015-09-09 15:52:37,5,4,641640357927735296
TUNE-IN to @600WMTAM as I’m joining @DougWagner at 6:25AM CT. You can also listen online here:http://600.wmtradio.com/onair/doug-wagner-51054/ …,2015-09-09 10:36:18,2,6,641560754232139776
I’m back on Twitter! Thanks to my staff for providing updates while I was on annual training for the @NationalGuardpic.twitter.com/P6nFCq1EO1,2015-09-08 19:51:12,25,13,641338012421390336
Ticket inquiries to see simulcast of Pope Francis’ historical address to Congress? Click here http://www.ernst.senate.gov/content/office-sen-ernst-announces-tickets-iowans-watch-simulcast-west-lawn-pope-address …pic.twitter.com/GyPuBAzyIW,2015-09-04 18:07:58,2,2,639862482325086208
Staff visited the Iowa City Veterans Affairs Hospital and took a tour last week.pic.twitter.com/VXdFYZPeHW,2015-09-04 13:58:58,6,2,639799820836839424
#TBT Sen. Ernst representing Iowa at a @SenateAGGOP hearing… https://www.facebook.com/senjoniernst/posts/454696928025080:0 …pic.twitter.com/MTcJAF7Ri4,2015-09-03 20:20:56,7,8,639533555111043072
"Questions about eligibility involving Social Security, Medicare, veterans benefits & more? Our office can help:pic.twitter.com/Zc1EV0P2E1",2015-09-03 13:08:07,1,3,639424633016598528
Staff visited the @132FighterWing where the tour focused on Iowa Air National Guard domestic response capabilities.pic.twitter.com/mD5H02fQ4N,2015-09-02 20:51:48,4,4,639178935910166529
.@TelegraphHerald: Tickets available for Pope speech simulcast http://www.thonline.com/news/tri-state/article_c4324d22-ed0e-53ab-9586-4b4d1bcccc58.html …,2015-09-02 16:44:30,4,3,639116702089879552
"Our office is here to help w/ questions on eligibility involving Social Security, Medicare, veterans benefits & morepic.twitter.com/lIQDIeAyo0",2015-09-02 13:52:56,6,6,639073524037079041
September is better breakfast month. What’s your favorite way to start the day?pic.twitter.com/1KlxWDm8C8,2015-09-01 16:13:39,7,2,638746549581967360
Staff from Sen. Ernst’s office will hold traveling office hours today. Find out more: http://www.ernst.senate.gov/content/office-sen-ernst-announces-traveling-office-hours-august-and-september …pic.twitter.com/vjPx0qtm5U,2015-09-01 12:57:10,2,4,638697103921934336
"If you can’t make traveling office hours, staff is available at offices across the state to assist you! Read more: http://www.ernst.senate.gov/content/sen-ernst-announces-new-office-locations …",2015-08-31 18:58:23,1,2,638425617952829442
Staff from Sen. Ernst’s office will hold traveling office hours today. Find out more: http://www.ernst.senate.gov/content/office-sen-ernst-announces-traveling-office-hours-august-and-september …pic.twitter.com/kwTEePz0X3,2015-08-31 17:11:54,0,2,638398822805282816
Staff from Sen. Ernst’s office will hold traveling office hours today. Find out more: http://www.ernst.senate.gov/content/office-sen-ernst-announces-traveling-office-hours-august-and-september …pic.twitter.com/fAGuuB72mK,2015-08-28 16:49:21,0,1,637305982834593792
#TBT Sen. Ernst at her first #99CountyTour visit in Montgomery County.pic.twitter.com/u1M2IsMeLG,2015-08-27 19:26:54,1,1,636983244265791490
Do you follow Sen. Ernst on Instagram? You should! Check out her account here: https://instagram.com/senjoniernst/ pic.twitter.com/hLjYHkH4ss,2015-08-26 17:56:07,1,0,636598007933308928
Staff from Sen. Ernst’s office will hold traveling office hours today. Find out more: http://www.ernst.senate.gov/content/office-sen-ernst-announces-traveling-office-hours-august-and-september …pic.twitter.com/uwDBXC6Htk,2015-08-26 13:51:07,1,0,636536354072043520
