Text,Date,Favorites,Retweets,Tweet ID
Our office can help arrange tours of the Capitol & other attractions in DC for Iowans who are visiting. Learn more: http://www.ernst.senate.gov/public/index.cfm/visiting-washington-dc …,2016-06-03 14:05:50,5,0,738733433451651073
I've already completed over half of my 2016 #99CountyTour so far! Follow along here: http://www.ernst.senate.gov/public/index.cfm/99-county-tour …,2016-06-02 14:08:43,6,0,738371772760924162
June is #NationalDairyMonth!pic.twitter.com/R02BO76Nla,2016-06-01 19:48:44,22,9,738094951255408640
Let’s remember and give thanks to all of our men and women who have given their lives so we can be free. #MemorialDay,2016-05-30 13:45:03,48,13,737278654225481729
Thinking of our fallen heroes & their families this #MemorialDay weekend. We will never forget your sacrifices for our nation.,2016-05-29 16:17:36,42,12,736954653611556864
May the WASP rest in peace at Arlington National Cemeteryhttp://bit.ly/1sE62bV ,2016-05-28 15:48:05,18,3,736584837629415424
I’m honored to give the Weekly Republican Address. Take a look:https://www.youtube.com/watch?v=XipnNtxB0Ww …,2016-05-28 13:46:54,13,9,736554341348352000
Do you have ideas of how to #MakeEmSqueal in Washington? Let me know here: http://www.ernst.senate.gov/public/index.cfm?p=make-em-squeal-email_2 …,2016-05-27 17:52:21,5,6,736253723299741697
.@KCRG took a look at some of the pieces of legislation I moved through the Senate this week. Watch:https://youtu.be/sTNITn0xxa8 ,2016-05-27 16:23:38,3,0,736231397522874368
Yesterday I told @marthamaccallum on @FoxNews why I'm calling for VA Secretary McDonald to resign. Watch:https://youtu.be/n9ta0tMrrI0 ,2016-05-27 14:17:48,13,8,736199732335370240
Our legislation to name a Cedar Rapids post office after an Iowa Guardsman killed in Afghanistan passed Senatehttp://www.ernst.senate.gov/public/index.cfm/2016/5/iowa-delegation-s-legislation-to-name-cedar-rapids-post-office-after-iowa-guardsman-killed-in-afghanistan-passes-senate …,2016-05-26 22:38:34,11,2,735963363449176065
"We’re $19 trillion in debt, yet our govt is spending $100,000 to build ski jumps?https://outreach.senate.gov/iqextranet/view_newsletter.aspx?id=101720&c=JErnst …",2016-05-26 21:21:45,10,9,735944033504202752
RT if you agree VA Sec. McDonald needs to resign immediately.http://www.ernst.senate.gov/public/index.cfm/2016/5/ernst-calls-on-va-secretary-mcdonald-to-resign-immediately …,2016-05-26 16:53:53,22,26,735876620985241600
I'm joining @AmericaNewsroom on @FoxNews at 9:40 AM CT to talk about my call for the VA Sec to resign. Tune in:http://video.foxnews.com/v/1241186546001/fox-news-channel/?#sp=watch-live …,2016-05-26 14:29:39,1,2,735840323449032705
Legislation to name a Cedar Rapids post office after an Iowa hero passed committee:http://www.thegazette.com/subject/news/government/bill-to-honor-eastern-iowa-soldier-advances-20160525 …,2016-05-26 13:27:58,8,0,735824804205473792
Spoke w/ @KCRG about our legislation to restore inurnment rights of WASP @ArlingtonNatl:https://youtu.be/zj0ihSQ4ENg ,2016-05-25 22:22:07,7,5,735596838942846977
Do you agree that our govt shouldn’t be spending $250K on a maple processing facility? See my latest Squeal Award: https://outreach.senate.gov/iqextranet/view_newsletter.aspx?id=101720&c=JErnst …,2016-05-24 22:08:23,11,5,735230995289542656
I'm calling on VA Sec. McDonald to resign immediately: http://www.ernst.senate.gov/public/index.cfm/2016/5/ernst-calls-on-va-secretary-mcdonald-to-resign-immediately …,2016-05-24 18:31:14,174,130,735176345068654592
Wonderful to welcome the Cedar Valley Honor Flight. Join me in thanking these heroes for their service.pic.twitter.com/ZcqzAt8Ys6,2016-05-24 17:01:23,41,13,735153734993514496
I announced this month's recipient of my Squeal Award for wasteful spending. Find out the winner here: https://outreach.senate.gov/iqextranet/view_newsletter.aspx?id=101720&c=JErnst … #MakeEmSqueal,2016-05-24 16:07:53,5,5,735140271135064064
"Last week, I had the honor of hosting a roundtable w/ vets & officials in Greene Countypic.twitter.com/IPICHmJGKO",2016-05-24 14:26:50,14,4,735114842823069698
Learned about the things KemX Global is doing in Boone on my #99CountyTour last weekpic.twitter.com/jhzG0EQZGN,2016-05-24 12:36:46,3,2,735087143719161861
Absolutely appalled by Sec. McDonalds’ callous & out of touch comparison of long VA wait times to lines @ Disneylandhttp://www.ernst.senate.gov/public/index.cfm/2016/5/ernst-condemns-va-secretary-s-disgraceful-comments-on-wait-times …,2016-05-23 23:00:00,22,17,734881594528403456
VIDEO: @POTUS signed into law our legislation to restore inurnment rights of WASP @ArlingtonNatlhttps://youtu.be/rn4Iwjqg15s ,2016-05-23 22:29:04,7,6,734873811829526528
TUNE-IN: Sen. Ernst to speak on Senate floor now on legislation signed into law to restore WASP inurnment rights:  http://www.c-span.org/networks/?channel=c-span-2 …,2016-05-23 20:55:56,6,5,734850371722563586
Talked about the health care issues facing Iowans w/ @IowaPharmacyIPA at the Guthrie Co. Hospital #99CountyTourpic.twitter.com/7vfNfYL8VP,2016-05-23 20:06:31,12,6,734837936605278208
Thrilled that our WASP measure has been signed into law! @SenatorBarb @RepMcSally @RepSusanDavishttp://www.ernst.senate.gov/public/index.cfm/2016/5/ernst-wasp-measure-signed-into-law …,2016-05-20 17:41:50,10,3,733714361978638337
I’ll be back on my #99CountyTour tomorrow! Check out my visits so far this year: http://www.ernst.senate.gov/public/index.cfm/99-county-tour …,2016-05-19 19:10:50,1,0,733374374309433345
thru providing post access to transportation & ridesharing companies like Uber http://www.ernst.senate.gov/public/index.cfm/2016/5/several-ernst-measures-included-in-national-defense-authorization-act-markup … (2/2),2016-05-18 21:54:14,3,2,733053105298919424
My NDAA provision would reduce drunk driving/provide opportunities for military communities (1/2),2016-05-18 21:53:56,3,1,733053029549809666
Always wonderful to see @ChuckGrassley and Iowans visiting DC at my Wednesday am constituent coffee!pic.twitter.com/sgOhxMqrXC,2016-05-18 20:53:01,10,2,733037698039074819
I was honored to greet the heroes from the Eastern Iowa Honor Flight to DC today. Thank you for your service!pic.twitter.com/un9dxE938Q,2016-05-18 19:52:58,27,8,733022586431504384
Congrats to fellow Iowan & friend Swati Dandekar on her new role as executive director w/ the Asian Development Bankhttp://www.thegazette.com/subject/news/government/us-senate-approved-dandekar-for-ambassador-post-20160517 …,2016-05-18 16:47:30,4,4,732975913336504320
Progress! @GOPoversight passed my bipartisan program mgmt bill which would prevent tax $$ from being wasted due to fed govt mismanagement.,2016-05-17 21:30:22,14,7,732684711403872256
.@wcfcourier: Ernst legislation to aid WASPs goes to presidenthttp://wcfcourier.com/news/local/govt-and-politics/ernst-legislation-to-aid-wasps-goes-to-president/article_b3cd772c-6169-55fc-8b83-cdb5205db956.html …,2016-05-17 20:56:38,5,5,732676224024227842
Honored to see the Army Reserve Soldiers off in Sioux City on Saturday as they deployed to Kuwait & Afghanistan.pic.twitter.com/ZlZSdjPJNc,2016-05-16 22:39:17,34,14,732339667518038016
Learned about the dam and dry run project in Bremer County on my #99CountyTour last weekpic.twitter.com/u5gJpeC7Ux,2016-05-16 21:49:20,1,0,732327096798875649
Had a great time in Waterloo on my #99CountyTour visiting @TysonFoods and the TechWorks Campuspic.twitter.com/PTw8r6hLhC,2016-05-16 20:51:44,3,1,732312601405820932
Nice to visit with @RitchieWaterers manufactures on my #99CountyTour in Grundy Countypic.twitter.com/v7kUKafah0,2016-05-16 19:50:59,3,3,732297314040197120
Appreciated the Qs & ideas from all of those who came to my town meeting in Hardin County last week. #99CountyTourpic.twitter.com/qC8duWC1Ta,2016-05-16 18:13:07,5,1,732272684604768260
My office can help Iowans in their dealings w/ the fed govt. Visit my website for more info: http://www.ernst.senate.gov/public/index.cfm/casework …,2016-05-12 19:15:44,2,3,730838889087291393
Do you have ideas of government waste that you think should be cut? Email me here: http://www.ernst.senate.gov/public/index.cfm?p=make-em-squeal-email_2 … #MakeEmSqueal,2016-05-12 15:49:44,4,4,730787049851240449
Enjoyed visiting with the @DesMoinesMetro this am!pic.twitter.com/kqjlvnvySr,2016-05-12 13:44:22,10,2,730755498643996673
The House just passed our legislation to restore the inurnment rights of WASP @ArlingtonNatl! I encourage @POTUS to sign it into law ASAP.,2016-05-11 21:49:51,13,11,730515285699112965
Thanks to all of the Iowans who joined me for coffee this morning at the DC office!pic.twitter.com/K0eTxTnAAN,2016-05-11 16:52:17,9,3,730440403422416897
Thrilled the Senate passed legislation I intro’d w/ @SenatorBarb to restore inurnment rights of WASP @ArlingtonNatlhttp://www.ernst.senate.gov/public/index.cfm/2016/5/ernst-mikulski-legislation-to-restore-inurnment-rights-of-wasp-at-arlington-national-cemetery-passes-senate-unanimously …,2016-05-10 22:51:55,15,12,730168517643911169
It was great to speak with @UEPCertified as we celebrate #NationalEggMonthpic.twitter.com/xzEUdTQe73,2016-05-10 15:40:05,5,5,730059846159106048
"If you’re an Iowan visiting DC, I’d love to see you at my constituent coffee tomorrow. Click here for more details: http://www.ernst.senate.gov/public/index.cfm/visiting-washington-dc …",2016-05-10 12:43:14,5,3,730015339677925376
Was honored to take part in the sendoff for the 185th CSSB of the IA National Guard as they deploy for Afghanistan.pic.twitter.com/FGctErzrC2,2016-05-09 21:38:38,35,17,729787690061803522
Got to see the awesome liftgates Tommy Gate makes on my #99CountyTour in Harrison Countypic.twitter.com/aAJJP3KboU,2016-05-06 21:17:42,8,0,728695257232252928
Had a wonderful time at @FrmTbleDelivery in Shelby County on my #99CountyTourpic.twitter.com/wM4G7Qs9oy,2016-05-06 20:33:13,6,3,728684062009901057
Learned about the great work the Children’s Nest does in early childhood education on my #99CountyTour in Audubonpic.twitter.com/tJ0Cu3k1Bu,2016-05-06 18:42:43,5,0,728656254357352449
Want to get the latest on my work in Washington on behalf of Iowans? Sign up for my newsletter here: http://www.ernst.senate.gov/public/index.cfm/get-the-newsletter …,2016-05-03 19:21:03,7,3,727578737248747522
April was #SAAM; check out some of the reforms I’ve been working on to raise awareness & combat this heinous crime:https://outreach.senate.gov/iqextranet/view_newsletter.aspx?id=101649&c=Jernst …,2016-05-03 13:54:19,10,3,727496513853755392
"Thanks to DAC, Inc. in Jackson County for showing me around your facility on my #99CountyTour & for the work you dopic.twitter.com/3RcV35yeaZ",2016-05-02 20:28:25,9,1,727233301350592512
It was great to hear from folks at my town meeting on Friday in Jones County on my #99CountyTourpic.twitter.com/FpOSFulhGX,2016-05-02 17:58:15,11,1,727195510671593472
Got to see the work Cedar County’s Xerxes Manufacturing does on my #99CountyTourpic.twitter.com/hWSawtPux6,2016-05-02 15:36:51,7,0,727159929673539588
Had fun taking questions from the students at Clinton High School on my #99CountyTourpic.twitter.com/zs9R5W65cH,2016-04-29 20:13:58,19,1,726142504681279488
@KMANews1: Ernst supports new energy reform bill http://www.kmaland.com/news/ernst-supports-new-energy-reform-bill/article_adc16614-0bc3-11e6-8e9d-bf5d7d29d98e.html …,2016-04-29 19:02:18,1,0,726124467114631171
Introduced the Military Retaliation Prevention Act to protect survivors of military sexual assault from retaliationhttp://www.ernst.senate.gov/public/index.cfm/2016/4/mccaskill-ernst-take-next-step-to-curb-sexual-assault-in-the-military-aiming-to-protect-survivors-from-retaliation …,2016-04-29 17:58:01,6,5,726108290128723969
Check out my column in the @DMRegister: Ernst: Improve response to sexual assault in the militaryhttp://www.desmoinesregister.com/story/opinion/columnists/iowa-view/2016/04/29/ernst-improve-response-sexual-assault-military/83657706/ …,2016-04-29 15:43:55,9,7,726074542565785602
"This week, I joined a bipartisan group of Senators to demand we #passCASAct:https://youtu.be/8HVh3L5tHMw ",2016-04-29 15:13:05,1,0,726066782935592960
Great meeting with folks from @mtownchamber and @LandOLakesInc todaypic.twitter.com/tqtO3Vk3tb,2016-04-27 21:37:02,7,6,725438631494717440
Wonderful way to start Wednesday: Having coffee with Iowans visiting DC!pic.twitter.com/ICIIM7mN5C,2016-04-27 20:04:30,12,3,725415343469006849
Prove It Act would mitigate rules like overreaching expansion of WOTUS that threatens livelihood of many small bizhttp://www.ernst.senate.gov/public/index.cfm/2016/4/ernst-introduces-prove-it-act …,2016-04-27 17:59:43,2,0,725383942707228673
.@RadioIowa: Ernst and Grassley back bill designed to cut sexual assault on college campuseshttp://www.radioiowa.com/2016/04/26/ernst-and-grassley-back-bill-designed-to-cut-sexual-assault-on-college-campuses/ …,2016-04-27 16:55:57,7,0,725367897040760832
Had good conversations with folks from Iowa Area Agencies on Aging & @IACommunityBank todaypic.twitter.com/Rhv4uXw9pP,2016-04-26 21:05:39,10,3,725068345691754496
I’ll be joining @trenterice on @1430KASI shortly at 1:05 PM CT. Listen here:http://www.iheart.com/live/kasi-1430am-4060/?autoplay=true&pname=583&campid=play_bar&cid=%2Fonair%2Fthe-trent-rice-show-53599%2F …,2016-04-26 17:59:50,2,2,725021585007071233
Getting ready to join fellow Senators & survivors in urging Congress to #passCASAct. Click here to watch live:https://www.youtube.com/watch?v=6oVb7loN9hs …,2016-04-26 15:33:04,4,0,724984647067832320
Are you planning a trip to DC? My office can help arrange tours for Iowans. More info here: http://www.ernst.senate.gov/public/index.cfm/visiting-washington-dc …,2016-04-25 21:01:18,1,0,724704862261383169
Last week the Senate passed bipartisan energy reforms to promote American energy production & save $$ for consumershttp://www.ernst.senate.gov/public/index.cfm/2016/4/ernst-supports-bipartisan-comprehensive-energy-reform-bill …,2016-04-25 18:35:01,5,4,724668051866705920
It’s always great to see strong bipartisan support for youth involvement in programs like 4-H:http://www.ernst.senate.gov/public/index.cfm/2016/4/ernst-encourages-support-of-4-h …,2016-04-22 18:41:09,5,1,723582431467581440
"Wonderful to honor, welcome, & thank our veterans visiting with the Honor Flight of the Quad Cities organization.pic.twitter.com/Vl3AXSvQ64",2016-04-22 16:04:18,31,9,723542957480120320
Welcomed @northpolkcomets students and folks from the @CityofPella Chamber of Commerce yesterday.pic.twitter.com/n6uGR0fv6w,2016-04-21 15:40:58,3,0,723174698180186112
What a heartwarming story about one of Iowa’s very own!http://www.kwwl.com/story/31759574/2016/04/19/iowa-teen-gives-up-senior-prom-to-attend-wisconsin-boys-dance …,2016-04-20 18:10:35,4,3,722849961218416640
It was great seeing Iowans in DC this morning at my constituent coffee!pic.twitter.com/zD03bvXzud,2016-04-20 14:42:00,15,1,722797472154656769
Great visits w/ folks from @ChamberMC and @VisitClearLake chambers today!pic.twitter.com/Eb1rlwST4K,2016-04-19 22:12:20,6,2,722548412994953216
Spoke about admin’s failure to detain illegal immigrant charged in drunk driving incident that led to death of Iowanhttps://youtu.be/8Z0hx1lFxqw ,2016-04-19 17:04:30,3,3,722470942878908416
#TaxDay is a good reminder of why we need to cut wasteful spending and #MakeEmSqueal in Washington: http://www.ernst.senate.gov/squeal ,2016-04-18 22:13:06,6,8,722186217157222400
My first Squeal Award highlights wasteful govt spending: TSA Randomizer. Find out why here: http://www.ernst.senate.gov/squeal ,2016-04-18 21:51:42,0,2,722180833394761728
Iowans sent me to Congress to cut wasteful spending: http://www.ernst.senate.gov/squeal pic.twitter.com/9FJwIS1UfY,2016-04-18 21:14:08,10,1,722171377999093765
April is Sexual Assault Awareness Month; a time to speak out & fight for victims of military sexual assault. #SAAMhttp://www.ernst.senate.gov/public/index.cfm/2016/2/ernst-leads-bipartisan-military-sexual-assault-victims-empowerment-act …,2016-04-15 18:51:59,6,7,721048442915700736
You won’t want to miss my newsletter this weekend! Sign-up here: http://www.ernst.senate.gov/public/index.cfm/get-the-newsletter …,2016-04-15 15:43:42,2,2,721001059141947392
"My staff will be at the following spots to assist you w/ problems over Medicare, vets benefits, passports & more:pic.twitter.com/5qKJjUo0ON",2016-04-15 13:31:26,4,2,720967773900402688
It was great to see @SiouxlndChamber and @ChamberQC today!pic.twitter.com/JrUD56YBkR,2016-04-14 21:40:40,0,3,720728504153849856
Need help cutting through fed govt red tape? Ask a member of my staff at traveling office hours today:pic.twitter.com/Vyr5SB9ohS,2016-04-14 12:38:30,1,5,720592062895288320
Had fun welcoming some young faces from LeMars Middle School to DCpic.twitter.com/RdkwAUbTn0,2016-04-13 22:50:43,4,2,720383746289983488
Had some good meetings today with @IAcattlemen and @IowaRestaurantpic.twitter.com/RvpLbFfOnl,2016-04-13 21:32:41,6,3,720364106532802564
Introduced legislation w/ @JerryMoran to promote youth involvement in programs that serve as intro to careers in aghttp://www.ernst.senate.gov/public/index.cfm/2016/4/sens-moran-and-ernst-introduce-legislation-to-encourage-new-generation-of-agriculture-producers …,2016-04-13 15:48:43,3,3,720277545988395010
It’s time to cut the pork! @GovWaste’s #PigBook2016 releasepic.twitter.com/nIXLEuh0mY,2016-04-13 15:08:19,9,8,720267379536572416
"If you have Qs on passports, Social Security, or other issues, my staff is holding office hours in IA today to help:pic.twitter.com/hgW0BOWMTa",2016-04-13 12:31:41,2,2,720227960289169411
"If you’re an Iowan visiting DC, stop by my constituent coffee tomorrow! http://www.ernst.senate.gov/public/index.cfm/visiting-washington-dc …",2016-04-12 17:00:59,3,0,719933342053986304
"Do you have Qs on Medicare, immigration issues & more? My staff is traveling around IA today to help you. Details:pic.twitter.com/ls4f8qWT87",2016-04-12 13:42:20,1,1,719883353516810240
We must restore the rights of Women Airforce Service Pilots to be inurned @ Arlington Natl Cemetery. RT if you agreehttps://youtu.be/Qu8Vn2WaZXE ,2016-04-11 20:05:59,22,18,719617512690868225
Spoke with @cbs2iowa about my @SenateAgGOP sub hearing on empowering rural communitieshttps://youtu.be/H7u6pq-ggZY ,2016-04-11 14:54:54,0,3,719539227705401344
"My staff will be around IA today to answer your Qs on vets benefits, Social Security, Medicare, passports, and more:pic.twitter.com/8jC1lXr8tp",2016-04-11 12:48:41,2,5,719507462328557568
Spoke w/ @KCRG about my fight for the inurnment rights of WASPs at Arlington National Cemetery https://youtu.be/Qu8Vn2WaZXE ,2016-04-08 19:35:29,4,1,718522671877722112
.@weareiowa5news took a look at my bipartisan Credit for Caring Act. Watch:https://youtu.be/1z-iobbB1kc ,2016-04-08 17:23:53,3,2,718489555779850241
Watch the highlights from my @SenateAgGOP sub hearing from @KHQA:https://youtu.be/ESzjRu0sNjA ,2016-04-08 15:21:23,1,2,718458725699338242
Stop by if you are in the area!https://youtu.be/x1ZFXGwZDg4 ,2016-04-08 14:05:52,0,0,718439721869918208
"Questions on passports, Medicare or military affairs? We are here to help. Check out where my staff will be today:pic.twitter.com/azQEAt16Qc",2016-04-08 13:53:57,2,3,718436724980977664
"There are 40+ mil. family caregivers in the US and 317,000+ in IA. These folks deserve recognition & some relief!http://www.ernst.senate.gov/public/index.cfm/2016/4/ernst-bennet-ayotte-and-warren-introduce-tax-credit-for-family-caregivers …",2016-04-07 21:19:44,4,4,718186520356790272
Family caregivers deserve our recognition & some relief. The Credit for Caring Act helps Iowans helping other Iowans http://www.ernst.senate.gov/public/index.cfm/2016/4/ernst-bennet-ayotte-and-warren-introduce-tax-credit-for-family-caregivers …,2016-04-07 18:11:43,4,4,718139203306045440
My bipartisan Credit for Caring Act will provide relief to the 40+ mil. family #caregivers in the US who support their loved ones. (2/2),2016-04-07 15:52:10,15,11,718104084205674496
Today I introduced the Credit for Caring Act which provides a tax credit for working family caregivers (1/2) http://www.ernst.senate.gov/public/index.cfm/2016/4/ernst-bennet-ayotte-and-warren-introduce-tax-credit-for-family-caregivers …,2016-04-07 15:51:21,10,8,718103879926333440
"Have questions about Social Security, Medicare, or vets benefits? Check out where my staff will be today to help:pic.twitter.com/PAwgbXtqEd",2016-04-07 12:16:06,1,2,718049709827469312
Thanks to @ALZIowa for visiting todaypic.twitter.com/C6MZuDlTlB,2016-04-06 22:05:38,5,3,717835684367740929
Heard from Iowans about how burdensome fed regs are impacting rural communities at @SenateAgGOP sub hearing http://www.ernst.senate.gov/public/index.cfm/2016/4/iowans-emphasize-burdensome-federal-regulations-impeding-rural-communities-at-ernst-subcommittee-hearing …,2016-04-06 21:19:08,1,1,717823983824015360
Thanks to Craig Hill from @IowaFarmBureau and Monte Shaw from @iowafuel for joining the @SenateAgGOP sub hearing today!,2016-04-06 20:45:23,7,7,717815489305698304
Watch my opening remarks from the @SenateAgGOP sub hearing on USDA rural development programs:https://youtu.be/Fwe25x39OW8 ,2016-04-06 15:55:35,2,6,717742556335968256
Watch my @SenateAgGOP sub hearing on impact of USDA rural development programs & their economic impact at 9 AM CT: http://www.agriculture.senate.gov/hearings/usda-rural-development-programs-and-their-economic-impact-across-america …,2016-04-06 13:52:30,0,1,717711583338700801
Getting ready to chair my @SenateAgGOP sub hearing on the impact of USDA rural development programs.pic.twitter.com/UWC44wE0N0,2016-04-06 13:35:10,18,3,717707222344720384
"At 8:20 AM CT, I’ll talk with @GarySadlemyer on @kfabnews. Tune-in:http://www.iheart.com/live/news-radio-1110-kfab-1325/?autoplay=true&pname=611&campid=play_bar&cid=index.html …",2016-04-06 13:10:02,0,1,717700895908229120
"Need help w/ issues like veterans benefits, passports, or IRS? Here's where my staff will be to help answer your Qs:pic.twitter.com/ftsfAzaGWW",2016-04-06 12:03:45,3,3,717684215211491328
I’ll join @DougWagner on @600WMTAM at 6:25 AM CT. Listen online here:http://www.iheart.com/live/600-wmt-917/?autoplay=true&pname=1216&campid=play_bar&cid=%2Fonair%2Fdoug-wagner-andy-petersen-51054%2F …,2016-04-06 11:20:36,2,2,717673356116492289
Met w/ some of our future leaders: students from Adair-Casey Community School & Boy Scout Troop 418 from Forest Citypic.twitter.com/fbyFpAJuo5,2016-04-05 19:59:54,12,0,717441655301910528
Looking forward to chairing @SenateAgGOP sub hearing on economic impact of USDA rural development programs. Watch:http://www.ernst.senate.gov/public/index.cfm/2016/3/sen-joni-ernst-to-chair-senate-subcommittee-hearing-on-usda-rural-development-programs …,2016-04-05 17:08:44,1,4,717398577744646144
Are you an Iowan visiting DC this week? I host a coffee on Wednesday mornings and hope you can stop by. More info: http://www.ernst.senate.gov/public/index.cfm/?p=meeting-request …,2016-04-05 14:28:58,5,2,717358370638925824
My staff is on the road in IA to help you cut through the red tape w/ the fed govt. Here's today's stops (2/2):pic.twitter.com/8gEbzEkHau,2016-04-05 12:18:09,2,4,717325451157499904
My staff is on the road in IA to help you cut through the red tape w/ the fed govt. Here's today's stops (1/2):pic.twitter.com/iOrPIEL14z,2016-04-05 12:17:34,4,4,717325303576657920
Protecting trade secrets is an extremely important component to helping our companies retain a competitive edge:http://www.ernst.senate.gov/public/index.cfm/2016/4/ernst-supports-protections-for-trade-secrets …,2016-04-04 22:35:50,3,2,717118510275682304
I’ve completed over a third of my #99CountyTour so far. Check out some of the highlights here:https://outreach.senate.gov/iqextranet/view_newsletter.aspx?id=101430&c=JErnst …,2016-04-04 20:11:13,3,2,717082116601856000
Need assistance with a federal agency? We are here to help. Stop by our traveling office hours:pic.twitter.com/qY33i5rtXW,2016-04-04 12:32:18,3,3,716966623605874689
Reps from the office of Sen. Ernst are holding traveling office hours throughout IA. Here's where we'll be today.pic.twitter.com/qFnZtvekOs,2016-04-01 13:27:01,1,6,715893228797607936
Grateful for the staff at @blankchildrens for the work they do.pic.twitter.com/Li7NyfSJCX,2016-03-31 20:31:02,10,3,715637551558705158
Called for review of regulatory barriers Iowa pharmacies face in federal drug take back programhttp://www.ernst.senate.gov/public/index.cfm/2016/3/ernst-grassley-call-for-review-of-regulatory-barriers-iowa-pharmacies-face-in-federal-drug-take-back-program …,2016-03-31 20:06:23,2,2,715631346698297345
Discussed how overregulation is harming our ag industry at @AGRILANDFS in Winterset on my #99CountyTourpic.twitter.com/Ag1nMrbfG6,2016-03-31 17:36:47,9,2,715593699095408640
Great to join the @WorldFoodPrize event recognizing the important achievements of women in agriculturepic.twitter.com/wURBMvNWjX,2016-03-30 19:45:48,25,8,715263779278295040
"On my #99CountyTour in Adel, I talked w/ @admschools students about the importance of making their voices heardpic.twitter.com/fhgQsDSLqf",2016-03-30 14:00:42,29,13,715176932153954304
Do you receive my e-newsletter? It’s a great way to stay up-to-date on my work to serve you. Sign up: http://www.ernst.senate.gov/public/index.cfm/get-the-newsletter …,2016-03-29 20:45:46,3,0,714916481604141058
Spoke with @WOWT6News recently about what we need to do to defeat ISIShttps://www.youtube.com/watch?v=0P123lNzHOw …,2016-03-29 19:31:22,1,1,714897759279689729
