Text,Date,Favorites,Retweets,Tweet ID
Note the updated time for my tele-townhall tonight. You can still participate here: https://vekeo.com/event/lets-talk-senator-mike-lee-18316/ … #utpolpic.twitter.com/z5Pc22syAB,2015-09-16 20:48:37,5,5,644251564811509760
Taking online privacy into the 21st century: http://thehill.com/blogs/congress-blog/technology/253751-taking-online-privacy-into-the-21st-century … #ECPA @RepKevinYoder @RepJaredPolis @SenatorLeahy,2015-09-16 15:19:13,7,15,644168669241700352
On Wednesday night I will be holding my monthly tele-townhall at 7:30 p.m. MT. Click here to sign up: https://vekeo.com/event/lets-talk-senator-mike-lee-18316/ … #utpol,2015-09-16 03:28:11,12,12,643989730942689280
We need to make it harder for the government to access your electronic communications: http://www.dailydot.com/politics/email-privacy-ecpa-reform-congress-mike-lee/ … #ECPA,2015-09-15 19:45:29,43,48,643873291128733696
Keep Hildale and the first responders helping it recover from a devastating flash flood in your prayers:http://www.deseretnews.com/article/865636806/Six-dead-eight-missing-after-vehicles-are-swept-up-in-southern-Utah-flash-flood.html …,2015-09-15 13:23:29,16,16,643777155265114112
The sharing of the treaty-making power between the executive and the Senate is not a quirk:http://www.washingtonexaminer.com/a-bad-deal-and-a-dangerous-precedent/article/2571827 …,2015-09-11 18:45:29,40,37,642408637504356353
"Today we honor those who were killed, pray for those they left behind, & thank those who keep us safe & defend our liberty. #NeverForget911",2015-09-11 15:03:52,100,79,642352866498347008
"Americans deserve to know what evil is abroad in their land, & what good can be done to overcome it: http://www.lee.senate.gov/public/index.cfm/speeches?ID=d0f59a00-b23e-452c-a2f1-789b408ed0c2 … #EndTheSilence",2015-09-10 16:55:02,48,56,642018454434934785
"As long as Planned Parenthood’s friends remain mute, I will endeavor to improve upon the silence: http://www.lee.senate.gov/public/index.cfm/speeches?ID=d0f59a00-b23e-452c-a2f1-789b408ed0c2 … #DefundPP",2015-09-10 00:26:14,75,83,641769615278895104
"JFK once said, “To govern is to choose.” To govern by CR is not to choose, and therefore isn't governing at all:http://www.deseretnews.com/article/865636291/A-conscience-vote-on-Planned-Parenthood.html …",2015-09-09 13:32:12,39,55,641605023294693376
My Coalville townhall is streaming now. You can tune in here: http://www.ustream.tv/channel/senator-mike-lee-tv … #leetownhall #utpol,2015-09-03 01:06:51,12,12,639243123957309442
"Before my townhall tonight in Coalville, I will be holding a mobile office in Morgan, UT at Larry's… https://instagram.com/p/7JHvR8mpmf/ ",2015-09-02 21:00:04,6,4,639181017916534784
"After a great townhall last night in Bountiful, I'm looking forward to a great event tonight in Coalville. #utpolpic.twitter.com/1GjQZZ3Rmb",2015-09-02 19:16:47,13,8,639155023482630144
Referenced in my answer: https://youtu.be/KEYWVK8GJhE  #IranNuclearDeal #leetownhall,2015-09-02 01:29:21,17,22,638886398003650560
"""Should #Iran deal be considered a treaty?"" http://www.ustream.tv/channel/senator-mike-lee-tv … #utpol #leetownhall",2015-09-02 01:23:54,23,30,638885025782566912
"""How do we become a country that creates opportunity and prosperity?"" http://www.ustream.tv/channel/senator-mike-lee-tv … #utpol #leetownhall",2015-09-02 01:18:29,18,22,638883660373094400
"I am holding a townhall tonight in Bountiful. It's streaming now, and you can watch it here: http://www.ustream.tv/channel/senator-mike-lee-tv … #utpol #leetownhall",2015-09-02 01:08:11,16,21,638881068381274112
"""What does America get out of the Iran deal?"" One of the great questions asked by the students of… https://instagram.com/p/7G5P6Lmptc/ ",2015-09-02 00:14:58,14,23,638867679043039232
Join me for a townhall tonight in Bountiful. I love this time of year when I get to meet with Utahns… https://instagram.com/p/7F_EzLGpg0/ ,2015-09-01 15:46:39,2,5,638739753836408832
I'm holding a townhall on Tuesday night in Bountiful. Come join dialogue on how to drive reform in Washington. #utpolpic.twitter.com/W3HKzZ2KLn,2015-09-01 03:03:30,16,17,638547702943457280
You can come meet with my staff at three mobile office visits in Sevier County today: http://www.lee.senate.gov/public/index.cfm/mobile-office … #utpol,2015-08-26 16:16:12,11,9,636572864636956672
How should Congress hold #EPA accountable for releasing millions of gallons of toxic waste into Animas River?http://www.lee.senate.gov/public/index.cfm/press-releases?ID=9f032e0b-a712-4206-88ab-59a2efc92041 …,2015-08-20 18:53:09,58,75,634438035308945408
My mobile office will be in Moab this afternoon. This is a great chance to come meet with my staff: http://www.lee.senate.gov/public/index.cfm/mobile-office?ID=e1416a6a-ca29-48e9-a9e5-20a5b8b0d13f … #utpol,2015-08-17 18:04:01,15,14,633338507323424768
My mobile office is in Randolph today for the Rich County Fair. Visit http://lee.senate.gov  to see the… https://instagram.com/p/6YUgUDGpgf/ ,2015-08-14 22:08:50,12,7,632312954516582400
We need to protect Utah by modernizing the Antiquities Act: http://ux.thespectrum.com/story/opinion/2015/08/07/mike-lee-utah-antiquities-act/31256811/?hootPostID=f1048e18e0604423a72582872fb11214 … #utpol,2015-08-08 17:20:47,19,22,630066136969801729
"Considering the ubiquity of digital information today, it's far past time we updated federal law on digital privacy:https://youtu.be/fG26XNc3qZI ",2015-08-07 18:42:48,29,35,629724387973943296
"Yesterday, shanesmithvice came to my office to do an interview for an upcoming documentary on… https://instagram.com/p/6C1lJcmps0/ ",2015-08-06 13:54:34,14,13,629289462665768960
It worries me that #IRS does not disavow the power to target religious institutions based on their religious beliefs:http://www.washingtonpost.com/news/acts-of-faith/wp/2015/08/03/irs-commissioner-promises-not-to-revoke-tax-exempt-status-of-colleges-that-oppose-gay-marriage/?tid=sm_tw …,2015-08-05 19:03:33,46,69,629004832540618752
"Like all defenders of institutional violence, the real adversary of #PlannedParenthood is the Truth: http://ow.ly/QtR2o  #DefundPP",2015-08-04 20:10:58,101,164,628659410567569408
"We must fight for the Truth that not only are all men created equal, but that all human beings are, in fact, human beings. #DefundPP",2015-08-04 19:03:17,172,211,628642379730419713
"We no longer have to be complicit in the lie of #PlannedParenthood, or the violence that it protects: http://www.lee.senate.gov/public/index.cfm/press-releases?ID=932f11a1-e404-4d2d-aea0-50dd61a7caa3 … #DefundPP",2015-08-04 18:20:48,107,171,628631689250611200
"#PlannedParenthood has betrayed our trust, and the trust of the women who came to them for help: http://www.lee.senate.gov/public/index.cfm/press-releases?ID=932f11a1-e404-4d2d-aea0-50dd61a7caa3 … #DefundPP",2015-08-04 17:05:56,84,99,628612845744197632
"When forced to defend the indefensible: you distract, you talk about anything else besides facts at hand: http://www.lee.senate.gov/public/index.cfm/press-releases?ID=932f11a1-e404-4d2d-aea0-50dd61a7caa3 … #DefundPP",2015-08-04 16:06:34,106,159,628597906396839940
"The Federal Reserve is an opaque, unaccountable, and unpredictable institution that is ripe for reform:http://www.forbes.com/sites/realspin/2015/07/28/the-sound-dollar-act-modernizing-the-federal-reserve/ …",2015-08-03 17:07:06,62,61,628250753564581888
"We don't need a National Zoning Board: Lee, Rubio, Cotton, and More Move to Block AFFH in Senate http://natl.re/8VMe5E  via @NRO",2015-07-31 18:23:25,50,86,627182794083536896
Today I introduced the Local Zoning Decisions Protection Act to prevent HUD takeover of local zoning decisions:http://www.lee.senate.gov/public/index.cfm?p=press-releases&id=1E29389D-4E8E-4D0C-AC63-223E9D2211CC …,2015-07-30 21:21:34,103,143,626865240601423872
From a Judiciary Committee hearing earlier today: #IRS Commits to not target religious institutions:https://youtu.be/vvNrv_AfIq8 ,2015-07-29 21:26:24,33,41,626504070568771584
Do you agree with Secretary Kerry's explanation for the #Iran deal not being a treaty?https://youtu.be/KEYWVK8GJhE ,2015-07-29 19:16:24,21,37,626471353332408320
My mobile office is in Bountiful and Fillmore today. This is a great opportunity to meet with my staff: http://www.lee.senate.gov/public/index.cfm/mobile-office … #utpol,2015-07-29 16:54:00,6,5,626435518906134528
My mobile office is in South Ogden today from 2-4 p.m. MT. Come meet with my staff if you are in the area. #utpolpic.twitter.com/GBnUSrFCjb,2015-07-28 20:18:10,10,14,626124508303376384
We can be smart on crime without being soft on crime:http://www.buzzfeed.com/evanmcsan/mike-lee-mandatory-minimums#.csq9QvW1X …,2015-07-28 16:13:14,19,20,626062871487758336
"The more people look at the #Iran deal, the more they see that it is full of flaws:https://youtu.be/4DQarmq1Xls ",2015-07-27 21:35:12,77,119,625781507303583745
I'm Looking forward to simple-majority threshold vote for #Obamacare repeal:http://www.lee.senate.gov/public/index.cfm/press-releases?ID=f3c682eb-c9e3-4a3a-aee9-05d2246b66df …,2015-07-24 18:18:25,71,98,624644823438499840
With highway trust fund it's time to stop propping up the broken policies of the past: http://www.sltrib.com/opinion/2761377-155/mike-lee-fixing-our-broken-transportation … #utpol,2015-07-24 17:04:59,41,49,624626342055837696
Good Analysis --> Reforming the Highway Transportation Fund — Lee's TEA plan can help do that: http://desne.ws/QjVpxz  #utpol,2015-07-23 15:53:12,19,29,624245887561269249
"Instead of my weekly Jell-O with the senator event, we decided to celebrate Pioneer Day early in my… https://instagram.com/p/5c3H28mpuC/ ",2015-07-22 19:56:55,20,8,623944833460240384
Read Letter I sent w/ 10 other Republicans to DOJ & HHS to conduct investigation of #PlannedParenthood https://www.scribd.com/doc/272235009/Lee-Letter-to-DOJ-and-HHS-to-conduct-full-investigation-of-Planned-Parenthood … #ScribdDocs,2015-07-22 15:27:15,68,105,623876970678501376
"Waiting for the 1,030 page highway bill to print, and we are scheduled to vote on it at 4:00 p.m. We… https://instagram.com/p/5aRZaNGprt/ ",2015-07-21 19:48:50,21,40,623580412498067456
"Just finished printing the highway bill. Received at 3:06 pm. 1,030 pages long. 1st vote on it at 4:00 pm.pic.twitter.com/sVUMSLV0XS",2015-07-21 19:41:05,83,210,623578462889058304
USCIS has distorted the law: Senator Lee Exposes Obama Amnesty Loopholehttps://youtu.be/3UpPJ-lO7mw ,2015-07-21 18:43:25,25,56,623563951629037568
My mobile office is in Weber County today. Come meet with my staff if you are in the area: http://www.lee.senate.gov/public/index.cfm/mobile-office?ID=fbc6d1f6-8c4d-4970-9615-28f088a0d5c8 … #utpol,2015-07-21 16:17:42,3,7,623527280334217216
I am pleased the Senate unanimously adopted my Free Range Kids Amendment as part of #ECAA:http://reason.com/blog/2015/07/17/sen-mike-lee-added-a-free-range-kids-cla …,2015-07-17 19:11:51,41,52,622121554424500224
"Utah parents have been asking for a new direction on education, but #ECAA only gives them more of the same: http://www.lee.senate.gov/public/index.cfm/press-releases?ID=9c7f3ff8-1e62-4fcb-98ef-4c0b7f30406f … #utpol",2015-07-16 19:26:24,20,33,621762826965749760
"I voted against the #ECAA today, and I am disappointed the Senate missed an opportunity to put states back in control of education policy.",2015-07-16 19:23:46,62,73,621762165289144320
We need to keep the feds out of early ed and keep early ed out of Every Child Achieves Act: https://www.facebook.com/senatormikelee/posts/974976252534068 … #ECAA #ESEA #tcot,2015-07-16 14:52:46,37,58,621693963829911552
"At the state and local level, innovative solutions for early childhood education and care are already working:pic.twitter.com/Mqie0H90oN",2015-07-16 14:49:13,21,37,621693072276090882
According to 2012 study by HHS whatever benefits kids gain from #HeadStart disappear by 3rd grade. Cost - $8 billion.pic.twitter.com/NqHb80qBbo,2015-07-16 14:43:45,48,88,621691696103993344
The federal government already spends $20 billion on 45 early-childhood education & care programs. Do we need 46?pic.twitter.com/fVJ0cdlkAh,2015-07-16 14:38:21,37,71,621690337803812864
The federal government has dumped over $1 trillion into K-12 education since 1962. They have nothing to show for it.pic.twitter.com/JLdJZQTZOz,2015-07-16 14:34:09,50,85,621689279786434560
Congress shouldn't use #ESEA to crowd out innovative community-level problem-solving w/ federal childcare monopoly:http://www.nationalreview.com/article/421213/esea-reauthorization-education-mandate-democrats …,2015-07-15 20:50:05,20,20,621421499627491328
In a world where our federal government has grown more comfortable with picking winners and losers… https://instagram.com/p/5KYQsfGpuS/ ,2015-07-15 15:40:54,16,24,621343689118490624
Heading to the Senate floor now to promote my amendment to allow parents to opt out of federal testing. #ESEA,2015-07-14 19:05:37,59,41,621032822049009664
"Join me, @JohnCornyn, @CoryBooker, and @SenWhitehouse today at 3:30 ET for discussion on criminal justice reform: http://www.coalitionforpublicsafety.org/event/across-the-aisle-a-bipartisan-conversation-on-criminal-justice-reform/ … …",2015-07-14 18:26:56,11,12,621023088189308928
I am concerned that in the administration’s desperation to reach an agreement w/ #Iran compromises were made that could threaten U.S.,2015-07-14 15:15:56,49,58,620975021675122688
Federally funded pre-k doesn't work. We shouldn't expand it: https://www.facebook.com/senatormikelee/posts/973610976003929 … #ESEA,2015-07-13 15:17:58,33,43,620613142465388544
ESEA reathorization shouldn't divert k-12 funds to expand Washington's control of early childhood education & care: https://www.facebook.com/senatormikelee/posts/973610976003929 …,2015-07-13 15:10:39,8,19,620611303426625536
"Our education system needs to be reformed not in spite of excessive federal control, but because of it: https://youtu.be/OiMDhQaZ9OI  #ESEA",2015-07-09 17:56:32,37,45,619203497658064897
You can still join my tele-townhall with @RepMiaLove: https://video.teleforumonline.com/video/streaming.php?awesm=vekeo.buzz_s13&client=7907 … #utpol,2015-07-09 01:05:45,6,8,618949126210908161
You can ask online questions for my tele-townhall with @RepMiaLove here: https://video.teleforumonline.com/video/streaming.php?awesm=vekeo.buzz_s13&client=7907 … #utpol,2015-07-09 00:52:27,5,15,618945776480296960
"You can join me and @RepMiaLove in a tele-townhall, starting now: https://video.teleforumonline.com/video/streaming.php?awesm=vekeo.buzz_s13&client=7907 … #utpol",2015-07-09 00:46:31,12,15,618944285686280192
Don't create a master #encryption key for criminals https://youtu.be/Wt7RXhv6D-4  #goingdark,2015-07-08 19:51:48,20,31,618870115937951746
No One-size-fits-all Mandates for Smartphone #Encryption https://youtu.be/ese5QebLKd0  #goingdark,2015-07-08 19:50:29,10,14,618869785661702144
DOD must admit cost and impact of President Obama's strategy in Syriahttps://youtu.be/v6D20cqnGBM ,2015-07-08 19:46:02,14,24,618868666055151617
Fed study: More student aid = higher college tuition - This is why we need to pass HERO Act: http://washex.am/1M9Bymc#.VZwMZ3fD6rA.twitter …,2015-07-07 17:30:04,14,33,618472061233668096
"In my tele-townhall this week, @RepMiaLove will be joining me. Sign up to attend here: https://vekeo.com/event/lets-talk-senator-mike-lee-07082015/ … #utpolpic.twitter.com/OJmPX5bTSq",2015-07-06 20:41:55,11,13,618157953569398784
Happy Fourth of July from the Lee and the Chaffetz families! #provofreedomfestival https://instagram.com/p/4uLY1Cmpi5/ ,2015-07-04 16:49:41,48,17,617374732065882112
#SCOTUS #EPA decision shows it is time to reform federal regulatory state:http://onforb.es/1R5uDRC ,2015-07-03 14:27:57,31,47,616976679282544640
Congress Has a Plan to Defend Your First Amendment Rights After Court’s Marriage Ruling http://dailysign.al/1Hl6Zfx  @DailySignal #Defend1A,2015-07-02 14:30:36,42,59,616614955564011520
My mobile office will be visiting multiple locations in Iron County today. Find more information here: http://www.lee.senate.gov/public/index.cfm/mobile-office … #utpol,2015-07-02 14:05:40,5,13,616608680511959041
My mobile office is in Loa today. Come meet with my staff if you are in the area: http://www.lee.senate.gov/public/index.cfm/mobile-office?ID=6291bb17-c2c9-45ca-8646-38f6a16d5f67 … #utpol,2015-07-01 16:31:52,2,8,616283088558161920
Come visit my mobile office in Huntsville today #utpolhttp://www.lee.senate.gov/public/index.cfm/mobile-office?ID=7c270b67-c400-4d63-b42c-e2356bcff150 …,2015-07-01 15:34:34,3,8,616268666078928896
The First Amendment Defense Act prevents discriminatory treatment of any person based on marriage views: https://www.scribd.com/doc/269138514/First-Amendment-Defense-Act … #Defend1A,2015-06-27 17:41:32,67,117,614851066031681541
“If the coming conversation about religious freedom is left to the judicial…” — @SenMikeLee https://medium.com/@SenMikeLee/conserving-religious-liberty-for-all-623c207785bf?source=tw-13aca87ea184-1435425605504#aa20--share-0-207 …pic.twitter.com/epEk8K6DFs,2015-06-27 17:20:33,129,218,614845785583296513
"Moving forward, the debate will be less about marriage and more about freedom of conscience: https://medium.com/@SenMikeLee/conserving-religious-liberty-for-all-623c207785bf?source=tw-13aca87ea184-1435374929845#ab0a--share-0-110 …pic.twitter.com/D6UyII7thB",2015-06-27 03:17:17,79,87,614633572117426176
"I am heartened by #SCOTUS majority’s reassurance that religious liberty rights of all Americans, must be protected:http://www.lee.senate.gov/public/index.cfm/press-releases?ID=ab17168a-466f-470e-bc1c-96777bc11c7c …",2015-06-26 18:55:19,43,44,614507245724913666
There is still time to come meet with my mobile office staff today in Woods Cross and Blanding: http://www.lee.senate.gov/public/index.cfm/mobile-office … #utpol,2015-06-24 20:20:44,10,8,613803968658079746
"My mobile office is in Davis County, Moab, & Monticello today. All are welcome to come connect w/ my office: http://www.lee.senate.gov/public/index.cfm/mobile-office … #utpol",2015-06-23 15:36:06,8,12,613369949906706432
Excellent analysis of Transportation Empowerment Act - How to reform federal funding of highways | TheHillhttp://thehill.com/blogs/pundits-blog/transportation/245677-how-to-reform-federal-funding-of-highways …,2015-06-22 15:03:05,16,27,612999252994867200
First Amendment Defense Act protects critical space of freedom: http://desne.ws/ktUG4G  @deseretnews #utpol,2015-06-18 22:33:53,21,31,611663149134139392
"My mobile office will be in Syracuse, UT today. Come meet with my staff if you are in the area: http://www.lee.senate.gov/public/index.cfm/mobile-office?ID=7c4cb9ff-f1e8-4dc2-8329-2a73b46ccfce … #utpol",2015-06-18 13:47:36,5,9,611530705567412224
Learn more about First Amendment Defense Act that I introduced today. @Raul_Labrador introduced in the House: http://www.lee.senate.gov/public/index.cfm?p=press-releases&id=e42a7e9d-294b-423e-ac90-208212c766d0 … #utpol,2015-06-17 21:24:37,35,60,611283331557236738
"For those following #leetownhall, here's a link to speech on religious liberty I delivered last week at @Hillsdale:https://medium.com/@SenMikeLee/conserving-religious-liberty-for-all-623c207785bf …",2015-06-17 03:08:08,27,33,611007390104862720
I am still taking questions for my tele-townhall. You can participate here: https://video.teleforumonline.com/video/streaming.php?awesm=vekeo.buzz_s13&client=7907 … #utpol #leetownhall,2015-06-17 02:44:08,13,10,611001351502495745
I am holding a tele-townhall now.  You can ask questions here: https://video.teleforumonline.com/video/streaming.php?awesm=vekeo.buzz_s13&client=7907 … #leetownhall #utpol,2015-06-17 02:21:46,9,8,610995721962176512
I am starting my monthly tele-townhall now.  You can join the event here: https://video.teleforumonline.com/video/streaming.php?awesm=vekeo.buzz_s13&client=7907 … #utpol #leetownhall #vekeo,2015-06-17 02:08:13,11,16,610992311313530881
"Mark Openshaw was a devoted husband, father, public servant, & friend. He & his family members who died today will be dearly missed.",2015-06-12 21:55:46,9,10,609479228317388800
Here's full text of speech I'm delivering today - Conserving Religious Liberty For All: http://www.scribd.com/doc/268385911  @Hillsdale,2015-06-11 16:09:02,27,54,609029581274796032
I can't imagine a better setting for delivering a speech on protecting religious liberty. https://instagram.com/p/3y2je2Gpla/ ,2015-06-11 15:52:26,33,30,609025406033928192
Let America Fix the Highways Washington Broke http://dailysign.al/1QmdjYc  via @RepDeSantis @DailySignal #TCOT,2015-06-11 03:12:45,12,25,608834222988623872
Today I joined a bipartisan group of Senators to introduce Due Process Guarantee Act as amendment to #NDAA: http://www.lee.senate.gov/public/index.cfm/press-releases?ID=8e576cf1-9dd5-44d7-8594-b087f23b607e … #utpol,2015-06-09 21:44:12,27,39,608389155425538051
Come visit my mobile office and meet with my staff in Tremonton today 1:30 p.m. - 3:30 p.m. http://ow.ly/O5aVh  #utpol,2015-06-09 18:31:31,6,9,608340665802596352
Come visit my mobile office and meet with my staff in Brigham City today from 10:00 a.m. - 12:00 noon. http://www.lee.senate.gov/public/index.cfm/2015/6/june-9-2015-mobile-office-visit-to-brigham-city … #utpol,2015-06-09 15:41:54,9,11,608297978932174848
"My mobile office is in Lehi, Brigham City, and Tremonton this week. More information here: http://www.lee.senate.gov/public/index.cfm/mobile-office … #utpol",2015-06-08 18:45:08,4,8,607981702443618304
Another great group of Utah WWII veterans were in DC this week on an #honorflight. Seventy-one years… https://instagram.com/p/3mJYvDmpmH/ ,2015-06-06 17:26:52,37,42,607237231057752064
We need to draw lines around the power of government to protect people from the its overpowering influence: http://ow.ly/NSYxr ,2015-06-05 01:35:14,76,89,606635357979967488
Sen. Lee says he will introduce legislation to protect religious organizations: http://desne.ws/Ek9TRP  @deseretnews #utpol,2015-06-04 19:22:07,52,58,606541460721180672
My mobile office is in Morgan City today. Come meet w/ my staff if you are in the area: http://www.lee.senate.gov/public/index.cfm/mobile-office?ID=43a0188b-70bf-4258-9047-f97e16639805 … #utpolpic.twitter.com/pUe2omvmB8,2015-06-03 20:18:08,11,8,606193169533935617
Utah prairie dog ruling stokes national conversation about endangered species http://desne.ws/8ARhpu  @deseretnews #NativeSpeciesAct #utpol,2015-06-03 20:02:52,5,9,606189326070882304
The Senate’s passage of the #USAFreedomAct today is a huge win for national security and the Fourth Amendment.pic.twitter.com/rxMQKrkWTb,2015-06-02 20:33:13,38,52,605834578356363266
Good news!https://twitter.com/WIRED/status/605823871405531137 …,2015-06-02 19:59:02,31,39,605825972282081280
"""Our privacy is part of our security""https://youtu.be/_f__MmT7YfM ",2015-06-02 19:31:00,24,26,605818917580177409
Good info here on why we need to #EndExIm:http://mercatus.org/publication/export-import-bank-winners-and-losers-government-granted-privilege …,2015-06-02 17:52:34,30,54,605794145781743620
"""I believe we have the votes to pass the #USAFreedomAct"" https://youtu.be/CT_K3tKL4bI  @CNNsotu",2015-05-31 14:14:40,29,38,605014534269612032
"Vital national security programs and our fundamental civil liberties deserve a full, open, honest & unrushed debate:http://www.washingtonpost.com/opinions/sen-mike-lee-quickly-approve-the-usa-freedom-act/2015/05/29/02d9ba3e-0580-11e5-8bda-c7b4e9a8f7ac_story.html …",2015-05-31 13:16:13,31,43,604999826380570625
Dan Liljenquist: Credit Utah's Sen. Lee as the driving force behind #USAFreedomAct: http://desne.ws/MlTFyn  via @deseretnews,2015-05-30 01:14:01,14,12,604455689092771840
"I am encouraged to see growing, bipartisan opposition to this: Democrats buck Obama on water rule http://thehill.com/policy/energy-environment/243299-democrats-buck-obama-on-water-rule#.VWdqFz6HSSY.twitter … #WOTUS #EPA",2015-05-28 19:19:58,52,77,604004202977824769
I commend the Fifth Circuit for its well-reasoned decision to prevent President Obama from implementing lawless executive amnesty program.,2015-05-26 20:44:59,126,134,603300820910768129
I salute the memory of those who have died in service to our nation on this Memorial Day: https://www.facebook.com/senatormikelee/posts/949622745069419 …,2015-05-25 14:36:25,32,49,602845681414451200
With #ExIm the Losers Outnumber the Winners https://youtu.be/AJ4Wm8qibsM  #EndExIm,2015-05-23 19:25:44,23,32,602193716196048896
The Senate is voting on the renewal of the #PatriotAct later today. It's still unclear which way this vote will go:https://youtu.be/iuT1V3Q7Qik ,2015-05-22 14:11:55,21,41,601752351595220993
“General warrants are not acceptable in America.” — @SenMikeLee https://medium.com/@SenMikeLee/north-briton-45-the-forgotten-history-of-the-fourth-amendment-and-its-relevance-for-reforming-c5bfad08b265?source=tw-13aca87ea184-1432243701677#1fc0--share-46-93 …pic.twitter.com/1jZM5dSHog,2015-05-21 21:28:32,110,149,601499842213478401
"“In fact, the number 45, with its association with the North Britain number…” — @SenMikeLee https://medium.com/@SenMikeLee/north-briton-45-the-forgotten-history-of-the-fourth-amendment-and-its-relevance-for-reforming-c5bfad08b265?source=tw-13aca87ea184-1432231353787#d3b6--share-0-165 …pic.twitter.com/TTNtepfc1b",2015-05-21 18:38:17,15,14,601456998526259200
