Text,Date,Favorites,Retweets,Tweet ID
"The recent vote to fund government at current levels is touted as compromise, but it was really an act of collusion:http://www.deseretnews.com/article/865589182/Compromise-or-collusion-Lee-draws-a-line-in-the-sand.html …",2013-10-27 01:27:06,87,331,394274019932770304
#ObamacareInOneWord: Coleco - watch the clip:http://youtu.be/9ySi9DeKQB4 ,2013-10-24 20:57:48,52,173,393481472444989440
#ObamacareInOneWord ShamWow ... without the wow.,2013-10-24 20:44:57,165,381,393478239228010497
HHS Secretary Sebelius recently acknowledged that they are finally bringing in the A-team to fix #Obamacare website:http://ow.ly/q8BhW ,2013-10-24 15:40:09,15,58,393401536229158912
#ButWaitTheresMore Many believe technical problems plaguing #Obamacare website indicate the entire law is broken:http://ow.ly/q4wAD ,2013-10-23 00:00:44,60,266,392802734539538432
"#ButWaitTheresMore Glitches, Kinks, Snags, Bugs: Whatever the excuse, it’s almost impossible to enroll in #Obamacarehttp://ow.ly/q4v6t ",2013-10-22 21:04:05,16,112,392758277576359936
#ButWaitTheresMore You have no reasonable expectation of privacy on #Obamacare website:http://ow.ly/q4t88 ,2013-10-22 20:03:44,48,258,392743091620560896
#ButWaitTheresMore The Definitive Guide to How #Obamacare is Destroying American Lives:http://ow.ly/q4nw3 ,2013-10-22 19:30:17,40,142,392734674914930688
"#ButWaitTheresMore If website doesn't work, operators are standing by to redirect you back to the broken website:http://ow.ly/q4n3g ",2013-10-22 19:05:57,76,274,392728548911611904
"MT @sentedcruz: #ButWaitTheresMore #Obamacare site isn't the only thing not working. Americans are out of work, too:http://news.investors.com/politics-obamacare/101713-669013-obamacare-employer-mandate-a-list-of-cuts-to-work-hours-jobs.htm …",2013-10-22 18:55:37,27,110,392725951345614849
"#ButWaitTheresMore Aside from website problems & policy cancellation notices, employers are cutting hours and jobs: http://ow.ly/q4m44 ",2013-10-22 18:41:26,84,366,392722379216277504
"Duplicate enrollments, spouses reported as children,  & suspect eligibility determinations: http://ow.ly/q4llC  #ButWaitTheresMore @WSJ",2013-10-22 18:33:40,20,104,392720423647203328
"http://Healthcare.gov  is barely operational. ""Don't even bother trying #Obamacare website"" http://ow.ly/q4l2W  #ButWaitTheresMore",2013-10-22 18:16:14,34,111,392716036703019008
Thousands of consumers get insurance cancellation notices due to #Obamacare: http://ow.ly/q4kFi  #ButWaitTheresMore,2013-10-22 18:01:01,74,357,392712207219585024
@DanzGeorge Here is a link to the video: http://youtu.be/h6VDwLg8M2s  You can call my DC office & ask for Ben Burr to get transcript 202-224-5444,2013-10-21 20:03:03,8,15,392380530995765248
A great example of civil society coming together in a crisis: #Utah ranchers giving cows to devastated SD ranchers: http://ow.ly/q1DmZ ,2013-10-21 19:15:18,75,237,392368515799580672
Americans are spending more time reading health plan cancellation notices than Democrats spent reading #Obamcarepic.twitter.com/H1aHO5s7es,2013-10-21 18:38:14,663,2160,392359184492003328
Did you see this list of employers that are cutting jobs and hours because of #Obamacare? http://ow.ly/q1DVi  How are you being affected?,2013-10-21 16:29:23,100,426,392326762165968896
He makes some excellent points - Jim DeMint: We Won't Back Down on #ObamaCare http://on.wsj.com/16j6xXu ,2013-10-21 15:21:34,80,236,392309695949459456
This is one of the best articles I have read about why the effort to #DefundObamacare was necessary: http://ow.ly/pZ5AJ  #MakeDCListen,2013-10-20 02:35:49,183,535,391754597494439936
House Leaders Must Shut Back Door To Comprehensive #Immigration Bill http://shar.es/E87HJ  via @BreitbartNews @SenatorSessions,2013-10-18 19:35:58,91,347,391286550731841536
We've got to launch this website to find out what is in it: http://washingtonexaminer.com/article/2537381  #Obamacare,2013-10-18 15:21:13,131,474,391222442095435777
Help me RT this: It is always worth it to do the right thing: http://www.lee.senate.gov/public/index.cfm/blog?ID=811d3642-c5cd-46d0-a6c9-672b269a310d … #tcot,2013-10-17 21:39:10,146,973,390955169959014400
"We are not going away.  As long as #Obamacare continues to hurt Americans, I will continue to fight to protect them:http://ow.ly/pV6tw ",2013-10-17 18:25:02,262,618,390906314001768449
This is not over.  We have an obligation to fight for the American people. And I do not intend to let the people down.,2013-10-17 03:01:51,422,823,390673985085902849
There will be very real consequences for people in both parties as a result of #Obamacare. American people will have the last word.,2013-10-17 02:45:38,218,578,390669906565677056
Almost everyone but the president seems to recognize that #Obamacare is going to be terrible for the American people:http://ow.ly/pTkvX ,2013-10-17 02:30:05,83,308,390665994152456192
Americans are realizing that with #Obamacare the Administration has either been dishonest or incompetent – or both:http://youtu.be/UZxWI2Ln28E ,2013-10-17 02:02:07,75,268,390658955829317632
The best case against #Obamacare is proving to be Obamacare itself: http://youtu.be/UZxWI2Ln28E  #tcot #MakeDCListen,2013-10-17 01:45:23,76,197,390654741753364480
We must remind the American people of the harmful effects of #Obamacare at every opportunity if we are ever going to see it repealed.,2013-10-17 01:30:51,104,333,390651087994515457
"In Washington, victories are rarely immediate & very few are permanent. #Obamacare wasn’t enacted overnight & it won’t be repealed overnight",2013-10-17 01:02:33,65,163,390643965529456640
"When the avoidance of political risk becomes our dominant motivation, only the Washington establishment wins.  And the American people lose.",2013-10-17 00:15:17,181,640,390632068772003840
"Avoiding difficult battles is how we ended up in this mess: $17 trillion in debt, a broken entitlement system, a tax code no one understands",2013-10-17 00:00:51,163,628,390628438169886720
Fighting against an abusive government in defense of individual rights and freedoms is always the right thing:  http://ow.ly/pTjRD  #tcot,2013-10-16 23:50:38,163,454,390625865392222208
"The media keeps asking, was it worth it?  My answer is that it is always worth it to do the right thing:http://ow.ly/pTjOc ",2013-10-16 23:40:05,202,492,390623210485870592
It appears that this fight will end the same way #Obamacare began: in a last-minute back-room deal forced on Congress & the American people.,2013-10-16 23:30:04,165,653,390620689897914368
"Here we are again: A proposal that maintains status quo, very little time to read & evaluate the bill, & no time to explain it to Americans.",2013-10-16 23:20:11,108,468,390618203250257920
"Sen. Lee answer questions about #Obamacare, the shutdown, & what you can do to make a difference http://www.lee.senate.gov/public/index.cfm/blog?ID=88218192-d1bb-4db2-9b16-67624f937cb7 … via @SenMikeLee",2013-10-16 19:50:31,28,79,390565437693382656
Read and share the letter I signed with 49 other senators to announce our opposition the UN Arms Trade Treaty: http://ow.ly/pQAvi  #UNATT,2013-10-15 19:05:02,155,515,390191602263920641
Here is a link to the Values Voter Summit speech I delivered earlier today: http://ow.ly/pJs87  #VVS13,2013-10-11 16:47:00,75,200,388707314041364480
"Today, @RushLimbaugh read one of my e-newsletters on his show. Many are asking where they can find it. Here's a link:http://ow.ly/pHzdq ",2013-10-10 20:59:02,122,365,388408353749467136
"Almost 10k people signed my #DontFundIt letter during 1st day online. #Obamacare had 6,200 sign-ups on its first day:http://ow.ly/pHvVX ",2013-10-10 20:31:26,104,371,388401406342086656
My monthly tele-townhall is happening right now.  You can participate on Facebook: http://ow.ly/pFsth  #LeeTownhall #utpol,2013-10-10 01:21:52,25,81,388112110452224000
Click here to participate in my tele-townhall meeting that is happening now: http://ow.ly/pFs8y ,2013-10-10 01:14:26,10,32,388110239507415040
My monthly tele-townhall will be starting at 7:00 p.m. MT.  Click here to participate online: http://ow.ly/pFqEf  #LeeTownhall,2013-10-10 01:00:57,14,27,388106847057895425
My monthly tele-townhall will be starting at 7:00 p.m. MT.  Click here to participate on Facebook: http://ow.ly/pFqzN  #LeeTownhall,2013-10-10 00:50:00,12,38,388104091718934528
Website version of a trainwreck: #Obamacare site hits reset button on passwords as contractors scramble:http://ars.to/1csbkwU ,2013-10-09 18:53:59,27,136,388014496674889728
The best argument against #Obamacare: http://youtu.be/-mWY9f4Mcn8  #tcot,2013-10-08 21:42:51,60,255,387694605107331072
"It is time to stop using the word ""public"" when talking about land owned and managed by the federal government:http://ow.ly/pCAW6 ",2013-10-08 20:10:19,78,297,387671318470340608
We now see how determined the president is to expand power of federal government & use that power to harm the country to get what he wants.,2013-10-07 21:15:05,231,940,387325228659261440
Each day of #shutdown brings a new and more vivid example of why it's critical that we not allow Washington to reach further into our lives.,2013-10-07 21:02:25,272,829,387322042988904449
"The #shutdown is introducing us to the abusive, partisan, unaccountable bureaucracy that, will soon be running America’s health care system.",2013-10-07 20:50:36,380,1518,387319068472381440
"The message behind Obama Admin’s #shutdown bullying is the same message sent by IRS’s abuses of political opponents: do what I say, or else",2013-10-07 20:40:42,170,651,387316575269044224
"Government will use – and misuse – its power to advance its own interests, even if that means punishing Americans:http://ow.ly/pAjLJ ",2013-10-07 20:30:21,73,304,387313973491949568
Obama Admin’s behavior during week 1 of #shutdown has been the best argument against #Obamacare anyone has ever made:http://ow.ly/pAjzt ,2013-10-07 20:19:00,380,1217,387311115052806144
House continues to pass bipartisan bills to fund government. Senate Democrats & president still refuse to negotiate:http://ow.ly/pwSBY ,2013-10-05 19:07:20,83,481,386568305538244608
"Today Senate Democrats made it clear that unless we fund #Obamacare, they won't fund veterans' benefits:http://youtu.be/KLNNt0k0yyk ",2013-10-04 19:09:33,48,405,386206475904774144
My prayers go out to the Capitol Police and other 1st responders to shooting near Capitol.  My staff and I are safe.,2013-10-03 19:03:57,51,83,385842677994225664
We shouldn't have to fund everything in order to fund anything: http://youtu.be/WUYb9PfedcY  #Shutdown #MakeDCListen,2013-10-03 17:46:02,148,502,385823070348259328
"MT @SenLeePressSec: Tune in! @SenMikeLee is talking w/ @marklevinshow next about need to pass smaller, noncontroversial funding bills. #tcot",2013-10-01 23:22:13,20,49,385182898309312512
Lee Joins Cruz in Calling for Series of Smaller CRs http://natl.re/18KZVmE  via @NRO,2013-10-01 18:41:46,41,167,385112319614664704
Where we have made progress: How to avoid a prolonged #GovernmentShutdown: http://youtu.be/RJPYU_rvMas  #MakeDCListen #tcot,2013-10-01 14:19:18,18,90,385046267346178048
"""If #Obamacare is the law, why won't the president follow it?"": http://youtu.be/DrZttDEl1Uc  #MakeDCListen @FoxNewsSunday",2013-09-30 15:08:27,183,719,384696249883979776
"""The American people will always have the final word"" http://youtu.be/RivcJLni5zk  RT if you agree #NoOnCloture #MakeDCListen #DefundObamacare",2013-09-27 16:18:58,129,496,383626830973919232
On my way to the Senate Floor with Senator Cruz to make the final case to #DefundObamacare… http://instagram.com/p/exO4HTmpnv/ ,2013-09-27 15:43:37,81,157,383617932372504576
"RT @SenTedCruz: If a vote for cloture tomorrow is a vote to #DefundObamacare, why does Harry Reid support it? #MakeDCListen",2013-09-26 20:27:31,60,267,383326992311275520
I am encouraged by the increasing number of my colleagues who have been calling me to commit their… http://instagram.com/p/evFZgompqE/ ,2013-09-26 19:47:26,82,231,383316903969964032
"I joined Sen. Inhofe on @hannity last night to give #DefundObamacare update: ""The big obstacle is fear"": http://youtu.be/YpQJML0j8VE  @InhofePress",2013-09-26 17:45:14,38,96,383286152662220800
Senate Republicans can prevent Sen. Reid from funding #Obamacare in the House CR if they stay unified: http://ow.ly/pfhH7  #MakeDCListen,2013-09-26 17:38:03,73,315,383284342736576512
My mobile office will be in Emery county today.  Stop by to meet with my staff if you are in the area: http://ow.ly/oWIxO  #utpol,2013-09-26 14:46:29,2,5,383241169163284480
I would like to thank @SenTedCruz for his extraordinary effort to #MakeDCListen.  http://ow.ly/i/3fkzs ,2013-09-25 16:20:33,382,811,382902453945253888
How to support the House CR that defunds Obamacare: http://youtu.be/rqXmCR6xtP0  #MakeDCListen,2013-09-25 14:30:42,63,273,382874807890485250
My mobile office will be in San Juan county today.  Stop by to meet with my staff if you are in the area: http://ow.ly/oWIrv  #utpol,2013-09-25 14:16:00,10,29,382871111165554688
"MT @repmarkmeadows: Chilling: @Forbes tells us #Obamacare will increase avg.  premiums by 99% for men, 62% for women:http://onforb.es/1dIeV82 ",2013-09-25 13:41:18,47,286,382862376577802240
I have promises to keep and miles to go before I sleep. #MakeDCListen,2013-09-25 10:45:53,276,630,382818230961991683
"I would like to thank everyone who stayed up to #MakeDCListen.  It's 6:30 am, and we are still going strong.",2013-09-25 10:35:17,220,417,382815563866992640
MT @kenivoryut: @SenMikeLee Thx for listening 2 UT Leg. to stop impacts of the ACA on Utah's economy http://tinyurl.com/kdgstug  #MakeDCListen,2013-09-25 03:43:12,14,48,382711858501005312
I did what I could to add your voice to the effort to #MakeDCListen:http://ow.ly/pbwhM ,2013-09-25 03:29:53,133,258,382708510532067328
I don't understand why voting to give Harry Reid power to gut the House defund bill is a vote in favor of House bill. #MakeDCListen,2013-09-25 02:37:03,123,431,382695211434246144
"Just today my office has received 1,093 emails, and almost every single one is asking me to do all I can to #DefundObamacare #MakeDCListen",2013-09-25 02:29:38,222,742,382693345392619520
I took a minute to meet w/ @Cavuto to explain #MakeDCListen: http://youtu.be/3u_sIAo7Eio  I'll be heading back to the floor soon. #DefundObamacare,2013-09-24 21:49:42,96,261,382622897463758848
Let's #MakeDCListen. Spread the Word: http://www.c-span.org/Live-Video/C-SPAN2/ …,2013-09-24 18:47:45,80,404,382577109090435072
My mobile office will be in Grand county today.  Stop by to meet with my staff if you are in the area: http://ow.ly/oWIiN  #utpol,2013-09-24 17:03:19,3,9,382550828340748288
Last night on @gretawire I explained the different scenarios that could take place in Senate to #DefundObamacare:http://youtu.be/uRzArnIWGP8 ,2013-09-24 16:43:43,18,69,382545893939232769
RT @senleepresssec: TONIGHT: @SenMikeLee will go On The Record with @gretawire to discuss the need to #DefundObamacare. Tune in at 10pm ET.,2013-09-24 01:50:13,13,49,382321038329393152
It is now time for the Senate to act to #DefundObamacare: http://www.youtube.com/watch?v=sMAHVSJgES0&feature=share&list=UUplVxs_j_sLAt0fkplXcl4A … via,2013-09-24 01:28:15,63,241,382315509871423490
MT @senleepresssec: TONIGHT: @SenMikeLee will talk w/ @marklevinshow about #DefundObamacare effort at 8:30pm ET!,2013-09-24 00:15:11,6,37,382297124731633664
Great Op-ed by @SenTedCruz on the #DefundObamacare path to victoryhttp://www.realclearpolitics.com/articles/2013/09/23/the_path_to_victory.html#.UkCRTO45LRw.twitter …,2013-09-23 19:26:13,100,401,382224400658862080
The American People Are Rallying Around the effort to #DefundObamacare: http://youtu.be/VBcxHsFlIC0  RT if Republicans should hold our ground.,2013-09-22 20:52:34,135,765,381883745130655744
Follow @repstutzman and read his @USATODAY op-ed: #ObamaCare hurts all Americans.  http://usat.ly/1eWf5N0  #DefundObamacare,2013-09-20 20:55:08,53,211,381159616710983680
I was honored to participate in the ceremony at Hill AFB today to celebrate the delivery of their… http://instagram.com/p/efWgJ5mpgg/ ,2013-09-20 17:09:52,5,12,381102922857455616
RT @kurtwallace: @SenTedCruz and @SenMikeLee join house in Defund Obamacare Press Conferencehttp://www.youtube.com/watch?v=znXhV5u2AEM&feature=youtu.be …,2013-09-20 16:49:48,12,39,381097873242599424
Take time today to thank your member of the House of Representatives if they voted to keep the government open and #DefundObamacare.,2013-09-20 15:37:49,111,336,381079760249442304
The House of Representatives has listened to the American people and just voted to #DefundObamacare.,2013-09-20 15:33:53,96,232,381078771303866369
#DefundObamacareBecause it was unconstitutionally rewritten twice by the Supreme Court and multiple times by the president.,2013-09-19 22:05:46,69,288,380815003000926208
"RT @senrandpaul: Earlier this morning, I appeared on @AmericaNewsroom w/ @BillHemmer to discuss #DefundObamacarehttp://www.youtube.com/watch?v=-GV_VhMRKTg …",2013-09-19 20:15:44,3,16,380787311736528896
I am planning to oppose the nomination of Ron Binz to head the Federal Energy Regulatory Commission.,2013-09-19 20:01:55,18,43,380783836663398400
I joined @reptomgraves and several other colleagues in a press conference today to congratulate the… http://instagram.com/p/ecvHAWGpki/ ,2013-09-19 16:44:53,7,15,380734249525329920
.@SenTedCruz and I spent time w/ @Hannity tonight to discuss #DefundObamacare progress. Here's the full interview:http://ow.ly/p0pB2 ,2013-09-19 04:25:50,63,159,380548261570170881
Sen. Mike Lee and Sean Hannity talk #DefundObamacare: https://soundcloud.com/senator-ted-cruz/sen-mike-lee-and-sean-hannity?utm_source=soundcloud&utm_campaign=share&utm_medium=twitter …,2013-09-18 21:15:28,24,60,380439954976829440
RT @tpcarney: A Tea Party for the People. My column >> http://washingtonexaminer.com/can-republicans-become-the-party-of-the-people/article/2535969 …,2013-09-18 21:00:32,11,35,380436197967167488
"RT @matthewschmitz: ""Amazing"": @petespiliakos on @SenMikeLee's vision for tax reformhttp://www.firstthings.com/blogs/postmodernconservative/2013/09/17/amazing/ …",2013-09-18 20:31:36,1,12,380428918031134720
"RT @rameshponnuru: ""Leading on Tax Reform,"" @NRO editorial on @SenMikeLee's plan:http://www.nationalreview.com/article/358790/leading-tax-reform-editors …",2013-09-18 20:15:27,4,21,380424853188509696
RT @senleepresssec: 4pm ET: @SenMikeLee will talk with @seanhannity about the latest on the defund ObamaCare efforts. Listen in! #utpol,2013-09-18 19:58:39,5,18,380420624264732672
My mobile office will be in Uintah county today. Stop by to meet with my staff if you are in the area: http://ow.ly/oWI8I  #utpol,2013-09-18 15:22:48,0,2,380351206356680704
"I introduced my ""Family Fairness and Opportunity Tax Reform Act"" today at the American Enterprise… http://instagram.com/p/eYHL3EGpvi/ ",2013-09-17 21:37:12,12,27,380083036270125056
"Check out the speech I delivered at @AEI today to introduce my pro-family, pro-growth tax reform plan: http://ow.ly/oXpph ",2013-09-17 18:22:31,13,36,380034042491838464
"RT @senleepresssec: At 1pm ET, @SenMikeLee will deliver a speech on tax reform at @AEI. Will stream live here: http://www.aei.org/events/2013/09/17/tax-reform-the-family-and-the-pursuit-of-happiness-a-new-plan-by-senator-mike-lee/ … #utpol",2013-09-17 16:40:24,1,11,380008347564793856
My mobile office will be in Duchesne county today.  Stop by to meet with my staff if you are in the area: http://ow.ly/oWHKy  #utpol,2013-09-17 15:01:56,2,8,379983565150502912
My thoughts & prayers go out to #NavyYardShooting victims.  I'm grateful to the first responders who are demonstrating heroism & bravery.,2013-09-16 20:33:30,30,51,379704618759880704
Republicans in the House should pass the @RepTomGraves bill to keep government open and #DefundObamacare:http://www.lee.senate.gov/public/index.cfm/press-releases?ID=ddcaff15-d6ad-4877-a26f-a3ae99bb6f55 …,2013-09-13 16:07:36,65,308,378550540759605248
Involvement in Syrian civil war doesn't make Americans safer: http://youtu.be/oV5la3tg3D8  @hannityshow,2013-09-12 12:04:14,10,39,378126907327275009
"We will #NeverForget the victims of #september11, the heroic first responders, and those who keep us safe and bring our enemies to justice.",2013-09-11 14:29:26,14,69,377801058455547905
1.2% of the constituents that have emailed my office this week support military action in #Syria.  98.8% are opposed.http://ow.ly/oDu6Z ,2013-09-06 17:32:45,110,478,376035251493277696
"Unfortunately, I have to reschedule my Kanab town hall. I apologize to those who planned to attend tonight: http://ow.ly/oB5yJ  #utpol",2013-09-05 17:10:55,2,4,375667370104487936
The administration has indicated its goal is to use limited military action to significantly degrade… http://instagram.com/p/d4pfP_Gpsc/ ,2013-09-05 16:22:27,1,10,375655172321841152
RT @senleepresssec: 10:20am MDT: @SenMikeLee will talk with @DougWrightShow about his position on #Syria: http://www.ksl.com/?nid=21&sid=73621 … #utpol,2013-09-05 16:20:50,0,3,375654766858502144
"In order to achieve the president’s goal in #Syria, the U.S. would be required to become much more deeply involved in the Syrian civil war.",2013-09-05 16:00:13,13,53,375649577132896256
It's possible that ineffective US strikes in #Syria would embolden Assad to become more ruthless towards his people:http://ow.ly/oAQaT ,2013-09-05 15:45:40,5,35,375645916000419840
It's unclear how president’s plan to execute limited strikes in #Syria would prevent further use of chemical wapons:http://ow.ly/oAPQJ ,2013-09-05 15:30:34,12,57,375642117827469312
"The real threat to U.S. credibility is not what happens if we don’t intervene, but what happens if we do without a plan for what comes next.",2013-09-05 15:07:43,44,150,375636365347917824
"After participating in #Syria briefings yesterday, I do not believe that military action should be taken:http://ow.ly/oAOtB ",2013-09-05 15:04:43,93,259,375635610570330112
MT @sentedcruz: The White House is in talks to fix #Obamacare for unions. Fix it for EVERYONE! #DontFundIt http://washingtonexaminer.com/article/2534957 ,2013-09-04 14:38:40,40,196,375266668538519554
ICYMI: The Use of Military Force is the Most Serious Exercise of Our National Sovereignty: http://youtu.be/ymX6vPEOYpU  @gretawire #Syria,2013-09-03 21:04:11,14,72,375001298124283904
Happy 50th birthday @mkibbe! (He reads at the level of a 51 yr. old)  #Kibbes50,2013-08-31 17:26:35,7,11,373859374206570496
"If the president can't convince Congress that #Syria crisis threatens our national security, military intervention should be off the table.",2013-08-30 19:36:09,234,659,373529593220591617
"If the president believes the situation in #Syria presents a threat to U.S. national security, the right thing to do is call back Congress.",2013-08-30 19:27:57,54,217,373527527634894848
RT @senleepresssec: 5pm ET: @SenMikeLee will talk #Syria and ObamaCare with @seanhannity. Listen in: http://www.iheart.com/live/2389/?autoplay=true … #utpol,2013-08-29 20:55:21,2,10,373187138227277824
Navigator grants provide one more way for #Obamcare to favor special interests over American people: http://ow.ly/oopj5  #DefundObamacare,2013-08-29 19:53:39,5,84,373171609827545088
The president shouldn't authorize the use of military force in #Syria without support of Congress & American people:http://ow.ly/onYOK ,2013-08-29 16:30:42,49,160,373120535905173504
My Farmington town hall is happening now.  You can watch it from my Facebook page by clicking the… http://instagram.com/p/dlCyfxmppP/ ,2013-08-29 01:34:04,0,12,372894890130427904
My town hall in Farmington is streaming now. Watch it online here:http://ow.ly/omDY8 ,2013-08-29 01:26:08,1,8,372892892370833409
My town hall in Farmington is streaming now.  Watch it online here: http://ow.ly/omDY8 ,2013-08-29 01:02:31,3,10,372886951843876864
Subscribe to my Ustream channel if you want to watch the live streams of my town hall meetings: http://ow.ly/ojJq1  #utpol,2013-08-28 23:45:43,4,14,372867624696569856
I am expecting another great town hall tonight in Farmington.  Click here for more information: http://ow.ly/omfRW  #utpol,2013-08-28 20:30:30,4,13,372818494242693120
"Before taking action in #Syria, the president should present his plan's cost, objectives, and timeline to Congress and get authorization.",2013-08-28 18:41:34,47,175,372791079273504769
Subscribe to my Ustream channel if you want to watch the live streams of my town hall meetings: http://ow.ly/ojJig  #utpol,2013-08-28 00:15:30,6,25,372512729518858240
I am looking forward to my town hall meeting in Tooele tonight at 7:00 p.m. MST.  Find more info. here: http://ow.ly/ojIb9  #utpol,2013-08-27 20:15:09,3,8,372452245499314176
"In another stop in my series of visits with large employers in #Utah, I had a great discussion with… http://instagram.com/p/dhvmSGmpoJ/ ",2013-08-27 19:10:07,2,8,372435877966118912
I need help to defeat the false narrative that the effort to #DefundObamacare is an effort to shutdown government:http://ow.ly/ojGyB ,2013-08-27 18:01:57,33,228,372418721299836928
ATK is one of northern Utah's largest employers.  I had a great meeting with this large group of… http://instagram.com/p/dfXH0Mmpg3/ ,2013-08-26 21:06:54,1,6,372102879991324672
Share this clip of @SenTedCruz discussing #DefundObamacare if you are part of the grassroots tsunami: http://youtu.be/6jwV8EzZ1SM  #tcot,2013-08-26 02:51:53,54,253,371827309466365952
My Plain City town hall is scheduled to start @ 7:00 p.m. MST.  You can watch it online here: http://ow.ly/obiCq  #utpol,2013-08-23 00:47:17,2,11,370708790674333697
