Text,Date,Favorites,Retweets,Tweet ID
Today we give thanks that our country was based on the premise of religious liberty. Happy Thanksgiving.pic.twitter.com/x3aEaFDWvR,2017-11-23 12:56:05,1049,295,933680552426663937
"#OnThisDay in 1863, President Lincoln spoke timeless truths on a Civil War battlefield to unite a tired & divided nation around our founding beliefs. Why we need to re-read the Gettysburg Address today: https://www.facebook.com/SenatorSasse/posts/1433803820050892 …pic.twitter.com/JYXzlVbknM",2017-11-19 19:08:27,339,130,932324708850262016
“The Day of Two Noons” happened #OnThisDay in 1883 – and it’s an incredible lesson in how businesses can drive national innovation.pic.twitter.com/kfLptWUYzq,2017-11-18 19:14:11,98,39,931963765918183424
The ABA isn't a neutral vetter of judges but a liberal organization that has publicly & consistently advocated for left-of-center positions.pic.twitter.com/ZTMrJVEAjw,2017-11-16 23:57:06,1643,620,931310187989950464
One way our office can serve veterans: helping them receive the service medals they have earned. Colin’s story: https://www.facebook.com/SenatorSasse/posts/1425503484214259:0 …pic.twitter.com/izxHB1iib5,2017-11-12 23:55:36,127,21,929860257542758400
"We owe our veterans an enduring debt of gratitude, today and every day. #VeteransDaypic.twitter.com/UXfHtKc2ds",2017-11-11 14:46:20,395,110,929359644530806784
Their stories help us understand the cost of freedom. Meet the #veterans of the NE Wounded Warriors Writing Workshop: https://www.facebook.com/SenatorSasse/posts/1424799044284703 … #VeteransDaypic.twitter.com/kYDEDA8D2J,2017-11-10 15:55:37,115,27,929014694110810113
"Whether it’s helping our neighbors after a natural disaster or defending American interests, Nebraskans know that we can depend on the men & women of @NENationalGuard to be there for us in our times of need. Thank you for your service.pic.twitter.com/Yx7dGfWLED",2017-11-08 22:38:58,173,32,928391424730652673
"The ABA purports to be a neutral arbiter, but is frankly twisting its ratings process to drive a political agenda. Here's how:pic.twitter.com/kyQgSNHOOT",2017-11-02 23:24:04,233,89,926228444999847937
"#OnThisDay 53 years ago, Reagan gave his famous “A Time for Choosing” speech. It still has much to say to us today.pic.twitter.com/4DaIpLUfUO",2017-10-27 14:17:22,3529,1861,923916535466520578
"Now that we’ve got your attention with Dr Pepper, let’s not forget the real substance from today’s hearing.pic.twitter.com/rvSmohvnnh",2017-10-18 19:57:23,956,265,920740612185444353
"Nebraskans have no patience for improper treatment of our veterans, nor for attempts to cover it up.https://www.sasse.senate.gov/public/index.cfm?p=press-releases&id=1BDD282A-D8D1-4C58-B3FC-B72AF6D6A505 …",2017-10-18 00:01:02,239,56,920439543349874690
"We celebrate the fall of ISIS in Raqqa & the liberation of the oppressed, but this is no time to let off of the gas. https://www.sasse.senate.gov/public/index.cfm?p=press-releases&id=4F76BD39-EB59-45CA-A8A2-0F6FD7E6623E …pic.twitter.com/5Xl7lAA5bF",2017-10-17 17:32:49,173,44,920341843119927296
Russia is a clear adversary in cyberspace and we can’t afford these self-inflicted injuries. https://www.sasse.senate.gov/public/index.cfm/press-releases?ID=B97F3D92-A6C1-48D8-935E-1F822754F164 …pic.twitter.com/82VCTw9vmu,2017-10-05 17:51:34,2233,1081,915997909656768512
"So, post-hack, Equifax gets $$$ in a no-bid IRS contract & potentially profits selling ID protection to hack victims? We deserve answers.pic.twitter.com/IjIvyM4hIk",2017-10-04 23:11:02,2498,1096,915715917207629824
"The Gilmores didn’t plan to adopt. But when the opportunity found them, they jumped in: https://www.instagram.com/p/BZoUAcShPIi/  #AdoptionAngelspic.twitter.com/0gPm1dbaNT",2017-09-30 00:30:05,164,24,913923872608608257
We are an economic & military superpower & trade is an effective weapon. Full statement on new North Korea sanctions:https://www.sasse.senate.gov/public/index.cfm?p=press-releases&id=EF0E5559-7573-40F3-B008-8797044821E5 …pic.twitter.com/DhRooapyu9,2017-09-21 18:04:24,198,76,910927707810213888
ISIS has lost ground in #Syria but we need a strategy to make sure that we don’t let off the gas. https://www.sasse.senate.gov/public/index.cfm?p=press-releases&id=F5731EB4-B822-4981-B414-4C4E92EFADA6 …pic.twitter.com/gU8OEKvfbS,2017-09-19 18:18:04,74,21,910206370984718342
Encouraged this year’s #NDAA includes these modest steps toward a serious cyber doctrine & an agile talent pipeline.https://www.sasse.senate.gov/public/index.cfm/press-releases?ID=7F111A10-01D9-4467-BD2F-EC4A886A1C22 …,2017-09-18 23:36:24,73,23,909924097144041472
"In our constitutional system, the government is limited & the people's rights are limitless. Happy #ConstitutionDay!pic.twitter.com/ElVrmuv9EL",2017-09-18 00:17:05,532,173,909571945452023809
#NeverForgethttps://twitter.com/SenateGOP/status/907237346025857024 …,2017-09-11 16:30:50,216,43,907280283866685445
We should fund emergency hurricane relief. We shouldn't spend other $ pretending it's emergency hurricane relief. https://www.sasse.senate.gov/public/index.cfm?p=press-releases&id=CBF86B9F-507D-4147-9053-090EBE5AB2B5 …pic.twitter.com/a3btdSfKwq,2017-09-07 15:48:02,1278,499,905819961783984128
The Pelosi-Schumer-Trump deal is bad.,2017-09-06 18:37:34,2873,1039,905500235148996608
What makes Husker football great? The same things that make Nebraska great. #GameDay #GBR #Huskers https://www.facebook.com/SenatorSasse/videos/1367950926636182/ …pic.twitter.com/2CbLJy0x7e,2017-09-02 14:42:04,157,52,903991418753921029
We need to have a “one cheer for politics” view of the world. Here’s what I mean by that:pic.twitter.com/3m41YlisqR,2017-08-31 00:25:07,330,133,903050983697072130
"Why the #MarchOnWashington, held #OnThisDay in 1963, remains one of the greatest triumphs of the First Amendment: https://www.facebook.com/SenatorSasse/photos/a.711063948991553.1073741828.709959352435346/1364247797006495/ …pic.twitter.com/l5m6a2D64v",2017-08-28 15:06:59,611,212,902185752108433408
#OnThisDay in 1814 the British torched DC—but 2 patriots saved vital American artifacts from destruction. The story: https://www.facebook.com/SenatorSasse/posts/1361072647324010:0 …pic.twitter.com/JADt3fWdKP,2017-08-24 15:29:13,220,74,900741795591618560
Eclipses are time capsules. Yesterday's #SolarEclipse2017 highlighted the incredible economic disruption & innovation of the last century.pic.twitter.com/FRdKk6s2Bu,2017-08-22 23:37:06,146,54,900139799360675841
"As thousands gather @HomesteadNM & across Nebraska to watch tomorrow’s historic eclipse, a quick reminder to keep those bright eyes safe:pic.twitter.com/nRbvewBQNu",2017-08-20 23:09:05,311,92,899407974522798080
"#OnThisDay in 1889, Americans raised $100,000 for the pedestal of the Statue of Liberty. Here's what that great story says about America:pic.twitter.com/qsS29kpeEq",2017-08-11 14:07:28,1296,590,896010181146017792
"A word of humble advice to our President: if you’re thinking of making a recess appointment to push out the Atty General, forget about it.pic.twitter.com/7P896qJJzX",2017-07-27 19:02:17,5468,1861,890648553772773377
"We still have a long, long way to go – both in health policy and in honesty. Full statement: https://www.sasse.senate.gov/public/index.cfm?p=press-releases&id=D238F36D-FBCE-4D44-B7C5-3055A9E690DC …pic.twitter.com/Wyvt4GAySv",2017-07-26 20:23:31,369,155,890306611687895040
Statement on August State Work Period Delay: https://www.sasse.senate.gov/public/index.cfm?p=press-releases&id=8B552C70-DD20-4203-899A-5C302CF5D51F …pic.twitter.com/oLxXQKjzWs,2017-07-11 18:25:53,293,93,884841186502086656
Happy Independence Day to the most exceptional nation in the history of the world.pic.twitter.com/vr9Reb8P2C,2017-07-04 12:07:04,2125,877,882209139404951553
Real fatherhood isn't anything like a greeting card. We all screw up. Here's to all the dads out there who show up & try again. #FathersDaypic.twitter.com/KtbcLJFzOy,2017-06-18 01:16:06,4395,1427,876247114799431680
"#OnThisDay in 2014, twin tornadoes ripped thru Pilger NE. Today we mourn the victims & remember the volunteers who helped the town rebuild.pic.twitter.com/A2iWze2LOC",2017-06-16 16:07:03,225,54,875746551217311748
We celebrate the flag because it represents the American creed. Why we're thinking of @prattprattpratt on #FlagDay: https://www.facebook.com/SenatorSasse/posts/1292701644161111 …pic.twitter.com/CpCSMQA7CV,2017-06-14 12:07:02,211,51,874961375109365760
Statement on nomination of Christopher Wray to be #FBIDirector: https://www.sasse.senate.gov/public/index.cfm?p=press-releases&id=0EE703C7-CCC3-4896-8BF1-11C29085DB2B …pic.twitter.com/XyzrexacHa,2017-06-07 14:01:24,133,46,872453440735240192
"We honor the 160,000 troops who fought their way onto the beaches & we tell the story of one Nebraskan whose work made it possible. #DDaypic.twitter.com/pV0yAMFRdm",2017-06-06 13:42:54,954,339,872086396680515584
Thanks to Western Sugar for the tour of their Scottsbluff facility.pic.twitter.com/okSZqThiVt,2017-06-02 23:48:23,93,11,870789219823869952
"This weekend, we tell the story of a special Nebraskan monument to our fallen heroes. Happy #MemorialDay, and #GBR.pic.twitter.com/yGnReHmMlV",2017-05-28 23:13:06,937,471,868968400877375490
Graduates: congrats! You’re entering the workforce during one of history's greatest economic disruptions. Saddle up: https://www.facebook.com/SenatorSasse/photos/a.711063948991553.1073741828.709959352435346/1258894270875182/?type=3&theater …pic.twitter.com/FHWc0k7w1t,2017-05-08 00:57:51,202,39,861384620079816704
These heroes deserve our thanks. Honored to be a small part in sending the #HonorFlight off at 3AM.pic.twitter.com/XuroVkvW00,2017-05-02 00:29:01,421,114,859203036522004480
Nebraskans don't take the land for granted. It's why we started #ArborDay.pic.twitter.com/HJYF6G444N,2017-04-28 17:50:38,419,133,858015614048378881
"In American politics, is it a radical idea to say that the state exists to preserve freedom? So what is so radical about @FedSoc?pic.twitter.com/1WtrJiVhXc",2017-04-26 18:09:10,656,299,857295504216117257
"If we view Russian interference through partisan lenses, they have already begun to win. Here's why:pic.twitter.com/c95cJLwiwR",2017-04-23 23:15:04,1288,629,856285323495489536
Free trade benefits the whole world – but it *really* benefits Nebraska.pic.twitter.com/H28r1XgBD3,2017-04-20 00:08:05,438,155,854849114546122753
Decentralization of government is a good thing. Here’s why a president – from either party – having lots of power is a bad thing:pic.twitter.com/62Ay3xa0KZ,2017-04-18 00:20:05,807,360,854127355001880576
Consumers win when there is more trade. Producers win when there is more trade. We should not scapegoat trade.pic.twitter.com/Zb4qYdQW5w,2017-04-15 23:39:05,667,259,853392261891072000
Thanks to the @LiedLodge for hosting today's Stronger Economies Together (SET) 2017 Southeast Nebraska Manufacturers Summit.pic.twitter.com/oqsuwSRwsU,2017-04-11 21:04:49,51,11,851903890723418113
"Good news for the rule of law: Today, Judge Gorsuch takes his black robe to #SCOTUS. #Confirmed http://bit.ly/2pa8Pbn pic.twitter.com/dxvubfNyHG",2017-04-07 16:14:13,475,120,850381207015751680
"Highlight of the week: meeting with Macy, Nebraska’s finest legislative advocate. Thanks to @NDSS for a great #bww2017.pic.twitter.com/G3J70Iz8pl",2017-04-06 23:26:03,413,54,850127494405472256
"49 years ago today, #MLK gave his final speech. Read the full text of the speech, here - it will give you chills: http://abcnews.go.com/Politics/martin-luther-kings-final-speech-ive-mountaintop-full/story?id=18872817 …pic.twitter.com/m6rzgJLP8r",2017-04-04 00:20:01,621,361,849053908550918144
Baseball is back & Judge Gorsuch is one step closer to to taking his seat on the Supreme Court. It’s a good day for America.pic.twitter.com/vTEJV38kcl,2017-04-03 20:20:44,691,257,848993693084393472
Let's fund life-affirming women’s health providers without sending taxpayer dollars to abortion businesses. https://www.sasse.senate.gov/public/index.cfm?p=press-releases&id=EC10CF0F-6B63-4B1E-9213-D40FAC8639D0 …pic.twitter.com/SmcLhJLEYQ,2017-03-30 20:55:24,399,151,847552863706509312
The simplest way for Russia to try to weaken us is by trying to exploit the places where we are already weak. https://www.wsj.com/articles/america-is-ill-prepared-to-counter-russias-information-warfare-1490655558 …pic.twitter.com/rix3FVLbhB,2017-03-28 23:49:05,469,255,846871798041927680
"Russia's influence campaign is a really big deal. Watch below, then read this: https://www.wsj.com/articles/america-is-ill-prepared-to-counter-russias-information-warfare-1490655558 …pic.twitter.com/WPLq261Qvb",2017-03-28 21:25:37,1419,924,846835695067025408
"Overturning this rule is a win for kids, because Washington’s good intentions can’t excuse garbage rules. http://bit.ly/2oaHKFk pic.twitter.com/DNYnE79ktV",2017-03-27 22:34:34,104,46,846490656721776641
"Today we honor one of the most important men you’ve probably never heard of: Norman Borlaug, the ag pioneer who was born #OnThisDay in 1914.pic.twitter.com/ac69QO90Ga",2017-03-25 23:11:01,1481,773,845775054658977792
Neil Gorsuch is a threat to you “if you breathe air or drink water”? There is a real danger in not condemning that kind of reckless speech.pic.twitter.com/2a7oKgJ4u3,2017-03-22 21:06:51,1847,862,844656644315385856
Won bigly at #GorsuchHearing.pic.twitter.com/rWF6JgFED4,2017-03-22 19:22:50,2651,1097,844630468477771776
Asked Judge Gorsuch for quick overview of why we have the Bill of Rights. It’s worth watching his answer. #GorsuchHearingpic.twitter.com/o94Izap5WY,2017-03-22 14:34:22,1104,763,844557872918941696
Seeking assurances from judges on future rulings is like asking a referee for pledges to a certain outcome before the tip-off. #SCOTUSpic.twitter.com/PWVn6kJe4r,2017-03-22 01:13:08,1508,742,844356233926758400
"In Neil Gorsuch, we have a qualified judge who knows what a judge's job is — he should be confirmed 100-0. #ConfirmGorsuchpic.twitter.com/Hxt5TyPTry",2017-03-20 23:25:06,458,175,843966659081703425
Focused my remarks around a simple image: a judge’s black robe. Here's why Judge Gorsuch will faithfully embody the spirit of that robe:pic.twitter.com/HqzCumUuSU,2017-03-20 21:54:26,698,284,843943843615641602
Judge Gorsuch knows what a judge's job is. Folks across the political spectrum should be excited about him when they read his opinions.pic.twitter.com/lHrsJKKFfx,2017-03-20 14:15:30,226,117,843828347809513472
Concerned about overreaching executives? About the lack of accountability in the administrative bureaucracies of the gov't? #ConfirmGorsuch.pic.twitter.com/josQniReyk,2017-03-15 00:35:02,280,139,841809933007908866
Nebraskans don't take the land for granted. It's why we started Arbor Day. #NE150pic.twitter.com/RN1RB2GhOH,2017-03-12 23:01:05,180,42,841061512978423809
A respectful ask that POTUS keep his promise to drain the swamp & veto any bills that contain earmarks.​ Our letter: http://www.sasse.senate.gov/public/index.cfm/press-releases?ID=8C87EB69-856B-460C-8C27-E2D0680820BF …pic.twitter.com/4F5Uh73kP8,2017-03-11 00:57:03,369,146,840365920836972545
Julian Assange should spend the rest of his life wearing an orange jumpsuit. This is why: http://www.sasse.senate.gov/public/index.cfm/press-releases?ID=B079EDA8-3475-4E64-882C-4946E14DAEAD …pic.twitter.com/Zj81vZy0vt,2017-03-09 15:53:37,1625,897,839866774657073153
This regulation makes the assumption that DC bureaucrats are competent to micromanage teacher training programs in America. That's absurd.pic.twitter.com/OcR3R4sZBq,2017-03-07 23:36:37,625,243,839258514656735232
Our state was built by pioneers. These homesteaders turned the “Great American Desert” into the world's breadbasket. #NE150pic.twitter.com/Xp5LWh4R9s,2017-03-06 00:46:03,190,39,838551215591940096
Full statement on Sessions recusal & Senate Intelligence Committee’s Russia investigation: http://bit.ly/2ljv8y3 pic.twitter.com/G9mLRuusGp,2017-03-02 21:53:26,1000,423,837420609940426752
"Happy Birthday, Nebraska! May the legacy of the homesteaders, caretakers of the land, statesmen, and volunteers guide you forever. #ne150pic.twitter.com/FYUbcCfyIX",2017-03-01 15:45:16,426,157,836965570864103424
Great news: The EPA’s unconstitutional water rule will die. Nebraska’s farmers & ranchers won’t shed a single tear. http://bit.ly/2lTh2R5 pic.twitter.com/x3qDAJ9NAS,2017-02-28 19:58:07,331,160,836666813769465856
It was a great privilege to deliver this address. May we study together these virtues of self-government again.https://www.youtube.com/watch?v=VcGIx1hAq7w …,2017-02-28 00:38:41,118,25,836375031424946176
Around 17% of Nebraskan corn is exported to Mexico. Exports are very important for Nebraska agriculture. http://bit.ly/2lCYbeZ pic.twitter.com/TgCvJHNoic,2017-02-21 17:40:26,190,91,834095447824297984
Nebraska farmers cannot become collateral damage in a trade war.http://www.sasse.senate.gov/public/index.cfm/press-releases?ID=712390EF-D64D-4604-B29D-D63F2B570F0D …,2017-02-18 18:34:42,220,97,833021944303845376
Putin and his thugs are fundamentally at odds with America’s interests.pic.twitter.com/SqozmACrbg,2017-02-18 01:09:03,1145,464,832758797009448962
It's our constitutional duty to conduct honest congressional oversight that restores public trust in self-governmenthttp://www.omaha.com/news/nation/nebraska-iowa-lawmakers-urge-trump-to-get-tough-with-russia/article_7858a685-20c7-5ea0-adb7-9402fe287aed.html …,2017-02-17 15:29:00,1489,542,832612821804388352
This should not be viewed through partisan labels. Congress should investigate Russia’s influence campaign in the UShttp://www.omaha.com/news/nation/nebraska-iowa-lawmakers-urge-trump-to-get-tough-with-russia/article_7858a685-20c7-5ea0-adb7-9402fe287aed.html …,2017-02-17 15:27:43,3306,1606,832612498662637568
This is bigger than D vs. R. The Founders' intended the check on consolidation of power to come from the other branches of government.pic.twitter.com/QRT1USODvd,2017-02-13 00:22:05,3126,1429,830935039051390976
Here's why everyone across the political spectrum should applaud the pick of Judge Gorsuch for #SCOTUS.pic.twitter.com/3E1Qwiqftw,2017-02-11 00:25:04,264,92,830211009994383362
The #CFPB's mission to prohibit “abusive practices” sounds great. But all that power has little accountability.http://usat.ly/2lnWuPc ,2017-02-08 15:44:17,53,30,829355175844397057
Met w/Gorsuch today. To the Chicken Littles on the other side of the aisle: he's a supremely qualified nominee.​ http://bit.ly/2kLbhGS pic.twitter.com/37iKyC57L9,2017-02-08 03:07:10,400,123,829164640420655105
Judge Gorsuch is a rockstar. People across the political spectrum should be excited about him. He's not trying to be a superlegislator.pic.twitter.com/cAU0oghAGe,2017-02-05 15:42:16,967,395,828267505080795137
Great to intro @USDA nominee Perdue to some of the Nebraskans whose hard work makes us the world’s breadbasket. @NEFarmBureau @NECattlemenpic.twitter.com/5M2BnbxbDs,2017-02-04 15:09:06,50,16,827896772542410752
Judge Gorsuch is exactly the kind of person who should be on the Supreme Court. Here's why. #SCOTUSpic.twitter.com/xlKjrjwNzT,2017-02-04 00:22:01,429,164,827673529214607361
"Reintroduced Sarah's Law in the new Congress. If an illegal alien kills an American & they are detained, they should be held until trial.pic.twitter.com/PHR6hnv8TE",2017-02-03 01:36:01,331,123,827329762645282816
Grateful POTUS signed this commonsense law & that taxpayers now have new tools to expose Washington’s waste & abuse. http://bit.ly/2kxHIbj pic.twitter.com/Nepcm0oJH9,2017-02-02 22:24:11,129,66,827281486479028224
Debate with MSNBC: Anyone who is concerned about the consolidation of power in the executive branch should absolutely support Judge Gorsuch.pic.twitter.com/Nwr6QjJ3aN,2017-02-02 04:06:32,680,257,827005255627837443
Sen. Schumer is about to tell Americans that Judge Gorsuch kicks puppies & heckles piano recitals. That’s hogwash.http://www.sasse.senate.gov/public/index.cfm/press-releases?ID=A4C75192-11A9-4449-8588-7A0C014E8764 …,2017-02-01 02:08:02,712,390,826613047397605376
"Gorsuch is a highly-regarded jurist with a record of distinguished service, rooted in respect for the law. #SCOTUS http://www.sasse.senate.gov/public/index.cfm/press-releases?ID=A4C75192-11A9-4449-8588-7A0C014E8764 …pic.twitter.com/YGRoMQyYzH",2017-02-01 01:50:16,908,402,826608576378630146
Statement on Border Security and Muslim Nations: http://www.sasse.senate.gov/public/index.cfm/press-releases?ID=813E24D8-1B88-4070-BF16-795305303A2B …pic.twitter.com/lh7mrEyrZV,2017-01-28 22:06:28,7447,4194,825465090866573313
"The crowd at today's #MarchforLife was so impressive, we ran up on the roof & into the crowds to document it. https://www.facebook.com/SenatorSasse/videos/1163370957094181/ …pic.twitter.com/aLLKzxDJ47",2017-01-28 01:11:05,2235,1061,825149161582452736
"Tomorrow, hundreds of thousands will come to DC to #MarchforLife. But the #prolife movement is so much bigger than that. #NEWalkforLifepic.twitter.com/oqmTbcUqhg",2017-01-27 02:11:06,600,227,824801877015433216
"The CFPB is accountable to no one: which means it isn't accountable to you. It's time to fire ""King Richard."" http://bit.ly/2kpwtT2 pic.twitter.com/F3kv6y6ujL",2017-01-25 14:45:03,128,74,824266839551119360
"Reintroduced #BornAlive legislation today, a rare opportunity to find common ground & protect newborns. #prolifepic.twitter.com/VOlCK5FxMm",2017-01-24 22:23:30,554,275,824019825446055936
Americans are humanitarians & the Mexico City Policy reflects our heartfelt compassion for both moms & babies. http://bit.ly/2kkn0Z4 pic.twitter.com/EItW23JHvO,2017-01-23 18:01:27,148,50,823591490458972160
"For the first time in 40 years, Nebraskans will have a voice on the Judiciary Committee. ​@senjudiciarypic.twitter.com/qWjUm72SEp",2017-01-22 23:17:04,236,51,823308527888281600
My hope for the new administration: the president succeeds in putting serious constitutionalists on #SCOTUS.http://www.wsj.com/articles/the-promise-of-president-trump-ben-sasse-1484868244 …,2017-01-22 02:47:31,231,75,822999105211432960
Why we celebrate Inauguration Day.pic.twitter.com/8HAipNY7b1,2017-01-20 02:04:41,2288,1513,822263547593916416
Congress has asserted its right to oversight with a big bipartisan vote: 99-0. More about our bill:https://www.youtube.com/watch?v=am-uZ2-HvUc …,2017-01-17 23:03:09,67,29,821493086509551616
Today we remember a man of unshakeable conviction who awakened the conscience of our nation. #MLKDay https://www.facebook.com/SenatorSasse/videos/1152217621542848/ …pic.twitter.com/OMZyE63kQT,2017-01-16 13:59:04,569,192,820993779247087618
Looking forward to another great year of #NEBreakfast. RSVP for 2017 breakfasts here: http://1.usa.gov/1Qdv2LC pic.twitter.com/LHheDPPiIf,2017-01-15 01:17:03,35,6,820439620714315776
Enjoyed meeting with @RealBenCarson this week & hearing his vision to reform @HUDgov. More here: https://www.facebook.com/SenatorSasse/photos/p.1148453348585942/1148453348585942/?type=3&theater …pic.twitter.com/ktvrJkXFUu,2017-01-12 01:10:06,148,45,819350708042416128
Pleased to have secured a commitment from AG nominee @jeffsessions to address Sarah's case so we can ensure killers like Mejia face justice.pic.twitter.com/ECDrlIb2Tg,2017-01-11 01:20:06,146,41,818990836377452544
It was a privilege meeting with Gen. James Mattis today and it will be a privilege supporting his nomination. http://bit.ly/2jmVR7f pic.twitter.com/2JfKbYcmWM,2017-01-10 00:06:55,1021,309,818610033663545345
It's time to fire King Richard. Here's what's wrong with the CFPB: http://bit.ly/2iW0x4Z pic.twitter.com/n6IKYiyXbj,2017-01-09 20:44:38,112,74,818559125672099844
"""A republic, if you can keep it."" A recent survey of the voting public revealed only 57% could name even one of our 1st Amendment freedomspic.twitter.com/pn54PYf8Yh",2017-01-09 00:37:06,566,424,818255242454147074
"If politicians turn the IC’s report into a Red vs. Blue shouting match, Putin gets a free pass. http://www.sasse.senate.gov/public/index.cfm/press-releases?ID=7950689E-AD16-4276-A8E5-02C0B1F84914 …pic.twitter.com/48aMVDy2j1",2017-01-06 23:16:55,383,218,817510286974418944
The #NEBreakfast is back. Click here to see our 2017 dates: http://1.usa.gov/1Qdv2LC pic.twitter.com/n5uGA1WZ5Z,2017-01-06 17:40:49,7,2,817425704916832256
Grateful the new Congress is moving this common-sense solution one step closer to the President's desk.​ @USGAO http://bit.ly/2hWmrmS pic.twitter.com/qdWuHElCVF,2017-01-06 01:11:03,44,17,817176620444172288
Our intel community is unparalleled in the world. We should affirm them & explain why their mission is critical​.http://journalstar.com/news/state-and-regional/federal-politics/sasse-defends-u-s-intelligence-community/article_ffb43b23-3226-51f3-a97e-152743181a13.html …,2017-01-06 00:46:14,290,97,817170375914221569
Why #WOTUS makes me want to put a speedboat in a ditch (and film it):pic.twitter.com/Ej8NC1TDvb,2017-01-03 16:44:53,133,75,816324465390821376
Who does overregulation hurt? Those most in need of economic opportunity. The poor - they're the ones who suffer.pic.twitter.com/ryeBwhy5eQ,2016-12-30 02:16:54,199,103,814656479299043328
Merry Christmas! Today we remember a Christmas miracle that happened #OnThisDay in North Platte in 1941. https://www.facebook.com/SenatorSasse/videos/1134057006692243/ …pic.twitter.com/O5bzBXjykG,2016-12-25 13:55:06,158,72,813020248035053568
Celebrating this Omaha family’s first Christmas together. Grab some tissues & read the full story: https://www.facebook.com/SenatorSasse/posts/1133265490104728 … #adoptionpic.twitter.com/sBjUGCeNNv,2016-12-24 01:53:39,72,23,812476298069061633
