Text,Date,Favorites,Retweets,Tweet ID
"Bon voyage to Nebraska’s @BorenAwards Scholars as they depart to Mozambique, Senegal, and Brazil for their studies!pic.twitter.com/mH7XtSayRW",2015-06-11 14:31:43,3,3,609005092650557440
"A pleasure to meet LTG Timothy Kadavy, highest ranked native Nebraskan in the military in US history. @RepAdrianSmithpic.twitter.com/TvAOQUeGOZ",2015-06-10 23:50:13,12,7,608783254687223808
Senator Sasse asked the nominee to head the #TSA whether it’s safe to fly. His answer will surprise you:http://bit.ly/1B2UKl6 ,2015-06-10 19:23:46,2,3,608716199611002881
Bombs on planes? Yawn. http://bit.ly/1B4AjUx  Carbon emissions from planes? Crisis! http://usat.ly/1I1T4W2  (This is insanity),2015-06-10 18:01:18,12,10,608695447021043712
"As a former college president, I don't know any institution where a 4% success rate could be anything but an ""F"" #TSAhttp://bit.ly/1cLXh7o ",2015-06-10 17:42:03,14,11,608690602264391680
Is Administration really more concerned w/ the exhaust leaving planes than the passengers who are getting on? #TSA http://usat.ly/1I1T4W2 ,2015-06-10 17:17:45,8,8,608684487204048897
Greenspan: not as simple as R vs. D: entitlement growth biggest under Ford & Nixon. Smallest under Clinton.,2015-06-10 15:53:42,4,3,608663337350668288
"Per Greenspan's book: GOP admins' average growth in entitlement spending ~10.5%. Under Dems, a “mere” 7% annual increase.",2015-06-10 15:53:21,2,1,608663249463164928
"Greenspan describes race to the bottom on entitlements: Nixon said, “If we don’t preempt the Ds & get the political credit, they will.”",2015-06-10 15:53:02,2,1,608663168416649216
"Greenspan: both parties have failed to constrain entitlement growth, GOP has worse track record in last 5 decades.",2015-06-10 15:52:44,2,2,608663095024717826
Met w/Alan Greenspan yesterday on the (sadly) bipartisan history of entitlement spending expansion. “It’s the Monster in the room”,2015-06-10 15:52:15,3,2,608662971045285888
3 exchanges in 30 seconds from today’s Homeland Security hearing that show just how broken #TSA is:http://bit.ly/1B4AjUx ,2015-06-09 23:40:23,3,3,608418392954032129
Highlights from today’s Homeland Security hearing: http://bit.ly/1B4AjUx  Does this make you feel safe? Washington must fix this. #TSA,2015-06-09 22:14:21,5,2,608396742317510656
"Public comfort from belief #TSA failure due to sophisticated ""Red Teams” - but IG doesn’t have Red Teams:http://bit.ly/1duvFo6 ",2015-06-09 20:45:08,2,1,608374289063100416
"96% #TSA fail rate wasn’t against “super-terrorist”-like red teams, just regular IG auditors  http://bit.ly/1duvFo6 ",2015-06-09 19:58:37,4,1,608362582018277376
"Washington needs to step up its game, and there needs to be public pressure to make that happen. #TSAhttp://bit.ly/1eYVwp8 ",2015-06-09 14:29:46,20,30,608279827976699904
The terrorists only need to succeed one time. What happens when #TSA has a 96% failure rate? http://bit.ly/1eYVwp8 ,2015-06-09 13:25:47,4,3,608263724961562624
Our families are only as safe as our weakest #TSA checkpoint. Government needs to do its job. http://bit.ly/1eYVwp8 ,2015-06-08 23:02:10,3,4,608046386907627520
President Obama owes the public a transparent account of #TSA's failures so that together we can fix them. http://bit.ly/1eYVwp8 ,2015-06-08 21:55:12,6,10,608029535460851713
"Before they board another flight, the American people deserve the truth about the #TSA's failures.http://usat.ly/1RYzqRN ",2015-06-08 18:09:29,2,10,607972733633359872
The public facts on #TSA's failures are disturbing. The classified details? Even worse. We need transparency now. http://usat.ly/1RYzqRN ,2015-06-08 16:19:34,2,1,607945070684291073
"Worth watching: NET on Andrew Jackson Higgins, the Nebraska boat builder “who won the war for us.” http://bit.ly/1KTPe7A  #DDay",2015-06-06 20:46:41,3,8,607287515805044736
Nebraska proud of @JeffFortenberry’s leadership on @HigginsDDay. A tremendous way to honor the heroes of #DDay: http://on.fb.me/1G24Dyl ,2015-06-06 16:24:50,2,4,607221620583854080
"After failing to catch 67 of 70 threats in an internal audit, the #TSA has a lot of explaining to do.http://bit.ly/1QtNVdR ",2015-06-04 17:25:44,3,1,606512169413431297
Talking with some Nebraskans from @BeltwayBeef in town for the Young Cattlemen’s Conference. Thanks for stopping by!pic.twitter.com/7Lam1MGNba,2015-06-03 22:09:27,4,2,606221183042887680
Early filings show double-digit rate increases for some in NE. It’s a wake-up call. We need real health care reform.http://bit.ly/1SWAmaY ,2015-06-03 19:10:26,2,1,606176130991812608
It was a sea of green at this morning’s #Nebraska Breakfast. Great to see so many @4H students! @Nebraska4Hpic.twitter.com/pxpH3HkI1Z,2015-06-03 17:53:18,16,8,606156719597752322
The American people deserve a full explanation for how TSA could miss weapons & explosives 95% of the time.http://bit.ly/1cw3m7O ,2015-06-02 20:01:55,12,7,605826699624783872
It’s time for DC to face the facts about #Obamacare - and for both parties to get serious about actual health care reform.,2015-06-02 17:48:15,6,3,605793059222134784
"#Obamacare promised to lower costs, but for these plans, the opposite is true. We have the numbers. https://ratereview.healthcare.gov/  #ThanksObamacare",2015-06-02 17:47:54,5,3,605792972743909376
GHMSI/BPMSP–94084MD017: 32.59% increase for Marylanders who choose to stay on that plan in 2016 #ThanksObamacare http://1.usa.gov/1FSdCBZ ,2015-06-02 17:47:19,4,1,605792828090810368
HMSA PPO-18350HI088: 49.87% increase for Hawaiians who choose to stay on that plan in 2016 #ThanksObamacare http://1.usa.gov/1FSdCBZ ,2015-06-02 17:46:57,3,1,605792732477464576
PA’s Geisinger proposes overall base rate increase of 40.57% for Individ HMO POS renewing members. #ThanksObamacare http://1.usa.gov/1FSdCBZ ,2015-06-02 17:46:33,3,2,605792634477543424
All Alliant indiv/fam plan premiums in GA will increase from 11-85% in 2016 w/an avg increase of 38% #ThanksObamacare http://1.usa.gov/1FSdCBZ ,2015-06-02 17:46:08,3,2,605792528164487169
"Per CMS, the requested avg rate change for UnitedHealthcare’s individ plans sold off the exchange in NE is +10.4% #ThanksObamacare",2015-06-02 17:45:20,3,1,605792326410072064
Coventry HC of NE–15438NE018: 14.42% increase for Nebraskans who choose to stay on that plan in 2016 #ThanksObamacare http://1.usa.gov/1FSdCBZ ,2015-06-02 17:44:39,3,3,605792156721123328
Carelink by ACH–15438NE017: 15.18% increase for Nebraskans who choose to stay on that plan in 2016 #ThanksObamacare http://1.usa.gov/1FSdCBZ ,2015-06-02 17:44:16,6,4,605792059073560577
ACA/SERMC-HMO-15438NE028: 14.49% increase for Nebraskans who choose to stay on that plan in 2016 #ThanksObamacare http://1.usa.gov/1FSdCBZ ,2015-06-02 17:43:44,4,3,605791922473463809
Caveats: These are PROPOSED rate increases for specific plans–final #s come in October. Only increases above 10% require advance posting.,2015-06-02 17:43:20,3,0,605791823076814849
#Obamacare continues to raise #healthcare premiums. CMS has released some data for 2016 plans. Standby for their estimates.,2015-06-02 17:43:04,3,0,605791756374806529
To the @NENationalGuard deploying today: You & your families' sacrifices give us all the gift of freedom. Thank you.pic.twitter.com/AjOqKisyGJ,2015-05-29 21:13:17,11,6,604395109766074368
Where’s the beef? Nebraska. Happy #NationalBurgerDay!pic.twitter.com/5rb4b2dDuk,2015-05-28 20:47:03,7,2,604026118203662336
This rule isn’t about improving the environment—it’s about keeping bureaucrats busy at the expense of ag. #WOTUSpic.twitter.com/yKoyOnNDBv,2015-05-28 15:08:40,9,19,603940962684039168
Beautiful #MemorialDay ceremony in Omaha. Today we honor our fallen heroes. Their sacrifice will never be forgotten.pic.twitter.com/VHu6Phe6EG,2015-05-25 19:05:26,12,7,602913382925246465
Senator Sasse explains why today’s vote on trade is good news: http://on.fb.me/1PCifry  #TPA,2015-05-23 03:39:41,7,6,601955634397974528
Trade expands opportunities for the world's most productive farmers and ranchers – and those are Nebraskans. #TPApic.twitter.com/XRBKmFcE9z,2015-05-22 17:37:58,11,17,601804207201624064
"#FighterAce Donald McPherson described his service as “commonplace"" but there’s nothing ordinary about his valor. http://bit.ly/1LmMhK0 ",2015-05-21 13:43:27,4,0,601382800919519232
Nebraskans owe Mr. McPherson an enduring debt of gratitude. The #CongressionalGoldMedal is a small token of thanks.https://vine.co/v/eAl39LBYt1O ,2015-05-21 13:42:54,3,3,601382662192889856
"153 years later, Nebraska still prospers thanks to the hard work & sacrifice of the Homestead Act settlers.",2015-05-20 21:25:23,6,2,601136660290641920
Forget pages of regulation-the only government program the Homestead Act settlers needed to succeed was opportunity.pic.twitter.com/MKixP4uuBQ,2015-05-20 21:23:51,4,4,601136278197927936
418 Americans filed claims the 1st day of the Homestead Act. The 1st claim was filed in Nebraska. Many more followed.pic.twitter.com/r2q6i4gLko,2015-05-20 21:21:31,4,1,601135690521378816
"153 years ago today, Abraham Lincoln signed the Homestead Act of 1862 into law. We opened the West with a single piece of paper.",2015-05-20 21:19:34,7,9,601135200391823360
Enjoyed talking with some of the wonderful members of the @NEStatePatrol today.pic.twitter.com/IthO872FEL,2015-05-20 18:47:05,3,5,601096826721271808
What a great crowd. Great conversation with the @NAIFA members who visited this morning.pic.twitter.com/65maJZfZOp,2015-05-20 16:56:52,2,2,601069087062626305
Fun meeting moment: It turns out Dr. Miller of @AAFP goes way back w/ one of our staffers-he delivered him! #FMCC2015pic.twitter.com/nhsjIex8yu,2015-05-14 14:47:09,10,6,598862118058905600
"Happy birthday, @SenTomCotton! Would say today's a special day for him because he gets to eat birthday cake, but...http://n.pr/1RFEuvg ",2015-05-13 19:55:51,9,2,598577416110546944
"If you think 18 yrs sounds far off for #SocialSecurity's insolvency, ask a mom whose child just graduated high school how quickly that goes.",2015-05-12 17:12:32,9,8,598173927995736065
The SSA says we have 18 years until #SocialSecurity’s reserves dry up. This report indicates we have even less time than that.,2015-05-12 17:12:15,3,2,598173857388855296
The SSA is a black box: only the #SocialSecurity trustees (not even Congress!) know the real data or the methodologies used.,2015-05-12 17:12:01,2,2,598173799377416192
"What's more: the SSA doesn’t publish its data, so this new study can’t give us a number of how off our #SocialSecurity estimates might be.",2015-05-12 17:11:45,2,3,598173728443375616
"Essentially, we’ve had fewer babies & fewer funerals than SSA estimated, which gives a very different picture of #SocialSecurity solvency.",2015-05-12 17:11:28,1,1,598173659426086912
"Since 2000, #SocialSecurity forecasts showed a rosier picture to Congress, providing false comfort & misleading by a wider margin each year.",2015-05-12 17:11:13,2,1,598173594032721921
Their new Harvard-Dartmouth study checked the accuracy of ~30 years of #SocialSecurity forecasts & it might be worse than we thought.,2015-05-12 17:10:53,1,1,598173512491278336
Kudos to @kinggary @kostyakashin & Dr Soneji for an important analysis. We need to know the hard facts about #SocialSecurity’s health.,2015-05-12 17:10:37,1,5,598173446342860800
"""My 11-year-old said, 'We get to thank some veterans today instead of just being in committee meetings? Outstanding'""http://bit.ly/1bKuiR2 ",2015-05-11 17:07:24,19,9,597810247227539456
“It gives you goosebumps.” @WOWT6News reports on the Nebraska honor flight Senator Sasse greeted in DC.  http://bit.ly/1bKcSE7 ,2015-05-11 15:12:13,6,4,597781259977371648
What a tremendous way to honor our WWII #veterans. Highlights from the #VEDay70 #ww2flyover.https://vine.co/v/emALPzhK0Di ,2015-05-09 00:12:16,2,7,596830006430584832
"“Fundamentally, this is about people’s lives.” Getting to the bottom of the CoOportunity collapse:http://bit.ly/1DUHERf ",2015-05-08 15:11:41,4,0,596693961256865793
An administration change is a uniquely risky time. How @SenSasse is helping Homeland Security manage the transition:http://bit.ly/1FScuzQ ,2015-05-07 21:12:37,4,5,596422408850034688
Thousands of Nebraskans lost health insurance. Millions of taxpayer $ squandered. Why did CoOportunity collapse? http://bit.ly/1DUHERf ,2015-05-07 19:50:19,2,4,596401695573303296
"When @OU_Football's JC Watts stops by, temporarily edit your framed bouncerooski to a fumblerooski. #etiquette #GBRpic.twitter.com/RIhBHCiC5H",2015-05-07 15:33:06,7,3,596336963852075008
Listening to ER docs about the stresses our ERs face. Their input is critical to fixing our broken healthcare system.pic.twitter.com/URtMxakfMq,2015-05-06 21:32:07,12,6,596064928278007808
The long-term strategy of the US should be to deny safe havens to terrorists so they can’t plan attacks from abroad.http://bit.ly/1by4eZ4 ,2015-05-06 19:58:30,6,9,596041366603493377
What does this weekend's attack in Garland tell us? This is going to be a long fight against jihad. http://bit.ly/1by4eZ4 ,2015-05-06 17:42:19,2,1,596007096522506240
Jihadism is metastasizing around the world. The world is a far more dangerous place than it was on 9/11. Here’s why: http://bit.ly/1by4eZ4 ,2015-05-06 15:55:01,6,4,595980093949878272
Congratulations to @WayneStCollege Women’s #Rugby on winning their second straight national title this weekend. Go Cats!,2015-05-06 15:03:13,22,17,595967058271203328
"Proud of our #PruSpirit2015 honorees, Melissa & Cole. Expect more great things from these young Nebraskans!pic.twitter.com/PszxXDUiV5",2015-05-05 17:28:58,3,3,595641346674786305
Peek into a meeting: community bankers tell Ben about regulatory barriers to make loans to Nebraskan homeowners. https://instagram.com/p/2JZQ10RUvE/ ,2015-05-01 17:22:37,3,3,594190197488807936
You know you're in a bad place when the French are negotiating for a tougher deal. #IranDeal #NRISummit15,2015-05-01 00:42:20,26,42,593938467324764160
No one is willing to have their sons & daughters go and die for someone being whimsical in foreign policy #NRISummit15,2015-05-01 00:37:54,12,6,593937351744749568
The public is so tired of a foreign policy geared around sound bites. #NRISummit15,2015-05-01 00:37:32,9,2,593937261453975552
"In American foreign policy, when you draw a red line, foreign leaders have said it's really a red carpet. #NRISummit15",2015-05-01 00:37:02,10,4,593937134685278209
"Break a leg in tonight’s @PoetryOutLoud championship, Amanda Pohlman! #POL15pic.twitter.com/YGVYkNYacI",2015-04-29 20:21:47,10,7,593510512626794496
Learning more about the issues facing Columbus businesses in this morning’s meeting with @ColNEChamber.pic.twitter.com/Lnn8i81aqC,2015-04-29 17:34:53,3,0,593468511403560961
"Our office just voted for @SkuttCatholic in the @VANS_66 Custom Culture contest. Nice work, kids! http://bit.ly/1Ep83ud ",2015-04-29 16:22:37,11,4,593450324242931712
Proud to see Nebraskan @PAEAStephane bringing her expertise to today’s House subcommittee hearing.pic.twitter.com/CihCAFRevv,2015-04-29 13:33:25,7,3,593407741026242560
Gen Scott(USAF Ret) told Ben 71% of kids aren't qualified to serve in military w/obesity a major cause @Mission_Readypic.twitter.com/5xB8HRK0ct,2015-04-28 23:03:50,5,9,593188906981597186
What Nebraskans really want to tell the President about the #IranDeal. Watch full video here: http://bit.ly/1J6nHLV https://vine.co/v/eW37XD01lU1 ,2015-04-28 20:28:08,4,5,593149721700630529
Proud to stand w/ next pro-life generation! MT @bishop_conley Thank you @sensasse for letter of support to our pro-life Catholic students,2015-04-28 19:12:14,10,4,593130618864676868
Questions on #IranDeal: (4) What really happens if we lift the sanctions and #Iran cheats?http://bit.ly/1J6nHLV ,2015-04-28 18:52:33,1,0,593125667212001280
Questions on #IranDeal: (3) What is the administration’s best case scenario for a nuclear #Iran?http://bit.ly/1J6nHLV ,2015-04-28 18:35:48,2,0,593121453333164032
Questions on #IranDeal: (2)Why change 36 years of bipartisan policy consensus that prohibited Iran’s nuclear weapons? http://bit.ly/1J6nHLV ,2015-04-28 18:19:08,3,0,593117255728242689
Questions on #IranDeal: (1) Didn't we decide we wouldn't tolerate state sponsors of terrorism? http://bit.ly/1J6nHLV ,2015-04-28 18:01:47,5,0,593112892700041216
4 Questions Nebraskans Have about the #IranDeal: http://bit.ly/1J6nHLV ,2015-04-28 13:30:37,4,2,593044650497302528
Happy to congratulate Elda Reinhardt on being named Columbus Chamber's Volunteer of the Year! http://on.fb.me/1GAHJAJ pic.twitter.com/C7pN4ibjRp,2015-04-27 17:03:41,2,4,592735883159277568
Mid-laugh. The folks who volunteer for @HonorFlightDCA are incredible. #HonorFlight #Veteranspic.twitter.com/VViafro4ko,2015-04-27 13:32:25,4,0,592682715431968770
Truly wonderful: the way the whole airport stood & clapped for our #Nebraska #veterans. #HonorFlighthttps://vine.co/v/eWWlJbvEahD ,2015-04-25 01:41:32,22,24,591779038378754048
Welcoming the Nebraska @HonorFlightDCA. God bless our heroes. #veteranspic.twitter.com/5YZfZyOLfg,2015-04-25 01:17:39,11,6,591773029623066624
Thanks to everyone who attended our first Coffee with Ben yesterday!pic.twitter.com/02k0UUnVjR,2015-04-24 20:41:33,3,1,591703546250289156
#ArborDay: a #Nebraska tradition. Kudos to the folks who work hard prepping the trees for this celebration:http://bit.ly/1OPdjtD ,2015-04-24 18:19:05,5,4,591667692844769281
The idea that Tehran follows the rule of law is laughable to anyone paying attention. http://bit.ly/1Dn4O3z  #Iran #IranDeal,2015-04-23 17:08:54,14,16,591287644258172929
Only in Washington DC would a deal this bad gain momentum. @SenSasse on Fox: http://bit.ly/1Dn4O3z  #Iran #IranDeal,2015-04-23 15:52:06,29,156,591268318029426689
"What play did Ben submit? The 1982 “Bounce Rooskie”, which he was there for as a kid selling pop in Memorial Stadium:http://bit.ly/1Huaw8B ",2015-04-22 20:24:28,6,4,590974473391763458
This is definitely getting framed for the office. @Coach_Riley signs @SenSasse’s play: https://vine.co/v/eapFrUKaV3j  #GBR #Huskers,2015-04-22 20:18:45,4,1,590973032308551681
Check this off the bucket list: offered @Coach_Riley a play for the #Huskers today. #GBRpic.twitter.com/KV0Dc6II27,2015-04-22 14:14:49,29,11,590881445218021376
What matters is that there not be a nuclear armed #Iran. Senator Sasse talks #IranDeal with @HughHewitt:http://bit.ly/1bdYDr9 ,2015-04-20 20:23:44,9,14,590249510502211585
It’s not surprising that our adversaries no longer fear us & that our allies no longer trust us. #Iran #IranDealhttp://bit.ly/1bdYDr9 ,2015-04-20 18:23:02,9,4,590219137152114688
We must negotiate from a position of strength. Show them we mean business & we don’t intend to allow a nuclear #Iran.http://bit.ly/1b4zVJE ,2015-04-17 18:08:35,15,25,589128335931940864
"""The right number of centrifuges for #Iran to have is zero."" Senator Sasse on @GlennBeck: http://bit.ly/1b4zVJE ",2015-04-17 15:41:13,15,17,589091251624013824
#Iran has 19K centrifuges. POTUS said he'd concede 1K & is now up to conceding 6K. The right # is zero & that’s what we should fight for.,2015-04-17 01:02:58,22,31,588870232309161985
Our objective should be that #Iran has no uranium enrichment capabilities.http://bit.ly/1zmyjAU ,2015-04-17 00:48:08,20,27,588866500263546883
"Congratulations to @LexSchools' Audrey Racek, Nebraska's Assistant Principal of the Year.pic.twitter.com/3znxRxiMRO",2015-04-17 00:11:13,10,7,588857206642188290
Great to meet with the @SiouxlndChamber today!pic.twitter.com/sgg4cgvDv3,2015-04-16 18:45:32,2,2,588775248486621184
Marrying the tax code's complexity to #Obamacare's complexity will make this a challenging year for the #IRS-& all Americans. #TaxDay,2015-04-15 22:18:43,6,4,588466509522948096
"Current #IRS estimates for telephone wait times? Almost 30 minutes, thanks to the redirection of funds from #Obamacare. #TaxDay",2015-04-15 22:18:23,6,2,588466423862849538
And don't expect help on the phone - $100 million of the #IRS's telephone support budget was redirected to #Obamacare compliance. #TaxDay,2015-04-15 22:17:58,4,9,588466322008248320
"Who's in charge of this massive new #ACA compliance? No one in particular at the IRS, according to IRS commissioner (except for him) #TaxDay",2015-04-15 22:17:16,6,4,588466142403899394
"And now the #IRS is in charge of implementing 34 provisions of #Obamacare for the 1st time this year, on top of that complexity. #TaxDay",2015-04-15 22:16:57,4,4,588466064062722048
How complex is the tax code? 91% of Americans use software to do their taxes. #TaxDay,2015-04-15 22:16:36,4,6,588465976661807104
"Today, the Oversight Cmte held a hearing with the #IRS commissioner for #TaxDay on #ACA implementation. Some of what we learned to follow.",2015-04-15 22:16:15,5,2,588465889961345024
"Ben was so eager to squeeze in a quick mtg w/ @ASUN_UNL, he almost missed his cue to speak at the NE Breakfast! #UNLpic.twitter.com/SySMfrk8rr",2015-04-15 19:09:48,7,2,588418965589925890
What an advocate @arcnebraska has in @LynnRedding1! So inspiring-this smile stayed on long after this selfie #DPS2015pic.twitter.com/wPsWPJiYq2,2015-04-15 16:17:23,13,5,588375574411894784
On the jumbotron at #NeFFA15. Meeting #FFA students makes one excited for the future of #ag in our state.pic.twitter.com/ZWmOlL1uF2,2015-04-10 15:22:35,6,4,586549846334709760
Senator Sasse with #Nebraska’s future #ag leaders from Morrill High School #FFA. #NeFFA15pic.twitter.com/kxWm3PqOLz,2015-04-10 14:07:32,9,1,586530958859509760
"From blueprint to home, Heritage Homes walked Senator Sasse through the homebuilding industry in Nebraska.pic.twitter.com/nWBLnYfSHV",2015-04-09 22:07:43,4,1,586289414650888194
Talking with the folks at the Norfolk Morning @Kiwanis Club is a great start to any morning. #civilsocietypic.twitter.com/CNoL32BMlL,2015-04-09 20:21:22,2,1,586262647756169216
#Iran is one of the two great sources of destabilization in the Middle East. We should be wary of this nuclear deal. http://bit.ly/1y9aHES ,2015-04-06 21:22:20,21,41,585190827128987648
Highlight of the trip: getting to talk with our brave men & women currently deployed overseas. God bless our troops.pic.twitter.com/krbNEBv2Ka,2015-04-06 18:57:40,10,3,585154420175937536
Senator Sasse is back in Nebraska after an eight-day trip to the Middle East. Here’s what he saw there:http://bit.ly/1GZ8SvO ,2015-04-06 18:15:38,5,2,585143841944141824
I’m hopeful that my colleagues & I are just beginning a conversation about the things Nebraskans regard as the most important duties of govt,2015-03-27 14:45:57,7,8,581467195047342080
It's not a perfect budget—I would've preferred more urgency in fixing Washington’s broken entitlement & poverty programs—but it is a roadmap,2015-03-27 14:45:29,9,6,581467078022025217
"The Senate budget offers a roadmap to tackle Washington’s runaway spending, set long-term priorities & start working on entitlement reform.",2015-03-27 14:45:06,9,3,581466984153501696
"We have a reason to be prudently optimistic: for the 1st time in years, Congress has an opportunity to pass a budget that leads to balance.",2015-03-27 14:44:31,10,1,581466837059239936
Taking a moment out from tonight’s #Voterama to #SupportBlue. @FRFOmahapic.twitter.com/vnKkCa3L9F,2015-03-27 02:17:12,32,16,581278766623756289
"Meeting Brig Gen Guillot, Commander of the 55th Wing, & CMSgt Grengs & SMSgt Lawson from @Offutt_AFB yesterday.pic.twitter.com/XnUA9vndaC",2015-03-26 23:37:41,5,0,581238625188347904
Talking w/@NECattlemen before passing an amdt w/@SenJohnBarrasso that helps producers reign in #WOTUS overregulationpic.twitter.com/1aSZpi5Tof,2015-03-26 20:52:40,1,6,581197097434771456
Congress should scrap this #SGR deal and work on a new solution. Americans deserve more than smoke & mirrors. #docfixhttp://politi.co/1BsTiTo ,2015-03-26 15:03:10,5,7,581109140472348672
"Additionally, this #SGR deal fails the budget common sense test. The magical “alternative fiscal baseline” won't hold http://politi.co/1BsTiTo ",2015-03-26 15:02:32,4,3,581108984196804608
And how many have read the 263pg #SGR bill? We know what happens when Congress passes a bill to find out what’s in it http://politi.co/1BsTiTo ,2015-03-26 15:02:08,5,2,581108883286073344
"Plus, the #SGR proposal saddles taxpayers & their grandkids with $141 billion over just the first decade. http://politi.co/1BsTiTo ",2015-03-26 15:01:38,2,1,581108757578518528
"This bill relies on command & control bureaucracy, substituting the flawed #SGR formula for >120 pages of new rules http://politi.co/1BsTiTo ",2015-03-26 15:00:52,3,4,581108563659124736
The House bill is a missed opportunity to fix #Medicare & arguably makes our long-term problems worse. #SGR http://politi.co/1BsTiTo ,2015-03-26 14:59:33,5,2,581108230803312641
"Meeting General Bohac, leader of some of Nebraska’s bravest men & women. @NENationalGuardpic.twitter.com/2YDeGsW3Ax",2015-03-25 20:38:55,10,4,580831248660226048
"With enough filters, the tie almost matches. Inspired by the dedication of these Nebraskans to #EndAlz!pic.twitter.com/Ntg8zZoqDU",2015-03-25 19:02:38,15,8,580807017733967872
Congress needs to hear from Nebraskans who care about clean water and pay the price for foolish red tape. http://bit.ly/1LUkd4N  #WOTUS,2015-03-24 23:11:56,3,3,580507366573154305
"Let’s give Nebraskans more choices, not bureaucrats more power. #Obamacarepic.twitter.com/if0S6DMjEk",2015-03-23 21:11:58,12,10,580114787767574529
Meeting with students from Superior HS in the best scenery the Senate has to offer. Go Wildcats!pic.twitter.com/WTLFtMIW9v,2015-03-19 22:46:26,4,6,578689010186469376
