Text,Date,Favorites,Retweets,Tweet ID
Over 7% of counties have a monopoly on the #ACA's exchange. Full numbers: http://1.usa.gov/1V7oEvQ pic.twitter.com/iLMjC0fpxV,2016-03-17 17:49:33,9,8,710523482052894721
Officially recognizing ISIS has committed genocide: a small but impt step to recovering a coherent foreign policy.http://1.usa.gov/22p8gcf ,2016-03-17 14:35:12,47,34,710474569719652353
Who better to celebrate #AgWeek with than the @NebraskaFFA?pic.twitter.com/87xtfzUCPH,2016-03-16 22:19:56,26,12,710229136787292162
Disheartened by ICE’s excuses and evolving explanations.http://bit.ly/1Z1Xqqq ,2016-03-16 21:16:05,18,6,710213069394288640
"Using GAO's count, every state has fewer 2016 exchange insurers than they did in the 2013 individual market. #ACAhttp://bit.ly/1S2114V ",2016-03-16 13:18:23,29,38,710092854216040449
Thanks to @NebraskaPTA for ensuring parental involvement remains central to Nebraska education. #PTALegConpic.twitter.com/RHmol7DRyZ,2016-03-15 22:35:25,24,7,709870645534978048
Does the #ACA increase competition? The data is clear: No. http://1.usa.gov/1V7oEvQ pic.twitter.com/KHMnG2KX62,2016-03-15 18:15:11,15,12,709805155089313792
This is a county-by-county snapshot of the #ACA’s failures:http://bit.ly/1RLGjnd ,2016-03-15 17:01:07,5,8,709786517137440768
"Under #ACA, over 36% of counties only have 1 or 2 insurers on the exchange. That's not much of a choice. http://bit.ly/1S2114V ",2016-03-15 15:47:04,10,4,709767880569655296
Couldn't be prouder of these two Nebraskans representing our state for the @SenateYouth program. #ussyp2016pic.twitter.com/SekMSeW3wS,2016-03-15 14:41:26,44,6,709751363291451392
"We must call brutal violence against Christians, Yazidis, & others in the Middle East what it is—genocide.http://1.usa.gov/1nJKLLi ",2016-03-14 22:16:11,67,37,709503416549171200
Today’s data cuts through the spin & makes this fact clear: the #ACA has failed families who now have fewer choices.http://1.usa.gov/1V7oEvQ ,2016-03-14 21:52:22,14,6,709497424918781952
REPORT: 2016 exchanges have nearly 6% fewer insurers than the 2015 exchanges. The #ACA has not increased competition:http://1.usa.gov/1V7oEvQ ,2016-03-14 20:15:49,16,22,709473125008863232
HHS owes all CO-OP enrollees and taxpayers answers. (And these CO-OPs owe taxpayers a whole lot of money.)http://bit.ly/1TIFx0i ,2016-03-14 15:32:38,13,10,709401861468585984
"""Check out all those zeroes."" -@FoxNews on the amount of taxpayer money #ACA's failed CO-OPs have lost.http://bit.ly/1XgdtQ1 ",2016-03-11 23:20:27,16,9,708432428294152193
"12 CO-OPs failed. 740K lost coverage. $1.2 bil in taxpayer ""loans"" gone. HHS owes us answers on the CO-OP collapse: http://1.usa.gov/1Lh2wx0 ",2016-03-11 18:30:07,20,15,708359363635879937
We need to acknowledge the utter incompetence of trying to centrally plan a program like these CO-OPs:http://bit.ly/1RbDMZp ,2016-03-11 16:43:23,11,5,708332503141117952
.@BretBaier reports on some hard facts to back up the notion that #ACA has been a financial failure​: http://bit.ly/1pcUxXc ,2016-03-11 14:59:15,12,10,708306295472971776
Failed #ACA CO-OPs lost $2 for every $1 from HHS --> http://bit.ly/1XgdtQ1 ,2016-03-10 23:37:34,6,9,708074345768329216
Families lost their healthcare plans; taxpayers were swindled; bureaucrats mismanaged. From today's CO-OP hearing:http://bit.ly/21livvD ,2016-03-10 22:12:34,31,22,708052957879607296
"Yet another reason why wearing a helmet is always a good idea...right, @BikeLeague? #NBS16pic.twitter.com/tv4GQOYQY3",2016-03-10 14:29:35,25,8,707936442765479936
Congress should make sure the school-lunch system isn’t being gamed at kids' expense. Why I'm calling for an audit:http://bit.ly/1SAFgLT ,2016-03-09 23:49:17,29,9,707714907748343808
A welcome break from an Administration that frequently circumvents the rule of law: http://bit.ly/223xXPm  #gitmo,2016-03-09 20:27:23,26,14,707664099715457024
Thank you to Gary Bodenheimer of @NKF for sharing his story of living with #kidney disease: http://bit.ly/1peKMbM pic.twitter.com/9wTsW65C5o,2016-03-08 23:50:48,12,2,707352902168350724
ICE has a duty to provide clear answers about why it would let someone go who had just killed another person.​http://bit.ly/1RxrAMP ,2016-03-08 00:00:17,21,15,706992899205033988
Glad my daughter was able to meet this strong & inspiring Omaha mom. Her story: http://bit.ly/1YohxyV pic.twitter.com/O1JW44INp6,2016-03-07 21:18:00,43,13,706952059443142656
The founders understood that throughout human history almost everyone had been wrong about the nature of gov't.http://dailysign.al/1ppBUjm ,2016-03-07 17:14:15,73,37,706890718791540736
We live in a time when 41% of Americans < 35 think the 1st Amendment is dangerous. We need a constitutional recoveryhttp://bit.ly/1QYoXZV ,2016-03-07 14:59:12,62,48,706856731834499072
The structure of our constitution screams: ALL the rights are the people's. http://bit.ly/1LFztTG  #CPAC2016,2016-03-04 22:18:51,65,41,705880211326427136
We don't ever wait for the government to give us any rights. We claim those by nature. http://bit.ly/1LYJzd1  #CPAC2016,2016-03-04 18:59:42,66,41,705830094456094721
Our youngest Nebraskans at this week's #NEBreakfast: #NPHSBulldogNation​. Thanks for joining us! @NPCloseUppic.twitter.com/ZPzWOdJqxj,2016-03-04 15:35:53,24,6,705778802127970306
American Exceptionalism in 7 Quotes: http://dailysign.al/1ppBUjm  via @DailySignal #CPAC2016,2016-03-04 01:18:50,37,21,705563117489680386
"In our system, the government's rights are limited, but the people's rights are limitless. http://bit.ly/1SmnTOw  #CPAC2016",2016-03-03 23:55:41,67,46,705542192513863680
"If this man is not a threat to public safety, then who is?http://bit.ly/24E6BBv ",2016-03-03 19:52:01,37,19,705480872036855808
Thank you to @VFWHQ for being a voice for #veterans at yesterday's #NEBreakfast - and thank you for your service.pic.twitter.com/wa0IRVU94H,2016-03-03 17:54:36,35,9,705451322758328320
What a joyous witness for life outside #SCOTUS. #Prolife advocates defend mother & child. We can #protectthemboth.pic.twitter.com/1qycz92WsP,2016-03-03 00:09:39,101,30,705183317012914176
Nebraskans deserve to know what DHS is doing to right this wrong:http://1.usa.gov/21IbDuc ,2016-03-02 22:25:18,17,10,705157059273216001
"Happy Birthday, Nebraska - and @SenatorFischer!https://twitter.com/SenatorFischer/status/704691702796128257 …",2016-03-02 00:08:50,20,6,704820725539065858
"Dear @greta, congrats on #Greta3500! Sincerely, gym rat. PS-- you've made tv great again.",2016-02-25 00:57:22,78,11,702658611844022272
It's a great read! https://twitter.com/aamers/status/702184660697272320 … @AAMerspic.twitter.com/b4p3JNfjDF,2016-02-23 20:11:33,35,6,702224297897672709
The Supreme Court is meant to check the power of the other two branches of government.​ #SCOTUShttp://bit.ly/1SOagbK ,2016-02-22 21:07:35,51,36,701876011026219008
FreeeeeeeDOM! http://dailysign.al/1XIoOZY  #SCOTUS,2016-02-22 17:22:30,62,31,701819364484448256
"Mr. President, you and your nominee must repudiate your executive unilateralism.​ #SCOTUS #XUhttp://bit.ly/1SUXatO ",2016-02-18 20:26:17,37,25,700416065713651718
The necessity of US leadership is inarguable — for our allies and for us. The US must lead.​http://bit.ly/1PPf0rT ,2016-02-17 20:00:14,31,16,700047120879976449
"Soon, all wars will have a #cyber component, for which we are unprepared and under-investing. http://bit.ly/1PPf0rT ",2016-02-17 18:04:34,35,17,700018013500792834
We must realize what Vladimir Putin is doing in Europe. We are foolish to see his aims as benign.  http://bit.ly/1PPf0rT ,2016-02-17 16:10:05,29,19,699989203489288192
Russia is “weaponizing” emigration to advance its geopolitical goals. This is no accident. http://bit.ly/1PPf0rT ,2016-02-16 23:06:23,19,14,699731577509642242
Global stability is at its lowest point since the Cold War’s conclusion in 1989. http://bit.ly/1PPf0rT ,2016-02-16 21:20:19,13,10,699704886477373440
New op-ed: Six observations from @SenJoniErnst & me on the global threats we face. http://bit.ly/1PPf0rT ,2016-02-16 20:11:39,16,16,699687606934757376
"Kim Jong Un is a two-bit dictator who threatens S Korea, Japan - and us. These sanctions on N Korea send a message.http://1.usa.gov/20NUouv ",2016-02-11 13:42:00,21,9,697777608554110977
An important step toward the American people—not unelected bureaucrats—setting energy policy http://1.usa.gov/1KbLJea pic.twitter.com/2oJvU0bDfF,2016-02-10 15:24:00,26,19,697440891351515136
Who does overregulation hurt? The poor. Here's why:http://bit.ly/1PfTe2q ,2016-02-07 22:02:59,37,27,696454131502854145
Government is not just another word for the things we choose to do together. This is what government really is:​http://bit.ly/1mkQVAC ,2016-02-06 23:14:55,19,14,696109849122197504
Washington's proper role is to maintain a framework for ordered liberty. http://on.fb.me/1mijD5c ,2016-02-05 18:03:51,35,34,695669176325771264
"Since 2009, the federal gov has saddled US businesses with over 180 major new regulations. Cost? ~$80 bil/year.​​http://bit.ly/20JavGk ",2016-02-04 21:44:51,18,13,695362407082774530
"We must allow more Americans to keep what they earn, hire employees & conduct business with less gov't interference. http://bit.ly/20JavGk ",2016-02-04 19:52:02,37,28,695334015499313152
New op-ed from @JimDeMint & me on why @Heritage's 2016 Economic Freedom Index has some bad news for America: http://bit.ly/20JavGk ,2016-02-04 17:34:18,32,45,695299354458980352
The U.S. Senate honors @Huskervball for their victory in the NCAA Championship: http://1.usa.gov/1nOahQx  #gbrhttps://twitter.com/Huskervball/status/679379393043496964 …,2016-02-04 00:11:21,10,4,695036887833116673
#NEBreakfast is back! Thanks to all who attended the 2016 kickoff of this 73-year tradition. http://1.usa.gov/1Qdv2LC pic.twitter.com/SEVQn7Kp0b,2016-02-03 22:18:23,13,2,695008458098229248
"In light of inclement weather, tomorrow's mobile office hours in Wahoo will be rescheduled to a later date. http://1.usa.gov/1K965nV ",2016-02-01 22:31:42,0,1,694287034215710721
"The Senate is for debate. Unfortunately, a great deal of our debate is weak. We need honorable, honest debating.http://bit.ly/1Pm95hc ",2016-01-29 17:49:19,39,11,693128803430825985
Full text of the @Peter_Wehner @Commentary article from today's floor speech. Worth a read: http://bit.ly/1OToGn1 ,2016-01-29 02:57:42,9,2,692904423689859073
Lessons from C.S. Lewis & Daniel Patrick Moynihan on debate that the Senate should take to heart:http://bit.ly/1Pm95hc ,2016-01-29 02:40:09,23,21,692900007553269763
Our mobile office hours kick off in Nebraska tomorrow! Click here for a list of locations: http://1.usa.gov/1K965nV pic.twitter.com/NaPxBdvCyE,2016-01-26 21:36:33,6,3,692098827189358592
"Rest in peace, Officer Vernon Alston. Thank you for your years of dedicated service to @CapitolPolice.http://politi.co/20oPWiq ",2016-01-25 14:56:03,22,13,691635650009780225
.@TheMarilynator praying for you and your #prolife crew. Be safe (and hopefully warm). Please send updates.,2016-01-23 16:10:54,23,5,690929710709092352
Stay safe & warm - we'll see you next year. #MarchforLife http://1.usa.gov/1nbE4S5 pic.twitter.com/HEB5XyMsMp,2016-01-22 16:39:22,3,2,690574486328983553
#WhyWeMarch? @BarackObama explained it fairly well himself in the #SOTU. If only he'd listen. #prolifepic.twitter.com/pFbivzbcxt,2016-01-22 15:47:40,67,49,690561476512354304
The Senate has experienced a 13-vote swing in four years on the issue of life: http://bit.ly/1nq3OLt  #Prolife progress.,2016-01-22 14:41:11,20,16,690544743080656896
Momentum is on our side. Science is on our side. Hope is on our side. @SenatorLankford & I on #prolife progress: http://bit.ly/1nq3OLt ,2016-01-21 21:05:10,55,37,690278988250484736
To all Nebraskans in town for the #MarchForLife: join @SenatorFischer & me at the Senate for a hot cocoa afterwards.pic.twitter.com/JarCIQvcmW,2016-01-21 15:35:02,15,7,690195906919006211
This is far from over—#WOTUS still faces a battle in the courts. Nebraskans are committed to seeing this fight thruhttp://1.usa.gov/1ZMFNyX ,2016-01-20 17:08:34,13,3,689857060125720580
Senators from both parties should be deeply skeptical of any changes that centralize power.http://dailysign.al/1OTXfL4 ,2016-01-15 22:27:17,42,35,688125327113981952
Don't abandon the filibuster - embrace the Founders' vision of serious debate as a bulwark against unlimited gov't. http://dailysign.al/1OTXfL4 ,2016-01-15 20:28:54,43,30,688095534247206912
The 3 most consequential moments in the growth of fed power in the past century show why we need the filibuster:http://on.wsj.com/1RIyvbo ,2016-01-15 18:44:19,18,18,688069216117866499
Any short-term political gain from undoing the filibuster comes at long-term expense. Here's why: http://on.wsj.com/1RIyvbo ,2016-01-15 16:00:52,9,14,688028080699518982
This is troubling: http://on.fb.me/1Ro991W  I hope it was just a vetting mistake. #SupportBlue,2016-01-14 19:14:39,5,7,687714461998821376
Honored to host MAJ Jeremy Haynes for #SOTU. The moving story of his service & sacrifice: http://wapo.st/1W5ilYd pic.twitter.com/ySSE1jf3T4,2016-01-13 00:20:01,20,6,687066533441474561
May God bless and protect our Nebraskan heroes as they defend our freedoms abroad. http://bit.ly/1OLoWWe  @NENationalGuard,2016-01-11 19:56:46,15,1,686637899002064903
".@erin_nichols @BenSasse, call your office.pic.twitter.com/EPxOgYXdCQ",2015-12-23 23:22:40,24,7,679804344938696704
We owe TSgt Lemm an enduring debt of gratitude for his heroism & sacrifice. Our prayers are with the Lemm family.http://bit.ly/1NKIIgO ,2015-12-23 02:43:52,20,14,679492591088439297
Nibbling around margins isn't enough. Congress must take responsibility for whether we bankrupt our kids. #budgethttp://bit.ly/1TfthAR ,2015-12-22 18:16:00,15,14,679364783355875328
"100s of policy decisions, 1000s of pages, & more than a trillion dollars passed right before Congress skips town.http://1.usa.gov/1YqIYGA ",2015-12-18 20:18:46,16,10,677946125031227393
Full text of the first executive unilateralism (#XU) speech on the Senate floor: http://bit.ly/1PbzBbB  @Medium,2015-12-18 20:08:25,10,10,677943521026908160
What President Trump would teach us about Congress's sophomoric views on executive power: http://bit.ly/1PaYFPK  #XU,2015-12-18 15:26:46,20,10,677872639625453570
The problem of a weak Congress and executive growth should be bad news to all of us. http://bit.ly/1Jfpn5c  #XU,2015-12-18 00:50:27,20,17,677652109312008195
People grow cynical when it’s nearly impossible to throw the bums out. The people are in charge - they should be able to do the firing. #XU,2015-12-17 22:57:37,23,19,677623711688744962
"Legislators can be fired – that’s what elections are for – but bureaucrats, who have the actual power, can't be fired. #XU",2015-12-17 22:56:32,15,20,677623440224989184
The Founders’ design for checks & balances was & is a good idea. Those in power will always try to grab more power—that has not changed. #XU,2015-12-17 22:56:00,18,16,677623304753192960
"The weakness of the Congress is not just undesirable, but is actually a dangerous thing for America. #XU",2015-12-17 22:54:56,13,9,677623038641315843
"For partisans, it’s easy to forgive a President who oversteps his authority— so long as your guy is the one in charge.​ #XU",2015-12-17 22:53:41,11,8,677622723670097920
Would Rs who raged against overreach be OK with a a lawless sonuvagun if he’s our lawless sonuvagun?​ #XUhttps://twitter.com/SenSasse/status/677622165307551745 …,2015-12-17 22:52:31,12,17,677622428378537984
Thought experiment: President Trump takes office & immediately begins signing executive orders. Huuuge ones. #XU,2015-12-17 22:51:28,14,11,677622165307551745
Headed to the floor to kick off the next series of floor speeches on executive unilateralism. Tune in here: http://1.usa.gov/1XM3piQ  #XU,2015-12-17 22:40:36,8,8,677619430633943041
Washington should look in the mirror at why so many of our people are running to demagoguing leaders.http://bit.ly/1TL7Ibh ,2015-12-14 15:55:34,20,22,676430337245904900
Full text of this week's floor speech on #SanBernardino and the war with militant Islam:http://bit.ly/1RIY0rr ,2015-12-11 20:13:07,13,11,675407989503864834
"Mr. President, please lead.http://bit.ly/1mf3QVv ",2015-12-11 18:39:04,16,9,675384318991159297
We should be clear about the freedoms we stand for - AND about those who would try to kill us because of it.http://bit.ly/1Udg9wR ,2015-12-11 17:01:10,19,8,675359682588987392
Our intel community has been asked to defeat an enemy their commander in chief refuses even to name. This is lunacy.http://bit.ly/1IYtm66 ,2015-12-11 00:01:58,17,19,675103193462874113
Headed to the Senate floor with this chart. You'll want to tune in. http://1.usa.gov/1XM3piQ pic.twitter.com/L7ZGTi8PLS,2015-12-10 22:35:31,18,13,675081435309568004
"#SanBernardino was not about workplace violence, global warming, gun shows, or income inequality. It's about this:http://bit.ly/1RcNVnb ",2015-12-10 19:48:39,16,13,675039443498237952
This fight will be decades long. And we will win it. But not by denying that the fight exists.http://tws.io/1YZcLIC ,2015-12-09 18:10:57,19,12,674652468396089344
We are at war. The American people already know this. Our enemies obviously know this. Only DC seems confused.http://bit.ly/1OQP6qQ ,2015-12-09 16:05:00,16,6,674620773408096260
We are at war with militant Islam. Full video of today's floor speech:http://bit.ly/1NKeTM9 ,2015-12-09 00:55:57,58,54,674392003870916608
Senator Sasse takes the floor shortly. Watch him speak live here: http://1.usa.gov/1XM3piQ ,2015-12-08 22:55:06,11,7,674361588883857409
Washington must wake up to this fact: the crowd-sourcing of domestic terror is a reality.​ http://bit.ly/1SDz42Q  #SanBernardino,2015-12-04 23:10:19,12,12,672915866628026369
"To the deployed soldier who gets Breck's #HolidayMail: know his monster artwork=""thanks for your service"" @RedCrosspic.twitter.com/9gstmrV2rF",2015-12-02 19:08:17,37,8,672130181264461832
Thank you for your service.https://twitter.com/OWHnews/status/671842969150816256 …,2015-12-02 14:42:37,18,11,672063323316363269
"60 years ago, she refused to give up her seat. Proud to cosponsor a resolution honoring her stand. #RosaParksDaypic.twitter.com/iMU5kvq3Mh",2015-12-01 17:37:46,18,2,671745016331689984
May we all work to live lives of gratitude & pass that tradition to our kids & grandkids. #HappyThanksgiving http://on.fb.me/1lkcmlc ,2015-11-26 19:55:19,11,4,669967690707111937
An excellent Thanksgiving read:http://nyti.ms/1TeBvJS ,2015-11-25 23:13:04,6,7,669655066413019136
Let’s ensure the wisdom of Nebraskans is preserved in @librarycongress. Join in #TheGreatListen this Thanksgiving:http://bit.ly/1QI1sD9 ,2015-11-25 14:44:43,7,4,669527137410502657
Still waiting.http://bit.ly/1Lyb5wd ,2015-11-24 23:50:22,6,6,669302065664012290
"Talking the Senate, censorship, cyberwar, and ...Tom Osborne? Loved joining @jaynordlinger for his podcast:http://bit.ly/1H7y725 ",2015-11-17 23:32:17,6,1,666760801643044865
.@POTUS: What would it take to admit misjudging ISIS? Anything short of an attack on American soil?,2015-11-17 18:27:46,25,16,666684168496115712
.@POTUS: Is France aligning with Russia because US support is insufficient?,2015-11-17 18:27:16,28,15,666684041316405248
".@POTUS: Do you have a list of targets that you’ll bomb if ISIS is able to attack the US? If so, why aren’t you bombing them now?",2015-11-17 18:26:29,23,19,666683842229587968
".@POTUS: Why are there ISIS HQs, training camps & ammo depots in Raqqa for France to bomb? Shouldn’t we have already taken those out?",2015-11-17 18:25:55,48,41,666683702374703104
Americans mourn and stand alongside our French allies. #PrayforParis http://on.fb.me/1McWtpH ,2015-11-14 04:45:58,17,8,665390188990976000
"We owe our #veterans an enduring debt of gratitude, each & every day. #VeteransDayhttp://bit.ly/1MAyjHa ",2015-11-11 15:21:31,13,6,664462966989959168
It's time to challenge fact-free debating and robotic recitation of boring talking points in the Senate.http://wapo.st/1SsXMTC ,2015-11-05 20:19:08,29,24,662363538774736896
The Senate has a really important job but we’re not doing it right now. http://bit.ly/1HtoYvb ,2015-11-05 14:04:21,22,15,662269223348084736
Real talk re: the fate of the Senate narrowly topped FB trends today v. stiff competition. Thank you all for sharingpic.twitter.com/uhQ27JOdUK,2015-11-05 02:01:57,30,17,662087422977683456
Wow. Thank you.http://bit.ly/1Qe42zD ,2015-11-05 00:23:20,17,11,662062607940087808
Solving the complex problems of today requires less political theater and more open-minded patience.http://dailysign.al/1kbI7x2 ,2015-11-04 23:16:13,26,10,662045714491555840
Morning Joe on the maiden speech:http://bit.ly/1Rw5vjh ,2015-11-04 21:18:43,10,6,662016145390747648
"The full text of yesterday’s maiden speech, on @Medium:http://bit.ly/1PaCN9T ",2015-11-04 20:04:53,26,25,661997566431797248
"Get ready for ""a steady rain of little rocks”:http://bit.ly/1WwuYiS ",2015-11-04 18:48:41,13,7,661978389797015552
Watch the full maiden speech here: http://on.fb.me/1RQDQt7 ,2015-11-04 01:36:47,47,31,661718700979003392
Want updates on the coming series of Floor speeches on the growth of the administrative state? Sign up here: http://1.usa.gov/1kq4KNG ,2015-11-03 20:41:26,7,4,661644374875443200
I think we can do better – and I want to labor with all who want to figure out how.pic.twitter.com/3dJKf5ihEf,2015-11-03 20:34:06,17,15,661642529255899136
Reducing polarization =/= watering down conviction. Quite the contrary.pic.twitter.com/8sgHvnQ8G0,2015-11-03 20:33:14,17,14,661642311873490945
Such executive overreach came about because of a great deal of symbiotic legislative underreach.pic.twitter.com/vN27Moznq9,2015-11-03 20:32:04,30,36,661642017710194689
Everything cannot be simply Republicans versus Democrats.pic.twitter.com/x8epdNcxvE,2015-11-03 20:30:49,23,23,661641702902468608
We need to pause to regularly recall the larger American principles that bind us together. http://1.usa.gov/1XM3piQ pic.twitter.com/IedfDBaMfd,2015-11-03 20:30:11,16,21,661641545972654080
"A functioning Senate is a place that rejects short-termism, both in substance and in tone. http://1.usa.gov/1XM3piQ pic.twitter.com/usnP0XZrvd",2015-11-03 20:25:39,13,18,661640402127208448
Blame political polarization for the dysfunctional Senate? Hardly. http://1.usa.gov/1XM3piQ pic.twitter.com/xy9ueRkcyn,2015-11-03 20:23:39,18,14,661639899486003200
What is unique about the Senate? What was it built for?https://youtu.be/QTG2tkjnRSQ ,2015-11-03 20:21:39,9,7,661639396597346304
The Senate was built to be the antidote to sound-bites. http://1.usa.gov/1XM3piQ pic.twitter.com/TyeXurV2Sy,2015-11-03 20:10:12,25,22,661636513252417536
"The painful, top-line take-away from interviews with colleagues:pic.twitter.com/U0mTLMbYVt",2015-11-03 20:04:15,20,26,661635017295208448
We as a people are not adequately tackling the generational crises that we face.pic.twitter.com/jYebb61Efo,2015-11-03 20:03:22,21,26,661634796498587648
Taking the floor to deliver the maiden speech shortly. Watch live here: http://1.usa.gov/1XM3piQ ,2015-11-03 19:53:51,13,7,661632402167627776
"The @WeeklyStandard: ""Ben Sasse Is Now Ready to Shake Up Washington”http://tws.io/1NOPwf9 ",2015-11-03 16:51:23,9,6,661586482772209664
A preview from @TheAtlantic of this afternoon’s maiden speech:http://theatln.tc/1LO6hq1 ,2015-11-03 14:51:01,13,15,661556190757957632
Delivering maiden speech on the Senate floor after 1:30 pm CST votes today. Watch here: http://www.senate.gov/floor/ ,2015-11-03 14:30:55,7,4,661551132339236864
The Sasse family dog’s first visit to the DC office. Tego looks ready to get to work… #dogsoftwitter #rescuedogspic.twitter.com/oqgZTfZ89F,2015-11-02 19:52:22,16,2,661269638735667200
Enough is enough. CO-OP collapse victims who lost coverage & taxpayers who paid billions in loans deserve answers. http://bit.ly/1WsqFjm ,2015-11-02 01:55:03,7,11,660998524683870209
"My team looks forward to serving you, and we hope this redesigned website will help. Check it out: http://www.sasse.senate.gov/ ",2015-10-26 17:42:50,5,3,658700325617012736
This should set the table for a serious conversation: http://1.usa.gov/1MIEvcn  We still need to go big on a #cybersecurity overhaul.,2015-10-23 21:31:47,2,3,657670781716058113
A small but encouraging sign that Congress is waking up to the reality that #cybersecurity is national security: http://1.usa.gov/1MIEvcn ,2015-10-23 14:00:06,9,4,657557109727477761
Americans deserve a complete & transparent accounting of the systematic failures of ACA's CO-OP program.http://bit.ly/1Go3Wmr ,2015-10-20 21:12:05,3,5,656578658652549120
No answers on co-op failure? No nominees to #HHS. http://bit.ly/1OGmJfz  Nebraska families who lost their insurance deserve answers.,2015-10-20 15:46:20,3,3,656496682922823681
Rs&Ds from these 9 states have a bipartisan opportunity to demand answers for our constituents—so this kind of failure never happens again.,2015-10-19 18:13:07,3,2,656171234074472448
"Co-ops have failed in CO, OR, TN, KY, IA, NY, NV, LA—and Nebraska. To date, 8 of the original 23 co-ops have failed.http://1.usa.gov/1PuqOnt ",2015-10-19 18:12:46,8,21,656171145037746176
I will block consideration & confirmation of every HHS nominee until families who lost their co-op insurance plans get straight answers.,2015-10-19 18:10:36,8,6,656170597714628608
Hundreds of thousands lost their plans when co-ops in 9 states collapsed. The bureaucrats who oversaw this mess owe victims answers.,2015-10-19 18:09:50,5,5,656170405384843264
Talking solutions in Utah with @SenMikeLee & @GovMikeLeavitt.pic.twitter.com/vsvAbb8OnO,2015-10-12 20:03:17,8,2,653662243138220032
