Text,Date,Favorites,Retweets,Tweet ID
Congress needs #bipartisanship to produce results: https://www.youtube.com/watch?v=Q6x60OOPJtQ …pic.twitter.com/RGGcIuMk2x,2017-02-02 18:32:34,91,23,827223200744501250
I join my fellow North Carolinians to reflect on the African-American history and heritage in our state and country. #BlackHistoryMonthpic.twitter.com/E35NcbdOI9,2017-02-01 16:45:59,52,10,826833987335290886
"Perfect description of Neil Gorsuch, @SenSchumer. It’s why you voted for him before. He’ll be a great SCOTUS justice.https://twitter.com/SenSchumer/status/826604084773916673 …",2017-02-01 02:19:44,919,639,826615988447748096
Judge Neil Gorsuch is an incredibly qualified and mainstream choice to serve on the #SCOTUS.pic.twitter.com/O3rGzDQhqJ,2017-02-01 01:13:44,401,184,826599379171684353
My North Carolina offices are accepting applications for spring internships which start immediately. Apply online: http://tillis.senate.gov pic.twitter.com/eJvu8f7oxF,2017-01-31 19:24:50,20,12,826511577289543680
"Susan, Please have him or his family contact my office at http://tillis.senate.gov  or (704) 509-9087.",2017-01-31 16:43:32,8,0,826470985071263745
I joined Senators Shaheen​ & McCaskill to send a letter to SecDef Mattis following POTUS' immigration exec order. http://bit.ly/2knddVL pic.twitter.com/R6kbsjcwUR,2017-01-31 16:21:06,200,64,826465337084350464
"North Carolinians: if you or anyone you know has a green card and is stranded at an airport, reach out to my constituent services team.pic.twitter.com/Mwtbk0CWJE",2017-01-30 20:45:17,159,76,826169436382035968
"It's clear implementation of the executive order has caused mass confusion & unintended consequences, particularly for green card holders.",2017-01-30 20:44:08,93,11,826169144483704832
Strengthening our vetting process for people coming into this country is a matter of national security.,2017-01-30 20:43:05,85,24,826168882192789504
The @NewsandRecord highlighted my framework for a broad #immigration overhaul in its latest editorial.http://bit.ly/2kM4AAW ,2017-01-30 19:21:22,23,6,826148318787035136
My statement on the immigration executive order. #ncpolpic.twitter.com/qbjAvu9qme,2017-01-29 18:25:27,163,98,825771857412575233
It is a sad day as we say goodbye to fmr Rep. Ruth Samuelson. Please continue to lift her family up in prayer. Photo: NCGA Brims & Bows 2013pic.twitter.com/yhVEcdyzy2,2017-01-27 17:35:05,60,18,825034405731266560
"Not true, I was happy to answer their questions...they were just about the puppy.pic.twitter.com/TH8TxRRrvZ",2017-01-26 22:37:40,16,3,824748166096502785
"Today, North Carolina received more than $198M in federal assistance from @HUDgov for Hurricane Matthew recovery. http://bit.ly/2ky8Vva pic.twitter.com/lg24ZYmtLU",2017-01-26 20:32:41,30,16,824716712021000192
Susan and I are praying for former Senator @kayhagan as she continues her recovery.https://twitter.com/TWCNewsTriad/status/824678481569214464 …,2017-01-26 18:27:19,48,13,824685163904991237
"In my defense, I might be the biggest @Panthers fan in Congress & this was taken during the Super Bowl run last year. #noregrets",2017-01-25 21:13:51,4,0,824364682999906310
Good luck to @WSSURams & @NCATSUAggies this weekend at the Honda Battle of the Bands! #HBOB #WSSU #NCAT,2017-01-25 20:24:55,14,5,824352369198694400
#SchoolChoice is allowing families across the nation to make decisions that work best for their children to receive a quality education.https://twitter.com/schoolchoicewk/status/824328054017171456 …,2017-01-25 20:15:10,26,7,824349916445151234
Read more about my bipartisan #Immigration reform framework http://bit.ly/2k3yhk8 pic.twitter.com/V5hANHeywv,2017-01-25 16:06:44,34,10,824287397223473152
Proud to vote to confirm @nikkihaley as our new @UN Ambassador.,2017-01-24 23:12:06,82,19,824032055969333248
"Today has truly been a great day. This morning I met our newest office puppy, and this afternoon I met our newest office baby. #TeamTillispic.twitter.com/LL8SJCXnO1",2017-01-24 22:53:52,164,29,824027465001660417
#KeystoneXL pipeline would support thousands of good-paying jobs across a range of industries & be done in environmentally conscious manner.,2017-01-24 20:58:47,67,27,823998505219932160
"Tilly belongs to a member of my staff. Considering her for our office mascot, @seungminkim!https://twitter.com/seungminkim/status/823943963774255104 …",2017-01-24 18:55:37,31,3,823967507803492352
"Heartbroken to learn of the passing of my dear friend Ruth Samuelson. Ruth was a wonderful wife, mother & leader. We will miss her so much.",2017-01-23 16:25:34,61,19,823567361563394050
"The deadline to apply with @fema is Monday, January 23. Visit http://disasterassistance.gov https://twitter.com/senthomtillis/status/818592877102055426 …",2017-01-22 15:39:29,10,10,823193374291296259
Glad to see @POTUS sign EO giving agencies flexibility to ease ObamaCare's burden on hardworking families & employers.,2017-01-21 01:46:47,47,7,822621433197109249
Shameful that rioters are destroying fellow citizens' property & displaying open contempt for our tradition of a peaceful transfer of power.,2017-01-20 19:08:48,388,185,822521274698080256
Congratulations to @realDonaldTrump on becoming the 45th President of the United States of America. #Inauguration #Inauguration2017pic.twitter.com/A6kNcyCGPK,2017-01-20 17:35:03,60,11,822497681478127617
Susan & I have enjoyed welcoming North Carolinians to my office in #DC for #inauguration. #ncpolpic.twitter.com/aLpUz5vH2v – at Dirksen Senate Building,2017-01-19 20:50:15,40,12,822184419188473858
Honored to welcome Josh and Michael to my D.C. office. Grateful to them for their service to our country. pic.twitter.com/1wtADOXAC7,2017-01-19 15:51:37,15,2,822109265099952129
.@POTUS' commutation of Manning sentence is the ultimate act of disrespect to our intelligence community & our allies. #ManningIsATraitor,2017-01-18 19:30:13,41,17,821801890489008129
"Great work, @OrlandoPolice. RIP Lt Clayton, your service and sacrifice will never be forgotten.https://twitter.com/OrlandoPolice/status/821561585709805568 …",2017-01-18 14:52:57,28,12,821732114907430912
I will be hosting a Facebook Live Townhall TOMORROW at 2:30pm. Please submit your questions on my Facebook page. https://www.facebook.com/SenatorThomTillis/ …pic.twitter.com/HSrj61UQP0,2017-01-17 22:23:43,6,6,821483162907934721
I ask for your patience as we conduct tele-townhalls in every part of the state.pic.twitter.com/7V0MSOSFPN,2017-01-17 19:53:04,0,0,821445250556325889
I ask for your patience as we conduct tele-townhalls in every part of the state.pic.twitter.com/ssr6K3ONyd,2017-01-17 19:51:27,0,0,821444845650722817
I ask for your patience as we conduct tele-townhalls in every part of the state.pic.twitter.com/wtmvptlaey,2017-01-17 18:31:28,1,0,821424716506341377
I ask for your patience as we conduct tele-townhalls in every part of the state.pic.twitter.com/JFSNR1siZ3,2017-01-17 18:31:12,0,0,821424648147570688
I ask for your patience as we conduct tele-townhalls in every part of the state.pic.twitter.com/RYah74s7kO,2017-01-17 18:30:53,0,1,821424571937079297
I ask for your patience as we conduct tele-townhalls in every part of the state.pic.twitter.com/uVNMQLQkyR,2017-01-17 18:30:29,0,0,821424467800887297
I ask for your patience as we conduct tele-townhalls in every part of the state.pic.twitter.com/6SEo2Vt5pP,2017-01-17 18:29:53,0,0,821424318706057217
I ask for your patience as we conduct tele-townhalls in every part of the state.pic.twitter.com/0kkGacJmgo,2017-01-17 18:29:32,0,0,821424230885691392
@BeAgrestic I ask for your patience as we conduct tele-townhalls in every part of the state.pic.twitter.com/OMzEy7HSaX,2017-01-17 18:29:10,0,0,821424137612722176
I ask for your patience as we conduct tele-townhalls in every part of the state.pic.twitter.com/PIfI6ENwZG,2017-01-17 18:28:27,0,0,821423955651215362
I ask for your patience as we conduct tele-townhalls in every part of the state.pic.twitter.com/KyZPCiWci8,2017-01-17 18:27:51,0,0,821423804664705024
I ask for your patience as we conduct tele-townhalls in every part of the state.pic.twitter.com/oCCYoTT7VO,2017-01-17 18:27:00,0,0,821423594643320832
I ask for your patience as we conduct tele-townhalls in every part of the state.pic.twitter.com/YWA13DirMC,2017-01-17 18:26:28,0,0,821423459087646720
Read my op-ed in @theobserver: Voters didn’t give Republicans a mandate http://www.charlotteobserver.com/opinion/op-ed/article126941659.html …pic.twitter.com/EkWLC98q5Z,2017-01-17 18:00:41,33,16,821416968456667137
Grateful to spend #MLKDay doing a service project @HighPointU with @UAHPU packing blessing bags for homeless veterans.pic.twitter.com/fMb9VJsORR,2017-01-16 22:42:34,43,14,821125519433498626
"On #MLKDay, we celebrate the life & legacy of a man who changed history by leading the fight for freedom & opportunity for all Americans.pic.twitter.com/lzbrRciVB7",2017-01-16 13:30:28,44,26,820986580483633152
Justice for eugenics victims wouldn't be possible w/o Rep Womble's activism. Susan presented him a copy of my bill that was signed into law.pic.twitter.com/VGLu6Z1Zau,2017-01-13 21:27:00,26,9,820019338874880000
"My office is accepting applications for legislative, communications and judicial internships. Apply online: http://bit.ly/SenTillisInternship …pic.twitter.com/Ci8XLbaPen",2017-01-13 20:40:40,14,16,820007680672727042
"Thanks for your tireless efforts to bring justice to these veterans, and to @DeptVetAffairs for granting disability benefits to the victims.https://twitter.com/SenatorBurr/status/819919990858088448 …",2017-01-13 16:30:43,26,10,819944776447430656
Check out some of my favorite photos from the 114th Congress in my latest e-newsletter: http://bit.ly/BestOf114thCongress …pic.twitter.com/D4MPlOwvYz,2017-01-13 16:01:03,8,5,819937310645088262
"Thanks for passing this message along, Amanda! I'm glad Nick was able to help you.",2017-01-12 22:45:37,0,0,819676737516736512
"Thank you, @VP Biden, for your dedicated service to our nation and leadership of the Cancer Moonshot initiative. I wish you all the best!",2017-01-12 21:25:33,83,8,819656587866476545
I am committed to repealing AND replacing #Obamacare. Thanks for contacting my office!,2017-01-12 18:58:33,4,1,819619591718572036
"Sorry, our phones have been ringing off the hook in DC. I'm glad you reached my Raleigh office! http://bit.ly/TillisEmail ",2017-01-12 18:54:10,0,0,819618489161973764
Republicans are committed to fulfilling the promise of affordable health care for every American by repealing and replacing #Obamacare.pic.twitter.com/cz14j6L3yz,2017-01-12 17:55:10,215,113,819603642567294976
"This morning, the Senate passed the #Obamacare repeal resolution that allows the Senate to begin the repeal and replace process.",2017-01-12 15:12:56,24,11,819562815740674048
Dr. Shulkin has demonstrated his commitment to reforming the #VA. He will work to ensure veterans receive timely and quality health care.pic.twitter.com/Z2QrVGoMcm,2017-01-11 22:10:46,25,12,819305579990700032
Deadline extended: @fema registration for Hurricane Matthew disaster assistance has been extended to Jan. 23 http://www.disasterassistance.gov pic.twitter.com/skxcrRKPAy,2017-01-09 22:58:45,11,9,818592877102055426
"My op-ed with Senator @ChrisCoons on #CJReform: America's criminal justice system is broken http://cnn.it/2jmBUgZ 

 via @CNN @CNNOpinionpic.twitter.com/Mm0iI8Ilz6",2017-01-09 21:53:58,29,18,818576576203735041
Courtney is a legislative all-star whose work ethic and passion for public policy is unmatched. http://bit.ly/2ib9xVr https://twitter.com/rollcall/status/818477443161948162 …,2017-01-09 17:42:44,14,8,818513351810674688
Saddened to hear the news out of #Orlando. Another tragic reminder of the dangers our law enforcement officers face every single day.,2017-01-09 16:17:01,31,15,818491779871805440
RT to #thankacop on National Law Enforcement Day. #SupportBluepic.twitter.com/z3VTNY4Bvg,2017-01-09 14:53:38,39,40,818470792350625795
I will be speaking to @MariaBartiromo on @SundayFutures at 10:10am about cyber security and the upcoming nomination hearings.Tune in!,2017-01-08 14:53:48,84,12,818108446809747456
"Monday, January 9 is the deadline to apply for disaster assistance.https://twitter.com/fema/status/786675743531081728 …",2017-01-07 20:30:05,5,8,817830687952740356
Thank you to the dedicated crews @NCDOT for their hard work to clear the roadways. #ncwxhttps://twitter.com/ncdot/status/817770499644260356 …,2017-01-07 17:54:18,30,10,817791486129565698
Too many families are familiar with the devastation of drug addiction. It's a growing epidemic we must all work together to stop.https://twitter.com/myfox8/status/816433102184652800 …,2017-01-07 16:30:00,18,4,817770272052875265
A snowy Saturday in North Carolina. Stay warm and be safe! Follow @NCEmergency & @NCDOT for updates.  #ncwxpic.twitter.com/hZeLwNQd0Y,2017-01-07 15:31:59,38,7,817755671252922368
Don't miss the Dec. 9 deadline to apply with @fema for federal disaster assistance from Hurricane Matthew: http://DisasterAssistance.gov pic.twitter.com/dM2UlQ9OXP,2017-01-06 22:29:53,4,1,817498451776860161
Please continue to keep Senator @KayHagan and her family in your thoughts and prayers. Susan and I are praying she makes a full recovery.https://twitter.com/NewsandRecord/status/817482720712474628 …,2017-01-06 21:28:31,52,22,817483005744836610
Praying for the families of the victims and everyone at the #FortLauderdale airport. #FLL,2017-01-06 20:14:26,23,6,817464361866379265
Met with #SecDef nominee General James #Mattis. I look forward to his confirmation and working together on behalf of our nation's military.pic.twitter.com/A9WCfuDdup,2017-01-06 17:37:10,63,23,817424783730180096
"2 yrs ago today, I had the honor of being sworn in as NC's US Senator. I look forward to continuing to work on behalf of each of you. #ncpolhttps://twitter.com/SenThomTillis/status/552571031588966401 …",2017-01-05 17:33:24,47,19,817061449357004800
Watch live: #SASC hearing on foreign cyber threats to the US - http://bit.ly/2ivGaxD ,2017-01-05 16:40:00,8,6,817048010123280385
"Americans deserve access to quality, affordable health care. The Obamacare status quo is unsustainable. #RepealObamacarepic.twitter.com/dI3USktfr2",2017-01-04 18:13:13,28,15,816709083323629574
The election was not a Republican mandate. The election was a results mandate.https://twitter.com/politico/status/816596311256535040 …,2017-01-04 15:48:27,19,10,816672648142929921
.@89SteveSmith Thanks for the great memories and enjoy retirement. #FarewellAgent89 #KeepPoundinghttps://twitter.com/Panthers/status/815975227855433728 …,2017-01-03 22:59:58,8,3,816418855878885376
Congrats to my friend @SenatorBurr on being sworn in for his third term. I look forward to continuing to serve North Carolinians together.https://twitter.com/SenatorBurr/status/816325022570659840 …,2017-01-03 16:54:45,31,7,816326946443456512
Susan and I wish you a Happy New Year!pic.twitter.com/m6MkXKKWiF,2017-01-01 05:01:03,28,7,815422562578493440
Read more on my call for commonsense reforms to our broken immigration system: http://bit.ly/2i5LZPA pic.twitter.com/B5KtLyFlG7,2016-12-30 16:00:02,7,6,814863625496104960
I joined @SenGillibrand to ensure military families have access to autism therapy for their children. http://bit.ly/SupportMilFams pic.twitter.com/RlDijY3Xff,2016-12-29 17:00:07,13,7,814516359354646528
I'm calling on other states to join NC in creating their own compensation programs for living eugenics victims. http://bit.ly/2h6cqCX pic.twitter.com/PHVJG0LUlB,2016-12-29 14:30:02,7,5,814478590653833218
My statement in response to Secretary of State John Kerry’s speech regarding Israel.pic.twitter.com/3B7aDBYjr7,2016-12-29 01:41:44,97,190,814285240235687936
Congrats @WakeFB on winning the @MilitaryBowl! #GoDeacs #MilitaryBowlhttps://twitter.com/militarybowl/status/813897798286540800 …,2016-12-28 03:21:01,53,9,813947837218168832
"Instead of continuing bipartisan tradition of supporting Israel, the President turned his back at a time they needed our help the most.",2016-12-27 17:50:01,27,13,813804140832772096
President Obama's refusal to stand up for Israel at the U.N. was nothing short of shameful.,2016-12-27 17:48:01,33,13,813803635599556608
I believe we need laws that are tough on crime and smart on rehabilitation. Pursuing #CJReform(s) will be one of my top priorities.pic.twitter.com/iD6bGtZ3lG,2016-12-27 17:36:08,16,6,813800644565995520
"Congratulations, @PackFootball, on winning the @IndyBowl! #BowlSTATEmenthttps://twitter.com/packfootball/status/813561502850551808 …",2016-12-27 02:19:50,28,5,813570050993098752
Susan and I wish you a Merry Christmas and Happy Holidays!pic.twitter.com/5ByGU8bbyG,2016-12-25 13:30:11,53,8,813013976992907265
Read my Op-Ed in the @fayobserver about securing over $300 million for Hurricane Matthew relief efforts.http://bit.ly/FayObserverOp-Ed …,2016-12-21 19:13:51,6,9,811650910631952384
Spent time with @24thMEU during pre-deployment training aboard USS Bataan & USS Mesa Verde. Wishing each Sailor & Marine a safe deployment.pic.twitter.com/1k7xNYOStC,2016-12-20 20:14:37,15,8,811303814078857216
".@craigderoche's op-ed: On criminal justice issues at least, principles are trumping partisanship http://bit.ly/2h6LnL9  via @newsobserver",2016-12-20 17:36:52,2,2,811264117566803968
"Provision would help military kids with #autism http://buff.ly/2i2aDnm  #milkids 

via @fayobserver @DrewBrooks",2016-12-19 19:34:46,6,5,810931399826018305
Congrats @AppState_FB on winning the #CamelliaBowl! #DefineTheMomenthttps://twitter.com/appstatesports/status/810304225095938048 …,2016-12-18 02:17:19,13,6,810307926799818753
I had the honor of greeting our nation's troops on their way home for the holidays during @USOofNC's Operation Exodus @CLTAirport.pic.twitter.com/r5PvvIIkba,2016-12-17 17:25:27,35,13,810174077373550592
North Carolinians affected by Hurricane Matthew have until Jan. 9 to apply w/ @fema for federal disaster assistance:http://DisasterAssistance.gov ,2016-12-16 15:50:53,2,8,809787893636075520
I joined @SenGillibrand to Secure #Autism Care Demonstration Program For #Military Families In The NDAA http://bit.ly/NDAA-AutismCare pic.twitter.com/RYQjHw66pV,2016-12-15 19:10:20,9,5,809475700331835392
I'm glad we were able to secure over $300M in recovery assistance to help North Carolinians:http://bit.ly/SenatePassesCR ,2016-12-15 18:37:56,0,0,809467543752540160
.@CameronNewton thank you for giving back to the Charlotte community!https://twitter.com/CameronNewton/status/808801457550086144 …,2016-12-14 15:26:10,10,5,809056897135505408
RT to wish the @NationalGuard a Happy 380th Birthday! #WeAreGuard,2016-12-13 12:46:37,26,20,808654357495484416
"My Op-ed: We must be more proactive on #wildfire prevention http://buff.ly/2gEXRJL 

via @asheville Citizen-Timespic.twitter.com/JxWZkQj530",2016-12-13 01:00:37,11,10,808476686220218368
North Carolina to get $300M in Matthew recovery assistance http://buff.ly/2gS6uOO  via @wsoctv,2016-12-12 20:30:21,9,4,808408673005555712
Please join Susan and me in praying for @KayHagan and her family. Wishing her a speedy recovery back to good health.http://www.theledger.com/news/20161209/kay-hagan-former-us-senator-and-lakeland-resident-in-hospital …,2016-12-10 14:40:16,76,36,807595793179955200
"Earlier this week, I spoke on the Senate floor to give an update on North Carolina's recovery from Hurricane Matthew. #NCRecoverspic.twitter.com/vtR5PmjCao",2016-12-09 18:20:02,12,8,807288714460172293
"The Cures Act gives additional money to fight the nationwide opioid crisis, which has hit communities in NC particularly hard. #CuresNowpic.twitter.com/fyg4C1BtQ5",2016-12-09 16:19:58,13,8,807258499176693760
The NDAA reaffirms our nation’s commitment to supporting our servicemembers and caring for our military families. http://buff.ly/2gpK3CK pic.twitter.com/CJt6ektMbZ,2016-12-09 13:35:01,4,4,807216985960566784
"John Glenn: Astronaut, U.S. Senator & Marine. I'm grateful for his lifetime of service to our nation, and send my condolences to his family.",2016-12-08 21:21:31,31,7,806971995162312704
"Our list is closed, and all of our tickets have been allocated. Thank you for reaching out.",2016-12-08 20:13:27,0,0,806954868350955520
Yesterday I had the opportunity to deliver gifts to @USMC and @ToysForTots_USA. Glad my office could participate this holiday season!pic.twitter.com/n1jy4pQCKA,2016-12-08 19:04:03,22,10,806937402904170496
Congratulations @SenTomCotton!https://twitter.com/HeardontheHill/status/806904852836188161 …,2016-12-08 16:57:49,7,4,806905634486624256
It was great meeting with Senator-elect @KamalaHarris yesterday. I look forward to working with her in the 115th Congress!pic.twitter.com/BEBr2cDALY,2016-12-08 15:36:20,112,19,806885129549475840
The Hurricane Matthew recovery assistance for North Carolina includes more than $300 million in funding. http://bit.ly/HurricaneAssistanceCR …pic.twitter.com/1GVCplRqLs,2016-12-08 12:45:05,14,9,806842031926546432
North Carolina’s Hurricane Matthew recovery effort is set to get big boost from Congress http://buff.ly/2gc4bEZ  via @theobserverpic.twitter.com/v7CcAVCSg7,2016-12-08 01:29:59,17,10,806672136974778378
Speaking on the Senate floor about Hurricane Matthew recovery. Watch live: https://www.c-span.org/networks/?channel=c-span-2 … #NCRecovers,2016-12-07 22:44:15,7,6,806630430191521792
Sen. Tillis Pushes Criminal Justice Reform http://buff.ly/2hkHT4T  via @TWCNewsRDU @BonitiTWCNews,2016-12-07 22:05:03,9,7,806620562692915200
Please join me to raise awareness for Ellie and this awful degenerative brain disease. Go to http://acureforellie.org/  for info.,2016-12-07 20:42:38,7,9,806599821712912385
".@SteveDaines, here is my attempt at #TheEllieChallenge. @CoryBooker, @SenDanSullivan, @SenCapito, can you do better than I did?pic.twitter.com/r5iUWjCT5x",2016-12-07 20:36:35,9,7,806598302330286080
.@KellyAyotte will be greatly missed in the Senate. It's been an honor serving with her and I wish her all the best in her future endeavors.,2016-12-07 17:29:03,16,3,806551106402783233
It was an honor working with @SenatorBarb to protect small businesses in Maryland and North Carolina.https://twitter.com/SenateMajLdr/status/806510782942998528 …,2016-12-07 15:00:49,5,2,806513802133073923
"On the 75th anniversary of the attacks on Pearl Harbor, take a moment to remember the lives lost that day and all who served in WWII.pic.twitter.com/7E3FUFUsUB",2016-12-07 14:21:29,21,19,806503904359972864
Congratulations @AppState_FB on reaching the @CamelliaBowl! #AppNation #OneCarolinahttps://twitter.com/CamelliaBowl/status/805504501667004416 …,2016-12-06 19:38:26,5,2,806221279682560001
It was great meeting with you today!https://twitter.com/moblum/status/806179403596185604 …,2016-12-06 17:30:33,7,2,806189095961694208
Congratulations to @WakeFB for being selected to play in this years @MilitaryBowl! #GoDeacshttps://twitter.com/MilitaryBowl/status/805509230820204548 …,2016-12-06 15:09:36,8,7,806153625529622528
Thank you to @NCFarmBureau for letting me speak at the NCFB Annual Meeting this morning. #NCFB16pic.twitter.com/k6saYFLikr,2016-12-05 20:55:26,15,5,805878267106525184
My statement on the North Carolina Gubernatorial Election: http://bit.ly/GubernatorialElection …pic.twitter.com/fA1nregrH0,2016-12-05 19:24:20,13,9,805855344740225024
Congratulations to North Carolina native and @EastCarolina alum @HV3_Golf on winning the @PGAofAustralia Championship!https://twitter.com/PGATOUR/status/805287470850043904 …,2016-12-05 17:06:46,26,14,805820723776393216
"Tillis, @SenRonJohnson Request President Obama to Implement Hiring Freeze During Transition http://bit.ly/hiringfreeze pic.twitter.com/9Y3JkJTDMM",2016-12-02 20:07:04,8,7,804778935439552513
I look forward to working with him to rebuild & modernize our military and support NC’s strategically vital military installations.,2016-12-02 03:35:57,16,9,804529509831737346
General Mattis is an outstanding choice for Secretary of Defense. Few living military leaders are as widely regarded and highly respected.,2016-12-02 03:34:38,73,33,804529177542193156
"Thank you! I agree, @susantillis is wonderfully caring and beautiful. I am very blessed.",2016-12-01 23:53:16,1,0,804473472831332356
"I voted to extend sanctions on #Iran until 2026, protecting the American people from one of the world's largest state sponsors of terrorism.",2016-12-01 22:33:56,64,28,804453504509046785
Susan and I are praying for the @raleighpolice officer who was shot responding to a burglary call and hope for a speedy recovery.https://twitter.com/ABC11_WTVD/status/804096604386885632 …,2016-12-01 16:50:54,16,7,804367177310736384
Praying for the family of the Tacoma officer killed in the line of duty. We can't forget the risks officers take everyday to keep us safe.pic.twitter.com/JqAOUsBrrv,2016-12-01 12:57:18,35,11,804308392156299264
"Happy Birthday to my friend and colleague, @SenatorBurr!pic.twitter.com/idhoElTuog",2016-11-30 19:33:34,22,5,804045729324994560
It's time to tell the far right & far left to get productive or get out of the way. [regarding criminal justice reform] #WPJustice @postlive,2016-11-30 15:09:33,57,40,803979287388770304
LiVE: Chatting with @cherylwt and Senator @ChrisCoons about criminal justice reform and juvenile justice. WATCH: http://wapo.st/justice pic.twitter.com/ZFss4N3xbH,2016-11-30 14:52:48,3,4,803975071400345600
My deepest condolences to @elonuniversity and the family of President Emeritus J. Earl Danieley. https://twitter.com/elonuniversity/status/803720307731206145 …,2016-11-29 22:16:08,36,19,803724249978507264
My deepest condolences go out to his family and friends.,2016-11-29 16:45:08,3,0,803640953110228993
