Text,Date,Favorites,Retweets,Tweet ID
"I co-sponsored bipartisan legislation (Fix NICS Act) with Senators @JohnCornyn, @ChrisMurphyCT, @SenatorTimScott and @SenBlumenthal to enhance compliance and ensure the accuracy of the existing background check system for firearms purchases.https://www.tillis.senate.gov/public/index.cfm/press-releases?ID=833664CA-A7F8-409B-840E-DC4C14E361D0 …",2017-11-30 20:34:06,25,6,936332530428645378
"Agreed, @SpeakerRyan. #SenateJudiciary
@SenatorLeahy
@ChrisCoons
@amyklobuchar
@SenWhitehouse
@SenFranken
@SenBlumenthal
@maziehironohttps://twitter.com/sarahnferris/status/936272862062759936 …",2017-11-30 17:00:21,12,7,936278740862230533
"We're now one step closer to providing historic tax relief to hardworking Americans, growing our economy, raising wages, and creating jobs. I'm looking forward to a full debate in the Senate. #TaxReform",2017-11-29 23:29:49,111,22,936014365869969410
"TODAY at 10:15am: #TaxReform event highlighting the positive impact of changing the tax code.

Who: @sendavidperdue @SenDeanHeller @Marcshort45 @AFPhq @imjamesdavis @FreedomPartners @carriesheffield @GenOpp @danielggarza @LIBREinitiative

Watch Live: https://www.facebook.com/SenateGOP/videos/10155814486369360/ …",2017-11-29 14:50:25,53,25,935883652176711685
"I applaud @BudgetGOP for passing the Tax Cuts & Jobs Act out of committee. We are now one step closer to bigger paychecks for middle-class workers and families, more American jobs and a stronger U.S. economy. #TaxReform",2017-11-28 20:07:02,153,40,935600943831420929
#TaxReform in North Carolina worked. We're now the #1 state in the country for business. #ncpol #ncgahttps://twitter.com/kbadenhausen/status/935527787712204802 …,2017-11-28 17:01:16,123,52,935554196010618883
I enjoyed our conversation and appreciated the tough questions. You have a bright group of students in your class!,2017-11-28 15:31:45,4,3,935531666449281029
"The Tax Cuts & Jobs Act will provide historic tax relief to hardworking Americans, grow our economy, raise wages, and create jobs. #TaxReformpic.twitter.com/mpCTL4P96e",2017-11-27 18:18:36,78,26,935211269195550720
Over 29 million #smallbusinesses in the US support our local economies every day. Let's support them today and #shopsmall. #smallbizsatpic.twitter.com/SXG54G9TGf,2017-11-25 13:36:24,48,22,934415475777392640
"Susan and I wish you a #HappyThanksgiving from our family to yours! We have a lot to be thankful for this year, including our new granddaughter Sawyer. We are also forever grateful to the men and women in uniform serving our country.pic.twitter.com/e25jP0BCZL",2017-11-23 14:46:59,84,13,933708462051221505
"Our #veterans learn a vast array of skills while bravely serving our country, and we should make opportunities to use those skills in the private sector as accessible as possible.https://www.tillis.senate.gov/public/index.cfm/videos-2?id=6F1E3F67-8659-44B8-8DC3-086B8DA25A14 …",2017-11-22 17:26:57,13,6,933386330893180929
I applaud the President for quickly signing this commonsense legislation into law to reduce burdensome requirements on businesses so apprenticeship programs become more available to veterans moving forward.,2017-11-22 17:26:19,16,9,933386170083442688
The Veteran Apprenticeship and Labor Opportunity Reform (VALOR) Act will increase access by streamlining the certification process for non-federal apprenticeship programs based in more than one state. https://www.tillis.senate.gov/public/index.cfm/videos-2?id=6F1E3F67-8659-44B8-8DC3-086B8DA25A14 …,2017-11-22 17:25:37,16,11,933385996623908864
Great news — @POTUS signed the VALOR Act into law today. This law will increase access to apprenticeship-training programs for #veterans.https://twitter.com/senthomtillis/status/932667231305125889 …,2017-11-21 23:38:04,431,265,933117339289108481
"On this day in 1789, #NorthCarolina ratified the U.S. Constitution to become the 12th state in the Union. Happy 228th Birthday, NC!pic.twitter.com/PqjtsITuxz",2017-11-21 15:57:02,152,83,933001313075519488
"I applaud Congress for passing the VALOR Act, legislation I introduced with @SenTomCotton, to reduce burdensome requirements on businesses so apprenticeship programs will be more accessible to #veterans.https://www.tillis.senate.gov/public/index.cfm/press-releases?id=4204B278-5899-4052-80DB-BC9C8A7DD2B2 …",2017-11-20 17:49:30,53,34,932667231305125889
"Fayetteville native Robert Wilkie confirmed by unanimous consent by U.S. Senate http://www.fayobserver.com/news/20171116/fayetteville-native-robert-wilkie-confirmed-by-unanimous-consent-by-us-senate …

via @fayobserver @DrewBrooks",2017-11-17 20:09:40,15,9,931615341293301761
Proud the #Senate unanimously confirmed my Senior Advisor Robert Wilkie as Under Secretary of Defense for Personnel and Readiness. #defensepic.twitter.com/RXHvDGtg84,2017-11-17 02:05:10,55,22,931342416539537413
"I want to thank my colleagues on the #SASC for this bipartisan effort that will positively affect our North Carolina installations, servicemembers, and military families. #NDAAhttps://www.tillis.senate.gov/public/index.cfm/press-releases?id=33070466-3A2E-48C0-9C56-CED34CBACE58 …",2017-11-16 21:45:37,4,6,931277097603162112
"I’m pleased that my provisions to upgrade @camp_lejeune and Cherry Point, improve military family readiness, and direct the DoD & VA to collaborate closely on establishing interoperability with the new Electronic Health Record are included.",2017-11-16 21:44:52,11,9,931276909484191744
The Senate passage of the #NDAA reaffirms our nation’s commitment to supporting the brave men and women in uniform and reestablishes America’s commitment to a strong national defense and protecting its interest abroad.https://www.tillis.senate.gov/public/index.cfm/press-releases?id=33070466-3A2E-48C0-9C56-CED34CBACE58 …,2017-11-16 21:43:52,8,9,931276658530770946
"Pancreatic cancer is the #3 cause of cancer-related death in the U.S., and there is no effective early detection screening tool, 71% of patients die within one year of diagnosis. Today, I'm wearing purple for World Pancreatic Cancer Day. #PANCaware #WPCDpic.twitter.com/gFt7NRWXwT",2017-11-16 18:01:00,195,50,931220574801661953
Thank you!,2017-11-15 19:24:39,1,0,930879238147837954
"Thank you, @SenatorRounds!",2017-11-15 19:09:32,2,3,930875430919458816
"Susan and I recently welcomed our first grandchild, Sawyer Marie, into the world. We love her so much!pic.twitter.com/LZh8YAWSfh",2017-11-15 18:53:07,1752,65,930871302398857222
"Chairing a @HelsinkiComm hearing on Turkey’s detention of U.S. citizens, including North Carolina native Andrew Brunson. Watch the hearing live: http://www.senate.gov/isvp/?type=live&comm=csce&filename=csce111517 …",2017-11-15 14:33:06,49,63,930805867225550848
"As a caregiver for my grandmother, I know firsthand the important role of caregivers in the lives of those battling Alzheimer's disease. #HonorACaregiver #NationalFamilyCaregiversMonthhttps://twitter.com/alzassociation/status/930551345534394369 …",2017-11-14 23:37:13,67,15,930580407384461313
The allegations leveled at Roy Moore are disturbing. I have serious concerns about his prior conduct and fitness for office. He should immediately withdraw from the race.,2017-11-13 22:13:26,10689,2537,930196937319632897
"#NorthCarolina under the Senate’s Tax Cuts and Jobs Act:

Estimated Jobs Added: 27,763

Estimated Gain in After-Tax Income for Middle-Income Family: $2,366

#TaxReformhttps://twitter.com/GOPSenFinance/status/930141387818971136 …",2017-11-13 18:59:32,21,15,930148140140855297
My op-ed via @fayobserver: A helping hand for veterans http://www.fayobserver.com/opinion/20171109/thom-tillis-helping-hand-for-veterans … #VeteransDay,2017-11-11 18:10:13,10,8,929410951186731008
"This #VeteransDay, make an extra effort to #ThankAVeteran and their family for their service to this great nation. We'll never be able to fully repay the debt that we owe them, but we can make a lot of installments as individual citizens to show our gratitude.pic.twitter.com/YyUI7ElNJL",2017-11-11 14:49:57,62,20,929360553738457088
Honored to receive the @USChamber Spirit of Enterprise Award at today's @USChamberCCMC @cltchamber event. #FinancingGrowthpic.twitter.com/BfS4JaT124,2017-11-10 20:17:05,18,7,929080492162519040
"Thank you @cltchamber @QuaadmanT @USChamberCCMC for hosting the #FinancingGrowth #RestoreMainStreetLending discussion in Charlotte. 

We have to pass #TaxReform. This is the future of this nation.pic.twitter.com/n5DHwJJAWV",2017-11-10 18:44:53,4,9,929057290069606400
"This will have an immediate impact on the national economy and growth. If we fail to produce a #TaxReform outcome, it will have an immediate and proportionately negative impact on the economy. #FinancingGrowth #RestoreMainStreetLending",2017-11-10 18:06:53,29,14,929047726565838849
"LIVE with @USChamberCCMC @QuaadmanT @cltchamber: http://bit.ly/2hji0EE 
#TaxReform
""The House created a good baseline for tax reform. We need to produce a result. Period. End of story. We need to do it long before Christmas."" #FinancingGrowth #RestoreMainStreetLending",2017-11-10 18:02:24,3,6,929046597647982602
"LIVE w/ @USChamberCCMC @QuaadmanT: http://bit.ly/2hji0EE 

""The way that we’re going to get to a sustained year over year GDP growth that will let us retire the debt, improve standard of living, get wages where they need to be, we have to have productive jobs."" #FinancingGrowth",2017-11-10 17:57:11,2,4,929045284679815172
Tune in at 12:30: I'll join @USChamberCCMC @QuaadmanT @cltchamber to discuss proposals to #RestoreMainStreetLending #FinancingGrowth http://www.facebook.com/uschamber/ ,2017-11-10 17:26:04,2,5,929037452605566977
"“Some people spend an entire lifetime wondering if they made a difference in the world. But, the #Marines don't have that problem.”―President Ronald Reagan

Happy 242nd Birthday, @USMC! NC is the proud home of @camp_lejeune, MCAS Cherry Point & MCAS New River. #USMChttps://twitter.com/USMC/status/927520956616077313 …",2017-11-10 12:58:29,60,20,928970114476756993
My statement on the Senate’s Tax Cuts and Jobs Act http://bit.ly/2ApBAH1  #TaxReformpic.twitter.com/eNL6YlFAyd,2017-11-09 22:57:34,15,11,928758492437078017
"As co-chair of the Senate Human Rights Caucus, I urged POTUS to address human rights concerns during his trip to Asia. We must continue to stand up for those oppressed across the world & raise concern with those violating human rights & democratic values. http://bit.ly/2zqPxYj pic.twitter.com/zT5drjqI6O",2017-11-09 21:59:32,34,10,928743884989050880
"My op-ed via @thehill: Congress needs to protect veterans from bad actors in VA home loan refinancing 

As we celebrate #VeteransDay, we should work to make sure this benefit is truly beneficial for #veterans and their families.http://bit.ly/2zrd3o4 ",2017-11-09 19:24:25,13,10,928704850166206465
"Loved their costumes at the #bipawtisan Halloween party. Well done, #TeamBurr!pic.twitter.com/A5yguQESR8",2017-11-09 16:43:48,20,3,928664429075599360
Congratulations to @947_QDR from #Raleigh: Large Market Station of the Year at the #CMAawardspic.twitter.com/G7knGvF7sI,2017-11-09 16:39:01,16,3,928663227533332482
"NC is home to over 790,000 veterans. On #VeteransDay, take the time to thank a veteran and their families for their service and sacrifice.pic.twitter.com/FresBPhZJA",2017-11-08 21:50:39,103,29,928379261358149632
"Proud to intro legislation w/ @amyklobuchar & @ChuckGrassley to aid in locating missing Autism, Alzheimer’s patients http://bit.ly/2hPSUxV pic.twitter.com/sgLOLvpuTV",2017-11-07 22:12:17,27,8,928022317837488128
Wishing a very happy 99th birthday to @BillyGraham!https://twitter.com/Franklin_Graham/status/927899339351117824 …,2017-11-07 18:59:34,33,9,927973821222719488
"My prayers are with the First Baptist Church and the community of Sutherland Springs, TX. What a horrific tragedy.",2017-11-05 20:18:44,340,66,927268969404358656
I applaud @POTUS for selecting Jerome Powell as the next Federal Reserve Chair & look forward to considering his nomination.,2017-11-02 21:24:17,44,9,926198300134457345
My full statement on the Tax Cuts and Jobs Act: http://bit.ly/2hylR0Y  #TaxReformpic.twitter.com/a7v4AmW7Is,2017-11-02 18:50:04,5,8,926159490193301504
I can think of no one more qualified for the position of Under Secretary of Defense for Personnel and Readiness than Robert Wilkie. #SASCpic.twitter.com/7GnVVsklzA,2017-11-02 18:05:00,21,17,926148150028652544
"Corporal Chesty XIV, official @USMC mascot, visited my office this week. The #Marines will celebrate their 242nd birthday on Nov 10. #USMCpic.twitter.com/kln8G6T2YY – at Dirksen Senate Building",2017-11-02 16:47:29,34,9,926128641981009921
Proud to intro Robert Wilkie for his nomination as Under Sec of Defense for Personnel & Readiness. Live @ 10: http://bit.ly/2h470hO  #SASC,2017-11-02 13:50:45,16,5,926084166034305024
Susan & I send our condolences to the Cecil family. William's contribution to the @BiltmoreEstate & Asheville community won't be forgotten.https://twitter.com/asheville/status/925423152544575488 …,2017-11-01 21:20:38,19,4,925834992483209216
"The results are in, and the winner of the #bipawtisan Senate Halloween Costume Celebration was @SenatorFischer's dog Fred (beanie baby)!https://twitter.com/AlexGangitano/status/925474163988590593 …",2017-11-01 14:11:16,66,24,925726942527217664
Thanks for attending!,2017-11-01 13:58:24,3,1,925723704004358146
Definitely one of my favorites from the #bipawtisan costume party!,2017-11-01 13:46:05,3,1,925720604585680897
Thanks to everyone who attended the #bipawtisan Halloween dog costume celebration!pic.twitter.com/j9oXXhFKTT,2017-10-31 22:42:34,158,44,925493226102026240
"Praying for #NYC. A terrible, senseless act that appears to be terrorism. Thank you to NYC first responders. #NYCBravest #NYCFinesthttps://twitter.com/AP/status/925464358943182849 …",2017-10-31 21:06:25,38,13,925469029401276416
"Agreed. What say you, @jaketapper?https://twitter.com/senatorshoshana/status/925349114262577152 …",2017-10-31 13:37:10,56,6,925355971962122240
"Susan and I are praying for your husband and family, @clairecmc.https://twitter.com/clairecmc/status/924969972169834497 …",2017-10-30 15:42:31,104,17,925025129620439040
Joined @MetLife earlier today for the Global Technology Campus groundbreaking in Cary. #jobs #ncpolpic.twitter.com/MAGiILwWmk,2017-10-27 20:37:11,10,7,924012119581962240
Rumors circulating that I’m hosting a bipartisan Senate Halloween dog costume celebration. Not rumors. It’s happening. #bipawtisanship,2017-10-26 20:32:53,2157,589,923648649447567361
"We'll look to health care providers, law enforcement, and local communities in helping provide an effective response to the #opioidepidemic.",2017-10-26 19:46:48,14,6,923637051270025217
"The #opioidepidemic is a bipartisan effort that requires working together & improving coordination between fed, state & local governments.",2017-10-26 19:45:04,18,8,923636618355007489
I applaud @POTUS' declaration of the #opioidepidemic as a public health emergency that requires an all-hands-on-deck approach.,2017-10-26 19:40:35,60,18,923635487570563072
"Congrats, Regan, a finalist for the nation’s most prestigious science competition for middle school students: Broadcom MASTERS. #brcmmasterspic.twitter.com/4ep8CZAiKq",2017-10-25 21:42:34,58,12,923303798231224327
Congress needs to recognize that we have a historic opportunity to pass #TaxReform and turn this economy around.pic.twitter.com/Xu53pkL2lQ,2017-10-25 20:12:20,381,142,923281091678568448
Ready for lunch with POTUS and @SenateGOP.pic.twitter.com/gtrZqgDD9e,2017-10-24 16:43:29,3627,1215,922866143790026753
"Joining @TeamCavuto live on @FoxBusiness at 12:15pm ET to talk #TaxReform, tune in!",2017-10-24 16:01:16,7,5,922855518942711809
"With the passage of the budget, we can now get to work on #TaxReform that will have a meaningful and lasting impact on the American people.https://twitter.com/senthomtillis/status/921133861106536449 …",2017-10-20 02:11:40,56,19,921197191028408321
I am committed to passing the budget so we can deliver #TaxReform for the American people.pic.twitter.com/x1seZTRBbl,2017-10-19 22:00:00,55,28,921133861106536449
https://twitter.com/wsjopinion/status/921097917577998336 …,2017-10-19 21:24:28,83,40,921124917659226112
General Kelly is a true patriot. We can never forget the servicemembers who make the ultimate sacrifice & we must support Gold Star families,2017-10-19 19:52:40,150,37,921101816573685760
"Yesterday, in @senjudiciary hearing, I questioned Attorney General Sessions about ending Operation Chokepoint and the phase-out of DACA.pic.twitter.com/FyIX3Z2LID",2017-10-19 17:45:00,8,10,921069688112607233
This law will prevent elder abuse and strengthen penalties against those who try to take advantage of our senior citizens.,2017-10-19 15:40:02,19,7,921038237765898240
"Proud this bipartisan legislation, The Elder Abuse Prevention and Protection Act of 2017, is now law.https://www.tillis.senate.gov/public/index.cfm/press-releases?id=3ACC8EFC-A191-45A0-953A-C0C711E324C4 …",2017-10-19 15:39:39,28,12,921038142085435393
I hope all members accept that perfect legislation doesn’t happen but good legislation that moves our country forward can happen. #TaxReformpic.twitter.com/PIqQ2Ddkb5,2017-10-18 21:11:44,121,20,920759323810287616
I look forward to meeting her and discussing her priorities for @DHSgov and keeping our nation secure.,2017-10-11 22:56:05,12,3,918248868634128385
.@realDonaldTrump's nomination of Kirstjen Nielsen demonstrates admin's commitment to cybersecurity. Proven experience & widely respected.,2017-10-11 22:54:55,141,48,918248574776938496
"Friday, October 13: Don't miss the deadline for a Spring internship in my DC or NC offices: https://www.tillis.senate.gov/public/index.cfm/internships …pic.twitter.com/SPBtPhWk9X",2017-10-10 17:50:12,8,7,917809505882312705
This is a tragic reminder of the dangers first responders face each day. We are praying for the Hensley family during this difficult time.,2017-10-10 14:12:40,12,5,917754761331576832
Susan and I send our deepest condolences to Firefighter Hensley's family and the @TripleCommunity Fire Department.https://twitter.com/MNH_RyanW/status/917381283667415042 …,2017-10-10 14:10:55,17,7,917754320787070976
"Staff Sgt. Black, Staff Sgt. Johnson, and Staff Sgt. Wright's sacrifices will not be forgotten.",2017-10-06 17:51:59,22,9,916360400580595712
This is a tragic reminder of the dangers facing our brave servicemembers as they combat terrorism across the globe to keep our country safe.,2017-10-06 17:51:22,17,7,916360244216913920
"My thoughts and prayers are with the @FtBraggNC community and the families of Staff Sgt. Black, Staff Sgt. Johnson, and Staff Sgt. Wright.https://twitter.com/fayobserver/status/916329964198334464 …",2017-10-06 16:50:55,58,27,916345034785599492
"Proud to honor Bradley Gordon & Ashley Morrison of Mebane, NC @CCAInstitute #adoptionangels ceremony. http://www.ccainstitute.org/congress-engage/angels/angels-in-adoption-congress …pic.twitter.com/qoAFKnOoEc",2017-10-06 14:25:41,12,4,916308484878159873
Proud to cosponsor the Pain-Capable Unborn Child Protection Act. #TheyFeelPain,2017-10-05 19:44:10,100,23,916026244952715264
Watch my keynote at the @NatImmForum live: http://cdn.digitalservices.online/NationalImmigrationForum/ … #LeadingtheWay17 #SUCCEEDAct,2017-10-05 16:05:38,4,4,915971251721646081
"Looking forward to speaking about the #SUCCEEDAct @NatImmForum's ""Leading the Way: A New Approach to American Immigration"" #LeadingtheWay17pic.twitter.com/y6zmllHQ8N",2017-10-05 14:51:45,26,16,915952654567854080
"Happy Birthday, Mom! I love you.pic.twitter.com/UgSyS5ayhW",2017-10-04 15:10:25,127,9,915594966973509632
FEMA releases Hurricane Matthew recovery moneyhttp://www.wral.com/fema-releases-hurricane-matthew-recovery-money/16989801/ …,2017-10-04 13:18:18,11,13,915566751454302208
Live: Senate Banking Committee with @WellsFargo CEO Tim Sloan.https://www.banking.senate.gov/public/index.cfm/hearings?ID=FE4441A6-5D3B-4C88-9637-16F9BD71DCAC …,2017-10-03 15:11:09,3,4,915232764408029185
Editorial from @nypost on the #SUCCEEDAct.http://nypost.com/2017/10/01/will-democrats-betray-the-dreamers-just-to-score-political-points/ …,2017-10-02 22:18:40,16,4,914977962403024896
My op-ed with @SenatorLankford via @WashTimes: A conservative approach to #DACAhttp://www.washingtontimes.com/news/2017/oct/1/daca-requires-a-conservative-approach/ …,2017-10-02 17:54:13,8,9,914911413193322496
Susan and I send our deepest condolences and prayers to the families of the victims of this horrific and senseless tragedy in Las Vegas.,2017-10-02 11:31:42,150,37,914815148879171584
"I joined @SenatorLankford to discuss the #SUCCEEDAct on @FoxNews, a merit-based solution to address uncertainty facing undocumented childrenpic.twitter.com/CipsKuiKGZ",2017-09-28 19:14:21,38,20,913482026694725639
"Welcome back to Capitol Hill, @SteveScalise!https://twitter.com/SteveScalise/status/913405166178783232 …",2017-09-28 15:00:15,66,11,913418079891279873
Editorial via @washingtonpost on the #SUCCEEDAct I introduced with @SenatorLankford and @senorrinhatch.https://www.washingtonpost.com/opinions/cant-we-get-this-one-thing-right/2017/09/27/d878acf6-a3ab-11e7-b14f-f41773cd5a14_story.html?utm_term=.341d2e55be5c …,2017-09-28 14:33:00,18,9,913411223856836609
Joining @DanaPerino on @FoxNews @ 10:30 with @SenatorLankford to discuss the #SUCCEEDAct. Learn more about our bill: https://www.tillis.senate.gov/public/index.cfm/succeed-act …pic.twitter.com/lAPn0lLGHC,2017-09-28 02:24:23,94,35,913227859078107137
"Joining @TeamCavuto on @FoxNews to discuss #TaxReform, Healthcare & the #SUCCEEDAct I introduced with @SenatorLankford and @senorrinhatch.",2017-09-26 20:24:06,12,7,912774802074750982
"GOP senators unveil new ‘Dreamers’ bill http://www.politico.com/story/2017/09/25/dreamers-republican-new-bill-243100 … #SUCCEEDAct 

via @politico @seungminkim",2017-09-26 16:44:14,23,24,912719473110593538
"Talking to @Morning_Joe about the #SUCCEED Act, tune in!",2017-09-26 12:30:47,11,7,912655689914437632
Expedited removal only applies to those convicted of a felony/significant misdemeanor.,2017-09-25 21:20:39,17,8,912426647323676673
.@SenatorDurbin's staff let him down by not giving him the right facts. Undocumented children cannot be arbitrarily deported.https://twitter.com/seungminkim/status/912420966696984578 …,2017-09-25 21:19:27,29,13,912426346026082304
Watch live: Introducing the #SUCCEEDAct with @SenatorLankford and @senorrinhatch. https://www.youtube.com/watch?v=Sp8D5hbo8mw …pic.twitter.com/1KR8fd7u3X,2017-09-25 17:20:18,16,10,912366163291774976
".@senorrinhatch: ""We have love for these children and we're going to help them. It's just that simple."" #SUCCEEDAct",2017-09-25 17:17:46,27,11,912365522418896896
".@senorrinhatch: ""We need to develop a solution that will recognize the positive contributions that Dreamers can make to our society.""",2017-09-25 17:16:40,9,3,912365248535023617
".@SenatorLankford ""We need to resolve the issues of #immigration. This is the moment to resolve things like #bordersecurity."" #SUCCEEDAct",2017-09-25 17:12:36,5,4,912364222528540673
"The #SUCCEEDAct is based on four core principles:
Compassion.
Merit.
Prevention.
Fairness.pic.twitter.com/MFajCbLZeT",2017-09-25 17:11:00,28,20,912363820156379139
Pursue one or a combo of three merit-based pathways to earn conditional status. #SUCCEEDActpic.twitter.com/W6WIEtQbzM,2017-09-25 17:09:48,16,15,912363519487733762
"Introducing the #SUCCEEDAct w/ @SenatorLankford @senorrinhatch, a merit-based solution to address uncertainty facing undocumented children.",2017-09-25 17:06:19,8,6,912362641661861888
LIVE: Press conference with @SenatorLankford & @senorrinhatch to address the legal status of undocumented childrenhttps://www.youtube.com/watch?v=Sp8D5hbo8mw …,2017-09-25 17:05:04,15,17,912362328775172096
Thank you to all of the attendees who showed up for our Service Academy Day info session @NCState! https://www.tillis.senate.gov/public/index.cfm/academy-nominations …pic.twitter.com/qniQ4h4V56,2017-09-23 17:55:20,8,5,911650201189994496
"ICYMI: My Op-ed via @WSJopinion on #TaxReform

Tax Reform Transformed North Carolina. Congress, Take Note
http://bit.ly/2wGywbQ pic.twitter.com/rlp7rvc2jw",2017-09-22 17:40:24,33,11,911284054305144834
Saturday @NCState my office will hold an info session on how we can help you through the application process for a U.S. Service Academy.https://twitter.com/SenThomTillis/status/909054291767320578 …,2017-09-22 14:16:11,9,4,911232664459505664
Thank you to the brave men and women in the @82ndABNDiv who are fighting to keep our country safe.https://twitter.com/fayobserver/status/910832270050775040 …,2017-09-21 18:15:43,21,16,910930556929617920
"My Op-ed in @WSJ: Tax Reform Transformed North Carolina. Congress, Take Note https://www.wsj.com/articles/tax-reform-transformed-north-carolina-congress-take-note-1505948613 … #TaxReform",2017-09-21 13:15:19,34,33,910854956546129920
"A great thing?? In addition to breaking the law, 10K have died crossing border over the last 20 yrs, including kids. #StopPlayingPoliticshttps://twitter.com/allahpundit/status/910685582543618048 …",2017-09-21 02:17:20,96,40,910689371640213504
"It's great to see @ConcordNCgov, @KdaleNC, and @Morrisville_NC on the list! #BestPlacesToLivehttps://twitter.com/MONEY/status/909748880295841792 …",2017-09-20 17:34:38,11,3,910557827864948736
Watch live: @senjudiciary noms hearing to consider Thomas Farr for U.S. District Judge for Eastern District of NC. http://bit.ly/2xikN8q ,2017-09-20 14:49:19,13,18,910516226660716544
