Text,Date,Favorites,Retweets,Tweet ID
"Don't worry, I didn't see this before the Secret Santa gift exchange. Thank you, @SenatorShaheen!https://twitter.com/SenatorShaheen/status/674365808970235905 …",2015-12-09 17:15:14,2,1,674638446393221120
Happening Now: Questioning @DeptofDefense Secretary Carter and General Paul Selva: http://1.usa.gov/1NeewdE .,2015-12-09 16:48:24,0,1,674631694419390464
GOP senators to #Obama: Here’s how we could beat #ISIS via @thehill @Rebecca_H_Khttp://bit.ly/1NM9Mv6 ,2015-12-09 15:42:50,0,2,674615194107162624
9:30am: Senate Armed Services Comm hearing on US strategy to counter Islamic State & our policy toward Iraq & #Syria http://1.usa.gov/1NeewdE ,2015-12-09 14:17:01,5,3,674593597610721280
"Happy Birthday, @SenGillibrand!",2015-12-09 13:49:08,1,3,674586581286690816
"""To safeguard our own national security, we must step up the military fight against ISIS as soon as possible...""http://1.usa.gov/1NJW7EM ",2015-12-08 23:06:02,4,6,674364340456316929
"Under The Every Student Succeeds Act, states will be free to set their own standards. #FixNCLB #ESSApic.twitter.com/yz3I1WYvcG",2015-12-08 21:59:16,3,1,674347537755676672
"""Simply conducting pin-prick strikes aimed at containing ISIS isn't a strategy."" via @fayobserver http://bit.ly/1HTl2d2 ",2015-12-08 21:07:50,1,4,674334593747656705
Honored to attend the ceremony for SGT Michael Beck to get keys to his new adapted home: http://www.hfotusa.org/beck pic.twitter.com/Wp14iohnM6,2015-12-08 19:54:18,7,3,674316087429832704
.@fayobserver: Who's in charge? Ash Carter or the Air Force? http://bit.ly/1NDKiEq pic.twitter.com/beNc1VpQoC,2015-12-08 15:14:47,0,2,674245745734742016
Great to see @RaleighGov in the Top 10 of the Top 25 Best-Performing Cities for 2015. #Raleigh #NorthCarolinahttps://twitter.com/MilkenInstitute/status/674229579687571456 …,2015-12-08 14:28:08,2,4,674234004938366976
"Earlier this year, I visited #PearlHarbor and paid my respects to the 2,403 killed on Dec. 7, 1941. #PearlHarbor74pic.twitter.com/yi4EJM5bFy",2015-12-07 20:37:40,10,3,673964616821686272
Sen. Tillis wants #POTUS to advance clear strategy against Islamic State via @fayobserver http://bit.ly/1QaTJ0m pic.twitter.com/irXpdXdHNT,2015-12-07 18:11:26,2,7,673927812613595136
"Happy Birthday, @SenatorCollins and @SenThadCochran!",2015-12-07 16:13:49,1,1,673898214651797504
"""December 7, 1941 — a date which will live in infamy."" -Franklin D. Roosevelt #PearlHarbor74pic.twitter.com/FrmHIVKBdS",2015-12-07 13:52:53,13,15,673862748808355840
"#KeepPounding, @Panthers!",2015-12-07 00:56:25,14,7,673667343172689920
Wishing a Happy Hanukkah to all who celebrate this holiday!,2015-12-06 20:41:30,5,8,673603190152105986
I promised the citizens of NC that if I were elected I would do everything I could to replace and #RepealObamacare: http://bit.ly/1lCnw4X .,2015-12-04 20:30:20,8,4,672875607286411264
Editorial: Sterilization compensation: Federal bill step toward national movement http://bit.ly/1SD29LL  via @JournalNow,2015-12-04 19:45:05,0,3,672864219524542464
@rillalev I would like to meet all of you as well. Please contact my office to schedule a meeting: http://www.tillis.senate.gov/public/index.cfm/meetings ….,2015-12-04 19:03:42,2,0,672853802958110720
My Op-Ed in the @dcexaminer on fixing issues plaguing @DeptVetAffairs #healthcare system. #Veterans deserve better.http://washex.am/1OLh6dF ,2015-12-04 18:37:35,3,7,672847229464551424
"@USAFStephen Congratulations Stephen, best of luck!",2015-12-03 21:47:53,5,1,672532734468866048
@dberwyn Thank you for your support Dennis,2015-12-03 20:39:02,3,1,672515408558235648
"Yesterday, I spoke on the Senate floor about the need to repeal and replace Obamacare. #RepealObamacarehttps://www.youtube.com/watch?v=VUBwhf2JgQg …",2015-12-03 17:51:41,7,4,672473293568520193
My op-ed in the @dcexaminer: It's time to fix the issues plaguing the VAhttp://www.washingtonexaminer.com/its-time-to-fix-the-issues-plaguing-the-va/article/2577490 …,2015-12-03 16:06:10,1,6,672446736313503745
The Senate & House agreed on a hwy bill that designates Raleigh-Norfolk and US 70 corridors as future interstates:http://1.usa.gov/1O4CAQ3 ,2015-12-02 22:17:06,8,8,672177700774223872
Premiums in #NorthCarolina rose more than 25% over the last year. #RepealObamacarepic.twitter.com/wBxJ7mS0Cz,2015-12-02 17:48:24,4,9,672110078489702401
[Infographic]: The Treatment of Certain Payments in Eugenics Compensation Act: http://1.usa.gov/1RjBTaL pic.twitter.com/FeC0Tm7QJ4,2015-12-01 23:01:40,2,3,671826527290568704
My staff attended a farewell ceremony for the 105th Military Police Battalion of the @NCNationalGuard via @ashevillehttp://avlne.ws/1NilBxg ,2015-12-01 22:07:36,2,2,671812920666378241
Railey: A happy Thanksgiving weekend for sterilization survivors http://bit.ly/1N22KTD  via @JournalNow,2015-12-01 18:46:17,2,2,671762255395037184
"""More customers than ever are begging for help to find affordable health insurance."" via @theobserver http://bit.ly/1lsCsCy  #Obamacare",2015-12-01 17:00:28,1,3,671735625452683266
Senate passed legislation I introduced w/ @SenatorCarper to assist eugenics victims receiving compensation paymentshttp://1.usa.gov/1RjBTaL ,2015-12-01 16:30:49,2,8,671728166277394432
Are you participating in #GivingTuesday? Every day is a great day to give back and help others.pic.twitter.com/4RFS783d2y,2015-12-01 15:00:41,1,1,671705482084659200
I will vote to #RepealObamacare and prevent $1 trillion in new taxes over the next decade. #healthcare #Obamacarehttps://twitter.com/kelsey_snell/status/671489588242837504 …,2015-12-01 14:45:50,11,5,671701746469720064
"Happy Birthday, @SenatorBurr! #NorthCarolinapic.twitter.com/otyUc9hN7q",2015-11-30 20:56:46,18,9,671432704479633408
"This week, I will vote to #RepealObamacare and prevent $1 trillion in new taxes over the next decade.",2015-11-30 20:51:38,83,43,671431413649047556
Five groups that could determine the fate of TPP http://thehill.com/policy/finance/261333-five-groups-that-hold-the-fate-of-tpp#.VlyVRztRb80.twitter … via @thehill @VickoftheHill,2015-11-30 18:34:20,0,1,671396861790576640
Obama signs bill requiring Army input on 440th decision http://www.fayobserver.com/military/obama-signs-bill-requiring-army-input-on-th-decision/article_4c1dc347-a40f-5b03-aa3a-b27b3fc9cbd2.html#.Vlx6-GQEeWw.twitter … via @fayobserver,2015-11-30 17:22:57,0,2,671378899784331264
Let's Go @Panthers! #KeepPounding #CARvsDAL,2015-11-26 21:31:06,7,7,669991796097708032
Happy Thanksgiving from our family to yours.pic.twitter.com/l7PVpliHId,2015-11-26 19:07:28,24,13,669955647325081600
Tillis questions #AirForce gag order allegations at #FortBragg http://bit.ly/21fIKX1  via @fayobserver,2015-11-25 14:31:20,2,3,669523767668940806
My thoughts and prayers are with the families of the four crew members. #FortHoodhttps://twitter.com/USATODAY/status/669154143362269185 …,2015-11-24 14:40:17,5,9,669163634162036736
GOP demands answers on Guantánamo transfer http://bit.ly/1Oe1lO9  via @thehill @Rebecca_H_K,2015-11-24 14:32:15,1,3,669161614134919168
Spending the evening on Lake Norman with Ike & Libby. #NorthCarolina #mansbestfriendpic.twitter.com/4RB8OzyMCw,2015-11-23 22:49:54,14,4,668924463019331584
Senators press Pentagon on controversial Gitmo transfer http://washex.am/1Nnj4Uh  via @DCExaminer,2015-11-23 14:46:16,0,1,668802751615401984
"Great win for the home team, 10-0! #KeepPoundingpic.twitter.com/VxiI1DmyA5",2015-11-22 21:17:44,39,11,668538878622605312
Thankful to join my #DC team for a #Thanksgiving potluck.pic.twitter.com/gSwh51Dp0Y,2015-11-20 21:29:14,7,2,667816997997031424
Tillis and @SenatorBurr Question Obama Administration On Release Of GITMO Prisoner: http://1.usa.gov/1OjoqNl pic.twitter.com/lXozV6QriH,2015-11-20 19:48:56,10,8,667791758974164992
It is unacceptable parents wait years to bring home their adopted child: http://bit.ly/1Xc9keN . #adoptionmonthpic.twitter.com/G6DXpSVYvt,2015-11-19 21:24:34,13,24,667453434703032320
"Yesterday, bipartisan bills I co-sponsored were the focus of the Veterans’ Affairs hearing http://1.usa.gov/1HZjnCx pic.twitter.com/68X7dkxwBI",2015-11-19 15:26:23,2,6,667363296962572288
"@ryanong Thank you, Ryan. I'm hopeful that Congress and the Administration can communicate with the DRC and help families like yours.",2015-11-18 23:00:37,5,6,667115218716237824
"Obama Admin using TPP as laboratory for partisan politics, discriminating against specific agricultural commodities:http://1.usa.gov/1PrG2Kf ",2015-11-18 22:35:56,1,2,667109009862860800
The Veterans Health Care Staffing Improvement Act will improve the quality and delivery of care for #veterans:https://www.youtube.com/watch?v=MWW_AjqzDXw …,2015-11-18 19:36:34,5,3,667063868569608192
I voted against @POTUS excessive carbon mandates. We must rein in regulatory overreach from @EPA. #CleanPowerPlanpic.twitter.com/8zadH0NuF6,2015-11-18 16:13:42,7,5,667012816063328256
Signed the condolence book in memory of the victims of the terrorist attacks in #Paris. #Prayers4Parispic.twitter.com/Pyd7HGLV5t,2015-11-17 19:04:55,13,11,666693516622438401
Governor McCrory asks feds to stop sending #SyrianRefugees to #NorthCarolina via @WRALhttp://fw.to/s4B5M7G ,2015-11-17 15:00:24,12,9,666631982453944321
Happy Birthday Senators @jiminhofe and @SenToomey!,2015-11-17 14:17:00,2,3,666621058062118912
The safety of the American people is my top priority.pic.twitter.com/uaFbnauzy5,2015-11-16 18:56:04,28,22,666328900260241410
I signed a letter demanding POTUS release additional info on detainees transferred out of Gitmo via @thehillhttp://bit.ly/1LeiYqt ,2015-11-16 16:53:14,9,14,666297987933577216
9-0!!!https://twitter.com/Panthers/status/665998533653303296 …,2015-11-15 21:03:44,8,4,665998640603885568
Praying for the people of Paris. America stands with France.,2015-11-13 23:00:18,20,12,665303201504096258
"Happy Birthday to my freshman twin, @SenDanSullivan! RT to wish him a happy birthday. #twinningpic.twitter.com/Q1KULkzGiT",2015-11-13 17:30:16,5,11,665220147188121601
I will vote against the TPP and actively work to help defeat its ratification in the Senate. http://1.usa.gov/1PrG2Kf https://twitter.com/FortuneMagazine/status/665128604070752256 …,2015-11-13 16:40:31,13,11,665207626708463616
"I honored Dorothy ""Dot"" Helms on the Senate floor. Watch the full speech: http://bit.ly/1Sp1FZh  #NorthCarolinapic.twitter.com/HeFFWXi6Pd",2015-11-13 14:33:46,9,9,665175727747264512
@PFFORG We appreciate Fred stopping by to meet with my office.,2015-11-12 20:21:37,1,1,664900880953659392
"Thank you for your service and courage, Captain Florent Groberg. #MedalOfHonor #USArmyhttps://twitter.com/FoxNews/status/664843664129028096 …",2015-11-12 19:22:59,13,12,664886124930867200
My Op-Ed in @StarNewsOnline: VA must fulfill its missionhttp://bit.ly/1O5ve17 ,2015-11-12 16:30:20,1,2,664842673841287168
"If you need help with a federal agency, contact my office: http://www.tillis.senate.gov/public/index.cfm/casework … #NorthCarolina",2015-11-12 14:46:45,3,2,664816605646495744
Pleased to see the White House support bipartisan #veterans bills I introduced with @SenBlumenthal http://bit.ly/1WMyUw5  via @fayobserver,2015-11-11 20:30:22,3,3,664540694619394048
Let us not only thank our veterans but recommit ourselves to providing them w/ the care they've earned. http://bit.ly/1WRxYl1  @fayobserver,2015-11-11 19:30:25,6,2,664525606663532544
"Attended the 62nd Annual #VeteransDay National Ceremony with my wife Susan, @SenatorCollins & @SenDanSullivan.pic.twitter.com/Myef4bwy1K",2015-11-11 18:35:02,12,4,664511669448650752
Thank you to all of our nation's veterans. #VeteransDaypic.twitter.com/n30NJZvssb,2015-11-11 15:00:32,8,8,664457688462458880
Thank a veteran today for their service and sacrifice on behalf of our country. #VeteransDayhttps://youtu.be/9CbuSLNrFrs ,2015-11-11 13:00:24,8,6,664427455621369856
The Wounded Warrior Employment Improvement Act provides funding and resources to support our military and veterans http://1.usa.gov/1QsRl3Q .,2015-11-10 21:30:17,5,6,664193382239997952
My Op-Ed in the Citizen-Times: We share a pride in our #military – and a duty http://avlne.ws/1iOoucG  via @asheville,2015-11-10 20:30:11,4,4,664178261195292672
"""Tomorrow may be #VeteransDay, but I believe every day is Veterans Day.""pic.twitter.com/fBGYjx3KiZ",2015-11-10 18:38:35,4,6,664150174105780228
The Veterans Health Care Staffing Improvement Act offers common-sense solutions to improve VA care for #veterans.pic.twitter.com/ymivZow3Fi,2015-11-10 17:00:50,8,12,664125574256984065
Press conf with @SenJeffMerkley @SenatorRounds @MarkWarner & @ReserveOfficer Exec Dir on The Veterans Health Care Staffing Improvement Act.,2015-11-10 16:40:32,1,3,664120468014825472
Tillis meets with #veterans about #VA medical center concerns https://shar.es/15xNiT  via @wsoctv @JoeBrunoWSOC9,2015-11-10 15:30:16,3,6,664102782052380672
"Happy 240th Birthday, @USMC! #usmc #marines #marinesbdaypic.twitter.com/4kADlYqQBQ",2015-11-10 13:34:59,13,13,664073772350205952
Check out these amazing photos by North Carolinian @cathyanderson27 via @capitalweather http://wapo.st/1RIYJXs  #NorthCarolina,2015-11-10 00:00:20,4,4,663868759413657600
"Susan and I are keeping the Helms family in our prayers. NC will miss Dot Helms, who lived an incredible life.http://www.newsobserver.com/news/local/counties/wake-county/article43612656.html …",2015-11-07 23:32:20,5,6,663136934932295680
Must-watch: @SamsPressShop recounts his 7 years as a POW: https://www.youtube.com/watch?v=-KnVWy9pOTU … #VeteransDay,2015-11-07 20:27:04,0,3,663090309362905088
"With President Obama's rejection of #KeystoneXL, he shows affordable energy and job creation are not his top priorities",2015-11-06 17:34:41,10,12,662684540163485697
Speaking now on the Senate floor against #WOTUS: http://www.c-span.org/video/?400292-1/us-senate-debate-water-quality&live … #DitchTheRule,2015-11-04 19:59:15,6,5,661996145737076740
"The many people who knew Howard Coble will never forget his character & kindness, highlighted by a legendary sense of humor.",2015-11-04 14:29:07,14,13,661913068390080512
Howard Coble was the embodiment of a public servant who put the needs of constituents before all else.,2015-11-04 14:20:13,10,12,661910827117756416
Susan and I are heartbroken to hear of Howard Coble’s passing.,2015-11-04 14:19:30,4,7,661910647395880960
A must-watch: @SenSasse's excellent maiden Senate floor speech. http://www.c-span.org/video/?c4558256/senator-ben-sasse-maiden-senate-floor-speech …,2015-11-03 22:17:06,17,14,661668449752518656
Recently introduced the Save our Small and Seasonal Businesses Act w/ @SenatorBarb @MarkWarner @BillCassidyhttp://www.tillis.senate.gov/public/index.cfm/press-releases?id=2FDF2295-E28C-4A7C-B0E1-CE55CC084DB3 …,2015-11-03 18:53:04,3,3,661617103015796736
ObamaCare premiums in NC could increase by as much as 50% next year:http://www.newsobserver.com/news/business/article41993349.html …,2015-11-02 14:24:10,6,14,661187045365260288
.@AuroraFossilMus Congratulations on your @BestTimeEver shoutout! Keep up the good work #Megalodon #NC,2015-10-29 20:13:42,1,0,659825458134040576
New squadron at Seymour Johnson reaffirms fact that America’s military doesn't move unless NC goes first. http://www.tillis.senate.gov/public/index.cfm/press-releases?id=6C0E9B0E-AB89-4E30-A35A-A6AE4B263B77 … #ncpol,2015-10-29 17:43:27,8,9,659787643992023041
"W/25 Senators, I sent a letter to the Dept of Labor raising concerns over the H-2B certification process #SaveH2Bhttp://www.tillis.senate.gov/public/index.cfm/press-releases?id=E7C173DC-D145-4B2F-89DE-A0DC6CB1DFBE …",2015-10-28 20:10:37,7,4,659462292178866176
I am so grateful to have the opportunity to wake up every day and represent this beautiful state. #NC #blessedhttps://www.youtube.com/watch?v=NpkJ1nevQ6w …,2015-10-28 14:42:24,7,6,659379694933049344
600 new high-paying jobs are coming to North Carolina. Thanks @PatMcCroryNC and @Fidelity #ncpolhttp://www.bizjournals.com/triangle/blog/techflash/2015/10/fidelity-to-add-600-jobs-in-durham.html?ana=e_trig_bn_breakingnews&u=Vu54Ri6hxmkpL7FQb8Ve7g0253128a&t=1445976462 …,2015-10-27 21:08:09,7,10,659114383000207360
Today I questioned Defense Sec. Ash Carter on the President's reckless veto of the bipartisan #NDAA.pic.twitter.com/zHyJ5c4YyH,2015-10-27 19:02:16,8,6,659082706102439936
ICYMI: @WSJ editorial on @SenatorBurr & @SenFeinstein's bipartisan cybersecurity bill:http://www.wsj.com/articles/a-cyber-defense-bill-at-last-1445898755 …,2015-10-27 14:19:51,4,3,659011631809187841
Margaret Spellings has proven she possesses the level of leadership required to tackle the challenges that face higher education today.,2015-10-23 17:48:16,5,5,657614531452141568
Margaret Spellings has the experience needed to lead the UNC System into the next era of distinction.,2015-10-23 17:47:15,0,2,657614274005762049
Joint statement from @SenatorBurr and me on the President's incomprehensible veto of the #NDAA: http://www.tillis.senate.gov/public/index.cfm/press-releases?id=62160EA9-EB63-4C40-8BBA-E073682D27E6 … #ncpol,2015-10-22 21:04:53,2,5,657301620582162434
President Obama's veto of the bipartisan #NDAA threatens the military readiness and security of our nation.,2015-10-22 20:19:20,6,5,657290158597885952
We must #SupportOurTroops. It's time for President Obama to sign the NDAA into law. #DontVetoNDAApic.twitter.com/ZnJ7cbVgHE,2015-10-22 14:40:05,16,16,657204782961045504
.@SenCoryGardner You think your haircut was awesome?? #BackToTheFuturepic.twitter.com/H8G2vTKhgh,2015-10-21 15:19:37,10,9,656852344165003264
The #NDAA includes a provision to help save the 440th Airlift Wing at Ft. Bragg: http://www.fayobserver.com/opinion/editorials/thom-tillis-and-richard-burr-defense-bill-critical-to-maintaining/article_e2bffa7b-e0c5-59fc-8ee7-3a2f11a024ce.html …pic.twitter.com/D6kooqq0qn,2015-10-21 13:19:54,6,4,656822216118677505
President Obama should drop his veto threat & sign the bipartisan #NDAA into law to support our troops and wounded warriors.,2015-10-21 13:13:37,12,9,656820635709083648
The #StopSanctuaryCities Act includes the common-sense ‘Kate’s Law’ that would crackdown on violent criminals here illegally.,2015-10-20 19:42:04,6,6,656556006630010880
I’m disappointed that my colleagues blocked the #StopSanctuaryCities Act from coming to the floor for a full debate  & vote.,2015-10-20 19:39:05,4,5,656555254704566272
A vast majority of the American people oppose sanctuary cities that harbor dangerous criminals here illegally. #StopSanctuaryCities,2015-10-20 19:34:49,8,7,656554179645669376
"Today, I'll be voting in support of legislation that helps crack-down on sanctuary cities.",2015-10-20 17:30:17,8,6,656522842704510976
"Tomorrow, I will be voting in support of the Stop Sanctuary Policies and Protect Americans Act, which includes Kate's Law.",2015-10-19 22:10:06,21,11,656230869397442560
Thank you @PatMcCroryNC for signing autism insurance bill into law. http://www.charlotteobserver.com/news/politics-government/article39268986.html … #ncgov #ncga,2015-10-19 13:26:00,10,17,656098977390026752
Huge win for the @Panthers! 5-0 for the 1st time since ’03-'04 NFC championship season! #KeepPounding,2015-10-18 23:20:50,33,19,655886282426478592
Iran continues to violate the terms of the bad #IranDeal before it even goes into effect.http://www.foxnews.com/world/2015/10/14/top-iranian-council-approves-nuclear-deal/ …,2015-10-14 20:53:21,2,9,654399614922174464
"Happy 240th birthday, @USNavy. We owe a debt of gratitude to the brave men and women who have served.",2015-10-13 22:25:18,12,6,654060368017367040
Many decades ago @SusanWhitmire hired me for a records management job. Had the chance to catch-up w/ her last week!pic.twitter.com/JN9yT4mWfi,2015-10-13 19:13:48,10,4,654012178274611200
Only a week old and he’s already rooting for the right team!https://twitter.com/RepRichHudson/status/652230894250553344 …,2015-10-09 01:32:57,8,6,652295652546859008
Pleased to support @SenatorWicker's EUREKA Act to help combat Alzheimer's disease.http://www.tillis.senate.gov/public/index.cfm/press-releases?ID=5928FBE7-6BF3-4CED-AE02-0C9C9367D2CF …,2015-10-08 19:40:46,4,3,652207022797144064
#NobelPrize reaffirms NC's status as a home to amazing research institutions & scientists literally changing the world for the better.,2015-10-07 18:12:06,11,12,651822321519296513
Their ground-breaking research in discovering how cells repair DNA could be a game-changer in the treatment of cancer. #NobelPrize,2015-10-07 18:11:08,6,8,651822078438432769
Congratulations to Dr. Paul Modrich (of @DukeU) and Dr. Aziz Sancar (of @UNC) for winning the #NobelPrize in Chemistry!,2015-10-07 18:10:07,62,42,651821823751880704
Proud to be working across the aisle w/ @SenSherrodBrown to increase educational opportunities for our veterans.http://blogs.rollcall.com/wgdb/senators-form-unlikely-alliance-on-veterans-education/?dcz …,2015-10-07 17:51:07,0,4,651817042576809984
The 440th Airlift Wing is imperative to our military readiness — it is the nation’s leading global response unit. http://www.fayobserver.com/opinion/editorials/thom-tillis-and-richard-burr-defense-bill-critical-to-maintaining/article_e2bffa7b-e0c5-59fc-8ee7-3a2f11a024ce.html …,2015-10-07 15:04:32,6,6,651775120546136064
I'm very pleased to welcome @RepBrianBrown to my staff as my Eastern Regional Representative. #ncpol #ncsen #ncga,2015-10-06 20:22:22,6,6,651492716686262272
Op-ed I wrote w/ @Senatorburr  in the @fayobserver: #NDAA critical to maintaining global response force. http://www.fayobserver.com/opinion/editorials/thom-tillis-and-richard-burr-defense-bill-critical-to-maintaining/article_e2bffa7b-e0c5-59fc-8ee7-3a2f11a024ce.html …,2015-10-06 19:04:43,2,2,651473176753479680
The White House’s #TPP spin needs a #TPP reality check: http://blogs.rollcall.com/wgdb/tpp-announcement-highlights-tobacco-problem/?dcz= …https://twitter.com/eilperin/status/651090794619772929 …,2015-10-06 00:11:52,6,8,651188082864054272
"I will not only vote against the #TPP, but actively work to help defeat its ratification in the Senate.",2015-10-05 22:20:03,11,8,651159946143232000
The Obama admin has decided to use #TPP as a laboratory for partisan politics by discriminating against specific ag commodities.,2015-10-05 22:16:35,3,5,651159072205463552
"With #TPP, the Obama admin has broken the long-standing precedent of not picking winners and losers in trade deals.",2015-10-05 22:16:00,3,3,651158926956756992
"Emergency weather and flooding information, including contacts for power outages, is here:http://www.tillis.senate.gov/public/index.cfm/press-releases?id=8249769E-15AB-4745-A93F-E9379162DA81 …",2015-10-05 00:01:41,0,6,650823133696421888
Download the #ReadyNC mobile app to access real-time weather and flooding information. http://readync.org/EN/Index.html ,2015-10-03 16:12:04,1,2,650342563207999488
Some important storm precautionary tips from @GovOfficeNC: http://www.tillis.senate.gov/public/index.cfm/press-releases?id=8249769E-15AB-4745-A93F-E9379162DA81 …,2015-10-03 14:35:06,1,2,650318160185298948
"North Carolina storm emergency information and key contacts: 
http://www.tillis.senate.gov/public/index.cfm/press-releases?id=8249769E-15AB-4745-A93F-E9379162DA81 …",2015-10-03 13:25:33,2,7,650300659313446913
"With the potential for power outages and major flooding, here is a list of emergency contacts: http://www.tillis.senate.gov/public/index.cfm/press-releases?id=8249769E-15AB-4745-A93F-E9379162DA81 …",2015-10-02 17:53:14,3,0,650005633756983296
My staff is ready to help you w/ any issues connecting with Federal Disaster Assistance or FEMA this weekend: http://www.tillis.senate.gov/public/index.cfm/press-releases?ID=8249769E-15AB-4745-A93F-E9379162DA81 …,2015-10-02 16:22:44,2,4,649982859474792448
Defense bill is critical to America's Global Response Force. An op-ed by @SenatorBurr and I in @RollCall:http://blogs.rollcall.com/beltway-insiders/defense-bill-critical-to-maintaining-americas-global-response-force/?dcz= …,2015-10-02 13:25:39,3,6,649938296857038849
.@SenatorBurr and I oppose the Obama administration's tobacco carve-out in #TPP: http://thehill.com/policy/finance/255655-gop-senators-concerned-about-tobacco-treatment-in-pacific-trade-deal … #ncpol,2015-10-01 18:45:44,1,3,649656460721455104
Speaking now on the Obama administration's #tobaccocarveout. Watch here: http://www.c-span.org/video/?328483-1/us-senate-legislative-business&live … #ncpol,2015-10-01 16:53:02,1,0,649628095499141120
Editorial from the @fayobserver: Defense bill raises hopes that 440th can be saved. http://www.fayobserver.com/opinion/editorials/our-view-defense-bill-raises-hopes-that-th-can-be/article_5dd3389d-c14f-5057-a14b-ea9b1a4cc2d5.html … #ncpol,2015-10-01 13:07:02,4,6,649571223412846592
.@fayobserver: Protection for Fort Bragg's 440th Airlift Wing included in defense spending bill.  http://www.fayobserver.com/military/protection-for-fort-bragg-s-th-airlift-wing-included-in/article_a1727968-8e80-58b1-8c0b-b909f1114021.html … #ncpol,2015-09-30 20:37:01,3,2,649322078169112576
I'm chairing the Senate Judiciary Committee nominations hearing today. Watch here:http://www.judiciary.senate.gov/meetings/nominations-09-30-15 …,2015-09-30 15:17:21,3,1,649241630936027138
The NDAA includes my amendment to help protect the 440th Airlift Wing at Ft. Bragg: http://www.tillis.senate.gov/public/index.cfm/press-releases?id=2C37B281-D4F0-446C-BA98-F85CB42F321D … #ncpol,2015-09-29 20:39:33,6,2,648960326495522816
Honored to present James Michael Hess - former Marine & Vietnam War vet - with his Purple Heart today.pic.twitter.com/8rylBOa5T5,2015-09-28 20:36:30,12,9,648597172452229120
